user_url,user_name,user_city,user_rating,user_review
/user_details?userid=2qKaHzMcM2s8GtoA-ovUhQ,Hoots A.,"Vancouver, Canada",4 star rating,"On a steamy summer night in the middle of a heat wave I decided to get out of the house and try Nonya. I haven't had many chances to try Indonesian, so I was very excited when I stumbled across it a few weeks ago.At the recommendation of the server, I waited a few minutes for an outdoor table (it was pretty warm inside). While I waited at the bar she brought me some water and salted peanuts to snack on. Once seated I got a homemade mint lemon/limeade (delicious, but a little pricier than expected at $4), more peanuts, and shrimp chips. I ordered the Indonesian-style crispy duck leg ($18), which came with rice and a few scoops of sides (okra, curried tofu, and some type of shredded pickled vegetable). The duck was tender and moist with very crispy skin (deep-fried?). Each of the sides were distinctly flavoured, although the yellow curry was a bit mild for my taste. The portions weren't huge, so I think I would get an appetiser next time. It was all very tasty! I can't wait to go back with a few people so I can try out the rest of their dishes.One thing to note, one of the previous reviews mentioned wine. I was told they couldn't serve alcohol, but maybe this only applies to the patio?"
/user_details?userid=T-4jMCwgOr2Gi22tHPTJyQ,Wade V.,"Montreal, Canada",3 star rating,Very nice place serving authentic tasting Indonesian food.  We visited this restaurant following a groupon purchase.  The service was unrushed so if your looking for fast food then go to McDonalds : )  My advice would be to bring your appetite and have a open mind about trying new things and give this place a try.
/user_details?userid=zGGsjN136oUMA92_LjL8_g,Erica L.,"Toronto, Canada",4 star rating,"Thank the LORD, there exists decent (even, dare I say, delectable) thai curry in Montreal! I know, I know, it's an Indonesian restaurant, but I won't lie and say that I know the difference between the two cuisines. To me, the flavors were quite similar, although I have never had thai food presented the way it's done at Nonya. I'd love to be enlightened-- some sort of explanation about Indonesian cooking on the menu would be much appreciated. But I'm a nerd. All I do know is that the yellow curry soup was delicious, (albeit slightly mild, but hey, it is still Montreal) and the Sumatran stewed beef was so tender it  melted in my mouth-- peanut and curry flavors bursting with every bite. My man's duck confit came right off the bone- no need for a knife-- and had perfectly crispy skin. The mains were presented alongside rice in a beautiful banana-leaf basket, really delicious roasted eggplant, a big prawn cracker, some sort of cold slaw that was refreshing, and a craving-inducing sauce (on the side!) that reminded me of hoisin but was so much better. My only criticism has to be that the table d'hote ($27) includes a dessert, but when you get the dessert menu you are informed that everything but the rice pudding will run you an extra $3. Being non-rice-pudding-fans, we were fine to pay for an order of ice cream and creme brulee, but none too pleased when we were presented with 1 scoop of store-bought ice-cream and probably 3 tablespoons of creme brulee- though it was delicious. Felt a little scammy to us, but I guess that's what you get when you order table d'hote. We resolved to order off the a la carte menu next time. And we will be back again. I'm sick of going back to Ottawa every time I get a craving for coconut milk and curry."
/user_details?userid=-Aw9kRoXmFptUMN2XkJY9w,eric g.,"Toronto, Canada",4 star rating,"What a fantastic meal! From the bowl of garlicky peanuts served when we sat down, to the black rice pudding at the end, everything was fabulous - the gado gado salad; the amazing cornish hen in red curry; the spicy beef curry, every element of this surprisingly elaborate dish laid out separately - beautiful plating!The table d'hôte is reasonably priced, and there is a good selection of wines by the glass or carafe.The only thing that knocks Nonya down from five stars to four is the really, really long wait between courses. If we'd known, we would have ordered a bottle instead of a half-litre."
/user_details?userid=6PKxQ07QMnzqzuoi8pEWbg,N S.,"Brossard, Canada",5 star rating,"If you've never had Indonesian food before, you are in for a serious treat as this a very refined Indonesian. I had some sort of braised coconut beef curry and it was out of this world. Paired nicely with the shrimp chips, pickled vegetables and the sriracha ""jam"". Portion size was perfect."
/user_details?userid=0rSY77NhhBi2ZCoJhwDMqw,Mo Riza ..,"New York, NY",3 star rating,"The food we had was good, decent Indonesian with modern touch. If only we didn't have to wait for ages for our food. The second time there it was much better, faster service that makes the food even more tastier. I'll go back for the thirt time the next time I'm in Montreal."
/user_details?userid=ZHfoPpu_mtFTqfr_8nzOew,François P.,"Montreal, Canada",4 star rating,"4 stars for this authentic and delicious food!But at those prices I would like to have something on my plate, and not wait 1 full hour to get my meal!"
/user_details?userid=gqnhxCtGgnOhVeqAzT5ywQ,Christian H.,"San Francisco, CA",5 star rating,"This was one of my favorite restaurants that we visited on our trip to Montreal. The food was wonderful and the service was amazing. I thought the menu was a little confusing, but one of the co-owners herself came to our table and explained how to order. The food took a little time to come out, but the wait was totally worth it. The food was amazing. If this is what authentic Indonesian food tastes like, then I love Indonesian food. The presentation of the food was remarkable. I enjoyed the flower shaped red pepper very much. Everything about the meal was worth every bit of money, especially the dessert. Excellent!!! At the end of the meal they gave us a coffee flavored candy called a Kopiko. Yum!!! This is a must go restaurant."
