user_url,user_name,user_city,user_rating,user_review
/user_details?userid=5G1LLdZNxwswR1TjMfiMig,Iatemontreal Q.,"Montreal, Canada",5 star rating,"Sometimes in life you find something as close to perfection as you could imagine. Our visit to Jatoba was beyond our wildest imaginations and served up a perfect meal. A delicious menu of steak and seafood influenced by an Asian flare, Chef Olivier Vigneault presents patrons with a modern take on both traditional and not so traditional dishes.Located on Place Phillips, Jatoba borders both the downtown shopping district and the opening to the old port of Montreal. The establishment has a very modern feel, with open spaces and a high ceilings. A good sized patio is available for summer dining, but for us it was decorated for the holiday season. The staff was attentive and accommodating and made sure all of our needs were attended to. From the coat check, to the waitstaff to Chef Olivier Vigneault himself, everyone at Jatoba make sure all guests have the best dining experience in Montreal.It was decided we would dine at the bar, this gave us the opportunity to observe the restaurant from afar and absorb the ambiance in full. Since we were already seated at the bar, cocktails were requited. We started with a five spice old fashioned and a maracuya martini, both endorsed by our attentive host for the evening Shima.  Drinks in hand it was time to dive into the menu. With so many choices and decisions, we wanted to try everything. Graciously Shima took the reigns and chose the dishes for us. To enhance our refreshments we sampled the spiced brussels sprout chips, crispy and tasty it was a nice start to our meal.Once we had our appetites awakened, we eagerly awaited the rest of our meal. Glass of wine in hand, having finished the cocktails, before us was placed a dish of kampachi sashimi. For the first time ever, we have no words to describe a  dish, simply put this is something you have to try as words cannot do it justice.Unsure how Jatoba would top this offering we waited anxiously, we were not disappointed. The 1855 beef tataki seared in sesame oil, was perfectly complemented with mini green beans, puffed black quinoa, truffle peaches and a sonomono sauce. Between courses we enjoyed a hearty bowl of edamame sprinkled with yuzu powder, nanami togarashi and fleur de sel. As we all know the best accompaniment to any Asian meal is edamame.The dumplings arrived as two separate dishes. the spiced oxtail was served after being braised for 12 hours, and attended by granny-smith apple, caramelized onions, jalapeno and micro cilantro, with yuzu beef stock. We wholeheartedly agree that this was the best oxtail we have ever tasted. The more traditional Gyoza dumplings, stuffed with pork, shrimp,Chinese chives, served with a side of Chinese vinegar and sambal oelek soya sauce for dipping, were almost too beautiful to eat. The dumplings were quickly followed by the oysters au gratin and rabbit congee. Being fans of raw bars in the past we tended to avoid cooked oysters, but this will no longer be the case. These oysters were perfectly prepared and thoroughly enjoyed. The rabbit was served atop a crispy youtiao and topped with puffed rice, green onions, uzura and micro cilantro. We think it would be safe to say the rabbit never tasted so good. Our final dinner dish was a combination of three separate plates but went together as if they were destined to do so, Jatoba black cod, king oyster mushrooms and fried rice with duck confit. The cod served over sauteed vegetables and celery root puree melted in our mouths as each bite. The fried rice with duck confit was ideally seasoned and was a wonderful twist on the traditional chicken fried rice. Finally the king oyster mushrooms in a sweet miso gratin, this was beyond any doubt our favorite dish of the night. We guess Chef Vigneault saved the best for last. No meal can ever be complete without a sampling of afters. We were so pleased Shima was designing our menu, because there was no way we were going to be able to decide on one dessert. What a delight to be served the chocolate bomb with passion fruit sorbet on the side. The bomb is served as a sphere and covered with a generous portion of hot chocolate. As the bomb melts away it reveals orange yogurt cake with white chocolate mousse. Just for the record, yes it tastes as good as it sounds.We would like to thank the entire Jatoba team for sharing their delightful menu with us. It is a remarkable establishment serving Montreal a most memorable experience."
/user_details?userid=9snvoghcheMC70P0PcldTw,S B.,"Montreal, Canada",4 star rating,"The beef was very good, but the portion was quite small and not very filling. The matcha flavour of the crêpes was too strong."
/user_details?userid=4tyCTmpMaQA9bpr0VEkuRQ,Eric S.,"Timberlea, Fort McMurray, Canada",1 star rating,"We left before our mains arrived. That should be self explanatory but I will elaborate. Not only was the service practically non existent, the food was terrible. Presentation wise the food looked incredible, unfortunately that was its only redeeming quality; it was practically flavorless. I'm glad we pulled the plug before being disappointed further. We were given a table and once we settled in we were moved. Then we waited for quite a while before an absolutely unenthused server asked us ""sup?"". Then the waiting game began anew, once we finally got a drink the waiting started again to place an order. Had the quality of the food redeemed the distain we felt as customers it might have been ok. We were in town for our 20th anniversary and felt completely unimportant/unwanted as customers. We felt like we were putting them out by being there, and we had booked weeks in advance on the advice of a friend who lived there. My advise is to avoid this place at all cost."
/user_details?userid=7hElQBiE_x2HZk6yJMVgNg,Lu Z.,"Montreal, Canada",3 star rating,"Desapointing experiance, if your going to try to compete in the iskaya business your ramen has to be good so does your sushi and none of the 2 were good, also it was pricy and small portions we were still hungry after 3 rolls, a ramen et fried chicken."
/user_details?userid=tohzRxSLcBPco8xUT6lOjg,Caroline D.,"Montreal, Canada",5 star rating,Delicious ! Beautiful terrace and ambiance.Need to try Aloha Jatoba drink & beef Tataki!
/user_details?userid=D3N6XvOxMrvaE2pjvjAYFA,Paul L.,"Montreal, Canada",5 star rating,"Jatoba is a tremendous addition to the downtown dining scene, which is dire need of variety beyond the chain restaurants. Very fresh and tasty plates, very good price-to-quality ratio - the lunch menu is well-worth it for those not looking to splash out too much. I've enjoyed the pan-seared tuna, salmon sashimi and beef teriyaki, all done to perfection. The dumplings could be among the best in Montreal. Chef Olivier Vigneault is raising the bar.The desserts - by pastry chef Kimberly Estrada of Some Kind of Wonderful - are unique: From the Suki blondie bar to the Japanese cotton cheesecake, you can't go wrong! I just wish they had kept the mango tart on the menu, it was incredible. My only criticism is that lunch service could be a little faster. But the decor and stylish remodelling of the interior makes it a location worth hanging out in..."
/user_details?userid=wSNiS3Lj5LJ2M8vw3PLetg,Matt R.,"Waterloo, Canada",4 star rating,We almost didn't go to Jatoba because we'd read some concerning reviews about the service. We took a chance and went anyways and boy am I happy we did. The service was great. Kudos to the owners for reading the Yelp reviews and taking action!  The food was awesome. Great Asian fusion menu done family style. And the decor is great too.
/user_details?userid=f5YXeYfggp0ydyDapaXDMA,Sandra K.,"Los Angeles, CA",5 star rating,"Visiting from Los Angeles, and this restaurant was fabulous and by far the best restaurant I tried in Montreal, yet they were all great. Everything from this restaurant was great. The entrance the vibe and the style of it. The food was marvelous and the service was great, Matt was our service and recommended amazing dishes especially the caramel dessert."
/user_details?userid=YcinXaZadMpwkRpgNyzzpw,Stella H.,"Montreal, Canada",2 star rating,"I usually do not leave comments but I am so hungry after dining here after $ 159 bill for two person, but I do not feel like ordering more because the bill will go higher. They do have a good environment tho. Just do not go there if you are hungry. Enough said, running home for instant noodle=D"
/user_details?userid=SWlWNSKQO1q9WOeT78japA,Michael S.,"Saddle River, NJ",5 star rating,"First day in Montreal and we went here on recommendation of concierge. Every dish was knockout. Our waitress was wonderful and she recommended excellent wines. We ordered the ultra dumplings, shrimp teriyaki, a maki roll, a side of Chinese eggplant, and veal. Each dish was phenomenal - we capped it off with a lemon dessert that was light and fresh and perfect way to end. The flavors were excellent, wonderful ambience, and lovely service. Highly recommended!"
/user_details?userid=ezdSzVJfp109N9Le39nqcw,Joseph G.,"Montreal, Canada",5 star rating,"I still can't believe where I was yesterday night. I think I was in Montreal, I think so... The second after the portal sucked me out of extremely cold mtl streets and into this L.A like wet dream of a resto, I froze. I excitedly began talking over the hostess who barely had time to finish greeting me: ""Where the hell am I? Are you guys joking? This is possibly the most important resto in MTL!'' and I hadn't even been close to knowing the menu or eating the food.When I ask myself what kind of cuisine I love the most, Japanese and South American always come up and jab at my soft spot... Jatoba confirms this.So how was the food you ask? On very few occasions, I like to use the words: Existentially Puzzling"
/user_details?userid=qFRGa_L96jOuLL4lqwxEqA,K Z.,"Kirkland, Canada",5 star rating,"Excellent Asian cuisine: Had the black cod with vegetables and rice dish, was very flavourful and cooked right. Definitely worth going."
/user_details?userid=dB4ZVcM1x9D_QrniH0wAZQ,Digna B.,"Playa del Rey, Los Angeles, CA",5 star rating,Modern asian fusion Cuisine that is so friendly to our taste buds. So far this is our number one on the list of restaurants in our 11 nights here in Montreal. Super delicate yellow tail blends into the exotic flavor of clear soya. Cod was so delicious that I can't stop saying hmmmm. Will definitely recommend this place to friends.
/user_details?userid=-dpNp1PpdvK7EbHfiN95Cg,Emma P.,"Montreal, Canada",4 star rating,"Very nice japanese restaurant downtown Montreal. The space is gorgeous and they have an outdoor part as well. Service was excellent. I came here with some work colleagues. The atmosphere is kind of fancy, not too casual. We got the brussel sprouts chips and edamame as a starter, both delicious. I also ordered the roasted bass with zucchini and it was perfectly cooked and flavourful. Chocolate cake for dessert, which tasted really good as well. Price per person can come to 40-70$."
/user_details?userid=8_vDBFYfEIxFxJ2kfpk2Tg,Jawdat S.,"Montreal, Canada",5 star rating,"Fancy Asian fusion spot. Pricey but definitely worth it. Menu is special, diverse and food is of the highest quality. Good place for a date, a dinner with friends or even business lunch."
/user_details?userid=wE_C7VS0mK7FNM8-JpQfSg,Amy K.,"Boston, MA",4 star rating,"This was a great restaurant for diner. Enjoyed every single dish including the Jatoba salad, salmon sashimi, steamed shrimp dumplings, and black cod. Perfect serving sizes and service."
/user_details?userid=MMcYFUCiPrr5CSjMvRNNKw,Asim Z.,"Miami Beach, FL",1 star rating,Terrible terrible terrible food. Food took 45 min after our appetizers . Came cold and over cooked and over salted . And by the end of it they still charged me for some of the orders
/user_details?userid=1Icmz3CDIwKE1Jfn4itL9g,Mandy P.,"Montreal, Canada",5 star rating,"There's nothing else like it downtown Montreal. The greatest food, drinks and ambiance."
/user_details?userid=ETqMgVfSa4tDiSRcbmjXUQ,Dax D.,"Montreal, Canada",5 star rating,"Been twice to Jatoba, once with business guests and once with my partner, and the entire experience was impeccable: amazing seafood (enjoyed the shrimp dumplings and bio sucre salmon), drinks (the Shoreleave is great) and staff. Bonus: the restaurant is beautiful with great ambience."
/user_details?userid=Q_IjLaB8AfWNcvWVQgJd3A,Heath B.,"Austin, TX",3 star rating,"Wonderful food. Nice decor. Very expensive and poor service. The dishes were all fantastic. Favorites were the scallops, beef tataki and yellowtail but the portions are very small (you would need at least 2 entrees per person) and quite expensive. The ingredients were very fresh but definitely not the best Japanese I've ever had. They have limited options of wine by the glass and there are not enough employees in the dining room to accommodate their guests. My wine glass was empty most of the meal and we would have purchased at least one more, if not two more bottles had the waiter been on task with refilling glasses. I'd go if you're not in a hurry and budget is no issue. Otherwise, I'm sure there are better options."
/user_details?userid=wQLqTg9_f9KxV4yr_I0JYA,Brian C.,"Montreal, Canada",4 star rating,"If you want a hot restaurant experience with cool people then I highly recommend Jatoba.You will dine in a newly decorated contemporary and spacious room. The place is buzzing with well healed MTL foodies and young professionals. So hats off to the owners because they definitely got the crowd in this difficult restaurant town. (Probably more restaurants per capita than anyplace on the planet).Its the combination of location,eclectically good Asian inspired food and great space thats"" bringing them in"".As for the menu its a sharing concept and we shared:Apps of sautéed oyster mushrooms in a foamy cheese sauce, asparagus vinaigrette and gyosas; all were nicely plated but did not excel which is what you want in a place as nice as this.The mains of Sautéed scallops, miso roasted octopus And a sushi roll were also well plated and for the most part good  except the octopus was  an overcooked misfire and the sushi roll was quite pedestrian. We had a side of duck fried rice which was super good.This may sound like a of food for a table of four but the portions are fair but a bit petite.  So there was abdominal space left for desserts which just happened to be the highlight of the evening. A chocolate bombethat  was the bomb;and a rendition of the ever popular red velvet cake which was more like a heavenly mousse than a gateaux. Bottom line: it looked and tasted sensational..ly. Hats off to the pastry chef.Jatoba has a very extensive and pricey wine list from which we chose an excellent Oregon Pinot Noir(hard to find in Montreal where there is  a huge but understandable bias toward French wines. I would have  liked to see more bottles in the $40-60 range because the next steps up appeared @ $80 -$100 and way more$$$.All in Jatoba is doing  most things right and its a great place for a fun , festive and may I add priceydinner.5 stars are waiting if they kick they food up a notch or two."
/user_details?userid=jiM8ZpOWUj2QrwzD0rYf2Q,Will P.,"Boston, MA",5 star rating,First night in Montreal with my wife and if this is the standard of eateries it should be an epic few days.  Buzzing with fast moving servers and bright eyed guests the reviews of previous Yelpers lived up to the reality.  Delicate sushi with inspired cocktails to wash them down had us tapping our feet with happiness.  The citrus soup with red curry avoided the overpowering side of the spice while delivering a good chili kick. The oxtail dumplings wth green apple and jalapeño were wonderful and the swordfish seared with a homemade Yuzu and mango shavings took a different slant from the usual approach.  In the end we were too full to take on the ultra rare beef tatake with truffles.....but we've decided to go back tonight and have it as a bar appetizer instead!
/user_details?userid=3cTKXxBK6shS8LbbKzQF4g,Josh S.,"Montreal, Canada",5 star rating,"From the warm decor, to friendly service, to the incredible food & drinks, this place is one of the best new spots in Montreal!"
/user_details?userid=JsdS0NVLx5C6e4orB0pC7w,Deanne D.,"Toronto, Canada",5 star rating,"Jatoba is a new restaurant (6 months old). I came here tonight for a work dinner thinking it would likely be decent but it proved to be much more than that. All of my dinner companions agreed that had we been staying in Montreal an additional night we'd all come back again tomorrow for dinner just to try more menu items.  It was phenomenal! We shared dumplings as appetizers - the shrimp were good, the crab/avocado, outstanding. I had the black cod as my main course choosing that based on yelp reviews/photos. It was a standout meal! The cod was perfectly cooked and broke apart in huge, perfectly uniform flakes. It sat on a delicious veg puree with onion, zucchini, and some other green vegetable. We had a lovely chablis with our meal and stuck with that all evening. Because the meal was excellent we shared a few desserts. I can't recall every one of them but they were all excellent. One was the green tea maki and it was like a sponge cake had been soaked in green tea and then rolled around fresh berries and served with a side of tart sorbet. Perfect ending to a meal!  The service was good as well and the manager even came by to ask us if we were satisfied. The answer was a resounding ""Yes"". We sat inside but I noticed that they had a huge patio which I would opt for next time. I can't wait to come back!"
/user_details?userid=sej5h5kqdI7zdxSF31La4w,Alisha M.,"El Dorado Hills, CA",5 star rating,"Amazing food! Excellent service, thank you Audrey for a great night. I would highly recommend Jatoba to anyone visiting Montreal."
/user_details?userid=Ev0MFP_tbXrxPGAy8BqGUg,John T.,"New York, NY",5 star rating,"Amazing experience... Delicious food and great customer service!!!! I highly recommend this place, it worths every single penny!"
/user_details?userid=V0NyT2fKIs7pwFDSGqyCKQ,H L.,"Montreal, Canada",3 star rating,"The service here is friendly and attentive and the room/ambiance are nice. The food is decent, not outstanding. Prices are somewhat inflated. 'Had the brussel sprout chips, crab dumplings, blue fin tataki (really nothing special there), duck bao (tasty, but Satay bros have better buns for a fraction of the price), the lobster (the one standout dish---lovely presentation and came with a tasty side of bok choy), and a caramel marshmallow dessert (it was good---Jatoba does good sweets). This was our second visit since the place opened, and we'll be back, but not soon. It's not the kind of place that leaves you dying for more of any particular dish and, for the price (around $400 for two people, including some drinks and sake), there are better dining experiences in town,  such as Joe Beef or Club Chasse et Pêche."
/user_details?userid=DKIVgpSzU2I3L6qLSezkIQ,Joe P.,"Southborough, MA",1 star rating,Bar only after 22.00. The listing here is broken and very disappointing if you expect to EAT during the listed hours.
/user_details?userid=r6VF7r91tXmiU0RVzbRmIQ,Lirra S.,"Brooklyn, NY",4 star rating,"This is not only a beautifully-designed space, the food is creative, high quality, and super delicious. Do yourself a favor and ignore the caloric content of the caramel blondie homemade marshmallow dessert-- you will be thinking about it for days afterward. Jatoba is a Montreal must and the head chef is destined for greatness (he's also a very generous and lovely host)."
/user_details?userid=dKIgS70K-saBOa_QK8KAiA,Greg S.,"Ville-Marie, Montreal, Canada",1 star rating,"The food here is terrible, we had to send our food back three times last because it was cold. To the people who say this was a good Restaurant, you have no right to be posting on yelp. Complete shit restaurant, and I've eaten them all."
/user_details?userid=TIXVPBC27XWOu2Yl-wpEpQ,Yann L.,"Montreal, Canada",5 star rating,really liked that place! food was excelent. so was the service!will go back soon!
/user_details?userid=K3Mes3wAXaRa27Q4G2lx9Q,Rima D.,"Montreal, Canada",3 star rating,"I had lunch, the food was good but very pricey. The portions too small. My colleagues and I had to go for something else after as we were all still hungry."
/user_details?userid=rLGg2H5CEnHD5T0Ijdh5qA,David B.,"Montreal, Canada",5 star rating,One of the best in MTL great atmosphere and the food is amazing always fresh fish and amazing drinks if you like Asian fusion check it out !! The chef is the nicest guy and he is so talented
/user_details?userid=MYSQQJic2tiDaMg0ivKdbQ,Steph E.,"Montreal, Canada",1 star rating,"I must say, if it wasn't for the absolutely arrogant and classless manager, I wouldn't even bother writing a post. If there is one thing I know about... Its food. I've been to the best restaurants all over the world, but I have never seen such an unprofessional person in my life! We were 5 people and our bill was around 650$ with tip. I can agree that most of the food was good... But their raw fish is absolutely discusting. It tasted soooooo fishy and when i brought this to their attention i was told that this manager was going to come and speak to us but he never did because he was too lazy to get up and do his job properly. And when i saw that they didnt remove these items that didnt even add up to 45$ off the insane bill I was shocked. They didnt even appologize. In fact, the manager argued with me and told me that I didnt know what I was talking about... Even when 5 other people agreed that the fish was DISCUSTING AND FISHY. He also told us he didnt care if we come back or not. Clearly this guy has no idea how to treat his clients and doesnt value his customers. Ive been to hundreds if restaurants and I am not one to complain or even write a review, but This was inevitable. Even at cheap restaurants if you dont likee something they take it off the bill because they want you to be happy or at least they offer you a drink or dessert. This guy is so money hugry he was more worried about removing 45$ than thinking of what great clients we could be in the long run. I eat sushi almost 3-4 times a week at places such as ryu, park, etc... So I know what fresh fish tastes like. They will never see me there again!! And someone wrote a comment saying that this place makes u feel like youre not in montreal... I live in Toronto where they actually have good food and service... And trust me this place made me feel exactly like I was in montreal, because only in montreal are they oblivious to the good service required in a high end restaurant."
/user_details?userid=YB8lcCoITYGtw374N8QgJg,Mia C.,"Montreal, Canada",5 star rating,"I went there yesterday for my boyfriend's birthday for lunch. Overall, a very enjoyable experience!First off, the decoration of the place matched my dream condo : wood, bricks, and green plants. It was beautiful, very modern! Loved it!The crowd there was all business people, seeing as we were there for lunch and it is located downtown.The service was excellent; we didn't wait too long for our plates, compared to other restaurants in the area that have a very slow service during lunch hours because of the rush. The waiters were very friendly, with smiles on their faces the whole time. We were thanked by three different waiters when we left!The lunch menu has nice options at an reasonable price and they come with a bowl of salad and a bowl of noodles to start. I took the Jatoba salad which was very good; the salmon sashimi in it was very tasty. My boyfriend had the beef teriyaki on rice and veggies; it was really good and cooked perfectly. I have to say that I preferred my boyfriend's dish, but it might've been because I was very hungry and wanted some meat. Anyway, we exchanged our plates with each other halfway through, so in the end, I was satisfied!The dessert menu looked really good and creative, but it was too pricey for a lunch so we skipped that part of the meal (anyway, I had already planned a dessert for the birthday boy!).I will definitely come back for supper to try different dishes and all the desserts! PS: This is a good place for business suppers."
/user_details?userid=HTsNH9Pwvkd_QIY4TKdFgQ,Marina M.,"Caledon, Canada",5 star rating,"Ahhh mazing. . Had eggplant dumpling. . I thought it may be an opportunity wasted as it was the veggie option,  but was suggested by the server .. don't regret it at all! Sooo good.  Had the lobster for dinner   another risk as its deep fried, also suggested. I thought it may be a way to ruin lobster. . First time I've had it deep fried.  But it was hardly battered. Super fresh and not greasy at all.  PS I got here by asking for recommendations. . Out of 30 ppl, 29 had this on their list ."
/user_details?userid=_-l7ei1KCcbdkcHp5D6nQw,Lina L.,"Elmhurst, NY",1 star rating,"being turned down right in front of the door, it was really unpleasant experience. you should make sure the NO KIDS sign in every of your restaurant advertisement even for tourists . some tourists walk and look for the direction hard enough and tired enough with hungry toddlers to find that you not accepting any kids. maybe it would nicer if you understand what our feeling at that time by recommending other place nearby so that we don't need to spend browsing a new place to eat!"
