user_url,user_name,user_city,user_rating,user_review
/user_details?userid=ykuDGEj5J1PKs-0huwiVVg,Jonathan L.,"Montreal, Canada",5 star rating,"One of my absolute favorite restaurants in Montreal. The food is phenomenal. The interior design is also gorgeous and it was done by a well known local designer named Amlyne Phillips. Whether you sit at the bar or a table you will get an amazing culinary experience. The restaurant is located in downtown Montreal, just off of Phillips Square which is currently undergoing a spectacular renovation. Jatoba also has an interior enclosed terrace which is open all year round so I do recommend you try and get a table in the terrace section as it's the nicest part of the restaurant. If you're driving there's an underground parking lot across the street you can use so you don't have to search on the street. Please support local restaurants during these crazy times. Jatoba still offers take-out throughout this pandemic. You won't be disappointed!"
/user_details?userid=AuEHPR3Fj7qsuRWiXRy0yA,Laura L.,"Montreal, Canada",5 star rating,Second time we have gone here.. What a gem! From the on point decor to the premium service and absolutely perfectly developed menu. The experience is top notch from the moment you walk in the door to the moment you leave. Plus there are many vegetarian-friendly dishes!Most recent visit was for my mother's 70th birthday- boy was she ever treated to a special experience. Cannot wait to go back!PS for vegetarians - you must try the eggplant dish! WOW
/user_details?userid=7sBZaqo57glRsFlWwuXnaA,Kimberley K.,"Beverly Hills, CA",5 star rating,If there was ever a restaurant that has MY name all over it it is this one. The bottles of Sake -   Amazing !The choices of Tartares ( all kinds ) -  out of this world !The choices of mains - many !Vegetarian & Salads & Veges -  Major !Will come back ( again & again )
/user_details?userid=UQFE3BT1rsIYrcDvu_XVow,Mike V.,"San Francisco, CA",4 star rating,"Lives up to the reputation. The tasting menu is worth every penny, and the drinks are exceptionally well crafted. The service was on point, the ambiance was the perfect balance of trendy without being obnoxious about it. Our last visit we actually dropped in unexpectedly after a prior plan didn't work out, and go figure, we found a table on short notice. Call first, but you'd be surprised."
/user_details?userid=WQepKNQQDOQo1CWpkTUvug,Philip N.,"San Francisco, CA",5 star rating,"Wow. Every dish was phenomenal. We started with the spicy chicken dumplings, shrimp dumplings, and gyoza - all amazing. The duck fried rice was solid, a good way to add more quantity to the portions. Next, the king oyster mushrooms. These were 100% a must get. The bluefin tuna tartar was outstanding as well. I'd say these were the top two dishes. Loved the black bean beef; melted in your mouth and generous portions. The sweet and sour chicken was very very good too. Overall, highly recommend nearly everything on the menu."
/user_details?userid=w0-8K64pIuKVYPaiWSvNvg,Roxie H.,"Nipomo, CA",5 star rating,I visited Jatoba during a work trip with some colleagues of mine and we were offered a tasting menu from the chef that did not disappoint. The restaurant dubs itself as 'Asian-influenced' and I would say that is accurate. The dining room is very nice with a full bar that boasts an extensive wine list. The plate presentations were wonderful and we were truly wowed by a huge cold platter of sushi that I believe was served as a third course behind some small bites of beef tataki and dumplings. Everything was not only aesthetically pleasing but a treat to eat!
/user_details?userid=g-y4Me4bqDz8jwFzX_e17w,Norine A.,"Montreal, Canada",5 star rating,"I love restaurants that take you away to a different food realm of fusion, Jatoba is exactly that with a twist on traditional Japanese dishes. Get seated in the indoor garden if you can- to really acquire the true dining experience. Unfortunately, it's fairly difficult to reserve a spot in the garden but our book club members were still content to be dining inside. I love the decor, elegant and sleek. There was so much to choose from on the menu. We decided to go with the tasting menu as suggested by some of the other yelp reviews. For the tasting menu -the items are selected by the chef so you have no idea what you're getting. It came out to around 56$ per person without tax and we sampled 6-7 items which was phenomenal considering the prices are steep for dishes alone. The menu included seasoned baked Brussel sprout leaves, smoked eel papaya mango salad, shrimp dim sum, wild salmon sashimi, a mushroom dish (I can't remember what it was called), sushi spread, sea bass, duck confit with fried rice (the only low point as not standing out as a creative dish). Since I didn't have a copy of the menu I don't have the exact names of the dishes-sorry :/The price of your meal will spike up if you buy cocktails or alcoholic beverages as they average around 16$ each. So I don't think I have to mention with 2 cocktails and the tasting menu -you're looking at an easy 100$+, but so worth it!"
/user_details?userid=g1MPo8zaOKLo9QazpThPJQ,Wei T.,"Montreal, Canada",4 star rating,"Nice restaurant for business meal or special occasions.  I went there with colleagues during lunch time in a weekday. Without reservation, we needed to sit at the bar. The dishes are somehow over priced, because the quantity were not much."
/user_details?userid=iJ_sn6RfwO5unR9YgFTd4Q,Camille R.,"Côte-des-Neiges, Montreal, Canada",5 star rating,I came here four years ago so My review is a bit outdated and I would like to go back. Entrée: cold somen with sonomono sauce sesame and coriander. In between: Alaskan King crab dumplings with Asian pear salsa and micro basil. Main: jatoba black cod with sautéed vegetables. Desert: red velvet cake with chocolate ganache and green tea ice cream and a delicious cappuccino.Loved this restaurant. Delicious but on the pricey side!Perfect for a date or special occasion
/user_details?userid=h8xK7S1xXUBP2qXW0ZPxxA,Laura R.,"Toronto, Canada",4 star rating,"This is a 4.5 star review.Jatoba has been on my radar for quite a while now. We finally made it! What a treat for the taste buds and the eyes!!The food was really inspiring. It started with Brussel sprout chips that are simply out of this world! I would seriously entertain the thought of coming here just for these chips - the right mix of spices makes them so appetizing and addictive.Next, we had the gyoza, which was pretty good- they didn't stand out that much.We had the salmon rice, which is akin to a poke bowl. This dish was really good and flavourful.The Jatoba salad was an interesting one; so many different tastes mixed into this bowl.The beef tatami was really amazing! Again, the spices made it come alive.The caramel dessert was delicious. My only complaint was that it was very pricey. I believe about $18 - that is a lot for dessert.Service was very friendly and servers were very knowledgeable. The atmosphere is sophisticated and very trendy. Be ready to people watch in this beautiful setting. It is teeming with a good looking, well heeled crowd.It is quite a scene. Chef Vigneault has a powerhouse restaurant on his hands here that will delight all your senses."
/user_details?userid=KBHTIaz-OdXukREefkP4qg,Gabrielle L.,"Montreal, Canada",4 star rating,"I went with a friend a few years ago. We both found it to be expensive for Asian food. We shared the black cod, the dumplings, the beef tataki and the fried rice. We had to order the fried rice because we were still hungry and we needed something to absorb all the alcohol we were drinking. My boyfriend and I went back for a friend's birthday dinner on Saturday. To be honest I wasn't too excited to go back but it ended up being a really good dinner! We had to do the group menu which was a good deal! My boyfriend and I thought we had to pick from the menu to get 5 dishes but we got all 12 dishes for $69 plus tax! The only downside was that we had to share all 12 plates family style instead of each having our own tasting menu. One guy sitting next to us barely ate because he was on the Paleo diet and then two other guys sitting next to us ordered off the group menu so I ended up sharing the plates with only two other people, which was good because otherwise I might have still been hungry at the end of the night.  My boyfriend and I got the bloody Caesar (aka Bloody bull) and Aloha Jatoba cocktail. The Bloody bull was great but I wish it had been spicier. The Aloha contained Tanqueray, Soho, fresh ginger yuzu sweet and sour and lime juice. The waitress said this was their most popular cocktail so I wanted to try it. It was very pretty to look at. It as garnished with a citrus fruit and flowers. However I regretted ordering this because it was too sweet for me. If you like sweet fruity drinks and like Soho (litchi liquor) then you will like this. After the cocktails we stuck with red wine by the glass. Edamame was good! I liked the spices they put on it. It reminded me of the Slap Ya Mama seasoning popular in New Orleans. Next we had the Jatoba salad, salmon tartare served with shrimp chips and beef tataki. The salad reminded me of a Singapore slaw as the vegetables were cut up julienne. The salmon tartare had avocado, sesame seeds and jalapeno peppers on top but it wasn't spicy. It was good! I wish there had been more of it. The beef tataki was delicious. We basically had two pieces each. After that we had the vegetarian dumplings, the chicken, and the yaki-ika (grilled calamari). The dumplings were crispy and were triangular like samossas. It was good but nothing special. Inside the dumpling was an eggplant puree, mushrooms, edamame and corn. When I had the dumplings the first time it was the ox dumplings and they were steamed. The chicken was similar to a general tao. Again it was good but nothing special.Then we had the duck confit fried rice, the filet mignon and the Jatoba style black cod. The duck confit fried rice was good but its just fried rice. I think its good to order rice to fill up on. The filet mignon was tender. Out of the three, the black cod was my favorite. It came with Chinese broccoli. I wish here had been more cod on the plate.The desserts were awesome! One dessert was like s'mores with vanilla ice cream and the second was a chocolate mousse cake with passionfruit sorbet. If you want fine dining in downtown Montreal and like Asian food then this is the place for you! In all honesty, I probably won't come back unless I have to because I do find it expensive for what it is. I recommend going in a group so that you can do the group menu because that is more worth it. Also be sure to predrink and eat a heavier lunch before you come! Ordering off of the regular menu is super expensive! I am half Asian and if I want Asian food I rather just go to chinatown because it's good and it's cheap!"
/user_details?userid=UDFIZXP0kOb2xKoYToTS6w,Julia D.,"Montreal, Canada",4 star rating,"When you are downtown and looking for a more upscale experience then you should definitely consider Jatoba.  This modern looking restaurant boasts an Asian fusion menu.  They have a gorgeous garden terrasse, however because it was booked we were unable to get a seat out there. While it is on the pricier side it is definitely worth the occasional splurge when you're in the mood for a treat.We ordered a tasting menu which gave us a chance to try a bit of everything.  Some of the dishes included confit de canard fried rice, salmon sashimi and dumplings.  While most of the dishes were really well done and tasted excellent I must admit that the fried rice was slightly uninspiring.  That being said they absolutely nailed all the fish dishes.  I found that they were all cooked to perfection.  The tasting menu was about $65 and we sampled 6 different dishes in total so I felt that it was worth it.Our server always made sure that we were well taken care of.  She checked on us often and we never seemed to wait long to receive our dishes.  She was also a really friendly person in general.Jatoba definitely merits a visit if you are in the downtown area and looking for a fine dining experience.  While it may be a little pricy for some I felt that it was fine to pay those kinds of prices once in a while for a meal like that.  I would definitely return here."
/user_details?userid=LfKXi3u8aRN8SHHBXGb3_A,Rhiannon T.,"Tallahassee, FL",5 star rating,"Jatoba is a beautiful restaurant and it has the food and flavours to match. Yes, it is pricey but it is worth the treat at least once in a while. We ordered about ten different dishes and everything was absolutely delicious. My personal favourites were the eggplant, the shrimp fried rice (super spicy), and the ox dumplings!The drinks were great, and they were generous with the alcohol.I would definitely recommend Jatoba to anyone who is looking for a great dinner to celebrate a special occasion!!"
/user_details?userid=RcpiJkkiT5_9UqXz_O1QqA,Konstantina P.,"Le Sud-Ouest, Montreal, Canada",4 star rating,"My foodie group and I had the chance to dine at this establishment located in downtown Montreal on a Friday night and of course, we had reservations on the terrace. It was a dark day and raining hard when we arrived so we were so relieved when we noticed that the terrace is actually covered! The venue is very modern with exposed brick, dark wood tables, a slick bar and chandeliers, but the hanging lights and lots of greenery on the terrace really gave you the feel of the outdoors. The rooftop is actually clear and with all the windows, you'd get all the natural light in if it were a sunny evening; for sure, one of the most gorgeous terraces in Montreal!We shared the tasting menu at 65$ per person and wow, was it well worth it! Four generous courses were served that left us full and content. Some dishes missed the mark like the sweet and sour chicken and the veal, mostly cause they were too dry and tasted more like smoke than anything else. The mango papaya salad and black cod dish were fabulous though, as were the cocktails. I had a spicy pimm's cocktail with wasabi and lemongrass which had the right combo of heat and sweet. Worth mentioning was the cheesecake dessert which came with a wasabi ice cream; the combo was good but not my thing although that cheesecake was fluffy heaven! The service was excellent as the staff was both personable and friendly, although there was a small wait between the second and third service. I'd totally return to the terrace on a sunny day to try some dishes from their a la carte menu and enjoy some of the lovely selections from the wine list; it was a memorable evening overall!"
/user_details?userid=KBoIRjxSW7OWczv8OS9Bew,Xue L.,"Verdun, Montreal, Canada",4 star rating,"If you like japanese food and suddenly feel fancy, this is the place for you. The food is fresh and the combination of the ingredients is nicely done. The best dishes i've had is the black cod and i've never had any other black cod like this elsewhere. It melts in your mouth as soon as you eat it and it has this nice subtile miso flavor. The staff is very friendly and helpful in choosing on what to order. The ambience is nice. The chef personally came to our table to explain the different kinds of fish on our sashimi platter. Althought it is quite pricey, every dish is definitely worth it once in a while."
/user_details?userid=6lELxb5duHs0u9C0oNkXtw,Farah S.,"Montreal, Canada",3 star rating,"Was highly eager to try Jatoba. It was ok but really more of a hip place with younger & business crowd and a scene of see & be seen than a foodie place. The patio is nice & service was great but the food was just ok. We had the Gyoza which was ok , really can get better in some Izakaya places. The highly anticipated & raved about Sashimi plate also fell short comparing to other good Japanese restos in Montreal.The Maki was really so so and over priced. We also found the Jatoba Cod to be overly sweet. Usually the Miso black cod is one of my favourite foods but here the sweetness just over powered the taste. We really liked the scallops which were very well executed with a tasty creamy mushroom sauce. The lobster was good but again nothing mind blowing. I think the originality was mainly apparent in deserts and top marks go to caramel dream and the cheese cake mousse."
/user_details?userid=gdZRGQoskfqapck_hL70hA,Kim P.,"Boston, MA",5 star rating,"This restaurant was definitely a little bit on the fancier side of things, but definitely worth trying. The way their menu was set up was kind of tapa style, so my friends and I got a couple of dishes (not all pictured).Their sashimi was definitely so fresh! Every piece I ate, I did not taste the fishiness at all and usually some restaurants don't clean their fish well enough, so there's still that fishiness taste to it, but Jatoba really did it well. Every piece melted in my mouth and it was well worth the price. I think our all time favorite dish was the fish. The sauce and seasoning of it was just so well done! We could not get enough off it. We also got duck fried rice, which was amazing! It may sound really simple, but it was so well done, definitely could go for more. The dessert was absolutely amazing. The Japanese cheesecake with jasmine milk tea ice cream was AMAZING. I would go back just for that, that's how good it is lol. Overall, every dish we ordered was amazing and we would definitely come back for it.Now, the only complaint I have is that our waiter forgot one of our orders AND misplaced someone else's order at our table. I'm giving Jatoba five stars for the food, but four stars for their service. Granted, our waiter was very patient with us, but when we repeated our order to him a few times, he still forgot one of our dishes. Usually that's not a big deal for me, but in this case we were visiting from out of the country and we really wanted to try what we ordered (but wasn't delivered). In any case, I'd still be willing to come back and hope that our next waiter/waitress doesn't forgot our orders!"
/user_details?userid=-FUmZTuSaI_7Wm2Sq4QgBw,Herwig P.,"Woodland Hills, CA",5 star rating,"Just a perfect spot to enjoy sushi and Japanese cuisine.It took me a while to find the entrance but once you find it it is amazing.Ambiance, Service, food, .... again just perfect."
/user_details?userid=pQ02Y1VCqcV7vZV_id2VsA,Sophie L.,"Montreal, Canada",4 star rating,"I come to Jatoba lots for lunch as its close to my workplace and has a great ambiance + food. I highly recommend the wok duck confit, the chirashi (basically a big bowl of sashimi!). Most recently I had one of their new items on their menu- the 5 spice chicken bao. The chicken was good but they haven't completely nailed the bao bun yet; it was thinner than it should be IMO!Also keep it mind that the prices are pretty high for the portions you're getting! I brought my boyfriend here once and after 3 dishes he still needed a second dinner!Overall, very good asian fusion with a beautiful interior."
/user_details?userid=emClTWXE_ou1_RJ5PHIAUQ,Iris N.,"Markham, Canada",3 star rating,"Too expensive for the quality of food... Maybe just this time but it was my first time so I'm just giving a review based on what I ate... The service and ambiance were great. Not the food.I had the most expensive HaGao in my life and also the worst. Very little shrimp in it and the outer layer is way too thick. Doesn't taste  fresh at all. The sashimi bowl I order was expensive as well and not as fresh as I thought it would be. The fish is cut very thinly which is fine but they don't have the sashimi taste. The ""marinated"" vegetables that come with the sashimi was just shredded carrots and reddish.. I had way better sashimi bowl for a better price."
/user_details?userid=MjqfukTWimz3D0w-cp5fDg,Kathy P.,"Verdun, Montreal, Canada",4 star rating,"It's a very fancy japanese restaurant. Expect to have to walk out of there with a bill of at least 50$ if you want to be full. At lunch, they have lunch ""specials"". Their sashimi platter is actually pretty decent ($$$).  For dinner, I tried many of their dishes and they are all on point (black cod,   scallops, etc.). Their cocktails are good."
/user_details?userid=nHjRBSbzPeqdq5_D3AirEg,Patricia C.,"Hampstead, Canada",4 star rating,"Jatoba is beautiful inside, chic yet comfortable decor with attentive friendly service and very high quality food. It is a tapas/sharing style restaurant so our table ordered various items to share.  To start I ordered their Aloha Jatoba cocktail and it was perfection, so well balanced and perfectly prepartion and presentation (not too sweet and not too strong tasting). We had the Gyoza dumplings as well as another set of dumplings (also with shrimp, I dont remember the name), they were both very tasty with a great balance of filling and great texture on the dumpling dough.  The beef tataki melted in our mouths , as did the salmon sashimi , they were soooo soooo good ! We also had the grilled seabass with tempura veggies , this was my least favourite but it still tasted great !  The Duck Bao buns were excellent , a little sweetness to them without being too much and the duck inside was juicy without being too fatty.  For dessert we had the matcha cake (This was just okay ,it says it has a gooey oozing filling but it didnt and the flavour was pretty ordinary, although the raspberry sorbet on the plate was excellent), the Caramel cake was the star , everything about it was perfect - it had a salty sweet feel to it and had some nice texture, the sorbet on the plate that came with it was also amazing ! This was by far my favorite of the two desserts. My one criticism is how very expensive this place is , especially for tapas- the quality and experience/service  are both very much there and on point but the prices are still pretty high in my opinion for what it is at the end of the day. This is more of a special occasion restaurant as opposed to somewhere to go on a regular dinner or date."
/user_details?userid=aIqDek9d1fDEgLIAWXMGSA,Robert L.,"Fort Lauderdale, FL",4 star rating,What a great place. Took my daughter for dinner here before the hockey game. Its a pricey place. Sushi was amazing. I hate eel yet i ate it as it did not have a dishy taste. The chinese dumplings were good but i have had better for a quarter the price. Great ambience.
/user_details?userid=raqTx1Tj-wTMs25mcDPMxQ,Monica M.,"Saint-Laurent, Canada",4 star rating,"I was very impressed with the drinks. Don't know who was the mastermind behind the drinks but good job!!! I took 2 drinks, both delish and with a nice amount of alcohol! Now for the food, loved the dumplings and tartare. Salad was ok and served with eel which I didn't see on the menu. Sashimi was excellent. Great option for a celebration or if u have a good amount of money to spend!!!  enjoy!"
/user_details?userid=Pxtz00WgmEBalguNqSjKYQ,Isabella C.,"Los Angeles, CA",3 star rating,"Ok food, very good service. I had the Tataki boeuf which was 6 thin slices of beef with crispy carbs and some cooked beans and sprouts. The beef had almost no flavor- actually, nothing had much flavor excerpt for the meager amount of truffle sauce that was on the bottom of the plate. Very underwhelming. We then had the salade jatoba, which was basically fresh vegetables very thinly sliced, drizzled with a light sauce. We also had the ultra gyozas, filled with shrimp and crab, but again, had almost no flavor. The only thing that tasted great was the le mille-crepes, which was 21 layers of crepes with a light cream in between each layer. The restaurant itself was gorgeous, but the food was nothing to rave about."
/user_details?userid=S5ctdm7RTh2boNvlkZY4wg,Ssu Ying C.,"Toronto, Canada",4 star rating,"Food was good so does the restaurant atmosphere.People are looking for fusion fine cuisine can have it try. Dessert we ordered mille crepes, a bit disappointed. For the price of dessert, i expected something more delicate than what i tasted.Overall experience i rated 4 out of 5, will visit again probably in summer for the beautiful terrace area."
/user_details?userid=1Bljt-GngRP4XxkQFLnHHQ,Rod M.,"Montreal, Canada",5 star rating,"I've been going to Jatoba pretty regularly for lunch over the summer. This restaurant has one of the nicest terraces in the downtown area. In fact the decor and atmosphere of the entire restaurant, both inside and out, is A+. Whether it is for a quick business lunch or to chill out on the terrace in the afternoon you can't go wrong here.Everything on the menu is pretty solid and the presentation is great. If I had to pick out one standout main dish it would certainly be the cod. It is excellently prepared and melts in your mouth. However, the real highlights on their menu are the desserts. Oh my god each one that I have seen or tasted is amazing. The portions are enormous so plan to share and they are rich and just out of this world. Take the chocolate bomb for example, someone has posted a video of this. Yes, this menu item is so amazing and interactive it requires a video.  Upon arrival at your table the server will pour hot chocolate melting a chocolate sphere containing more chocolate and fruity goodness. Forget the main course just go straight for the dessert, you won't be disappointed. In all honesty, even if it wasn't for the desserts I would comeback just for the terrace, there is nowhere else downtown with such a nice outdoor space."
