user_url,user_name,user_city,user_rating,user_review
/user_details?userid=6ukKiFO0Z77f8OHvAPZODQ,Madeleine P.,"Hudson, Canada",5 star rating,"Very excited to have discovered this place. We were seated in the beautiful covered terrasse. The ambiance was perfect - lights just right, music at ideal volume, plants & furniture were classy and comfortable. It's the kind of place you want to just linger and enjoy your meal. Which is exactly what we did! We had the group menu for $65 and the courses kept coming and coming. The first course was my favorite but they all had some outstanding dishes. The spicy salmon tartare and beef tataki were excellent, as was Jatoba's black cod. Would i try wasabe ice cream again? Probably not, but pairing it with the cheesecake was an interesting experience. I also enjoyed my Spicy Foo Pimm's Cup cocktail. The service was also first rate. An entirely charming experience!"
/user_details?userid=hVqavL_V9pbCsG76K6qT9g,Georges C.,"L'Île-Bizard, Canada",5 star rating,"Had a great meal here this week. Always love coming here. Beautiful setting and solid food. We had the dumplings to start, a couple fresh salads, some grilled fishes, sashimi platter, 1 maki roll, some filet mignon and other sides of veggies and rice. Honestly the food is simple yet complex. The veggies are treated like royalty, it's pretty amazon actually. The star of the show is the sashimi platter with all the herbs and different species. It's awesome. Very talented young chef here, and you can tell this place is run tight. Congrats on the good work."
/user_details?userid=hV5P36JyNyeBSu8zTIFntQ,Shakil A.,"Montreal, Canada",3 star rating,The chocolate bomb is the bomb. Everything else is alright. Not the best from chef Antonio Park. Would highly recommend park restaurant and cafe bazin instead.
/user_details?userid=FNSUuB0wcQXfnO3ioGWPsQ,Julia C.,"Dollard-Des Ormeaux, Canada",2 star rating,Honestly nothing special.I ordered the duck bao buns and the mango and papaya salad. The buns were good but for the price of $28 (for 2 small buns) my mind should have been blown and they were only alright. The salad missed the mark for me. I've had better and payed the fraction of the cost that they charge here. Probably wouldn't come back.
/user_details?userid=vj-gGhmf8zw4FJiJ4oWGjQ,Beantpreet K.,"Montreal, Canada",3 star rating,"Decided to give this place a shot based on so many positive reviews. Went here for a special occasion dinner, which my husband had mentioned while making the reservation. We showed up on time and the hostess showed us to our table. Nobody came to our table with even water. After 10 minutes, we asked for a server and menu. The entire time we were there, we were struggling to get our server's attention. It turned out he was a bartender, which explained why he wasn't very happy serving us. After 30 minutes, he finally took our order. We got our drinks in 15 minutes and first round of food in another 20 minutes. Then we had to wait for another 30 minutes to get our remaining order. The food was good. Drinks were good as well. Don't know what was up with so much wait because they were not busy. At this point I was getting restless and just wanted to finish eating and leave. It was quite late for a weeknight dinner. Finally finished eating and waited to ask for the bill. 15 minutes later, we managed to a get a server's attention and requested the bill. Got the bill in few minutes this time, paid and left. I had three restaurant options for that night but I decided to check this place out, which I believe was a mistake. It actually took us more than 2 hours here. Despite of mentioning that we were celebrating a special occasion, the service was horrible. Also, there was no apology whatsoever. I would like to check out their Terrasse  for drinks only but would not go here for food again because of the long wait."
/user_details?userid=lXTVIhtLxoWjBGjmdfRZuw,S S.,"Greensboro, NC",3 star rating,"Not quite satisfied for the PriceMy friend and I arrived promptly for our 7p reservation on Saturday. The decor is very pretty/sexy. Waitresses wear cute dresses with belt bags. We were told the menu was designed to share. However we were somewhat disappointed to see the portions were quite small and my friend and I were both still a little hungry after our meal but not excited enough to order more. We started with the dumplings. MehhhhNext up was the mango salad. Delish but really for one person. Tuna tataki which was crusted in Tempura and not much flavor. Tempura is not my favorite so maybe don't trust me if you love it. But the tuna was bland. And our entree was the Lamb dish. Tastes but they took our spoons and it is not a dish that you can eat with chopsticks. I think we needed rice or something but couldn't wrap our heads around the double digit price. The waitress assured us we had enough but it wasn't. It gets very crowded, loud and tight in space."
/user_details?userid=hk8TeCnbk4k4oDtOE4EqMA,Stephanie H.,"Columbia, MD",5 star rating,"What a wonderful night on the terrace at Jatoba.  We started off with drinks recommended by our waiter and they were a hit. I got the Spicy Foo Pim's cup with wasabi, lime juice, ginger beer and lemon grass and hubby got a bourbon Ewa Warhawk drink that was to die for.  We started off with the sashimi platter.  The Chef brought it to our table and describe the platter and told us that everything was edible. We ate it all and it was the freshest we have had in a long time.  Lovely.  We also shared the gyoza dumplings which were good.  My meal was the black cod, melt in your mouth emigrant fish paired with a recommended red wine from the waiter.  Just delightful! Hubby filled up mainly on the sashimi so he had a Riz (rice) bowl with shrimp at the end.  All in all a lovely meal in a great atmosphere and easy metro ride back to our AirBNB."
/user_details?userid=KFZAeHIYdB__US6rNCo8hg,Banny B.,"Montreal, Canada",4 star rating,"Book a reservation, Garden Terrace has a great ambiance, Excellent sushi, great drinks, having guests from out of town or just looking for a spot for a romantic dinner,  it is the perfect place with the perfect menu."
/user_details?userid=cntYY9TAsK8gLccAVmLK9Q,Joanie M.,"Granby, Canada",4 star rating,"The covered terrace behind is absolutely gorgeous! However, it started raining strongly and it was so noisy! It was a very strong and unusual storm but i'm guessing even small rain might be bothersome.  The food is a combination of japanese and fancy. Always very fresh and tasty. I love the dumplings and the bluefin tartare in crispy rolls were the perfect mix of creamy and crispy. My friend took the quail and it was a modest, small plate but so packed with flavor!. I will definitely go back."
/user_details?userid=Hib9c10vUQWvNpmysW_c0A,Victoria X.,"Saint-Laurent, Canada",3 star rating,"Disclaimer: I came here with a friend for a catch up lunch so my comments only apply for the lunch service. The pros: Very nice setting for a business lunch if you work in the area. They have both indoor and a shaded outdoor setting options. Good option if you are looking for a healthy meal as more than half the menu boasts fresh fish in some variation. The cons: Service a bit on the slower side of you are in a hurry. It took almost 30 minutes between our salad and main course. This can be an issue if you have a restricted lunch timeframe. The food was very decent, good quality produce; definitely no complaints there. However it's rather on the pricier side. 36$ for 12 pieces of sashimi with some rather plain veggies is a bit on an overkill in my books. For the same price you could have gotten the sashimi omakase at Park sushi, which comes with 3 different serving sauces and a more generous portion of sashimi. Granted the location in core downtown comes with a price hike but price ratio still doesn't balance well once that factored in. If you can expense a 100$+ lunch meal on company tab than by all means this is a good place to get good quality food and impress a client. If it's just to catch up with a friend, I'd pick somewhere else."
/user_details?userid=xDg4gp_oBUudXbZz31yf-A,Helena U.,"Montreal, Canada",4 star rating,"The place is well hidden despite the fact that it is located in Place Philips downtown. We had the pork collar & the chirashi. The meat was so tender and tasteful! Since the terrace is covered, we can enjoy its ambiance whether is raining or not. I would recommend this place for 5à7 or big events."
/user_details?userid=t-0_us3OTzs_ZhKy6fcamg,Dawn M.,"Toronto, Canada",4 star rating,"Beautiful space, beautiful presentation of the food, great service, very good quality ingredients, not super authentic (not that it matters as long as the food is good), and very, very pricey. The menu is eclectic, more Asian fusion than actually Japanese. We had the sashimi platter daily special and the coconut rice with grilled shrimp. We had about three glasses of wine and a mixed drink between us, and we shared a dessert. All of this came to $202ish before gratuity. The sashimi was fresh and served with all kinds of interesting, pretty, and edible herbs/flowers/plants. It was exquisitely arranged on a bed of ice, very fresh and tasty. A good variety of fish I might not have otherwise chosen, because when I order à la carte I tend to stick to my usual faves. Interestingly, it was served with a sweet soy sauce as opposed to the type you'd normally get with sashimi/sushi. In fact, it tasted almost like Chinese clay pot rice (煲仔飯) soy sauce, because it was sweetish. The coconut rice was delicious and fragrant but overcooked (or rather, cooked with too much liquid). My grandpa would probably rave about it. The shrimp was decent but probably brined in baking soda to make the meat springier - I'd prefer untreated shrimp. The rice was a little bland, to be honest. Drinks were good. The highlight was the dessert for sure. My dining companion told me they had an amazing dessert chef and he was right!!! I'm glad it was so good too, because the desserts were on average $18 each before tax and gratuity. We had this caramel concoction - two tender, fragrant, thin layers of warm cake with some warm caramel stuff in the middle, topped with The Best Vanilla Ice Cream I'd Ever Had. The ice cream was HEAVENLY. It was generously dotted with vanilla beans and the flavour was so pure and vanilla-y, just the right amount of sweetness, and the difference in temperature went so perfectly with the warm cake under it. We were told it's one of their bestsellers and I can see why - I will be fantasizing about it for a long time!"
/user_details?userid=66gYpqgVAFLLxSG7JaM4Uw,Lize-Mari V.,"Stowe, VT",5 star rating,Love this place. On the expensive side but great quality. Best cocktails in Montreal.
/user_details?userid=BoRp3z_2wGlxFL8nGP0QIg,Luc P.,"Saint-Laurent, Canada",5 star rating,"By far one of the best Japanese restaurant in town!What could you ask for more : Nothing! Great service, wine list, food is perfect!The gyozas, salads are amazing. Fish? The best and freshest you can find outside of an ocean village. Nice open setting. Could get a bit loud, but ok if not too busy. Only little culprit is the price, very high, with few option on the low side. But at this high level of quality, it's worth it if you can afford."
/user_details?userid=2hGEFClDF2fQVjGo95IMZA,tony C.,"St Charles, IL",5 star rating,"Can't say enough good things about the food and service here.   Best tofu I've ever eaten...Crispy Tofu...light, but creamy inside ...crunchy and savory on the outside.   The Ultra Dumplings, the fried rice with duck and thin sliced beef with roasted grains were all superb.  And our server, Jennifer, could not have been better...always on time, professional and sweet beyond words.   If you're in Montreal do not pass this place up!"
/user_details?userid=OAh1W2NqSYkKQuzhpE8Hbw,Christina S.,"Calgary, Canada",5 star rating,"Can I just say best service ever? Went there on Friday night with my family and everything was delicious. They loved the calamari (reminds you of popcorn shrimp), the filet minion (sliced thin when served with amazing sauce), beef tenderloin, Jatoba salad, dumplings, and to end the evening the chocolate bomb!!! We actually ordered two of them to watch the perfectly closed chocolate bomb melt from the hot chocolate sauce and open to show the inside of the dessert. It was gorgeous!! I am vegan and they accommodated me very well.We will be back! Service extraordinaire."
/user_details?userid=5ca2MkCJFAMafDrRxLMlXQ,Ash L.,"Montreal, Canada",4 star rating,"I should have given it a 4.5 star because it is almost as good as it could get for Asian fusion cuisine in Montreal, not to mention the amazing decor and beautiful terrace (perfect for fancy office party/networking event). The only reason i removed 1 star was probably due to the portion. My husband left a business lunch there hungry and didn't wanna go back until i insisted- then we were both pleasantly surprised at dinner: the Lobster dish comes with a complimentary shanghai bok choy and it reminds me of some top Chinese restaurant in Hong Kong (price was even higher). The gratin with king oyster mushroom is creative and tasty - a must-have! The other dishes like fried rice (only filling dish you could order), crispy tofu, salmon tartare are a bit less memorable but definitely still good. tips: do 2 plates per person+dessert or 3 plates/person if you have light items like salad/tofu.It's pricy but totally worth it . Enjoy!"
/user_details?userid=owtyCzBVO-4xaEnHvPKLLw,Joanne L.,"Montreal, Canada",4 star rating,"I'm usually not a big of Asian fusion but this restaurant exceeded my expectations. All the dishes we tried were jam packed with flavours that complemented each other. Service was excellent, staff members were very attentive and friendly. Highlights of the night: hamachi, king oysters, uni (so good)."
/user_details?userid=aehLkadQqOZ4-xX2d0g0aQ,Deasy N.,"Montreal, Canada",4 star rating,"First off, the food was delicious! And the presentation was pretty! We had: beef tataki, duck confit fried rice and shrimp dim sum (hagao). I was sceptical about the duck fried rice at the beginning (my friend wanted to order that so we went ahead), but wow, I was so impressed with it. The fried rice was so tasty! The beef tataki really melted in my mouth (my favourite of the night)! The combination of cider vinegar, sesame oil and sonomono sauce was amazing! Everything was light but so delicious.I really enjoyed the ambiance too - it's trendy and somewhat fancy. I think it's a great place for a date or a small gathering. My waitress was super friendly and knowledgeable about the foods (I asked her quite a few questions). I will definitely be back to try more stuff on the menu!!"
/user_details?userid=2vKPIXEFrtqZc8zIWvA4tw,MaryJane R.,"Montreal, Canada",5 star rating,Woah! Been in MtL for 3 years and had no idea this place existed! How is that possible?!? I'm always googling around for nice restaurants in downtown. How I passed this place up is beyond me.FYI - this place is quite bougey. But I love it. Great people watching and fantastic decor and ambiance! We sat in the terrasse area. The food was amazing. Best dumplings and dessert I ever had. Can't wait to go back!!! Cocktail menu on point!!
/user_details?userid=I-h2h1NRVH8k3vaddo8n1g,Alex G.,"Miami, FL",5 star rating,"My first love... no one ever forgets their first love! December 2015 was the first time I stepped foot at Jatoba; ever since, I've been back countless times (but to my lack of initiative, never took the time to review it). So... truth is, Jatoba is an extraordinary blend of culture, food, hand-crafted drinks, ambiance, and art. Chef Olivier Vigneault & his team present a truly unique Asian fusion concept (with a Montreal flair of course) whereby the freshness of each ingredient (especially the sashimi) hits your palate at about 120 km/hr. Whenever I have a guest visiting from out of town, this is my restaurant of choice. A truly experiential dining adventure worth the trek, but be sure to make a reservation. Genuine gratefulness to the Jatoba team for the hospitality, and we'll see you again soon!"
/user_details?userid=bvuxor346zDAen3poNl9qA,Kate F.,"Fort Mitchell, KY",5 star rating,"A very good choice for dinner. Hip decor, good vibe, nice service.  The Jatoba salad was awesome!  The ox ravioli was unique and very tasty. The mushroom side dish was amazing! Finally the sea bass and the short ribs (with lots of delicious veggies) were both very nicely prepared. If you are in central Montreal, worth a visit!"
/user_details?userid=i6ZDJFeypkj6kCvSFjMbyg,Annie K.,"Montreal, Canada",5 star rating,"Yummy yummy in my tummy. Had been meaning to try this resto since it opened. Everything on the menu is really well thought out. The black cod was the best I have ever had. Period. It just melted in my mouth. And even just simple edamame was done right; seasoning was on point, although it might be considered spicy for certain palates.   Def worth a try."
/user_details?userid=tXhscxwFTd-ayLTdPx_2yA,Jonah K.,"Miami Beach, FL",3 star rating,"My colleagues in Montreal were gushing about the quality of the sushi here. We came for a business lunch. We had them order for us, and they brought an assortment of apps and sushi. The food was all decent, but the fish quality wasn't where it could be. Had much better sushi elsewhere, although in Montreal I have not, so maybe I am being too harsh on them.The service was great, and the ambiance was decent, but slightly dated."
/user_details?userid=3QJj7MESj2TSIp7_Ylkg0g,Mtl F.,"Montreal, Canada",5 star rating,This place has everything right. The decor is breathtaking & the food is incredible. We had great service and really enjoyed our dinner. Definitely worth the price.
/user_details?userid=xO3EIJR0QNzM3CdajinWtw,Michael P.,"Montreal, Canada",4 star rating,"When one talks about dining in Montreal, we rarely talk about the downtown core as a big part of that. There are definitely places worth checking out that are more than simply overpriced fare for the business crowd. One of these is Jatoba. Located in Phillips Square, Jatoba is a project headed by chef Olivier Vigneault, previously a sous-chef for Antonio Park.The space, conceived by La Chambre Design, is a beautiful combination of the old brownstone structure with some more modern touches. I love how they incorporate the brick facades all around the different rooms and make them focal points. The lighting is ample but slightly dimmed to create a nice intimate feel. Lots of wood warms up the space and the kitchen is exposed in the big backroom. The other big element is the use of tons of plant life to incorporate some nature into the space. The whole of the restaurant feels very warm and cozy.Jatoba has a pretty good cocktail menu and wine list. I started with a Lavender May - Lot 40, lavender and calico syrup, fresh lime juice, egg white, rhubarb bitters. I love egg white cocktails so this was an easy sell for me. Not too floral with a nice touch of both sweet and sour. The frothy texture of the egg white added some body to it as well. As for the wine, for the purpose of full disclosure, I know the sommelier of Jatoba - an old high school friend - so with his advice, we were treated to a lovely French Patrimonio that we had never heard of. Just the fact he got my parents to like a French wine is worth very high praise. Thanks Marc-Andre!Food-wise, given the pedigree of the chef, you can imagine that the menu is Asian-inspired fusion fare. As a group of 5, we were able to share numerous items. First up, I can never say no to a bowl of edamame with yusuf powder, nanami togarashi and fleur de sel. Always love that salty kick.We also tried the Brussel sprout chips with spices. Very thinly sliced and fried up, I personally loved the slightly bitter notes from the sprouts and the crunch that came from frying them.Next up, we went for some dumplings. We tried three varieties - the Gyoza (pork, shrimp, chinese chives, spicy samba oelek soy and chinese vinegar), the Tori (chicken, napa cabbage, braised shiitakes, leek and sonomono sauce) and the Ha Gao (shrimp, green onion and red wine tobiko). All excellent - very flavourful with the subtle hints of the extra ingredients above the primary proteins. Kind of made me crave some true Dim Sum at that point....My girlfriend and I felt like a soup so we shared the lemongrass soup - lemongrass and coconut cream, shrimp, lobster, tomatoes, thai basil, green onions and bamboo. A lovely well balanced soup. The lemongrass was strong but the sweetness of the coconut cream softened it slightly and created a super silky texture. The addition of shrimp and lobster gave it some more heft and the tomatoes brought some freshness and tanginess. One of the best soups I've had in a while.As a rice dish, we went with the fried rice with duck confit which included an egg, vegetable medley, yukon gold chips, green onions, micro coriander and enoki mushrooms. Very generous portion of rice and lovely flavours all around. The rice had the crunch of a fried rice with some earthy notes. The addition of the duck confit provided a nice rich and fatty contrast to the rest of the rice dish.Next up was sushi time. We went with The Roll - atlantic salmon, spicy hamachi, avocado, cucumber, tempura flakes, sweet soy and yusuf yogourt. A more upscale version of a classic ""Kamikaze"" roll and excellent all around. Key differentiation was the use of less of the binding elements like the tempura and more emphasis of the freshness of the salmon. The fish was beautiful and came through clearly within the roll. No hiding of the fish here. The tempura brought a touch of crunch and I liked the touch of sweet creaminess coming from the yogourt.The final savoury dish we tried was the 1855 Beef Tataki seared with sesame oil, mini green beans with cider vinegar, dwarf truffle peaches, black quinoa soufflé and sonomono sauce. Beautiful elegant dish - the beef was sliced beautifully thin and super tender. The addition elements simply play to augment the natural flavours of the beef.For dessert, we got the Chocolate Bomb and the Japanese cheesecake. The bomb - a combination of black and white triple chocolate brownie with hazelnut praline, dark chocolate and hazelnut truffle, dark chocolate mousse, marbled chocolate sphere and milk chocolate sauce - was a chocolate overload in all the best ways possible. I loved the different uses of texture and flavours within all the chocolate. The cheesecake served with maple spongy candy and black sesame ice cream was excellent texture-wise. Nice and creamy. The black sesame ice cream was not my thing but a cool pairing to the inherent richness and creaminess of the cake.Jatoba was a lovely night out - wonderful drinks, awesome service and good food."
/user_details?userid=m_7elkDE_kTEh65xHt5y4w,Larissa L.,"Montreal, Canada",4 star rating,"After hearing so much about Jatoba, I was glad to finally check it out. The menu is enormous and the ideia is to share so you get to taste many different options. I strongly suggest their cocktails. My friends and I each had a different one and all were amazing! Super creative and delicious. The food was very good, although in general I would say it was not extraordinary. For all the hype and being that pricy, I have to say I expected a little more. Our waitress was great, very knowledgeable about the menu, gave great tips about what to order. But the only part of the meal I can call unforgettable was the dessert: a caramel tarte that was unbelievably good!"
/user_details?userid=qmU-A7otLfTXVShkrPsF-Q,Patrick B.,"Sarasota, FL",2 star rating,"In short,  I would say this restaurant is highly overpriced.  The portions are quite small and the recipes are nothing special.We ordered the sashimi plate, rice with grilled shrimp and a gyoza vegetable.  The sashimi was good but the gyoza vegetable was chewy and fibrous.  Not worth $14! The rice was a very simple, unimpressive dish that was definitely not worth $18.The service was mediocre at best. After the meal, our waiter disappeared. It took another wauter 20 minutes  to ask if we wanted a dessert. No one from the staff asked how our experience was.Save yourself the expense and the disappointment and avoid this restaurant."
/user_details?userid=g9DJsWXLvp7qu_ogVbMZtw,Jimmy C.,"Mascouche, Canada",5 star rating,"Where do i begin?The inside of the restaurant is beautiful very elegant but our reservation was at the terrace ... which to our surprise it was covered  with clear roof and lots of green ... with beautiful globe shaped lamps .... it was perfect as it was a rainy day ... with summer being so short in Quebec .. we want to maximize our outside seating as much as we can...Now foodWe had the 65$ tasting menu ...  and boy we were not disappointed... it was lots of food!!!Some dishes hit my palate some missed it ... but overall it was great .!!!The cocktails were very interesting and very originals .. the service was very attentive and professional So given the money that we paid, the amount of food we got .. the originality of the dishes ...the amazing cocktails ... the excellent service .. the beauty of the terrace This place is a must ... to any and every foodie out there .!!!!"
