user_url,user_name,user_city,user_rating,user_review
/user_details?userid=RMBj39407GldNqYIKWQZhQ,Brandon F.,"Fairfax, VA",5 star rating,When in Montreal don't miss Jatoba. The service and food were both exceptional. I appreciated the fact that they had an amazing cocktail and wine list to pair with the the food. We had the server choose our meal with some guidance on what we were looking for. The fish melted in your mouth it was so fresh and good. I also loved the fact that everything on the platter was edible. We had a sweet and sour chicken dish that was ok but not as top notch as the rest of the meal. The beef tataki was terrific with excellent flavor and was like butter. The black cod was over the top spectacular. The fish was cooked to perfection glistening as you cut into it. We had an amazing meal here and will be a go to spot for me when I am back in town.
/user_details?userid=bzCgHWtklCymHQDEFiCppA,Nazanin G.,"Ville-Marie, Canada",3 star rating,Over all it it was okay . one of my dishes that was sashimi was smelling so much that me and my friend we couldn't handle it to the point that in my nose I was smelling fish the whole night !! The drinks were nice I recommend it . The salads were normal nothing wow and wasn't dressed to perfection where they could add more taste to it . Also we had deserts that were acceptable but they were coming in  huge portion so one is good for two person to share . The atmosphere was nice and calm the day we went there . The service was smooth and nice. Worth to try it once but I won't go there on regular basis.
/user_details?userid=TlPX51ckc-yD-_DeU0sCOA,Andrew F.,"Atlanta, GA",1 star rating,Incredibly rude management staff.  We came at the recommendation of a local restauranteur friend but they had a private event which is fine. As we were getting our coats back from coat check and ordering a Uber the manager (short woman with short red hair) came over and was visibly upset at our mere existence. We told her we understood the private event and were getting our things back to go to which she raised her voice another octave and insisted we leave this instant and put our coats back on outside in the rain/snow. So we trudged back outside and on the way out she made sure to tell her staff not to let us back for any reason...  you would think she thought we were Jason Bourne on a life long mission to crash their restaurant. Mind you this was in the front coat room and foyer area where we saw no attendees. Will make it a point to tell others to avoid this place.
/user_details?userid=Xa5zlxG7M0DMEU2Qh12rHQ,Michael M.,"Ville-Marie, Montreal, Canada",5 star rating,Amazing!! The beef is simply the best dish in Montreal and the caramel dream is my favourite dessert I have ever eaten. There is nothing not to like about it. Try and reserve a table in the garden
/user_details?userid=pDpcXPcwZnv1NrfdFkBdQw,Jason H.,"Rochester Hills, MI",5 star rating,"First of all, everything we had was un-effing-believable. Top 5 restaurant I've had in my life and I would travel to Montreal again to specifically eat at this restaurant each night. It ain't cheap but I would spend a G here without a care.Top item that would make me spend a $500 plane ticket to travel back to Montreal...the fried vegetarian dumplings. Most unbelievable flavor combo in a vegetarian thing I've ever had. 5 others at my table agreed. We bought another without hesitation!Service=impeccable. Shannon and her staff felt like they were only serving us while still being attentive to other patrons. Every recommendation Shannon made was on point! Girls knows her taste.This should be a Viral review on every website. I don't usually yelp review but when I do I make sure it's for bad ass restaurants like Jatoba!"
/user_details?userid=zLkbxR1IvwnEbbztvZDfmw,Marie C.,"Laval, Canada",2 star rating,"I had high expectations about this restaurant from the reviews , the starter of eggplant purée dampling was ok but the cresson that came with it was loaded to the max with salt so I stayed waiting for the sea bass my main dish , the main dish of sea bass  was full of salty tomatoes and the fish consisted of around 2 fingers of this sea monster which was also crunchy from salt ,, so I ended up enjoying the tomatoes which were not even marinated with olive oil but with some oil ! My friends had very tiny dishes of something called sea food like tuna slices portions cut for the birds not for humans !Then came my dessert it was supposed to be meringue but was instead of meringue like a white omelette for cholesterol dieters,  soft instead of crunchy and disgusting filled with some old fruits and topped with sorbet ,, I ate the sorbet only ! What a shame !!i came home to order a pizza!"
/user_details?userid=Ls9JpiFzUgTbuLlTgjNwRw,Tracy T.,"Ottawa, Canada",5 star rating,"FIRST, book a reservation. I went on Monday night with a party of 3. Thought the restaurant wont be busy. I was wrong. Had to sit in the nice courtyard. Service was attentative. Ordered scallops, salmon and dumplings. Really exquisite dishes. Small portion. asian fusion With emphasis on taste and presentation. Impeccable."
/user_details?userid=Ex-QoUxevVpBPsovXWb8cw,Naoufel T.,"Montreal, Canada",4 star rating,"It is been a while I have a very very pleasant experience at a restaurant. The ambiance was very well designed from the lighting to the the music and decor. It has a trendy modern feel to it. The waiter was on point, he almost knew what we want before we order. Gave us advice on what to pick and his choices didn't disappoint. We had the shrimp dumpling, they were pretty good, the spicy salmon tartare was really really good, i am not too sure about the avocado cream they put on it but it wasn't overwhelming, I could almost avoid it. The egg plans were amazing, the coconut shrimp  was a bit bland, though the shrimp was well done. The caramel dessert they have was to the best way to end the dinner. This place is perfect for business, romantic or casual dinner with friends"
/user_details?userid=mBLlok-7v-LkiaDwFi99Dg,Trismegistus _.,"Oakland, CA",5 star rating,"I've yet to write a yelp review for a restaurant within a couple of hours after eating there takeout.  Well here it is...I ordered the Brussels Sprouts crisps and the King Oyster Mushrooms.  I've been eating Brussels Sprouts since I was a child and this is by far the best way I've ever had them prepared.  Crispy, savory, and seasoned perfectly, this is one of the best dishes I've experienced here in Canada. The mushrooms were lightly seasoned and grilled perfectly.  They tasted delicious alone but they included a little cheese dip that took it to an unexpected level.Every time I come to Montreal I will go to Jatoba.  Truly a gem."
/user_details?userid=6iD6drB51smAYkvWR2vzmQ,D F.,"Côte-Des-Neiges—Notre-Dame-De-Grâce, Canada",4 star rating,"Very nice trendy restaurant. Nice decor especially in the back room where we sat. They have valet for $15. Water refills were decent. The food is Asian fusion . I tried a few appetizers: Eggplant, Mushrooms, Veggie dumplings, chicken dumplings. Mushrooms were the best. I would get that one again. For the main I got the sweet and sour chicken. It was incredible. I would get it again. Although I also wouldn't mind trying other things on the menu. My hubby got the cod. It was good but the chicken was better. Caramel cake was a good dessert."
/user_details?userid=A7YlcidsiAZzU-tCSsrTSg,Anny T.,"Montreal, Canada",5 star rating,"Jatoba is a beautiful restaurant with a really trendy and grand interiors. I've met Chef Olivier Vigneault when I used to work for an upscale sushi restaurant Kaizen, where I remembered how fantastic his cooking was. When I saw he's at Jatoba, I was sold.Good: We've ordered the vegetarian gyoza (dumplings), the daikon with fresh herbs and spicy beef salad, and the 1855 beef tataki to share. The service was fantastic, and the food had totally exceeded my expectations. The complex flavours of each dish was simply amazing. I highly recommend the daikon salad, it's really light, filling and flavourful. You know the food is great when you can't decide which dish was your favourite because everything was so tasty.  Now, I had recently returned from a trip in Japan, so my expectations have been lowered for all Japanese restaurants in Canada (sorry), but having tried the sashimi at Jatoba, I was instantly reliving my Japan trip all over again. Each bite was so fresh with delicate flavours, you would slowly savour it. That's how good it was.Bad: We didn't get a seat the terrace, but it was our fault we didn't reserve in advance.Bottom line: This is among my top 5 picks in Montreal. I would recommend this place for anyone in a heart beat. If you still need more convincing to try this place, just look at Chef Olivier Vigneault's Instagram account."
/user_details?userid=u-JPr__Yqrj0wfHBUu3hjQ,Andrew R.,"Outremont, Canada",2 star rating,"If you're thinking this is some kind of hidden high end gem right downtown think again. I didn't necessarily have a bad experience here but it was also nothing special. The place is pretty big, between the front room and the terrace, and seems setup more like a ""pack in the lawyers at lunch and charge 'em an arm and a leg"" place rather than a fine dining establishment. The dumplings were disappointing, and the sashimi and maki were passable. Wouldn't go back."
/user_details?userid=GMhCq90wV2zlidFfIduTOA,Donna M.,"Newton, MA",4 star rating,"Dined here on July 28. Overall, it was lovely and definitely would return! Food: Note that most of the items are very small. If you like to eat and have a hearty appetite like my husband and I do, be prepared to buy many different things. We got the GaI Gao dumplings ($16) to start which were very good. You only get 5, but if you are a party of two, they offer to give you a 6th which is great. However, we didn't know until we got the bill that they charge you $4 for the extra dumpling! I thought that was pricey. We then got Yaki Tori chicken ($24) - again, extremely tiny portions, only 4 small skewers which we ate in a heartbeat. Along with that, the steamed rice and vegetables with chopped pork were very good, both sizes were reasonable for two. After all of this, we were relatively full but had room for dessert. YOU MUST GET the dish with the marshmallow and ?blondie with ice cream. It's seriously one of the best desserts I have ever had !!!  What a great way to end the meal. Drinks: got two rounds of Aloha Jatobas. Very tasty and beautifully presented. However, the first round didn't taste like it had much booze in it which was a downer. The second round did, which made me question if there was any alcohol in the first drink at all. I wanted to get a third round because it was so refreshing, but at $14 a pop, it was getting expensive! Atmosphere: kinda has a retro vibe with plants and geometric figures on shelving. Very cozy and comfortable. We has hopes of sitting on the terrace but we were seated inside so I can't speak to the outside. Service: very good, attentive, sweet. TL;DR: pricey but worth it"
/user_details?userid=2AAIpyvPPCeQMi1_FKjNXw,Seema S.,"Toronto, Canada",5 star rating,Not just a pretty face. The food at Jatoba was outstanding. These are the must-haves dishes in my opinion:- eggplant dumplings- brussel chips- king oyster mushrooms and miso gratin- spicy crispy tofu- sauteed sweet and sour eggplant- sesame steamed rice- cheesecake Great place for vegetarians. Pricey but worth it. We'll be back!
/user_details?userid=97TzYvnM4UFhja-vLwv51w,Farah G.,"Waterloo, Canada",4 star rating,"Okay, so I have so much to say. First of all, the restaurant itself is gorgeous beyond words, the decoration and the overall atmosphere is very sophisticated and elegant. When it comes to the food, honestly beautiful presentation and elevated dishes. The king crab dumplings were amazing, however, I would say that considering the amount me and my friend had ordered, I was expecting to be full, but I was actually pleasantly surprised to feel pretty light and just the right amount of full. The red velvet dessert was jaw-dropping. The service was also extremely lovely and overall very caring to our needs. I would say though, that the table that we were placed in was uncomfortably close to the table next to us, so much so I could hear their conversation with utter clarity. Overall though, this is a spectacular restaurant."
/user_details?userid=69AqMB6P3sI5v2IK_I376A,Mark S.,"Montreal, Canada",5 star rating,"I absolutely needed to write a review about this restaurant as it was, by far, one of the best Japanese restaurants in Montreal. My standards for Japanese food elevated in the past month as I just came back from Japan. The taste, texture, and presentation really took me back Kyoto where I ate the best sashimi.The decor had a modern elegant flow to it, from the hardwood floors, the mouldings on the walls, to the light fixtures, and out to the terrace. And that terrace!!! B-E-A-utiful. Be sure to make reservation to get a spot outside. The service was on point, nothing bad to say. We were seated quickly, our waiter took our orders as soon as we put down the menus and filled water glasses as they reached near the end. The price can add up very quickly but it's really worth every hard earned dollars.I highly recommend for a special night out. Enjoy!!!"
/user_details?userid=nWSVPRBfs43RcwsfGOJ3qQ,J G.,"Los Gatos, CA",3 star rating,I love Japanese food. I live in Calif where we have some of the freshest seafood there is. This restaurant came highly recommended. I was told that it was overpriced and portions were small.  Have no problem overpaying if great food.I have the restaurant a 3 because the portions for the money was not worth it. The food was good - not great! We ordered a ceviche that was only 3 spoonfuls for $25 dollars us.Crazy! Not even tasty. I wish I could give a higher rating but after 4 days in NYC and 3 days in Montreal this was the first meal that was not really good. Check out other places for better food and value.
/user_details?userid=ul_W0OlpG2F5ovzXuc1GDg,Diego C.,"Manhattan, NY",2 star rating,"The place is not worth it.  The space is beautiful. Very well put together. However...The food is sub parThe service is just okNever even a look over from the manger much less a visit. I've only spent a few days in Montreal, but Jatoba has left a bad taste in my mouth. Don't waste your time"
/user_details?userid=S_9xTmBOARaqVis0WqlhPw,Yen Q.,"Brooklyn, NY",3 star rating,"Dinner menu: Minuscule portions that are good, not great. The lemongrass soup was delicious. The Sea Bass was good and a fair portion. Gai Gao dumplings which were ok, nothing special, and Hamachi which was portioned SMALLER than the palm of my hand, and good but not amazing. I saw decent portioned plates but ours were not. Presentation was beautiful. The ambience is pretty. Sound level loud. Tables very deep, creating a large distance between you and dinner partner - we had to speak in raised voices, adding to the loud din. Beautiful people. The saviour of the meal was the dessert. Caramel Dream was out of this world. I would return to sit at bar and have dessert only."
/user_details?userid=rR3KgAwuJxk9Roz4J5_jtg,Derek L.,"Oakville, Canada",4 star rating,"Came here after some research into some great restaurants in Montreal and Jatoba did not disappoint! A great style of Japanese food with a North American flare!The restaurant is located on a quite street just minutes away from Old Montreal. It look a bit of looking since the restaurant is slight hidden. The incredible decor reminds you of dining in someone's backyard. The slight upscale feel and the dim lighting sets the mood for the dining experience ahead.Their five spice old fashion is really something else, a mix of bourbon and five spice mix gives the cocktail a unique flavor. The kumquat balances out the anise flavor to create a delicious mix.The must have is the kampachi, a great blend of fresh kampachi fish with the spicy flavours of wasabi and jalapenos. A must try at the restaurant, my only complaint is the fact there wasn't more of it!I'd definiately come back for sure next   time i'm in town!"
/user_details?userid=TmljCl6px9_1D-V1dEUR-w,Alf O.,"Long Island City, NY",2 star rating,sushi comes swimming in soy sauce / the side dishes are good
/user_details?userid=_6HkVWbZISbKNVycuZg18A,Shelley H.,"North Vancouver, Canada",5 star rating,Exceptional food that is light and very balanced. Hands down the best gyoza and black cod that I've ever had and the service was excellent (there for lunch). I'll be dreaming of the food until I come back to Montreal!
/user_details?userid=bTG-wTud-NReiQZjvxeoOA,Kevin M.,"Severna Park, MD",5 star rating,Easily the best restaurant in the neighborhood. Jotoba is a high-end Japanese/Asian Fusion restaurant. The fish was impeccable and they have a decent selection of sakes. Many items on the menu worth exploring. I will definitely be back. Reservations recommended.
/user_details?userid=PghVeuONyc4XGr6_5pERqA,Christopher L.,"Brooklyn, NY",5 star rating,Elevated form of Japanese cuisine. Didn't have any of the gimmicks you usually find with fusion foods but gravitated towards a more elegant and contemporary taste that reflected all the traditional Japanese ingredients. Beef tataki and ox-tail dumplings are must haves.
/user_details?userid=OHTXFa3YQY0cB0nzHgjhRw,Yi T.,"Montreal, Canada",2 star rating,"Really disappointed by this experience. Probably the worst ""high-end restaurant"" I've been to. The fish and meat were great. We had bluefin tataki, salmon tartare, filet mignon and sea bass; they were all fresh and delicious. However, the Alaskan crab was a too salty for my taste and the tempura shrimp had too much batter. We also had many types of dumplings, the only memorable one being the Hao Gao. You can find tastier dumplings for half the price in Chinatown though. The salads were okay, nothing to write home about. The vegetable sides often lacked seasoning and were bland. I had the Japanese cheesecake for dessert, which you should avoid. The cheesecake was dry and crumbly, nothing like the Japanese style. The accompanying wasabi ice cream was very out of place (and frankly, the taste was just off). Having pieces of maple toffee was nice though. Not sure how they fit in the plate, but at least they were good. Now you may be reading this and thinking, ""Wow, isn't she picky!"". But I think that when you're paying so much per plate (and keep in mind that the portions were tapa-sized), quality needs to follow suit. Now the service. For starters, our waiter left abruptly in the middle of taking our table's order, without excusing himself or anything. He did come back 5 minutes later, but this would be a preface to the overall rudeness of the service. Someone came over to take away our wine glasses without even asking us if we'd like anything to drink. Our plates were later taken away from the table even though they were clearly unfinished. Moreover, it was a rainy evening, and we were sitting in the veranda area; water was leaking through the roof and splashing on one end of the table, also bothering my friend in the process. The waiter came by, looked up to the ceiling with annoyance, and did absolutely *nothing*. No offer to move the table out of the dribbling water, and not even an apology. Seriously? We had to scoot over ourselves. Fix your roof, Jatoba."
/user_details?userid=MkVbFinsz9PvFXDpfiihhw,Liz C.,"Downey, CA",5 star rating,Had the pleasure of dining here this week for lunch. The cod was divine! Flaky but not dry and had a very tasty and subtle taste. The bok choy was sautéed and cooked to perfection. Great ambience. Would absolutely recommend!
/user_details?userid=09maL_m5yM-2RwPf9DW0Sg,John H.,"Gaithersburg, MD",2 star rating,"Jatoba is the much hyped addition to downtown Montreal. Located inside a large building without an obvious signs, the restaurant is vast with a beautiful terrace out back.  The decor and ambiance are very nice and welcoming.  The service is excellent with no less than 3 people waiting on your table.  I would give it 5 stars just for the service and decor.  The food is what brings this place down.  We ordered the pork and shrimp dumplings to start.  They were mediocre at best. There are better, more authentic dumplings anywhere in Chinatown but again, you won't get the nice terrace or a server wiping down your table mid meal.The brussell sprout chips were my favorite. They were light an crispy but fell short of anything more than a snack.  Finally, out starters ended with a very very disappointing seaweed salad.  The dressing was bland and lacked the traditional seaweed salad found in almost all of the Japanese restaurants in the area.  I ordered the chicken and my colleague ordered the sea bass as our mains.  My chicken was 2 skewers of dry chunks of chicken in a mysterious brown sauce.  For $24, I would expect an actual piece of chicken with crispy skin (as described in the menu).  This was almost inedible.  The bass was good with large chunks of tomato. The vegetable fried rice was disgusting.  Broken grains of rice in what looked like a mixture of rice and frozen peas.  There was no flavor and the rice was dry.  I'm not sure what this place is aiming for because it's not quite Asian.  The venue is gorgeous but the food is terrible.  There are many other options for fine Asian fusion in MTL and this is not one of them."
