user_url,user_name,user_city,user_rating,user_review
/user_details?userid=eoGFI3g5Rx2_42W6rrgU3w,Annie Y.,"Richmond Hill, Canada",2 star rating,"Sorry for the long post =(My friends who lives in Montreal brought me (from Toronto) here for dinner the first time (photo 1). I liked it so much that I brought my friend here the 2nd time (photo 2). I had the Tom Yum soup and my friend had the beef noodles soup. The Tom Yum soup was so delicious, like nothing I had taste before (including when I was in Thailand). We both loved it so much and came back for lunch a couple days later. We both tried something else. I loved my soup, if I remembered correctly, should be Suki soup. We loved the chicken salad more than the papaya salad.  Today, Jan 6, 20, brought my other friend to try Mae Sri (lunch). And I was dying to have the Tom Yum soup again. I had the first taste, it was 100% different than what I had the first time. I thought I ordered the wrong item. And tried the soup again, didn't taste right. I called over the waiter and asked and was told that's the soup base they use. Sorry I didn't take any photo today, my friend ordered the chicken soup, is the same broth as hers. Tom Yum definitely does not taste like plain chicken soup. If I have never had Tom Yum at Mae Sri, I would just assumed this is another failed Thai restaurant. Yet the Tom Yum soup I had in November was not the same broth! The waiter offered to give me more Tom Yum paste and extra lime on the soup. I tried it all and still doesn't taste right. He kept saying this was their soup base, and if I ordered anything else, he won't be able to refund me the $. I ate the noodles & seafood, didn't take another zip of the soup. The waiter came again and told me they have different chefs in the noon & evening. No wonder! But how could there be such a day & night different in taste? Is totally a different soup! Shouldn't there be a standard???? I was so disappointed. The waiter offered 1 tapioca dessert for the 2 of us. In this case, never come here for lunch! I would not recommend to any of my friends again."
/user_details?userid=yRB4UrgnLs3BxbVM1QQ0Gw,Sababa S.,"Toronto, Canada",4 star rating,"I went in Mae Sri expecting Pamika standards but then I realized the menu, the prices and ambiance was all different. Mae Sri is a casual over the counter restaurant. I should've tried their noodle soup bowls to get a feel for thai street food. Instead I had spicy crispy pork belly with rice. The dish was a bit too spicy for me. I added a fried egg on top ( for 2$) and the fried egg was over cooked. We ordered chicken salad (lab kai) for starters to share and it was alright, not as great as Pamika's."
/user_details?userid=KEBvAP-lG8oOUaX4coq0cg,Issan Z.,"Montreal, Canada",5 star rating,"This place had been a breakfast spot before opening as Mae Sri in November last year. We went tonight around 8h and the place was pretty full. We got seated at the windows after about 5 min, and decided on what to order. I didn't know that ordering was at the counter, so ended up waiting for awhile before a server clarified the situation. We got papaya salad, Pad Thai Mae Sri, Kuai Tiao Tom Yum, Thai Red Syrup with Milk and a Tapioca for dessert. The food came very fast, and was beautifully plated on banana leaves and enamel plates. Portions were not huge but reasonable (leaving room for side dishes!). The pad thai and tom yum soup were good, with well balanced flavors and fresh ingredients. The red syrup drink was fruity and very sweet, but with a smooth finish thanks to the milk. The star, however, was the papaya salad. From the first bite to the last, the salad absolutely **rocked** my world. Very few dishes can marry so many strong flavors - the sweetness of palm sugar, tartness of lime juice, punch of hot chili, pungence of fish sauce - and textures. I couldn't get enough of it! The level of spice was much bolder than I expected, which was a fantastic surprise (just like seeing snow fungus, pork blood and morning glory on the menu!!). Unfortunately, the tapioca was a bit of a miss, as its texture had hardened with the cold. We were very happy with the food, service and pricing. The restaurant had a simple but beautiful interior, with warm, dim lights and cozy wooden structures. A lot of attention was paid to details, down to the choice of tableware and cutlery holders. Bonus points for the restaurant's website's beautiful photos and comprehensive menu, which indicates the name of each item in Thai script, romanized Thai and English. So happy Mae Sri is in the neighborhood!!"
/user_details?userid=5HiO4RFBVtAc7EY6w2mmRg,Vanessa V.,"Côte Saint-Luc, Canada",5 star rating,one of the best thai restaurants in montreal for sure. it's the same owner from Pamika so we knew it was going to be amazing! we got the soup and the pad thai with two of their delicious deserts! staff is very helpful and friendly. must try!
/user_details?userid=Y6JhHLPzBZ6Z5cHS1s-B4w,Rojarra T.,"Lachine, Canada",4 star rating,"Even though this restaurant has only been open for about 3 weeks, I've already visited 3 times. I'm feeling lucky these days because I've discovered so many hidden gems in close proximity to my job at McGill!Anyway, back to Mae Sri Thai. You walk in, pay at the counter, have a seat and your food is brought out to you. The quantity + quality of food that you get for the price is almost unbeatable. I've had three dishes (pictures attached); they were all very flavourful and delicious. The food is prepped very quickly, so it's a great option if you'd like a good meal and don't have too much time.With that being said, though the food is great, however it's not quite up to the standard of The flagship location, Pamika yet. I say ""yet"" because Mae Sri is still fairly new and since the owners are the same, I'm sure they'll be up to par soon.In any event, I recommend Mae Sri. However, I REALLY recommend Pamika!"
/user_details?userid=I8nPtKPLXMupdtdnPjctsw,Ping Y.,"Montreal, Canada",5 star rating,"This was my second time there and the quality has been consistent both times. They opened not too long ago and it's a more casual and cafeteria style restaurant where you order at the counter. The inside is very clean and has a nice ambiance.The food came fast and was beautifully presented. For 2 people, we got the green curry ($16) which I highly recommend, one of the noodle soups (forgot what it was called unfortunately but they're $12-15), the papaya salad (super fresh and delicious with a little spice $10), the seafood set ($12) and finally a thai iced coffee with condensed milk ($5). It was certainly a lot of food for 2 but the portions are pretty good in general for the mains (appetizers and salads are a little smaller).The prices are higher than some other small over the counter restaurants but it's justified by the freshness and quality of the ingredients. Overall, good service and great food! Thanks for the great experience, I will be back soon!"
/user_details?userid=nNPvKTSrx4x1KkD-wA-9vQ,Jurie H.,"Lyon, France",3 star rating,"I ordered the green curry. It took over 20 minutes. The waiter apologized. It came with noodles, something I've never seen. The noodles were lukewarm. It was served on a flat plate so to get sauce on the noodles (and to heat them) I put them in the curry, only to then fish them out again. The chicken came with bones and cartilage, including all the tiny and sharp bones. I had to fish it out of the curry to be able to eat it. Very cumbersome. There were no napkins anywhere. Not going back."
/user_details?userid=fw7GQ34xVS3cZpuV5UmMFA,Irene D.,"Deux-Montagnes, Canada",5 star rating,"I came across it through Instagram (they kept liking my pictures ) so I googled them and turned out, they're right next to work.I've been twice already, but think about it everyday.I've only tried their soups thus far, but will be returning to try more stuff!Their quality, quantity, price, service, decor are great and I really recommend it!"
/user_details?userid=N8qbEfp3u2cdFqLbcPecJw,Megan C.,"Montreal, Canada",5 star rating,I love this place! Yummy thai food perfect for a comforting meal in the winter time!
/user_details?userid=SlWGENN-t346Tsuisr3QLg,Jeffery T.,"Saint-Laurent, Montreal, Canada",3 star rating,"First time I went, I give 4 stars. The rice portion was small, but I liked their red nectar drink (which was great at nullifying their really spicy chili!), and their tapioca was nice.Second time I went there, 2 stars. I ordered green curry, and God it was awful. It was so runny and liquidy and bland. They served noodles with it, which was weird but whatever. But it was a small amount of noodles, so I asked for their overpriced rice ($3 per bowl). And two bowls of it since I was famished. But the curry made me want to puke. But since I don't like wasting food, I finished my rice anyways.Average it out, 3 stars."
/user_details?userid=8o5YaBnbnTJfjc7wpsiGUw,Kristie N.,"Montreal, Canada",4 star rating,"I had the pleasure of going to Mae Sri since it's super close to my place. I tried the pad thai which was pretty good! It was a bit too chewy for my liking but the taste overall was really good! The bean sprouts on top were kind of odd. I'm not too sure if it's part of the garnish or what, but maybe they could be cooked or something?? I'm going to go again to check out the other items on their menu! P.S. It's also self serve. You pay and then sit down!"
/user_details?userid=plYXTteFs0QSlLlXU51sXA,Phill P.,"Toronto, Canada",3 star rating,"Papaya Salad is fantastic. Great medley of different flavours, one of the best thai salads I've ever had.Baa Mee Haeng Moo Dang is horrible. I don't know if it's ""authentic"", but it definitely isn't ""good"". It literally is a noodle soup without soup. On the menu it's in the same section as pad thai so I figured it'd have some sort of sauce. Nope, no sauce, literally a bowl of undressed cooked noodles with a bunch of toppings.I'd go back but would definitely avoid the Baa Mee Haeng Moo Dang next time."
/user_details?userid=jpF5VxuG9moPTZzDfAPuSA,Tram L.,"Montreal, Canada",3 star rating,"I discovered this place through ads on Instagram as I follow their other restaurant, Pamika, I guess?I was very excited to try it out. As it is a counter format, it seemed simple enough. So I gathered some friends and we were a group of 8 quite eager to have some good noodles. The place is cute. Simple in decoration style. They were so newly opened that there were no coat hooks.... whatever, we piled our stuff on the floor next the the table.The waitress/hostess was very friendly, we chitchatted while I waited for my friends because I was the first one there. People started to come in more and more and I thought this was gonna be awesome!!!It started with ordering... my order was pretty straightforward but the waitress messed up & charged me for something else. She was very apologetic. Human errors, all good! Then she tried to explain to her boss, it went well. They said they'd flag the kitchen to make sure I get the right soup.Then came the soups. They were so unequal from one to another in term of quantity inside the bowls. And these bowls are flat, so if I can see the bottom of the bowl, there isn't a lot of food in there, is there... AND the heat didn't stay long... Then obviously the kitchen came out with the wrong order of my food.. Fine, whatever. They went to verify and came back with the right one. The menu is also inconsistent with what is spicy and what isn't. One of us took a soup that isn't spicy and ended up leaving half of it because she couldn't handle it, despite having no warning anywhere.Then as we started to eat, which took longer than we are used to, we realized that one of us never got her food. And it's been a long time. She asked the waiter and he said he'd check. 15 mins later still nothing, at this point it must have been REALLY long, because I eat slow and I was half way into the soup already (or because there wasn't a lot, I don't know..) I had to flag it AGAIN. Finally she got her order plus the appetizers that should have came out much earlier. They then offered us some appetizers on the house to apologize for the delay and mix ups.Now, the food was good. Some better than others. But the whole scenario really deflated us & I'm not sure we'd come back... I undertand with newly opened places, etc, but when you open a restaurant, especially already owning another one, shouldn't you be READY? Honestly for the price vs quantity and quality, it's kinda expensive. I hope they change it up a bit to improve."
/user_details?userid=Et6YLMrlyX2PCkqtwSVAug,Sabeena S.,"Montreal, Canada",5 star rating,"For the students who are lovers of Pamika, you will be very pleasantly surprised to know that it's owners have opened a quaint restaurant steps from McGill. The cozy decor and incredible service compliment the always delicious and fresh food that Pamika is known for. I tried the vegetarian green curry, which is surprisingly served with rice noodles here unlike the normal rice. They even added some fried tofu upon my request! I love the vibe of this spot- place your order at the counter and find a comfortable seat. The food is out so quickly! Plenty of seating too. Be careful though, it's difficult to eat the curry with noodles, you'll need extra napkins. The menu is decently priced. My meal was $16 but there are cheaper dishes on the menu. I highly recommend it and can't wait to come back and try more things."
/user_details?userid=mib6HoG8IaHwbHiYuvWhtA,Nattaya S.,"Le Plateau-Mont-Royal, Montreal, Canada",5 star rating,"As a Thai person, I found the food here super authentic and insanely delicious! Eating here reminds me so much of home. Definitely will revisit & staff are very friendly :-) ps. If you're not afraid of spiciness, order your dishes in ""Thai spicy"" and they'll put a bit more spices. I did that and the food tasted amazing!"
/user_details?userid=5o05OPIAhp5oAs7E6a9JNQ,Crystal Y.,"Kaohsiung, Taiwan",3 star rating,We'll never order rice dishes again. Added an egg cost $2. It's too simple and pricy with overcooked meat compared to the noodles. Beverages were too sweet and strange flavor for me.
/user_details?userid=NkMOVXd9lb9V57tLaQ4vNQ,An T.,"Rawdon, Canada",4 star rating,"Came to this restaurant so many times and tried most items on their menu. I've been to Thailand and I can say that it's definitely the most authentic thai restaurant you can find in Montreal. Everything tastes quite good except for some appetizers (don't order the boiled seafood/meat dish, it tastes bland). They serve different types of delicious noodle soups. If it's your first time, i would definitely recommend ordering the pad thai, pad sew ew and the thai iced tea!"
/user_details?userid=CZIABQgavGBUOZJBYs5egQ,Autish D.,"Vienna, VA",5 star rating,"Mae Sri is a small restaurant. They specialize in noodle soups. Overall I loved the food here. Their Thai Braised Beef soup and their Chicken Soup were delicious. We also tried their Crispy Pork Belly which was excellent too. The soups are fairly large and very filling. The pork belly was slightly smaller. In vegetarian selection, if you don't eat fish sauce please check what has fish sauce and what doesn't. Several items on the menu marked vegetarian had fish sauce.  The vegetarian Pad Thai was excellent. The ice teas were on the small side and had too much ice, which watered down the flavor. They ask you to place the order at the counter. The people there were incredibly helpful, the overall service was excellent and the food was great."
/user_details?userid=vDKJJVVwV-cuFz69jYEB1Q,Diana M.,"Montreal, Canada",2 star rating,"One bite in and i said I would never come back. The dishes are bland and both dishes we ordered were disappointing. I ordered the pad se ew and the seafood ye to, just meh. I had to add so much spice, fish sauce and soya garlic pepper sauce for it to be OK. i will never understand how a restaurant with such basic food can be so popular. Although their thai iced tea was delicious, not worth going back. I will never return and would never recommend to anyone.... unless i dislike them"
/user_details?userid=CuWnqAqc5ncH2o4KkVDWRQ,Chelle F.,"New York, NY",3 star rating,"Counter service, simple menu.  We arrived in the afternoon on a weekday, so it wasn't terribly busy.  Even with the few other customers, I got the wrong order (ordered the ground pork but got the crispy pork belly).  The other dish was right--pad thai with chicken, egg and tofu--and tasted good.  Portions seemed smallish since we were so hungry; we cleaned both plates.  Neither had a lot of protein/meat.  Overall everything was fine, but I was expecting more from the rave reviews."
/user_details?userid=IMSaka8H9PLGfzkbT7MsyQ,Julia WeiYi Z.,"Montreal, Canada",5 star rating,"Ok. This restaurant really surprised me by the taste of the food. I tried three plates: papaya salad set, beef soup and hainan rice. I love three of them!It is very rare for me to love every single plate of a restaurant! I think the presentation is very authentic as well.If the location is in the middle of downtown, I'm sure they would have line up for hours."
/user_details?userid=c4lTZbA8NeZBgB1YYB6Izg,Julie C.,"Montreal, Canada",3 star rating,"This restaurant is in front of my house. I wish so badly I could give them a 5 star review. The food and service is fantastic. The only thing I would say is that the portion size is small for the money you're paying. I really love the braised beef soup which I've gotten 3 times now. It comes to be around $17 with tip and tax. I always leave each time feeling like I should've ordered two portions because I'm not quite full enough (and I don't think my appetite nor the portion sizes I'm used to are unreasonably large). I would still probably come back because I really do love the people there and I do like the soup a lot. I just wish it was either slightly cheaper for the same size, or the same price as now but slightly bigger portion size. I've also tried their popular ""fried chicken"" and rice. The food here is quite good. Above average for sure - but overall, I'm not sure if it is worth the price point."
/user_details?userid=Jlb_wgkmpvsh9QqjjgH-NA,Huiying W.,"Manhattan, NY",3 star rating,"The taste of the food is ok, fresh ingredients. The only problem is, it's too oily. I had the take out pad thai, there is a layer of oil at the bottom of container."
/user_details?userid=yIFyaNq4oCLoYkY1Gi0XAw,Corey D.,"Brossard, Canada",4 star rating,Adorable little Thai eatery in McGill ghetto. The menu has a good selection without being overwhelming. We tried the spicy porc belly and pad thai. They were both delicious. Their home brewed cold teas were also good but a little on the sweet side.  Staff is friendly despite the quick turnover of tables and in and out of people coming in for takeout. Portions are a little on the small side. I was still hungry after eating. They have gluten free options on the menu as well. I will be back! I'm gonna try the entire menu.
/user_details?userid=K0KwRQ6r0W_1v4Bq_AZQMQ,Arfina M.,"Ste-Adèle, Canada",4 star rating,We went to the resto last night the food was great but the portion a bit small. The ambiance is amazing but the heater is not sufficient. Maybe we're going back in the summer.
/user_details?userid=3ZrY316WfsTrFKbUCc9waw,Diane M.,"Rotterdam, NY",4 star rating,"ExcellentWe actually found this place by accident and so glad we did!Did I say wow ???  We a party of 5 walked in with 25 minutes to closing.  No big deal to them.  Such great greetings.  Even took the time to talk to us about the menu and recommendations.  We were hungry so they took our appetizer order and quickly got that for us to start on.  I loved the decor.  Simple yet elegant.  Tin cans to hold utensils in.  We ordered 6 dishes to share.  We customized the heat level too.  10 minutes till the kitchen closed and special Request didn't bother them whatsoever. From what I was told the restaurant was up and running for about 10 days, you would never know it it already operated like a fine oiled machine. I can't stress enough how accommodating, how friendly, how knowledgeable the wait staff was in describing and recommending dishes. Everything was amazing. The fried chicken salad I am still talking about.  Good luck, with your new restaurant .  Not that you would need it !  Incredible value. We walked out with to go containers. This place is going places!!!!"
/user_details?userid=RU7K54qCLmGrgRgo39c70Q,YC N.,"Ville-Marie, Montreal, Canada",5 star rating,"Cozy place with a fresh modern twist on asian food. Food is delicious, we got the vege green curry and crispy pork belly. For appetizers we got the pork and beef set - super good and fun to dip into the sauce. Portions might seem small compared to other places but really they are more than enough to get you full without feeling bloated. Crispy pork belly was good but not much different from Japanese Katsu or Korean places. However the green curry is pretty unique and a must have!!! can't wait to come back for new dishes!"
/user_details?userid=dmprdDTSUebCPeTBGFxu5Q,Patrick E.,"Peoria, IL",3 star rating,Service was good and their menu had a lot of variety.  The food came out fast but it was just average. Not the worst Thai food I've had in Montreal but certainly not the best.  We ordered the chicken pad see ew and the papaya salad along with two Thai iced teas. The Thai iced teas were delicious and came out in little bowls. I give them props for creativity but I also felt cheated by the small amount of the beverage.  Papaya salad was okay but had some strange ingredients in it that aren't normally in papaya salad.  Pad see ew was disappointing.  The chicken was chewy and the flavors were off.  We could not finish it.  It was a nice place because it was open late but it was expensive.  There are better Thai options in Montreal.
/user_details?userid=dQ7n5YCdGd0CPCIyMTBDjA,Mike P.,"Kirkland, WA",5 star rating,Excellent Thai cuisine. Super nice staff/owners. The Thai cold drinks with homemade syrups are phenomenal!
/user_details?userid=q4RldrEv0Nt8tZrST3L_KA,Brian T.,"Cleveland, OH",5 star rating,"Unbelievably good food! Wonderful ambience, and the food couldn't of been better, it made me wish that I lived in Montreal. I enjoyed the spicy papaya salad as well as the seafood soup, and other members of my family enjoyed the chicken soup and the pad Thai. My daughter actually asked for her last meal in Montreal to be from the to go menu. Check it out!"
/user_details?userid=aN3cFJeTme2P7wuqYDLXvw,Micaela S.,"Manhattan, NY",5 star rating,"Delicious affordable food in a cozy atmosphere. Staff was very professional and very kind, accommodating and checking that everything was okay. Will definitely come back."
/user_details?userid=n_qegtThC71PIIvw6oWGzQ,Pr N.,"Colorado Springs, CO",1 star rating,"Bad service, literally inedible food.  This is by far one of the worst restaurants I have ever had the displeasure of experiencing. The food they served was literally inedible because it was a bowl of bones. They claim it is their chicken curry but it is all chicken bones and skin packed into a bowl, covered with some curry. It is like a soup with nothing but bones and cartilage in it, not only large bones and knuckles, but also many tiny and sharp bones that you could easily choke on, break a tooth or cut your mouth on. When I told them that my curry was all bones and wanted to send it back, they took it back to the kitchen and actually put more bones in it! The service is also bad, my dining partner did not receive their meal until at least 10 minutes after my bowl of bones was served. We noticed that other diners also did not have their meals arrive at the same time. I do not know how this place is even in business serving such disgusting fare, they should be shut down by the health department for serving food that can harm someone.  With so much amazing food in Montreal, please keep stepping."
/user_details?userid=AgBrRPkq3YtRKfAg6pgAZg,M L.,"New York, NY",5 star rating,"This was a great find in Montreal. My family was spending New Year's Day in Montreal and stumbled upon this little restaurant. The food was really good and flavorful. Between my husband and I we shared a papaya salad app, green curry and Krapow basil rice. My kids shared a bowl of braised beef noodles, which they really enjoyed. I highly recommend!"
/user_details?userid=BTRcfOlCrXfQXK5BjLydwg,La L.,"Montreal, Canada",2 star rating,Food was very mediocre. I had the green curry and papaya salad. Small portions for the price and taste was bland. Their other restaurant (Pamika) is far better and has similar prices. I would definitely recommend Pamika over this location.
/user_details?userid=bfjmL7CDXev_QPWEBHFZwg,Fatima B.,"Laval, Montreal, Canada",5 star rating,"Delicious food. Great employees. The fella at the cash is particularly nice.  Table cards provide you with fun facts about Thailand, so the experience is both educational and filling! Xoxoxo FM"
/user_details?userid=l3fBFHVxKl1ah5x3Fvz8zA,Peter S.,"Old Toronto, Toronto, Canada",5 star rating,Delicious and authentic. Have been there more than once and was never disappointed. The papaya salad is pretty good.
/user_details?userid=I9UYYYa2m10MsrLkhpf7Gg,Aslı E.,"Ville-Marie, Montreal, Canada",5 star rating,Super good super friendly service!! Definitely recommend!! My 6 friends and I all really enjoyed it food and experience
