user_url,user_name,user_city,user_rating,user_review
/user_details?userid=zZYpI2V_6C36JPa9Ul_bFQ,Alec Y.,"Richmond, Canada",5 star rating,"You haven't had Thai food like this before at the McGill ghetto/Plateau area. Mae Sri at Milton is a great choice for comfort if you're looking for lunch during the weekend! I'd describe this place with three straightforward words: tasty, convenient, and authentic. Take your pick between their various rice and noodle dishes, order upfront at the counter, and enjoy.It was a cold Sunday afternoon when I visited. The quality customer service appeared right away - the server sat me down and recommended me some fan favourites and personal choices. I decided to get the braised beef noodle soup ($16 after tax and tip) to warm myself up. In less than 5 minutes, the soup came - and how was it? Well, move over Nudo and Nouilles de Lan Zhou... there's a new noodle champion in town. The broth was aromatic and beefy, the braised meat was delicate, and the meatballs provided the salty kick that I was oh so craving. Add in the scallions for some freshness, and you have a deadly combination. I was honestly not expecting a Thai dish to be my favourite noodle experience in Montreal. But here we are!To keep it short, I expect to come here again. Several times at that. I wish they accepted Amex, but oh well. The next time you're craving Thai, give Mae Sri a shot."
/user_details?userid=oTXacfmCLz9mev6KORIfEQ,Anna C.,"Montreal, Canada",4 star rating,"We consulted the covid-19 yelp takeout list and decided to try Mae Sri. I had previously tried their sister restaurant Pamika and had been wanting to try Mae Sri ever since.Takeout experience was great. It's easy to order on their website, you a select a pick up time or delivery (Uber and skip the dishes). When I went to pick up my order was ready, they handed me my bag and that was it. Food was delicious and thankfully we ordered extra to have leftovers (delicious leftovers btw!). Fried chicken salad and the papaya salad were my favorite. I loved the marinades and the crunch of the salads. The green curry was also delicious and just the right level of spice. Baa Mee Haeng Moo Dang was also really good. It's essentially noodles, dumplings and what seemed like beets? It also comes in a soup form which is like to try next time.We also ordered the pad Thai, which was good but nothing special. Their other dishes are much more interesting and flavorful.Keep supporting your local businesses like Mae Sri, if you can!"
/user_details?userid=9nj5lry5KkSal22Oo9VGvQ,Cayla L.,"Brossard, Canada",4 star rating,"Mae Sri is one of my go to places for asian comfort food! The environment is very friendly but in winter, you would probably need to keep your coat on since it is pretty cold inside. Every time I go to Mae sri, I would order the thai milk tea because it is delicious!If you don't know what it tastes like, here is my definition: it taste a little bit like caramel milk tea. Don't forget to ask for less ice!!! If you don't eat spicy, you can ask for the papaya salad without spice. The salad is refreshing, it's a good amount of spicy, salty and sweet. The imperial rolls are alright. As for the main meal, I love love love and recommend the green curry. It comes with vermicelli on the side, a bowl of green curry and tender chicken inside the curry. The way to eat it is by dipping the vermicelli inside the curry and scoop all of that yumminesss in one spoon!I have also tried out other dishes before such as the Ba mee noodles and the pad Thai. The ba mee noodles are good if you are looking for a more fresh soup with egg noodles and char siu plus some fragrant spices. As for the pad Thai, I enjoy it whenever I want some sweet and salty noodles with the perfect amount of egg, chicken and shrimp."
/user_details?userid=bUPeHBFEINhqiKj9-k4-zA,Charles N.,"Montreal, Canada",5 star rating,"Move over Thai Express, hello Mae Sri! Are you looking to satisfy your mid-morning munchies while catching up with friends over over brunch or leisurely dinner without the complications of a lengthy sit down experience?Then you should take a look at this wonderful lunch counter who specializes in noodle soup bowls for mouth watering  selection of healthy, tasty and quickly delivered dishes - there's surely something to tickle your fancies!Admittedly, the menu has been adapted to the local taste,  but it doesn't take anything away from the fact that everything is homemade, recipes are authentic, not all are spicy, you chose what you want at the counter and they bring it to you and it's fast!Last weekend, I had the pleasure of satisfying my Thai food cravings over Brunch with a longtime childhood buddy and news friends... and oh did we fill our bellies with wonderful and tasty dishes. Items marked with a star (*) are must haves!Lab Kai Thod: Fried Chicken Salad*Po Pia Tod: Fried Spring RollsSet Tum Tad: Papaya Salad Special*Kuai Tiao Neua Tun: Thai Braised Beef Soup*Kuai Tiao Kai Tun Ma Rah: Bitter Gourd SoupKuai Tiao Ruea Ayuthaya: Boat Noodle SoupYen Ta Fo: Seafood Soup*Ba Mee Moo Dang: Ba Mee Moo Soup*... and some Thai Iced Tea with condensed milk.In speaking with owners, Pamika and Pascal, I was informed that another Mae Sri will open in the Plateau area on Mont-Royal street and possibly in Europe too! One more thing, if you are looking for a different type of dining experience, beautifully decorated space and access to a more elaborate menu, I invite you to try their other Thai restaurant called Pamika.P.S. Best time to get fast service is at 1pm on weekends or early evening around 5:30."
/user_details?userid=yERJfPKhhU49aJAJ6DvqEg,Sian D.,"Kirkland, Canada",5 star rating,"I've tried Pamika Brasserie Thai before, and I had an amazing experience. The food was absolutely delicious, the service was great, and the restaurant's decor was gorgeous. So, when I found out that the same chef, Pamika Sukla, was behind Mae Sri, I was super excited. Mae Sri, compared to Pamika, is more of a fast-serving ""street food"" style experience. You order from the counter and pay in advance, and then your food is brought to your table.  The decor is simple and practical, yet also culturally inspired. There is great natural light (for the pictures!!), and their location is super convenient if you are a McGill student (like me ). We started off our meal with a Thai iced tea and Thai iced coffee with condensed milk. Both drinks were extremely good and came in really cute bowls. I highly recommend the Thai iced coffee with condensed milk!!For the appetizers, we tried the papaya salad, the fried chicken salad and the Mae Sri fried rolls. The papaya salad is one of their most popular dishes, and for a reason. It is full of flavor and completely different from anything I've ever tried before. The rolls were also delicious, and are fried fresh upon ordering!! For our main meals, we tried the Mae Sri Pad Thai, the Baa Mee Moo, the Seafood Rad Na, the Green Curry and the Stir Fry with Thai Holy Basil. The green curry, like the one I tried at Pamika, was delicious. It also contained a lot of meat for the serving size, so we were very satisfied!! The Stir Fry with Thai Holy Basil was my favorite dish. It was really spicy, but so so good. It's packed with a lot of flavor and the portion size is really big. My sister, who I went with, was obsessed with the Pad Thai, for good reason too!! They also have to-go dessert packages: mango pudding or tapioca. The mango pudding was addictive!! I would buy half a dozen next time I go to bring them home with me  Overall, really good experience. Definitely recommend for a casual lunch or dinner experience. This location is especially convenient for McGill students, so I'm so happy that I found out about it!!"
/user_details?userid=g-y4Me4bqDz8jwFzX_e17w,Norine A.,"Montreal, Canada",3 star rating,"Mae Sri is definitely what it advertises to be, a Thai take out counter. It's a close walk from Place Des Arts metro. It's easy to walk past this place, because the door sign isn't visible. The decor us very nice, similar seating to Kinton Ramen with the block styled chairs. Nice you grab a seat, you'll find a small menu- drawback: there is no pictures of these dishes and everything seems to look like alike in words, but thank God for social media! The servers were actually quite friendly and honest about food portions and flavours, I really liked that. To order, you go up and order, pay and get a number like mandy's. To start we got the spring rolls x 4. These were good and no different than any Asian take out order. For the mains: wevopted to get a baa mee moo with noodles (12$) they comes with egg noodles, roasted pork, Asian Tak choy, dumplings and egg. I really loved this dish - better for 1 person than sharing. The second dish we got was the seafood rad na (15$) that comes with stir fry noodles, Asian kale, shrimp, calamari (barely any) and veggies. I did not enjoy this dish - it was a soupy very soupy but served in a plate - which made it hard to eat, and it wasa bit bland.  I tried the Thai iced tea tea (5$) with condense milk but didn't like it- way too sweet. More of an acquired taste. It cost 55$ in total amongst the two of us. I don't know if I would come back here, rather settle for Thai express."
/user_details?userid=ncAOj5Xz-XS6bpSnTWp3tQ,Austin G.,"Washington, DC",4 star rating,"Mae Sri is a small neighborhood Thai restaurant in Milton Park just several blocks from downtown Montreal. Here's what's to love about it:1) Food: It's among the best food we've had in the city. It's a hybrid of fast-casual and a sit-down restaurant. They seat you when you enter, but you order at the front when you're ready. They have a wide variety of options from all the usual Thai suspects (green curry, pad Thai, papaya salad, etc) and a few more unique items. I ordered the veggie green curry and the coconut sauce was perfect as were the noodles. My wife ordered a delicious pad Thai and papaya salad.2) Service: Compared to other restaurants in the city, the service is faster and more friendly. They also have a booster seat for kids. 3) Space: It's beautiful with tables and wood stools. There's window seating as well.4) Wifi: It's free and strong. The password as of August 2019 is ""maesrithai.""One thing to note:1) The Thai iced tea was not my favorite. It came out in a small silver bowl with too much ice and WAY too sweet. I almost didn't finish it.Overall, if you want good Thai food, go to Mae Sri!"
/user_details?userid=0Zswwlz4NzUJoG-skyWzIw,Tania L.,"Mississauga, Canada",5 star rating,"Didn't expect to find Thai food this great in Montreal! We purposely made a stop here due to the raving reviews, and Mae Sri definitely impressed. The concept is fast casual - you line up, and they don't take your order until there are available seats. After paying, you're then directed to an empty table to sit and eat.We ordered a papaya salad to share; I then got the Kuai Tiao Tom Yum, my sister the Thai Hainan steamed chicken, my Dad the Pad Kra Pao, and my Mom the Crispy Pork Belly. I sampled all, and they were all so delicious!Papaya saladThis appetizer was a pretty solid and generous portion - and quite spicy too! The spice added a pleasant kick to the raw papaya, with the lime balancing things out with a tangy sourness.Thai Hainan steamed chickenFor those who love the original Hainanese steamed chicken, you must try this out! My sister loves her Hainanese chicken, and we were blown away by this dish. The chicken was so silky smooth and flavourful! The rice was also delicious, having absorbed all the chicken oil / essence.Pad Kra PaoI only had a small bite of this, but it didn't taste vastly different from those from other places. By this, I mean it met expectations and was quite good nevertheless.Crispy Pork BellyThis was an interesting dish, and very delicious! The pork belly highly resembles the ones from Chinese cuisine, but are fried to be a great crisp and offer an amazing bite! Kuai Tiao Tom YumThis dish was the least exceptional, though the tom yum broth was still quite flavourful. It was the ultimate comfort meal, however. The rice noodles readily absorbed the broth, and offered a taste of home with each bite. I particularly enjoyed the many shrimps and the soft-boiled egg, though the meatballs were mediocre and not my favourite.Overall, the meal was amazing. The service was also quite friendly; the staff were all smiles and super accommodating. Would highly recommend!"
/user_details?userid=s_xEvGNM98O4SaFG8sNCSg,Vikram G.,"Jersey City, NJ",3 star rating,"Went there for Wednesday dinner and I must say it was crowded and 15-20 minutes wait time mid-week!! But again its a small intimate kind of setting. If you are driving here, parking is a major issue as all majority of the spots in nearby streets have resident parking permit requirement. You can't reserve a table, you need to stand and wait at restaurant.Coming to food, presentation is good but all dishes were way too sweet and had some fish after taste, some fish oil variant must have been used in dishes (Pad Thai and Stir Fry Vegi). Chicken Soup was good and flavorful but again not the best I have had in past. At least couple of staff members seemed overwhelmed with crowd in the restaurant."
/user_details?userid=3i1qKssMS5g_eJxN1HiHJQ,Amelia L.,"Boston, MA",5 star rating,"The Thai food was absolutely amazing! Such a little hidden gem. I got the pad Thai with tofu. The pad Thai sauce was unbelievably delicious, typically I don't eat all the pad Thai just because it comes in such a huge portion but it was so good, I literally couldn't stop eating and ended up eating the whole plate in one sitting! The place is fairly casual and such a comfortable atmosphere. The service was A+ as well!"
/user_details?userid=JmEji3_Tfo2__69aLLcLPA,Jing S.,"Brossard, Canada",4 star rating,"Situated on Milton street, near McGill University, this small restaurant is all you need for a Thai fix during finals.I ordered their kuai tiao Tom yum soup; basically a sea food noodle soup. It was quite good; tasty good amount of sea food; calamari and shrimp, for the price you pay. Not very spicy. The presentation is superb. My friend ordered pad Thai; unfortunately it wasn't to her taste. There's better pas thais. I had a bite; it was ok. I was happy with my soup noodle. Overall, friendly staffs,  cute little place for a quick Thai snack after school or in between classes."
/user_details?userid=8tjx6xsOigLJC07y7yA2BA,JiaYin C.,"Le Sud-Ouest, Montreal, Canada",5 star rating,"I ordered their Sukhothai Noodles: cold rice noodles with fresh veggies and different types of pork meat. The food presentation was beautiful and the portions are reasonable (if you're hungry: get a side dish!). The noodles came out a little soggy to my taste, but the sauce makes up for it: each bite tasted delicious and the flavour is perfectly balanced! A little bit spicy, sour and sweet. They also have Thai condiments to season your food. A must try! Their desserts tasted okay.The restaurant's ambiance and the decoration is really nice: casual and chic. Even though their place was packed, their service was quick and we didn't had to wait long before getting served.Definitely a place to visit with friends for a quick bite!"
/user_details?userid=dKKvpFh7QrplB3e0EEh8Rg,Rebecca T.,"San Marcos, CA",5 star rating,"Food was delicious here!!! We tried their noodles, curry, boat noodle soup, appetizers, they all tasted wonderful and according to my friend, it's not common in Montréal to have delicious Asian food!They opened not long ago but has already been busy because we saw people still coming in as late as 10pm. The service was great and friendly. The food came out pretty quickly too. The dining room had stool chairs so it's not the most comfortable seating but it's OK. The air circulation could be better. We hanged our coats on the rack and came out smelling like grease haha. Good French pâtisseries and restaurants might be everywhere in Montréal, but it isn't easy to find an authentic and delicious Thai restaurant. It's wonderful to see such a restaurant in the city."
/user_details?userid=LP-8DbFrARGiEavU4BcI6Q,Sha Y.,"Brossard, Canada",4 star rating,"My cousin recommended this place to satisfy our Thai street food dishes cravings.The resto is in the McGill ghetto so expect a lot of students. It was packed but the service was fast which is fitting for the concept of "" cheap "" street food. You have to order at the cash and they bring your dishes at your table. The place itself is simple but well decorated. The service was good and fast. We don't find Hanainese Chinese often on menus so my friend and I both ordered that dish out of curiosity to compare to what we had in Thailand. It was quite tasty! My cousin ordered the green curry dish which he found good but tad too sweet for his liking. The dishes are overall quite tasty but portions are small. Perhaps more authentic than other Thai restos but of course not comparable to dishes in Thailand :p  They don't serve alcohol which was too bad.I would still come back if I'm around the neighbourhood to try other dishes. Oh and I noticed there were quite a few vegetarian options on the menu which is great."
/user_details?userid=aGJnMKMTt0oy-kOewd0ysA,Nicky E.,"Boston, MA",4 star rating,"I really enjoyed the set up here - it was casual, but also trendy and chic. I got the pad thai, and it was beautifully presented, delicious, and filling - but not too too much food. The flavors were great, but not overwhelming, and it was perfect for a fairly large group of people - the long tables were perfect!"
/user_details?userid=tgCdfvfaBC7kuv6vn_y3AA,Charlotte L.,"Le Sud-Ouest, Montreal, Canada",5 star rating,"Very good Thai restaurant! The food was really good, full of flavour, well balanced and spicy enough! I particularly enjoyed the beauty and coziness of the place. Especially at night since the lightning and decorations are very well chosen. The service is quite simple (you chose, you pay, you sit), but the plates get to your table really fast!Overall loving this place and strongly recommend it!  The Pad Kra Pao was my favourite meal! And the price are good for the quality and quantities."
/user_details?userid=eMdgOvazao0q-bX-DpYouQ,The City Craves T.,"Mercier-Hochelaga-Maisonneuve, Montreal, Canada",5 star rating,"Not to be dramatic... but Mae Sri serves the best authentic Thai food in the City of Montreal! They have so many great dishes for everyone- vegetarians, people who like spicy food, people who can't handle the spice, etc. Their menu is inspired by the street food in Bangkok and we really think they pulled it off- even though we haven't made it to Bangkok for a visit yet! We tried so much and enjoyed it all!To start, we tried the Thai iced coffee with condensed milk and the Thai lemon iced tea... loved that the drinks were filled with little ice pieces, instead of the usual big cubes and loved the touch of the condensed milk in the coffee, it's worth a try.For the appetizers, we tried homemade Mae Sri fried rolls (nothing like any spring roll you've ever had), the spicy papaya salad and fried chicken salad. That papaya salad really lives up to its hype! Regarding the main meals, we tried (among other things) Baa Mee Moo, Pad Thai Mae Sri, green Curry with rice noodles and the seafood Rad Na! We recommend the homemade pad Thai and the green curry with rice noodles the most- even though we were pleased with everything! The pad Thai is is packed with such delicious and real flavours- we've only ever had it in a fast food place, so it was such a different experience this time.Out of the desserts offered to us, we preferred the mango pudding! So sweet and a perfect way to end such a delicious meal in good company! Something that really stood out here was that all the ingredients were just so fresh- were stuffed at the end, but a good stuffed lol Thanks to Gabriel for the amazing service and for explaining the menu so well :)Thanks for opening our eyes to authentic Thai food, we will definitely be back!"
/user_details?userid=yphnJ8zYbJF7Y3QbtMj91g,Shahanaz B.,"Southwest, Montreal, Canada",3 star rating,"A tiny and beautiful restaurant; with golden color chandelier and wooden tables, chairs and walls. I arrived early, took five spots for me and my friends. Within the 10 minutes the restaurant was filling up. I was worried I am going to loose the table if my friends weren't there any time soon. The host of the restaurant, came to tell me the same thing as I thought of loosing table, which I understand but the host was had a very threatening tone. He was creepy and scary. Thankfully, my friends arrived. Their system is you order your food at counter and pay. By the time, it's ordered and paid, my food arrived right away on my table. It was quickest service ever! I had the papaya salad which was so good, spicy, flavorful, fresh and so delicious. My vegetarian rad na was a disappointment; it hadn't any flavor; it was so bland. It's a 50/50 with this place."
/user_details?userid=RJe_w0M66fXdpRkH2E7nRg,Emillie S.,"Montreal, Canada",5 star rating,Best night market style Thai food in MontréalService is amazing ! My favourite dish is crispy pork with fried egg on top of rice.
/user_details?userid=5ca2MkCJFAMafDrRxLMlXQ,Ash L.,"Montreal, Canada",5 star rating,"This place is inexpensive, authentic and hip. The vibe is a bit like Harbin dumplings. Hidden in the Mcgill ghetto, this is the best Thai restaurant within 20-30min radiance. What I appreciate the most is how they are bold enough to not removing those ""weird"" but authentic Asian ingredients just because some locals find them too ""special"" (while, those picky locals can always order an pad Thai and be super happy with it). However, order some spicy noodle dishes if you want to try some ingredients that you would not find in any other Thai restaurants in Montreal."
/user_details?userid=7FoE5PH5CV6I6ZEfxVG5rg,Kobsupang R.,"New York, NY",5 star rating,"I discovered Mae Sri through Uber Eats app while visiting Montreal. Given that they have only been opened a little over a week, we weren't able to add rice and drinks to our order so I decided to walk over to the restaurant (only a few blocks away from our hotel). I was very impressed by the staff that was very helpful and gave us free rice for the inconvenience. The next day we ordered from them again because it was cold out and we didn't feel like going out. I'm Thai so I'm pretty particular and will only write for a Thai place that I think their food is authentic and tastes like what I had back home. I ordered the Glass Noodle Salad (Yum Woon Sen with Moo Yor) and it was really really good like what my grandma used to make for me. I've also tried their Ba-Mee- Moo-Dang (Yellow Noodle with roasted pork) which I would recommend as well. I'm glad that I have found a Thai place to go to next time I'm in Montreal!"
/user_details?userid=KBoIRjxSW7OWczv8OS9Bew,Xue L.,"Verdun, Montreal, Canada",4 star rating,"Good food, but small portions. We were 4 and ordered 6 different dishes to share. The pork and beef set and the glass noodle salad were just ok, nothing amazing. The hainanese chicken and rice was good. The pad thai was delicious and has a good peanuty flavor. The crispy pork belly was flavorful but it wasn't crispy at all. Their thai iced tea had a good tea flavor, but it came in a tiny jar. Overall, the food is good but the portions were very small.  Even though we shared 6 dishes, we left the restaurant hungry and went to get food somewhere else. As for the restaurant itself, it's clean and cozy and has a good vibe. You need to order at the cash register and then they bring you the foodto your table. The staff were nice and the service was quick."
/user_details?userid=Bhe156ZrEhZrr6KL1d_IdA,Nathalie L.,"Le Sud-Ouest, Montreal, Canada",5 star rating,"Definitely the best pad thai in Montreal! The food is all so delicious. I really love this restaurant, such a great ambiance! And the staff is so nice and give a great service!"
/user_details?userid=8gZwPyesnY2mDiN5E_pmzQ,Brandon S.,"Pointe-Claire, Canada",4 star rating,"Hello Yelp,Mae Sri is a fine counter Thai establishment. Based on the lore, Mae Sri is the mother of the famed Pamika. For reference, Pamika is the genius behind both Mae Sri and the Pamika Brasserie on Sherbrooke. Now, the food:-I have tasted the Tom yum soup. This soup was truly excellent. My gf and I talk about deep into this quarantine. We would order it for take out but soup does not travel. Or does it?Now , the green curry was also excellent. However, the green curry at the Pamika brasserie is #1 my books. Now price -extremely fair , amazing value if I'm being blunt. -ambience, it is an order at counter and then a waiter bring you your food. Casual and well decorated with Thai adornments. Also, since I've been to Thailand I'd like to think I know a thing or two about Thai food! Brandon"
