user_url,user_name,user_city,user_rating,user_review
/user_details?userid=eQ-ukSPHXYvUhYR_wysd8A,Lily F.,"Brookline, MA",5 star rating,"Really gorgeous interior with exposed brick walls, hanging basket chairs, and beautiful plants. It was fancier than I expected though, and also super busy during lunch on a weekday. I ended up ordering something to go - the truffles and caviar dish, which is zucchini spaghetti, oyster mushrooms, parsley, tapioca caviar, and a creamy white sauce. It was really yummy, but I wish it'd had a source of protein, like veggie chicken. Staff was super friendly and my wait time wasn't long for takeout. Apparently they're going to open a location in NYC shortly, which is exciting!"
/user_details?userid=97YdD8tkMkUSvGUw6_u4GQ,Rebecca C.,"Oakland, CA",3 star rating,"3.5 stars. Some solid dishes at this vegetarian restaurant with nice ambience but it wasn't one of our best meals in Montreal. The service was so so, it took almost 20 minutes between the soup and our second courses. And they totally didn't follow our request on bringing things our 1-2 dishes at a time. The pairing of the dishes was a bit bizarre, with poutine and onion rings at the end.MUST HAVE'S:Pea quinoa cake - light and airy full of spring flavors from little peas. Well-executed and delightful.SOLID:gazpacho - typical standard fareCari cacao - rice with curry carrot, squash, kale, and cashew. Comfort food. Good to share. SKIP:Fried onion rings - the onion rings are too thick and big and the the fried dough around the onion rings was not crispy.Vegan poutine - this one was sweet potato fries with soy sauce-based gravy and tofu like imitation cheese on top.  The alteration from the real poutine was disappointing. We wished that we just order sweet potato fries on its own instead.Gnocchi - pesto gnocchi on a bed of arugula. The combination of the ingredients didn't quite make sense. Texture of the gnocchi was quite good but i didn't love the pesto sauce."
/user_details?userid=gEtdFQBqJXj0MgPtANGisw,Mitch J.,"Rockford, IL",5 star rating,"I LOVed this place (sorry, how can you not). I'm normally  not a vegan fan, but you could never tell this place is vegan. All the food is super healthy while still managing to be super tasty. I ordered the gnocchi and it might've been the best gnocchi I've ever had, even compared to others that have had actual cheese. It was incredible. The smoothies were decent, and the coffee offerings were great. The service staff were awesome--super friendly and ready to assist however they could. We never felt rushed, but only felt welcomed. Also, I could go on and on about the atmosphere here. Check out the pictures of the interior and you'll see what I'm talking about. Literally the only downside is the higher prices, but I suppose you get what you pay for. A great spot that we'd come to an embarrassing amount of times if we lived closer."
/user_details?userid=oR5az_eNCnfN7e49H3ONhg,Rebecca H.,"Worcester, MA",5 star rating,"This place was absolutely exceptional. I've heard from Olivia Wilde forever ago how amazing Montréal is for vegan food. I knew that was a priority when we decided to come to MTL for a quick weekend getaway. LOV is a formidable contender on both yelp and Google searches. We made a reservation at the most convenient time available at late notice: 9pm. After a few pregame drinks, we arrived to find a mostly full restaurant, even at that hour on a Saturday night. The menu is outrageous. After some deliberation, we arrived at our selections. I guess it was busy enough that our server kept us waiting to order for a hot minute. Another server either by pure observational skills or bc they overheard me express my impatience, came over to take our orders. For drinks I ordered the lilikoi with tequila, passion fruit, mango, lime, and pistachio. Tina ordered a Moscow mule. Hers was standard, nothing special, but mine was AMAZING. I would've ordered another one if I had the opportunity. For our actual meal, I absolutely had to try vegan poutine. It's listed a side, so don't experience the wave of terror that I went through after I couldn't find it in the appetizers. This frankly was one of the best things I have ever had the pleasure of placing on the tiny tongue protrusions that make up my taste buds. The ""gravy"" is incredibly flavorful, so much so that I scooped up the remnants with my fork afterwards. The cheese curds were not as satisfying as real cheese obviously but did the trick. The fries were crisp. I would eat this way too often if I lived in MTL. We ordered the banh mi burger and the gnocchi di casa for our mains. The burger was INCREDIBLE. The tofu was thick, breaded and flanked with slaw. An explosion of flavors. The gnocchi was tasty as well. I detected a slightly nutty tone. They were engulfed in a delicious pesto sauce and dusted with parm. This place has amazing food. The service leaves something to be desired but the food is so fantastic it makes up for the service issues."
/user_details?userid=EO49noCE6deJZXcf1Zrd0A,Chanhong L.,"Alexandria, VA",5 star rating,"Of course we chose to eat at LOV during the one meal they don't serve poutine-weekend brunch! I didn't find this out until later. This was very unfortunate because I was very much looking forward to trying vegan poutine and because our back up plans failed until the end of our trip. Nevertheless, my boyfriend and I ended up sharing a very delicious apple french toast at LOV to jumpstart our Montreal vacation. Unfortunately because we were new to Canada, we hadn't fully grasped the USD to CAD rate. As a result, we thought our tiny french toast was a little pricey, but it only ended up being 12 USD with tip and tax, so we totally could've tried another delicious entree! With this knowledge in hand, I will most definitely be returning to LOV the next chance I have. With so many locations, including this one conveniently located in Downtown Montreal, it'll be hard not to!P.S. The menus are now bilingual with French on one side and English on the other."
/user_details?userid=FJL0x-PVW9u6WGE1iZe3Bg,Ravi C.,"Jersey City, NJ",5 star rating,"LOVed this place on McGILL.  Great good, excellent service, wonderful taste, excellent ambiance.Make a reserve because it gets busy.Everything is vegan.  In Montreal they tout their poutine, however if you are vegan this is not something you can try....unless you go to LOV.  Would definitely go back!"
/user_details?userid=thdKkC601infVVh7XM0qDg,Neda I.,"Toronto, Canada",5 star rating,"Loved the food and the service. The staff was very attentive to my needs and the food was delicious. I got the caesar salad and the zoodles. The atmosphere was very pleasant (not ideal if you're looking for a silent setting).For anyone from Toronto, the vibe is similar to Fresh restaurants (more specifically the location on Front street).Would definitely go again and recommend to any friend visiting Montreal!"
/user_details?userid=zYPvMZS4XwEL0AH-MuSfow,Blake A.,"Honolulu, HI",5 star rating,"Walked in on a Friday night with no reservation with a party of 3. Only later did I realize it was one of top restaurants in Montreal...boy did I get LUCKY! Also, I was terribly underdressed and I apologize for that. Outside of the restaurant - gorgeous. Inside of the restaurant - gorgeous; looks like the set of a romantic Shakespeare novel. Food - fantastic. If vegetarian food was this good everywhere, all the time, I would be a devout vegetarian. I would convert and never look back. Everything tastes fresh, good good flavoring, the wait staff was amazingly helpful and friendly. Not to mention they spared me any embarrassing remarks for wearing  junky clothes to their posh restaurant. This is definitely one of the best places I've eaten. 1000% recommend."
/user_details?userid=oCKtbgKBtYb44q1zqqefNA,Rosalie C.,"Milwaukee, WI",4 star rating,"#veganWe booked here in advance for dinner and it was a good thing. Friday evening and the place was packed with a line at the door! I LOVE the decor. It is all white with old wood, old windows, baskets, yellow lights... I mean it was just stunning inside. Felt so fancy even though I was just in sweatpants. The staff is amazing. So kind and so attentive. They seat you, they clear your plates, they even unnecessarily cleared and replaced our cutlery once. It was quite an experience. A++I got an alcoholic chai/chocolatey tea. It was okay. We split poutine and kimichi (?). The rice ball and grilled cauliflower was decent, sauce could have used a touch more flavor. The poutine was ok. I had had some better poutine earlier in the day but overall I would get it again. I got the cheeseburger. This was also good. I think it may have been a bean burger, very dense... but a lovely fluffy bun and melted cheese and sauce. Montreal seems to know how to do burger sauce well. The cesar salad was awesome, finally some vegan croutons. For dessert I tried the chocolate icecream, which is mostly a coconut base and yet doesnt taste like coconuts so yay! I tried the creme brule, I honestly do not think Ive ever had it before, even nonvegan- YUM. Way yum. I took a bite of brownie, didnt love it. I took a bite of cheesecake and didnt like that. Overall I would say the food is in general OKAY. The decor and staff were great!! The price is.... very very expensive. Appetizers, meals, desserts, and a drink each for 3 people was $200. Perhaps the most expensive bill Ive paid. I will not do that again anytime soon but I am very happy with the experience and would encourage you to go!!"
/user_details?userid=VO5CusoWMSr-29B0mUgAeA,Kim S.,"Los Angeles, CA",5 star rating,"I love this place! The ambiance, the decor, the food, everything! I was so surprised that there are so many vegan restaurants in Montreal, AND they are good! It's hard to get in this restaurant without reservation. I'd definitely suggest anyone who wants to try it out to spend a few minutes to make a reservation online. The staff is very friendly attentive and sweet. We had risottos, lasagna, truffles caviar mushroom, and poutine. Every single dish was delicious and surprising, especially the seasoning on the crispy oyster mushroom was a must try! Highly highly recommend this place to everyone who is in town. Give it a try, even if you're not vegan, you'll love it!"
/user_details?userid=ys3IJ6orjC5_gaScXlBKxA,Amanda A.,"Oakville, Canada",5 star rating,"Had to try this place out because I saw it on Buzzfeed's Worth It. Hence, why we ordered the kimchi fries to start, which were excellent. Perfectly balanced: not too spicy and not soggy from too much sauce. For our main course, we ordered the vegan lasagna which was amazing and paired with a surprisingly delicious Cesar salad. The whole atmosphere was also beautiful, great for taking Instagram pictures!"
/user_details?userid=RwQUv7Cn61gTkPXcytSrSQ,Amy Yu T.,"Montreal, Canada",4 star rating,"I've been here twice and my experience was quite consistent. Ambiance: this is why I'm giving the restaurant a 4 star. The decorations were quite charming and the way everything is placed was lovely. There were a row of swings, a fresh flower on each table and the general atmosphere was pleasant. I would come here from celebratory occasions to a casual meet up with a friend. The service was polite and attentive. Food: this aspect of the restaurant irks me a little. I ordered sweet potato friends and they came out covered in salt, which overpowered the sweetness of the sweet potato. My risotto came out a bit cold and it was good, but isn't on par with other risottos that I've had. It lacked flavour and creaminess. Overall, good experience, especially for vegetarians/vegans."
/user_details?userid=x9f5mbYpgdssyHaDI6jnvQ,Eman S.,"Chicago, IL",5 star rating,LOVed LOV;) I mean if you're in the area of Old Montreal definitely stop in here for some salads and drinks or vegetarian /vegan options and cocktails after a day of walking around....you will LOV LOV it;) Great yummy fresh food & Bali vibes inside......
/user_details?userid=khRG2oMmAOXA7C1U7P1j4w,Michael L.,"Montreal, Canada",3 star rating,"Nothing special. I got the veggie LOV burger. It was around $14, pretty reasonable until I found out that it did not come with some sort of side dish such as french fries. Although the LOV special sauce was tasty, the burger lacked flavour.If you do plan on going to this restaurant for its unique meal preference (vegan), I would recommend getting a side dish to accompany any main meal as they are not filling enough (the waitress had to even suggest to almost everyone that the meal they respectively chose would most likely not be enough food). The atmosphere is quite nice, beautiful area in old Montreal. The restaurant has a ""Cali beach side"" feel to it which is nice."
/user_details?userid=VClRFo4FaJKhGIyTQcoHVg,Urvi T.,"Jersey City, NJ",5 star rating,"Walking into LOV there was only one thing going through my mind: Hunger. My companions and I were extremely famished and were looking for a place that can satisfy our vegan needs. We were immediately greeted by a light feel in the air, one that reminds you of grandma's cooking, and following that sensory revelation was a kind waiter who gave us options as to our seating preferences, contrary to the behavior of many in the industry. At the table we were greeted by a simplistic and homey ambiance, one with a hint of elegance to exemplify that you've arrived at a place of class. And the classy qualities did not end with just appearances, the food followed up and satisfied. With a variety of options and each dish vying for the best on a list of many, my group and I were surprised and delighted by each subsequent plate, and constantly asking for seconds. The taste was amazing, although that does not truly do it justice. If I had to describe it properly, all I can say is this: you must try it yourself. Our favorite dish by far was the Poke bowl, which blended flavors of seaweed, wood mushrooms, and mango to entice my taste buds for another bite. All in all, the ambiance at LOV was great, the service at LOV was great, and the food at LOV was great."
/user_details?userid=2mCtmrp5MFgMoZNDp2XTnw,Cat Y.,"Los Angeles, CA",5 star rating,"This was my first time in Montreal and every one was telling me to try the city's poutine. However, I'm allergic to dairy so I was so excited when my cousin showed me this vegan restaurant. When we stepped in, the decor immediately attracted me. It has cute swing seats in the back and hanging plants at the front windows. I ordered the almond milk cappuccino, cream cheese bagel, gnocchi, big lov burger, curry, and of course the poutine. The cappuccino was pretty good. There was nothing special to the curry. My favorite was the big lov burger and the poutine. The big lov burger is probably the best vegan burger I've ever tasted. Usually the patty gets pretty dry but this burger was very juicy. My cousin said the poutine does not taste the same as real poutine but it still tasted good! Just different. For dessert, I ordered the blueberry cheesecake and that was amazing! Like the poutine, it doesn't taste exactly like real cheesecake but it is very good. The consistency is the same! I really enjoyed it. I would definitely come back again if I visit Montreal! I think this restaurant is a must if you eat vegan food or want to try vegan food!"
/user_details?userid=F3QKNUhTgNh6m0J9thujtg,Natalie W.,"East Side, Vancouver, Canada",4 star rating,"This restaurant is so beautiful on the inside. The decor is bright and lovely. They have wicker baskets as the light fixtures, a few hanging seats, and plant wallpaper. The tables looked like marble on the tops, and overall had a really nice aesthetic. All the food we tried was tasty and plated nicely. The mac and cheese was creamy, even thought there wasn't any dairy. The dumplings were crisp on the outside and had a nice kick from the almond butter kimchi sauce. The hero 2.0 bowl was flavourful and a little bit spicy. I liked how each ingredient was cooked and not soaked in all the sauce. The bok choy was a bit crispy for the leaf part, and the broccoli still had some crunch. When we walked by another table, the onion rings looked good so we had one order. It was massive. It came with 5 huge onion rings. They were super crispy, but my mom found it to not be that flavourful on its own. Overall, this was a great place to get some vegan food.  The atmosphere was lovely and service was great. I'd definitely come back and would love for them to open up in Vancouver!"
/user_details?userid=HUkLmF3TUDZQRw7kfw0Pxw,Kartik G.,"Boston, MA",5 star rating,My go to vegan restaurant in Montreal. Heard them from one of the YouTube channels that I follow and wanted to give a try. Service was excellent and the food was good as well.
/user_details?userid=_MeA1exOjobDz9J6cGaglA,Nick G.,"Toronto, Canada",5 star rating,"I visited this restaurant as an inspiration from the show Worth It and I have to say it was worth it. Their fries were so light and different from traditional fries I've eaten, which mixed in very well with the sesame sauce and kimchi. I can see why this restaurant was a Worth It winner and I would recommend this place to anyone for vegan food. I also tried their house burger on the side and it is a really close competitor to the Beyond Meat burger (which they also serve here). I'd say this burger is easily second place to the Beyond Meat one I've had at A&W.In the back, they have some hammock seats you can sit in to relax, although I saw no one sitting on them at the time. The balance of greenery with the white space was very well done."
/user_details?userid=wmXYo8UbPon5woxlOvVptA,Vanessa H.,"West Windsor Township, NJ",4 star rating,"Beautiful beautiful restaurant. It is so aesthetically pleasing as soon as you step in. The service is incredible too. Our waiter was all smiles and extremely friendly. I ordered a Lov mimosa and my SO ordered a beer. For appetizers, we ordered the dumplings. They were completely fried and stuffed with mushrooms and veggies. They were crisp and soft on the inside. The wrapper wasn't the same traditional dumpling wrapper. It fried differently. For mains, We ordered their version of Pho and the truffle and caviar. The pho was so different and surprising. I really enjoyed it. It packed a ton of flavor and didn't need the additional topping a normal pho needs. I was so surprised. The truffle and caviar was just as interesting. They used zucchini noodles and tapioca for the caviar. The truffle flavor was definitely there.Overall, I really appreciate how creative their menu is. Everything is pretty delicious, just a tad pricey. If you're vegan/veg check it out."
/user_details?userid=5QrlMMzUq_RoUlEyH2zcig,Judy K.,"Montreal, Canada",3 star rating,"Haven't tried a lot on the menu; however the avocado toast with poached egg was really good; easy to cut, nice taste, could of used a little more avocado spread. Beautiful presentation. Add the organic hot sauce they have to it. The sauce isn't hot by any means but has wonderful flavour.The beet salad is really good, could do with a bit more beets. However very tasty none the less and a good sharing size. The lack of beets was probably due to the time we ordered the salad at. *see service comment as to why.The service was ok. It took a bit to get our waitress to stop rushing away from us so we could order. We placed our drink orders and before I could order our enters she ran off, essentially while I was mid sentence. we ordered our entrees  and when we went to order our main courses she told us the kitchen was closed and we could order form the snack menu. She never told us the kitchen was closing and when we asked what time the kitchen closed at she said 3:00... when we asked it was 3:02!!!!!! It was a bit of an issue to have her at least ask the kitchen if they'd make our salad we wanted. She reluctantly asked and they graciously said yes. (YAAAY for awesome kitchen staff!) she gave my friend a lot of attitude about us missing the last call for the kitchen... all this could of been avoided had she just mentioned the last call for the kitchen was at 3:00.Beside that little incident, she was pleasant but not really attentive and the restaurant wasn't overly busy so I don't see a reason for the lack of attention.The decor of the restaurant is absolutely lovely. It's all white brick with pretty plants and it's very bright.Would defiantly visit again; I can't wait to try more of the yummy looking food from the menu and I'm hoping the service is a bit better next time.  Would definitely recommend!"
/user_details?userid=wWHeaOS28fnCnFN1Pmo3xg,Shaan A.,"Thornhill, Vaughan, Canada",4 star rating,"LOV is a really great spot for dinner. I made reservations but needed to push back the time slightly, and they happily accommodated my request. I arrived to the bustling, fragrant atmosphere and was greeted immediately by the friendly staff. I saw LOV on an episode of Buzzfeed's 'Worth It', and I was so excited to try. I highly recommend getting reservations as it does get quite busy. The menu is not too large, but every dish is thoughtful and seems super tasty. Every dish here is vegetarian and some are vegan too - honestly the perfect type of restaurant for me. The decor is very nice - complete with aesthetic marble tables - though the indoor lighting is not the most ideal for food photography. They do have a patio which I would be open to trying in the future -  but it was a cooler night when I went. It was really hard to make choices, but I finally decided on kimchi fries as an appetizer and gnocchi as my main. The wait time for food preparation is a bit longer, but the restaurant was quite busy. The kimchi fries came out piping hot and crispy - but really what made the fries amazing was the aioli - it was made with a soy emulsion and tasted amazing. The gnocchi is also one of their most popular dishes and I have no regrets - it was satisfying as the filling wa sweet potato, yet light as it was made with a pesto sauce. The price point was also quite reasonable! I paid $30 after tax for 2 items. The atmosphere was a bit loud as the restaurant was narrow, but honestly LOV was great. Definitely a place to try in Montreal."
/user_details?userid=jt49xjEjQisu6wTTGn6B3A,Annette J.,"Ann Arbor, MI",4 star rating,"I'm not a vegan but I play one on TV. Ok, not on TV. But as someone who just likes food full-stop, I appreciate deliciousness in all forms and Restaurant LOV delivers in spades, all dairy and meat free!First off--holy moly is the space beautiful. It's truly stunning in there. It's bright and calming, with lovely foliage set against off-white walls. Lovely as can be!Second--the food is quite tasty. The kombucha onion rings might have been some of the best onion rings I've ever had. They weren't heavy or overly greasy in the slightest and had a delicious crunch and flavor. The dipping sauce was a little bland but the rings were flavorful enough on their own that I wasn't disappointed in the slightest. But something extra to give it some oomph (siracha? garlic? herbs?) might really take it to the next level. I also had the LOV burger, which was also tasty. The patty was not dry in the slightest (which can happen with veggie burgers) and had great flavors/spices mixed in. It came with a vegan cheese, onion, tomatoes, lettuce, pickles and a special sauce. Simple but quite good.Service was a little on the slower side but my colleague and I were busy chatting and catching up so it was nice to not feel rushed. Although if you're in a hurry you might want to tell them up front."
/user_details?userid=3vGiPNH4yCAj88-kfdvbjw,Noha G.,"Montreal, Canada",4 star rating,"I'd been wanting to try LOV since it opened in Montreal but never had the chance until a girls night here a few weeks ago. We came here for dinner on a weeknight and I was pretty floored at the gorgeousness of the decor here - it's so beautifully decorated/furnished that it makes you want to instantly eat here (read: IG-worthy place!) We ordered the soup, jack fruit fritters, and LOV poutine to start (the fritters were delicious!). We then had the risotto, pesto gnocchi, and coconut curry as our mains. Every dish was artfully presented and delicious. The gnocchi and curry surpassed the risotto but all the dishes were yummy. The prices are a touch high but worth it given the ambiance, service and food. Keep in mind that the portions are very generous so if you want dessert, skip the appetizer! Would definitely recommend LOV, and am looking forward to my next visit! definitely best vegan place in town!"
/user_details?userid=7qwOmEFkHcMwc6x8H4i6eA,Hazel A.,"North York, Toronto, Canada",5 star rating,"I heard about LOV from the series 'Worth It' so when I was in Montreal I knew I had to try it out! The atmosphere was very warm and inviting. My boyfriend and I were seated at a high top and were served promptly. We got the Lilikoi cocktails, the banh mi burger and the kimchi fries to share. Each item was absolutely delicious! We are not vegan but we do enjoy having meatless meals. Each dish was packed with flavour and did not disappoint. We also got the spritz les iles and the mojito kombucha. Drinks were amazing as well. Service was also excellent. We would come back 100%!"
