user_url,user_name,user_city,user_rating,user_review
/user_details?userid=KBHTIaz-OdXukREefkP4qg,Gabrielle L.,"Montreal, Canada",2 star rating,"I came here with two girlfriends on a Tuesday. The place is really cute and nicely decorated. I like the hanging chairs even though they pretty much serve no purpose. The service was very slow and the place was not packed. I waited maybe 15 minutes for my friends to arrive and the waiter did not offer me any water and did not ask if I wanted a drink in the meantime. It took awhile to get our food and the waiter brought one cocktail at a time. Also when the waiter saw that the water jug was empty he wasn't going to fill it up! I had to ask him to do so. I started with the Egyptian Karkade cocktail, which consisted of dark rum, saffron, hibiscus lemon and angostura bitters. It was not good. :( My friends tried my drink too and they all didn't like it either. I then had the Pina Koala mocktail and asked the waiter to put white rum in it. It resembled a pina colada and that drink was actually good. It was made up of coconut milk, pineapple, eucalyptus, kombucha and mint/chlorophyll. I then decided to stick to Beau's beer and play it safe.We all had the poutine. The sauce is miso based. The poutine was good but I would have liked there to be more sauce. It was all at the bottom so the poutine was a dry on top and you couldn't mix it.  This place wasn't all that bad but I wouldn't go again."
/user_details?userid=gPutIn3JgUQyVBLOeilXEA,Louisa K.,"Glasgow, United Kingdom",4 star rating,"Vegan gourmet restaurants are still a rare thing so it's nice to have Lov in Montreal. They certainly created a beautiful space that is very Instagram worthy.In the late afternoon they only offer smaller plates so I've only tried the Hummus Toast. The nut cheese and olive crumbs on the pink beet hummus made a really tasty and also eye-catching combination. It's nothing you couldn't easily reproduce at home though, so I wouldn't go back just to have it again. The bread didn't seem too fresh, it was a little tough, and the slice also could have been a little thicker.To treat myself, I also ordered their mocktail Pina Koala. Cute name, pretty decoration, and quite tasty.I'd like to visit again and try something from the full menu to be able to give a better judgement."
/user_details?userid=0gZ8E5tBWTEtGEZDuTzhzw,Cindy Feng Xin L.,"Montreal, Canada",3 star rating,"Really too overrated as restaurant, but worth paying the visit because of its beauty. I tried the Coureur des Bois, the priciest dish in the menu, but it consists 90% of potatoes, the vegan sausage is good but not wow, the other ingredients are neglectable in number. I also took the green smoothie, but seriously it's not flattering.However, I think many people are attracted by the look of the restaurant, including myself. It is really a piece of art, basket lights and suspended chairs, I can't get enough of the decor, but I wouldn't come back for the food, sadly."
/user_details?userid=istH4rSLO8ZE7A7isoFNUg,Kate M.,"Houston, TX",5 star rating,The atmosphere the drinks the vegetarian burger yum yum yum. The bartender Jessica was super friendly and helped me with the menu (I only know a bit of French) She recommended the burger and I said yes. They also had healthy options like a carrot and ginger soup and a LOVely sounding beet salad but I had come from walking 10 miles around the city in the snow & cold and I knew only a burger would hit the spot.The patty had a nice crispy texture on the outside with a soft interior. It held together between bites underneath the buttery bun. The bib lettuce thinly sliced onions pickles tomatoes & cheese made the burger taste fresh and somewhat healthy. I mean it could be super healthy but it was so delicious my tastebuds were not sure. The sweet and salty LOV sauce rounded out the flavors of the burger. I ate the entire thing by myself very happily and very quickly. My next favorite part of the night was the amazing PINK drink. Also know as the Castilian Paloma. Tantalizingly tart and slightly sweet. And so cool to look at. And so easy to drink.This restaurant has great reviews on all the other review platforms. I was surprised to see such low reviews here. I personally recommend giving it a try. It's beautiful and fun and tasty.
/user_details?userid=EBqOfSAvI1giMy1cc1Lwnw,Carol Y.,"Chicago, IL",5 star rating,"Sooooo good!! I'm not even vegetarian and I throughly enjoyed this place! The service was quick and servers are quite attentive to your meal and refjll your water whenever it was empty! The place was so aesthetically pleasing, it made me happy just being there. Def recommend you go here and take some pictures on the beautiful floating(?) chairs in the back!!"
/user_details?userid=aJPO0e5KeWdxoFuBZhzJjw,Debbie G.,"Montreal, Canada",4 star rating,Great vibe and lovely decor. Food was great! The avocado toast and quinoa fritters are a MUST! The Poutine was so-so since I am not vegan and I love the taste of real cheese  I will definitely go back!
/user_details?userid=POqJ771-9PCqPmx0Sl56wQ,Bri V.,"Utica, MI",5 star rating,This was probably my favorite restaurant we ate at during our trip to Montreal. The food and service was amazing! I would definitely recommend the poutine and creme brûlée. Can't wait to go back and try other dishes.
/user_details?userid=LicyHK-zhYSAIuZvabBLlQ,Matt B.,"Vancouver, Canada",5 star rating,"My wife and I came here for brunch on a Sunday morning, and were lucky to get a seat -- it was packed! I ordered the ""sugar shack"", which was so intensely flavourful and wonderfully designed -- the vegan sausages and the beans particularly being amazing. Their coffee was good too. Friendly service, and the food came out in good time. Reasonably priced for the most part. My favourite meal when visiting Montreal!"
/user_details?userid=lxGwbMkC_I9D7GhGT23mFQ,Cynthia L.,"Ville-Marie, Montreal, Canada",4 star rating,"Love the decor of the place! Also a fan of their avocado toast :) Great quality of coffee too (this location is the only one that has filter coffee, although their americano is quite good). The menu is not very wide, but they do have a few good options. I've tried the brunch menu a few times and am never disappointed. I usually like getting the pancakes. Giving this place four stars though as it is a bit ""pricey"" for the amount of food you get."
/user_details?userid=0FKf9_Mc5d9ATO1bN-xl2g,Laura M.,"New York, NY",5 star rating,"AMAZING CREME BRULEE. They had great food as well, but the creme brûlée was by FAR the best I've had (vegan or not vegan). Their drinks were also unique and tasty. We ended up going for breakfast and dinner, and both meals were wonderful. I recommend the beyond burger and French toast."
/user_details?userid=g8IC8rlbQYXAgMVuwL5_GQ,Lindsay R.,"Toronto, Canada",4 star rating,"The food is excellent as is the service and the decor.The food was delicious and full of flavour. For two people we ordered the poutine, the tempe bowl, the kale ""Caesar""and the squash dish. The meal was superb. Portions are on the smaller side so order multiple dishes.The server and host were extremely friendly and polite. Definitely top-notch service that's passionate about the food and genuinely friendly.As indicated by one of the reviews in French, the vibe is very trendy and LA-style and is a nice addition to the restaurant scene in Montreal. We ordered a class of Quebec sparkling bubbly and the portion of booze was VERY generous. The glass was filled up to the top which was much appreciated!My only small critique was that the dessert potion was too small. We related this feedback to the server. It was more like ""cheesecake shavings"" as opposed to an actual piece of cheesecake. Would have gladly payed more for a bigger portion.Overall, this is an excellent restaurant and I highly recommend it whether you're a vegetarian or a carnivore."
/user_details?userid=iNatil-QzPGbLMz4LHGL8g,Beverly N.,"Toronto, Canada",5 star rating,One of the best vegetarian eggs benedict that we've ever had.  The potato hash is crispy on the outside and moist on the inside. Absolutely beautiful interior decor.Would definitely return when I'm back in Montreal.
/user_details?userid=2rIfScRQaDHiAcG36lNPNQ,Tina B.,"New York, NY",5 star rating,"SO cute and aesthetically pleasing inside! The food was pretty good too- made with wholesome ingredients and was pretty healthy! I got the vegan omelette with cheese and the maple sausage. As a vegan, i don't miss the taste of eggs at all but the definitely miss a traditional egg brekkie so this was delicious to me! The vegan cheese inside was great, nice texture and flavor. The maple sausage was smokey and a bit salty but good with the meal. Overall, good experience and I'd go again!"
/user_details?userid=jLbeWFl6TvF7qC1scB_4fw,Anand B.,"Short Hills, NJ",5 star rating,Nice and cozy with lots of vegan choices. Great presentation and ambience. Friendly staff.
/user_details?userid=ar-mbe2nTSLmtm7URUexFg,Leo D.,"Toronto, Canada",3 star rating,"Never actually ate here.Yesterday we walked in. They said they were closed, or something, even though people were eating. We weren't gonna argue, so we made a reservation for tonight.Tonight, we arrived and were shown our  ""table,"" which was bar-style, not very wide, and too high. It wasn't really a table. More like a Tim Horton's window counter, except Lov's is an island for people to face each other. Other tables were available but the one we wanted was reserved. I got the feeling our reservation didn't carry the same weight as other reservations . So we left.EDIT: I changed the rating to 3 stars because Catherine G. of LOV McGill replied to my post -- thank you Catherine. I'll be sure to try again next time I'm in the neighbourhood."
/user_details?userid=nkQOsq9k6YPj5cZGJ58P-Q,Dan B.,"Montreal, Canada",1 star rating,"This was a great local place to eat.  I live in the old port of Montreal for almost 30 years.  Its normally an awesome place to live since there are so many activities and restaurants in the area and it is Dog Friendly almost everywhere.Even though I have eaten here several times with our tiny dog, at times in the puppy bag that we use for airplanes, this time they refused us entry to the outdoor terrace on the street.The manager lied that they don't have the permits to allow small dogs.Guess what, you do not require a permit!So we are enjoying food next door at a very doggie friendly terrace named ""Marche des Eclusiers"" with even more awesome food, best sangria ever on the river.Call to all dog lovers, Lov does not love puppies!!!Photos are from the terrace that we enjoy all summer...Bye bye Lov!"
/user_details?userid=YVaONBBT9lSJQwBPWCB0qQ,Ann T.,"Montreal, Canada",3 star rating,"Location: In the old port of Montreal. The closest subway is Square Victoria and it's a short walk from there. Street parking is available but mostly metered and it may be tough to find a spot on the weekend. The place: It's not incredibly big, but it's spacious enough. The decor is simple but lovely and cozy. Overall, the place has a great vibe. My date called a day or two in advanced to make a reservation for 7:45pm.The goods: We ordered a few dishes to share because we wanted to taste a variety of things. My date ordered the soup - it was a velouté containing eggplant and carrot (I think). The flavor was nice, but there was something missing. My date thought it was salt and I thought it should be a little spicier. The quinoa fritters and curry dish were both big hits - absolutely delicious! The avocado toast was nice, but it fell short on seasoning (as in, there was none). I'm still not sure how I feel about the brussel sprouts - from a flavor perspective, they were OK, but the leaves were so very crispy that they fell apart pretty quickly and it was like eating air. The gnocchi that everyone raves about were a complete miss for us. We both found the dish to be very, very dry and lacking in flavor. Between us, I think that we ate half - maybe. We ordered a bottle of Riesling and really enjoyed that. Skipped dessert.Service: Good. Our waitress was really nice and friendly.Price point: Everything including the wine came out to $124 tax in."
/user_details?userid=3QJj7MESj2TSIp7_Ylkg0g,Mtl F.,"Montreal, Canada",5 star rating,"First of all, this restaurant is absolutely gorgeous. Secondly, the food is INCREDIBLE. My friend and I shared 4 plates (3 apps and 1 main), I got a dessert and she got a mocha latte. Everything was SO good. The prices are great too, not too expensive. I highly recommend this place to anyone, not just vegans or vegetarians."
/user_details?userid=-UIo6DFMAPTrR_r8VEKwTg,Mary B.,"Dallas, TX",5 star rating,"I went here two nights in a row while in Montreal. It is AMAZING. Being a non-alcoholic vegan makes it often challenging to find an elegant/upscale place to go for dinner. Based on reviews only, I decided to check out Restaurant LOV to see what it was like. I had such a great experience! They have great tasting and good looking mocktails and the food is incredible. My recommendations: the asparagus special appetizer (so good!), truffle & caviar (ask for a spoon to not miss a drop of the sauce), the pok' ai' (the watermelon preparation is so unique!), the beet tartar (so so tasty!). Wonderful food for vegans and non-vegans! I can't wait to come back to Montreal to try another dish."
/user_details?userid=R4O7yl6qpyE7N_tuHfP-bw,Jon R.,"Manhattan, NY",2 star rating,"Should you love love? No, but can you like it? Yes. Over hyped, trendy place that, unfortunately, is lacking in heart. We got the dumplings, which were the best, followed by the Arancini (too much garlic). Down hill from there! The gnocchi was tough and no good, the lasagna, a weird after taste and the risotto too undercooked. The service was horrendous with the food taking forever to come out and the waiters being completely inattebtive. Many tables were all waiting for their food and getting the bill was an ordeal. It's quite something when you ask for a wine rec and the waiter points to the most expensive item on the menu..."
/user_details?userid=U2OPJc9c1q7VToeKeTZ-UA,Kevin W.,"Westmount, Canada",4 star rating,Decor: 5 starsAmbiance: trendy and upbeat.  Can be loud. RSVP: definitely make a reservation Service: friendly but felt very slow  (30 minutes to take our order. Another 30 minutes for appetizers to arrive). Food choices: Quinoa frittersKale mac and cheesebig lov burger Speaking from the perspective of a non-vegan palate I would say I enjoyed the food and would eat it again.  My two year old loved every bite.  Would definitely hope the service improves to match the food.
/user_details?userid=lky3Ga87YSFM-2PPmuv94w,Drew M.,"New York, NY",5 star rating,Had a wonderful experience trying a vegan restaurant for the first time. Waiters were accommodating to food allergies and the food service was very fast. I would recommend trying the gazpacho and the zucchini noodles dish. So refreshing and light. The space is very chic and modern.
/user_details?userid=QYC3HlU2lVeocJSU_UP73A,Alex Catherine L.,"Montreal, Canada",3 star rating,"The food is super good and filling. Not too big not too small just perfect. The decor is super nice too. The downside? Service. It's not awful, the waiters are even polite and nice. Are they efficient though? Not at all. They sat us (we were 3) at the counter even if they has free tables so I had to ask them... the plates were droped on the table with barely a smile and no word. We had to ask multiple times for the receipt. Could be improved."
/user_details?userid=yYULDdPTSHdJKIo3IVcV_w,Eric M.,"Los Gatos, CA",1 star rating,"This was our 2nd visit to LOV McGill. We discovered it last summer and were impressed with our 1st visit. Our experience this time couldn't have been more different.We had a reservation, showed up a few minutes early, were seated immediately. Our waiter took our order, brought our drinks, and then we waited for our food. And waited. And waited.We realized that people seated after us were getting their food. A couple seated at the table next to us had ordered the same appetizer as we had. We ordered ours well before they did, and they received their appetizer and meal before we had even received our appetizer. After 45 minutes of waiting, we requested our waiter to check on our order, and he ignored this request. The waiter only took action once he saw how unhappy we were becoming.The food, when it finally arrived, was disappointing: lukewarm temperature, the gnocchi was hard and chewy (unlike on our 1st visit), and generally not up to the level expected for this price point. But we were out of time to send it back as we had an appointment to keep.We won't be going back."
/user_details?userid=w9p1riXy9ojTdbjHpCMcrA,Evan C.,"Truckee, CA",5 star rating,Amazing food.    We came here because a friend was vegetarian.   He and I had the coconut curry.  Others had the soup and the zucchini pasta with a poached egg.  Everything ordered was amazingly delicious and the waitress very warm and friendly.  Then we had dessert.  The creme brûlée was perfect.   I'm really blown away by this place and would definitely come back.
/user_details?userid=3eY-El6B-mEMOLh0Z8lCUA,Diane Levy Photography L.,"Tenafly, NJ",5 star rating,Love love love this place !!!!The place is so beautiful and dreamy.The food was just incredible so fresh and so good.A must go for vegan lovers
/user_details?userid=wiA96NmeGtsuWykUk3VbGw,Sarika C.,"White Plains, NY",4 star rating,"I've had vegan food at many restaurants. However, the variety and flavor of the food here was just fantastic! The poker faced servers were the only factor that took away from our experience. The servers were not pleasant at all and having grumpy servers on a meal outside can greatly alter your experience. So 5 stars for the food and ambience! But only 1 for the service!"
/user_details?userid=359xbFpHw-NdN5FG-zMQkQ,Rebecca G.,"Boca Raton, FL",3 star rating,"Fast, friendly service. Soup was great. Had the beyond burger so it was what it was. Desert was ok but not great. Decor is nice. I'd go back, would like to try the brunch menu."
/user_details?userid=dz7fey3cYbOoWItZXtsRtw,Lisa H.,"Pipersville, PA",5 star rating,"What a great find! After a 7 hour drive to Montréal, we just wanted something to eat close to our hotel. My husband isn't vegan but is usually up for plant based dining as long as it's not boring. LOV was anything but boring. It was quite busy with just a few seats open on a Monday night at 9:00PM. We were warmly welcomed by the host and shown to a table right away. Our waiter, Marius was delightful, funny and super attentive. We started with kombucha mojitos and they were definitely the perfect choice. I only want kombucha based cocktails from now on. Next we shared the vegan poutine which was absolutely delicious. The vegan cheese cubes are almond based and the mushroom gravy was thick and creamy. I couldn't wait to try the french onion soup. It did not disappoint. I have been craving french onion soup since I went vegan over a year ago. It was warm and comforting, perfect for warming up on such a chilly night. My husband enjoyed his tofu banh mi burger. In fact he enjoyed it so much I didn't even get to try it. I'll take his word for it. We were too tired for dessert but returned the following night to try the Big LOV Burger, onion rings, dumplings, Pho. Everything was incredible. Seriously. I want to go back again tonight and try the tacos."
/user_details?userid=n84ezbfLhfV2gIp_eE7lRg,Calvin L.,"Saskatoon, Canada",3 star rating,"A vegan friend and I came to check this place out, and overall had a good experience. The place definitely gets 5/5 for decor and ambience - tall ceilings, beautiful white washed brick walls and lush potted plants tastefully placed gives the space an airy bohemian vibe. Service was good, prices were acceptable...oh, and the waiters are all tall attractive men. In terms of the food, we shared the kimchi fries, which were fantastic, with complex flavours and a great fermented cabbage kick. However, the Chili de lupeh off the seasonal menu was quite average, and somewhat small in size. The flavour of the chili itself was fine, but so is the chili from Tim Hortons. After a surprising and innovative appetizer, this was a sad $14 disappointment. I would certainly try this place again because I suspect there are stronger menu items. However, I will be judicious in what I order."
/user_details?userid=DOZH3rOqT3cVyyt_FzL3ug,Michael K.,"Haverhill, MA",3 star rating,Fun location with a great feel. Food was good but missed on a few marks. Vegan cheese platter was amazing but entrees a little less. Service was very pleasant but slow.
/user_details?userid=QpcT6K3Yu6lnooscnLwMWA,Meaghan O.,"North Hollywood, CA",5 star rating,Tasty and great vibe. Super cool with allergens. Excellent grilled cheese. Will come back again.
/user_details?userid=JZ1iaqRejucnR150Gkee7A,Nahush P.,"Alpharetta, GA",4 star rating,Interesting menu and awesome vegan food. The power bowl and the burger was delicious.
/user_details?userid=c5J24zIGtZN-FnHuibfjRQ,Alexis L.,"Rochester, MN",5 star rating,"I went to dine alone on a Saturday night while on a work trip in Montreal. I usually don't enjoy dining alone. But this place gave me so much positive energy !!! The inside is beautiful, the staff is amazing (kuddos to Maxandre). I ate vegan delicious and fresh food. This is definitely my new GQ when I'm in Montreal. Do not hesitate, just go !!"
/user_details?userid=vIdW5SRk1PuaD8-3Gl5ang,Jamie W.,"Montreal, Canada",1 star rating,"With so much great restaurant fare in Montreal, Lov certainly does NOT deserve your dollar. The food is fine, certainly good if you have a need for vegetarian... but...The service is atrocious. Hands down the most appalling experience I have had in 15 years. Though the reservation was made a month in advance, we were bumped by 45m upon arrival. No apology. When seated, it took 20m to order even a drink. My main course arrived 15 minutes after the first, after I asked the waitress to check on it. When it arrived, it was clearly rushed and undercooked. One party at our table had two long black hairs in her risotto. In order to pay, two of us had to get up to ask the waitress for the check, and it took over 30m from when we finished. We missed our show in the old port. She brought the bills, and I had to get up after we had them for ten minutes to allow us to actually pay.In summary, the experience was atrocious. An embarrassment for Ave McGill, and they dont deserve the location. There was no apology, care, or kindness shown at all."
/user_details?userid=23naRmK_DDRh4FNLZmn5LQ,Tiam D.,"Laval, Canada",3 star rating,"Why does vegan have to be so expensive? Decor with gorgeous and food was original. However, lacking in flavor. Paying for the hype and surrounding shenanigans.There are so many other vegan places more worth mentioning like Lola Rosa!"
/user_details?userid=Rgb8wjMyK_mFcxO5rrU7kA,Melissa G.,"Arlington, VA",4 star rating,"Yum! They have a great selection of specialty drinks (try the Camerise!) and vegetarian/vegan food. Their menu clearly marks the vegan items. The vegan poutine was fantastic...except for the vegan cheese which was not my thing, but I am not a vegan. You can substitute the vegan cheese for real cheese, which I will next time I'm here. I also got the buffalo brussel sprouts and would change absolutely nothing about those. Superb!"
/user_details?userid=aVxpgZk6ZwUBKzvCs2Ae4w,Jacqueline N.,"Vancouver, Canada",5 star rating,The most beautiful decor and environment! Every little detail is so pleasing to the eye! I came for brunch and had the lumberjack! It definitely satisfied my vegetarian meat cravings! The potatoes were so creamy and delicious! The staff was very friendly! Highly recommend!
/user_details?userid=DKM3Ud7hi9W7JEgwpK7rKg,PJ S.,"Evanston, IL",4 star rating,"Absolutely beautiful setting with lovely food. Service was a little slow and cold but the food was great with a few misses. Kale mac and cheese was lacking salt and umami. The vanilla cupcake screamed ""vegan recipe"". Highlights: poutine, banh mi burger, mushroom entree, cheesecake dessert. Cocktails were also wonderful."
/user_details?userid=7TkOKn80Yw9tHjg1IJJ21w,Christian B.,"VT, VT",4 star rating,"Wednesday night, and the restaurant is packed. Maybe it's because of their excellent social media presence, or just because they hit all the right points, it's as simple as that. They nail it.- The decor is what strikes you first of course. It's light, playful, refreshing; elaborate and curated but not taking itself seriously, like the food.- The food is on point. It's not a vegan restaurant that hides its preference, or a baba cool hippie from the 60's with only grain dishes. Each dish has it's own flavor and texture; inventive, satisfying, good proportions and careful presentation. May be the dessert was the disappointment (hence the lost star) as it was not up to par with the rest of the meal. Don't tell your carnivore friends it's vegan, and they will still be satisfied.- The service was nice and easy. They may be trendy and full, but they still have a smile each time they interact, and they take their time with you. You don't feel rushed and the service is friendly without being unprofessional.A very rounded experience - the price is right, for a well delivered and executed experience. It's an experience that makes you smile and be happy, like the decor."
/user_details?userid=dXAHdsfUGaYS4XScr3epEg,Helene S.,"Pointe-Claire, Canada",5 star rating,Went for lunch. Great food and excellent service. Had the gnocchi. Portion looked small but was very filling.
