user_url,user_name,user_city,user_rating,user_review
/user_details?userid=-MERKiI7sX6s9_ovlUxIXg,Matt R.,"Irvine, CA",3 star rating,I was in town the other week and decided to come by twice. The first time I came by the burgers were good. I liked the tofu ban mi burger more than the veggie patty taste wise. My wife also wanted the onion rings and fries so we got them. The onion rings had little to no taste and were not salted much. For a fried food...I think they need to be salted. The sauce that came with the onion rings also had little to no taste.We came back again a few days later as we are vegetarian. This time we got the lasagna and the pot pie and decided to give the onion rings another chance.The lasagna had no noodles or at least felt like there were none. It seemed more like a tomato casserole than lasagna...we opted for the ricotta cheese on top for extra...I could only really taste tomato and the dish was under salted.The pot pie came out and looked great. Then we tried it and the taste was just flat. No taste really at all. The jack fruit inside tasted like it was just dropped in the dish without any flavor added. We cook jack fruit at home from time to time and it's a great option to substitute for meat if flavored correctly. Unfortunately this felt like the jack fruit went straight from the can or jar and into the pot pie...no bueno.The onion rings again were not salted and neither was the sauce that came with them. For the prices of the food here and the reviews Lov gets we expected a bit more. Especially since we know there's good vegan food to be had if done correctly. The staff was very nice and accommodating and even removed the dishes off our bill once we let them know. I'm writing this review in hopes they can improve as I think they can.
/user_details?userid=U28XN1IGtjsQL2DUxr7FKg,Be F.,"Vancouver, Canada",3 star rating,"We tried the bahn mi burger, which both servers recommended, and found it only OK. The large block of tofu makes it just so bland despite the crispy coating. We also had the vegetable soup, which was thin and boring, and another dish I can't even remember. The standout flavour was the aioli they served with the fries, it was spectacular. Overall things tasted fine and it's food you feel great after eating, but clearly this wasn't a stunning meal. Oh right - it was the chili. And we ended with the creme brûlée, which was a decent replica with only a hint of a soy-type taste, but not nearly the right ratio of creme to crust - I make one that's much better at home. Portions are very small and service was only passable. It was the only time on our trip so far that we experienced a server who seemed irritated that we aren't fluent in French."
/user_details?userid=J84FICbDVoSe7ZXn5lnQNw,Cameron S.,"Washington, DC",5 star rating,"we came here twice while we were in Montreal. everything tasted delicious, the service was great, and the place is super cute. love that this all vegan restaurant is instagram worthy!"
/user_details?userid=ofta5HrHCmHSN0WvC4zR0w,Claire L.,"New Haven, CT",5 star rating,"My boyfriend and I came here last night, after I found this place on Yelp. We were intrigued by the ""Local, Organic, Vegan"" concept, and thought this would be an excellent place to detox after a few greasy and carb-y meals in Montreal! As soon as we stepped foot in the interior of the restaurant, the atmosphere and decor nearly took my breath away - I thought I was transported to a rustic, but chic gourmet boutique cafe in Los Angeles or Paris! LOV during dinnertime is dimly lit, perfect for an intimate date night or a low-key birthday celebration at night. Although we didn't have reservations, we were lucky enough to score a two-person table in a relatively quiet nook of the restaurant. Service was so kind and attentive. One waiter seated us, and another introduced the menu to us. For a starter, we ordered a Pho to share. The Pho soup consists of lemongrass broth, bok choy, konjac noodle, fried tofu, bean sprouts, Thai basil, enoki mushrooms, and lime. It was so, so tasty and innovative - unlike any pho dish I have ever tried. As opposed to a massive, hulking bowl of pho, their pho is served in a dainty bowl with the ingredients arranged artfully on top. The konjac noodles were an interesting consistency, kind of bouncy but with good texture. The fried tofu was also well seasoned, and an excellent complement to the fresh veggies, like the crispy bok choy. The highlight of the pho soup was obviously the broth. The lemongrass flavor absolutely shines through, and was the perfect antidote to a freezing and snowy winter night! For entrees, I ordered the Power Bowl, which consists of mesclun / arugula, cucumber, cherry tomatoes, pickled radish, corn, carrot, quinoa, lentil, sprouted mung beans, a specialty LOV crunch mix and avocado / basil green goddess dressing. Simply put, this was probably one of the best, most colorful salads I've had in my life. So filling and delicious. All the different ingredients added a variety of textures in the salad, so it didn't feel like I was just eating a plate of greens. The pickled radish in particular added a wonderful tangy crunch to the mix. The LOV crunch mix consisted of sunflower seeds, raisins, and corn nuts - an unusual combo but very tasty when mixed in with the salad. My boyfriend ordered the Banh Mi burger, which he greatly enjoyed as well. He wished the sriracha aioli were a little spicier, but the concept of the restaurant is showcasing the flavor of the veggies and ingredients, as opposed to overpowering them with seasoning! My main takeaway is that I would absolutely come here again and would recommend LOV to anyone, vegan or otherwise. LOV knows just how to bring the freshness and essence of the vegetables to center stage. The ingredients are not hiding behind a veil of heavy seasoning or fried oil, but rather are enhanced by its other companions on the dish. Everything we tried was fresh, clean, delicious, and reasonably priced. Coupled with great service, LOV is a 5-star experience!"
/user_details?userid=HlI6IYi8mqUNqo09Z1Xvyw,Saurin S.,"New York, NY",5 star rating,"I have been there once and I am already a fan! Best you can find for vegans and vegetarians.Visited Montreal over the weekend and decided to visit this place based on other yelp reviews and recommendations from bloggers and had one of the best bunch in Montreal. I would recommend making a reservation if you mind sitting on the communal table or at the bar, we do not mind that and sometimes enjoy sitting at the bar as we did here. It gives you an opportunity to interact with the bartenders and servers more(understand that locals might not want to do it but we enjoyed that as tourists.). the staff was really friendly and delight to talk.The place was amazing and definitely Instagram worthy and friendly (See Pics). Let's start with food now:Soy Milk Mocha - 5/5Cow Milk Cappuccino -  5/5Bénédicte LOV with eggs on top - 4.5/5Gnocchi Di Casa with real cheese- 5/5I will definitely go back when again in Montreal."
/user_details?userid=WWwZzFfneG9w7LEvZBas2A,Ceci Z.,"Seattle, WA",4 star rating,Came here for early dinner so the place was quite empty. The ambiance is amazing with beautiful decor. The food selections have great presentation and tastes delicious. I took off one star because service was slightly disappointing. After we ordered food it was difficult to flag a waitress down.
/user_details?userid=KhUli0MLYJ6dXHPU0V1Akw,Lorna D.,"Palm Desert, CA",5 star rating,Food and service was wonderful. It is also super cute and has nice outdoor seating. I had the Kale Mac n cheese and my mom had the gnocchi. Delish! Probably my favorite restaurant in Montréal.
/user_details?userid=a9j6XZL_k34e9ZCExa8WHg,Jon W.,"Bushwick, NY",1 star rating,"My friend and I chose to visit LOV on the recommendation of her coworker. Upon entering, the hostess told us that the many empty tables were all reserved. She sat us at a high shared bar table, which was fine. We ordered our drinks, a lemonade and a matcha latte with oat milk. My companion's lemonade was good, but a little hard to sip with all the stray pieces of rosemary. The latte was bitter, even with two packs of cane sugar, and full of matcha sludge at the bottom.As an appetizer, we ordered jackfruit croquettes and were not provided sharing plates, forcing us to eat out of the same cumbersome bowl. The croquettes were fine, but the topping (""a corn salsa"" w/ random baby spinach) was difficult to consume.My friend ordered the mushroom risotto; I had the chili. The risotto ""tasted like mushroom soup from a can, the peas were undercooked, the only visible ""mushroom"" tasted stale. It was awful."" I had the chili which was cold and utterly flavorless, without even a dash of salt, nor was any salt or pepper available on the table. The beans in the chili were undercooked. It was served with corn chips, which was kind of them, as they didn't give me a spoon.Some of the other food looked and smelled really good, and perhaps we picked the wrong dishes or got unlucky, but overall this was a bad experience. Ambiance-wise, the decor was a bit hackneyed - Edison bulbs & weird hanging chairs. The music would have been appropriate for watching my father wash his Camaro in the summer of 1988 - e.g. ""Don't Fear The Reaper"".The food was insanely overpriced. Two entrees of tasteless vegetarian slop, a passable appetizer, and two non-alcoholic drinks were $70!"
/user_details?userid=jscwXAi6lSUwtm8Jpxce0g,Megan L.,"Hawthorne, CA",5 star rating,"I'm in love with this place. My niece introduced me during my visit to Montreal, and I have been for both brunch and dinner. This place is great for either. The LOV burger is my favorite with a side of fries. I go with the real cheese because I'm allergic to coconut and can't do the vegan cheese.  Atmosphere is great, and will be back anytime I'm in town."
/user_details?userid=kYKQ3_bv0yJkoYuUZ9UMuA,Katherine P.,"Raleigh, NC",5 star rating,Best vegan burger I've ever had!! The drinks were also delicious. The kimchi fries were incredible.
/user_details?userid=HmYj8wXXzzmc80DIenufuw,Sherry S.,"Manhattan, NY",3 star rating,"Copper Branch is yummier. I'm sorry, but it is.The place is very Instagrammable. Very pretty, very calm, like a plantation, colonial set up (ignore all the terrible associations with that), with rattan white chairs and pretty lighting everywhere.The food itself was just okay.Took the quinoa croquettes and found them very flour-y. It was yummy but it left an aftertaste of flour.The waitress sort of sighed and tried very hard to ignore us when we asked for another empty bowl to split the meal to share the two so we could try each other's bowls. One star off for that.We took the ""classic LOV burger"" and it was okay. Tasted fine, but the black bean patty was not the best I have ever had (Copper Branch burgers are better)...  The sauce, the bread, it was all fine because it tasted like a burger with the sauce, but the patty was not very meat-y in flavour (I am not a vegan or vegetarian by the way).The Thai curry was good, but needed far more rice and sauce, and it lacked a home-yness to it that I associate with curries and rice. It felt a little flat.Portions were okay. With the appetizer and meal, it was okay, but I wasn't thinking: Wow I am full! .. which is fine, because it is never good to eat too much.Still, my favourite place to eat vegan / vegetarian is Copper Branch"
/user_details?userid=aPTxdV3iOlOPs9usJ1yE_w,Kait M.,"Montreal, Canada",4 star rating,"Let's preface this review by saying that I've been to the de la Montagne LOV a handful of times since it opened earlier this summer and I absolutely adore it. I was in the Old Port with relatives yesterday and figured it was about time I try the original location.I have to admit, after having consecutive excellent experiences on de la Montagne, I had high hopes for the McGill location and, I have to say, I was slightly let down. The service was only OK and the presentation seemed to be off.My ""Big LOV"" burger was brought out much later than the rest of my party's food. The bun was soggy and the contents were lopsided and falling out. The flavour was there, I will give them that, but the presentation and soggy bun were a big disappointment. Maybe they were having an off night? Either way, a $13 burger (with no sides) should not be soggy and falling apart!Now that the negative is out of the way, here's why you still absolutely have to try LOV (maybe just skip the ""Big LOV"" burger). I've brought a handful of omnivore friends here and they've all been amazed by how delicious their plates are. Not to mention the cheesecake! Seriously. It doesn't matter how full we are from dinner, I always order a cheesecake for the table to share just to show them how delicious cashews can be! If I didn't tell them upfront that it's vegan, they would have no idea. It's really that good.I really love LOV -- you'll find me there often. As a strict vegetarian with a handful of food intolerances, it's rare to find a place that is accommodating *and* truly delicious. Plant-based restaurants are far too often dismissed as flavourless hippie joints and LOV is proof that vegan doesn't have to be bland or cookie cutter. Thank you, Stéphanie Audet!"
/user_details?userid=JNbVaQDDR-YmZ2-ZFHIhjQ,Fiona C.,"New York, NY",4 star rating,"Fantastic vegan place that totally lifted up my spirits after my flight got cancelled. They were so busy on a Sunday night at 9pm but thankfully were able to accommodate us at the bar. Our server Alex is a totally sweetheart and very attentive. We shared the beet tartare and it was so good with so many layers of flavor with the mint and cashew cream and dusted seaweed - it really felt like eating raw fish. I had the hero 2.0 with egg noodles, eggplant, broccoli, tempeh, bok choy and kimchi. The dish was sweet, tangy and spicy but I couldn't eat the kimchi (I don't think they've gotten their kimchi quite right). My friend got the pok'ai which is a refreshing salad with cauliflower rice, cucumbers, watermelon cubes, macadamia nuts, edamame, seaweed with a poached egg. I'd totally be back the next time I'm in Montreal!"
/user_details?userid=iJAuYSwEs9qCTKbh8Lqt5A,Lidor E.,"Miami Beach, FL",5 star rating,"We are not vegan; and yet this place is beyond anything! So delicious, so tasty , the service is amazing. Get the burger and the beer tartar! Wow it's so delicious"
/user_details?userid=CYNfm4XfDiI_eShEEbME4A,Jay V.,"Ocala, FL",5 star rating,"I was looking for a place to have some Vegan food and wow, this is an amazing place with an even more amazing atmosphere.. The food is delicious.."
/user_details?userid=A7Rj1h3TJzzHCKd3SAIxVA,Laura P.,"La Verne, CA",5 star rating,"The atmosphere is incredible. Just absolutely gorgeous ! Their service is excellent. Now for the food. Yes I ate here twice in one day. They left such an impression on me. What?! I'm a tourist ;) For brunch on Saturday I ordered the waffles and Nutella toast. All vegan! Later I came back for dinner. I ordered the Lov burger, poutine and the onion rings. I totally recommend this place especially if you are a vegan tourist like myself."
/user_details?userid=51J0DDJS22fKeYWrxA56qA,Chris F.,"West Hollywood, CA",4 star rating,"Super tasty and healthy but super slow when busy. Took an hour for our food and no gesture was made to compensate beyond a ""sorry"".no biggie but usually you pick up something.. coffee, smoothie and side dish or whatever. Food was also cold when my poached egg should have been warm at least on my Benedict. Would still go back but maybe not rush it."
/user_details?userid=HpzMECWPO4H1fJihiMG1Pg,Lanyi L.,"Markham, Canada",4 star rating,"An extremely aesthetic restaurant. For vegetarian food, it was surprisingly hearty. I had the eggs Benedict which was expensive but I think you pay for a great experience. I would definitely come again though to try the other items on the menu. Everything that I saw others had looked great!"
/user_details?userid=7ITNWhYP1l8B672DxYdZ2g,Robert R.,"Smyrna, GA",4 star rating,"The decor of this restaurant is beautiful. Like everyone has mentioned you really need to make a reservation to have any hope of eating here.I am a vegetarian and my wife is a vegan so finding places where we can both eat can be troublesome.  We ordered the Kale Mac n Cheese, Urban Mushroom & the Indian Casserole. All of the dishes were flavorful and were presented well. The service was great and there really wasn't much to complain about."
/user_details?userid=Wc5L6iuvSNF5WGBlqIO8nw,Risa D.,"Lac-Supérieur, Canada",4 star rating,"Went for dinner last night and really loved the experience. The food overall was cosy and tasty, really successfully doing filling, yummy, vegan comfort food.  We tried the kale mac n' cheese, the mushroom carpaccio with truffles, the onion rings, the smoked beet sandwich, and the risotto. The risotto was the only miss, bland with a gluey texture. Skip it. But everything else was amazing. It's so fun to eat indulgent food like mac n' cheese or a twist on a smoked meat sandwich and not feel sad about animals, and also not feel hungry after. I just finished the takeout container of the onion rings and the panko kept them crispy and not too crazy greasy. There are lots of cocktails, good local beers and interesting wines on the list, we loved the one orange wine they were serving by the glass. And the service last night was charming, friendly, warm, quick, and thoughtful. Really look forward to coming back."
/user_details?userid=e97eulCGpHeuBIDK9x8WLg,Elyssa K.,"Manhattan, NY",5 star rating,"I recently visited Montreal and had a really amazing Brunch here as well as a fantastic lunch at their Ville-Marie location the next day. At this one I was able to get a seat ASAP. The servers were very friendly and although there was a slight wait for my food to come out, they made sure to let me know it was on the way. I had the Tofu Benedict and ate every bit of it, it was that good! I also really love their sweet potato fries. For lunch at their other location (which had fantastic service too) I had the kale mac and ""cheese"" which I recommend for any vegan mac and ""cheese"" fans. And I had more sweet potato fries with their aioli sauce. I will definitely come back here next time I visit Montreal!"
/user_details?userid=agm7_n86op8xh3c8_W_DiQ,J D.,"Los Angeles, CA",5 star rating,"The decor, ambiance, staff, and food were excellent. We stopped by as a party of two on a Friday evening. The restaurant was full, but accommodated us quickly (reservations are possible through OpenTable). In particular, the beet tartar, dumplings, and not-a-cheese-plate starters were delicious."
/user_details?userid=Yj6gAP6HTKaFks9EyDLm2Q,Mark B.,"Oakland, CA",5 star rating,"Ridiculously delicious vegan fare. This sounds corny, but the interior design is done so well, you just feel like you're going to have a special time. Highly recommend the cheese plate and poutine there.Cheese plate had a feta that was uncanny and a bleu cheese that was unlike any other vegan cheese I've ever had. Similar to Miyoko's, but the flavor profiles were more complex.The poutine was the best vegan poutine we had in Montreal, period.Wine recommendations were spot on, and the beer selection is tops."
/user_details?userid=MZ2eEtdLsfOGLFa0U_Rk9g,Bong B.,"Montreal, Canada",4 star rating,"Ideal for a Vegetarian Brunch!Everything is vegetarian, in addition to being organic, local and absolutely delicious! It's a bright and cozy environment with a good service! However, the acoustic of the restaurant is awful, which makes it very noisy. The portions could also be more generous."
/user_details?userid=STEY6Hr01gpw4pA_rpzesg,john b.,"Hoboken, NJ",4 star rating,Good food. Very poor beer selection. Way too loud. Couldn't hear our waiter and he couldn't hear us.
/user_details?userid=IAh4B4pSw9qU0gUxeiLRdg,Hayley D.,"Westdale South, Hamilton, Canada",5 star rating,The vegan Mac and cheese was AMAZING. I got a side beyond meat sausage and ate it along with the Mac and cheese to balance the flavours and make the dish more savoury. My partner got their club which was mediocre. Ideally he would of gotten the Benedict but since he's allergic to cashews he switched. The waitress was extremely nice/thorough about his allergy and didn't make him feel uncomfortable.Overall we both were so happy with our experience and would 1000% come back!
/user_details?userid=fQbwv0pE5GmF-YhLd6_18g,Missy D.,"Hamden, CT",4 star rating,"As a first-timer to Montreal, I was excited to go to a vegan/vegetarian restaurant outside the USA. I loved the poutine with the cheese curds. It was rich and delicious. The olive stater was good, but could use more olives in it. The mushroom entree was small but fresh. The Hero 2.0 was interesting and fun. Overall, it was a fun dining experience, with great service and wonderful decor. I recommend it to people looking for a trendy, fun, vegetarian experience."
/user_details?userid=_o4c53ihffhBwGQeQRMWCA,Anna H.,"Snohomish, WA",5 star rating,"To put it simply, we LOVed this place! The staff was so sincere, kind, and helpful. The manager checked in on us numerous times and is so personable. So now the food: I'm pretty sure the song L-O-V-E was written after Nat King Cole ate here. All the right flavors at the right time, so delicious. Would recommend to anyone visiting or living in Montréal! Thank you LOV for showing these U.S. girls some true love"
/user_details?userid=stlnyCuHYakQ9DbwXgONfg,Kristi W.,"Aiken, SC",5 star rating,"The Buckwheat Sweet Potato Gnocchi with hemp pesto and arugula was inspired! A party in my mouth. Husband had the Apple Pancakes. He was equally happy. Had to try dessert so our server suggested the cheesecake. Were only gonna eat one bite. HA! We licked the plate! Adorable atmosphere, attentive and knowledgeable server, good prices. Highly recommend Lov."
/user_details?userid=vF_iEVE4GT1PfcGlrofBeg,Sarah M.,"New York, NY",4 star rating,"food is alright had the kale mac and cheese it was yum  the hash browns were YUM! Coffee is mild, staff is nice. Ambiance is beautiful!! The beyond burger was ehh not the biggest fan but the store is beautiful aesthetically pleasing!!"
/user_details?userid=e4zs1qtfXfF3zA7MdQr8EQ,Mark H.,"Spring, TX",5 star rating,I have eaten at a lot of vegetarian and vegan restaurants around the US and Canada in all of the major cities. This is the best Vegan restaurant I have eaten at. I do a ton of vegan cooking and there are a lot of dishes that I eat and think to myself I can do better. We ordered 8 meals and two appetizers off of the menu and everyone was incredible. We shared and I tried them all. I could not do better.
/user_details?userid=Il9EB1SLBALhvp7GOVMokw,Rich B.,"Brooklyn, NY",4 star rating,Adorable and charming spot to get your vegan fix.I had their tasty burger - which for a veggie burger had great texture and held together. All you want in a veggie burger. Their big salad bowls are solid as well.
/user_details?userid=Gdyzk0Bq4CMsp8onOsdsdA,Serge N.,"Montreal, Canada",2 star rating,Benedictine that don't include eggs or hollandaise by default. Röstis that are fried way in advance. Pear toasts that can't nail the right taste nor texture. Staff that clearly doesn't want to work there. Coffee that's WAY worse that McDonald's. At least they have the decency to not charge crazy prices.
/user_details?userid=3dRM4nuOI2Hs0AbiMQdWrg,IS Palette S.,"Toronto, Canada",5 star rating,"Here are a few bites from our full experience blog review - ""Light, airy atmosphere with lots of white and greens plus beautiful copper accents coming though all awaited us inside.""""This little place is perfect for vegans, vegetarians and people with food intolerances.""""With ""Je Suis in Herbivore"" written on the side of their plain white t-shirts and other messages like ""Je Vie En Une Jardine"" we appreciated this easy going, humorous, youthful vibe."""
/user_details?userid=eoGFI3g5Rx2_42W6rrgU3w,Annie Y.,"Richmond Hill, Canada",5 star rating,"Loved their food, not many selection but food are good! Not a very big portion of food, but is enough if you are not a big eater. =P Atmosphere is very nice, gets packed easily."
/user_details?userid=5WdBw9XyBEYi4Dzb4UhvIQ,Jonathan K.,"Westborough, MA",5 star rating,"Some of the best vegan food I've ever had. If you want to know what the full extent of vegan cuisine is, come here. The kimchi fries are to die for, and the desert is killer! Only complaint is that it's on the expensive side (and rightfully so) so be prepared to spend a lot if you want to try everything."
/user_details?userid=Grz7ijVPXEXI-RvsMZI6Zw,Kristin P.,"Chestnut Hill, MA",5 star rating,"Absolutely loved having lunch at LOV during our trip to Montreal! Beautiful outside and inside eating areas!! Lovely staff. Since it was our first time, we tried a variety of things and shared: Vegan Mac and cheese, vegan nachos, vegan poutine, and a salad. All really tasty!!! Would definitely recommend!"
/user_details?userid=PuzMIxyvmoU81W48MtMRjg,Chris P.,"Carmel Hamlet, NY",5 star rating,"BEST!! Service, best food. Vegan food can be good but this was next level. Server was so kind and helpful! Even if youre not vegan, this place slaps! Their Truffle and Caviar pasta was amazing, arguably better vegan than it wouldve been with traditional ingredients. Restaurant was casual but beautifully decorated, very artsy and trendy decor, a bustling spot you definitely want to sit at. Outdoor area is nice! Love this place through and through, will definitely eat here next time I'm in town!"
