user_url,user_name,user_city,user_rating,user_review
/user_details?userid=w7Lr5GQOAa4XhoYm18yWHA,Christie W.,"Montreal, Canada",4 star rating,Been Lov 2 times. Their options are diversified and menu is updated on seasons. Food is good.
/user_details?userid=xjfBEGfgC9UcJLIV_Czodg,Casey F.,"Severna Park, MD",2 star rating,"Great bartender and drinks- atrocious service. Never actually got my entree because both the kitchen couldn't handle the volume of orders and server failure. Very disappointed. I spent hours here and had very little food in my stomach to show for it. There are many great elements- they just can't seem to execute because of poor management of the dining experience. Three stars for drinks and appetizers.On a side note, if Yelp didn't hide bad reviews by calling them ""not recommended"" I would have read those reviews and known what to expect because the not recommended reviews of this restaurant are actually spot on with my experience."
/user_details?userid=PPcOPmObmXP80nDIt6XjZg,Mandeep K.,"Brampton, Canada",3 star rating,"The atmosphere was no doubt one of the best. The ambiance and decor was very tastefully done and the staff were very friendly. However, I wish the food had more flavour. The garlic aioli for example tasted like the store bought veganaise (unflavoured version). The burger patty was very dry. The food itself was over priced."
/user_details?userid=MXEFT3vZYil7ZGCfY38UVQ,Lizette F.,"Arlington, VA",5 star rating,"We were in town for a family vacation and stopped in Lov for brunch. Our large group of six was quickly accommodated, but we were lucky! Within 25 minutes the restaurant was bustling, full of reserved tables. The food was delicious and priced as you would expect given the chic atmosphere. Every inch of the space is Instagram and Snapchat ready, including the food. As for flavor: you will not be disappointed. Vegan brunch? Delicious? It is possible!Had the avocado toast with a poached egg, the berry grilled ""cheese"" (vegan), and the green juice and was totally satisfied by the modest portion, full flavors and good coffee. Even my parents were happy with the Lov Benedict and Lov Burger.TIP: Make reservations!"
/user_details?userid=PmyBGG-bWSgHD98vgkZYWA,Katelyn T.,"Saint-Hubert, Canada",5 star rating,"Lov is wonderful! Both in terms of the food and the atmosphere. The place is adorable, so much so that it'll make you want to have their interior designer redecorate your home. The food is inexpensive and delicious. I love the veggie burger! My friend loves the mac and cheese, too. My brother is a hunter (and thus, an avid meat eater) but he loves this place just as much as me and my vegan friends do. Definitely check this place out if you're vegan and also if you aren't!!"
/user_details?userid=qqA0We0VUn2cazJbw_B3vA,Shab N.,"Ville-Marie, Montreal, Canada",4 star rating,"Cute and fresh ambiance. Couldn't stop checking out the decor from the entrance to the bathrooms. Made you feel like it was summer already!Food was refreshing, great veggie combinations. Not a fan of ""vegan replacements"" in general - but they fooled me. The cauliflower dish was so yummy! Must try! Service was hospitable, attentive and informative. Will go back, again and again."
/user_details?userid=eNORuY4cjyQStMygVSSYZQ,Meimei Z.,"Vancouver, Canada",5 star rating,"The decor inside is very chic, a great place to stop by for brunch on your way to tour around old port. Although I can't really comment on the food since I have the total opposite of a vegan diet, my friend (who loves everything vegan) loved every dish we ordered :)"
/user_details?userid=Xlqxirfs1rZogrv2tukNqw,Jane L.,"New York, NY",1 star rating,"My friend and I went to Lov for dinner last night - I am a big fan of vegan food and she hasn't tried it much but is open-minded about it. The restaurant itself is beautiful and has an amazing ambiance, but unfortunately, the food is horrible! I opted for the eggplant appetizer - there were nice flavors, but I couldn't get over the fact that it was just large, soggy, cold pieces of eggplant in a soup. My friend got the kale mac & cheese, which our waitress told us was mindblowing but really had no flavor and just tasted like plain pasta in mashed squash - definitely ""not worth the calories"", as she said. Next, for the entree, I got the summer garden salad and my friend ordered the Caesar salad. Both were absolute letdowns! They were both just huge portions of greens with a very acidic yet flavorless dressing - the only difference between them was the small sprinkling of toppings on each. Mine had some fruit and hers had tomatoes, dry & plain croutons, grated almonds instead of parmesan, and capers which have no place in a Caesar salad! Maybe we ordered the wrong food, but we left the restaurant with disappointment and stomach aches (from the huge acidic salads). Our meal cost us $70 - I wouldn't pay more than $20 for this."
/user_details?userid=EK9ZARKop5qiXlz7wA28jw,Ben R.,"San Francisco, CA",4 star rating,"Delicious vegan fare in a bright but cozy, not antiseptic atmosphere, with friendly service. A bit pricey for the portion sizes."
/user_details?userid=H4DFHgX4QsG8_GVO5JjBhA,Anna P.,"Irvine, CA",5 star rating,"Glad this was one of the closest restaurants to where I was staying in Montreal! Went for brunch on a Sunday and back later in the week for lunch before heading to the airport. The staff was very helpful and friendly. The gluten free waffle was a bit heavy, but delicious. The strawberries, yogurt, and chia gel on it was perfect. The beet salad for lunch was out of this world. Extremely tasty and light but satisfying. Looking forward to going back when I visit Montreal again!"
/user_details?userid=QBe3oadPKot2mtuh8jB1UQ,Gurvinder K.,"Ville-Marie, Montreal, Canada",5 star rating,Very fairly priced vegetarian and vegan options for with a great ambiance. I tried the vegan mac n cheese and couldn't tell the difference from the real thing!
/user_details?userid=zANxYvQu4tSpXoZ4L6r6Rw,Arielle J.,"Southwest, Montreal, Canada",2 star rating,"First time trying vegan food and did not really enjoy it. The burger was quite dry in my opinion. The Poutine gravy sauce was cold, so although it was in a cast iron bowl the meal was cold. The gnocchi was just okay, the consistency of the ""pasta"" was too chewy. The decor was  incredible though!"
/user_details?userid=A7YlcidsiAZzU-tCSsrTSg,Anny T.,"Montreal, Canada",2 star rating,"When I was in LA, I've tried a creative gourmet vegan restaurant named Erven that blew my mind, so I was pretty bummed about coming back to Montreal. When I discovered an upscale vegetarian spot is opening in Montreal, I was beyond excited. We have a lot of decent vegetarian spots, but LOV is dubbed as the one with a creative twist. Good: Conveniently located in the Old Port right by Square Victoria, this seems like the perfect spot for locals and tourists. The interior decor is beautiful, trendy, and totally Instagram worthy. I was excited just entering the restaurant. Lots of greenery, exposed white brick walls, and just simply gorgeous decor. As for the food, the best thing I've had here was the kale Mac & cheese. Even my boyfriend was surprise that 'it's not real cheese?'. Service was very good, the waiters were attentive and courteous. Bad: they don't have an English menu, which was a bit surprising considering it's in such a touristy area. I understand some French, but still had to ask the waiter to explain some of the dishes. I really wanted to love this place, but I honest felt the food was mediocre and menu description sounds better than the actual meal (except that Kale Mac and cheese was 10/10). I've ordered the 'Hero', (note: the staff was accommodating when it came to my sesame allergies, big ups!) The dish came in a beautiful bowl, nice presentation, but tasted horribly bland. Few pieces of unseasoned steamed eggplants were buried in the middle. The napa cabbage was minimally flavoured and kind of soggy. The tempeh was okay. Very small portion, but that was fine because the Mac and cheese was very filling anyways. Basically, the Hero was more of a Zero.My boyfriend ordered the Rave, which was celery root. Beautiful looking dish, however the only part that was good was the guacamole and pickled onions (I think). The grains were pretty flavourless so I didn't really enjoy it either. I think I did more of a Rant than a Rave.We also had a brownie for dessert at the end, which was okay. The almonds were a bit over roasted and the brownie was really hard. *sigh*The food taste like something from a culinary school, beautiful presentations, but the flavours and skills are not all there yet (except that kale Mac and Cheese).Bottom line: I probably wouldn't go back by choice. If my girlfriends want to try it, I might give it a shot again just to order the kale Mac and cheese."
/user_details?userid=LGnqkKdL2qyQpjsN8mmGDw,Lily H.,"Etobicoke, Canada",5 star rating,"This is a must try place if you are vegan. Me and my friend had quinoa fritter, sweet potato fries, mush risotto ,golden curry and cheezecake for dessert. The quinoa fritter is so unique it has jackfruit and it doesn't taste like vegan at all. Sweet potato fries are cooked in perfection. I LOVE the mushroom risotto. It is extremely tasty and I can't believe there is no seafood to make it that tasty! Also the cheezecake which made out of cashew cream is the finest dessert. Every dish is made to perfection and looks beautiful. For the quality of food, the price is very decent!! Overall, love the place wish to come back have more!"
/user_details?userid=sZxdtnrVCMyGtmSuG2XJ6Q,Summer V.,"Boise, ID",5 star rating,"Fantastic experience while visiting Montréal. I love LOV! Beautiful ambiance inside with friendly staff, upbeat music and clean and modern decor. I had the Coconut Curry and it was delicious! Sauce was amazing and vegetables were cooked to the perfect texture. Such a great place I plan to come back every day during my visit!"
/user_details?userid=zIDUDgoHsfvsi8oS8QlgIA,Jodie B.,"Brooklyn, NY",5 star rating,"My friend and I took a chance and stopped into LOV last night in hopes that we could find a table - and sure enough, we grabbed the last one! We were so thrilled to try their fresh cocktails (I had the tequila-cocktail, she had the gin-cocktail, both were great), and we had a REALLY hard time choosing what we wanted on the menu because everything looked so good. We ended up sharing the: quinoa fritters, mushroom carpaccio, the Rebel, the risotto, and the chocolate brownie. Everything was beautifully presented and delicious!  The staff was absolutely charming, the atmosphere felt inviting, fresh, and innovative... everything about it felt great. FAB spot!"
/user_details?userid=6oljgiQto2Dkbn034ixA9Q,Leila H.,"Montreal, Canada",3 star rating,"Glad I found another vegan 'upscale' restaurant in Montreal. I went with my girlfriend after seeing the picture perfect shots on instagram. The decor is truly gorgeous, bright and cozy!! We both had the LOV burgers for lunch because apparently it was suppose to taste like a big mac or exactly like a ''real'' hamburger but....it was kinda tasteless. The service is friendly but took a bit before we get our plates. I will definetly give this place another shot since its so close to my work, I want to try their poutine!"
/user_details?userid=dHLmDXwP2-ckmpyt79Yheg,Stefan K.,"Toronto, Canada",5 star rating,This was our first stop in Montréal and we somehow managed to unwittingly time it right to not need a reservation. The staff were excellent and gave us a meal that set the bar very high. As far as vegan places go this not only ranks tops within the city but I would say anywhere. Not only did we have the most delicious poutine that incorporated kale chips along with a gourmet version of a Big Mac (The LOV burger) but we also had a meal so delicious and healthy it left us fulfilled of our taste and health cravings. It doesn't stop there though the ambience is like no other and the cocktails are to die for. We didn't have desert because our bliss factor was already through the roof. This is a must if you are in Montréal.
/user_details?userid=EJ5ybtY1FqieuS22LHbT1w,Claire L.,"Montreal, Canada",4 star rating,"Super well made and well plated food at a price. Small but high quality wine list. Large glass of white wine is 17 dollars, small glass is 11. Personally I find this to be a bit over priced. Would recommend les croquette de quinoa. Found the Poutine a bit salty. Was not overly impressed by the Chou fleur entrée. In general their plates are not large, so you will have to order a good amount of food.Their desserts are constantly rotating, but we got the cheesecake and really enjoyed it! Excellent ambiance, not overly packed, even though it seems to be challenging to get a reservation here. Relatively quick food service"
/user_details?userid=3el8cM1GhOSvZvcQ6qTrRA,Grace H.,"CA, CA",5 star rating,"My family and I visited this location on a Tuesday night - LOV was crowded despite it being a weekday. Service was very friendly and willing to accommodate the dietary needs of one member of our family, which was very meaningful for us. We ordered the gnocchi di casa (sweet potato gnocchi), mushroom risotto, fries, and a green salad. My family shared all of the dishes and agreed that every single one of them was good - the flavors were so rich and appetizing that you could not tell all of it was vegan, plant-based, and mostly gluten-free. We were very impressed and would definitely eat here again!"
/user_details?userid=0fBUD1_9sNSUvlVK8y9Wow,Eric A.,"Alpharetta, GA",5 star rating,"All the great reviews don't do this place justice! This place is amazing. Staff was wonderful and extremely friendly. Food was exceptional. We had the beet tartare to start. My wife had the truffles and caviar, I had the risotto. Dessert we shared cheese cake and crème brûlée. Hands down, the Risotto was the star of the evening...it's one of those dishes you'll continuously think about. I'm a meat eater, but wanted to take my wife (near vegetarian) out to eat to celebrate our anniversary -- this place could turn me into a vegetarian...it's that good. Definitely would recommend."
/user_details?userid=hkgzyrs3qenNS1_jXgArIg,Miguel Z.,"Philadelphia, PA",4 star rating,"Usually vegan places serve premium priced dog ass...this place was different. I got kimchi fries and left certain that no other plate of french fries will ever measure up. Sorry Chickie's & Pete's, but the vegans got you on this one. Other than that, I think I was the only male in this jawn apart from one of the waiters who had a man bun."
/user_details?userid=gZMV-lduevgtyPILvHe7oA,Tony V.,"Grand Rapids, MI",4 star rating,"One word. Incredible. Great food and atmosphere. One of the best Vegan or Vegetarian restaurants I have ever been too, period. Lots of creative items to choose from. I hade the Mushroom Carpaccio to start - better than the real thing. Gnocchi for main course - excellent preparation and flavors. Glutenberg gluten free IPA in a can - surprisingly satisfying. I would make it my go to beer if I could find it back in Michigan. Attention Michigan craft brewers - consider tapping into the gluten free market. (Pun intended)I gave it 4 stars but it's really 5. I don't want to give the impression that I just give out 5 stars to everything I like. However, if I come back and have a similar experience I am sure lov can earn 5 stars  - no problem. I look forward to eating at lov again on my next visit to beautiful Montreal!"
/user_details?userid=EZc6IQtM0UI_uYVomjcJaQ,Pau A.,"Fort Worth, TX",1 star rating,"This is probably my least favorite plant based resturant I have tried.  The portions were ridiculously small. My gnocchi  was very dry.  I told the waitress but noting was done to fix the problem.  The salad was tiny, expensive and very ordinary.  No special veggies, no special dressing  just a salad in a flower pot.  Seems like the money and energy goes into the decor. The decor is adorable and the waitress was kind but not enough to return."
/user_details?userid=hiSGGFiLUwDss3HNUIuZAQ,CM L.,"Montreal, Canada",1 star rating,"I ordered gnocchi and my friend ordered the Beets sandwich. Gnocchi was tasteles, friend's beets sandwich was nothing spectacular certainly something we could have made our own. Cocktails were bad. I didn't see how the drink was made but it certainly didn't taste like there was any shaking or effort needed to make that drink. I could have mixed my own tequila w abit of pamplemouse juice at home. So many more better cocktail bars in Montréal so they certainly need to buckle up if one is charging $11 for such quality. Too much hype about this place. It was probably one of those ""to-be-seen"" spots in Montréal. Who would have thought we would leave this place deeply disappointed for somewhere that requires reservation two weeks in advance. Doubt I would never go back and it isn't something I would recommend to any of my friends as there are much better options out there for vegetarian food in Montréal."
/user_details?userid=di4lb-LD53Gort7RzwF73w,Simren J.,"Hauppauge, NY",3 star rating,"Beautiful decor, upscale-ish, food is amazing!!! And so so pretty inside, classy and bo-ho ish. However their were a lot of flies, and it made me not want to continue eating. Super unhygienic and gross. Didn't like that"
/user_details?userid=XZfv70IsujPrIMGKeL9kdw,Vanessa F.,"Montreal, Canada",5 star rating,"Came here on an early Friday evening to meet a friend. Make sure to reserve. Beautiful space (spacious yet intimate and romantic), good and attentive service, and great food. Pricey but worth it. Can't wait to come back and try other options from the menu."
/user_details?userid=EoDmDW64_EDQ_6jH_R3Bow,Eric P.,"Rye, NY",4 star rating,Great food and prices.  Great and friendly service.  Nice decor.  And hostess seated us despite being crowded and not having reservations.
/user_details?userid=uKQwQ-rjpvNDv2vd5sW6Iw,Gol S.,"Montreal, Canada",1 star rating,"Worse service, worse vegi food in Montreal...poor attitude.overpriced for what you get."
/user_details?userid=vQjVTRVS0CM8Q0iinE0cgQ,Renee M.,"Durham, NC",3 star rating,"Food was fine. The kimchi fries were definitely the best thing we ordered. The veggie burger was very good as well. The zucchini spaghetti was promised to be very truffle-y, but it had an overwhelmingly taste of black pepper instead. The caesar salad was also lackluster without the thick flavorful dressing of a traditional caesar."
/user_details?userid=tpBIR5DM8CaNuA2qlcxdfQ,Oliver C.,"Dorval, Canada",4 star rating,"Every time I go to this place I try to get something new because so far I've loved everything I've had. The interior design is perfect. Be careful ordering the onion rings though, they're huge and really messy to eat. The service at this location is a lot better than the La Montagne location in my opinion."
/user_details?userid=ZuYNS9eNhSNy32YYYv5fUw,Fran F.,"Pointe-Claire, Canada",5 star rating,"Everything about this experience was very quick. We seated quickly, tended to quickly, and served quickly. It was very busy for almost 2 in the afternoon. Nothing wrong with that, they were busy for a reason. The food excellent. I ordered the LOV burger and it wasn't exactly my cup of tea because I'm not big on vegan food but it was very tasty (other than the vegan aspects, haha). Also very affordable"
/user_details?userid=pjg1SzYYYrxT-IK9hw-rFA,Ryussui A.,"Dry Creek, Campbell, CA",5 star rating,"Super friendly staff, we did not have reservation and they were able to accommodate us. The kimchi fries and the creme brûlée were spectacular... and all is vegan :)"
/user_details?userid=8p4JGNgZl705fByqyF6BrQ,Monyka T.,"Montreal, Canada",4 star rating,"I am giving it 4 stars just because it's vegan, but it really only deserves 3 stars. The quality of the food is great, but the flavours are just a little off. We've been twice now, tried different dishes, and every time everyone at the table is slightly disappointed by the flavours. The dishes are so close to being delicious, yet so far. I will return on invite, but won't be suggesting it as a go to spot."
/user_details?userid=JEJT2tAcwUUj9k9wUbw-hQ,Stacie O.,"Woodside, Queens, NY",5 star rating,Great Nachos!! I am vegan. And these are probably the best vegan nachos I have ever eaten. The mac & cheese is also very good. Service was great.
/user_details?userid=Eqk0ppInDgtFSuBjbchfmQ,Tina L.,"Montreal, Canada",2 star rating,It was my first time . The place looks amazing . Our table was at the far back . We were afraid for the service but that turned out to be the high light of the evening . The service is AMAZING!!! Now for the food . Sorry to say but very bland . Everything looked great but the flavours were just not there .
/user_details?userid=1-InP8lBeLIryDeDhFcyVQ,S O.,"Orlando, FL",5 star rating,The food was outstanding.  Great place to go for Vegan food.   So many options on the menu.  Every dish we ordered was so delicious.  Very nice ambiance and decor.
/user_details?userid=oBdoW70bmmcmppjBu70odA,Kayla T.,"Ville-Marie, Montreal, Canada",5 star rating,Everything you heard about Lov is true! Except the squirrel attacks.Our favorite place for vegan brunch!
/user_details?userid=Tu5YAg-M7yQgxiFE5s2fDg,Camilla H.,"Manhattan, NY",5 star rating,"Great food! The tastiest vegan meal I have ever had. Try their avocado starter, it was really good. The personnel was friendly - it was a pleasure."
/user_details?userid=XK5NeMRDrwqSa9XQIWyskA,Yacine M. D.,"Montreal, Canada",3 star rating,Vegan/ Vegetarian place! Go for the beautiful decor and fresh food! I had the sweet potato gnocchis which were a little bland but still satisfying! I look forward to going there again specifically to try their brunch offers.
/user_details?userid=laFwsknjneH2QoGeLbemTw,Didier H.,"Montreal, Canada",4 star rating,"For a non vegetarian, I was pleasantly surprise how satisfying the plates were. I recommend ordering two plates per person. The lov Poutine taste amazing"
/user_details?userid=cbF5pnqEKb-I4ElK0M4C1A,Chiara P.,"Chicago, IL",5 star rating,"first vegan meal...amazed!I am by no means vegan and was hesitant to spend a precious dinner meal at anywhere other than a gluttonous, French restaurant while in Montreal this past weekend. My friend and I came across LOV on a walk and were drawn in by its dreamy decor. I ruled it out for an option to visit later that night because it was vegan but was convinced by my friend...best decision ever! Honestly if no one told me all the dishes were made vegan I would have never guessed. The decor, cocktails, mains and dessert were to die for - and I felt that much better afterwards knowing I had eaten something slightly better for me than I usually would. All ingredients are seasonal and local as well. The mushroom risotto and creme brulee were incredible! I will be eating more vegan food now and I hope it's as amazing as LOV."
/user_details?userid=1Icmz3CDIwKE1Jfn4itL9g,Mandy P.,"Montreal, Canada",4 star rating,"Beautiful ambiance - truly a gem in Old Montreal. The food is fresh, unique and hearty enough to satiate any non-vegetarian/non-vegan. I can't help but to order the Lov Burger every time as it is so, so good. Only con: desserts aren't great, and definitely ""taste vegan"" - might be off-putting if that's not something you're familiar with."
/user_details?userid=NNLywVTGhPgyYfT6jEQLGg,Greg S.,"Atlantic Highlands, NJ",4 star rating,"This place is the real deal, the food is top notch the decor is beautiful and the staff is amazing. Would have gotten a 5th star but it's upsetting when a vegan restaurant can only make a non vegan Bloody Mary."
/user_details?userid=e209ZX8jCn2O_z1pxDEwcg,Kirk S.,"Arlington, MA",4 star rating,"The decor was perfect. The food was good and innovative, but some of the flavors/textures were a tad off even for a vegan/vegetarian restaurant. The top seller, gnocchi, was too basil-y, I would add more pine nuts and real/fake cheese. The Indian chickpea pancake dish was far too dry."
/user_details?userid=bCC9m7vuNKISQ-ckJ98fJQ,She H.,"Montreal, Canada",3 star rating,"We came here for brunch a few weeks ago. Walking into this restaurant in the morning is like a breath of fresh air. The decor is beautiful and the space is bright. The service was friendly and we got great recommendations.  I love that the drinks come with your choice of milk alternative, be it soy, almond milk etc. I thought the menu choices were rather limited but I was happy with my meal choice.I had the coureur des bois: a spicy, but flavorful brunch item.  Don't order it if you can't handle spicy food.  The smoothie bowls that my friends ordered looked beautiful, but I can't justify paying $9 for a smoothie that was poured into a bowl and then topped with a few goji berries and oatmeal. I am sure it was much healthier than what I had though. Overall I think it's a great place for vegetarians and vegans, but with so many choices in town, I will be trying out other brunch spots before returning to LOV."
/user_details?userid=55rm9_A0EIofkx41SgnJZQ,Lino C.,"Montreal, Canada",4 star rating,Delicious vegetarian new resto in town. Everything in the menu sounded deliscous and what we ordered didn't upset. Definitely recommend this place... oh and the ambience is amazing too
