user_url,user_name,user_city,user_rating,user_review
/user_details?userid=CfKT4Pr7QYIUlcq4fnKfgg,Clara S.,"Chicago, IL",3 star rating,"Really not a fan of the wait that comes with this popular restaurant, but I guess that's what is to be expected with such a crowded spot. It's right by the water and all outdoors, so it's popular this time of year for good reason. It also has a nice dj pumping some club music to get the vibes going too. People dress like they are going to the club here..one thing my coworker's and I did not come prepared for..We had some glasses of red wine and ordered after waiting for our waitress forever. The charcuterie board was delicious and of good portion, and the kale and goat cheese salad was also another great healthy starter. The beets in this salad were tasty and sweet. I also got the grilled salmon, which was kind of small and really salty. We also ordered another round of our reds, which I noticed I received a much different tasting glass the second time around..so now I have no idea which red I ended up drinking...Our waitress was nice, just expect the service to be slow at first and waiting in line for a table beforehand. Come dressed to impressed and ready to party. It's a good spot for drinks and very small plates before going out."
/user_details?userid=wQ7aR99gBCPaiE_fD0jiyQ,Laura R.,"Montreal, Canada",1 star rating,Discriminatory place against people of colour. They made a public apology and blamed their discrimination on corona  really a joke. Food and drinks are not that great and overpriced. So many better places in Montreal.
/user_details?userid=O70Ls-Nf52BEnKb-D6vdeg,Johnny F.,"Montreal, Canada",1 star rating,"Awful customer service, the food is underwhelming, I order some chicken and it was raw at the center (I am too cute for a salmonella infection !) the sangria was diluted with water. The waiter seemed to hate his job,  and the bouncer is an arrogant and rude twit. I will not come back to this place ever again."
/user_details?userid=yERJfPKhhU49aJAJ6DvqEg,Sian D.,"Kirkland, Canada",4 star rating,"Went for brunch (around 12pm) with some friends for a birthday. Food was really good (especially the mini macs) and the sangria was super delicious (although maybe watered down). Nice atmosphere and sweet staff. However, I would not recommend if you are a big group and looking for a nice sit down meal. We were too many to sit at a table so they put us down on the couches. We ended up eating our food on our laps, which isn't the most amazing meal experience. The fruit smoothies they brought as a substitute for mimosas were terrible (none of us could finish them). Overall, would come again if it was just me and another friend. Cannot comment on how it is for boozy brunch later in the evening though, but I would be open to trying that out."
/user_details?userid=kYdMjK6GHUfQ7g97SnWNyg,Gogo G.,"Longueuil, Canada",1 star rating,"Very bad service, way better options in the city. Wondering why they are still open..."
/user_details?userid=9DhQeZZYbHQFui-pSIWkpw,Ameya B.,"New York, NY",2 star rating,"Checked out this place for a mid day drink while vacationing in Montreal. We were walking around old Montreal and on a rather cooler day, decided to take a walk around the harbor.This place is bit of a walk, but the set-up itself is pretty good and it was the 7 of us and we were seated in a Cabana - comfortable seating too.We ordered some finger food and a few drinks - nothing great about both and we found this place to be a little expensive. Service however was excellent and they have a very friendly and welcoming staff."
/user_details?userid=OP7nO0dIaYW0O6DYX8-azQ,Charles H.,"Montreal, Canada",1 star rating,"Last year the food last rather bland, the customer service was basically non-existent and I was left with the indelible impression that this place is overrated (and overpriced) and the only nice thing about it is its location and the views. This week I brought my elderly father for a walk to the Old Port, we passed by and he needed to use the bathroom, I explained the bouncer it was an emergency situation and still he was reluctant to allow him use the bathroom for a couple of minutes. I fully understand that some establishments have restrooms only for customers but sometimes one has to be flexible given the circumstances, instead, the bouncer refused the access with a smirk on his face and was starting to become aggressive. As far as I am concerned this place does not deserve my money and can go out of business anytime, probably it will and when it happens I won't be ashamed to say that I will feel a bit of ""schadenfreude"""
/user_details?userid=GlEhxPlaofxOOvcf-5guvw,Cindy D.,"Montreal, Canada",2 star rating,"We were looking for a place to have a drink and relax before going for a ride on the Ferris wheel, and Terrace Bonsecours seemed like the best option. It was an experience, how to say this hum ... interesting, because it has confirmed several things to me including stuff about myself:A) A pitch of sangria at the price of $ 30, does not necessarily mean that the content will be of quality (*cough cough* kool-aid)B) A lounge bar with such an idyllic location does not mean that the clientele will be as consistentC) As I get older, soirées populated of under 21s are not really my thingNeedless to say that I will not go back but at least I tried."
/user_details?userid=mHNtArKcW30P0zaxDOxtng,Melissa Z.,"New York, NY",5 star rating,"We found this place by accident in I guess where some would consider the touristy part with the ferris wheel. However, the clubby and tropical scene was great! We got strawberry lychee margarita pitcher to share and it was delicious and very inexpensive. Felt upscale, but without the crazy prices."
/user_details?userid=p0bhaLNXg2nWqWEK5TZ6AA,Alexandre C.,"Montreal, Canada",1 star rating,"Unfriendly staff, wont even let you in if you have a reservation, this make no sense after that they said could be the dress or something else but wont precises.. wont go back to that place."
/user_details?userid=9zpcZZP5dPQK5eJ8uZ4lWg,Alexia N.,"Riviere-des-Prairies—Pointe-aux-Trembles, Montreal, Canada",1 star rating,racist arrogant people. Desman Murphy has a horrible attitude and refused service to a non-white group simply for their skin colour while also letting a group of 15 people at a time which is against the law. Horrible.
/user_details?userid=vj-gGhmf8zw4FJiJ4oWGjQ,Beantpreet K.,"Montreal, Canada",4 star rating,"Great place for hanging out with your friends, especially when the weather is nice. Also, if you're a sangria lover, this is the place! They have tons sangria choices. I really like this place because of the amazing view and good music. Note their food is quite average."
/user_details?userid=g-y4Me4bqDz8jwFzX_e17w,Norine A.,"Montreal, Canada",2 star rating,"I have been here a few times and each time I  have felt I was missing my entourage, yacht party and boom box entering in. I came here on a Sunday with a friend to grab a drink (even though the sangrias are legit over priced at 30$ a pitcher serving diluted water down kool-aid) . The location and the decor are impeccable. The points drop with the loud music and very young crowd. I had no idea that people deck out in clubbing gear on a Sunday night- I guess Bonsecours equates to the Vegas of Mtl."
/user_details?userid=yphnJ8zYbJF7Y3QbtMj91g,Shahanaz B.,"Southwest, Montreal, Canada",3 star rating,"I feel I am somewhere down south. Outdoor and all the plants around, a perfect place for the summer. The music is fun. The service is very helpful and amiable. Our waitress Anesthesia recommended us the sangria with champagne. The drinks were tasted so delicious and it was refreshing. The stars go down, the food was very bland. More flavor needed."
/user_details?userid=dSbadqJziiYWNBURY8RkYg,Tamiah B.,"Pierrefonds-Roxboro, Montreal, Canada",1 star rating,"We made reservations for two and were there ten minutes early and only got seated 20 minutes late. The waitress came once to take our order two minutes after being seated and never saw us again. We got a table literally 2 feet in front of the entrance lineup, it was stressful and our chairs kept getting kicked. We stayed for about half an hour and received no helpful service so we needed up leaving. Definitely not a good place to go for two."
/user_details?userid=wPT7Uxcn0IMxnPa7AM-NWg,Priscilla L.,"Salt Lake City, Salt Lake City, UT",2 star rating,"My friend and I were starving and I remember this place from years ago when I came once for a drink with friends. I suggested we go here since we were in old port and didn't want to travel far. We should have travelled further...We first had 2 glasses of sparkling wine which took forever to be served. And not just a long time for drinks, but a long time for anything to be served at a restaurant. We also had 2 salmon tartares and a salad to share. The tartare was ok but Montreal has so many great tartares, why settle for that? They served it with 3 pieces of bread soaked in butter so it was soggy - it was terrible. The salad was also just ok with the vinaigrette being too sweet. Overall, it was really mediocre food with a price well above that.They do have a nice terasse but it's not worth the overpriced food you get with it."
/user_details?userid=UDFIZXP0kOb2xKoYToTS6w,Julia D.,"Montreal, Canada",1 star rating,"Terrasse Bonsecour is located right in the heart of the Old Port.  It's a beautiful spot in summer so if you want a four or five star experience here, come, admire the view and leave because after that it goes downhill very quickly.Everything here is as overpriced as it gets.  We were a group so we ordered a few sangria pitchers.  They were all very weak and overly sweet and just not worth the $30 price tag.  Unfortunately the food was no better.  They boast a tapas menu but the portions are so small that you can really only share with one person tops if you hope to have any food yourself.  I actually left still hungry and had to stop for a burger on my way home.  I also found the food to be bland and uninspiring.  A grilled asparagus tapas dish seemed to have no seasoning whatsoever and the beef tacos I ordered were dry and lacking flavour.  Once again the dishes were vastly overpriced given the portion size and quality.Now the real issue I have with Terrasse Bonsecours is the obvious double standards that they have for their employees regarding the dress code.  The male employees wear standard polo shirts and pants while the female employees have to wear high heels and super-tight, skimpy dresses that don't leave much to the imagination.  This was pretty darn sexist if you ask me.To top it off the service was all over the place.  First up we were given two menus when we were a group of 10.  Let me tell you that that doesn't work very well.  It also took quite some time to do standard things like place an order or get a bill. I have to say that despite its stellar location the Terrasse Bonsecours is not worth the visit.  Save your money and go elsewhere."
/user_details?userid=EM7GeJPO0f7Lrq4HXotECA,Sarah J.,"Côte-Des-Neiges—Notre-Dame-De-Grâce, Montreal, Canada",5 star rating,Lovely place. Very nice staff. Great drinks and fun ambiance. The prices of the drinks are good for the amount they provide. I recommend trying their sangrias.
/user_details?userid=ULaj9CNCB0zBDaThC4-aFg,Marvin J.,"Chicago, IL",1 star rating,"Beautiful women, great vibes but terrible management. It was our last night in Montreal and we had a section, there was about 12-13 of us and we had already purchased 7 bottles and had been there from 9pm until 1am and they kicked us out because they had a prior reservation that was supposed to show at 11:30 but they told us if they didn't show it was ours to keep. We had just purchased TWO more bottles and they made us leave full bottles. I will never visit this establishment again because of this treatment."
/user_details?userid=hOXDcekNFwfXz5BVOxqkkQ,Ed H.,"Clovis, CA",1 star rating,Horrible management and client services.  I'm a medical doctor from California.  I called the venue and was told a reservation was not necessary. I insisted on a reservation to no avail.  She emphasized once again that it was not necessary due to the time of the day.  On arrival(approximately 4:20pm) security and later the manager(Desmond) asked if I had a reservation.  I explained the phone conversation to them and though they understood the miscommunication they refused to allow me entry.  The venue was not full at the time and while I waited other clients arrived who were not on the stated guest list but were allowed in without issue.  I do not want to rush to conclusions but I can only wonder if my appearance played a role as the other clients who were let in were white.It's unfortunate for the owner because the manager and security team are distorting the image of the business.  I hope the owner of the venue is aware and I encourage everyone to take time to write a review good or bad.If my experience is an isolated event the good reviews will drown the bad.  I was at the venue about a month ago without incident so it may just be an isolated event.
/user_details?userid=sLhx_e9CveYKWQXUzUeCfg,Sunshine M.,"Northern California, CA",3 star rating,"Sunday Funday- boozy brunch is how locals describe this place. Security everywhere and doormen and it's only 6pm. Lower level has a bar and tables ( reservations suggested ) upper level is more relaxed, long bar, highTop tables with views of the port. ( Kodak moment) and views of lower level. Music is electronic/ house/ loungey. Not terribly loud. Friendly service. The biggest surprise was the POUR. It's not freehand or bartenders discretion. It's computerized. So if your drink isn't "" strong "" enough, be ready to pay for more/ shot. This is the ONLY place I have seen using this technology. Bought a small pitcher of sangria $22 and not strong as I'm used to in Nyc. Oh well- it's canada. Good for date - casual hangout. Dress code was all over the place. 3 stars for bartender Pascal. MINUS 2FOR RUDE BLONDE WAITRESS STATING A BUSBOY SHOULD HAVE HELD MY SANGRIA AS I WALKED FROM UPPER LEVEL TO LOWER."
/user_details?userid=_OkEXLN_5T9cMc3UFrLT9A,Lily A.,"Montreal, Canada",2 star rating,"They luck out on having a great spot in Montreal's old port. Unfortunately there are no other pros.Even for a Tuesday evening service was slow and casual. Drinks were served quickly but the ""tapas style"" food was not worth the trip. All 3 of our orders came out at varied times (make that 2 out of 3 as it wasn't until everyone got their food that they mentioned they were out of whatever I had ordered).We barely saw our server throughout our stay but she made a lasting impression when she mentioned to a friend that a 15% tip wasn't included - note that this was after she had already been tipped over 15% by said friend. The food itself came in the teeniest tapa portion I've seen and cost the price of what could be a full meal.Overall generally unimpressed. :("
/user_details?userid=-w7ww3yW5BHE3TFyj3IHuQ,Carolina M.,"Montreal, Canada",1 star rating,"Can I have my money back please?The WORST PLACE in MTL. Seriously.I'm a local and I've only been there once when they opened years ago and I went back today 5 years later only to remember why I had never been back.It all started at with the host sitting us right by the entrance where all the traffic is while the whole place is empty. Our waiter showed up 1.5 seconds after being seated to take our drink and food order all that while twitching and mumbling something... I was confused.Then the Sangria was 99% juice.Food was super dry and crazy overprice for the tiny portions.Then while I sat there eating, 6... Yes 6 people asked me if I was done and tried to take my plate away (me mouth full, cutting food!!) I'm super vexed.They legit hired 73 cute (with terrible shoes and all in serious need of a pedicure) 19 year olds who have no service experience to serve shitty tapas and even shittier drinks.I feel robbed."
/user_details?userid=3yGnsbg2upmxoZzLqYtW6g,Laura-Li B.,"Downtown, Canada",1 star rating,"I went there with a friend that wanted to try this place. WORST IDEA. After waiting a while, we had to ask to order, since the waitress seemed to be too busy serving alcohol to ""better clients"". When we order, she seemed not appreciating the fact we didn't order alcoholic drinks and only took a plate each. ""It's pretty small, you know"" she added when we ordered in a condescending way. And then, to pay, it was the same thing. We had to ask someone if we could have the bill after waiting a long time. But, this time she was faster ;-) The food was horrible. In fact, we are both suffering of food poisoning... I'll never go back. Never."
/user_details?userid=T5dIHEkjN6FsImmT0gblOA,Elliot G.,"Oro Station, Canada",1 star rating,"Been there twice. Both times same horrible experience. Food came at unacceptable times, one friend both times did not each until 30 minutes after we had all moved on to sipping their consistently watered down and over priced booze. The waitress had no idea what was going on with our food, in fact I paid my bill about 5 seconds before the last plate showed up. After having two friends work their as models that serve, I can ensure you the staff here are treated little better than dogs. Nothing but a sleezy place made by some money hungry bros. Only reason you should go here is to order $5K of booze on the last day it's open and then not pay your order cause karma's a bitch."
/user_details?userid=zG6yDqtQx3CQF4FhBQvpXg,Zohreh S.,"Montreal, Canada",1 star rating,"Worst service ever, rude and unfriendly staff. I had a reservation for my birthday at 6:30 Saturday evening. I've explicitly asked them if the rain would be a problem and they told me not to worry. I've arrived and they assigned me a table without any shade or ceiling and shower started. I've asked them to change our table and they told me sorry we cannot do anything. There are other available seats under the shade but they told me that they have been reserved. I left !!! Basically ruined my day !!!!"
/user_details?userid=63G9pKA7B9OYHfTaBc7RBg,Erin S.,"Hell's Kitchen, Manhattan, NY",2 star rating,"Very very disappointed in this place. View is nice, music is great, and food was very good. But the service and drinks were so horrendous that it's hard to put words to it. We sat and the hostess gave us 1 menu for 3 people. Lol. We asked to be in the shade, so she put us next to a bush that was completely infested in bees. Also, rather than putting us in the shade, she put an umbrella up above the table beside us - nice gesture but it covered half of the table.. sucks for the third person in our party. We then had to ask three times for water.. and by 3 times I mean it took 45 minutes. We also had some drink issues. I asked for a margarita on the rocks and when she brought it, she said ""I just put ice in the frozen one"" ....k. Our Jim beam lemonade (the actual name of the drink) was just pure sour mix. They even forgot the alcohol. It was LIME GREEN. Both drinks got sent back in favor of wine - one of us ordered a glass before the other discovered we could get a bottle for less. Could not cancel the glass. ""I can't send it back again"" was actually said. The food was good but portioned out for 3-7 year olds. The chicken tacos (meal) were 3 tortillas the size of the bottom of a pint glass. The steak was $30 and the size of my palm. The octopus was very good until I involuntarily threw it up a few hours later. Not a drill. It was also really exciting when it rained. Does it rain much in Montreal? Because the staff does not know how to handle it. They ran around clearing the empty tables of utensils and left us and our food in the rain lol. lol. We moved our own items including chairs, table, and the marbled bottom umbrella while they quite literally watched. Again, lol.I asked for the check when the food arrived mostly because we were there for 2 hours before the food came and we assume itd take just as long for everything else. Assumption was accurate. I'd skip this place. Cool vibe but should probably consider hiring trained wait staff that isn't bottle girls running around in poorly fitted bra dresses, mingling with men at tables rather than actually waiting tables. I mean, just a thought?"
/user_details?userid=syinOAXKYb-CWepWWS13gA,George K.,"Middletown, CT",1 star rating,Very poor service with low quality atmosphere . The hostess was put out that we showed up and the waitress was rude.  Our food was high priced and low quality.  We went out of our way to find the restaurant because it was on the water but there are no views of the water.  Asking for drinking water during the meal was like asking for a favor.  We have been finding great places everywhere in the city.  Stay away from here.
/user_details?userid=F5eOUCRGt6AlbvjP8f9IQA,Maxime C.,"Montreal, Canada",5 star rating,"I went for boozy brunch on a Sunday the vibe was electric. Pamela took care of our bottle service. She was attentive to every little detail, had a great attitude. She gave us a 5stat service."
/user_details?userid=qNPhFjTXSCaBfv2YrmgAgQ,Kate S.,"Berlin, CT",1 star rating,If I could give them zero stars I would. I took 40 minutes for a waitress to even come up to us and it was because we had to flag her down. Worst customer service i've ever dealt with. Spend your time and money somewhere else
/user_details?userid=buExMKd4mSaP_9awgqfgHw,Anna S.,"Montreal, Canada",5 star rating,"Amazing place for summer drinks, and best place to be during the summer. Music, staff, food, and SANGRIA are the things that make you  want summer to come back sooner!!"
/user_details?userid=5lrxxjFF2MpQPVIRNHQUAQ,Reuby S.,"Hampstead, Canada",1 star rating,"Terrible experience. Had a 9pm dinner reservation and was only seated at 10:45. They claimed they had a busy night for reservations however, they should have a cap on the amount of reservations they allow. We were a group of 4 and they kept seating groups of 2 who did not have a reservation in front of us but refused to put any of those 2 person tables together to seat us at a reasonable time. Everyone in line both in front and a behind us complained as they had the same issues as us.Once seated and ordered we were told everything we wanted they had none left of. One person in my party didn't even order because 3 salads that she wanted they didn't have. Most of the meals came at a decent speed, however, one salad never came so we cancelled it. Drinks were decent however not worth the price.Probably won't go again"
/user_details?userid=A6gDy6VvbEg0V-6FznieuA,J. B.,"Boston, MA",4 star rating,"This is a gorgeous spot to grab a drink (I did not eat). The vibe was very-very European/new money/some would say douchey. Perfect spot for a Sunday-Funday. A little pricey, but you are paying for the atmosphere and views."
/user_details?userid=Igme2ZlmTqQeNoVPFhXJFQ,Aira B.,"Montreal, Canada",3 star rating,"Came here for a 5 à 7 after work hangout and we reserved for a large group. We initially had problems with our sitting arrangement because not everyone arrived at the same time. Food was not really worth it for its price, the drinks were alright but service was very slow and they told us that it was because of their machine. I can understand that, but when other tables are are getting served before us, it's kind of frustrating. I ordered a half-pitcher of a drink but it took so long for me to get it that they were nice enough to give me a whole pitcher for the price of the half. Because it is quite a popular spot, service can definitely be slow. Overall, nice hangout spot for a drink, I did enjoy myself but wouldn't go back."
/user_details?userid=PXG-proxqxxbFbBoFfRh7w,Reena B.,"Jersey City, NJ",1 star rating,"This is a great idea in concept.  Ridiculously poor execution, service, price...basically everything but location.Food/Drinks - Overpriced...badly madeService - Oh so bad.  Rude staff that is too busy to serve people.  The bar was empty, except for a lot of bees around (because Montreal) and we were trying to order a bottle of champagne.  We told the bartender after waiting there for her for about 10 minutes...she gave us the one finger up. Continued to talk to other people who had already had their drink. They finished their drink and she got them a second before even coming up to us and asking us which bottle of champagne we wanted.  Then she gets us said champagne, no glasses.  We get glasses eventually (champagne is still on ice but now 30 minutes have passed since we got to the bar). One of the glasses have ACTUAL glass pieces in it...could kill us.  I tell them...no apology..no care that I could have just died from drinking glass...she just took away the glass and NO REPLACEMENT.  I had to remind her I needed that new glass, finally get one, then we can open the champagne.  Needless to say her tip was less than my normal generosity...it should have been non-existent.Price - Overpriced for everything...even if Service and decor was fantastic...still high.Decor - REALLY crowded and kind of run down.  They do not take care of the furniture outside or clean up the space after guests leave quickly at all.  The entire time we were there, a table left and was never cleaned up.Notable Extra - Just location"
/user_details?userid=hydvat9tDGXVzsBItYmldA,J.C. P.,"Westlake, OH",1 star rating,Would not let me in to eat lunch and have beer on patio with a tank top in summer. All the woman were sleeveless though!
