user_url,user_name,user_city,user_rating,user_review
/user_details?userid=WU7rYsVYxYraTjxjm0tJMA,Ketsia L.,"Kirkland, Canada",1 star rating,"Worst experience. We made a reservation, got there only to find out we were not on their list. Lucky for us they were able to get us a table... the worst one they had!!!! The table was tiny, there were fruit flies EVERYWHERE ( I understand its a terrasse but come on!!!) they had to add a chair to accomodate us (i had to push my chair every 3 seconds so that the waiters could actually do their job). After about 15 min we asked the host to get us a new table if possible and she said she would get us the next one available. Well it turns out she did give the table but not to us... she gave it to those ""no reservation"" blonde bimbos who are friends with the manager. 15 min passed and still no service so we just decided to leave. It was really disappointing as there was alot of hype about this place. Only go there if you know the manager."
/user_details?userid=upoFRIKKnZG3DroO-5YHcg,Michael G.,"Hampstead, MD",1 star rating,"Visited the nightclub portion of this business with a group of guys visiting Montreal for a bachelor party. From the outside this place oversees a great view of the city, but the service is awful and not worth the view. We arrived early in the night around 10pm where there were only a handful of people in the club. Ordered a bottle from the bottle service menu and received terrible service. We were disappointed to find out that there was no seating or lounge section for bottle service if less than 3 bottles were purchased. Our waitress was rude and didn't bother to check on us to refill our mixers (juices and tonic). Our tip reflected the service as we only gave 10% on a $200+ bill. The waitress returned with our money and told us that this was far less than what is customary and said 15% is average. After a brief conversation with her manager, it was determined that 10% was extremely generous. The bathroom at this facility is probably the most disgusting thing I have ever witnessed. It is no where connected to the club and you must walk outside and into a basement of another building next door. The basement is poorly lit and clearly has not been disinfected in quite some time. The aroma you get as soon as you walk halfway down the stairs is extremely putrid. The DJ played good dance music and once the night progressed the club filled up with patrons. I think rating this place 1 star was even too generous."
/user_details?userid=D9JPSQOgYSWTSGEVXh3-9Q,Cat I.,"New Orleans, LA",1 star rating,"This was recommended as a casual place to eat with good food and great atmosphere.  It was neither.  First the food. Tappas style plates at main course prices and very limited selection.  I went with 2 friends.  we each had the greek salad (there was virtually no other choice) no lettuce, bland dressing. not very good.  Main course, I had a tuna tartar, it was diced tuna on top of a mango 'dressing' if you will. bland and uninspiring. Other friend had the rare steak strips and he said they were very good. again small portions but big priceWe shared a nice bottle of wine. Service was excellentBut the worst part of it all was the atmosphere.  its a long haul there from downtown but thought it would be worth it cause it was on the port near the water.  but you could see nothing, just have soon been surrounded by a parking lot.  That was not the worst of it. There were piping loud obnoxious, techno inspired pop music. this is at 7 pm mind you not late in the evening.  it is hard to describe how much that ruined the evening. if it were me and my wife i would have left right there. But we soldiered on. it could have been the best food in the world and i would not have enjoyed it.  if that was not bad enough there were smokers all around usThis place is utterly charmless. there are dozens and dozens of good, charming restaurants in Montreal, if you are over 30 avoid this place like the plague. if you are under 30 and enjoy this type of restaurant, examine your life"
/user_details?userid=UMqH6QepV59qSnyg5iX6zA,Sonja U.,"Alpharetta, GA",1 star rating,The staff is RUDE and The service here is terrible. Also their hours aware wrong on Yelp..beware. Actually just don't waste your time trying this place...
/user_details?userid=fy_ln4zeL9q0EAJBY_6sig,Mill S.,"Toronto, Canada",2 star rating,"Oh Sir where do I begin. This place was recommended for Sunday brunch and tappas. Oh my excitement at the possible selection.Let me begin by saying the location is beautiful. The DJ was awesome and the actual food was absolutely hands down delicious. I mean 5 out 5. The chef is clearly talented. That's where it ends. The food selection is limited, disturbingly overpriced, serving sizes are comical even for tappa style. Not to mention it's far too expensive to have a true tappa style experience. We had to ask for bread to help fill us up. The wait staff, bouncers and hosts are snotty. Professional is great but only catering to high rollers is weird. Oh I can't forget to mention the pretend high rollers in this place. Everywhere you look there's a table with bottle service...one bottle!! Lol bottle service for the poor, I guess. The guests are snotty as well. Which I must commend them for because we were dripping sweat down our faces from the lack of shading umbrellas and looked roasted while the high rollers kept their composure the whole time. They must have been wearing sweat proof makeup!! All in all, this place is an experience. Go once, waste your money and never go back. Unless of course you're into over spending, being cooked by the sun and going home hungry and craving cereal. Not I All in all, this place is all human thumbs down"
/user_details?userid=_KqErwCaKB9e4rIl5hXQUw,Kenneth R.,"Palmer, MA",1 star rating,"Absolutely the worst service in the world. Great location, good cocktails, reasonable prices... But stay away. After getting our cocktails we watched another table get up to leave before being served. The server never came back to check on us. After our drinks were empty we waited 15 minutes until we finally had to yell across two tables to get out check. Now the server had plenty of time to actually stand at our table side waiting for a tip, she informed us that most people leave 15%. We have traveled extensively and never have I had service this bad AND RUDE."
/user_details?userid=TpXEA_yFlc-fXHadDw0IMw,Derek L.,"Champaign, IL",1 star rating,"Terrible frozen cocktails. We got the blue raspberry and cucumber and basil frozen cocktails on a hot summer day. The ice was not slushed properly, still chunky and not mixed well with the other liquids used. The blue raspberry was pretty much vodka in ice with barely any other flavors. The cucumber and basil was extremely bland and practically no basil taste. Not recommended."
/user_details?userid=dGPYUP92UFTQiDNGN5Wkfw,Fareed I.,"Yonkers, NY",4 star rating,"Four stars for the scene. On a hot day you're going to be baking under the sun unless you get seating under the shade. The outdoor grill smokes the place up, they need an exhaust system to send that smoke elsewhere. Food doesn't seem bad but I wouldn't want to put down that burger between two Belgian waffles and eggs on a sweltering day, go to Dolcetto on Saint Paul first. I would definitely get there by 5 or 6 and get it popping--cool house music, very trendy crowd, sweet bartenders, gets really packed so stay away if crowds aren't your thing."
/user_details?userid=vESbH0wH-N4hXMPwxYg6rQ,Michael G.,"Westport, CT",2 star rating,Probably a great place for a night time drink. Not so much for a meal. The decor is okay but there were a lot of bugs and broken glass in the cabanas. Odd they chose not to address that when we pointed it out. Food is ok at best. The view from the dining area is poor as it is sunken. So there is no river view. You are better off going across the street to a proper restaurant.
/user_details?userid=ewrfMC8uik_MioaA4NSEug,Richard T.,"Montreal, Canada",1 star rating,"Worst place ever. Service was slow, waitress was extremely rude. That was the dinner part. As for the club, staff pushes you around and one of them cussed at us. The owner did not care and didn't do anything. To the owner: learn to run your business, you are doing a horrible job and are in need of a refresh on customer service. Take it from me go somewhere else this place is an absolute nightmare!"
/user_details?userid=dLB7Kir5aN288IbQO9rA_A,Christopher S.,"Whippany, NJ",1 star rating,We ordered a bottle and literally had the worst waitress ever we gave her a tip to reflect her attitude and service (10%) she then came back and said I usually get 15% and then began to make us explain ourselves why we gave her a bad tip.... She then said well fine I need to call the manger we explained the situation and he was understating and we got  a new waitress....
/user_details?userid=hMY0wsj3VxOaBixV_6YnuA,Gregory S.,"Houston, TX",3 star rating,"The location is perfect on the water in Old Montreal.  On warm summer evenings you get the cooling breeze off the Saint Lawrence.  Everything is open and airy.There are two areas, the patio with all the tables for food and drinks and then the club itself on a few floors.  The portion sizes are pretty small for the price of the meal and it isn't that great.  I suggest getting a lot of platters to share.  They have a lot of choices for the drinks such as various creations of martinis.  They also serve champagne cocktails as well.The club plays a variety of music from hip hop to house to trance to reggaeton it suits a diverse mixture of people.  The crowd is a eclectic mix of all that Montreal has to offer.  As stated before, its perfect on a warm summer night to enjoy the breezes.  The top floor is for bottle service and has nice couches to chill and relax.  It's a different night out than the usual."
/user_details?userid=JudEGM3yUpeTB3ex5YEojQ,Leah M.,"Montreal, Canada",1 star rating,Portions are  small and ridiculously over priced. Super loud and bad music playing as you eat which really ruins the whole ambiance. Food was alright and sangria was good. Would not recommend.
/user_details?userid=8_A_OdF_OS_PHHyDE2GiZw,Jay D.,"Montreal, Canada",5 star rating,"Well... I have to say that it's not always good but when you hit a good night it's just amazing. It's better to go when it's a sunny Saturday/Sunday. It's a good place to be all dress up, good Djs there. I like the staff, very friendly.I have to admit I never tried the food because it's more a place for party and I assume that going in a restaurant is wiser...But overall I had the craziest night there. And I'm talking about party, not food."
/user_details?userid=p1CYr8Nsl6URPiqJKjEc2Q,Simon P.,"Montreal, Canada",1 star rating,"I have had some bad experiences in the past, but never so bad i felt compelled to write a yelp review. The process of downloading the yelp app and creating an account was painfully slow, but it was definitevely worth it if this review makes this sleazy business lose even a single client. Where to start, the sassy waitress who felt it was necessary to be rude despite not having a table ready 50 min after my resevation. We were told to sit at the bar and that they would call us once the table was ready. What she didn't mention is that there was no room at the bar and she expected us to stand around in a corner. It was clear that nobody had any idea how to organise a reservation system. The hostess, on top of the constant rudeness, was more confused than a hungry baby at a topless bar.  This place is to bars what donald trump is to politics, pretentious, dumb, and dishonest. Avoid the bar and avoid people who like it."
/user_details?userid=XX4jsqDM0mMyR7V-adqFKA,Clark B.,"Montreal, Canada",4 star rating,"Went there for the club on a Saturday night (twice now). Amazing! Great music, good crowd (mid-twenties I'd say), friendly staff and cute waitresses.  View is pretty sweet.  Definitely the go to place for a summer night."
