user_url,user_name,user_city,user_rating,user_review
/user_details?userid=CqPKiwlgPqerUKtlzmszkg,Andrea K.,"Montreal, Canada",5 star rating,"We were lucky to secure a reservation for La Fabrique, and were rewarded with a very memorable meal. The food was next level on many fronts - the vegetables impossibly fresh, the dishes creative and playful, and every ingredient holding its own, despite the complexity of the dishes. In delighting in the beautifully composed plates, I saw the inspiration and the pride of the craft shining through. The service was also exceptional - the server was very knowledgable about wine and very graciously swapped out an ingredient for me due to a food sensitivity. We were made to feel like guests visiting friends. I highly recommend a visit and will most definitely be back."
/user_details?userid=yInNj9eDZ1JAUIZ4n0P6Jg,Mike Z.,"Nashville, TN",3 star rating,"I guess I expected more from when I read the reviews.  While the place is very cute and intimate, the loudness of the restaurant was still great.  It's a great spot for a social gathering. Brunch had a chill vibe yet had the energy you want in a place to make you excited. I will say the front hostess was very welcoming and accommodating.  Not to mention being from the South in the States, the coat check is a whole new world for me.  It's a great idea and makes you feel like you're in for an experience.We like sitting at the bar when we go to restaurants. Most of the time, it's more entertaining to watch the bartenders make their drinks and partake in something new we haven't tried and looks intriguing, not to mention they're good about what and what not to try.We had the pancakes (which are not standard American flapjacks) and the brisket plate (which was more of a pot roast). I would say the portions are a lot smaller than you expect but they were heavy enough to fill your appetite so know that going in.I gotta say they work their tail off in the kitchen from the view we had and everyone's constantly moving, so with a place fairly quaint, the place fills up quickly and is always in constant motion while trying to keep a bright and airy feeling to the restaurant.  I would go back if I'm back in town but it wasn't a stand out experience."
/user_details?userid=ahgcM5gvEyu8Fg0d1RFnlg,Michelle V.,"Dollard-Des Ormeaux, Canada",5 star rating,"Brioche bread, pork stew, root vegetables, rice vinegar, slobbering egg, coriander.Eggs at 63°, puree of topinambour with cheese, broccoli, shiitake, hazelnut, cranberry chips.To top it off a thick layer of homemade bacon preserved in maple syrup- EVERYTHING made in house. Believe it or not, you will be able to bring that can of maple syrup HOME. Yes, maple syrup infused with pork fat. FUCK. YES! SLATHER THAT SHIT ALL OVER MY BODY.I would like to sincerely thank the owners and entire team of La Fabrique for allowing me to savour your new project. This is what I do best: To truly and genuinely connect with humans and understanding that going to successful restaurants isn't just about eating a good meal. Not only it is about sharing a vision, but it is also about sharing a story."
/user_details?userid=JmBs_hVnqHHidm1bbLy0IQ,Axel E.,"Phoenix, AZ",5 star rating,"I don't know if I have ever had better service. They were able to squeeze us in on thanksgiving as a walk-in and we ended up very glad they did! Very friendly waitress from France, extremely attentive. Dinner menus not brought until after drinks were ordered, very classy. The table bread is delicious - I liked the table pickles as well. Seasonal soup was delicious with nuts and croutons in the bottom of the bowl. Every bit of the meal had high marks for presentation and taste. Very nice atmosphere and lots of space for big groups or small. We would love to come back!"
/user_details?userid=3kggkuTo6mjJjVpPGBy4DA,René D.,"Lansing, MI",5 star rating,"This place has been a favorite of mine for a few yrs now.  I have never had a subpar meal or experience here.  They can accommodate the solitary diner or a large group.  The waitstaff seem to love their work.  They are never idle and they help each other always.  One takes an order, another brings your meal, and another clears your plate.  Their menu is continuously evolving, and their desserts are to die."
/user_details?userid=LYOvyedhKD3eqs4dJrp6yQ,Jackie S.,"Jersey City, NJ",4 star rating,"I think La Fabrique is more of a brunch hotspot, but I came here for dinner and had a good experience. The service is a bit slow, but the food was very good. Be careful when you get drinks, they are stingy with the liquor. Perhaps save the alcohol for a bar nearby.The fried squid appetizer was fantastic. It had fennel which I hate, but honestly, whatever they did...worked. The salmon tartar was excellent, and I recommend getting the larger portion because it comes with either salad or fries. Get the fries, they're great and there are A LOT. The braised beef shoulder entree was cooked perfectly and very tasty too. A nice touch that the restaurant does is they give you a complementary jar of pickles which are AWESOME, and cotton candy as a complementary dessert!"
/user_details?userid=-JSy3GQgsE7bp9DQ6-xxfg,Bliek ..,"Toronto, Canada",5 star rating,"Outstanding menu and wine list, somewhat unexpected given the St Denis strip. Ingredients reflect the chef's imaginative take on classic dishes, described as they are without the usual torrent of alluring adjectives. The unusual combinations generated succulent and revealing results. Our server doubled as sommelier and expertly guided us through the wine list, concluding with an out-of-the ordinary recommendation that fit perfectly with the meal. I would not hesitate to go back ... apparently the brunch menu draws a crowd."
/user_details?userid=Wcz-TUD7ma96mRX7ujTvvA,Pras C.,"Northeast Washington, Washington, DC",5 star rating,A good brunch spot with delicious cocktails and mocktails. Seating on the terrace and indoors. Attentive service and cute details like chinaware. We ordered the soft boiled eggs and shoulder beef and onion cake entrees. We were advised against ordering multiple appetizers because they are pretty large. I'll let you judge for yourself if the four croquettes look large for two people to you!
/user_details?userid=Y6JhHLPzBZ6Z5cHS1s-B4w,Rojarra T.,"Lachine, Canada",5 star rating,"La Fabrique has made it into my top 3 brunch experiences in Montreal.The restaurant is beautiful, the ambience is lively, the service is top-notch, the prices are reasonable and the food is absolutely delicious! I visited for brunch with my partner and brother and we ordered a few dishes to share between us. Although everything that we got was fantastic, my two favourites were the French Toast with Praline cream and Orange Candy and the savoury French Toast with Brioche bread, Guinea Fowl and Egg Yolk. The first dish was perfectly balanced and not too sweet. The toast was crispy on the outside and soft on the inside. Since the dish is rather small, I'd suggest getting it as a starter, dessert or as one of a few sharing plates.The Savoury dish was also perfect. This portion was generous and filling. The meat was flavourful and tender. Oh and they take reservations, so no long lines and no waiting! I know that their menu changes often, so I can't wait to visit again and try a few more of their brunch specialities!"
/user_details?userid=tsHroQ1hZRvNFitOoAoh_Q,Maria B.,"Miami, FL",5 star rating,"This place definitely stood out because of the menu. It has very interesting mixtures and combinations of flavors that look very odd but taste very good! Portions are small but full of flavor. Staff is very nice, service was quick and the place is beautiful"
/user_details?userid=EJ5ybtY1FqieuS22LHbT1w,Claire L.,"Montreal, Canada",3 star rating,"BRUNCH REVIEW : this is my second time coming to La Fabrique. It is a great choice when you are a group looking for a spot in the plateau area because you can reserve! The food and menu is great and interesting, great spot for a date or a girls brunch. However, they REALLY need to step up their coffee game. We ordered a variety of drinks and they don't have proper barista coffee. For me, I would rather see a good filtered coffee if they can't offer a decent latte. They do however offer good homemade juice options. Second point where the restaurant really fell short was in terms of service. We sat down at 11 and didn't get visited by a waiter for 15 minutes. We ordered right away, expecting it would be an issue to get the waiters attention again....and we waited until 12 to get our food. I agree that the plates are a bit more complex...but I feel they could really improve in this regard."
/user_details?userid=fevnU9WEaJTJm5QzyQIyWw,Rose H.,"Jacksonville, FL",4 star rating,"Elegant little restaurant! They change their menu every week so it is only in French. The wait staff is super friendly and read the entire menu to us in English. The translation of the description may have been a little off, but the food is of the highest quality and the attention to detail of taste and presentation is high! There may be too many tastes going on with each menu item for my liking, but it is well thought out and put together.The salmon cream cheese bretzel was delicious! Romantic, coZy atmosphere across the street from a nice park"
/user_details?userid=2RaUfJhn1KJhiQ0D1HRx4A,Riddhika J.,"Englewood, CO",5 star rating,"RUSTIC SETTING, VERY FRIENDLY SERVERS & AWESOMEEEE FOOD!One of my friend, who is a big fan of this place, dragged us to La Fabrique for brunch. First let me say that their kitchen is fabulous. They have it out in the open where you can actually watch what they are cooking and how. Second important thing is, they now have their menu is english and we went the day they started using those menu so we were even able to point out the mistakes. The server was very polite and friendly and explained us all about the dishes. DRINKS: We ordered coffee, orange juice and chai tea latte for start of the meal. The coffee is being served in small glasses that are used in India for tea serving and I was very pleased with that and above all the coffee was brewed perfectly. Chai tea on other hand was very light and I would have loved if they would have served 2 tea bags instead of just one. Juice was freshly squeezed and perfect.  FOOD: I ordered FRENCH TOAST with English custard, apple and maple glaze. I had to wait for a while but OMG it was well worth the wait. It was very unique because I had never had a french toast baked in the cute little casserole. It felt like my taste buds thanking me. I have never had such a delicious french toast in my entire life. The top layer was all caramelized maple, then English custard and french toast and caramelized apple then french toast again and bottom most layer was English custard. I could eat that over and over and would still want it. My friend had the English biscuit with pulled pork topped with egg. The meat was perfectly seasoned and cooked. The biscuit was very flaky and to top that off the egg was soo gooey in the center. He loved it. My husband ordered pork roast with salad and he was impressed with that. Overall, the food was really good and I would definitely wanna go back there and try their pancakes. Ohhh, I can't stop drooling! I highly recommend this place :)"
/user_details?userid=0gZ8E5tBWTEtGEZDuTzhzw,Cindy Feng Xin L.,"Montreal, Canada",4 star rating,"I wanted to go to this restaurant for a long time and I didn't know that it's just next to Sherbrooke metro and having a view on the St-Louis Square. Honestly it is a great little restaurant that looks beautiful without being overly extravagant. I went there for brunch and tried their pork chops and egg on English muffin, it was really good! The portion is quite generous and the service good in general. I would recommend this restaurant to you!"
/user_details?userid=T7Nq0NQXubxB3AambVaWPA,Nicholas F.,"Portland, OR",2 star rating,"Service is excellent.  Food was not for me.  To me, this is what happens when a chef learns to cook during an acid trip rather that during culinary school.  There was not a single dish that didn't have some ridiculous combination of ill suited ingredients."
/user_details?userid=lLF9x4I41LFFKa_FX-lkbQ,Jedsada Y.,"Astoria, Queens, NY",5 star rating,"Best French cuisine experience!!!!Visiting Montreal during the new year and most of my favorite restaurants were closed, so I had to call up a few restaurants to see if they were open, and, voila, La Fabrique was there to save us!"
/user_details?userid=Y_2jMUKz6pvJ0JSWG3u10A,Tina T.,"Philadelphia, PA",5 star rating,"Holy crap on this brunch!! On our first trip to Montreal, our restaurant try list was mostly derailed since we didn't make any reservations. So on a Sunday morning, we were hoping for the best on various places. We stopped here, on a gorgeous day, and were able to score a table on the patio (for 3) after waiting 10-15 minutes. I ordered an egg dish with cheese, zucchini, corn, and some toast. It was light, fluffy, and delicious. I tried not to demolish it and share but it was very difficult. Kana K ordered a French toast with fruit which was equally light (not in calories, of course) and delicious. Brian T ordered a steak tartare which a) I usually steer clear of and b) I happily ate a few bites of. Just delicious and well flavored. For drinks, I had a mimosa and Brian T tried a maple whiskey on the menu (chilled). That whiskey was the start of a new addiction for Brian T, haha, and maybe me too!Great service and restaurant. Must go again on our next visit."
/user_details?userid=55fCofuKVb7XP3newzmX3w,Andrea M.,"Philadelphia, PA",4 star rating,Cutest little restaurant. The kitchen is right in the center so you can watch your food being made. The service was fast and great. The salmon was delicious. I normally like mine well done and I asked them to cook it a little longer and they were so accommodating which was nice. The beef shoulder was also very good. If you are new to town or a local you should check this place out. I was very pleased and it was reasonably priced!
/user_details?userid=R5WcogaoAwjdHxrB2v5NsQ,Bonnie E.,"Phoenix, AZ",4 star rating,"If I upload more than five photos of a place, I'm a fan. If I write ""Get this!"" on every food photo, I'm a big fat fan. Love this place. Genuine people working an open kitchen, full-steam ahead, in a relaxed-but-hip ambiance. Excellent service. Each dish was not only beautifully presented, but also, each dish tasted delicious. Love how they do the salmon tartare with cranberries. They take that salmon to the edge - where it's not so soft as to be mistaken for cat food (major dislike) but where it is smooth, with just a hint of texture. If ever I lose my teeth, this shall sustain me. I'd be relocating for salmon tartare. I've made crazier moves. Is this pain perdu?! Pain perdu was a not a trick, hiding under vellum-thin pineapple sheets...it was a treat! Ouefs mollets did not disappoint - ample mayo in this dish, so venture forth at your own risk. It's worth it. They take reservations, by the way."
/user_details?userid=0Pd-LScDP0zLf4ShnV8L0Q,Katie D.,"Manhattan Beach, CA",3 star rating,"We had a very large group here for brunch. Reserving the place and figuring out the menu ahead of time was quite difficult. They were extremely slow to respond to email correspondence, we had to actually call a couple of times to get to someone. We were told that for a large group we had to select just a few entrees ahead of head, but then of course never heard back and they just offered everyone the full menu the day of. The open kitchen that occupies the center of the restaurant is very neat. The tables right next to the kitchen, where we were sat, are quite close to the cooking area. The issue is probably if you lean back too much, you will touch it and I certainly hope people don't sneeze or something.The menu itself was quite interesting, I would even call some of the combinations unusual. Sometimes it's a little difficult to figure out what is being served because each item is just a list of ingredients. I wanted something lighter so opted for the French Toast. The bread itself was awesomely thick and the sides were nice and crisp. The remainder of the dish was a mix of diced fruit, some white chocolate chips and this fruity mousse. It was a strange combination with the toast and unfortunately made the bottom of it a bit soggy. I did not get to try everyone else is food, but ""interesting"" was a common theme. I could consider coffee and tea being served in glasses with no handle to be the same."
/user_details?userid=Lr8RJL9_Y5_lkgACj2l7oA,Maria B.,"Ottawa, Canada",5 star rating,The best French brunch Cuisine experience ever! We paid for the set menu Easter Brunch and it was worth every bite! They space out the courses nicely to give you time and enjoy what you are eating. The positions are perfect to keep you satisfied but not overly full. The staff is friendly and the place has a homey feel to it. Their lattes are amazing!!!! They do order two sizes (small / large). Get the large because the small is not worth it and you will be wanting more. Lol Overall - great experience and we would return without a doubt!
/user_details?userid=UirqnjnmN1CLusITMx7Dhw,Dyson L.,"Montreal, Canada",5 star rating,"Went there for brunch on a Sunday. It was busy and we had no reservation so we ended up sitting at the bar.  Very original brunch menu. I had the pain brioché (plus homemade bacon as extra) and my friend the lamb confit. Delicious! Everything was on point -- not too sweet, not too salty. Presentation was excellent. Service was fast (there were large groups that day but they had the smarts and decency to serve smaller tables first) and friendly. The price is a bit higher than at most brunch places but you get quality and originality. Will go back soon."
/user_details?userid=_Es5HuksJfx_n-8_JgKG1A,Tiffany M.,"New York, NY",5 star rating,"This turned out to be an excellent recommendation from another restaurant. Mr favorite was the French toast, which, although the garnishes change on a weekly basis, is a staple- so crunchy outside, yet so fluffy inside. Ask for the bacon to be slightly crispy/ charred and you e won't be disappointed at all! Oh, and tell Stephanie the girls from NYC said you had to have a pickleback made with the juice from their homemade pickles- amazeballs!"
/user_details?userid=ioKXr5feQNc7hiLTshlZPQ,Aaron T.,"Beverly, MA",5 star rating,Fabulous dining experience.  I had the beef shoulder (pictured) and it was one of the most flavorful and tender red meats I have every enjoyed.    La Fabrique leaves cotton candy on the house while you wait for your check!  PS  my dining parter for the night had salmon and loved it!
/user_details?userid=pPEvdh5cNfWFlBW_X_Rwdw,Cecilia H.,"Oakville, Canada",3 star rating,My colleague and I landed in Montreal late in the evening and happened to find La Fabrique by chance as we hangrily walking around in search of food. The menu was quite extensive and options were interesting. She chose the linguini (+1 scallop)  and I went for the pulled pork burger. I was surprised that the pulled pork was pressed into a tight patty! Was fully expecting the pulled pork to be strewn out and that I would have a messy night. The meat was tender and juicy. I really enjoyed the flavours! It was paired with duck fat fries with homemade ketchup. All excellent! We tried each other's dishes and both agreed that my burger was the better of the 2. My colleague mentioned that her linguini was lacklustre and was a little too heavy on a vinaigrette taste. Bonus: they serve you pickles and bread as a a free appetizer and cotton candy as a free dessert! Space set-up was interesting with an open concept kitchen right in the middle of the room. Our server was attentive and polite but a little slow (note that he was also the only server that night and there were approximately 5 tables).
/user_details?userid=CNn843UNx7Vk9RuYNMCNqg,HyunKyung C.,"Manhattan, NY",3 star rating,I went there for Montreal table. Foods I had there were oily and salty to me. It would be better if I had a glass of wine. I only liked dessert there after eating the foods and the presentation. The presentation was amazing. Staffs there kind and friendly. Also I recommend to seat far from open kitchen to some people who just like me. I seated next to the open kitchen I was too warm and I felt that the air wasn't fresh. My clothes smells like a restaurant.
/user_details?userid=uHpSb0mha3eeWqh9qJdWLw,Jon W.,"Sault Ste. Marie, Canada",5 star rating,"Excellent food and service!  Decor is beautiful and it is reflected in the food. Tried the Pulled Pork, Onion Bread, French Toast and the Braised beef sandwich. All the dishes were excellent."
/user_details?userid=KsoqByb3HKAaz-YWzPwXWg,Judi S.,"Palisades Park, NJ",5 star rating,"Came here for New Years dinner and loved loved! First, they called us ahead to make sure no one had any food allergies since it was a set menu. It's always appreciated when restaurants are mindful as such.The layout and space is modern, cozy with the open kitchen being the center of attention. It was a great experience watching what was about to be served at your table. I'm not so adventurous with meat nor is French food my meal of choice. But everything from the rabbit ravioli to the sweetbreads surf and turf was fabulous! Service was excellent. And they spaced out the courses just right!I will surely be returning to La Fabrique upon my next trip to Montréal! It's a keeper!"
/user_details?userid=fFyCIvBwWkIHpm_usMn8qw,Thomas D.,"West Hartford, CT",3 star rating,"Well executed food but the flavor combinations just don't work.Braised beef shoulder was perfectly cooked and super tender.  However the apple and avocado did not work with the tomato base sauce that it was served with.Similar with the slow cooked salmon - very well cooked salmon but the watermelon, zucchini, etc was not a good flavor mix.Overall it was a good experience, the waiter was excellent, good atmosphere, nice open kitchen.  I would probably go back but would like to see the food improve."
/user_details?userid=MhUesWZxFpvhhW2tCZWIXw,Desmond R.,"New York, NY",4 star rating,Great service. Great food. Then a warm serving of cotton candy when they bring you the bill!
/user_details?userid=z4k_voLiA1fOcUtUyVZ6jw,A. M.,"Burlington, VT",5 star rating,"A life saver. Imagine this. Saturday night, 5 pm 4 kids three adults no reservations. All food snobs. Enter La Fabrique. Outstanding food all around. They accommodated us on a short notice, even called us to give directions when we were lost and were very friendly. But the food. Yummy. I had the Mi-figue, mi-raisin, outstanding, i followed with the Ravioli of foie gras. Also perfect. Nice job."
/user_details?userid=7igTVTgqI3WiqZp8hrgaMA,Yelp Was Supposed To Delete This K.,"Philadelphia, PA",4 star rating,The French toast was fucking textbook. Props to Brian T for discovering a breakfast whiskey!
/user_details?userid=Ex-QoUxevVpBPsovXWb8cw,Naoufel T.,"Montreal, Canada",5 star rating,"I have been to this place several time, mostly for brunch. I did one or two dinners here. I love it personally. The ambiance is nothing spectacular. It is a nice restaurant, looks like many restaurants I have been to. The food though is very good. The service is on point."
/user_details?userid=jFY8cEqe8JPPUoCuFqB7_g,Pragna H.,"Vienna, VA",5 star rating,"This terrace brunch is everything you want from a terrace brunch! Sipping on grapefruit cider mimosa, drinking coffee from little glasses (what's with Montreal and serving coffee in glasses?), and taking bites of delicious food that combine taste, texture and aroma. I got the mushroom tart. The description said braised beef. I was expecting something like a quiche with a bowl of braised beef and somewhere a fried egg, perhaps. What I got was nothing like that! On top of a thick hummus-like bean paste that was drizzled with olive oil, sat a small disc of thin-layered pastry, filled with  think later of mushroom, atop which sat two discs of super tender braised beef, and everything was topped with a fried egg. there were chunks of tomatoes sprinkled with a really tasty salt positioned under the pile, stuck into the bean paste or on the plate displayed to the world. Every bite, whether it's just one of the ingredients or a combination, was very flavorful. I took a long time to finish my meal and it was well worth it.My brunch buddy got a plate of bean stew, topped with fennel, ricotta, potatoes, and 63-degree eggs. Doesn't sound like much, but it was really really good! Definitely a good location to venture out to if you are in the city. Everything on the menu looked awesome! Try a few!"
/user_details?userid=N8jcjp70Ll3BAhZKB9Sebg,Chaozhe H.,"Munising, MI",5 star rating,"Very good French restaurant. Tasty Foie gras served on top of risotto. The chef cook in front you. The service is also great, explain the menu well. Not a big restaurant but good for friend gathering. They closed at 930 but can serve longer if you get in before that."
