user_url,user_name,user_city,user_rating,user_review
/user_details?userid=EOgls9I_SXTz0mRsbfnE4w,Ed Y.,"Toronto, Canada",5 star rating,"This is a great place for a nice meal. It was recommended by my beau-frere. The ambience was really nice. Not too crowded (meaning the tables and seats were not flush against each other). I really liked the open kitchen because I like watching how food is prepared. It is kind of like watching a tv show live in a studio. We started with a potato salad, but it was no ordinary potato salad. The flavour was there, and the potatoes were not over or under cooked. The nice touch was the addition of mussels. For the main, we shared the salmon and the cauliflower, broccoli, Brussell sprout sauté. Both were delicious. The salmon was cooked to perfection (I find that most restaurants over cook their salmon so it is really dry). All I can say is that the chefs know how to prepare their dishes. Their homemade pickles were good too."
/user_details?userid=fmhpe7LojW2Xidn8Pxxe5Q,Elizabeth H.,"Brooklyn, NY",2 star rating,Hip spot for a younger crowd. No problem getting a reservation a week in advance for a Friday night; the place was busy but not full . while we were there. Loved the gratis homemade pickles with peasant bread and chive/shallot spread. Fois gras app also successful. Avoid veal cheek main -- the Asian-style sauce was too bitter. Steak frites was better and cooked as ordered but is the most expensive menu item. Iced tea came straight from a can. Service could have been more attentive but we never felt rushed. Not a bad meal but not a destination either.
/user_details?userid=oZaxrIrU9c0zaAYDBgtQeg,Davi D.,"San Francisco, CA",5 star rating,"Fabulous experience in this open kitchen restaurant.  Everything is fresh, made with meticulous care, well presented, creative and delicious.  Great wine list and Stephanie was very knowledgeable not only about the food and ingredients but about the the wines.  Will definitely come back when back in Montreal."
/user_details?userid=mOM28hs1DTgfJgQlLJFvKA,Mert G.,"Delmar, NY",5 star rating,"We have been La Fabrique once in 2012 and once 2013 while visiting Montreal for a long weekend.  Both times the service was excellent and the food was amazing.  The most recent time we were there we stuck with a combination of small plates.  They start with bread and their own pickles.  I don't know what it is with those pickles, but it's hard to stop eating them.  The beet/cheddar/pear salad was right on the point.  We also had the mi-figue and the potato apple gnocchi as well as the foie gras torchon.  They were all excellent.  I would definitely recommend something that involves foie gras.I used to be a vegetarian, so I tend to take a look at the menu with a vegetarian's eye.  I think a vegetarian could also have an amazing meal here.Staff was very friendly and attentive without crowding us."
/user_details?userid=7XNEyACMHtTOTDmKgLdA7w,Alex L.,"Brookfield, CT",5 star rating,"This place was great. After walking around with empty stomachs, we were enticed by the island kitchen.The veal cheek is out of this world with a nice medium body bottle of wine.i have to say this place was far more enojyable than some of the other more fancier places i have been. This place is a must."
/user_details?userid=fleb-0jfBkYs7g0R3kz9YA,David E.,"McLean, VA",4 star rating,"La Fabrique's open kitchen takes up the center of the restaurant.  The place says trendy all the way, but deservedly so.  The service staff are young, energetic, and helpful and the customers appear to be on the younger side as well.   The food was great and we had brunch with a Quebecois twist.   I had the salmon tartar with the poach egg on toast on top.  I thought it was a great variation on dishes I had before, but never put together in this way.   My daughter had the pancakes with chocolate sauce that were also something very different if you are use to brunch in the USA.  We also had a pate of pork with pickles of the house, which was a nice touch.  They bring you a jar of pickles/cornichon to serve yourself."
/user_details?userid=8apKnC2iVfWnfB4cIgUBMw,Jason L.,"Montreal, Canada",3 star rating,"Braised beef with gnocchi in a vegetable ragu. Pillowy soft nuggets of flour and potato dumplings, gnocchi isn't my thing and thus, my boat remains unfloated. Don't get me wrong, the dish was tasty - the beef was tender and broke at the slightest pressure from the fork and lent a nice beefy aroma to the sauce of eggplant and carrots and gnocchi."
/user_details?userid=aE8Zvyrt2xgOeaHvKCN9ug,Elizabeth D.,"Albany, CA",4 star rating,"After walking up and down Rue St. Denis, I chose La Fabrique because it seemed like a local place and the food looked good from the window.  Menus are available in French and English.  Selections were innovative, including one allowing the chef to make something of his whim.  I had a hard time deciding on several possibilities, but was happy with my choice of beef with scallops, herb gnocchi, some perfectly cooked zucchini strips and olives in a well flavored sauce. What was nice about the restaurant was the complimentary special touches, like the warm toasted peasant bread with chive spread, large jar of delicious homemade pickles, and even pink cotton candy for a special ending.  Although my entree was more than enough for me, I wanted to try the french fries fried in duck fat.  The waiter accommodated by giving me a small sample in a little container.  Absolutely decadent!"
/user_details?userid=asP_34A81QJT410p-bH5gA,Leanne M.,"Montreal, Canada",1 star rating,"We were here for brunch on Sun., March 20 - our first and only time I might add.... This place has the kitchen right in the midst of the tables so customers can watch as the food is prepared. It's a fun idea & I liked it at first, but I was facing one food preparer (a young, short wiry guy) preparing tartar. He spooned the tartar from a bowl into a mold & with the same spoon, scraped out the remaining tartar from the bowl into his mouth & then placed the same spoon in a metal container with water. He re-used the same spoons from that metal container (without washing the spoons or the small rinse container) & repeated this same behaviour- using this spoon to eat the remaining bits of tartar from the bowl - several times throughout the hour & a half that we were there..... Yikes! Fortunately I did not order tartar - but I found his food preparation techniques alarming to say the least..... Looks like some re-training might be in order......"
/user_details?userid=gracT3tOBmzYxMNTCxIeoQ,C L.,"Amawalk, NY",1 star rating,"Horrible service, mediocre food.  You can do far better than this place.   When our meal was served, they neglected to see if all the diners had tableware, and we were left sitting on the terrace for five minutes until I walked into the restaurant  and asked for a knife and a fork.  We also ordered a second bottle of wine at the time the main course was served, and were promptly ignored.  The wine came as we were finishing our food.  The service at McDonald's is far better than this place."
