user_url,user_name,user_city,user_rating,user_review
/user_details?userid=XfQloz-i6NywnjZl0OIzwA,Kim T.,"Toronto, Canada",3 star rating,"We came here for brunch on a Sunday morning and it wasn't too busy, just perfect. Nice restaurant and friendly service. Love that the kitchen is open in the middle of the restaurant so we can watch the chefs in action and put together their beautiful dishes. There is also a couple of tables by the front of the restaurant with wide open window facing the street/park that could be very nice too. As we were watching the chefs cooking, we got really excited about the food. The presentation is really nice, they have that fancy egg poacher machine that make the egg look oh so beautiful. However, when we tasted the food, we were a little disappointed. It wasn't bad at all, but we just expected so much more. It was a great experience, but I don't think I will come back here for a while."
/user_details?userid=lNn7-6PTVDrftefs9I9Gew,Soohyun K.,"Bellevue, WA",3 star rating,"Went for their brunch with a friend on a Sunday morning around 11:30pm. We couldn't get a seat outside, but were offered a seat inside. The atmosphere of the restaurant was super cute and dainty. I was a bit disappointed because we asked if we could sit outside when the seat became available, however the waitress said there aren't any (although the people who came after us got seated outside so I'm not sure what the matter with that is). Aside from that, service was pretty good. I got their coffee (pretty good, $2.50, but nothing special) and ordered the 'Pain Naan' (housemade naan bread with very rich goat cheese and other sauce and cucumbers on top, $16.00). The naan bread was not what I was expecting - as it wasn't the traditional gooey naan bread but rather a fluffier one. Goat cheese portion on top was great, however with the naan bread it was a bit too much and the flavour seemed to be missing something. Not sure if I would try the same thing again, but as the price was in reasonable range ($13-18) for brunch, maybe I'll come back when I visit Montreal again and try a different item."
/user_details?userid=8D8mjeNaJ3DGhl0WX8copA,Brandon C.,"Toronto, Canada",4 star rating,"The open kitchen in the Center of La Fabrique let's you watch the chefs at work.The food is very good.  The beet salad is great. The steaks are cooked properly, but not amazing. The sweet potato soup was very good. The complimentary bread and pickles were great.There was one thing that I experienced here that was AMAZING. La Fabrique had two cooks, two waitresses, and one busboy serving the entire place. (Probably 25-30 tables). The service was excellent. The waitresses smiled, made drinks, poured refills, and rang up checks as if we were the only people in there. I have never experienced such efficiency in any restaurant."
/user_details?userid=KAZQYouyyl4_GxkoC2sJiQ,Eve C.,"Copenhagen, Denmark",5 star rating,"Muy Favorite restaurant in Montreal.Clearly, no doubt on that - the best brunch on sunday.Unique, magic, innovative, and just great.Quality food, super service.Nice wine, nice ambiance.Best place to have dinner between friends.Go! Go!"
/user_details?userid=zOqB2XBzkk7Unu82n7PR7A,Kristopher F.,"Montreal, Canada",5 star rating,This place is actually really cool and awesome on the tastebuds. Pros - Entirely different breakfast from the staple eggs and bacon - Food is super - love the kitchen in the middle of the restaurant  - Drip coffee is great! - Super friendly service  - Clean modern establishment  - reasonable on the walletCon- none to speak ofReally overall a great place!
/user_details?userid=zO1cTvfuXFZzoGNXTKMETA,Charles B.,"Vancouver, Canada",2 star rating,"Why do people think it's trendy to have super uncomfortable seats? This is not cool, this is annoying. Also, any food that is deep fried, battered, cooked in copious amounts of butter or covered in syrup is going to taste good but that doesn't make you a good cook. It makes you an overpriced McDonalds. The brunch options had enough calories for the rest of the day and the vegetarian options were either a salad or one of two sugary dishes that would make a poutine look like ax kale smoothie. What about an omelette? What about eggs florentine? This restaurant just invented a bunch of super fattening dishes to compensate for the fact that they're mediocre chefs. Finally, 3.50 for a very small glass of room temperature orange juice? Unless you have the orange tree in back, this a rip off."
/user_details?userid=-4JBYNDqR6DLByu97G2E3w,Sarah W.,"BROOKLINE VLG, MA",5 star rating,"The food is AMAZING!! Farm to table so it is extremely fresh.  If you are looking for gluten & lactose free, this is the perfect place.  I ate the green salad, steak and French fries fried in duck fat.  My husband ordered the vegetables with his steak and we shared.  Every morsel we ate was delicious!!  We happened upon this place because the restaurant with the pig head was booked solid & sometimes things happen for a reason.  DELICIOUS & very friendly waitstaff.  Don't think twice unless you need Internet with your meal because the wifi was spotty & did not work well."
/user_details?userid=3My7MetPqqtpRrVqRKdmJA,Gaël B.,"Montreal, Canada",5 star rating,"A wonderful restaurant experience, a super friendly staff in a beautiful industrial decor.  The open kitchen gives the whole place a special touch.But above all a stunning food, there are always new items on the menu that keep surprising us. A must try in Montreal!"
/user_details?userid=xO3EIJR0QNzM3CdajinWtw,Michael P.,"Montreal, Canada",4 star rating,"Sometimes the closest restaurants to you are the ones you never check out. They sit on your ""to visit"" list and get ignored. Be it because you forget about them or get distracted by other places. This year's taste MTL allowed me to finally eliminate one such place from my list - La Fabrique Bistrot. Situated in front of St-Louis Square and a short walk from my neighbourhood, this open kitchen concept restaurant makes quite the impression when you walk in. The kitchen right in the middle of the room, beautifully wood panelling all around and tons of lighting accents. It creates a very inviting and rustic feel all without losing the fine dining element.For taste MTL, they were offering a 39$ menu that combined regular menu items with some other options. They also offered a wine pairing option for an additional 27$ for each of the meal. My dining companions and I went with this option and were satisfied with the selections - particularly the Muscato I received during the dessert course.Prior to the actual menu, we received a small bowl of squash, corn and nut soup as an amuse-bouche. Nice and rich, we were pleasantly surprised by the addition of the corn and the nuts. The corn provided some sweetness and the nuts a little salt on top of the texture additions both provided. A nice starter to the meal.The 2 appetizers offered for Taste MTL were a beetroot, carrot and orange salad with horseradish cream and ratatouille in a terrine with Vitello tomato and foccaccia. The salad was wonderfully light and fresh with a strong kick from the horseradish to spice things up. The ratatouille terrine was a very unique concept that worked beautifully and the sauce provided a nice creamy component to mix with the terrine.The first main course was a slowly cooked pork with apple, squash, turnip and sweet potato sautéed with Papineau's maple syrup and ginger. Perfectly executed, the pork just felt apart. The fattiness of the pork was augmented nicely with the sweetness of the maple syrup and the freshness of the vegetables in the dish. The addition of the cheddar on top added some nice sharpness as well. A very creative and delicious dish all around.The second main was salmon preserved in sunflower oil with miniature pepper, parsnip, onion and a carrot purée. The preparation here was a bit more straight forward compared to the pork dish but very well done. The salmon was perfectly cooked and the carrot puree was wonderfully sweet. The other vegetables were good but didn't hit home as much as the puree.We also ordered an extra side of home fries as they are fried in duck fat and served with house ketchup. Duck fat always adds a little something extra to dishes and that was no exception here. The fries had just that little extra taste and bite which was nice. The house-made ketchup had a nice tanginess to it as well. For dessert, the options were French toast with clove caramel and fleur de sel or an apple and maple syrup in a homemade yogurt cream. The French toast was ridiculous - a thick cut slice of bread with a rich and cream caramel with just the right hint of salt to balance out the sweetness. The apple, maple and yogurt mixture was quite good as well but got quickly overshadowed by the French toast. And then, once the bills came, so did our final surprise dessert - house cotton candy! Nice, sweet and fluffy without that pesky stickiness which hampers handling. A very playful way to end a great meal.From beginning to end, la Fabrique was a great experience. Having the kitchen in the middle of the dining room is a cool hook to get you in but the great food and atmosphere are what will make you come back for more. It is nice to know I have another awesome restaurant a short walk over in my neighbourhood. Just another reminder to not ignore what you have close to you. You may be pleasantly surprised. Cheers!"
/user_details?userid=v_gdWkUoAOvgB29WYbaC2w,Michelle E.,"Westchester County, NY",5 star rating,"Tableside cooking? Check. Local ingredients? Check. Service that is genuinely kind, efficient and hospitable? Check. A restaurant that makes its own mayo and ketchup? Wow. The warm, charred bread and sour cream butter spread was a nice way to start the meal. Housemade pickles added to the wow factor. We started with the daily soup, an amazing Carrot, clementine puree. We continued with a cheese terrine melted on a slab of crusty bread. For entrées I had the succulent beef shoulder braised and grilled, dressed with Roman beans. It was out of this world good. My husband had the salmon with a side of fries. We finished with the french toast and I highly suggest that you save room for it too. The insanely delicious caramel top was a perfect balance for the salted, buttery crust of the soft bread. We were so disappointed that we couldn't go back for a second night as they do close on Mondays, but we were glad to have had the experience for at least one of our culinary adventures in Montreal."
/user_details?userid=lOnP1uXxSU_nJlidWUkLVQ,Luci A.,"Miami, FL",5 star rating,"Trying to find a restaurant on our last night in Montreal and happened across this gem via Open Table. Their sommelier graciously accommodated our party of 8 in spite of having a full house. It's a very hip, low key place with amazing food and service. Attentive to the highest degree - every detail was attended to with the warmest of attitude. We're so glad we were able to have such a fabulous gastronomic experience during our visit to beautiful Montreal."
/user_details?userid=lJix8dFRFk4WvVpdRTyC0g,Andrew W.,"Denver, CO",5 star rating,"As recommended by our hotel concierge, La Fabrique was very much the exact restaurant we were looking for visiting from Denver, Colorado.Our request to our hotel concierge of ANYTHING in Montreal needed to meet our criteria: Local, non-tourist, new, the perfect feel for Montreal, young, hip, swanky but not snobby, and fair priced - but not cheap.We made reservations for 6:00pm as we wanted to make it to the fire works for the Montreal High Lights Festival that Friday evening downtown.We parked our rental Yaris on the street right out front on St-Denis.  The interior was of modern browns, plastic fishing boat seats and exposed red brick blending very well together.  The open central kitchen organized of silver cooking utensils, blackened cooking grills and clear plastic containers of fresh ingredients filled the narrow restaurant with a wonderful aroma.My girlfriend ordered a Shiraz - 25cl of wine [about two glasses] and I ordered their Quebec Wheat Ale.  Very good recommendations.Before our appetizer arrived, complimentary grilled French bread with a large jar of sweet pickles and homemade butter is what we nibbled on.  As I love pickles, I was already in seventh heaven.As we were not able to read the French menu, our waiter helped running to another waitress for translation.  Soon, our wonderful dinning neighbors also stepped in to decipher the menu.  We settled on the stuffed pigs feet type egg rolls as our appetizer.  The inside was a sweet hot creamy mixture on a bed of julienne apples.  Just enough for two.  My girlfriend ordered the Veel Cheeks on thick perfectly cooked turnip slices.  Topped with whole steamed carrots and a very nice gravy/sauce.  I ordered the Special: Pork and Scallops with mashed potatoes, a potato type bread and a wonderful gravy/sauce.  Both of our dishes were perfectly prepared. The atmosphere was casual and full of conversation.  The large back area and table filled with a surprise birthday party followed by the group singing Happy Birthday to the birthday boy.Our waiter, waitress and neighboring patrons made our ""outsider and visiting"" experience more of a local and welcoming experience.  Everyone was very helpful and the food was better than expected.  I really hope my Non-Canadian experience helped with deciding to visit La Fabrique.  I really really enjoyed it."
/user_details?userid=8p4JGNgZl705fByqyF6BrQ,Monyka T.,"Montreal, Canada",3 star rating,"Honestly, this is just another hipster joint. The menu sounds tasty and the atmosphere is trendy, but the dishes are mediocre and plain. Montreal is cracking with top notch restaurants pushing the envelope when it comes to trends and creating flavourful dishes, La Fabrique is underwhelming and was obviously a disappointment. Staff was great, however."
/user_details?userid=oJRqcPNygJ-UdUx880pNDw,Joana S.,"Montreal, Canada",5 star rating,"Just went there for brunch. I loved it! The food was delicious and the service is flawless. Will definitely go there again, and not just one more time!"
/user_details?userid=jae1cBvdz_CGQ2r9LX8iFQ,Elena C.,"Montreal, Canada",4 star rating,"Ate at the Annexe that they have open for the summer, just a couple doors up from the regular location on St.Denis. I have been meaning to eat at this place for a while now, and I am happy that I finally did. Sat out on the terrace with my brother and enjoyed a very nice late lunch/early dinner. We started our meal with some delicious bloody caesars that had some port in them and were garnished with anchovy stuffed olives (yum!). Could have been a tad spicier, but other than that they were really quite good.For appetizers, I ordered the melon salad, upon the recommendation of our server and I was not disappointed! It was really refreshing on a very humid day. my brother ordered the tartine gratine, but was brought the cheese fondue. It was not what he ordered, but we didn't complain because the cheese fondue was really great! It's a deliciously breaded piece of cheese on top of a little rocket salad. We completed our meal with a second round of caesars and our main dishes: the bavette for my brother, and the gnocchi with a scallop for me. Both were well seasoned and cooked perfectly. We also ordered a beef burger to bring home to my sweetie who didn't come for lunch. It's made with braised beef and garnished with a sweet red cabbage. Really yummy! Overall a lovely meal. Delicious food, nice atmosphere, and beautiful plating. The bread and home made chivey butter that came with the meal was really great and their home made ketchup and mayo were also delicious!! I will definitely be back."
/user_details?userid=qYeHKJQ8UkKVuhIYx2EYBQ,Scott C.,"Dartmouth, Canada",5 star rating,One of the best breakfasts I have ever had. Had the pulled pork on English muffin topped with cranberry bread and a soft boiled egg. Fries in duck fat. Amazing!
/user_details?userid=bCC9m7vuNKISQ-ckJ98fJQ,She H.,"Montreal, Canada",4 star rating,"Brunch - pain perdu = phenomenal french bread! the crispy edge and the syrup make this dish absolutely divine! A little intense for breakfast in terms of sweetness, but I would happily split this with someone who would take a salty plate.pudding  au pain - I had a small bite, it's a soft, moist bread with a nice sweet taste, coupled with saltier side of poultry, and a squash puree. Also very tasty, great for someone who wants something salty and sweet . Oeuf moelleux - will not likely order again as it lacked taste. I usually complain that dishes are too salty, but this one was short on flavors. The lentil salad was great, but the remainder of the dish was a definite miss."
/user_details?userid=Dp4jfn3XvZ9Xd9Ng_t7RAQ,Chrystina B.,"Toronto, Canada",4 star rating,"First thing's first: walking into the restaurant, the first thing you see is the open kitchen and the food waiting on the pass under heat lamps. Interesting introduction as you walk in, but unfortunately your first contact is wading through ""traffic"". And though the service is a little slow, the food is quite outstanding. The complimentary pickle jar to start and cotton candy at the end are nice touches, and does nothing to take away from the artful dishes prepared before your eyes by the creative chefs (who are not hard on the eyes themselves). Tried the salmon tartar which was which was fresh and flavorful and the ""plat du jour"" which consisted of a pork and black bean tart which scallops and seasonal veggies - amazing. Didn't have room for dessert but apparently the Pain Perdu is wonderful.Will definitely go back (but maybe during the week)"
/user_details?userid=_h_EiVf-NWFrovL9FXyO1w,Meg S.,"Hamilton, Canada",5 star rating,"I came here for my birthday dinner while on vacation in Montreal after checking out the thoughtful menu online.  When we arrived, I immediately knew I'd come to the right place.  It was open, decorated with some awesome artwork and right in the middle is an open kitchen where you can see the chefs move swiftly and expertly while preparing your meals!Our server was absolutely lovely, explaining everything on the menu with expertise.  She made some cocktail recommendations (a gin fizz, made with a small batch gin from Vermont, tasting of honey) and she was spot on.  It was a nice touch that she brought extra soda water to the table so I could alter the cocktail to fit my tastes, but it didn't need altering at all.After ordering, the complimentary pickles and bread came to the table.  I don't think people have said enough about these pickles on their reviews.  These pickles are insanely good- they're bread and butter pickles with a gingery kick, absolute perfection.  Other places would charge you an arm and a leg for these on a charcuterie board- I thought it was a great touch.My partner ordered the steak frites and I had the hake with ravioli in a mushroom broth.  We were both really pleased with our meals.  He loved the butter and steak (perfectly cooked to medium-rare and tender) and my dish was so delicious.  The mushroom broth was richly flavoured, the hake light and a great contrast to the richness of the broth, and large, thin slices of pickled carrot provided acidity as well.  A really thoughtful dish.  After a lovely dessert of lemon merengue tart, the waitress brought out a small glass of cotton candy to top off the meal.  It was a playful, light touch to end a great dining experience.  I'm sad I'll only be able to go back on vacation- I am already craving those pickles!"
/user_details?userid=vcDS5YXey50HeRfdgiY1jQ,Marilyn J.,"Brooklyn, NY",5 star rating,"La Fabrique was our last meal in Montreal and we were happy we chose to eat there. The food was delicious and the chefs did a wonderful job with the presentation of it. The atmosphere was relaxed with cool music and the waitress Roxane was amazing! She was genuine, funny and truly took care of us. All in all - La Fabrique was the entire package."
/user_details?userid=6_1ttfU00JfSfmaTTDyaIw,Tara C.,"Oxford, MA",5 star rating,"I was really impressed with this place.  A very unique atmosphere, kind of hipster-like, but it was cozy and welcoming.  I liked being able to see all the chefs at work -- the kitchen in the middle of the dining room was a really neat touch.  I don't get to see a lot of places like that were I live.  Started out with their house bread which came with some sort of cream cheese or sour cream spread.  Thoroughly enjoyed it.  The homemade pickles they give you are also delicious.  Sweet and spicy, but in a unique way.  Then followed up with their toasted baguette with an assortment of Quebec cheeses.  Also really good -- I think the baguette was toasted with garlic.  I ordered the foie gras and my boyfriend ordered the beef shoulder.  The foie gras was beautifully presented, slightly crispy on the edges and buttery tasting.  I didn't try my boyfriend's beef, but he said it was amazing and keeps telling everyone how good it was.  We finalized the meal with some dessert.  I had their passion fruit yogurt with rhubarb and puffed millet.  Delicious, sweet, and tart.  My boyfriend had the meringue.  I'm not a fan of meringue, but I am a fan of La Fabrique's meringue.  It's sweet and has a flavor that I've never tasted before in a meringue.  They followed up our desserts with a serving of cotton candy, and that made my night, because I LOVE cotton candy.  If you want a truly unique meal with some beautifully presented dishes and a great wait staff, La Fabrique is the place to go."
/user_details?userid=HWIkv4fFVHl69OTr468VVg,Erick H.,"Ventura, CA",4 star rating,"The relaxed environment of La Fabrique Bistrot made it the perfect place for dinner following a long day of travel and business meetings. Starting with an excellent wine recommendation, our waiter continually demonstrated an expertise and attention to detail that made for a casual and professionally-productive time, all while adroitly switching between English and French in order to accommodate all four members of our dinner party.After spending a great deal of time scrutinizing the menu and its occasional, though rather amusing, translation failures, I decided that a hearty bowl of onion soup was an apropos way to begin the meal in a city still under the grip of winter. The robustly-flavored and appropriately-comforting soup proved the perfect way to start the meal.For my main and final course, I opted for the pan-seared cod with cumin and black olive mashed potato galette. The obviously high-quality fish was seared perfectly, the light char serving to hold together the flaky flesh without overwhelming its mild flavor. The boldly-flavored potato ""cake"" proved a welcome and pleasing juxtaposition to the cod, making for an  adeptly-balanced dish. The accompanying vegetables added a bit of depth to the dish without disturbing the pairing of fish and galette that was clearly the chef's focus.After lingering for a few hours all while never feeling rushed despite the rapidly-filling dining room, we departed having enjoyed a meal clearly prepared by a skilled and passionate chef intent on providing rich, satisfying ""comfort"" food in a laid-back environment."
/user_details?userid=yuLmuvba8qI9L_dKk6ihqQ,Andrea K.,"Manchester, NH",5 star rating,Eating here was a religious experience. Duck fat potatoes. Red meat cooked to perfection. Transformative. Ethereal. I almost cried twice. Wow. What a meal.
/user_details?userid=Us1y4hBCozBmfLqzvB80Nw,Masao K.,"Montreal, Canada",2 star rating,I was unimpressed with the food and the service was pretty poor.  I don't intend to go back any time soon.
/user_details?userid=8SdXEmce1c5R9hGSljbv1g,Shao L.,"Richmond Hill, Canada",1 star rating,"The location is nice and the setup is good, but the food and the service are not on par. I started with the Porc Terrine which unfortunately was tasteless and dry (although the portion was more than generous). The accompanying foie gras was nice. So were the starters of my wife and her mother. The main course was more miss than hit. My duck burger was OK but they definitely tried to cram to many things in it which made the whole thing unpalatable. The duck is mixed with cheese then crusted and deep-fried. Then it's put in between buns with some sort of celeri/beets salad, something resembling a bearnaise sauce and foie gras (that was a supplement that I asked for). Unfortunately the dish was way to heavy and the sauce was too strong. Something that could have been really inventive turned out to be a greasy deluxe version of a McDonald dish. My wife ordered the old-aged steack. She asked for it medium-rare and it came well done. Now that's bad. When a restaurant can not cook meat properly, you know for a fact there is something really wrong in the kitchen. They were honests with us and did not count the dish on the note but the damage was done. The deserts were OK although I am 90% sure their creme brulee was not homemade. Service was decent. The only problem was that out of the 3 waiters (2 girls and one guy), only the girls looked like they knew what they were doing. The guy kept forgetting everything and did not look like a professional waiter at all (he probably gave these poor girls more work than help at the end). So all in all, a below average experience which is all the most disappointing that some of the ideas on the menu or in the setup could have led to something really great. If you know cooking, don't go there, if you're just looking for a nice place and don't care about what you eat, this could do the trick."
