user_url,user_name,user_city,user_rating,user_review
/user_details?userid=teW3K8NVBPJvYcTiIxtGZw,Monica T.,"Laval, Canada",5 star rating,"The restaurant is small and cozy. I enjoyed the service, the waitress was lovely! She knows the menu well and was useful. The food came very fast. The salmon chirashi was great. The fish was fresh and tasty. My boyfriend had the take kago. He enjoyed most of the plates, especially the karaage! The portion size was perfect too. We had the strawberry roll cake for dessert which was also amazing. Overall, my only complain is that the salmon chirashi bowl was filled with too much rice.Definitely in my list of favorite restaurants now!"
/user_details?userid=9ht3qxaczdw08fKCHfrToQ,Christopher L.,"Boston, MA",3 star rating,"Nice ambiance and great friendly service.  Small and cozy place but still spacious.  The food is decent quality, but the menu is a bit off.  It feels as if the chef is hiding something by soaking the rice in a slightly sweet and quite salty, soy-based sauce.  And the fish is smothered in scallions.  In my opinion, a nice piece of raw fish like a Toro should be allowed to speak for itself against a plain background.  It's like putting a loud and obnoxious frame on a beautiful painting."
/user_details?userid=IMSaka8H9PLGfzkbT7MsyQ,Julia WeiYi Z.,"Montreal, Canada",5 star rating,"Best Japanese restaurant in Montreal!!!A small cozy restaurant. We came here Thursday and arrived before 6pm, so it was pretty empty but we could choose where to sit.My friend was debating either to get uni don or Kaisen don, she chose uni don because daily special tends to be fresher?! I ordered unagi donAnd we made the right choice.This uni don, the sea urchin was the best one that I ever had it in Montreal. Today is Saturday, and I'm want to go back right now...."
/user_details?userid=LtBYic6bNL2_JiuMmMKa4w,P D.,"Long Beach, CA",5 star rating,"We went to 3 Japanese/ sushi restaurants in Montreal, starting with this one. It set such a high bar that the other restaurants were disappointing in comparison. The food was phenomenal. The chicken karage was very lightly breaded and perfectly cooked. Even the drinks were stellar. I got a lychee martini that was refreshing and not too sweet. The bill ended up at a very reasonable price. We will definitely try to go back."
/user_details?userid=0gZ8E5tBWTEtGEZDuTzhzw,Cindy Feng Xin L.,"Montreal, Canada",5 star rating,"One of my fav Japanese restaurants in Montreal, offering different surprises for me each time I pay a visit there! The owner changes the menu on a regular basis, so even the choices of dishes are not very varied, satisfaction is guaranteed no matter what you take, and if you go there after a while, you get to try a different set of gourmet! The three times that I go there, either me or my friend took the five choices of the chef, which offers a great variety of little dishes to try out, so if it is your first time there, definitely try it out! The plating is beautiful and it looks super good even before I taste it! My favorite is their sashimi bowl, which is so fresh and succulent, I cannot stop! Their salmon bowl is good but I think it's not as good as the other choices.  I highly recommend Nozy!"
/user_details?userid=TRHyQ2-3b92RyIKoozsotw,Andre N.,"Montreal, Canada",5 star rating,"Great food and atmosphere, serve are great. Best thing on the menu is the sea urchin bowl ! It's fresh and just melts in your mouth."
/user_details?userid=ZxMBtQ6x9VZlE9Co8fjwQQ,Shijia C.,"New York, NY",5 star rating,"I read up about this place at one of the blogs on new places to try in Montreal so decided to give it a try. Quite impressed with their food, so fresh and great presentation! I'm surprise this place does not have any reviews yet cus they def deserves some! I came in on a wed night at Aron d 830 an hour before the close. It was quite busy in there but manageable to get seated right away with a few tables opened. I like the fact that they kept their menus simple with just a few things to select from but def brings characters and everything is very different. I wasn't too hungry but wanted to try their salmon so I went for the salmon chirashi. Which was amazingly good!! It came with a miso soup, side salads and some pickles on the side. They were also super fast with their servings!!! I literally order and within 5 mins they already brought the food to me. I was quite surprise. The salmon was tender. It comes with the sashimi, half cooked ones, tartar and some eggs on it. I love it!  Not too heavy just about right as i've been eating such heavy stuff in Montreal so this def does it for me. Not to mention my waitress was really nice  too and it seemed like she was the only served there that night. I would come back again and try their take Kago (chef's choice of apps) and omakase. Def worth a visit! Oh and they do have a bar there as well :)"
/user_details?userid=W_CkghBYSgJIJYi44GBTPA,HanDan W.,"Montreal, Canada",5 star rating,"Love the food here. It's a bit pricier but definitely worth it. I am lucky enough that they have uni don today(sea urchin). Everything from sea urchin to salmon to the rice are perfectly cooked and prepared. I also loved their miso soup and the salad. For desert, we had crème brûlée, it was ok but not as impressive as their don. My friend ordered the chef's choice that contains Japanese fried chicken which is also very tasty. The other friend ordered the kaisen don(assorted sashimi don) which was also amazing. In all, we all loved each of our dishes and we will definitely come back to try out more. You may need to make an reservation if you come on Saturday (they're closed on Sundays) since the restaurant is tiny. We are fortunate enough to sit at the bar as all other seats were reserved."
/user_details?userid=sLUems6LCJsPjWpmufQY2A,Steve D.,"Ville-Marie, Montreal, Canada",5 star rating,Very tasty little Japanese restaurant. Interesting menu and many sake options. Great to finally eat something other than sushi in a Japanese resto!
/user_details?userid=3NvmvvKNUcigSkT5OlLM7A,Vincent T.,"Montreal, Canada",3 star rating,"Not a bad joint but I was quite disappointed with their chirashi. It usually comes with a wide variety of sashimi, seafood, vegetables on sushi rice but this salmon chisarahi, well, just salmon and jasmin rice. True, the menu did specify it was salmon chirashi but I believe you shouldn't use the term chirashi as it's known to be a bowl mix of fish, veggie and other ingredients ... chirashi stands for ""scattered""!"
/user_details?userid=SSrxVJTiQX5noMU2YcNyoQ,JI Won K.,"Côte-Des-Neiges—Notre-Dame-De-Grâce, Montreal, Canada",4 star rating,"It was great dinner. Very friendly staff and delicious foods were perfect harmony. If you like Sashimi, I think this restaurant is good for you."
/user_details?userid=FTsYsxk0-vsSk4uil1VD5g,Feifei L.,"Chicago, IL",5 star rating,"I like this little Japanese gem in St-Henri. They don't serve sushi, but instead go for a more ""home cooked"" style of Japanese food. I'm a fan of their Karaage, Uni Don, Toro Don, and Sashimi overall."
/user_details?userid=rztxnI_Uh_izxvq2hFzfrQ,Emily D.,"Montreal, Canada",5 star rating,"So delicious!!!!! I had the salmon bowl. It was so fresh and tasty. There was an amazing spicy sauce on it that I even asked for more of. My boyfriend got the burger steak.. Bad move! Stick to the fish there and it seems pretty fool proof. They change the menu each week and use seasonal fresh ingredients. Simple decor, pretty good service.Came on a Saturday night and it was pretty full. Overall I really recommend it!!!"
/user_details?userid=YOmyzxTFYULhTCHdDgWQRA,Cathy Yuqi G.,"Montreal, Canada",5 star rating,"This place got me hooked no joke. If it is not because I am on a diet (and broke) I'll probably go there every single day until I try every single item on the menu. Their interior is super simple, yet cozy. The waitress is friendly, and helpful. The service is fast. They fully deserve their fives stars! :DI got lucky actually because they offer uni don and toro tekka don on their daily special menu, the two bowls I wanted to try the most. As always, when I go to a japanese restaurant I always order their karaange, and this time is no exception. And lastly no matter how full I am, there is always room for dessert, especially when the dessert of the day is matcha creme brulee. ;)- Karaange: I love their karaange. Probably my favorite so far. The crust is thinner compared to the other karaange I've tried before, so it has light crisp. The meat is sooo juicy. It has a hint of spicy flavor, because there was an aftertaste of ginger, which makes it even more interesting to eat. - Uni don: I tried the uni don at Otto, and I shall say Nozy is winning hands down. Their uni don includes sea urchin, salmon roe, and salmon tartar, which gives variety. The one I had at Otto was smaller in portion and only had sea urchin and salmon roe, and was only 2$ cheaper than Nozy. The sea urchin did not have that ""fishy"" taste at all. Since there are so many different texture in the bowl, it was more interesting to eat.- Toro tekka don: The sashimi tasted fresh, and the tuna was melting in your mouth. The rice was already seasonned, but did not overpower the taste of the fish itself. I'll say compared to the uni don, this is kinda dull to eat, but since I love tuna belly sashimi, this is not a big problem for me. - Matcha creme brulee: Probably my least favorite part of the meal. The creme brulee did not had any taste of green tea at all. The sugar crust on top was a little too thin in my opinion. GREAT PLACE! GONNA BRING MY FRIENDS FOR SURE! THIS WILL BECOME MY NEXT GO TO PLACE ！"
/user_details?userid=VeEM--3NvAQ_b_R8g05CkQ,Adele D.,"Montreal, Canada",4 star rating,"This is one of my favourite spots, whether for dinner, lunch or weekend brunch. I love that each meal comes with a small side salad and miso soup. The quality of the food and service is always top notch, and the place in general offers great value (especially at lunch, when prices are about $2 cheaper per menu item than at dinner). I've tried and enjoyed the salmon chirashi bowl, the take kago, the sashimi lunch platter and the seasonal uni Don. The food has always been fresh, delicous, and beautifully presented. At lunch/brunch, prices start at $13 (for the Japanese curry dish) to $28-$32 for some of the seasonal specialities (uni don bowl, blue or yellow fin tuna bowl etc.) Dinner prices start at about $18 I think. There's a reasonably priced wine list for dinner as well (bottles starting at about $30-ish)."
/user_details?userid=0Se8OFrPpi6wE2TY2IVTLA,Eric N.,"Montreal, Canada",3 star rating,"It's a cozy little place, then fish are fresh however I personally find it a bit lack of selection. Their night menu is also lack of hot dishes (most them are sashimi or tataki)."
/user_details?userid=ESvntjNosDLMzOkUmP9NAQ,Mark C.,"Los Angeles, CA",5 star rating,"Excellent service,  food,  and ambiance.  The karage and black cod are must haves. The sashimi is high quality. Will definitely return."
/user_details?userid=KBHTIaz-OdXukREefkP4qg,Gabrielle L.,"Montreal, Canada",4 star rating,"I went here with a friend on a Wednesday. It was packed and we hadn't reserved but luckily there was space at the bar. I had the Bloody Caesar (sake, vodka, lime, cucumber) and the salmon chirashi (salmon 3 ways: sashimi, tartare, and tataki). It also comes with miso soup, a salade and pickled beets. It was very good but I wish there had been more salmon. There were three pieces of tataki and four pieces of sashimi. My friend had the miso cod which was the special of the day. She said it tasted good but didn't like that there were bones in the fish."
/user_details?userid=bds7VxgVm0e6Pu5RuVV-wg,Thea V.,"Montreal, Canada",4 star rating,"We've been wanting to come here for a while now. We finally gave it a try today. The location is great. it is located on one of the main roads of Griffintown. I was worried when we stepped in because we did not make a reservation and all the tables were reserved. Luckily, we managed to get seats at the bar. I ordered chicken karaage , salmon chirashi bowl and my partner ordered another ricebowl with salmon, shrimp, and tuna(i forgot the name of the dish). It was the best karaage I have ever had! The chicken was so tender, it almost melts in your mouth ! Both rice bowls were really delicious, the fish was tasty, the rice was cooked perfectly and they both came with miso soup and a nice portion of salad. For dessert, we ordered the kaki-gori (shaved ice) with berries and ice cream. It was heavenly!!! Overall, our bill came up to $65 taxes included + Tip. I'm only giving it 4 stars, because the service was a little slow but everything else was great. I would definitely come back."
/user_details?userid=jImKbs4In8xg5c73Gb0NTQ,Eric C.,"Montreal, Canada",4 star rating,"When available, you must get their exquisite toro and uni don combo. Also served with caviar, miso soup and salad. Their sashimi appetizer is also a good choice, while I was less impress with their unagi don, the rice quality is not consistent. The place is tiny and simple, not recommended for large group, but food quality is good and price is fair, worth going and returning."
/user_details?userid=nBotK5rAhsUCkBKhzShKXA,Melis B.,"Montreal, Canada",5 star rating,Amazing lunch menu !!! I highly recommend the sashimi is so fresh and delicious. The place is so simple and beautiful. Highly recommend
/user_details?userid=NXGHE6Cbjpk5S6LNATdYzg,Cindy K.,"Montreal, Canada",5 star rating,MUST EAT MUST TRY - a true fan girl of NOZY. Went back for my birthday dinner. The food is just amazing however some of the items are seasonal so don't expect the exact same meal if you go back twice!
/user_details?userid=aNfG4yqETNKXNQgc2qTToA,Doris Z.,"Glasgow, United Kingdom",4 star rating,"Reserve before coming here! Had to go back for a second time because they were fully booked when we got there one night. Wanted the uni bowl but was told the season has passed. The waitress was super friendly and accommodating, she offered a special rice bowl for us with several different fishes. It was a combo with salad, soup and some Japanese pickles. The rice bowl was absolutely heaven like. The fish was fresh and the rice was al-dente. With the soy sauce and wasabi, it was a really fulfilling meal. The miso soup was made with shrimps, so it got an extra layer of taste and freshness. We also shared an appetizer platter, you can tell it's made with love and dedication! It got fried chicken, beef carpaccio, sashimi, eggplant dip and kale salad. All were really good. The chicken was super tender, the kale salad was really special with sesame sauce and the eggplant dip! Where can I buy some to eat with chips while watching TV?! The only reason was the sashimi bowl turned out to be $28, it's a bit expensive compared to the salmon bowl for only $16. We only found out the price when we got the bill. We wish we were informed the price before we ordered. Other than that, it was a perfect meal! Can't wait to go back!"
/user_details?userid=I4DmKbidvmcGjQGosQuZNA,Thi H.,"LaSalle, Canada",5 star rating,"A lovely cozy japanese resto. It feels like japanese ""comfort"" food, homemade meal. We were a group of 7 and the staff was courteous and patient on explaining the menu. The proportion of the meal is well thought. A must try."
/user_details?userid=FK6QC2bpIcAIwPQ5MGxPFg,Alice X.,"Montreal, Canada",5 star rating,"Food is great, but a little pricy given the small portion.  We made reservation for 1:00 pm, but the restaurnat was quite empty at that time. They are serving Uni Don ($28) these days, so don't miss the chance! My friend had Take Kago($17), which is a combination of 5 entrée. The eggplant purée and karaage are pretty good."
/user_details?userid=TIXVPBC27XWOu2Yl-wpEpQ,Yann L.,"Montreal, Canada",5 star rating,"My favorite japanese restaurant in the city!Quite place, amazing fish quality, prepared with love and technique!Extremely afordable and fairly priced! Some spots in the city would charge 10x more for what u have there!"
/user_details?userid=23naRmK_DDRh4FNLZmn5LQ,Tiam D.,"Laval, Canada",5 star rating,"Big crush for this place since moving to St Henri. The food is fresh and simple yet incredibly tasty. Food Is prepared with love and it makes all the difference! By the way, Best chicken karaage so far in Montreal!"
/user_details?userid=z8ckRjVaLQWAFaqKFwaodA,Emilie W.,"Seattle, WA",4 star rating,"Nozy is a nice and cozy place ;) where you can tell locals have called it home.Excellent service - the waitress knew her menu and her specials very well.The restaurant offers interesting lunch menus that come with the main dish, a miso soup, salad and a potato purée. Specials of the day also come with the same sides.I ordered the eel special; it was good, but nothing extraordinary. My friend ordered the tuna belly sashimi special. The sashimi was delicious. The only downside was that it was placed on the rice when it was still warm thereby cooking the raw fish a little bit. I would've given 5 stars if it wasn't for that :)For dessert we had the black forest cake. Smooth and fluffy. Probably one of the best I've had."
/user_details?userid=RMJNk8zk0wtw9x5jl2iTWQ,Ha L.,"Mount Royal, Canada",5 star rating,"Simple no fuss Chirashi and donburi, real authentic Japanese food. Delicious and reasonable prices. One of my favourite in town."
/user_details?userid=6JpfqDCXwP4hIqoGYAk9Dg,Jiayi P.,"Saint Leonard, Montreal, Canada",4 star rating,"Had a nice meal with my friends. The food was wonderfully fresh and the atmostphere was pleasant for a nice rainy evening. We found that the place is easy to find and conveniently close to a metro (just a little far from where we live, but definitively worth it)."
/user_details?userid=laFwsknjneH2QoGeLbemTw,Didier H.,"Montreal, Canada",5 star rating,The restaurant serves amazing Toro and great juicy karaage. The rice used for the sashimi bowl improved and is now good.
/user_details?userid=rYLFksli7mXB0MZxo3MHOw,Eric L.,"Toronto, Canada",5 star rating,"Amazing place. Love coming here because the menu is different Everytime. As someone who hates going through menus, love the chef special and it's always a good surprise :)"
/user_details?userid=eQCbpclmzEGIOvoaMolYyA,Mandyy S.,"Saint-Laurent, Canada",4 star rating,Went too late so not too many choice left! A small Japanese resto... A bit hot as a/c not very strong! Food is so delicious! Love their chirashi... Simple but so good! Hopefully can try their Uni don one day~
/user_details?userid=BgFL0NXsJAlZCmj-vxPPqw,Doug B.,"Montreal, Canada",5 star rating,Don't pass this place up.   Doesn't seem like much from the street but the food is mind blowing.
/user_details?userid=kR4Vfavzox20UHD3U9Cjew,Monica W.,"Montreal, Canada",5 star rating,"Had a "" not on the menu "" sashimi platter for 2 made by chef Nozomu :) great seletion and good portion."
/user_details?userid=oSt46KM_mSVBWKjwFzgPkA,Philippe C.,"Montreal, Canada",5 star rating,"My favourite Japanese restaurant ever. Loved the umeshu drink, the cod was amazing, the sushi incredible! Everything is so nicely presented, fresh and delicious. Refreshingly unpretentious. Will return many, many, many times."
/user_details?userid=5ca2MkCJFAMafDrRxLMlXQ,Ash L.,"Montreal, Canada",3 star rating,"Every dish is so photogenic here like food p*rn, except that nothing I tried here would give you any foodg*sm. It's a shame because the menu is authentic, the service is nice and the portion-price ratio is so satisfying! So why is it a 3 star? For example, almost EVERYTHING you don't ""physically"" see in the salmon chirashi dish is missing! Besides white rice + salmon, there's really not much going on. If you simply googled ""recipe for chirashi"" there's at least 1 c of rice vinegar, 2 tbsp of sesame seed, 1 tbsp. katsuo fumi furikake rice seasoning..., but the rice tastes plain and the salmon is not fresh enough to 'appreciate' zero seasoning. My boyfriend seems to be quite satisfied with the ""nutrition factor"" of this meal. Maybe it is a good quick lunch option if you want something healthy&fresh in the neighborhood."
/user_details?userid=SaHdDUPNjf8bg-iza4seOA,Harry H.,"Montreal, Canada",5 star rating,Love this place! It's a little pricey and the service is a bit slow but that's only because the chef makes everything with care and love. The food is fresh and the presentation is spot on.
/user_details?userid=vAfDke0aeT1tNnpKu4-UrA,Lise T.,"Montreal, Canada",2 star rating,"There are plenty of better Japanese restaurants in town. The choices are very limited. Too overpriced for the quality of the food. A tiny bowl of miso soup has absolutely nothing inside costs 3 dollars. It's not even as good as those served in cheap Sushi buffets. Anyways, not impressive. Probably won't come back."
/user_details?userid=szntccriwCwx5c4LcKfn9A,Betsy L.,"Montreal, Canada",5 star rating,"Fantastic place.  The menu is small but very well thought out.  The salmon chirashi is my favorite.  I get veggie dip every time, the karaage is delicious and the specials are great.  I had a black cod in miso that was awesome.  I eat there almost every week now."
/user_details?userid=WJ_RadMqD2AMGxg3tt9Orw,Nicole E.,"Montreal, Canada",1 star rating,"Smelly, limitedOptions. Very poor air circulation smells like fish and does not make u want to eat your food."
/user_details?userid=VnQvB2JDkMtRXr4tA8QaQw,Annick L.,"Quebec City, Canada",5 star rating,"A Japanese place serving something other than sushi. Been here 5 times; addicted to salmon chirashi. Rice always cooked perfectly, attention to detail, high quality ingredients and food. Go and try it!!"
/user_details?userid=gGaXenGU3j7-dg6HkYhC-A,Lay B.,"Montreal, Canada",4 star rating,"It was good, authentic and filling we were thankful that the waitress forgot one of our dishes."
/user_details?userid=IMbTPsOTTY5xs5VhHSm4mA,Louis G.,"Montreal, Canada",5 star rating,"This restaurant is one of the few that I've been to that nails simplicity. Small menu, nothing fancy, just a focus on good food and good ambiance. The salmon chirashi dinner is a great choice, and if you're really hungry, the fried chicken is really, really good."
/user_details?userid=JNu14P8S6gknZCHP-V2R-A,Patrice C.,"Westmount, Canada",5 star rating,Fantastic Japanese with super friendly service. The Take Kano box is a nice surprise.
/user_details?userid=ws8w3gzeKvdJ04vkKSiYvw,S H.,"Montreal, Canada",4 star rating,"New-ish Japanese place in Saint-Henri. Tried it out for lunch and really enjoyed it. Decor is tasteful and comfortable. Menu is small but well considered; everything on it looked delicious. Finally decided on the salmon platter, and my friend had the appetizer assortment. Food is tasty and fresh. A bit pricey, though, which is the only reason I deducted the fifth star. Still, a welcome addition to the neighbourhood."
/user_details?userid=bZADhhMrBsNUnSBg3d2yPw,Jessica C.,"Montreal, Canada",3 star rating,"The food was excellent but the service was pretty terrible, and too slow for a quick lunch. I hope this improves!"
/user_details?userid=c_3gu1Ep5KhP-MVwVz8eSQ,Nicolas M.,"Montreal, Canada",5 star rating,Recently moved to St-Henri and stumbled on this cute little Japanese restaurant. I love it when the menu is small and simple and Nozy is just that; fresh and good food. The chicken karaage is simply one of the best I had in Montreal. Pair the fried chicken with the pancakes and a salmon bowl.
/user_details?userid=7hElQBiE_x2HZk6yJMVgNg,Lu Z.,"Montreal, Canada",5 star rating,"great place loved it, the fish is very fresh it's from a japanese private import. big difference comparable to Park's quality. the bowls are very good, comes with a soup which is a plus not salty at all the miso soup. Service is ok, not very accommodating waitress but they were full."
