user_url,user_name,user_city,user_rating,user_review
/user_details?userid=KcFMI-hsr2Em7whfI4OM5g,Katya P.,"Montreal, Canada",4 star rating,"Spent a lovely day in Old Port for Canada Day and decided to try this restaurant with family and friends. We were all very satisfied with our experience, loved the food!I always like having a little something with my main dish and the all you can eat salad bar and bread was perfect. There are choices that'll please anyone, from your basic greens to couscous, chick peas, potato salad and so on. I got 3 plates of it and wanted more that's how much I enjoyed it.I got their classic St Leonard spaghetti with meat sauce which was extremely flavorful and had just the right texture.My mom got the duck leg confit with caramelized onions and raisins, she must not have realized that it would be so sweet although the duck itself was succulent.We were 5 people and not one of us had food left on our plates by the end of the meal.It's a charming restaurant, great location and not overly packed. The fact that it doesn't have a terrace makes it a little bit more low key compared to other restaurants in the area but I found that perfect since that means it's easier to get a table.I would definitely go back, can't wait to try their tortellini or chicken parmesan.I would have given this place 5 stars had it included a desert or drink in the meal."
/user_details?userid=dzQ7rchHMdWs89hxvZNZxw,Ella M.,"Fredericton, Canada",5 star rating,Solid 9/10. Not best food i've had in my entire life but very enjoyable satisfying and delicious! Would recommend to a friend.
/user_details?userid=DLR7b3ieCQPrptyQGJ3v4w,Sanija M.,"Cambridge, MA",5 star rating,Great food...Loved the lamb shank fetticuine with red wine reduction.... Wow it was so good ...five star to finger licking lamb shank
/user_details?userid=FqeqwaxWkcjK0bZoTpLiNQ,Madhavi J.,"East San Jose, San Jose, CA",5 star rating,"What a wonderful, wonderful place ! We were in Montreal for 4 nights and ended up in this place for 2 of them! The #2 and #10 items on the menu are simply phenomenal! Cant wait to go back here when we visit again!"
/user_details?userid=2YX9RsELgz4DAzYCmn6vrw,Marianne K.,"Fountain Valley, CA",5 star rating,"We have had dinner here twice on our week long stay in Montreal. The lobster linguini was outstanding,as was the ravioli. Also the classic spaghetti and meatballs is zesty and yummy. Have a small slice of bread with a large helping of their special butter but be careful not to over eat. Salad bar is an eclectic blend of tastes. Be careful here too, easy to over do it with the delicious variety. I tried everything in the salad bar (small bites) but not lettuce with dressing. All was outstanding. Desert: if they have strawberry shortcake get it. It's not the American-traditional style it's WAY better. This cake (and it is a cake) is why we came back a second time but jeez the meals are wonderful!  I will tell everyone I know coming to Montreal to get lunch or dinner here!!!  Wine selection was above average. I went with the suggested wine (both evenings) and it was superb with my meal. Enjoy!!!  By the way. The servers are super nice and helpful!!!!!!!"
/user_details?userid=SEhFT1ehLkiaysiDEUT3kA,John O.,"Stow, MA",4 star rating,"This will sound overblown but the best spaghetti and meatballs I've ever had (sorry Mom). My wife had the lasagna and was equally pleased. The bread was good but not warm, which was a bit of a disappointment. Table seating was comfortable although the table next to us was extremely loud, fortunately they left shortly after we were seated.Service was friendly and quick. I'd definitely go back in a heartbeat."
/user_details?userid=_2fbm1twxz7SnlT-0LRq6g,Erin D.,"Washington, DC",4 star rating,"Solo-traveling for the first time, eating alone here was actually a great experience. They give fresh bread with homemade garlic butter and there is a salad bar included with your meal. The service was very nice and accommodating as well. I ordered the Spaghetti Saint-Paul, which was just basic spaghetti with tomato sauce. They used angel hair pasta which I was super happy about because it's my favorite! The sauce was really spicy, I'm not sure why, but it still tasted good, especially if you like spicy food. At least the bread is there on the side to comfort your taste buds. For sure a quick, easy restaurant with good food with stop in on Rue Saint-Paul after a long day."
/user_details?userid=MGS4xcClMRZ2SYlmWdv5WQ,Genevieve M.,"Montreal, Canada",4 star rating,I enjoy my meal every time I go!! Pasta is delicious!! Very unique variety of entrees and dishes. Yummy!! If I'm in the old port and feeling pasta that's the place to go!!!
/user_details?userid=KGYVQ5DwN1KEkoZOmVnL5Q,Tanner M.,"Brooklyn, NY",5 star rating,The neighborhood is so beautiful and the decor inside is really detailed. Lot's of seating and when I went it was not crazy busy. Steak & spaghetti was so good.
/user_details?userid=tCC0EUoGnvSHxQhoWoxo1Q,Keith A.,"Beverly Hills, CA",5 star rating,"Just happened upon this restaurant and from the inside looks i expected an average meal.  This place was astounding in fact! I've had Italian all over the world and this place is right up there now in my top 3 which are La Forketta in Singapore and the no longer open Gionetti's in Oakbrook Hills Chicago USA.  I could go on forever about the bread, the starters, the pasta sauce and the meatballs but you really need to experience this for yourself."
/user_details?userid=7VvxCDLau8g8ynrQTU8VHg,Lynn R.,"San Marcos, TX",4 star rating,"Solid experience, perfect meal before continuing our trek through the brisk air back to our hotel. The place has a warm vibe, with a good balance of local flair and welcoming ambiance. The food was all good, with only minor improvements that could be made. All the entrées come with unlimited salad bar and bread. The salad bar is quite small, but it's all incredibly fresh. As for the main course, we had Le Golden Square Mile and Les Éclusiers. Bot were good, but LGSM was really good. It had the most delicious goat cheese I think I've ever had. The raviolis were melt-in-your-mouth delicious. Les Éclusiers did not suck either, with a well-rounded heat to it. The shrimp were a good size, and well cooked. The flavor and freshness were fine.  All in all, we liked the food, the portions were perfect, the service was good, and the atmosphere was lovely. We'd go again. Next time, we'd leave room for the rather handsome desserts!"
/user_details?userid=PiIHHg8F3Td7J2tz3wWXZQ,Kate O.,"Randolph, NJ",4 star rating,"what a great find in old port. tons of pasta choices to choose from and great specials. reasonable wine list. our good was great and our server was very pleasant and didn't rush us. we opted for caesar salads over the salad bar, just personal preference, I regret not even checking it out...i had the lobster linguine which was full of lobster chunks and a light cream sauce, hubby had the veal saltimbica, crisp and light not cheesy. delicious."
/user_details?userid=kZ3SR6HaVtJKAqnEPVONQg,Vishwas G.,"Brampton, Canada",1 star rating,"A racist restaurant with unhygienic food and terrible customer service forcing us to tip. I went there with my friends. We were asked to wait as there was no table available. But a group of 6  people speaking french came and they were seated way before us. Moving on , my friend had a disgusting piece of mud in his salad. When we complained wbout it the waitress took the plate away and told her she will be right back, but she never came back. We could see her talking to the mamager, they both looked at us and no one came to apologize. After a few minutes another waitress came and said she won't charge us for that dish. But she forced us to tip her and told her that it is the law in Montreal to tip. Instead of being apologetic, she was arrogant and disrespectful towards us. It completely ruined our trip. I would suggest don't go there, there are other great places to eat in Montreal. It left a bad impression in our minds about Montreal."
/user_details?userid=7JVPBzoG7inrDaKt5_KrVA,Gary M.,"Indianapolis, IN",3 star rating,Food atmosphere great; however waiters picked up plates and bottles with out asking .Rushing my enjoyable meal. Rush rush
/user_details?userid=smgOzQtIThYAr2q_53oXIg,Luc M.,"Surrey, Canada",4 star rating,Came on a Monday night and enjoyed some great food. The salad bar is a nice touch while you wait for your entrée to arrive.  The service was friendly however they seemed to be a touch under staff thus the 4 stars instead of 5.
/user_details?userid=NgfpyYvMM7Zn8qKnkeZVqg,Vishal M.,"Montreal, Canada",1 star rating,"Horendous Service! !!  We sat in the restaurant at our table for over 40 minutes waiting to place our order. Despite asking numerous times if she could take our order,  she chose to clean the empty tables instead. Once we realized that we wouldn't be getting service anytime soon,  we politely told her that we will be leaving and even left some money for the bread we ate, at the bare minimum I was expecting an excuse or even an apology  but all we got was an ""okay""  its ashame because the atmosphere seems nice and full of rich history"
/user_details?userid=eu7CM4w89mbADwjMBzEBYw,Ray G.,"Las Vegas, NV",4 star rating,"Though looking through other reviews on this place, I thought the service was pretty friendly! The only reason for the 4 star rating is the food was mostly really good, the wine was excellent, but it was just kind of the sauce that was a little lacking. Not super expensive either for being in Old Port, but beware it isn't a cheap meal either. Mostly a positive experience, only issue was I felt the waiter didn't come around enough to bring water or whatever I was in need of (the water glasses are pretty small, and dishes are usually pretty hot) but they were pleasant about it and have me a whole pitcher of water! Overall about a 9 out of 10 experience!"
/user_details?userid=HmjVSaduS2DLRVSxqrPf5Q,Jack S.,"Scottsdale, AZ",4 star rating,Really enjoyable Italian dishes in a great setting in Old Montreal.  The prices were reasonable for the food as well as the wine.  Very friendly staff.
/user_details?userid=ITZU9bz9CY_laMqK4hZrvA,Randy S.,"Hartville, OH",4 star rating,"I thought it was cool that Charles Dickens wrote some of his notes here for A Tale of Two Cities.  It's in a very touristy part of town which might be why it tends to be a little pricey.  I thought the atmosphere was quaint and comfy.  We came in around 2:30 in the afternoon so very few people were in there.  Service was pretty good.To start, you get free bread and garlic butter.  Then, we got free salad bar with the meal.  We did not have a ton of options at the salad bar, but they were a unique selection for someone coming from Ohio.  They also had potato salad and I always love a good potato salad.  I ordered the tortellini ($14) and my wife ordered the spaghetti ($12).  These were probably the cheapest items on the menu.  The tortellini was covered in cheese and it was exactly what I was hoping for.  Italian food is not my top choice usually so I was quite happy with what I had.  My wife really enjoyed her spaghetti especially the spicy sauce.  I thought the portions were pretty good.  After having bread, potato salad, and pasta, I was quite full and satisfied.  My wife thought I should give this place 5 stars but the price is keeping me from going above 4 stars."
/user_details?userid=jDwT1ekJS0UcEGfGHaWeCg,Adina S.,"Thornhill, Canada",5 star rating,"Very quaint, cozy and rustic italian restaurant.  The food was very good, the portions very good.  They have a kids menu, so is a family friendly space.  Dinner comes with a salad bar and lovely dinner rolls and fresh butter with herbs.  There is a wine room on site so plenty of choices there.  There are many choices on the menu to satisfy the italian craving in you.  The service was very good.  If your looking for a nice place to unwind and have a good italian meal, this is the space."
/user_details?userid=ghd1vAZzQ7FzvEo02dIzpA,Martin P.,"Carlsbad, CA",2 star rating,"The place was nice and comfortable, prices were very reasonable. Unfortunately, I found the lasagna was pretty terrible. Everyone else at the table enjoyed their food."
/user_details?userid=Xjia-GO0JKjWVaT6ORUiZg,Maria P.,"Boca Raton, FL",4 star rating,We were starving after walking old Montreal for hours under the freezing weather so we really wanted to sit down and eat! This place was perfect because they have the all you can eat salads and bread while we wait for the main course...My pesto pasta wasn't the best but it was ok.
/user_details?userid=QcEbJjEFDgmvK-sCxpN55g,Kristy S.,"FOREST HILLS, NY",5 star rating,"We had a wonderful lunch here. Judith was our waitress and she was so warm and lovely. She made excellent recommendations. We had the spaghetti with lobster, today's special, and spaghetti with meatballs. Both were delicious! Great great meatballs (tasty, and very tender...meaty) and so much lobster! Nice wine as well. Desserts looked great but we were too full. An all you can eat salad bar is included with the main dishes. It was delicious! Meticulously prepared salads and dressings. A wonderful feature of this restaurant! We had potato salad, beet salad, pasta salad, Israeli couscous, crisp lettuce, and homemade coleslaw. I almost forgot! They have a Wonderful warm bread basket!!! With herbed butter. Lovely and very quaint decor...from the stone wine cellar in the main dining room, to the antique phone operators switchboard by the bathrooms. Eclectic and interesting! A great place anywhere...a standout in this touristy neighborhood."
/user_details?userid=61PBS6o6PxMpFGR9PGiIHw,Simone C.,"Newton, MA",2 star rating,"I have been here before and enjoy the food, but the service at this restaurant was appalling. The waitress was curt and rude and rushed us out of the restaurant. Other staff members took our plates too soon and kicked us out of the place immediately after paying our bill. I am generally an easy customer and a good tipper, but this was unacceptable as a paying patron at this restaurant."
/user_details?userid=6FYRza9vSd7rROqVTDdY8A,Andrew F.,"Boston, MA",5 star rating,We just happened to pop into the restaurant while we were touring Olde Montreal.  We did it based on the menu and the crowd inside.  We were glad that we did as the food was good.  And our servers were great. Great value for the money.
/user_details?userid=wNtRrYCn5F5A6kFcs-gqGw,Roderick L.,"New York, NY",4 star rating,A gem in old port Montreal. Lunch comes with a salad bar and amazing garlic butter. Mushroom penne is so good that I wonder how they cook it out of such simple ingredients. Price is reasonable for this touristy area. Service is alright but definitely great value for a yummy meal!
/user_details?userid=a3gKHarQcY61pZ9B6Ob5fg,Tanya G.,"Nashville, TN",4 star rating,"I give this little gem a solid 4 stars. They offer a great lunch special with a soup and salad bar included with your main. I had the braised beef ravioli that was very good. I will definitely come here again. Great cozy atmosphere, very good food and reasonable prices. What's not to love?"
/user_details?userid=k42GMSp6bPe-X4S0zUW_iQ,Oscar P.,"Milford, CT",5 star rating,Best Italian food I've ever had so far. Delicious meat ravioli. Lamb chops and pesto spaghetti was amazing as well. They have a good wine selection too.
/user_details?userid=sFJjEc7ytSUV28Y7PpdMjQ,Mathieu B.,"Montreal, Canada",3 star rating,"For lazy readers: Food: 6.8/10Service: 6.5/10Decoration: 7.5/10General comment: crowdy, good for kids, established since a long time, cheap for a Old Port Restaurant.Review:I went there with my pal and his friend on summer at a very touristic time of the year. On the marvelous St-Paul. E St. This must be one of the best deal and it as established a solid reputation. Set on 2 floors, the concept is pretty simple : Free Bread (with butter or Garlic Butter) and Salad Buffet with approx. 10-12 choices which is pretty decent. The menu has approx. 50 choices of fresh pasta. You will pay approx. 20-25$ dollars for the whole thing. When we were there it was really crowdy and we were on the second floor, near the kitchen. Normally I would be annoyed but the very same place, Charles Dickinson was there when he wrote his Christmas Novel. I don't think I would go back there because I'm rarely amazed by pasta restaurant. What makes me come back to a restaurant is based on: Could I do this at home without being annoyed and if the answer is: NO well i might come back. However the quality of the food is good, and the service rushed but not pushy."
/user_details?userid=nuEnKgmx3Z11wQP3AuyKVw,Jean-Pierre L.,"Oakville, Canada",4 star rating,"Spaghetti st-Paul was a simple and well executed dish. Nice selection of beers, service was friendly. Oh and it's open in-between the hours of 230pm and 5pm unlike other places."
/user_details?userid=uIB8qFzG5E3PUGfiCiUmqg,Steve K.,"Flower Mound, TX",2 star rating,"L'usine's quaint old building is cool and interesting, comfortable but with a cramped feeling at the same time. The bar is fairly limited, with a few decent beer and wine choices, and the salad bar is good... But I wasn't all that impressed with the ""Italian"" food, particularly the tomato sauce. Also, our server was distracted and a little too pre-occupied with what I assume is her beau, who was seated at the barMaybe I'm spoiled with all the great Italian food I've had over the years, but my entree here was uninspired and a bit bland. Mama Francesca's home cooking it is not"
/user_details?userid=-HMryuf0scfllObkYFF0hg,Vanessa M.,"Vancouver, Canada",2 star rating,"I visited this restaurant along with 2 friends, who, I must mention, LOVED their meals. However, I would be lying if I said that I thought that the meal I ate was delicious, or incredibly well seasoned. I had the opportunity to taste their plate of Tortellini au Gratin, which was not bad, though comparable to what I could have prepared at home with a package of Olivieri Tortellini and some commercial sauce. And honestly, how sad is it to eat a meal in a restaurant that you could have easily prepared at home for far less expensive, and with more expertise? Don't get me wrong, there is nothing wrong with packaged pasta - It can even be a life saver when you are short on time. The real problem with the meal that I ordered? 1 word. Overcooked. If you are going to use some commercial pasta in your kitchen, you should at least have the decency to serve it Al Dente. At least that's my take on it. On a brighter note, I should mention, again, that both of my friends really enjoyed their meals! I guess that this restaurant fails at pleasing some people, but succeeds at charming others."
/user_details?userid=fjsqXrTbkbfPSkzVztmYAQ,Carol R.,"Verbank, NY",3 star rating,"I want to give three and a half stars. Food was okay nice salad bar wonderful service. Comfortable very cute place for a family meal in old Montreal . The sauce had a spicy tang to it that I didn't like. Bathrooms were an adventure couldn't fit in one stall and I'm not big, other stall the toilet moved when you sat on it."
/user_details?userid=9W_LHR59vqFE6jr7raR0vA,Fn A.,"Nevada City, CA",4 star rating,"Lovely Italian restaurant in Vieux Montreal, different and yummy salad bar, good rolls and average pasta dishes. Meatballs disappointing but still a decent value for Montreal. Efficient service by Fanny who was charming and dressed for Halloween. Wine was average but there are no deals on wine in Canada. Overall a lovely fall evening for us."
/user_details?userid=Ryz4y3lecA9Z5EHNCCgJKg,Ryan B.,"Toronto, Canada",4 star rating,Very affordable spot in Old Montreal - other places nearby I found to be very over-priced. There's a great selection of pasta dishes and a delicious salad bar is also included in the price. Even the bread and garlic butter brought to the table was very tasty! I had a traditional spaghetti dish and it was very filling!
/user_details?userid=a1i3ou799Ic-_kODPN-Gng,Rachel G.,"Pittsford, NY",5 star rating,"I never clean my plate but here I did ! Wonderful atmosphere, delicious food, not overly expensive. Salad 'bar' was a nice & unexpected touch. Perfect dinner in Old Montreal"
/user_details?userid=Ffar8yC7iyUroscbI3ALvw,Shana B.,"Albany, NY",2 star rating,"Not so good.  My family and I were very excited to eat here.  However,  the service was less than average and so was the food.  My son who only eats alfredo sauce had to get the gigantic adult portion because they were not flexible enough to make a kid's portion.  I offered to pay the normal upcharge, but ended paying $22 for the 10 bites he nibbled on because they added scallions on top, which I clearly stated in both French and English, no spices.  My chicken parm was dry like the desert and I am still suffering from heart burn a day later from the sauce.  My daughter ate one bite of her spaghetti with meat sauce.  My husband did like his steak, although we all ate some so he left hungry.  We did not bother with dessert, as it is stored on these low to floor case. Kinda yucky way to present desserts.  Oh, by the way,  the salad bar sucks - to be blunt.  Did not take one item.  Waste of $$$$"
/user_details?userid=K_H2SLOudDpujs2cTgPRzg,Joshua K.,"Ottawa, Canada",3 star rating,"Decent food and service, can't complain.  This place is American-style Italian food, both on selection and portion size.  A bit on the pricey side ($15-25 for lunch); right next to Jacques Cartier Square this is more of a tourist spot than anything else.  Overall, good food and unobjectionable for entertaining groups."
/user_details?userid=Sz-FsPuWlDhuJsdORjWADQ,Paul S.,"New York, NY",2 star rating,"So, I am conflicted here as I was taken here by some co-workers of mine who live in Montreal and the service was absolutely top-notch and the place itself was very nicely appointed and comfortable.  The issue is that none of that fills my belly and being a NY who loves his Italian, I have to weight the food heavier than the rest.  The appetizers were decent with the shrimp being the best.  The duck was a little salty.  Their sauce is meaty as one reviewer pointed out but it is way too sweet and had a pasty consistency when I dined there.  This is not how sauce or ""gravy"" is supposed to taste or at least what I am accustomed to.  Again, the menu, drinks, service, and the company were all fantastic and some portions of the meal were very good.  I just had an issue with the sauce and for me this is a core component of my Italian food experience."
/user_details?userid=lwydcZ-3V4bjK-95LbbKIQ,BonnieNClyde z.,"New Brunswick, NJ",2 star rating,Wandered in Old Montreal and ended up here by chance.  Meat was fatty and spaghetti overcooked.
