user_url,user_name,user_city,user_rating,user_review
/user_details?userid=yACLb6lUDPjw0g5JrNwXMg,Kyle S.,"Atlanta, GA",4 star rating,"Ended up here after searching for hours on where to get decent Italian in Montreal. Was not disappointed.Ordered the classic spaghetti with meat sauce and it really hit home for me. The bread was also very delicious. Unfortunately I didn't take any pics of my food like a good Yelper is supposed to, but I will definitely be back to this place!Very charming place too, with old fashioned decor. I believe they have a salad bar as well that was free with a pasta dinner. (Though my memory may be incorrect)"
/user_details?userid=D0Caw5JJXmQQ5luhH7ZvxQ,Carolyn B.,"Cincinnati, OH",5 star rating,"We went here for lunch. I ordered the linguini with lobster and it was very tasty.  However, my daughter had hands down the best dish at our table  risotto with chicken and mushrooms. Just one taste made you want to beg for more!!   Three of us ordered sangria which was very refreshing.  It made me think of Summer.   After lunch, my hubby had an espresso while I enjoyed a cafe au lait decaf. Unfortunately my daughter's dish was just a special of the day, so they don't always have it. She even sent her compliments back to the chef.    Our waiter was very helpful, funny and kind.  We would definitely go back there when we visit Montreal again."
/user_details?userid=FJL0x-PVW9u6WGE1iZe3Bg,Ravi C.,"Jersey City, NJ",4 star rating,"Great little place near Bon Secours marketplace in old Montreal.  Our concern was that they would not have egg free pasta (dt allergies), but they did!The hostess and waitress was extremely helpful.  They even have a salad bar as part of their restaurant with each order.  This was also very good.Cool ambiance and good food.  If you find yourself in this touristy area this is a great place to stop and grab a bite"
/user_details?userid=5HiO4RFBVtAc7EY6w2mmRg,Vanessa V.,"Côte Saint-Luc, Canada",4 star rating,very beautiful restaurant in the heart of the old port! the portions are generous and the food was good! prices are reasonable. the only thing is that the pasta i took (prosciutto with blue cheese) didn't really have prosciutto and blue cheese. the sauce was milky (not cheesy) and i had maybe to tiny pieces of prosciutto.
/user_details?userid=KyF8TsD-5g1IHKwQRNW_DQ,Briana S.,"Maitland, FL",4 star rating,Amazing selection of comfort food. I ordered a dish with lobster and cream. It was to die for! You also get to start with the salad bar and they offer and excellent selection of wines.
/user_details?userid=RVuGMBDgPegZ7ANlPF2dOQ,Angela G.,"Toronto, Canada",3 star rating,"This spot is great for families, it kinda reminded me of an Olive Garden but with better food. Service was okay, and considering the restaurant was empty for a Friday night - they did'nt need to stick us in the back of the place. The food was all very average, my favorite was probably the pasta with shrimp. Everything else was kinda meh. I probably wouldn't come back here considering Montreal has amazing options. Keep Eating, Angela"
/user_details?userid=CEaeGGAZBvWeCDgn_2o-9A,Princy A.,"Albany, NY",4 star rating,The duck confit is spectacular. The pasta accompanied with this dish is extremely boring. I suggest asking for a substitution with another pasta dish.
/user_details?userid=l9fGOqjEQDEN10Pog3cMng,Xena W.,"Montreal, Canada",5 star rating,"Nice restaurant in Montreal's Old Port. Prices are reasonable : main dishes (all containing some form of pasta) range from 12$ to 29$, the most expensive being the lobster linguini. Meals come with free bread and all-you-can-eat salad bar. Service is prompt and friendly. They don't have a terrace and the interior is quite dark, but it is tastefully decorated and has a quaint historical feel to it."
/user_details?userid=a9UOQC0UT1aAv_KVUgl8tA,Aakrati K.,"Redmond, WA",4 star rating,"Everything was fresh and made to order except the tomato sauce, ofcourse. I ordered a red wine sangria, which was fantastic and refreshing, and goat cheese and sundried tomato ravioli and it was very good as well except the sauce which was too tart for my taste. Liked the ambiance and really friendly staff which helped me decide my order as a vegetarian :)"
/user_details?userid=XiO8gDumFlFuxP2I4tMJ2A,R G.,"Mission, San Francisco, CA",4 star rating,"Oh yeah... yumm!   We were on a mission for lobster... Walked over from Rue de Catherine- quick, cute easy stroll to the port. And without reservation (not sure they take them), walked in and got seated right away.  Hostess was cool, sweet, and super efficient.  Everything on the menu looked good- true to mission- ordered the  lobster with pesto spaghetti- Very tasty.  Meal and includes salad bar!  The execution on the food was not a luscious 5 star meal , but the overall experience was a strong 4.  Wine selection was sufficient.  Service was casual but professional , food was solid.   Felt like a super great deal."
/user_details?userid=ai6Sb1iGQqJNh0w_Zo49Rg,Amy L.,"Toronto, Canada",4 star rating,"Was strolling through Old Montreal and had a sudden craving for pasta so we decided to try this place. I got the lobster linguine while my boyfriend got the lamb chop spaghetti. First of all, the portions here were huge! The linguine was delicious and had a good amount of lobster in it. However, I found it a bit strange that they used peas in this dish and would have preferred spinach or onions. It just tasted a little off. My boyfriend said he enjoyed the lamb pasta as well. The salad bar was quite simple but fresh. Service was also great. Would recommend if you're looking for quick service and yummy pasta."
/user_details?userid=g9MYC0QTNPPmbIdrtdan9A,Foodie M.,"Toronto, Canada",5 star rating,"Such delicious simple pasta for such an affordable price with all you can eat salad bar and bread with garlic butter!!! Super Fancy French food is good and all but I have to say nothing beats a plate of perfectly made spaghetti! I had the white sangria which was absolutely delicious - you could definitely tell that the wine was marinated with the fruits for a good amount of time before being served.One thing to note is that extra melted/baked mozzarella cheese on the dish is an extra $4 which we weren't aware of, but I would highly recommend it as it was so good. Couldn't have asked for a more satisfying meal!! :D"
/user_details?userid=-fvoES_EA1-6hAQqWpphmw,Wesley S.,"Philadelphia, PA",5 star rating,What can I say about this place that hasn't already been said.  It's amazing! Definitely on my list of place to hit again when I come back.  The pasta and chicken was delicious!  The salad bar was so fresh and really felt like something your grandma would make and set out on the table before dinner.  The prices are really fair for what you get.  We beat the rush and had a cute little table in the corner. Definitely bookmark this place and check them out!
/user_details?userid=hV7RsFEacHd3fFqY2X70eQ,Meenah T.,"New York, NY",5 star rating,"I really really wanted shrimp & pasta, and though it wasn't on the menu the server helped me combine two dishes to create my own, which was lovely! I wish they'd addmore seafood options (can't have meat due to halal restrictions) or add a halal option - that would be awesome. Overall a great place! We got cheesy garlic bread, shrimp (15 pieces of shrimp) and my huge dish of pasta all for 31$. All you can eat salad bar plus bread&butter to start with. The two of us were pretty full!"
/user_details?userid=dZT5pdhP-xMZ0Q7YfNBuLg,Nicholas D.,"Dallas, TX",5 star rating,"This restaurant had been recommended by a friend and it sure did not disappoint! It was the perfect place to enjoy a great meal in the charming Old Montreal area. The space is very quaint with stone walls, wood floors, and dim lighting. The staff was friendly but they seemed extremely busy and maybe short handed. There was a line waiting to get in, which did not end up taking too long. No one was really taking names or anything which was a bit confusing. The waitress was prompt, friendly, and accurate which was appreciated. Our French was very rusty and she was more than happy to speak English to us. While you wait for you food, they bring a nice bread basket with a garlic butter side. A salad bar is included with most meals, but the choices are pretty limited. Keep that in mind if you are wanting more of a substantial salad. I ordered a vegetarian spaghetti dish that was absolutely yummy. My travel companion had an eggplant dish that he thought was delicious. The house red wine was great and a good value as well. The entire meal was very affordable considering the area. I can't speak for how the desserts tasted, but they looked amazing. All in all, if you are looking for a cute and cozy place for some Italian food in Old Montreal, I would suggest you check this place out. It is not pretentious or flashy, just a great place to enjoy a good meal and unwind.  bon appétit"
/user_details?userid=Iprn7raIGsZnMXFymmruFw,Janet F.,"Edmonton, Canada",4 star rating,"While walking through Old Montreal with some locals, they suggested this restaurant. It definitely lived up to expectations! The menu is quite large and offers a broad range of different pastas and sauces. According to our waitress, the recipes have stayed the same for a long time, which speaks to the longevity of this restaurant in the Old Montreal area.Upon finally deciding what I'd eat (I went with the classic spaghetti with meat sauce, as they call it, the ""Spaghetti St-Leonard"") which cost $14. All the menu prices seemed very reasonable, especially considering that all menu items come with salad bar and bread included. The bread comes out warm and fresh, and is served with a delicious garlic butter, made in house, as well as conventional butter. The salad bar isn't huge, but it has a good range of different salads that include leafy greens, pasta or potato salads, and other marinated salads and cut-up vegetables. The dressings are very tasty, and there is a vinaigrette that is a real stand-out. The quality of the main course was also great. The pasta was cooked just perfectly (not too hard and not too soft), and the sauce was flavourful and satisfying. The portion size was also surprisingly large, so I wouldn't think anyone would leave hungry.As an interesting side note, the menu items are all named after places and figures from the local area, so those new to the area or just visiting can find some names to google while they wait for their meal (the menus are left behind as placemats).Also, the decor in this place is really nice and rustic, which suits the Old Montreal charm perfectly. This place is definitely worth a try."
/user_details?userid=5CbfKqyOSe63xH6CJL9sSA,Maxine R.,"Manhattan, New York, NY",5 star rating,"The four of us stopped here after a walking tour of Montreal and were all very hungry. We were definitely not disappointed! The servers were polite and attentive and the atmosphere was cozy and casual. I ordered the chicken parm with added mixed vegetables and thought it was delicious! My family also ordered pasta dishes and said they were satisfying and yummy. Before our meals arrived, the server told us we could stop by the salad bar. The salad bar was clean, and had healthy and yummy options. we were also given fresh bread with garlic butter and regular butter. The garlic butter was literally to die for!!"
/user_details?userid=PlOqytFARLVkJ3SH2QChNA,Lai P.,"Chicago, IL",3 star rating,The bad:Won't allow seating until the entire party is here. Lobster linguine has no flavor and I had to add lots of salt and pepper.The salad bar is very basic and disappointing. Sangria has very little flavor.Escargot is so-soThe good:duck is a bit sweet and very tender. I like the joyous Atmosphere and interior decor.
/user_details?userid=in0aLEL8gC5MwNywqyrdUQ,Eve W.,"North London, London, Canada",5 star rating,"I adore this location. It's perfectly situated in Vieux-Montréal and cures any pasta craving you may have. I ordered a white sangria to drink, the Golden Square Mile pasta, followed by the Tiramisu for dessert. All fantastic, highly recommend. Upon entering this location you will be politely greeted and showed to your table where the server will explain that you can order wine and pour yourself a glass located at the salad bar, and you can also help yourself to the salads (buffet style), then you are brought a basket of breads directly to the table to enjoy. None of which we were expecting but nonetheless was a pleasant surprise.Our server was polite but a bit quiet, we believe she was dealing with an agitated customer right next to us so her demeanour may have been lacking. Overall, great place for families and couples. Amazing wine selection and the food is outstanding."
/user_details?userid=IKSmm5MzHF8cMhMolKaIOw,Lorenzo L.,"Mississauga, Canada",4 star rating,"So what to do for dinner in our first night in a new city...We were in the mood for Italian while in Montreal. This restaurant was relatively close to our hotel so we decided to walk there. Unfortunately for us, the city was under an extreme cold alert, so the 20 minute walk became an exercise in survival. Thankfully, once we were there, we quickly forgot about the cold. We were promptly seated and the restaurant was fairly busy so we were glad to have a table right away. Place is a little quaint and has a nice European decor. It's located in the Old Montreal area. They bring you a complementary bread with an amazing garlic butter along with the AYCE salad bar. We quickly decided to go with the Cheese Garlic bread for an appetizer. We went with Spaghetti St-Paul (spicy tomato sauce), Rigatoni with meat sauce, smoked meat and mozzarella and Spaghetti with meat sauce and meatballs.The service was attentive and prompt as we were never out of water. Portions size were decent and all 3 dishes were flavourful. We were glad that we braved the weather to be here. Recommended."
/user_details?userid=0vIwQebNKMZUobede4gxyg,Roberta W.,"Bridgman, MI",5 star rating,"Cozy atmosphere, clean, great service,  excellent spaghetti, large plates with salad bar included. Good value for the main tourist area. Wish we would have eaten here again instead of trying the close-by poutine restaurant the next day, which was awful.I had the spaghetti St. Paul, which was the perfect level of spice with mushrooms added.  If you like mushrooms,  I highly recommend adding them to your pasta dish."
/user_details?userid=ysPY2UiBzI1qHmCKcre9Dw,Bilal Z.,"Seymour, CT",5 star rating,Best Spaghetti place in old Montréal. Good service and delicious food. Atmosphere was nice too
/user_details?userid=2gLhzkyZNnfbOfJmkdw_8Q,Dipak K.,"Plainsboro, NJ",2 star rating,Were looking for a restaurant that had decent choice of pasta right before we go to see the fireworks. Roamed around a few blocks around old Montreal and finally settled on this place just because they stated they make their own pasta and had a variety of choices plus the place was almost full We ordered a bruschetta and a dish of spaghetti with vegetables. Food - portion are pretty big for Canadian standard but taste was ok. Nothing that was anything to remember. Service - waitress was friendly and accommodating to our vegetarian optionsAmbience - simple 2 floor buildingWas a little disappointed in taste as I was expecting more from fresh pasta and sauce.
/user_details?userid=rW89FKQNGwCNMoH_GJZPeg,Eric V.,"Washington, DC",4 star rating,"Took the family here on a beautiful spring evening for dinner. The atmosphere was warm and welcoming. Servers were very polite, and were great with our children. I quote my 10-yr old: ""OMG! This is the BEST TORTELLINI EVER!!!!!!!""I had Les 100 Cloches, which was delicious and tender. Everyone enjoyed themselves, and we were very pleased with our choice for dinner!"
/user_details?userid=o7TsB8hQuhR_ShQE8RYUXQ,Howard W.,"Winooski, VT",5 star rating,"Fantastic place. Coming here for years never fails to deliver great meals, service at a very good price. Located in Old Montreal. Don't miss it."
/user_details?userid=kLGSZ65IRaLsf5zQD9KJeA,Sharon B.,"North Bellmore, NY",4 star rating,"Everything was excellent. Had the chicken Parmesan with spaghetti, and escargot. Lovely atmosphere"
/user_details?userid=wAl8QDvF38N1R0gO-nKPMg,Brad W.,"Toronto, Canada",5 star rating,"The pasta here is simple and elegant, making the basics to the perfection. The price is very reasonable for the quality of food you will be getting.Service is fast and excellent thanks to their friendly staff and of course the attentive chefs and cooks in the kitchen.Highly recommend for those just want some spaghetti gastronomy."
/user_details?userid=iU-67Fnxr0ikH7aezeT2rQ,David F.,"Evanston, IL",5 star rating,"Very welcoming, about a 5 minute wait to be seated. The decor is rustic but tasteful. Our waitress took us to the back room which has a story  of its own. Charles dickens wrote the notes for a tale of two cities in this room. The waitress was very polite and was able to switch between French and English very easily.  We ordered and our food came within 20 minutes, the people in my group ordered - #1 Le Golden Square Mile, #2 Le Bonaventure,  #3 Raviolis Le Windsor, #14 Spaghetti Place - D'Armes, #20 Le Jean talon.All of them where very good and we all rated our dishes a 10/10. They had a complementary salad bar and it was very fresh. Over all an amazing meal, would definitely come back!"
/user_details?userid=nHjRBSbzPeqdq5_D3AirEg,Patricia C.,"Hampstead, Canada",3 star rating,"I had heard many good things about this place and so I was looking forward to trying it for myself.  We went on a Friday night and while there was a bit of a lineup, we didnt wait too long to be seated. Service was friendly and quick but the location itself was a little dark and a little cramped. The prices are very very affordable and the quantity you get is very generous , you also get bread with garlic butter on the side and access to the unlimited salad bar with the purchase of any main meal which is a nice touch. The salad bar is okay, it has a few different options but nothing really standout.  we had the braised lamb with herbed pasta which was pretty good when you mix the sauce from the lamb with the pasta, it had nice flavour , although the lamb wasnt as moist as you would expect it to be even though it is braised. We also had the salmon pasta which actually had zero flavour , it almost tasted like KD with a little flavourless salmon inside. We had to add alot of salt and alot of parm in order to give it some sort of taste.  The house red wine was really cheap and actually very good so no complaints there. This seemed like a very family friendly place and a good idea for a casual inexpensive dinner. Not my favourite pasta place in Montreal but it wasnt a bad experience either, so I wouldnt discourage anyone for trying it out for themselves !"
/user_details?userid=cF1oFZ2cl1xpQIsq-yA4mQ,Aretha C.,"Montreal, Canada",4 star rating,"A nice spot to have dinner at old port, reasonably priced for the location and homely meals.The atmosphere is cozy and the service is pretty relaxed so you can enjoy yourself. Apparently this place has been around for a VERY long time, so kudos for them!Their menu is mostly pasta based, I got the stuffed manicotti and spaghetti bolognese duo. (the entrees are all named after montreal streets or areas, mine was st.denis something) Pasta was really good, cooked just right. Nothing too fancy and just hits the spot. They have a serve yourself salad bar, with about 6 different salads. The salads weren't particularly appealing but hey, eat your veggies right? They also start you off with rolls served with garlic butter. The rolls were okay but wow that garlic butter! My boyfriend nearly finished off the whole thing. Worth a try if you're looking for a place to eat in old montreal. side story: we spoke to another diner who just exited the restaurant and took a photo of the storefront. Turns out he sailed for 4 months from the Netherlands, making stops along the shore at every city he passed. He said the lobster linguine was good!"
/user_details?userid=o5ZjdtNfCmuky2SGoddExg,J W.,"Toronto, Canada",4 star rating,"We had to wait 25 minutes in line for a table, it was worth it.Ambient lighting, an excellent all you can eat salad bar.They have a nice wine bottle list.Devine lamb shank braised in red wine that just fell apart and the fettuccine was to die for, nice seasoning and doneness. I will come again."
/user_details?userid=Db449GeMh8Tm9aWn6u5ZgA,Zumer K.,"Alpharetta, GA",3 star rating,This place was recommended by a local while walking on the street. The dishes were all well cooked nothing burnt. All though the bread was cold.  Left the seafood place across the street. Server was extremely rude. Had a very stinky attitude.
/user_details?userid=ax9skkXMzTJ1rSj2yTakoQ,Ryli W.,"Birmingham, AL",4 star rating,"I would give this a 3.5 if I could - 4 for food, 3 for service. The restaurant is cute, and the meals were very good. Bread and garlic butter were provided, which was a nice little touch. I got the eggplant and my husband got a pesto dish with lamb. Both were delicious! I wish we would've stopped after the meals because I probably would've given this a solid 4, maybe considered even higher, but we decided to stay for dessert. I got the tiramisu, and was disappointed. It wasn't bad, but was lacking on the coffee flavor and really just tasted more like vanilla cake with whipped cream. It was a very light, nice vanilla cake, but not what I was looking forward to in a tiramisu. We also had to wait a very long time (15-20 mins) after we had clearly finished dessert before the waitress brought our check and we could leave. It got a little busier and there was only one waitress, so we were patient, but it was a very long wait with no water refills or anything while she passed us multiple times. This might have been overlooked if she was a great waitress to begin with, but even before this, the service was only okay so it was a little bit annoying. Again, I understood she was busy, but we saw tables order and get their food between the time she brought us the check and came back by to run the card.Overall, the food was good and is why I gave this a 4 star review. Not a fancy place, but a very nice dinner. The service is good when the restaurant is very slow, but could get frustrating during busier dinner hours."
/user_details?userid=FYtcz_NOxlK6TenQWUwfaQ,Sam V.,"Fair Lawn, NJ",5 star rating,"We couldn't be any happier. We had to wait for a good 40 minutes before we could be seated, but it was definitely worth it. The staff are super friendly and very efficient. The portion sizes are generous. The food was evidently fresh. Highly recommended. Thank me later!"
/user_details?userid=e_CN9aEGbI3HezrLu0q5qA,Ken N.,"Strasburg, PA",4 star rating,"Pasta definitely tastes fresh, garlic butter for the bread was really good, cheese tortellini with rosé wine sauce was DELICIOUS!!"
/user_details?userid=_I0L-dIxPx_ksmo0E2p_Ow,Kirsten B.,"Harmony, NC",5 star rating,This restaurant is amazing! My family and I were visiting from the states and wanted some pasta for dinner. We walked about a mile to find it from our hotel and I am very glad we did! The staff speaks both French and English and we easily understood the menu as it was in both languages. The salad bar was great and there menu is diverse enough for even the most picky eaters! Definitely give it a try!
/user_details?userid=y9Txs00wSYpT2kM0Vp6qfw,Judy S.,"Fairfax, VA",1 star rating,"Pros: had a salad bar that comes with your lunch but because there weren't a lot of customers the veggies seemed like it was sitting out for a while. Cons: We ordered 3 dishes the arrabiata (spicy marinara) spaghetti, pesto lamb pasta, and the baked rigatoni with meat sauce. All the sauces were way too sweet and tasted like it was straight out of a can. The pesto with lamb was awful and gamey which smelled strange. The pesto sauce lacked flavor and depth. Service: Just after ordering 3 dishes I realized it would be too much food so quickly asked to cancel 1 item. The waitress was upset and said if I cancel a dish only 1 person could have the salad bar even though we were ordering 2 entrees and an appetizer. It didn't make any sense and they were clearly desperate to make money off of anyone. Service went downhill after that and she never refilled our water cups or came back to ask if we needed anything else."
/user_details?userid=I7wE1mOvJU4E9eNBfzb_Yw,G M.,"Austin, TX",3 star rating,"Found this by accident, great find in historic Montreal. We have been there twice because the wait staff is excellent, the Wine selection is excellent. We all found the food to be better than OK but not exceptional.We will for sure be back for the wine and the service! Bon!"
/user_details?userid=CZ88mVeafJoA2FEkrcxxpA,Chanel F.,"Laguna Niguel, CA",5 star rating,"Amazing food, there's always a wait, but it's 100% worth it. Great food, ambiance is wonderful, and the history of Dickens is worth it!"
/user_details?userid=3QJj7MESj2TSIp7_Ylkg0g,Mtl F.,"Montreal, Canada",4 star rating,Really beautiful place. Came here for a staff Christmas dinner in December and the decorations were stunning. The food and the service were also very good. Overall good experience and they easily accommodate big groups.
