user_url,user_name,user_city,user_rating,user_review
/user_details?userid=W8RW8XCiPn7hY5OXvJi5Kw,Frank D.,"Toronto, Canada",1 star rating,"We waited in a long line for dinner basing our decision on the positive reviews (about forty minutes). Someone walked by and commented 'Wow, look at the long line! This place must be good'. That was our thinking too but looks were deceiving. The restaurant seemed understaffed. The hostess was our waitress and also the bartender. I ordered the pasta arrabbiata since this is a difficult pasta to mess up. However, I was dead wrong. The pasta was overcooked and cold. The tomato sauce was thick chunks directly from the can. And the oil? Well, let's just say everything was swimming in it like a fish in the St. Lawrence River."
/user_details?userid=CT-oSdy6JINaFVx8IvmrPA,Reggie C.,"Malabar, FL",4 star rating,"Very good food, service, and atmosphere!! Located in a very historic part of town. I felt like I was transported back in time. Restaurant is known as the place where Charles Dickens, in May of 1842, wrote notes for what would become A Tale of two Cities."
/user_details?userid=ggP5hWgIo6GyveBjeHIkNg,Brenda Jiwon L.,"Sunnyvale, CA",4 star rating,"Awesome Italian restaurant in downtown Montreal! We went on a Sunday night for dinner, and we had such an awesome time. It was peaceful, and I loved how the interior was decorated with Christmas decorations. We got the lobster linguine, which was absolutely delicious. The noodles were cooked just right and was super chewy, and the sauce wasn't too salty. They also give you a decent amount of lobster meat in the pasta. We also ordered the rose tortellini with melted cheese and the lamb with pesto sauce. The only disappointing dish was the lamb with pesto. The sauce and the lamb tasted sour. They also have bread with garlic bread, and all you can eat salad. The salad bar wasn't super diverse, but the vegetables were fresh and everything went well with the food. Also, I highly recommend the white sangria! It's super sweet and tasty! (Although I wish they had put more alcohol in it). The staff was super nice and sweet. I highly recommend this Italian restaurant."
/user_details?userid=hmHPTH22A2rx6dFPwH-Q1Q,Angelo C.,"Beachwood, OH",5 star rating,"There are endless options for Italian food in and around Montreal, so deciding upon a place is a bit like trying to select a beer in Munich during Octoberfest. Needless to say, this place did not disappoint! The portions were generous, the service attentive, and each entree comes with free salad bar access. I settled on a plate of spaghetti with a spicy tomato sauce (arrabiata), and it was as expertly prepared and delicious as you could get. Even better, my order only came to $11.00 (Canadian dollars) after tax. If you're in Montreal and looking for pasta, definitely give this place a shot!"
/user_details?userid=7bmqVWMWkhlvtNBX5tyg5g,Lisa L.,"Toronto, Canada",3 star rating,"I would give it 3.5 if I could only because their garlic butter was really good! Service is quick, all you can eat salad and bread, the buns are cold and there are 5/6 salads to choose from. Pasta was mediocre, the vegetable pasta did not have enough sauce (number 7), the daisy pasta (number 1) was too heavy, they stuffed the ravioli with cheese and then put more cheese on top, probably would be better with a brown butter sauce. We were just desperate for food, would not come again."
/user_details?userid=Y_YeKQnyEdk5pcQ-lO9DKQ,Amanda M.,"Watertown, NY",3 star rating,"This is a pretty good spot if you're in old Montreal and by that i mean one of the only places you don't need reservations for on Saturday night ! My husband and i could not find a restaurant with any tables so we were so relieved to find that they don't need reservations. Only had to wait 15-20 min while they were packed. Waitresses were super nice. Biggest disappointment was the food. The salad bar was a bit of a shock, just lettuce and dressing, unless you like mayo based pasta salads. My husband had a creamy salmon pasta that was super watery. My sundries tomato and goat cheese ravioli were really good, once i got all the oil off of them. I think because it was almost 9pm might have been why it seemed rushed together. My sangria was amazing. But it's a decent restaurant if you're looking for something without reservations."
/user_details?userid=-BI7-JlFsGKPiRmC_a1i1A,Luis T.,"Houston, TX",4 star rating,Good past overall could have stronger seasoningFree salad bar which is actually good and we ordered a merlot bottle for 35dlls and ended up paying 80 dlls for the whole dinner which we thiught was very reasonable for what we got.
/user_details?userid=lHGUjSQKKYGDkUZlxYvTWw,Lana T.,"Bloomfield Hills, MI",4 star rating,In general i wasn't impressed with food in Monteral . Thisbplace has a decent salad bar and pasta. Thier steak is better than thier chicken. Service was good .place was clean
/user_details?userid=OqdwamXjeu6tZcKHspml7g,Elise G.,"Lighthouse Point, FL",4 star rating,"The menu has many different options that are all unique. Next, the inside of the restaurant is very cozy and original. The service was amazing, friendly, and fast. I very much enjoyed the bread with the garlic butter. Also, the salad bar is a great concept with the best salad dressings I've had. I would definitely recommend this restaurant."
/user_details?userid=sBFQ8CfrjXJXMRnkDwHv6Q,Craig R.,"Chicago, IL",5 star rating,"The title had me thinking this would be a bit pedestrian, but as soon as we were greeting we loved the place.  Our waitress was the best on our whole trip - casual and genuine.  The food was very good.  The wine I ordered had gone bad, but the waitress tried some, agreed, and had no problem getting a replacement bottle."
/user_details?userid=wmW-SKO8uwh1cJbwt8I-4w,Steve W.,"Hamilton, Canada",5 star rating,An amazing place in Old Montreal to be greeted by the owner more often than not. You will enjoy the all you can eat salad and soup before your main course arrives. Choosing the Spaghetti and meat sauce is a wise choice. Enjoy the garlic butter on the fresh buns served up with it too. I highly recommend this location and food here. It's reasonably priced. I'll be back.
/user_details?userid=-duHzkejpOJjc9G2ERE9Kw,Allyssa V.,"Toronto, Canada",4 star rating,"Cozy place, and lovely ambiance. It's located downtown Montreal. Getting there was really nice walk around the city. The food was amazing! I would like to add that they have fresh salad buffet and that is all you can eat when you order food, I had their pesto salmon and I remember it's $17 plus tax. Highly recommended place! You should check it out when you're in Montreal and craving good Italian food! Xx"
/user_details?userid=KXwQXZjIbIuSlouwXoSigg,Gustavo C.,"Miami Beach, FL",4 star rating,It was the only place I could find that was open for a 6pm dinner and it was a great option! I wondered Lamb and it was cooked perfectly. The meals included a salad bar that I wasn't expecting.
/user_details?userid=zVm8BbJRSiXDnM1DzOHbWw,Gowsi M.,"Saint-Laurent, Montreal, Canada",5 star rating,"This place is amazing and so is the food. Staff are kind and approachable. I love how it the restaurant looks inside; clean, open space (not crowded), vintage and it gives you a welcoming vibe."
/user_details?userid=jXdnU8ONRIHVzhmDBvlmOQ,Ali A.,"Downtown, Canada",4 star rating,"Well all-spaghetti all delicious! Very warm, homey, relaxing vibe. Perfect lighting and pleasant music. Nice and polite staff. Well priced menu. I tried the Grand Prix. Liked it. Yummy and plenty. The salad bar is included. But it does not have much to offer. I would definitely order dessert but I was already full. The interesting point is that they serve daily wine. A glass of red (Spain's) went really well with the food. Spicy and dry."
/user_details?userid=hNihr6KJG0lNN7WbfxQYqw,Olivier C.,"Gatineau, Canada",4 star rating,"Tried this place with the family, they have a kids menu with different options and they had no issue picking something. Between $8 and $12 so it's not that cheap but kids enjoyed their meals.For the adults we were all very happy. The spaghetti sauce is great, reminded me of when people took hours to make a batch instead of buying Classico sauce. The meatballa were huge and perfect in every way. My wife took the eggplant lasagna and loved it.Bread and garlic butter on the table prior to ordering, salad and soup bar with limited options but everything seemed fresh and the homemade (?) salad dressing was very good. We were all too full to order dessert but they still brought some chocolatey squares with the bill.Service was fast and overall I have nothing negative to say.I spaghetti felt like dried pasta instead of fresh pasta like one would expect at that price point, it is my only negative point.Will return if we are back in the area."
/user_details?userid=_o5zsA_kIA2D9OEbJimmSw,Zyg M.,"Los Gatos, CA",4 star rating,Walked into this restaurant while we were walking around old town. There were seven of us. Service was good. Very friendly server. We all ordered differently. Wife was happy they had gluten free selection. Good wine selections. Everybody was happy with the food.  My gripe is the sambuca was served without coffee beans
/user_details?userid=bKqcvJcbS-sESmX6qpjV4A,Chuck W.,"Nashville, TN",5 star rating,"Our first trip to Montreal, what a great place for Italian food.  Our server was so nice and helpful"
/user_details?userid=a3LX2G9IRtbavf1sjIDRuQ,Bonnie S.,"Anchorage, AK",5 star rating,"This is an incredible deal in old Montreal. Wish we'd discovered it 2 days ago. We stopped in because it was close to our marina (traveling by boat) and it was rainy so didn't want to search. Cozy old world atmosphere. Almost immediately, were served rolls with butter that had a good amount of fresh garlic added--good. I ordered lamb shank, husband ordered arrabiata. Then we were told our meals also included an incredible salad buffet--potato, green, carrot salads, mixed greens with tangy mustard dressing, beets, green beans, and others I didn't try but all I did were tasty. Good glass of house wine only $7 Canadian. Servings were large--had leftovers. Bottom line: Food was very good, even though not amazing, but I'm giving 5 stars for value. Whole meal--including 2 hearty pasta entrees, salad bar, glass of wine, bottle of pellogrino was $55 Canadian for two--a steal."
/user_details?userid=bStzh4K_Pcalhe0NxAr1yQ,Amanda M.,"Dunkirk, MD",4 star rating,I was pleasantly surprised by this restaurant. It is definitely a tourist restaurant but the food was pretty good. The salad bar and large portion sizes filled us up. The house wine was inexpensive and tasty.
/user_details?userid=SXJqzKeC7g6-v5uHHz3WAQ,Alexa N.,"Montreal, Canada",3 star rating,"What to say about this place! The pasta menu is very big, the wine selection as well. Prices a reasonable the old port.The decoration is beautiful and the ambiance is warm, except a bit loud.I took the ""monsieur le maire drapeau"" which consisted of tortellinis stuffed with ricotta cheese in a rosé sauce topped with melted mozzarella. The meal itself was very good. Sauce was very tasteful.  You get all you can eat small salad bar and fresh bread.The garlic butter was AMAZING. I was filled with pasta and i still ate some bread with it.Service was ok. She took my bread plate when i wasn't done.Overall delicious experience."
/user_details?userid=4M39l0ggWntLS--Rogz4ZQ,Andrew ..,"Hollis, NH",3 star rating,"Good, but not at all great. It's spaghetti. Their spaghetti tastes exactly like you or I would make in 5 minutes. The meatballs were pretty bland, but not bad. Very popular due to its excellent location. Great staff."
/user_details?userid=eoZP1bwnnuvh596TQ9PeNQ,Anthony D.,"Pensacola, FL",5 star rating,Excellent food and a great atmosphere. It is located in a 300 year old building and has a really cool vibe. They have a large wine selection. Each meal comes with a salad and soup bar that is phenomenal. The chicken Parmesan and meatballs are great. The waitress was quick and attentive. We will definitely visit again when we are in the area.
/user_details?userid=dOHvUeFksjT9bW-b7s-AJQ,Carolina T.,"Richmond Hill, Canada",4 star rating,"Food is good, although service needs improvement. They provide all you can eat salad if you order a main course"
/user_details?userid=L_ynaOXEgOE-3UTT-L-j1Q,Diego B.,"Le Sud-Ouest, Montreal, Canada",4 star rating,"Nice place! Great food and service, highly recommended. Great location and awesome historic building."
/user_details?userid=LKqnw5_fve19Nn1z7qH_gg,Marilyn Y.,"New York, NY",5 star rating,"Old Montreal. Had a delicious authentic Italian meal. I had their house specialty: pasta w/meat sauce. Daughter had one of the specials: linguini with lobster sauce. Service was very good. Came with salad bar, bread, and garlic butter. Their cheesecake was some of the finest I've had. Lemon cake was also delicious. Strong recommend for this place."
/user_details?userid=ivBxjcPvWMdo_NK5mfoCug,Borce A.,"Lake Worth, FL",5 star rating,"Went here on a date with my wife while on vacation. Located in Old Montreal, the restaurant isn't very large, but felt cozy, with a few other diners sitting nearby. Perfect ambiance to have great conversations with the people you're with. Food was great. Got the lamb with pesto spaghetti. Very good. They also bring out bread & butter before hand, also very good. Overall, really enjoyed my dining experience here."
/user_details?userid=zmV9CGxa-Rx3YfOVvr8QUA,Sal P.,"Billerica, MA",4 star rating,Stopped here for lunch after a walking tour of Montreal.  I had the eggplant parmigiana special that included their salad bar and soup offering.  Both the food and service was excellent.  Highly recommended!
/user_details?userid=u4JVPzbu9aDDeLoseX7G6A,Michael R.,"Ballwin, MO",5 star rating,"We wandered into this charming restaurant inside an historic building by chance.  Inside, we were greeted by a lovely young lady who was fluent in both English and French.  We were seated in a dining room featuring old stone and deeply polished wood, with golden lighting...a cozy ambiance!  Service was prompt, and our selections from the fairly extensive menu were all tasty and served fresh and piping hot.  The bread service and small salad bar were complimentary, and were also delicious.  My order of spaghetti with meat sauce was superb, while my companion's order of chicken parmigiana with marinara sauce and pasta was tender and juicy.  All prices were reasonable for a tourist area.  Overall, this was a lovely experience in an attractive restaurant."
/user_details?userid=1ViT_LzrNbbrheWgIvT5Tw,Wes N.,"Montreal, Canada",4 star rating,"I love finding places that give value!L'Usine de Saghetti's got the right mix, so here are your 1, 2, 3sAtmosphere: Warm! The entire place is draped in wood - floors, walls, tables, chairs... it feels like they've carved out the place from inside of a massive tree.  Small(isn) yet disruptively well spaced L'Usine is a great place to be on an intimate date or with a group of friends.Food: This is where the place comes up trumps - a great selection of freshly made pastas served with a basket of fresh bread and an open bar salad.  What's nice is that of the dishes I tried none where over-bearing or overly heavy, which leaves you with the opportunity to really savour the meal at hand.  Le Golden Square mile was my favourite choice - extremely well done.   Last, L'Usine has a great selection of wines - some of which are 'importation privée (ip) i.e. they have been exclusively procured for the L'Usine.  Points!  Prices range from $14-$18 per dish, and little more for the fancier varieties (with meats an such) - like I said, value!Service: the service here is good - nothing overly fancy, in fact the waitresses are quite casual about their work.  Not to say that they are slack or uninterested, but they are efficient and hardly noticeable otherwise.  Bring some of your A French game when you come - some waitress' communicate best in French here. mais ce n'est pas un problème - juste une autre occasion de pracitice la langue de Molière!Super great place to pop in for a date or gathering.  Will certainly be coming back.Eat well you all!"
/user_details?userid=COjKNS8lwCPN6cAdWk-UrQ,Nick L.,"Russell, Canada",5 star rating,"This is a go to spot for us in Montreal.  The value for what you get is unbeatable.  Escargots were excellent, chicken parm is very well done with light breading and lots of fresh tomato and basil.  Tomato sauce is awesome.  Perfect place for a nice dinner at prices that are cheaper than East Side Marios with actual quality food!"
/user_details?userid=Q7mjK0PmkYHcap06ArzgOw,Zeeshan S.,"Lexington, MA",5 star rating,Was open on Christmas Day. Attentive service. Great food. 2 adults + 2 kids. The ravioli was fresh small salad bar that comes with entree. Good value for a family.
/user_details?userid=ZoIDjke0OMHfonUuyXEZWA,Ruth B.,"Grass Valley, CA",5 star rating,What wonderful service! It was a snowy day in the is beautiful town and we slipped in to this quaint restaurant and felt like we slipped back in time with excellent service and wonderful pastas in huge portions! To salad bar was a fun surprise and very very good with different sorts  of fresh mixed salads  The staff was so kind and attentive and we enjoyed such a delightful afternoon there as we leisurely ate our meal. Would highly recommend!
/user_details?userid=b_aVEAUJiODaoVgrmmA_SA,Vivek S.,"Durham, NC",3 star rating,"Great service, but we ordered the duck medium rare as per the chef's recommendation, and I threw up after dinner and the next morning."
/user_details?userid=nL2h8Vypn8fhOXo_mjQNtQ,Andrew N.,"Glen Cairn - Kanata South Business Park, Canada",5 star rating,Great restaurant with great atmosphere. We are a family of 5 and the food was delicious and affordable. Staff is fantastic and very welcoming.  Plan for a meal here and you are in the heart of old Montreal. We were very happy with our choice.
/user_details?userid=krt5huQg0Ke0BNZKABDK5Q,Jeff J.,"Bainbridge Island, WA",4 star rating,"Had lunch here, mid week, mid winter. No wait, not crowded, good service. Meatballs were a bit oily but the cheesy garlic bread was delicious and the spaghetti was properly cooked. Good, solid lunch spot."
/user_details?userid=GZ5QZt6NO-lLFUHmpPnj7A,Tony T.,"Durham, NC",5 star rating,"It was a bit difficult to choose from so many restaurant in that old town area. Was attracted by the decoration inside and went for the lobster spaghetti on the ad, which is Very delicious. Tasty bread and nice salad bar for free, too."
/user_details?userid=uN-R8j0JexLz2AEBYOByIA,Nico L.,"Montreal, Canada",4 star rating,"Beautiful restaurant in the old port of Montreal. A group of us had supper there on a weekend and it wasn't packed at all. The salad bar is a plus but isn't really something special. The garlic butter that came with the bread, though, was excellent. There is a lot of choice on the menu for people with different tastes. Different meat options, vegetarian options, different pastas... something for everyone! All of us enjoyed our meal and the bonus was that the prices were extremely reasonable compared to other restaurants in the area. Not the best pasta plate I've ever had but it was still very satisfying as I finished the whole thing (i had the linguini with prosciutto and blue cheese)."
/user_details?userid=-tdrDbhC0hcPU2gK1P4bUw,Michelle T.,"Poughkeepsie, NY",4 star rating,We were looking for something good on a budget. It seems that most restaurants in this area are pricey so when we found this on Yelp we decided to check it out. I got the lobster linguini special and my boyfriend got the steak and spaghetti. Both dishes were so rich and flavorful. The wait staff was friendly and the salad bar was a nice plus.
/user_details?userid=sFr1ZQpQ5tixv0PBbANJkg,Raavi A.,"Ville-Marie, Montreal, Canada",4 star rating,Its a nice cozy place with amiable staff. The food is good and service is great. It generally gets a long waiting line at the peak time. It has some vegetarian options too so loved it. Definitely recommend the place.
/user_details?userid=t2eYZu6cZxNqTSwPtJfW4A,Drew B.,"Tampa, FL",4 star rating,"Our experience here was very nice.  The servers were warm and welcoming, and the sangria was excellent.  The food was very good as well!  Overall very good experience!Bon appetite!"
/user_details?userid=-5rgQfe0j-0AGl4B9g7DQg,Kim K.,"Montreal, Canada",5 star rating,"Eat. Here.Eat too much here.Eat and drink everything including the salad bar here.I was introduced to this restaurant one blizzardy night almost 5 years ago as me and my friends sought refuge from the cold after a night of skating in old port.It was the best winter discovery of my life.Starting with the buns and ""ohmygodthisissogood"" homemade garlic butter (and yes you can ask for more but you will feel ashamed in your happiness), this restaurant really offers everything a pasta lover needs. The free salad bar is always stocked and always fresh. Their house vinaigrette is tangy and delicious and I put it on everything I pick from the salad bar, even if it's just the potato salad.I have tried nearly everything on their menu but I HIGHLY recommend the ""place des armes"" spaghetti with 2 HUGE succulent meatballs. Their meat pasta sauce is the perfect balance of tangy and sweet and the pasta is ALWAYS cooked to perfection. I'm an al-dente fanatic and l'Usine de Spaghetti delivers it perfectly every time.I have recommended this restaurant to every single person I meet who is in Montreal for the first time and every person that has eaten there has told me it was a great recommendation. The most recent people to hear me stand on a soap box and rave about this restaurant were a couple from Newfoundland I happened to overhear on a terrace (I'm originally from the East Coast) and after I had finished my -by now- very polished spiel, my boyfriend and I decided to eat there that night! And who should we see in the line up while we were leaving but the couple!I told them I would hope they enjoy their meal, but I knew they would so I just told them to get the special of the day braised beef ravioli instead.Besides the incredible pasta they also have a kick ass white sangria. I highly recommend and guarantee you'll become as much of an addict of this place as I am. Just can't beat dat garlic buttah!Quality for a great price and definitely not a tourist trap, L'Usine de Spaghetti is sure to become your cozy refuge from anything in life like it was that winter day for me."
/user_details?userid=xkHD4SJh0b71wehG_sqC9Q,Kambiz G.,"Los Angeles, CA",5 star rating,Great food. Spaghetti St. Leonard was super delicious!! Good service. Salad bar could be better. Was very limited but it was included.
/user_details?userid=qmtLeBrHYh6vtdlNCJ_lfA,John L.,"Jurong, Singapore, Singapore",5 star rating,"5 stars because my lamb shank fettuccine made me cry, so good! Lovell restaurant and lovely staff. And generous with bread, came with home made herb butter. Tres bon!"
/user_details?userid=jveIBHpWOfZFv24luiDjPA,David R.,"Costa Mesa, CA",1 star rating,"Read carefully!! The food was great!! My food was awesome!! Again, Food gets 5 stars!!!! However, the service SUCKED!!Our waitress was just not good. She tried to do nothing but upgrade us. No drink refills. After we got our food she was gone!!"
/user_details?userid=NXIKZ7yLQk1ZmAyt1OUeMA,Hannah L.,"Scarborough, Toronto, Canada",4 star rating,"environment is good, food is wonderful, and the price is comparable. My dad love it, will come back."
/user_details?userid=-BF-_l6i1fWib9U5T8IhHQ,M I.,"Boston, MA",5 star rating,Awesome food and the service was great. They were able to accommodate us last minute although we didn't had a reservation. We'll definitely visit them again when we will be back in Montreal.
/user_details?userid=mxyzKmpVXMJv6X3RiSQIMg,Melissa V.,"San Francisco, CA",4 star rating,"I definitely would recommend this place again. The open appetizer bar, which consists of different types of salads, was all you can eat and tempting to eat more than you should before your main entree. But make sure to save room for the entree because they are all delicious. This place was recommended to us by two strangers from Montreal and they did a good job because the pasta is super good and tasty. Everything from the presentation to licking the last bit of sauce out of the bowl was very enjoyable."
/user_details?userid=IF7c49XtOT12oG9vIgP5Qw,Ariel L.,"Bloomfield, NJ",2 star rating,Overpriced bad food. Even the presentation was bad. Two stars for the ambiance and for being open on New Year's Day. Tasted like a microwave dinner- some parts of my meal were very hot and some bits were cold.
/user_details?userid=fllQymLLlR5y0Os1slvvNQ,Daniel F.,"Lachine, Canada",2 star rating,"Not impressed. Even though wine is very good. Wide selection at a fair price. I was expecting an amazing meal but did not happen. Quickly the place got packed so service got compromised. Salad bar is complementary, lack of choices or quality. I ordered the Chicken parmigiana. You can taste the home tomato sauce being a normal grocery store/ragu brand style like. Also ordered a traditional meat sauce spaghetti (same thing). Not real cheeses either. Tiramisu(just fine) and the half ltr. Masi Red( Lovely!) We dined two for over$80+ tip. Only thing I loved was espresso. Overall not such a good pasta experience. Not keen to go back."
