user_url,user_name,user_city,user_rating,user_review
/user_details?userid=C416RqFkejkCCsFLwHGj2w,Kimmey P.,"Coconut Creek, FL",5 star rating,"This place is amazing! They brew some of the best beer in Montreal, hands down! my favorites were the passion fruit and pumpkin spice saison.Veronica was amazing and provided great conversation and tips for my other beer and food adventures in the city.They also have a ""beer bible"" of beers available from all around the world - ask them about it!"
/user_details?userid=xC-q_yh0XwcjRLimkS3RNg,Jonny M.,"Vancouver, Canada",3 star rating,"After dinner, we were looking for a close place to grab a drink so we decided to head to Le Saint-Bock. I've only been here one other time.We dropped in on a Tuesday evening (around 8:45pm) and the outdoor terrasse was packed. We went inside where there was a plethora of seats available. There's also multiple TV's inside.The beer menu is annoyingly only on screens but there is a food menu that they bring to the table. 44 different beers and ciders on tap. Service is spotty. - Triple brett chardo (#14) ($7.83) - Triple aux Bretts Fût De Chardonnay - CID original (#25) ($7.83) - basic cider, nothing special about this one. - Small beer mac & cheese ($9.00) - this came out piping hot. Don't touch the pan! Creamy and oozy.LSB beers aren't the best but aren't the worst either."
/user_details?userid=OP7nO0dIaYW0O6DYX8-azQ,Charles H.,"Montreal, Canada",1 star rating,"This place has such bad customer service that one star is one too many. Slow customer service on Friday afternoon even the place is almost empty due to the pandemic. No menus, it has to be checked online, they have a list of beers written on a blackboard but most of them are not available, the staff looks like they could not be bothered with anything, after they brought the glasses of water and waited for about 5 minutes we just got up and left"
/user_details?userid=p5UpfL_k2rqrhFw7gBSm7g,Kojhi C.,"Queens, NY",4 star rating,Stumbled upon this spot on my most recent trip to Montreal and it didn't disappoint. Need to kill time as me and my boy waited for our air bnb check in and this was the perfect place. The atmosphere was great considering it was 12pm. Good music had TVs going in the background. The honey garlic wings were great and the drinks were decently priced. The bartender was really nice and accommodating.
/user_details?userid=rLh63PoxknAV52w5IkmcQA,Crystina S.,"Montreal, Canada",2 star rating,"We did not enjoy our visit to Saint Bock. We were sat at a tiny table so close to another that the person behind me kept getting up and bumping me no matter how much I moved over. It took about 10 minute to get the menu, and no one explained that their beer menu was just on screens around the restaurant. Having bad eyesight, I couldn't read them. We asked for a beer menu, and he said ""it's on the website"" Wow. We ordered our drinks. Beer #5 was alright, their white sangria was not. I had the Galvaude ""burger"" and my dinner mate had the Métropolitain.Mine was a bad attempt at a hot chicken sandwich. Pretty confident the chicken was that pre-cooked stuff you get at Costco and reheat, when it was advertised as pulled/shredded chicken and it wasn't. The gravy they used was way too salty, and I that's from someone that puts salt on everything. The Metropolitain was about 3 slices of smoked meat. Really disappointing for $18. Fries were pretty good. The server walked by our table with empty glasses about 5 times and never once asked if we wanted anything else. We felt pretty ignored and unwelcome."
/user_details?userid=LrsX8ioOG6GEIHfsXI_9GA,Sarah M.,"Montreal, Canada",3 star rating,"Yes, they have a significant beer selection, but the waiter we had couldn't seem to use his words to talk about them. Maybe it was an english thing? I tried in french but didn't get any further along in the details I had. Charcuterie board I only liked one of the four meats, and I don't know how that's possible when I eat pretty much everything but maybe it was meant for those with a more... developed palette? Overale the place is really hyped up and I don't get it. Beers were average, food was average, service was subpar."
/user_details?userid=IzJ36jX6V6ky5BtoN-Agng,Chun P.,"San Diego, CA",5 star rating,"Again, another awesome bar that makes me love Quebec more, and hate France a bit more...  Le Saint-Bock is a popular craft beer bar, the place was jam packed the Friday night we walked in.  Luckily a couple of bar stools opened just as the wife and I approached. Thirty-something different craft brews are on draft at any given time, if you can't find something you are truly a hipster beer snob.  The friendly bartender gave us a few pointers on all the stouts, belgians, and scotch ales, our favorites.  Most beers are reasonably priced between $5-9, and I'm talking about Canadian dollars, so that's 20% off for us Americans. Sweet!  We didn't order food, but the pub grub of burgers, nachos, and poutine all looked delicious. Despite the busy Friday crowd, the nice cordial barman gave us complimentary samples of the beers he thought we'd like too...that would NEVER happen in France.  A couple locals chatted us up too... good times...I love Montreal and Quebec!"
/user_details?userid=dDl03jDeSD1rx821eoOu0A,Laura D.,"Rhinebeck, NY",2 star rating,"I read a lot a great reviews. I'm sorry to say I didn't feel that way. We ordered the pulled pork poutine and the American burger with poutine. The pulled pork was very dried out, almost like a jerky. The burger was fine but my knife, upon unwrapping, was very dirty.  The waiter was sweet and when he needed to go behind the bar he said a waitress would take over.  We finished eating about 10 minutes ago and still haven't see her.  I really dislike leaving poor reviews. With luck our next stop will be better."
/user_details?userid=_CB1KhsRDJFF21XTxP43dw,Joseph Y.,"Los Angeles, CA",4 star rating,"Don't let the fact that it is directly next to a strip club scare you away. They have the 4 largest collection of bottled beers so you will definitely find a beer that makes you happy, plus, they brew their own beers on site as well. The pouting is delicious. The cheese curd is unpasteurized and fresh (can't get that in the states). The gravy is beef broth and has beer mixed into it.... just don't add ketchup or they will give you weird looks, it's not accepted here.The bathrooms are downstairs and you need to go down some narrow steps...if you are drinking, you might need an escort to help you down."
/user_details?userid=CwFebMF23wOAepWE38XACA,Tomer N.,"Ottawa, Canada",5 star rating,"If you like AMAZING beers, if you like to taste beers from different microbreweries, if you are an IPA (or dark IPA) lover than this is your Mecca (although I am not sure they drink alcohol in Mecca).I love this place, during the summer you sit outside, on St. Denis where everything is happening and get to drink beer in a nice summer breeze while watching a festival or tapping into the vibe of the city. In winter you can sit inside, watch a sport event and wish summer is here. It doesnt matter the season, as long as you can drink their superb beer you know things will be great."
/user_details?userid=Kj9cFO70zZOQorN0mgeLWA,Faiza K.,"Toronto, Canada",2 star rating,"Solid place to grab a few beers - their menu is extensive!  But they are big, loud and BUSY so expect to wait a bit for service.  We had to routinely look for a server and she looked pretty exhausted (not sure if people called in sick or what happened, but she looked like she was the only few working there).It's close by to a strip club but hey, whenever is that a problem?!  Sit on the patio or the tables by the open windows and enjoy the views/fresh air.They put the menu on a few blackboards around the room, but when we asked for a menu the server told us to look online.  Good for a beer or two if you are in the area but I don't think I'd put this on my top lists of places to visit when back in the city."
/user_details?userid=4sMsjoRxi6Rqpm0IziQ0GA,Kate Z.,"San Jose, CA",5 star rating,"LOVED the place!Beer- what a selection! And for your convenience all the beers are listed on their website. We had the Pineapple Express and Pot Not Pot or something like that and the NW IPA. These are some great beers. Food- we started with the bacon nachos. Portions are humongous a d two of us were full after splitting the plate.Service- awesome! Super nice, friendly and helpfulPlenty of seating."
/user_details?userid=wzyGNvArcpUjZauRWFrKHA,Bill T.,"New York, NY",4 star rating,"Wonderful beer selection, cool vibe and friendly/efficient service!   Came here on a Thursday night after a Habs game to meet a dear friend and even though it was crowded, was able to snag a table.  The waiter was very quick and kept all his tables full of beer!I like how you can view their beers online (or on your phone) as well as on the screens on the wall.  The screens have a lenghty cycle time so sometimes you have to wait to see about a particular beer but there's no waiting on your phone.This is a great place to have some delicious craft beers and hang out."
/user_details?userid=qZn4-4_ApTfiJHRTSwJAlQ,Sylvain P.,"Victoria, Canada",4 star rating,"Excellent microbrewery with an awesome choice of beers.They offer lots of homemade beers and more from others brewers.They offer pub meals and i really like my fish n chips and burgers are good too.Good place to let the pressure off !Excellente micro-brasserie avec un choix époustouflant de bières artisanales.Leurs bières brassée sont excellentes et il offre aussi des bières d'autre brasseurs.Ils offrent des repas genre pub, mon fish and chip était très bon et le burger est bon.Bon endroit pour décompresser !"
/user_details?userid=pMuxummYS_3kvSRj2ndoEw,Regina W.,"Irvine, CA",4 star rating,Nice place! Lots of choice on beers and food a little better than bar's average food... the wait time to get our food was a bit long but will still recommend this place :)
/user_details?userid=_cS_9Yowq2Oyvl8uvHnZcw,Benita W.,"Beltline, Canada",3 star rating,"We visit here tonight. Ordered pull pork poutine and pork nachos. Beer tester with selection of 5.Beer is great, but pulled pork is overly dressing with poutine."
/user_details?userid=UgAl1BXZjJWUAdvVixwhew,Eden L.,"Montreal, Canada",4 star rating,Waiting time can be a little long on a Friday night.Numerous choices of beer. Good price.
/user_details?userid=M0AnYyp5EBMryhTNHR8oqQ,Sara S.,"Tampa, FL",4 star rating,"Pints and poutine!! Impressive and extensive beer selection, prime location on St. Denis, tasty comfort food, and the loungy patio make this restaurant/bar a huge draw. The patio was packed any time of day the weather was nice. Inside was inviting, but who wants to be inside during summer in Canada? Children are allowed on the patio up until 8 pm, which is a good indication the party starts around then. Server was very kind and timely throughout the meal. The poutine with jalapeños and sausage was especially delicious and not as hot as it appeared. The mac and cheese was not a favorite for children with the meat and beer flavor, but adults will gladly enjoy. Glad to see some salad options on the menu to help balance the rest of the glutinous food. Ideal place to lounge with friends and drink pints for hours. Credit cards accepted."
/user_details?userid=whINg-cC-FiAv_ATDGMDTg,PatrickJ T.,"Bakersfield, CA",3 star rating,"While in Montreal, the family decided to stop by this pub for a drink.  Le Saint-Bock has both indoor and outdoor seating available.  We chose to enjoy their outdoor setting.  Sweet Jesus was my choice of beer.  It is one of the beers made by Le Saint-Bock.  Tasted great!  One of the best micro brews that I have ever drank.Pulled Pork Nachos that we all shared was not so good.  Meat was bland.  Chips were stale.  I do not recommend.My brother n'law had a flight of beers.  He said they all tasted pretty good.  The ladies chose some mixed cocktails.  Neither was impressed.To summarize, try their micro brews especially their Sweet Jesus!!  Stay away from their mixed cocktails and nachos."
/user_details?userid=tYyP5K4Zfu1XQTCbNnmcng,Mack R.,"Courtenay, Canada",4 star rating,"Beer selection is as advertised. Good place to go for a few beers and some solid pub grub. Lower lighting with an overall nice and relaxing atmosphere. My bartender was awesome, I don't speak a lick of French and was curious about certain French words describing the beers.I ordered the Nagano burger and subbed out fries for a poutine  (I'm in Montreal....of course I Will!) The burger was flavorful, slathered in bacon jelly and mayo! The one small issue I had was the poutine was a $3.50 upcharge and was very very small....left me wanting more!Great spot, wouldn't definitely go back!"
/user_details?userid=iquCZU8tjmRQrnDgci5YpQ,Cori C.,"Calgary, Canada",4 star rating,"This is not a place I would have chosen on my own. The pink lighting. The pounding music. It has a distinctly loungey vibe that doesn't go with the idea of a brewery at all. It seems like the place to find someone testing out Rules of the Game, not find fantastic beers.But I was talked into it and I'm glad I was. The beer menu (40 beers on tap, plus plenty more in bottles) was on some horrible rotating screen, but it's also online. I did a flight because there were too many options to just pick one, followed by another round.The blueberries with hot peppers sounded like a bold move that would either be wonderful or the worst (it was wonderful). The Duchess of Burgundy was by far my favorite, though.I'm sure I'll be back to try some more."
/user_details?userid=0-H9ASZU3JtiI5QNM1abbA,John O.,"Peabody, MA",4 star rating,"So this was a ten minute walk from our hotel up rue Ste. Denis. This a sit yourself place with options for sitting inside or on the street deck. The ambience was cozy and welcoming. Service was friendly and prompt as well.The beer selection was available on a couple flat-screens in the pub. The bar offers wi-fi as well, and if you can't easily view the flat-screens, you can go on their website and see what is available. I thought this was a great idea to avoid waste with making print of the beer selections, as I imagine it is always changing. My only complaint was the menu wouldn't download. When it did, I found that it was a little different from ones provided by staff. But these are technical issues, who needs a website to get your drink on?My wife got the BBQ chicken wings. They were tiny, but delicious and delicate. I got le Nazegon (looking for it on the website menu, to no avail) which was a pork style burger. It was juicy and delicious. Some of the fries though hot, were a little undercooked. Overall though, it was worth stopping in."
/user_details?userid=tWBLn4k1M7PLBtAtwAg73g,Jay M.,"Toronto, Canada",2 star rating,"An impressive variety of beers to choose from, available in flights of up to 5 beers. The catch? The beers weren't that great and the prices were extreme. $19 post tax / pre tip for a flight is pretty extreme!Now I'll give them credit for the fact they had many different styles and even some weird experimental things like ""marijuana beer"" which I'm guessing they drop hop with herb and thus increases the costs, but either way, I left underwhelmed with most of my selections. I'm also not sold on the atmosphere of the place, and my bartender was pretty cold and inattentive. While I don't speak french, I know she spoke english, and while I'm fine sitting at a bar without conversation, I felt zero engagement at all from the time of sitting down to the time of asking for my bill (without even being asked about another drink order). Overall, pretty a pretty meh experience that I'll be skipping on my next trip to town."
/user_details?userid=XIkydFm5vkMpXXhnO26rgw,Chris R.,"Litchfield, NH",5 star rating,"Ate here 9/8. Beer was good, I had the IPA pretty standard. The good, the food did not disappoint. We accidentally got onion rings which all 4 in my party felt were the best ever, especially with the horseradish sauce. Then my wife and friend got the ""soup of the moment"" which was French onion. They both said it was better than any other French onion soup they have had. I tried it and it was really good but it was a first time for me. I got the wings and fries, wings good flavor but could have had more heat. Fries like warm but good flavor. Overall the wait didn't bother me and would definately return with hopes the French onion soup is on the menu."
/user_details?userid=2z8eJokMM5Fe88eAQFc4jg,Jina S.,"Vienna, VA",5 star rating,"Definitely a solid bar in a great location. Loved the selection of beers (my favorite was their orange IPA). My husband and I had a round of drinks along with some appetizers (nachos and vegetable beignets (warning: vegetable beignets = falafel... we cracked up so hard thinking they would be actual beignets)). Service was friendly and quick at a busy time on Thursday evening. It is a bit loud with the music (John Mayer's CD was playing on full blast), but worth going to try their local beers."
/user_details?userid=xJpvRrk04rb4rgWtMXaPUQ,Kenny C.,"Brooklyn, NY",5 star rating,"Do you like beer? No, I mean, do you REALLY like beer? Doesn't matter. Either way, Saint Bock has you covered.They have an ever-evolving beer list written on a chalkboard outside. We came here twice in a week and the list almost completely changed over. They brew a lot of their own stuff, and what we tried was really, really good. They had a great sour beer called the Abomination, which was gone the second time we showed up. Too bad.They have a beer with vanilla flavors that they serve with a marshmallow. Plus, they also have a full bar so if you want a cocktail or mixed drink, you can have that too. But really, why?They also have the famed Beer Bible, which is a list of a ton of imported and specialty beers. We had a few of those as well. Our waiter JC was a super cool guy who gave us wonderful recommendations (and also shots). My favorite was the Cantillon Gueuze Lambic.Great place to sit curbside and people watch (read; watch girls walk by in very short shorts). It's also next door to a gentlemen's club, so that's always interesting."
/user_details?userid=-ZqPTpx9TyyvdAWbajdilA,Jessica S.,"San Diego, CA",4 star rating,"This restaurant was our meeting spot for this fantastic craft beer tour that we took on our first day in Montreal. We spent about an hour in here as a group, before moving on to our second stop.Our tour group had a small section of tables clustered together, close to the bar. There we sat, getting schooled on proper tasting technique and sampling two of the bar's many draft beers.The first beer was the Calice, which is an American style IPA. They say that, at least, but it's far less hoppy than the IPA's that I'm familiar with. Maybe they make that comparison because it was just about as bitter as the IPA's I get at home. At any rate, though it was bitter, it wasn't overpowering, so it was easy to drink. We had a couple of people on the tour who were not drinking, so there was plenty of beer to go around, should we need seconds (and we did need seconds!)The second beer was the Encensoir, which was a smoked beer, and probably my favorite of the night. It was smoky, yes, but not overly smoky. It didn't taste like you were standing downwind of a raging BBQ, which was nice. It was smooth and dark, and paired well with the poutine sampler we were given.The poutine itself was...not my favorite. This was our first time trying it, and had it been up to me, after this sample I wouldn't have tried poutine again anywhere else. The gravy on the fries was good (and that's why our guide had chosen the Encensoir to pair - the smokiness of the beer would pair well with the beefy gravy), but other than that, the dish was kind of meh. The cheese curds dominated the small dish, and that's probably what turned me off to it. Not that I don't like cheese curds, because I do. I just prefer them melted (or so I came to find out).The wait staff was friendly and accommodating, given that three people on the tour had taken it upon themselves to order a full-on meal in the middle of the tour, and then moved tables a couple of times to boot.They have something like 47 beers on tap, and our guide mentioned something else about a staggering number of bottled beers for sale, but it was a long time ago and I was a bit buzzed by then (he was free with the refills, lemmetellya!)We wanted to go back to this restaurant to try their food and sample some of their other draft beers, but we ran out of time. I did enjoy the samples we had, though, and would definitely recommend it for those looking for a wide variety."
/user_details?userid=MaWklnJJpqheLP2ePAIQeg,Teresa B.,"Buffalo, NY",5 star rating,"Le Saint-Bock was located across from our 2nd B&B! The bartenders were very friendly and spoke English too!! Dan and I sat at their bar and ordered a Caesar salad and homemade beer battered onion rings with house made honey mustard. They had over forty beers on tap and let us taste a few before making our decision. Number 1-16 were brewed there. I first ordered a passion sour beer and I think Dan got an IPA The Caesar salad was delicious! The dressing was homemade and it came with real bacon bits. The onion rings were the best we've ever had!! Made with beer brewed there (beer battered) and the house made honey mustard, WOW!! I could see why this restaurant and brewery became busier and busier!! I even had a Kombucha they had on tap (think it was mint citrus). It's the new rage here and Montreal is into the natural probiotics (Kombucha is fermented black and green tea). When we visit Montreal, QC again were definitely going to St. Bock again!!"
/user_details?userid=PJEMuHRRfpLe1Vbc6biCjg,Robert C.,"Spring, TX",5 star rating,"Dropped into this place after it was recommended from a local business a few streets down, and it's always nice when recommendations hit expectations.  Excellent beer selection on tap, at the moment there were about 40+.  Had some sours available as well, and all were pretty tasty!  Pulled pork poutine was nice, french fries with mayo...can't go wrong there!Solid service, chill atmosphere, lots of different sports channels on for all sorts of viewership that may attend.My friend who lives in Montreal came to drop by and mentioned that the location is like a second office for some of his other friends and coworkers.  I really need to move to Montreal!"
/user_details?userid=HwbfsEUBSN0fT8hz88b9Ww,Jenna C.,"Edisto Island, SC",4 star rating,"I was on a mission to find a local brewery with a solid stout and an enticing menu. Le Saint-Bock did not disappoint. Their milk stout Malédiction is delicious, so I was very happy there. Factor in the beet salad, which is everything a beet salad should be, and the brewer's nachos, and you have a pub that I would happily frequent if I was lucky enough to live in Montreal. There was one blemish on the experience: service. Although I tried to learn some French before my trip, I was too inexperienced to hold meaningful conversations, and I was grateful for the server who could bridge the language gap with her excellent English. Unfortunately, her shift must have ended. We sat at the bar for 30 minutes, signaling with my limited French, trying to get the attention of any of the 5 other staff--who were right in front of us. Finally, another patron next to me intervened. I don't have the impression this is typical of Le Saint-Bock, but consider yourself warned. I was feeling pretty insignificant by the time I left...but wasn't down for long. Walking along Saint Denis in the sunshine is too much fun to stay grumpy. (Having a Malédiction buzz helped, too!)"
/user_details?userid=fevnU9WEaJTJm5QzyQIyWw,Rose H.,"Jacksonville, FL",5 star rating,"Great pub ! Delicious beer, fast service, fun time! Pretty sure we even saw saint Bock himself! Haha!(good people watching)! The French fries are delicious with the homemade mayo sauce! The macaroni and cheese is absolutely delicious! You only need to order the small size! The coder was very good!"
/user_details?userid=og0aBF1SkDI84YnSVsOoEA,Toby F.,"Charleston, SC",5 star rating,Wonderful Belgian restaurant. There's a huge beer selection. The scotch selection was nice too. I had the blue cheese burger and fries. Both were yummy. A lot of people on Yelp complained of the wait and service. This was not my experience. I had a great time. I was disappointed that they did not have mussels.
/user_details?userid=MEEJt5W82ACG1MhfQX-CnQ,Tina R.,"Boston, MA",4 star rating,"Tasty burger in a nice outdoor setting . The menu is limited to mostly poutine, nachos, burgers and basic salads but the food didn't disappoint."
