user_url,user_name,user_city,user_rating,user_review
/user_details?userid=oeFiWvoOG0hpMOXXxblfyQ,Coty S.,"Saint Petersburg, FL",3 star rating,"Mostly an expensive beer bar, with a massive selection to choose from.  The prices are high, but the location is convenient, the crowd is nice, and there is a large selection.  I thought that they accepted credit cards, but our waitress told us it was cash only, and you have to pay as you go.  This can make the entire drinking experience stressful instead of just relaxing and drinking up a larger tab.The main reason I came here.. In search of framboise.  I was only able to find one bottle of chilled Peche, and I drank that and left.  However, for more of the beer-lover clientele, this place would be heaven."
/user_details?userid=vpldxbdbHIWdtm3CU49bsA,Joe A.,"Montreal, Canada",3 star rating,There is a huge variety of craft beer available here! I certainly have only tasted a tip of the ice berg. The waitstaff is friendly and the atmosphere is hip. The prices are a little higher than I'd like if I were going to stay for a considerable amount of time. A good place to try some new drinks with friends and find your new favorite!
/user_details?userid=qVRavGPFSpCarN21vCOHRw,Pierre R.,"Montréal, Canada",5 star rating,"What ? I never reviewed Le Saint Bock ?Ok this is one of the best Beer Bar in Montreal. If not the best.Ask for the Beer Bible, I won't spoil it : Be amazed.Add them on Facebook, they have special events with different breweries all the time, new beers very frequently.Their home brews are just great and every one I tried is a perfect discovery.The food is good too, the poutine with braised beef and beer sauce is delicious.Oh and you don't like beer ? My girlfriend fell in love with their Pina ColadaEnjoy"
/user_details?userid=V2GAZKlh2_820OMT2xG-Qg,Aleczander S.,"Burlington, VT",5 star rating,"This is a great place to get food and beer; they have over 40 on draught! I had a Berliner Weiss aged in a Shiraz cask, super tasty. You can upgrade your fries to a beer poutine, what more do you need? Service is great too, very friendly and quick."
/user_details?userid=kFhCnOW3Z8hVA3tzKt6A7Q,Ole B.,"Brooklyn, NY",5 star rating,"The first time I came here, a waiter gave me a beer menu book that was as heavy as  Tolstoy's ""Anna Karenina"". As I was flipping the pages, I could feel pressure going into my eyes because I could not recognize many beer names. Eventually, I ordered Kwak :) in a special glass, and then worked my way down the list. Their beer and liquor  selection is very extensive and good. If you are beer connoisseur then this place is just for you.Their bar food is good too, I've tried chicken wings, and other snack with pleasurable  satisfaction. I scrolled down on people reviews and observe that many folks complained about the service, but it solely depends on how busy this place is. On weekends they have so many people that waiters could not serve everyone simultaneously. Y'all have to chill out with these complains. This place is large to fit many guests so it is understandable that service would take some time."
/user_details?userid=cEwkL8fzzvi0s7XBL2TGOg,John L.,"Reisterstown, MD",4 star rating,"Poutine was pretty awesome here. Microbrew selection is a touch overwhelming in my opinion, but it leaves room for plenty of choice. Staff is friendly and will give you recommendations. They also have cocktails if beer ain't quite your thing. Solid."
/user_details?userid=sYvkub3B_nrs1VQs9avE_Q,Noel P.,"Whitchurch-Stouffville, Canada",5 star rating,"Hears the food was good, but didn't go there for that. Amazing selection of beer! Something like 20 in house brews, 45 taps in total and about 800 different bottles, WoW! Was not disappointed at all by any of the half dozen pints I indulged in. My favorite was the coconut chocolate porter. Delightful! Staff was very friendly and knowledgeable on the beer. Must visit again!"
/user_details?userid=ffYdp5uFJB6HOu_-Clr5wA,Djodi G.,"Gravenhurst, Canada",5 star rating,Incredible beer and food...terrific service...fantastic atmosphere.  You must eat/drink here!
/user_details?userid=VnKj044Tt5doqaVDIJbWsw,Ian P.,"Toronto, Canada",4 star rating,"Definitely a recommended destination for beer lovers in Montreal.For starters, they have an insane selection...when I was there 44 beers on tap with a little under half of them being their own brew.  In addition to their house brews, they have an excellent selection of Quebec microbrews, including the vaunted Trou du Diable as well as many you've never heard of.  There's also an insanely long bottle list with plenty of Belgians, although I didn't quite wade into it.For my visit, I was incredibly lucky, and they happened to be having a sour beer ""festival"" during my visit.  I never did quite figure out why all the servers kept using air quotes for ""festival"", but I didn't mind.  They had a few excellent beers including a Brett IPA made in-house and a spontaneous sour from Mikkeller that blew my mind.  Service was generally friendly and nice.  And there's a beautiful outdoor terasse (patio for Torontonians).  Didn't get to try the food, but from looking around, it looked pretty standard pub fare.Definitely be back."
/user_details?userid=f8MgvIC7fq-nNcTjC4DbzQ,Rebekah B.,"Brookline Village, Boston, MA",5 star rating,"Wandered in here randomly on a Monday afternoon for a few drinks - had a huge selections of beer to choose from and excellent service! And on Mondays, we learned bottled beers are 25percent off!!"
/user_details?userid=9JPPOSV1OL5oTjaZO_Pwjw,Samantha G.,"Seattle, WA",5 star rating,"Pricy but good, we went to Montreal for a few days for New Years, and ended up here more than once!"
/user_details?userid=Vi8s8MzwbiCLu6-1dCdSzA,Lucia B.,"Manhattan, New York, NY",2 star rating,"the mac and cheese looked delicious but unfortunately was bland,and the chicken tenders did not look fresh. our server took forever to take our order, forever to bring it out (nothing complicated with our order) , never came to check if all was well and was overall not friendly at all. i wouldn't return."
/user_details?userid=sq7-V6JivL4bPtPQADDhdQ,Allison V.,"Saratoga County, NY",2 star rating,"Cool selection of drinks and the shooters/shots menu has some great options, but terrible service. Asked for water twice before getting it, and once we got our drinks I didn't see our waitress for over half an hour.Also, place is kind of dirty. There was a bug floating in my boyfriends drink and the wall area we were seated next to was really dusty. Yummy drinks but I won't be back. Ps. I'm writing this review while waiting for the check from our waitress but she hasn't even looked in our direction for more than 45 minutes!"
/user_details?userid=lGbru0gCkmWWU49PGoEegQ,Dorian M.,"Manhattan, NY",5 star rating,"Today, the stars were aligned... a mixture of a long walk and some rain led me to this gem in Montreal.  How's the food? I have no idea. It's all about beers and service here!  Search craft beer in Montreal and this place is bound to pop up on some top 5, top 10 list. The atmosphere is conversational loud with some tunes in the background...basically positive :).  A must visit on your tour of Montreal and your tour of craft beer. Great selection of beers, including this (pic on the check-in) Session IPA."
/user_details?userid=Z-UeczA0tAcoEHldEJQY-w,Larissa P.,"Salem, NH",4 star rating,"We had dinner here because it was in the vicinity of our hotel and had decent yelp reviews. They didn't have a menu posted outside, so when we arrived we asked to see one before being seated. The person that greeted us came off as a bit rude, but we overlooked it and good thing we did. The food was fantastic as was the beer! I had a scotch ale which was delicious. For food we had the Brewers nachos, classic poutine, and onion rings. The nachos are huge and loaded with toppings. The onion rings were good, but not amazing. Poutine was so good and just what I was looking for. Our waiter was very nice and totally made up for our initial reception. All in all, a great place for a beer and some food."
/user_details?userid=DLRx9eeSPzOb7QRImcbTTQ,Sean B.,"Mather, CA",5 star rating,"This place is SOLID!!!  Great beer selection on tap and in bottles.  Food was far above standard pub grub.  If you are in Montreal, you need to check this place out, they love beer, they love food, and they super friendly."
/user_details?userid=fM9LC2P8jQrQGGsXKccLQw,Anita T.,"Toronto, Canada",3 star rating,"Just as most of the reviews have mentioned, I also have mixed feelings for this place. Plus I'm not a big fan of beer so maybe this review is even irrelevant. Oh well. Me and my boyfriend stayed at the hotel that was two stores down (well over the strip club...) so we decided to stop here for a couple of drinks. The patio looked promising, but full so we opted for an inside seat. Sooo we found out it's not really a place for couples .. Or talking inside. It's quite loud, but hey it's a pub right? It's supposed to be loud. The service is a bit slow, even though our server was really nice. The drinks are definitely worth the price (~$6.50 for a Caesar, $7 for a pint) but it's hard to keep a conversation and the atmosphere inside the pub isn't too great. I think it would be a place to stop by again if the patio was open and we would just want a quick drink, but you're really not missing anything here."
/user_details?userid=kI8IQx34JjZCbgvR8DCj5w,Francis M.,"Montreal, Canada",5 star rating,"I really like this place. It may not be the ""best"" in any specific categories, but it's definitely a safe choice. Very well located, and big enough that you will usually find a place on most night.Their main feature is that they have over 40 beers on tap. Some beers come and go from the menu, and it happens sometimes that they run out of some of the beers on the menu. Prices are varied depending on the beers, but overall not expensive unless you want to try some of the special stuff, like the Russian Porter at 11,9% that's 10$ a glass.Their regular food is okay, but the stuff in the ""Collection Trappiste"" are decadent."
/user_details?userid=hN03Wim4nDQ-824277aEsQ,Tyler L.,"Wanaque, NJ",4 star rating,"Le Saint Bock, a brewpub in the northwest end of Montreal is one of the most comfy bars in the city. It gets very crowded at night, and even though tables are packed in pretty tight, we had to wait 15 minutes or so for a table. The beer list is huge with nearly 50 beers, most of which are brewed by them. These beers were excellent from a roasty marshmallow porter which was a bit sweet for me (though it did come with a marshmallow on the side which was cool) to an incredible Belgian trippel that was crisp and clove accented in a fantastic way. The menu is shown on tv screens throughout, just underneath the screens that show hockey whenever it is on. When the Canadiens are playing, they even ring a bell behind the bar for each goal which was fun. The food was pretty good as well. The poutine was made with very tasty fries and melty gooey cheese curd in a succulent thick gravy. The burger was one of the best I've had, surpassing Shake Shack and up there with Black Tap. The meat was incredibly tender and succulent and perfectly cooked. The flatbread mini pizza with pulled pork made with the beer was awesome as well. Service was good, though a little inattentive and had to be called over a few times."
/user_details?userid=0Y6T9NMKgps3WKhFhDnzhQ,Marisa S.,"Henryville, IN",4 star rating,"A wonderful beer selection! We did not eat, but the food looked good. The staff was courteous and helpful. Clientele was a mixture of young and old, and seemed to include both tourists and locals. A very enjoyable evening."
/user_details?userid=uwlJRTzIlqMgc_Cpm2m2BQ,Lauren H.,"Atlanta, GA",4 star rating,"5 stars for beer - amazing selection, knowledgeable staff, and an ever rotating list of over 40 beers on draft. A beer lovers heaven! Also they have a beer bible of their bottles to top it all off! I loved their collaborations as well as their house beers - they were top notch. I only gave them four stars tho because unless you're sitting at the bar the service was slow and or non-existent. Also their food was good, but not the best we had in Montreal. Expect upscale but more bar food than gourmet meal (even though they have more gourmet items). We went several times during our trip for drinks and were never disappointed."
/user_details?userid=G7aVNhrUo1ljbYSoLkMRRQ,John B.,"Nashville, TN",4 star rating,"I've been back a a few times lately, and have decided to give them a boost. The service has improved, which is a big plus in my book. They've also featured some pretty cool specialty beers this fall. Worth checking out."
/user_details?userid=HOB6E9IWDdUtWJzFYUOj3A,Nina N.,"New York, NY",5 star rating,Great bar with decent prices. Love their pints and they have a great selection of beer.
/user_details?userid=wwnOG4UviDks7M2BUgE_vg,Dave C.,"Châteauguay, Canada",4 star rating,"This is a reasonably priced beer meca!  Forget Biermarket. Le St Bock has everything that you haven't tried but should have. I didn't really eat here, I'll save that for a later review.  You need to come here if you like beer. Also it's Anglo friendly."
/user_details?userid=tlZ3GAIVMtg53AS6_Pxc6A,Matthew V.,"New York, NY",5 star rating,Came here with a few friends as part of the Montreal craft beer tour back in August.  This place has a wide selection of craft beer and the westmalle double poutine was delicious.  Seriously one of the best craft beer bars in Montreal.  I highly recommend this place if you're in the area.
/user_details?userid=swx0FJkZWb6nVP58ZsMl7w,Meng Z.,"Toronto, Canada",4 star rating,I can't believe I did not know about this place earlier! They have a great beer selection with some playful touches on their beers. We came here quite late at night on Friday and got seated immediate on the patio. The four of us got a large nachos to share (nothing special to the nachos in my opinion) as well as a pint of beer each. I tried the creamsicle which was a place ale and tasted surprisingly like creamsicle! a strong organic undertone and a creamy after taste. Prices for the beers are reasonable as well !
/user_details?userid=NaW6r6e2dwXSv5qLrL7ZkQ,Stephen Y.,"Montreal, Canada",4 star rating,"Cozy and with a long list of beers to choose from, Le Saint Bock is an awesome place to hang out with a close friend or a whole bunch of them. Service, when it's busy, leaves a little to be desired as it took awhile for someone to take our order, but the beer arrives quickly and they check up on you often enough.I'm a big fan of stouts and brown ales and I highly recommend the Gargouille brown ale and the Odysée stout.Cheers!"
/user_details?userid=kVfQeyNGz2QBNwAHRy7ihw,Tim N.,"Ottawa, Canada",4 star rating,My wife and I were looking for a lunch time sports bar in Montrèal to watch the last Ottawa Senators game against Philadelphia. We found Le Saint Bock and this place rocked. 42 beers on tap and the food was excellent!
/user_details?userid=ezW02HA5b_tIBZxN76wXOA,Steven H.,"Chicago, IL",5 star rating,The food is good. The risotto was surprisingly good for a pub. Fantastic beer.
/user_details?userid=BUWgBHjzd5c1iWvmLsgw4A,Ann E.,"Londonderry, NH",4 star rating,"Love this brew pub. We enjoy trying all of their beer. Sat outside on the patio yesterday-absolutely delightful. Also, had the nachos which may have been the best we ever had. Do not pass up this gem."
/user_details?userid=FuZbv8M72c6uqJqcmKOhDg,Jaison E.,"West Orange, NJ",5 star rating,"Nice pub. I had drinks and dinner with my boss and coworkers while traveling in Montreal. Great location.The bartender was friendly and when we had dinner,  I swear that it was the Best Steak Ever!"
/user_details?userid=nS-BJHUSI-9Zft8MMWeEBQ,Alan W.,"McHenry, IL",5 star rating,"Thank you Yelp. Popped in after the hotel, poutine is good and 16 of their own beers + another 16 more and a nice flight of beers to choose from"
/user_details?userid=E7IFhaydao4bjazTSX1hBQ,Christina G.,"The Heights, Houston, TX",4 star rating,This place was so much fun. The beer selection was great and the server had accurate recommendations. The burger was a bust but the fries were good. We went the night of a big hockey game and they did shot specials every time the team scored. Made for a fun and boozy night.
/user_details?userid=6agmDWsBMxZBc6qDSZworg,Kris U.,"Austin, TX",4 star rating,"Of the three stops on our Montreal Brewpub Experience tour, this spot in the Latin Quarter was my favorite.  They have draft offerings from local breweries and some unique selections, such as a smoky porter, for us to try.  They also served up fabulous brie in a maple sauce with candied walnuts.  Be sure to look up and check out the interesting lighting fixtures, and peruse the beer ""wall of fame""."
/user_details?userid=CmaKvkgoyWxTloLPL2xkNw,Hugo C.,"Toronto, Canada",5 star rating,"Excellent craft beer selection. A wonderful variety of international exotics, essential domestics, and unique local brews.The food was really good too. The mac and cheese was rich and flavourful. Every bite felt better than the last.The poutine.... MMM!!! I ordered the classic poutine (forget the name but it incorporates beer into the recipe). I was impressed by the quality of the cheese curds. Beautiful appearance, and great flavour and chew. The gravy was also well balanced and didn't taste overpowering as some Toronto style poutines tend to be.Service was solid. No complaints.Overall a great way to experience a Montreal brewpub, and excellent poutine that lives up to the city's hype.  I highly recommend for both the overall quality as well as the atmosphere."
/user_details?userid=P5uRLwVRpv8OGv1eEvpvhQ,Natalie H.,"Mississauga, Canada",4 star rating,"Love the layout, looks very inviting. Great menu system inside for the 44 beer choices! Nice edited food choices with a mix of gastropub and pub options. Had the tartare really enjoyed it and two saisons Parc and a Rhubarb one. Good if a tad slow service.  Great place if you like to try beer."
/user_details?userid=T-4jMCwgOr2Gi22tHPTJyQ,Wade V.,"Montreal, Canada",5 star rating,"First off anyone who knows me, knows I like a good pint of beer or 3, I even get specialty beers for my B-Day and Christmas.  Well the Saint Bock is going to have me working for a few years trying to get through their massive menu of specialty beers.  Alot of them are Belgium, but hell the Belgiums do great beer, my favorite of the night was a French beer called ""page 24"" If memory serves me right it came in a blond, amber and possibly a dark.... but I only had 2.  At 10.00 a bottle it's not cheap, but you get what you pay for.As for the staff, awesome.  I felt like we had a wine sommelier, but for beer.  He made great suggestions based on what we liked in terms of day to day beers.  The food was pub food but very good and well priced.  The ambiance was great, and the music was not too loud.  It often bugs me when you go somewhere with a group of friends and we all have to shout in each others ears because the bar has the music cranked up.all in all a big thumbs up..."
/user_details?userid=HyXNQZjrEkKjyWWB0GugmQ,Jeanpaul C.,"Washington, DC",4 star rating,"The Saint-Bock is great. I am not a big beer fan but even this places had me pulling taps. They have a beer bible which is actually a bound book if that can give you an idea of how many beers that they have. Though we did not eat all I hear about during our entire visit from other patrons was, of course, about the Poutine. Their Poutine selection is pretty incredible and if Poutine is your thing than this is your jam. The one thing to bear in mind is that they do a lot of groups of large beer tastings so if you don't want the loud chatter during one of these days you may want to enjoy time out on their patio. The service was great and for a non-beer drinker the beer selection and beer was terrific."
/user_details?userid=r64205M8WHgSJlbrzgqLgw,Joanne P.,"New Westminster, Canada",5 star rating,Good Beer and bacon and cheese popcorn our bartender is great our bartender Vincent is fabulous so friendly and funny and very informative about the beer selection love this place to bad we have to fly home to Vancouver today wish we had discovered it a few days ago
/user_details?userid=Dvrr88xmhrcqtgU1LgPLZw,Leilani D.,"Denver, CO",5 star rating,"One thing I noticed about all of the establishments in montreal is that in general they are woefully understaffed. So let me open with the disclaimer that we came in when the place was first opening up and by the time we left the place had filled up and the service had slowed down.That being said, the service overall was still very friendly, knowledgeable, and efficient enough.What everyone says about the beers are true - they have 20+ really unique interesting brews on tap, several of them their own bock brand. The server helped us pick out a few and all were excellent and fairly priced (especially considering the quality).I found the food offered here to be simple, but really well done  - we ordered a baked Brie with sun dried tomato pesto that was to die for (doesn't sound simple but baked Brie seems to be a common menu item) and I had a really tasty chicken and goat cheese sandwich. Both the fries and the garden salad that accompanied it were also pretty good.Overall we had a fantastic lunch here - great beer, food, and service."
/user_details?userid=hynDwqElXtwnmCUirgsUWg,Amanda S.,"Clermont, FL",5 star rating,"Great food and lots of selections for drinks! A wide variety of items on the menu, including most of the things you'd find at a bar in the US. The menu clearly posted the prices for alcoholic drinks - which was a welcome change. They got us seated quickly even on a busy day after the Formula 1 Grand Prix. Food came out quicker than I expected and was very tasty."
/user_details?userid=4RtRSK_6SX49u76bMvdZ0A,Nicole P.,"Bloomfield, CT",5 star rating,The most outstanding craft beer selection in Montreal. Love the religious theme; the staff are extremely helpful in selecting a quality beer that suits your taste; and their 70s music playlist is the stuff of sing-along dreams. Do not miss this hotspot in the Latin Quarter!
/user_details?userid=K2GDNstHWzUx8mHMt8VPwQ,Laura F.,"Baltimore, MD",4 star rating,"I'm not a big beer drinker- or as they say in Montreal, biere- but when I come to a place like this, I say ""when in Rome"" (or in this case, Montreal).Anyway, overwhelmingly impressive selection of beers on tap and in bottles, many of which I've never heard of before.  Staff are very friendly, and the bar itself is cozy and cute, offering tables, barstools and couches as seating options.Admittedly, my French is nowhere near good enough to understand what was on the menu, and I was too embarrassed to ask.  So we went with the one menu item we recognized- Pizza.  It wasn't great, but we were hungry and it went well with the beer.  I had the Purgatoire IPA for the first, and then moved to the Double Nelson.  That one was so delicious that I mentioned to the server how much I liked it.  It turned out to be one of his favorites as well, as he smiled and responded, ""it's pretty interesting,eh?""Oh, Canada."
/user_details?userid=Nnz2QtnXOfPxvHO95oAYXQ,Jenna M.,"Philadelphia, PA",1 star rating,"We made a special trek out here for Montreal's supposed best brew pup, only to be told: children not allowed. Maybe it's a cultural difference, since in my hometown (Philly) the slow, 5-6pm hours are when urban parents like me bring our well-managed kids with us to brewpubs to enjoy a pint and a meal with friends. It's pretty shocking to be told you aren't welcome in an establishment."
/user_details?userid=NZfuLlP0I87gQGVWNFUFRA,Christina R.,"Mississauga, Canada",5 star rating,"I love this place for beer, and this is where I first sipped on Dominus triple about 3 years ago. when I came by last week unfortunately they didn't have the ""book"" drink menu anymore, *whomp whomp* but did have one bottle of Dominus double in the fridge when I asked! whoohoo!!! thanks to the bartender for finding that for me, and for another bartender recommending some great beers to try the second time around. will be back. thanks for not hating on the English speakers of the country :)"
/user_details?userid=0TJ01iwzVLXtr_EYcfqoWQ,Offer R.,"Le Plateau-Mont-Royal, Canada",4 star rating,"Good beer, and good food. Hard to get a table, service mediocre, but not bad enough to boycott the place :) In the summer, sitting on the terrace is highly recommended!"
/user_details?userid=H0gVSvuL8iUGIAqNfHhl9w,Erin H.,"Montreal, Canada",4 star rating,"20 different kinds of craft brewed beer on tap - need I say more? Le Saint Bock is a great choice for a night out with friends and one of the best options in le quartier latin. The ambience is dark and cozy, the music hip and the beer is plentiful. Food is your standard pub-fare so it is hard to go too wrong.If you are solo or a duo, grab a spot at the bar if you can. One of my favourite rainy day activities is to sit here and sample several of the delicious brews on offer."
/user_details?userid=qF0zZHtqaMbFF3UePDCaHg,Emily-Anne P.,"Edmonton, Canada",4 star rating,"I am a huge fan of Montreal brewpubs, any really, ranging from hole in the wall to the bigger more established ones and I have to say this has to be one of my favourites in the hood. They have a big patio, which in the summer is perfect and inside isn't too bad too. They have a huge selection of beer, a number of beers they brew themselves and then they bring a few in too.I had everything hoppy they had on tap and I loved every bit of it. Their beers are really good and the service is great.  I'm a fan."
