user_url,user_name,user_city,user_rating,user_review
/user_details?userid=oHnSznYNayUkSQ4Cy_6PbQ,Brian E.,"Arlington, VA",5 star rating,"My girlfriend and I were searching out places with good beer, and found our way here one evening.  However, part of that was because Yelp lists it under ""Bars, Brasseries, Steakhouses"".  First, and foremost, it's not a steakhouse.  Unless you count hamburgers as steak, I didn't see any steak on the menu.  This isn't a negative take on Le Saint-Bock, but rather Yelp. We sat down at the bar, and had a number of beers from their long list.  A few of their own brews, as well as a few Belgians.  Having Duchesse de Bourgogne on tap is unusual for many bars. . . they had two different ""vintages"" of it (2016, and 2014).  I had both, though honestly I couldn't tell what the difference was, just that there was a difference.  Either way, everything they had on tap looked good (except for kombucha. . . that just doesn't sound like something I want).  We had some nachos, and a bowl of French onion soup.  Both were good.  The bar staff was friendly, and seemed to answer peoples questions about the beers happily.  They were happy to speak in English for us since our French is horrible/non-existent (we were happy about this, since it seemed that almost everyone there was speaking French).Overall, a great experience with a very good beer selection."
/user_details?userid=AY0JAXaho8caEg3TnIkkJA,Xanthia R.,"CA, CA",4 star rating,"A really fun place for pints with the bonus of food. I wasn't super impressed with my veg poutine, but eh, the cider made up for it.Service was great and the beer menu is pretty big.  My husband fell in love with Sweet Jesus. We now have a problem ;)"
/user_details?userid=6zsuSuLEwhUNHEWSDJqt-Q,Rohit A.,"Brampton, Canada",4 star rating,"At any given time they have more than fifty beer on tap(I'm not kidding) to choose from, a lot of which are their home brews. They also have a book with over 800 beer imports to choose from if none of the draughts are to your liking or if you're after something very specific.Pretty decent cocktails menu if beer is not your thing. A lot of options for food as well which is much more than you would expect. The place is very crowded at most times, so please expect to wait for a few minutes to get a table and be patient knowing that the wait staff is trying to serve each of their patrons to the best of their ability. Go, visit and enjoy."
/user_details?userid=kBAzprZlkPeEGNCjc8mpCQ,Georgia F.,"Mississauga, Canada",2 star rating,"I don't get the hype I heard about this place. Yes, the beer list was extensive and the beer/cider delicious, but that doesn't make up for the shortcomings.Our server, who was lovely, had clearly been handed too large a section for a busy Saturday(the place was packed) because it took nearly 20mins for someone to bring us menus, and a further 15 to actually meet our server. Then once we ordered food, a 45+ minute wait for  it to arrive, so we had finished our drinks. Our second round never came, I'm assuming the server forgot. Food was fine, but for a wait that long it better be fantastic. My burger was so well done I probably could have played hockey with it, but the poutine on the side was good. My friend enjoyed her mac and cheese, but we  both agreed the wait was just too long and the food nothing special.It's a shame, we were excited to go here."
/user_details?userid=R5rc_-cUAhmS-pIVbXpMiA,Kathy S.,"Montreal, Canada",3 star rating,"Really loud - service was slow (but it was packed to the rim) - mostly UQAM crowd. I was hoping the burgers would have saved the night - although they were tasty (the beef was really fresh, so were the ingredients) it was quite on the dry side. The fries were homemade, and the beer selection is crazy extensive (and reasonable in prices) I found the burger/fries price a little much (16$). Might be good on a slow Monday or Tuesday night, but for two people, we had to shout to be heard. Might go back with a group but only for a few drinks"
/user_details?userid=tUr7Uefr9I1v2s5zoa5nwQ,Elyann Q.,"Montreal, Canada",5 star rating,"Great beer selection, 44 on tap! Great music and great service! Really amazing staff!"
/user_details?userid=NoZVoxs41Ra2tHyGYcWk7g,Kylie M.,"Chicago, IL",5 star rating,"Great design, easy accommodations, relaxed time, my top three descriptions. It's easy to feel right at home here. The variety will keep you enthused. Was amused they had beers back in my states translated in french, ie. Two brothers : deux freres. service is superb, nobody staring at their phones here while you are seeking to order. Friendly anglais/francaise ambience.Everyone should try this place at least once. Thanks saint bock!"
/user_details?userid=VjUx2MnbWJGV1-5eXoPNqQ,CH K.,"Austin, TX",5 star rating,"Amazing and vast offerings of beers and ciders. Knowledgeable wait staff. We went early when they opened and the bartender expertly created flights for everyone in our group based on individual tastes and likes of beers we regularly drink. Most of the products were Quebecois, and several we're from craft breweries in Montreal. Make sure you have a flashlight app on your phone as it's dark in here even during the day. If you launch the restaurants website, there is an up to date listing of every beer they have on tap. Will definitely go back."
/user_details?userid=6KfDQ5HVf74-Mn1OofJFUA,P R.,"Toronto, Canada",4 star rating,"Great selection of beers (about 40 on the blackboard menu) and decent smoked meat poutine. However, the gravy was way too salty, which made it less enjoyable the more I ate. Great location on St.Denis, and seemed to be busy/popular, especially because they have a nice patio area with plenty of seating. Would be great in the evening too, when the music gets louder. Would come back for sure!"
/user_details?userid=037RDNFEAoJpaWnW9au7ag,Alan M.,"Etobicoke, Toronto, Canada",1 star rating,"TERRIBLE SERVICE!!I live in Ontario, but visit Montreal often for work.  As a result, I have been practicing on improving my high school French.  This weekend my wife and I came for a long weekend getaway and started exploring the city.  I enjoy my craft beer, so I did some digging and Le Saint Bock came up with a pretty good rating.  I read the reviews here ahead of time and looked past the ""poor service"" comments and thought with my conversational French, that it would be fine.  We sat down, it was a loud, busy atmosphere. The waitress approached us and placed some menus on the table.  I greeted her in French, and she asked if we wanted water.  I asked her to repeat herself, and she picked up that we weren't native French speakers.  She asked, ""English?"", to which we replied ""Yes"".  She then PICKED UP THE MENUS SHE HAD JUST PLACED ON THE TABLE, murmured some to herself, and put them back where she found them.  Came back over, TURNED HER BACK TO US and took the order of the table next to us.We left immediately.  I have never experienced such disrespect from wait service.  I know how to travel.  I know that if you are in a city where your native tongue is not spoken, attempting to speak the local language goes a long way.  This we tried and STILL we were disrespected.  Montreal thrives on tourism.  UNBELIEVABLE! But not to worry, we went down the street to L'Amère A Boire and had amazing poutine-fondue and home brews that were excellent (and a cask brew too!).VOTE WITH YOUR WALLET!  Le Saint Bock does not respect their clients, otherwise, they would have taken action on this waitress who has repeatedly been identified as rude and prejudice."
/user_details?userid=js2Jy7YMFNCyhJhGoV4Rcg,Scott M.,"Oswego, IL",3 star rating,"In here with my pal Marine Lacoste, the keyboard player from Uncle Kracker, and my Francophone Passepartout Beno, who used to squire me about when I came up here to do my ""chien et poney"" show for Hammond.Nominally a beer showcase, the food is featured as well. I opted for a number of appetizers-as-tapas to go with the beer. I love Olives, and they were featured. They came warm, which was a surprise, with some seasonings and a few other veggie things. Delicious! I also swung with a Beef Tartare which is hard to find in the USA, due to culinary paranoia. Surprise! I survived. (and it was yummy). I also was advised to get the Poutine, which is a big deal up here. Fries with cheese curds and brown gravy. I'm neither a fan of Fries nor brown gravy, and My folks used to live withing a mile of a deep rural cheesemonger in Wisconsin who made excellent Curds. Sorry, Cher, I can live without Poutine.I had three different Beers, all excellent. Don't remember their names....The company/conversation was better than the food, but still not bad at all..."
/user_details?userid=rNjCwG4nAMba2K6K1Pl2xw,G C.,"Englishtown, NJ",5 star rating,I would give them a 5 for beer and a 1 for food.  Just come for beer but eat elsewhere...burnt nachos etc...
/user_details?userid=cMET82t9sXgLaQpQf5TWmQ,Kathy C.,"Saint-Lambert, Canada",3 star rating,"Best. Piña. Colada. Ever. I don't drink beer so I have no comments about that.The food is pretty good. I give this place only 3 stars because it's not big enough. If you do get a seat, it's very right and crowded."
/user_details?userid=1Y0zsJSfWLkfDylH0X1yNQ,Kelly O.,"Boston, MA",3 star rating,"This place has an amaaaazing selection of beer, especially their vast selection of unique and well-made house beers (coconut porter whaaaat). The food isn't bad either (try the pulled pork poutine made with beer gravy). But minus stars for the crappy service- we waited forever to be served by an unattentive and uninterested waitress, and one of our entrees was completely forgotten about to boot with zero apology or explanation. Maybe service would be better at an off-peak time, because the beer is definitely worth checking out..."
/user_details?userid=Xv6b0KDoRtEewM9ckGNAmA,David C.,"Le Plateau-Mont-Royal, Montreal, Canada",1 star rating,"Never got service, so we just left.Not enough veggie items on the menu.Hey Yelp, there is nothing more to say here so just post the review and stop asking for more text."
/user_details?userid=41kMyI1BfOTyIIAenUSaTQ,D'Arcy L.,"Terrebonne, Canada",3 star rating,"Artisanal beer hall with 44 beers on the menu. Some you could order in pint size, others not? I guess because some are do e larger batch vs smaller batch. Here at SB there is an interesting concept for ordering beer. They have an electronic menu board AKA- McDonald's or Tim Hortons that rolls through the different beers. Not really my favourite way as you have to read quickly through the list of ten beers then the page changes. Sure it comes back but I'd declare by conception it was a great idea by utility and functionality it's a bit cumbersome. Maybe I just need more time to peruse a menu. Pints selected were fresh and tasty. No complaints here. We had a table halfway out to the terrace (halfway inside) and my complaint here is that there are way too many tables jammed into a tight space. Just watching the server navigate through the tables made me think ""good lord he's going to dump his tray full of pints on some poor person"". It didn't happen but tables are squeezed in to the max here. Vibe of the place was a bit sterile. We had one pint each and moved on to our next place."
/user_details?userid=KlAHrJAzAKkurClpvO821A,Joe M.,"Yarmouth, ME",4 star rating,"Enjoyed dinner and a few drinks here while watching a Canadians hockey game. Food was good, service attentive, and a decent beer selection   Menu has a good variety. This was a fun place to take in the game with friends."
/user_details?userid=CNBqZtLqUKs5YD0Mkq654A,Lilly S.,"San Diego, CA",5 star rating,Knowledgeable staff. Phenomenal beer list and great food. Highly recommend.
/user_details?userid=PmoyuES2OmZTRPFTRjVCtg,Tom S.,"Lynn, MA",5 star rating,"One of the coolest breweries that I've ever been to!  The staff was really friendly and the beer list is massive.  They brew many of their own beers but they also carry some beers from different brewers.  Their beer list is called the ""Bible,"" which is kind of cool.  We didn't eat but the food did look really good.I absolutely recommend this to anyone who loves beer!"
/user_details?userid=eL8VdX4tyDr5zHWSahbtuQ,Courtney N.,"Wakefield, MA",3 star rating,"Fantastic beer selection! The Kunta Kong was a dark saison that was so good. Malediction was pretty good and the fuzzy navel had a nice amount of alcohol. Be prepared to be crowded and loud. This appears to be a stop on a beer tour and they had several tables full of people learning and drinking. Did I mention it was loud? I could barely hear across my little table. I think you're going for the experience and the amazing beers on tap and not for a quiet dining experience if you stop in here. Menu was okay. We tried a small poutine with smoked meats and some sort of beer gravy. It was just okay. I get the feeling the food is an after thought so a lot of the items are just okay while the real stars are the beers. Our waitress was nice, and the prices were fine so we would return."
/user_details?userid=Y_h-nrOIIZWBF-AFzdQbgQ,Matthew P.,"Laval, Canada",3 star rating,Worth coming for the beers lots of choices. Some of them I didn't like the sour beers to me were just bad the mango was alright really liked one of there reds don't the number . The burger was not the greatest but I liked it . Stay away from the calmer it was one of the worst I ever had in my life it's kind of funny how bad it was but not because I still payed for it. Over all worth trying there different beers .
/user_details?userid=jINooQ6E8k79LgN-2-Lwgg,V V.,"Brooklyn, NY",2 star rating,"Two stars just for the dope IPAs and lagers, and selection in general. The service is great. The ambience? Well that's just spectacular. HOW CAN YOU NOT HAVE GUAC FOR THOSE AWESOME NACHOS? BYOA- bring your own avocado."
/user_details?userid=1NMwPReWhtvyVoZ592vIBw,Jay P.,"Roswell, GA",2 star rating,"It was just okay. For a decent late night (10pm) burger spot. I was disappointed that I asked for a medium cooked burger and it was beyond well done. The bread was super toasted and the fries were plain and blah. The service was just okay, wasn't very memorable. I would try another restaurant on that street before I come back. But with few options this place fits the bill."
/user_details?userid=kwfobAMMN9-5JSxp35F7mA,Asmaa H.,"Oakville, Canada",4 star rating,"Almost nonexistent service -- had to hunt down a server after waiting 15 mins at a table. My friends ordered beer and it took quite a while to arrive. The food was hit or miss -- the Mac and cheese was underwhelming, the fish and chips were standard (read: good), the poutine was better than most, but the true star was the corn dogs with a curry ketchup -- it is he ONLY reason for such a high star rating. Worth going back just for them!"
/user_details?userid=ou7z4su1Hd89zUYwp7YnTg,Nicole G.,"Houston, TX",5 star rating,"This was around the corner from where we were staying while visiting Montreal, and it was one of our favorite spots. It's a rather modern, but also a cozy and busy place to grab a beer and possibly watch some hockey. There's a wonderful selection which can be seen on the screens or online, and the servers are really knowledgeable if you want to match it with your food or try a specific type or brewery. As far as food, the mac and cheese is delicious (and pretty generous!),there's a great poutine selection, and I thought the fish and chips were pretty solid too. Nice staff and a busy area to explore afterwards."
/user_details?userid=UDFIZXP0kOb2xKoYToTS6w,Julia D.,"Montreal, Canada",4 star rating,"Brew pubs are starting to grow on me more and more.  I was never the biggest beer drinker but as I slowly check out more places like Le Saint Bock I start to change my mind.  They have a very good selection of beers.  I went with a hibiscus beer which was ideal for a summer day.  It is a tad on the expensive side and you're not saving much if you opt for a glass instead of pint.  I also had a cider which was thoroughly enjoyable.Foodwise you can expect your typical bar food (burgers, nachos, pizzas).  I opted for a classic bacon cheeseburger which was huge and the meat was very juicy.  The fries too were seasoned and crispy.  Prices for food are in line with what you get as the portion was quite reasonable.  The service was a bit on the slow side.  It took time just to get our drinks which was a little frustrating however I did like it here.  They have a terrasse which is right on Saint Denis and a wonderful spot to people watch in summer time although it does fill up quickly.  Food and drink were also winners."
/user_details?userid=HPxLcTHZqhD6hRKVpSPGbg,Marguerite L.,"Montreal, Canada",5 star rating,"I'm surprised I haven't given any review on this place yet. It's one of my favs micro-brewery! The food is good enough, but this is one of THE beer place to go to. You get plenty of choices of beers. Try their malédiction with a marshmallow (or two!), if you like dark beer ;)"
/user_details?userid=_OyjH4D0dxU3l3CX7bKtUQ,Jessica J.,"Miami, FL",5 star rating,"Delicious chicken wings, home cut fries and a wide selection of beers. Our waitress was super nice, a kick-back and relax kind of establishment. The music playing was a variety of 90's hip-hop and R&B."
/user_details?userid=1G60jrILPeXz1eKwUZrn3w,Emma A.,"Denton, TX",4 star rating,"This place was great to hang out and watch a hockey game. It looked packed when we walked up, but it was just that everyone sat outside so the inside was nice and open. It's a nice, modern looking place and the beers are pretty good. The poutine with onions and ground beef was really good but more like American chili fries than poutine. The bathrooms though....for such a nice looking place, those are some scary nasty bathrooms. Also they are down a flight of stairs that looks like you'll get murdered. I took off a star literally just for the bathrooms traumatizing me."
/user_details?userid=HMQYQHcBiLM8JM36q3q5QQ,Cassandra S.,"Stamford, CT",5 star rating,"Liked this place so much that we actually made this our ""regular"" and came back every day on our week long trip.  It gets busy so literally the only possible negative would be that it's sometimes hard to get a table outside.The beer selection was fabulous and so was the poutine. The beer they brewed themselves was awesome and some of the best we tried in the city (we tried over 50 individual beers) and their selection of outside beers was incredible. We had all the poutines except the Calabria sausage one and each one was better than the next. The fried sausage appetizer got ordered accidentally because of the language barrier... but what a happy accident! Nothing I would have ever voluntarily ordered myself but it was delicious! The nacho dishes were pretty awesome too for bar food. I would definitely recommend the poutine with carrots and meat, that was my personal favorite- I believe that was the Duvel one, but literally any one you order will be outstanding. This was my favorite bar in the city- it's an Untappd user's Montreal dream."
/user_details?userid=q2lAEmQQvd8VOX85leB2gA,Emily C.,"Manhattan, NY",4 star rating,"My BF and I went for an early dinner after his friend recommended this place. We were able to enjoy the nice outdoor patio since it was a sunny afternoon. We both got flights with (1, 3, 9, 12, 15, 18, 36, 38 .... see attached photos). 1 was easily our favorite!!! The fish and chips were mediocre, this place is better for beer than for food. The waitstaff was not the friendliest but it was a crowded afternoon so they were probably stressed. Huge beer selection!"
/user_details?userid=GgWHCWrqoNM-o0ZyMWfloQ,Jeremy H.,"Atlanta, GA",4 star rating,"Excellent beer selection - we ended up coming back here almost every day on our Montreal visit because there were over 40 great beers on draft. The staff was helpful in picking out beers, and they have a nice selection of local, regional, and international craft beers. They also make their own beers, which were quite good, diverse, and affordable.The environment is upscale bar - pretty modern feel. Food was just ok - I had the poutine...it was far from the best food I had in Montreal but serviceable if you want some bar food or a snack. The service was pretty good when we sat at the bar, but one night we got a table and waited forever anytime we were looking for our waitress. Granted it was F1 weekend and they were busy, but alas the service was slow.Definitely recommend stopping in here if you're looking for a good craft beer spot in Montreal."
/user_details?userid=tIGkY5_JydVHe7BkYyAE0A,Dalton L.,"Portland, ME",4 star rating,Very extensive beer selection which was easier to browse on their website. The atmosphere was warm and exciting with friendly service too. A must-visit if looking for a myriad of draft beer options.
/user_details?userid=vYRjDSefr7twKDCDpOVJ_g,Michael C.,"Manchester, CT",5 star rating,"First time I traveled to Montreal and I just have to say, it's an amazing city. The folks are great and friendly. This bar is located on a prime street where there's great night life. They have one of the leathery collection of beer on tap. I went with a group for a pub crawl where hit up a few other nearby bars and sampled their popular beer selections. Would definitely come back again in the future."
/user_details?userid=cvBW7RDkXHG0Z0wZMx6tkg,Pierre-Yves B.,"Montreal, Canada",4 star rating,"Beers: 6/5. Their beer bible has a lot of great choices. $1 shots on some occasions.Service: 4/5. Good advices. Be patient on busy nights.Food: 3.5/5. Pricey. Poutines are disappointing (we ordered the braised beef ones, they were too dry and came with a single slice of carrot). Burgers are great!"
/user_details?userid=lD4HStgxvpZtTCod34rZrQ,Val L.,"Montreal, Canada",2 star rating,"This place only gets stars for the wide selections of beer and the food which is pretty good. However every time I've been (hoping it would change) the service was terrible. They don't have enough staff especially if youre on the terrace. Last time we went (and final time), we were sat down by someone and no one came to see us after that for a good 10 minutes. The tables in front of us came in after and got served first. Then the waitress showed up saying the section of the terrace we were in was closed? And instead of saying sorry and looking for another place to sit us, she walked away. So that was the last chance we gave them. Sucks because it's in a great location and the food/beverages are awesome."
/user_details?userid=K27z8C9Lw2WzC8A401sUVQ,S R.,"Chicago, IL",5 star rating,"Beer selection = greatFood = awesomeService = wonderful. I will be back for more poutine, black and red IPAs, and an Oracle (a great beer with a nice finish and a good dessert after a filling meal)."
/user_details?userid=CxDOIDnH8gp9KXzpBHJYXw,Jennifer K.,"Markham, Canada",4 star rating,"Le Saint Bock has over 19 drafts on their white chalk board... what to drink?? I can't think properly when I am too excited, faced with too many choices: local Quebec beers from various microbreweries. I ended up just ordering by numbers... lucky number 17 and 19 at $4.13 each.The low armchairs are quite comfy... and music quite loud... I can only see my friend's mouth moving but cannot hear a thing.....it is quite dark inside too and everyone looks good?! Maybe just a little too much to drink?Waitress is super nice and ask if we need separate checks for our beers??"
/user_details?userid=9KpMzih4E_gEioFtNeuIIw,Jade M.,"New York, NY",4 star rating,Good selection of beers on offer. Do speak to the wait staffs regarding the selection as they are very knowledgable!
/user_details?userid=UVCJhVuSDdwOTovskJdXqA,Bia H.,"Boston, MA",3 star rating,Ok selection of beersI went there for the beers. They had a lot of IPAs and some stouts but that was it. Many beers of just two styles. My beer was ok and the food was ok too.The server was beer friendly and it's a chill restaurant/bar.
/user_details?userid=Iji-ZWAGnnwM5SfTD1EzxA,Lani B.,"Woodstock, GA",5 star rating,"When I chose Montreal for an extended visit, it was partly because of all the great brewery choices. I chose 10 to visit, with no repeats. Well, this one I had to visit again. The food is upscale pub food that is carefully made and very delicious, but I didn't visit a second and third time for the food, it was for the beer and atmosphere.  The beers on tap are amazing. Soooo many choices and all good ones. I had a great time talking to other patrons and all the staff are friendly. Check this brewery out, you will not be disappointed."
/user_details?userid=xtDJJLvipvRkM6ZxY0Fz3Q,Emily A.,"Troy, NY",4 star rating,"Our friends who live in Montreal brought B and I for afternoon day-drinking, and we spent a seriously lovely couple of hours sipping beers and catching up. Their beer list is extensive and they have a lot of different sizes so you can have short pours to try things, or get bigger glasses of stuff you know you like. We liked it so much we came back the following day to escape the rain while we waited for the Distillerie to open. Really friendly service and a clean, comfy interior-- definitely a must-stop when you're in town."
