user_url,user_name,user_city,user_rating,user_review
/user_details?userid=s_ushMFjAYjIvszJW2gOhQ,Jessica E.,"Wilmington, DE",5 star rating,"Le Saint Bock, where have you been all my life?  This bar is fantastic!  It is a Belgian beer drinker's paradise.  They have quite an extensive bottled beer collection from around the world and 20 beers on tap.  The on-tap beers are a combination of their own brews and other local brews.  We tackled the 20 beer sampler and it was well worth it!  Most of the beers were Belgian style, but there were also some IPAs and Stouts.  Everything was delicious.  Also, they have quite an impressive collection of glassware.  (An additional note:  Not everything on their bottle list was in stock.)The decor and atmosphere are very chic as well and the bar chairs are quite cozy.  As is the case with many bars in Montreal, the bar tenders are pretty hands off until you ask for their assistance, but they are genuinely helpful and friendly.  This is a bar that every beer drinker must visit if you are in the area."
/user_details?userid=4BFLt1rOTgvawjm8nkSmtQ,Trevor B.,"Orlando, FL",4 star rating,"Great beer. Very fast wifi , over 50 MB download and over 20 MB upload ! Food was great. We had poutine and nachos."
/user_details?userid=2LptcvhkcFyNXT_NZDPpaQ,Luca M.,"Montreal, Canada",5 star rating,"I come to bars that are named after beer types or play puns on booze for one thing only - beer. The more the merrier. As said by other reviewers, Saint Bock is easy to walk by because neither its entrance nor its street front are flashy in any way, shape or form. You'd be missing out.Le Saint Bock satisfies me wonderfully, with their wide selection of microbrews enticing you through entertaining names and descriptions in languages that sound exotic to most non-snobs. Never having had any of their food, I wouldn't be able to comment. I had the chance to regret not having any. If you're at Saint Bock at 7-ish, stay there and eat: the decent eateries  around the area have line-ups stretching half a block until well past 8pm.Cheers. Or shall I say Prost?"
/user_details?userid=_mct9Muk3vO-4q_6et4WXw,Raymond G.,"Petworth, Washington, DC",4 star rating,"Straightforward and to the point.  Craft beer, in a party atmosphere.  Worth a post dinner beer or a late Saturday afternoon kickoff."
/user_details?userid=7qTDnoA9anaad8o64jkRsA,James R.,"Borås, Sweden",5 star rating,For any from New England... this place has amazing IPA's!!! Don't listen to the Canadians who don't appreciate our style!!!
/user_details?userid=QFHHwLvFBpr2xJlXyVWT5A,Jonathan D.,"Laval, Canada",2 star rating,It's my first time here and im disappointed I order calmar for a enters and I got it after the main meal. The service was okay
/user_details?userid=1652MDlbA0pOtsq7U1Ygow,Clayton V.,"Redmond, WA",4 star rating,"Le Saint Bock  sits humbly on the street, unassuming amidst its surroundings.  It's beer selection is note worthy, the house taps are amazing. A solid Black IPA, a great Rye IPA. Drinkable, clean, and well formed. It's Witte is noteworthy, as it isn't drowned in Coriander like so many of its brethren.Solid pub food, enjoyable when having an afternoon out.Friendly prompt service adds to the ambience here.  It does seem to attract a louder crowd on nights and weekends, but that is much to be expected. During a Sunday Afternoon it tended to be about what one expects of a beer crowd. Also, a wall full of Trappiste, and other craft bottles adds a very nice flair to the establishment. I'll certainly be returning."
/user_details?userid=reJ7c2yq3f8dODMslzODUQ,Eugene K.,"Riverview, FL",2 star rating,"It gets the 2nd star because this place is a beer hall and I didn't go for the brews.I was starving.  The food was bland, took forever, and the waitress was absolutely hopeless.  She was hot, so she probably is one of those who assumes she doesn't have to put effort in.  She brought my drink refill I asked for when I got my meal... AFTER she brought the check.I got a chicken sandwich which sounded great on the menu.The menu probably would have tasted better.Horrible."
/user_details?userid=v1r9TLsmpnUobW4-x85gKg,Aptos K.,"Aptos, CA",4 star rating,Great place for micro brew.  Very busy. Good service.  Lots of smokers on patio but great for people watching and a burger.
/user_details?userid=dWAbLSSeVtQWPw6PeuIqXA,Wales C.,"Montreal, Canada",5 star rating,This is a great spot to discover local beer in Montreal. The ambiance is great and the poutine is on par.
/user_details?userid=UvSYeJnfK0iFWuegma0uvA,Chris B.,"Seattle, WA",5 star rating,I visited with a friend last month.  What an awesome place.  Fantastic selection of beers.  Great food.  Funny bartenders doing shots behind the bar.  I'd be here a lot if I lived in Montreal.
/user_details?userid=k2t-xCELlWanDIBPp5oEyg,Ian M.,"Boston, MA",4 star rating,"Comfortable place with decent prices. They have some great beers on occasion, but their problem is that their menu includes too many beers, so as a result they have a few gems hidden amongst a lot of mediocre beers, and if you don't know in advance which are worth it (likely, since it serves a lot of lesser-known distilleries/beers), you'll likely go through a couple of not-worth-it beers searching for something decent. Patio is nice but way too small and always full."
/user_details?userid=GzXYJ_IkPaiBHYXdt7mMoA,Marcella V.,"Cambridge, MA",4 star rating,Beer selection was good.  Server was attentive but very busy.  Food was ok - the point of the place is really beer.
/user_details?userid=yGPSqnzFfrDKkHpadjPy3g,Tyson L.,"Anaheim, CA",4 star rating,"A very pleasant place to dine and drink on St. Denis.  Their ""St. Denis"" pizza is a very very thin crust, almost flaky type.  With ham and cranberries of all things to top it off with. Cheese is very gooey but in a good way.Thing is, the menu is FRENCH ONLY.  I mean you can kinda make out what youre reading, and the lovely waitress was nice to listen to as she explained the menu in her Quebecois accent.  So not all is lost.Beer menu is pretty cool.  They have their own microbrews along with some other international brews.Price is definitely high.  But kind of expected considering the location."
/user_details?userid=Wu0yySWcHQ5tZ_59HNiamg,WaYnE c.,"Vaughan, Canada",3 star rating,"After a hard days Leisure, nothing is better than a Brew.We strived to visit Local Flavour Brasserie Artisanales.Le Saint Bock is a place that one can spend all night.Classy somewhat chic pub meant for the 25+ crowd. 3.5'dDraft Menu at the Bar was miniscule with semi-poor Lighting.It was chance we sat at the Lounge sections near the Bar.NHL on the Monitors at the Bar keeps you updated on scores.Waitress, while pleasant had unsure descriptions of certain Drafts.Twenty odd Drafts were chalked, majority but not all St. Bock Brews.However if I'm correct, all were Quebec local Microbrewery brands.Decided on the St. Bock Crucifixion (Saison Amber Pale Ale 5.5%)Flavourful easy-drinking Beer that matches the atmosphere in shade.If not for the overly blasting Music, we would have stayed longer."
/user_details?userid=u3zg7aOO4pl9OxEsaLCmDQ,John S.,"South Burlington, VT",4 star rating,"Great beer selection, food was ok (pub food). Very disappointing service, waited forever for server, we were sitting at the bar and the place was empty. I would go back again just for beer."
/user_details?userid=3Vh126tCO2Y_0Vh0YOwHgQ,Eleanor F.,"Boston, MA",5 star rating,"Wandering around Quartier Latin, this is the ONLY bar I was even interested in going inside of. What a great beer selection! We ordered dinner at 1AM and the food was great. My brie veggie sandwich came with salad and fries, and their Saint Bock Porter was awesome! This is literally how I felt when I walked through the Latin Quarter: Punk BarStrip ClubDouch bag BarSports BarThank GOD for St. Bock and it's down to earth crowd, friendly waitresses who didn't mind my butchered french, early 30s crowd that was having a good time but not sloppy, and late night kitchen, and excellent beer selection. St. Bock saved my night."
/user_details?userid=3FDhMd2logLHCJajVLF-9g,Rocco A.,"Brooklyn, NY",4 star rating,"First Impression: Being from New York and a frequent patron to my New York pubs I was excited to visit my first Montreal BrewPub on my first night on Holiday in Montreal. I walked in and enjoyed the vibe as I witnessed many patrons on by the bar stools, lounge areas and seating areas. I also noticed an out door patio that wasn't being used. The establishment was showing the game on their multiple television screens and broadcast the sound as well. I overall enjoyed the vibe. The host sat us to a table and we were greeted by a waitress in about 3 minutes. Food and Drink: The establishment offers a wide variety of blonds, reds and darks. I ordered a red and was not disappointed with my choice. For my meal I ordered the Duck Burger which was served with fries and green salad. The burger was cooked to my liking and tasted of good quality. I was not disappointed with my order. The duck meat was very tender and the bread it was served on was fresh and soft. The fries were tasty as well, it did not have to much salt, and I enjoyed dipping them in the mayonnaise sauce that came with the plate. The portion was big and very satisfying. Service: The waitress was attentive and very professional. She took her time to translate certain menu items and explain portion size and variety of options. She also asked us what kind of beers we usually like and made great suggestions for our drink choice. Pros: The food quality and portions are worth the price. Cons: I did not note any particular cons on my visit.Overall: I would re-visit this brew pub. The quality of the food is great and it taste delicious. Come early if you are looking to sit down and eat as this place does seem to get crowded after 10 and you may have to wait for seating. This place is easily 3 stars. The 4th star was giving because the duck burger was cooked perfect to my preference. The beer choice ranges and tasting my friends selections as well I was happy with the offerings. Overall impressed but not completely blown away as of yet!"
/user_details?userid=iZviX6z2D566l4wWY2XxRw,J C.,"San Jose, CA",4 star rating,"Huge selection of beers, including home brews, other local breweries, and a few beers from Europe and the US. If you can't find something you like, you probably don't like beer."
/user_details?userid=UeVG9bbjm7SEelcyoK2DHQ,Tom A.,"Ithaca, NY",3 star rating,"In a state of quasi-culture shock, we settled into a patio table and watch the crowds fly. Hookers and strippers at the gentlemen's club nearby, university protesters, and dog-tethered burnouts smoking copious pot on the streets. What better environment to order a few half-pints off the chalkboard and carouse through Quebec's better draft offerings? Our waitress was the perfect nighttime patio-sitting attendant, keen and correct, but never pushy. The beers were always right, came at the right temp in tulips, and had a fair price on them (for Canada). I could have done without all the smoking, but this is Canada and apparently smoking is still cool here. Great selection.A later visit for a cider found us stuck indoors with some really slow service, despite the fact that the only action was outdoors. Had trouble getting service and were really hot inside."
/user_details?userid=nbMkcP7c6392pDGQZvC0ZQ,HogtownMickey ..,"Toronto, Canada",1 star rating,I went here on Feb. 27th of 2015. I have visited this establishment on a previous trip to Montreal and was excited to come back. I ordered he same thing I ordered on my previous visit. The Trappist burger. The burger itself was great except for he fact that somebody be for someone forgetting to was their hands after handling chicken and leaving me with food poisoning for the rest of the weekend. It felt like I contracted the Ebola virus... I have never been sicker in my entire life. Yelpers beware...
/user_details?userid=YTAZicAF167DuPB64IRqFA,Crystal R.,"Carlisle, PA",4 star rating,"Large selection of beers. Had three that were from them (the milk stout, a rose IPA, and another IPA). Also had the poutine and the mac n'cheese. All three beers were good, the milk stout our favorite. The poutine was also delicious. The mac n'cheese was tasty but oily, though that's being persnickety. Service was ok, accurate but not overly friendly. Worth going if you like beer."
/user_details?userid=FruZms7HXV3MyyUpgP5xtw,Kevin T.,"Sherbrooke, Canada",2 star rating,"First, let me say that the beer is excellent.  Where things fell down was service.  Waited 45 minutes for our dinner.  We saw other tables wait 20 minutes for their bill.  When our food did arrive it was good, though by that time our mental state didn't allow us to properly enjoy it.  Great place if they had their act together."
/user_details?userid=VOkQp62ZufDuECAM8hUdGg,art f.,"Annandale, VA",3 star rating,Beer - 4 to 5 stars.  Good range and strong selections.Atmosphere - loud and young.  We sat just between the indoor and outdoor sections.Food - only had the nachos but they were the worst I've had outside a movie theater. A minimal drizzle of cheese and a few peppers - dry and tasteless..
/user_details?userid=-y8mv6-8C-IJWsy00EWAfA,Jehanne A.,"Montreal, Canada",2 star rating,"We came in for the beers - and yes they have a nice list of brews... But the staff doesn't know their blonds to their darks and well when you're in a brewpub that's really not a good point. The seating is really uncomfortable as they tried to put as many tables and seats in as little space possible so don't even think about stretching your legs without hitting a few people in the process. The music was really loud but I guess that's what they call ""young and urban atmosphere"" (I suppose I'm getting old!). We ended up eating and that was not a good idea... The food was just re-heated frozen anything, the fried were totally undercooked, the burgers tasteless and chewy, the sauce had been siting there too long and well the whole thing was just not good. Really if you're looking for nice beers, nice foods, nice staff and nice atmosphere... go somewhere else!"
/user_details?userid=XduciX-f9ONDZ-rUhs3PfQ,Sam C.,"Saratoga, CA",4 star rating,"This place has tons of beers on tap.  This is one of the places I wish I was able to explore the beer menu more.  I only managed to try 2 of their dark brews (Malediction and Sabbath).  Both good, but just nothing that would be on the top of my lists.  Appetizers here are delicious.  Had a warm brie with maple and pecans.  The bread it was served with was amazing, super soft and fresh.  I gotta learn how to make this."
/user_details?userid=0wf8jAdiMelXNDUgTimhDw,B. T.,"Belleville, Canada",4 star rating,Really good brewpub with a decent menu.  Enjoyed the smoked meat poutine and sampled two of their many beers on tap.  All were very good.
/user_details?userid=60RwPOf4HGLyXzDoUhMuNw,Mihai V.,"Mountain View, CA",2 star rating,Great atmosphere and outdoor seating. Great selection of beers but be prepared for no service. We waited with no one offering is menus. People around is were waiting to pay but no service still. Trust me were not impatient but this was bad.
/user_details?userid=Qsu2EtNn99_oVG9bS4Miaw,Tanya C.,"Toronto, Canada",3 star rating,Long beer list. Great patio. Pretty busy.
/user_details?userid=n3TDPio38lQXL1EWiSUAjw,M X.,"Atlanta, GA",4 star rating,"Solid beer selection, I suppose. Wasn't impressed by their house IPA. Pretty good sausage poutine and ok risotto."
/user_details?userid=2ivYtkXqCQeAfXEw33tEQQ,Sam V.,"Gainesville, FL",5 star rating,"We stopped here while on the craft beer tour and loved it. Vast selection, delicious poutine, and they even made me a nice non-alcoholic drink so baby and I wouldn't feel left out. Would definitely visit again."
/user_details?userid=2dcRdQ3brGjwi7UKBIwQ_w,Jo M.,"Toronto, Canada",1 star rating,"Unfortunately ended up here again, but luckily it was only for a drink but even that was not without some aggravation. Really rude and slow service. Music was incredibly loud. And why is that all the employees just like to stand around the cash register doing nothing while customers are made to wait forever, and ever and ever for one drink??Le Sh*t Bock, you done did it again."
/user_details?userid=D2189mUf9P9QKcUbuG25hQ,Ryan G.,"West Vancouver, Canada",4 star rating,"This was a nice little pub, that served up some great Nachos; Also, they have a great Beer selection."
/user_details?userid=auEIdTBTWd2YvVpXmMc8-A,Jim B.,"Philadelphia, PA",4 star rating,"I traveled from the US to Montreal looking for good beer and I found it!Le Saint-Bock is in Montreal's Latin Quarter not far from Le Cheval Blanc, Brasserie Artisanale L'Amère A Boire, and one of the many Les 3 Brasseurs locations. If you're in the mood for live music, mainly blues and rock, there's also Bistro a Jojo; or there's a great scotch selection at Pub L'Ile Noire - both have a decent selection of beer as well.At first glance LSB seem small, but once you pass the outdoor seating area and step inside you'll find that it's actually pretty deep. At night it has very much of a nightclub feel, and the younger crowd seems to thrive on that. Dance music plays and red light glows from beneath the bar, and against the walls. It has a red, black, silver against beechwood decor theme going on. It's slick, but not overly so. Given my druthers, however, I'd prefer to visit during the daytime when it's a little more casual and 'common'.Look for a beer menu and you won't find one, unless you look up on the wall at one of the electronic menu boards they have. The draft list slowly pages through, offering 44 beers on tap including 20 of their own. The brewery, by the way, is tucked all the way in back.I sampled several of the house beers and found them all to be quite good. The guest beers included a few Belgians, a few Americans (two from Stone, Avery's Beast, and something from Moylan's) which was highly unusual, and their Canadian choices were of the finest and most rare from Dieu Du Ciel, Hopfenstark, Microbrasserie du Lac Saint-Jean, Microbrasserie L'Hermite, Microbrasserie Charlevoix, Le Naufrageur, Trois Mousquetaires, Brasseurs Illimités, and Brasserie Franches-Montagnes to name a few. Impressive!They offer food as well, which is mostly basic (although in Montreal where many places offer no food at all or just ""snacks"", this is something special), including soups, salads, sandwiches, nachos and chicken tenders, etc. The prices are slightly pricey given the neighboring competition, but with a few beers in you I doubt you'd consider trekking out to save a dollar or two.Overall I was quite impressed by the beer selection, and I wish I'd gone here immediately (I stayed just up the block but I chose two other close locations to visit in the Quartier Latin and didn't get back until a week later the night before I left for home)."
/user_details?userid=vAp72qVpThC01b4rPnNzVA,Keat Ying C.,"Natick, MA",1 star rating,We went to this place at 9:40pm. The place was busy but not all tables were occupied. We asked for a table for two and was told that they had to re-arrange the tables. We were left standing for 10 minutes while the waiter continued serving other people. Finally got seated and got the menu. Waited until 10:10pm and we were basically ignored. Other tables with big groups got served first. We decided to leave the place and the same waiter who seated us saw us leaving didn't even bother asking us or addressing what the problem was. There are many other good restaurants on the same street. Avoid this if they are busy and if you don't have time to wait
/user_details?userid=mYwyDsBOz3XT620JpA7fHw,Earl L.,"Amherst, MA",4 star rating,"Was here during the Mondiale and they had a randall evening.  Despite the place being packed to the gills, the service was very good. They are super heroes.  The beers were also great.  Didn't try the food.  I'll definitely go back."
/user_details?userid=_GagOZ5oAmNVMt8Z_qH4Kg,Dean P.,"Morrisville, PA",4 star rating,A great place to grab a bite.  My only complaint is that it is a little crowded.  My friends and I have been here many times and it never disappoints.  The food is always reasonable and made to perfection.  The beer selection is good and varied.
/user_details?userid=ywf1G9IvDLg_KytwLimFCw,Scott J.,"New York, NY",4 star rating,"I like Le Saint Bock; it holds a sentimental place for me, as we started a mini-pub crawl here for my friend's bachelor party.It was a Saturday afternoon and we arrived shortly after the joint opened up at 1 PM.  We sat indoors in large, comfy, black vinyl chairs that faced a wall filled with a variety of colorful beer bottles.  This seating arrangement reminded me of a lounge and was very conducive to accommodate our party of 11 guys.The bartender/waitress was efficient, friendly, and adorable.  She made sure our beer glasses were never empty and brought our fresh nachos and wings plates quickly.The beer selection here is impressive (20 beers on tap) and the light atmosphere was an excellent starting point for a fun-filled day in Montreal.  Highly recommend."
/user_details?userid=am8QVk6qjt_TS6l0JMA6pA,Chris G.,"Boston, MA",5 star rating,"Love this place. Food is always amazing and the bottle/tap list is always on point. One of the best craft beer bars in Montreal, and a must visit if you enjoy delicious pub grub and sought after craft beers."
/user_details?userid=cumYM_K8wMZZjmrp3tlpRw,Patrick B.,"Merrimack, NH",5 star rating,"Wonderful beers with a varied selection (19 on tap when I stopped in).  Nice patio seating if the weather's nice - and World Cup on the numerous tvs.  Didn't try the food - but what I saw being served looked pretty good.Update:  stopped in again to catch the World Cup and have lunch.  The menu has a good selection of what you'd expect from a bar.  The burger I ordered was quite good and came with a side of fries and a salad.  Ran a tab and paid with a credit card with no problem - not sure why the other reviewer had trouble.  Also, all the beers are cheaper before 7 - and they serve pitchers of most beers."
/user_details?userid=XBwqLcVJ19GRa-mFf3q2iw,Krystle M.,"Toronto, Canada",5 star rating,"When every other place is full along St. Denis during a Habs game, there always seems to be just enough room in here. One of the less touristy places along the strip I think. Multiple ciders on tab and glutenberg if you're gluten free. Not a ton of GF food options, but the nachos are pretty safe and they are usually pretty nice about food questions even though it's not their specialty."
/user_details?userid=Mksw5P27e00UQuNzRdRAyg,Megan W.,"Wyncote, PA",5 star rating,"Omfg. I stumbled upon this place the other night while on a work trip and came back today because I had time to kill before my flight. I was at the bar less than an hour before realizing that everyone here (including me) is a repeat customer. What a gem! 40+ rotating beers on tap, friendly service, outstanding food (I didn't think anything could beat the pulled pork poutine until I tried the mac&cheese with lardons). My only regret is that I can't fold this place up and take it home. Do NOT miss it."
/user_details?userid=DEBefMdEFFoM9MiYWGm97Q,Conrad S.,"Vienna, Austria",4 star rating,St. Bock just won four medals at the Mondial de la Bière here in Montreal (where I had the honour to be a judge). I went there after the awards event and found the place very inviting. We had a very friendly waitress - much to my surprise she did not understand much English. The problem was solved similarly to what you do in Chinese restaurants: You can order the beers by their number - en francais.
/user_details?userid=G9Vt0v4eebn2A5dbQEN0RQ,Cat A.,"Feigères, France",5 star rating,"A great choice of excellent beers, many made right here. We ate a beer caramelized hamburger that was delicious. Free Wi Fi, 2 screens where we watched the Olympics. Good music, good service. A great address!"
/user_details?userid=CdUZIzSe0GJ7qxq4BU8pQw,Jonas K.,"Toronto, Canada",3 star rating,"Totally fine pub in Latin quarter fun area of Quebec, decent vibe and friendly atmosphere. Fairly good selection if Quebec beers, not amazing but satisfying place to spend a few hours. Asian food nearby!"
/user_details?userid=E7rEdhFfUm0jQ4I055IOeg,Craige M.,"Alexandria, VA",4 star rating,"Located a few blocks from the Berri-Uquam metro, St. Bock is easily accessable. They have approximately 8 of their own beers on tap, which can be purchased by the pint, glass or taster ($6.50/5.50/1.75). The brown and the porter were our favorites and were good examples of each style. The Scotch ale tasted a bit off. We did not try the food. It is mostly typical pub grub. Nice mellow vibe overall. Definitely seems to attract an over 30 crowd."
/user_details?userid=XZfv70IsujPrIMGKeL9kdw,Vanessa F.,"Montreal, Canada",3 star rating,"Trop bruyante, pas assez de nourriture végé (que veux-tu, c'est un bar) mais leur sélection de bières est excellente."
/user_details?userid=y0OAeOAkh-KBFt3-lurUMA,Whitney S.,"Dover, NH",4 star rating,Great beer menu.. hundreds of different bottles from around the world!
/user_details?userid=vDxEKnS0G8-ecS-zT1sMNQ,Tony L.,"San Francisco, CA",1 star rating,This place is awful.  Terrible.  Bad food and slow service.  Beer was good.  Just terrible bleak service
