user_url,user_name,user_city,user_rating,user_review
/user_details?userid=dA4PqVeYfWmn0W2CpjxlkQ,Emily D.,"Old Toronto, Toronto, Canada",5 star rating,"Went for brunch with my mom and although there was a wait to get in, we were greeted with friendly and welcoming faces!  The staff was very attentive and continually made sure we were comfortable and satisfied.  Our food and drinks came shortly after ordering and omg it was all amazing!  The food was incredibly fresh and packed with flavour!  We got water without even asking for it and it had a slight watermelon flavour to it which really added an extra something!  By far the best part of the meal was the delicious potatoes; they were perfectly cooked and just the right amount of crunchy!  Definitely coming back here and would recommend to everyone as a must eat!"
/user_details?userid=Q6f-wmLKk6kPIq648ybmbw,Shiran B.,"Montreal, Canada",5 star rating,I absolutely love this place! They once had this amazing duck confit eggs Benedict and I recently found out they removed it from the menu :( I was SO SAD! But honestly they have amazing choices and everything is so God dam delicious. I feel like some breakfast places should learn a thing or two from this place. Also amazing service!! & family friendly but in a cool way
/user_details?userid=pEQQLDHE_G_JlbsU553q2w,Danielle G.,"Sandy Hill, Ottawa, Canada",5 star rating,"Genuinely the best breakfast I've ever had. Quantity is INSANE which often means low quality but nope not here. Quality is awesome, and you can tell a lot of thought and time goes into creating & making the recipe/ food. Never miss out going here when I'm in Montreal."
/user_details?userid=3q3kDbgp9WRxsDByep35wg,Angie B.,"West New York, NJ",4 star rating,"If you're in the area this is a great place for breakfast or brunch. It's very bright and colorful inside and the service was very friendly and fast. We went in and there was a line of course which was a good sign. The watermelon flavored water was a great touch, and the fruit skewer that comes with every meal is also a great bonus. I had the ""I'll take everything"" it had french toast a pancake, eggs, bacon, sausage, potato you name it!  I was truly amazed I could walk after that meal. There really is something here for everyone. I would definitely recommend."
/user_details?userid=xSb2qnoa2BxPZZFS9XR3qg,Valérie P.,"Montreal, Canada",4 star rating,"First time here. I have never been to their other location in Plateau Mont-Royal.We wait about 45 minutes to get in but we were lucky to cut the line since we were only 2 and everyone in front of us were larger groups. If you want to try this restaurant (which you should!), I suggest you go only with one friend. We had the duck confit Benedicts and the ""I'll take it all"" plate. The plates are enormous, the waitress later told us there is an option to share a plate.Both came with the largest fruit skewer I have ever seen. Fruits were fresh and sweet. The duck Benedict was great. LOTS of duck with caramelized onions, the poached eggs were cooked perfectly. And the site of potatoes, OH.MY.GOD. So good, plus you can add one of their hot sauce or Cajun spices, available on the table. Then ""I'll take it all"", a plate of eggs your way, French toast, pancake, bacon, herbs sausage, pork rillette, braised ham, beans, potatoes and a side of bread (choice of bread, Baguette or St-Viateur bagel. Scrambled eggs were very fluffy, and probably represented more than two eggs. Ham looked a little like pulled pork and made me regret my benedict choice. Rillette was creamy and topped with pickled onions. I am not a fan of beans but I have to admit that they were good. We did not touch the pancake or French toast so I cannot comment on that. French toast looked a little dry. All plates are served with real maple syrup, which is always a plus. Coffee is not included, which I always find a little disappointing. Service was great and waitress was smiling and talkative.TLDR; Go, with ONE friend and your patience. Enjoy the food and decor."
/user_details?userid=G0EvHxnVoXfTMvnezkOvSQ,Brittani C.,"Ville-Marie, Montreal, Canada",5 star rating,"Amazing brunch place!! The Nutella coffee is to die for. I chose the ""indecisive"" off the menu as I couldn't decide whether to choose the sweet or savoury route but I'm glad I had a little bit of both. The service was impeccable and staff was great! Highly recommend this place to all!"
/user_details?userid=Z7xuJ9P_rMtBvi4aFmP7zw,Fouad B.,"Montreal, Canada",5 star rating,"They have a big selection in the breakfast menu.I chose l'indécis; 2 eggs with a sausage, bacon, fruits and a delicious dulce de lecce pancake.They have big portions, and a nice decoration. Service is good, the waiter was nice."
/user_details?userid=KBoIRjxSW7OWczv8OS9Bew,Xue L.,"Verdun, Montreal, Canada",5 star rating,One of the best places for brunch. The new location has a shorter waiting line for it's faster to be seated. Their benedict eggs come in many varieties and are amazing. The smoothies are also awesome and come in a huge glass to share.
/user_details?userid=nptaypYVM2RVTgm0uuCzeA,Henry L.,"Montreal, Canada",4 star rating,"L'Avenue's menu is so overwhelming the finding what to eat can be enjoyable for some and disastrous for the indecisive. I chose to go with their ""Basic Omelette"" based on it's modest price of just short of $10. The Basic Omelette was exactly what its' name implies: basic and an omelette made of four eggs making it thick and impossible to finish. However, I must give L'Avenue credit for making absolutely phenomenal smoothies with kale, and other vegetables I don't remember that actually tasted great, and for the fruit they serve with maple syrup - Very Canadian! In short, while lacking in the basic omelette department, L'Avenue did not disappoint in all other aspects, (including service and decor) but make sure to get an interesting main dish if you can afford it and avoid my mistake."
/user_details?userid=qnZkCGvLz6AB5cQN_J_pUA,Jack D.,"East Oakland, Oakland, CA",4 star rating,"Had this place bookmarked for months and decided to start my birthday off here for brunch! I've passed my L'Avenue several times and there's usually a line, but we were lucky to arrive just early enough for there to be some open seating still. Walking in, one can't help but be struck by the decor: a motorcycle hanging from the ceiling in front of a graffiti mural, cute asymmetrical lighting above the booths, retro chairs, a huge replica of a can of syrop d'erable, a gigantic mirror in the back. A good selection of music served as a backdrop as we checked out the cleverly-designed game show themed menus. Food wise, lots of great choices, but for my birthday, I went for the duck Benedict, and it was definitely what one might expect: rich, fatty, juicy. Not sure if I'd order that on the regular, but it was delectable to say the least. My boo got the ""Indecisive"" with the Creme Brûlée French toast (amazing), the homemade sausage and cretons. All the food was on point. Their coffee by the way is cheaper than Timmys but a million times better (however I doubt they take to-go orders for it). Finally, nature called and I paid a visit to thee infamous restroom. Nothing like taking a tinkle while surrounded wall-to-ceiling by black light-illuminated artwork. I felt like I was peeing in outer space. In short, L'Avenue is a one-of-a-kind dining experience that hits on all the essentials: food, service, and ambience. Arrive early or during slow hours to avoid the line, and order the cheap delicious coffee!!!"
/user_details?userid=afeuRZrOp6LL2IXKudOOYQ,Alem F.,"Manhattan, New York, NY",5 star rating,L'Avenue redefines my definition of a good brunch. I was visiting the city of Montreal and was recommended this spot and I'm happy to say I wasn't disappointed. I ordered the steak and egg Benedict and it was impeccable. Both the steak and eggs cooked well with the addition of a strong cup of coffee. Reasonably priced.
/user_details?userid=hkRWBcShA76C1SJm6PfuTQ,Dax C.,"Denver, CO",5 star rating,"Top 3 breakfast place we have visited.  L'Avenue was so good I felt compelled to write a review.  My wife and I visited Montreal for a long weekend and stumbled upon L'Avenue.  We waited for about 10 minutes in line but breakfast was well worth it.She had the avocado toast which was much more compelling than some of our other favorites breakfast restaurants - Snooze in Denver and Nora in NYC.  I had the Indecisive Breakfast with eggs, millionaires bacon (a must get), sausage, and carrot cake pancakes.  It was delicious.The entire meal was excellent and our server was fantastic and super friendly.  It was well worth the short wait."
/user_details?userid=SgmmMT7T5b-CxP5duc0wWA,Staci P.,"Spring, TX",5 star rating,"My son was on a sugar high all day long after having the FRENCH toast with caramelized bananas and Nutella in brioche bread. I had a bite and it was heavenly. I had the ""Indecisive"" with eggs, bacon and two of the carrot cake pancakes. They were sinful. I highly recommend this place for breakfast/brunch, but either get there early or be prepared to wait. The line was down the block when we left."
/user_details?userid=Ed7eipVLDWj967zsxUQ5QQ,K S.,"Toronto, Canada",5 star rating,"I went here for the first time nearly ten years ago, and never forgot it... Couldn't believe you STILL line up, even on a random Wednesday morning. And I generally won't line up for much of anything :) More recently they've changed the menu up slightly (event the website isn't up to date yet), but still so, so, good. They used to have a Benedict with onion compote, but it's been replaced with one even better (some caramelized onion and mushroom nonsense). But literally everything is great, filling, and indulgent.Coffee... Shakes... Smoothies... Whatever you're into. This place always seems to have something for anyone, and the service is lovely too. Couldn't recommend more highly."
/user_details?userid=JU8E72yHE2k7aqfmeBdK1A,Jose R.,"Montreal, Canada",5 star rating,"I Was super curious of visiting the new location and i believe  is definitely one of my favs spots in town right now! The ambiance is pretty uplifting with great tunes and nice staff along with the exquisite menu they offer. I went on a Sunday morning around 11 am and the line wasn't so long, probably like 15-20 mins.  We ordered the Bobby visite L'Espagne and the Chorizo II egg Benedict. They were both delicious with perfectly cooked chorizo and fresh ingredients.This place is a must for brunch!"
/user_details?userid=yphnJ8zYbJF7Y3QbtMj91g,Shahanaz B.,"Southwest, Montreal, Canada",5 star rating,"I went few times to L'avenue on Mont Royal. One of my favorite brunch place. Recently, I went to L'Avenue on Notre Dame (near my place! Yay!). The place is bigger. Still as usual, full house. We waited about 20 minutes. Service was given by Laila. She was really amazing, despite being super busy, we felt she took care of us with sincerity. From the water(fruity flavor) to our dish, everything were succulent. The price is reasonable. I love the decor, very funky."
/user_details?userid=ei5gIl34SOo3FoR4tQT2fA,Joseph T.,"Nanuet, NY",3 star rating,"The food was solid, waitress was charismatic. But gave us some terrible suggestions and she mixed two of my friends orders and we only realized by the time the check came in. How is that possible"
/user_details?userid=0HJw2Y1gc8T_LHxEYJcNZw,Jessica G.,"Boston, MA",5 star rating,"Great brunch spot in downtown Montreal. Spacious and beautiful on the inside. I came here with 2 friends, and it was pretty easy to find a parking spot  on a Friday afternoon. The wait is a bit long (about 20 min for us) but well worth it."
/user_details?userid=4wZFfQ2JV4FvQ2nTcd3D1Q,Simranpreet B.,"Gaithersburg, MD",5 star rating,"The server was great, she helped me make my choice and it was perfect. I wanted something small but filling and she suggested the passion fruit single pancake by far the best pancake I have ever had. The passion fruit cream wasn't too sweet, the coconut flakes and fruits just added the right touch since it was a single pancake."
/user_details?userid=x5NxuvprlaYGeqV21Wylvw,Antoine S.,"Brossard, Canada",4 star rating,"Me my girlfriend and my best friend decide it to go eat at l'avenue on Notre-Dame at Montreal. When we got to the restaurant, there was a line to go in there. We waited for 30min before we got our table. We got our menu when we got our table and a few moment later we got our water which is great as we didn't need to request for it and at the same time she ask us if we want it coffee and we all accepted. The coffe was good but I am not a black coffee taste person so a normal flavor coffee would be fine since I had cream and sugar. We all order Milkshakes and 2 of us got a shot of espresso in it, I got choco-banana milkshake and the other 2 got oreo biscuit milkshake. The waitress were friendly. They took our order where we all order different egg benedict, I took steak & egg benedict, my girlfriend took Montreal benedict smoked meat and my friend got Saint-Ambroisse Benedict. It was really delicious and we got our plate fast too. We even got a small entree of fruit to start off and there was a few mix of different fruit to eat.The only thing why i would reduce one star it's because the time we waited for our table, before we could order and to get our bills. But it's understandable has there was a lot of customer and a lot of people came to eat there. I would recommend the place. It wasn't too noisy and the environment was good."
/user_details?userid=PJ8PdaAoEqk01-nd5tnm2Q,John D.,"Lafayette, LA",5 star rating,"This was hands down the best breakfast of my life. I have eaten in some great places but this was the most incredible Eggs Benedict I've had. They used a pulled pork instead of ham, the hollandaise sauce was perfect, the eggs equally perfect. But those potatoes - roasted somehow and just incredible. But it wasn't just my breakie, it was the skewer of fresh fruit that everyone got, the giant smoothies thy were all so delicious, his awesome the staff and ambiance were all just great.Montreal has some real gems but for breakfast this is by far the best place I've ever been to. Oh - and the prices are competitive with any chain restaurant but you're eating some of the best Montreal has to offer. There is always a line up and it was packed from the second we got there to the moment we left but now I know why."
/user_details?userid=0gZ8E5tBWTEtGEZDuTzhzw,Cindy Feng Xin L.,"Montreal, Canada",4 star rating,"I really like Avenue Notre-Dame compared to Mont-Royal one, since there's no lineup and both the food & service were really impressive! The decor of Avenue is super hype as usual, featuring street art graffiti wall, eccentric model, motorcycle on the wall, crazy neon toilets (all three of them were different and insanely original), so it's very instagrammable in every aspect. However, they didn't offer the fruit brochette as they were doing at Avenue Mont-Royal, but that's a minor detail. I ordered Huevos Rancheros, which is tortilla with generous salsa mountain, cheddar, egg as well as potato on the side, the portion was huge and the price very fair. I would definitely come back again!"
/user_details?userid=0iqIj3u5x5VDQrl1TFkznQ,Denny F.,"Bronx, NY",5 star rating,Came here twice during our short weekend trip from New York City. Food was so good. Waiters/waitresses were amazing. I had the Rainbow Eggs Benedict and the Pecan French Toast. Both amazing combos.
/user_details?userid=eCm1PJ58PxcXapQKd7mjVQ,Noorina M.,"Mississauga, Canada",5 star rating,Beautiful little quaint joint with a varied and unique menu. Service was quick and friendly. The pancakes are to die for! Highly recommend. Also make sure you stop by their bathrooms
/user_details?userid=chgTnp84tlV4UUJlfIVJzA,Anuj S.,"Chicago, IL",4 star rating,"After having breakfast at the hotel, a bunch of friend we were with decided to have brunch. I guess most of them had missed the hotel breakfast. I had hoped to go with the lunch menu to get a sandwich or something like that, but after sitting down we found out that they don't do the lunch menu on weekends. The only other thing that was inconvenient was that there was a really long wait, which was a bit frustrating. But this place did have some great breakfast...Some of the biggest fluffiest pancakes I've ever seen. The menu was all in French, so that made it a bit difficult. I didn't realize crepes were pancakes until we asked the waiter. He was super-helpful with options and so forth. So the pancakes came with this nice creamy syrup on top plus maple syrup on the side. They were also topped generously with fruits. Oh, that's one thing at L'Avenue... there are TONS of fresh fruits. You get an entire plateful of this fruit kebab when you first sit down - that was pretty cool. With all the sugary goodness going around, I really enjoyed my order of savory breakfast potatoes with my order. That balanced all meal out for me. I could only finish two of those pancakes... I strongly advise sharing for people who visit this place as the portions are enormous.Would definitely recommend for a big hearty breakfast."
/user_details?userid=VazMGd9E2HgZHuhCsHvcew,Anu P.,"Newark, NJ",4 star rating,Expensive high-end breakfast a little drive away from downtown. Ordered Nutella coffee and strawberry Nutella pancakes. The coffee was yum! The pancakes were huge and three in number. Very large portion for breakfast. They were soft and fluffy and neutrally sweet by themselves. Service was great and they serve fruit infused water and fruit skewers while you wait for food
/user_details?userid=5NHnefJf5lhO2vCO4sJmuw,Casandra N.,"Le Sud-Ouest, Montreal, Canada",5 star rating,"Cool atmosphere, food was delicious, and the service was great. I'll definitely be back!"
/user_details?userid=jc2n8lLSWXpS50homWIwYw,Jonathan P.,"Kips Bay, Manhattan, NY",5 star rating,"The food and service are next level! The atmosphere is very cool and vibey. Staff is happy and attentive. I truly enjoy this place and worth any wait that there is. At the end of the day, there's a wait for a reason!"
/user_details?userid=-BDFBUbT-t67hsSxEwpVeg,Ally B.,"Le Sud-Ouest, Montreal, Canada",5 star rating,L'Avenue is a great and unique breakfast spot in Montreal! It's always our first choice for weekly family brunch.
/user_details?userid=dEW944sWJzmx_sc0_l4-BA,Kamal K.,"Jersey City, NJ",5 star rating,Greaaat food! Perfect ending to our Montreal trip. This location does not have big queues unlike the other location. We had the Goat omelette and strawberry pancakes.. both were delicious! Will definitely visit again during my next trip to Montreal!
/user_details?userid=FNaTeTU1OuqD-nYUNSiR3A,Abdul J.,"Fishers, IN",5 star rating,The decoration is amazing. Service is fast! Although always there is a waiting line but it worth it.There have English and French menu. I only find the music is a bit heavy for brunch! But it's highly recommended
/user_details?userid=QbH0JX6kJ8RKdUubyb9ewA,Alex E.,"Etobicoke, Toronto, Canada",5 star rating,You have to go here for Brunch.  Amazing food. Great vibe. Awesome tunes.  Fantastic service.  A real experience! Amazing attention to detail.  Trust me go there on an empty stomach.
/user_details?userid=ARweLrh7wcXWTGBkWaB6hA,Chelsey H.,"Niagara Falls, Canada",5 star rating,"This is an incredible breakfast place. The Chorizo Eggs Benedict are phenomenal! The best I've ever had. Plan to wait about an hour on the weekend, but it's totally worth it."
/user_details?userid=Qwrbfgn8iGcHQ5MaQfXiTA,Seasy H.,"Montreal, Canada",5 star rating,"So amazing! What an awesome brunch experience. Typical of Montreal brunch places, we waited ~30 minutes for a table. It was a Saturday morning, typical brunch time, so that was nothing unexpected. The first thing we noticed was the menu. The designs and names were so quirky and cute! I got the nutella latte, which tasted exactly how you'd think it would taste. Caffeinating and chocolatey, perfect for a Saturday brunch. I love duck, so it was obviously the duck benedict for me. The indécis is perfect for anyone who doesn't know what to get! I saw a tip saying it was better to ask for the pancakes on the side, which is what we did. A definite bonus: the filter coffee is both unlimited and cheap! Overall amazing brunch with fantastic drinks, main dishes, and side dishes (those potatoes though omg). 5 stars well earned."
/user_details?userid=DR8wzuDlG2g3Gy9sua_e5g,Leroy C.,"Le Sud-Ouest, Montreal, Canada",5 star rating,Amazing brunch amazing settings and amazing service. Can't go wrong. Shout out to Roy. Best waiter.
/user_details?userid=GUjUFwyqUe_fT-eMBKK2uQ,Ansley P.,"Markham, Canada",5 star rating,Amazing brunch spot on a quiet street in the Saint-Henri neighbourhood. Coffee is mild and not too bitter (unlimited as well). The hollandaise sauce that is served with the Egg's Benedict is a must try.
/user_details?userid=PhaiUt5shE1xQLPr_a1OrQ,Kareem E.,"Old Toronto, Toronto, Canada",5 star rating,Okay so we're not going to have egss Benedict anywhere else except here and that's a fact. Honestly they might have not invented this here but they sure have perfected it. The service is also very exceptional and friendly to match the hip atmosphere and great food
/user_details?userid=pZDmoYqX5AY8D_zAJ9Zheg,Max T.,"CA, CA",5 star rating,Do not go full. Must go hungry. Fullness of breakfast is complete.I eat eggs benediction having steak and spicy sauce. Fruit with compliments came to begin. Very big stomach created. Flavour was powerful with quality. Best breakfast ever for Montreal. This is heavy comment. Even water has taste in watermelon. This has never happened.Clean. Service has professional wardrobe. Don't think about money.
/user_details?userid=v_lsxDKlCuPWfgH9WcuGQg,Nathan M.,"Montreal, Canada",4 star rating,Lives up to the original on Mount Royal!Love that they provide the option of Portobello mushrooms instead of English muffins for the eggs Benedict. Great space with WIFI. Still waiting for 3rd wave coffee to make it mainstream :/I want a pour-over with my poached eggs xD
/user_details?userid=AdiS05aWlVGTNoHi8n5iQg,Jennifer G.,"Sayville, NY",5 star rating,"Fantastic food, fun atmosphere! Found this place on Yelp! And based on reviews and other reviewers photos decided we needed to try it out. I couldn't have been more pleased. We got there shortly after opening, so we were easily seated, as we were getting ready to leave there was a line at the door! Glad we came early, the food was excellent, staff was friendly!"
/user_details?userid=br7e8wY7cQNfGR09jqitFw,George D.,"El Paso, TX",5 star rating,Absolutely amazing food. Very unique and cool vibe. Good service. We will absolutely be back here!
/user_details?userid=3QJj7MESj2TSIp7_Ylkg0g,Mtl F.,"Montreal, Canada",5 star rating,"Incredible. I've legitimately never been to a restaurant i love more. The staff is extremely nice and accommodating. I went there with all my family (a group of 12) and they served us with big smiles and never made us feel like we took too much room. The food and drinks are excellent, the decor is superb (everyone should visit the bathroom). This is a MUST if youre visiting montreal. Keep an eye out for the little touches (pink himalayen sea salt, watermelon infused water, the maple syrup served in cans...)"
/user_details?userid=VdleIEhNRyrQIFtmPSIftQ,Neth L.,"Montreal, Canada",5 star rating,My first time trying and it was a great experience. I went on the weekend and there was a line up but it will be worth it. I got the indecisive. My favorites are the potatoes ( so flavourful) and the carrot pancake. Love the decor and when you go to the bathroom it feels like you're in a club. Oh and the service was spot on. Loved it !
/user_details?userid=JdDnG7NShlw0PQA56JxKyw,Samantha C.,"Naples, ME",5 star rating,This place is 100% worth the hype. I got the sweet and savory eggs Benedict and it was the best Benedict I have ever had. In addition to that the drinks were phenomenal and the service was quick and kind.
/user_details?userid=A09pJVwPDGX1a2xuFpt1MA,Teresa A.,"VT, VT",5 star rating,"At breakfast, expect await, but it is worth it! Fun, energetic, eclectic vibe. Great food and lots of options to select from on the menu. Fresh and tasty! Portions are large as well. Wait staff is friendly and attentive. Cocktails are yummy too. Especially, the Irish Coffee and the Blueberry Basil Mimosa."
/user_details?userid=aisu0QdB6KTx9GMmfh7iUQ,Misa P.,"Lasalle, Montreal, Canada",4 star rating,"In the heart of Plateau, l'Avenue is very easy to spot. That hole in the wall that always seems to have a massive lineup? Yup, you've found it. The place is quite cramped for their enormous popularity but you will definitely enjoy your time there. Your menu looks like a dating game show; interesting! The food is quite tasty. Being used to your traditional breakfast places that give you the choice of brown or white bread, I was shocked when they asked if I'd like brown, white, baguette or bagel (bagel, please!). My favorite part of my dish was the crème brûlée French toast - so crispy and sweet. I will surely be back!"
/user_details?userid=Yu92IcNIMlRp1DKAKjaDig,Bianca A.,"Methuen, MA",5 star rating,"Amazing brunch! The pecan pancakes are a must have. The smoothies and pitchers are a great add! They start off by giving you a fruit skewer which is a nice add! Get there early as there is usually a line around the block, for good reason."
