user_url,user_name,user_city,user_rating,user_review
/user_details?userid=0reDYORHg8BZ11a-drzayg,Rebecca B.,"Jamaica, Queens, NY",5 star rating,"Such a delicious restaurant! There was a wait when my group of 4 arrived but it passed relatively quickly! The food was delicious and the portions were absolutely perfect! I love the decor of the place, it's something I don't see often! The french toast with nutella and strawberries is absolutely delicious! (But just so you know, I do have a sweet tooth) haha. I'd definitely recommend this to anyone looking for a great breakfast/brunch spot!"
/user_details?userid=Gnkq84PL6E5dYdhJvruAAw,Roxane A.,"Côte-Des-Neiges—Notre-Dame-De-Grâce, Montreal, Canada",5 star rating,"Excellent brunch! This place is a dream for brunch lovers. The diverse menu has something to offer to every taste, ranging from conservative to more original dishes. My favorite was the ""indecisive"" option, where you get to choose from different savory and sweet options to build the perfect plate for yourself. I had high expectations coming to L'avenue's new location, and I was not disappointed. The decor and ambiance of the restaurant is modern yet laid-back. Even on a Tuesday morning the place was vibrant and the staff was energetic and timely. The presentation of the dishes was simple but appealing. I really enjoyed their cretons and the mac and cheese pancakes which were the sweet option that I chose (although they were more savory than sweet...). The oreo milkshake was just perfect, not too sweet, but it should definitely be shared as it is pretty huge. Most of the meals were very filling and I felt like the staff was used to preparing leftover boxes. Don't forget to visit the restrooms in this location! Each one has a unique and hypnotizing setup. Overall a perfect brunch!"
/user_details?userid=7Qsw_BJjPVg13iiEKnj4Rw,Jay L.,"Marietta, GA",5 star rating,If I didn't live here I'd miss this place.  This is a neighborhood gem!  I go probably weekly sometimes twice. The staff are amazingly attentive even when super busy. The food is exactly what you're looking for in a 5 Star brunch spot. I have at least 5 favorite regular menu items I choose from. They even let me keep my personal hot sauce there. What isn't to love about this place!!!
/user_details?userid=KeTXA8X6BTn2p-X0o6m-nA,Candice D.,"Bloomfield Hills, MI",5 star rating,"Great brunch spot! It is worth the wait.  Great food, drinks, and service.  Bathroom is awesome too"
/user_details?userid=DYfOeMGz3N8-DUa-sz9IaA,Wajdi G.,"Verdun, Montreal, Canada",5 star rating,"L'avenue is more than a restaurant. It is a rich experience concept brunch place. The decor, vibes and music are all unique. The service is top notch, offered by dedicated staff who go the extra mile. The food portions are extra generous and the taste is out-of-this-world. The Reese milkshake and maple syrup coffee are pure delight. The ingredients are clearly fresh and the open kitchen increases your confidence. Dont miss the watermelon infused water and the restroom instagramable moment."
/user_details?userid=UwXIpK-yhVNABLpMpoSyCA,Nadine P.,"San Diego, CA",5 star rating,Great breakfast place. Menu offered many choices. Environment was trendy and staff really nice
/user_details?userid=nHjRBSbzPeqdq5_D3AirEg,Patricia C.,"Hampstead, Canada",4 star rating,"This was my first time at this location -I came here for brunch on a Saturday around 1ish. There was a lineup but not a huge one and the wait for a table wasn't too long (although we were two -I think the wait time for larger groups would be longer since the space inside isn't huge). The service was friendly and the prices aren't over the top. The decor in the avenue restaurants is always a little funky (In a good way) bright upbeat colours and always clean. Their filter coffee was actually very good compared to most breakfast places (they use lavazza coffee  I believe) Even their water has a little something extra always cold with a hint of watermelon flavour. I tried an egg Benedict dish which was very good such great flavour without being overpowering and the portion size was more than enough to be filling. My boyfriend had a chorizo scramble which was also a huge portion and was very tasty , but he said he would prefer to order one of their more unique items like the one I had because it's something you can't really order elsewhere in terms of the flavours and  the unique twist they put on the dish.they also bring you a little plate of fruit as a kind of free starter which is a nice touch . I would recommend this spot to anyone who wants good quality breakfast/brunch since they have your more classic eggs and bacon dishes but also offer some more unique options for the more adventurous eater ! (Lunch items also available for those who aren't crazy about breakfast but still want to go out with their brunch loving friends or significant other etc) . No outdoor seating available but they have a somewhat open concept towards the back of the restaurant on warmer days where you can still enjoy the fresh air"
/user_details?userid=m_7elkDE_kTEh65xHt5y4w,Larissa L.,"Montreal, Canada",5 star rating,"I tend to resist waiting in line at a restaurant in a city like Montreal, where there are so many wonderful places to eat with no line involved. But one Saturday we were in the area rather early and decided to give it a try. God, was it worth it!!! Starting with the coffee. Simply the best coffee of the kind I had in Montreal so far. Real coffee. Everything was delicious, inventive, in generous portions. I will definitely go back, even though I got the impression the line outside is more due to the time it takes them to clean a table than to the amount of people wanting one."
/user_details?userid=qWGy5yKXlOo3QUl1fswKGA,Paul D.,"Quebec City, Canada",5 star rating,"So I love the weekend routine of Saturday and/or Sunday brunches, and have been to quite a few places along this Notre Dame strip. All that being said I think this is my new favorite place. So far the best regular coffee I've had with a brunch. The food portions are very generous and quite tasty. In a party of three we couldn't really decide from all of the interesting options available so they conveniently have an ""indecisive"" option which allows you to mix and match some signature sides. The music was great, the vibe was hip and fun, the service was excellent and even the bathrooms were fun with different colour coded themes! Definitely recommend!"
/user_details?userid=FlMmKZIE-wdu-tX38oFNmQ,Monica M.,"San Francisco, CA",5 star rating,"I came here for breakfast with a friend. We arrived around 10:45 and got seated right away. The atmosphere is fun and inviting and I loved the decor around the restaurant. I started off with a latte in a cup and it was delicious. The menu is big, there's lots to choose from which led me to decide on the ""Indecisive"" breakfast which let's you choose the choice of 2 savoury items and 1 sweet item. This meal comes with 2 eggs, potatoes and either a st-viateur bagel, baguette or toast. I chose sausage and baked beans for my savoury and the caramel pecan French toast for my sweet and I had wheat bread. The sausage was delicious, and the French toast was by far the best thing I have ever had! However very  sweet as one might expect, I could only finish half of it. My only complaint is the potatoes, way too much garlic in my opinion. I only had a taste and didn't touch them the rest of the meal. Overall I'm very pleased with my experience and the food was superb. I will definitely return!"
/user_details?userid=xYsa-NaCf2FcXdP64UpnGQ,Vicky T.,"San Antonio, TX",4 star rating,"I thoroughly enjoyed the breakfast, TRULY delicious and a must visit. The service, on the other hand, not so amazing. My waiter was VERY friendly but inattentive. I sat with no offer of coffee or juice for a good 10min. I did have water provided, so that was nice. I then kept waiting for coffee refills and then he forgot that I wanted just a little more. By this time, I was ready to go, so he did offer me a coffee to go, but then payment was next, he brought the receipt and when I took out my AMEX card, he kindly rejected since they did not accept AMEX but then walked away. He didn't even wait to see if I had another method of payment. I would have left him a bigger tip if he was a little more attentive. I got up, payed someone there with cash and left."
/user_details?userid=-EkcGnTwDJ3p3sYyQhUgJA,Dallison D.,"Redmond, WA",5 star rating,This place is fab!I went here tired of Faberge and wanting a change.The service was friendly enough and the Resto was cute.I ordered the chicken and waffles and was in heaven.The chicken was fried crispy and juicy with great flavor.The potatoes were sexy with a yummy sauce on the side along side juicy fruit.My only let down was the waffle.It was to sweet and dense for the plate.Will back soon if to only take a cool selfie in their Dope bathrooms.
/user_details?userid=L_Gjvt8MiuUliAm0ysPv-Q,Gil G.,"Montreal, Canada",3 star rating,"The dishes are generous. Fruit-infused water and pleasant servers.Waiting time is long and the dishes are good, but not a wow."
/user_details?userid=l-1cva9rA8_ugLrtSdKAqA,Vibhor S.,"San Francisco, CA",3 star rating,"I had the chicken eggs Benedict at L'Avenue. I know, who gets chicken eggs benny, but it was good and the chorizo one was better. The hype behind this place is a bit much imo, or maybe I didn't try the correct thing. It would've been a solid 3.5-4 stars, if this place wasn't as hyped up with all the line ups!!"
/user_details?userid=c3TvXGJO_KchrYJIx9eU2Q,Wen W.,"Montreal, Canada",5 star rating,Loooove their eggs Benedict! Everything on the plate was so delicious and the portion was so big that I couldn't finish it. We went there on a workday so it wasn't too crowded. Great service and good food!
/user_details?userid=vvd_4SyRt9hyXDLH7sDFXA,Shibby G.,"Montreal, Canada",4 star rating,"Brunch was absolutely delicious, the menu contains very creative brunch preparations. I will point out that the service was a tad slow for my taste. They brought us our fruit 'brochettes' 5-10 minutes after our order, but the meals came about 30 minutes after the original order was placed."
/user_details?userid=Yi7ClD0E8h27nzWd5fFG3Q,Rebekah C.,"Garner, NC",5 star rating,"Great service, amazing food. The Indecisive is the way to go! (Beer braised ham is amazing!)"
/user_details?userid=yyhzB-HRh-LQ6TBERHO27w,Irfan A.,"Montreal, Canada",5 star rating,Delicious breakfast. The best brunch in town. Every bite has so much taste and you can experience all the flavours blend into something great. The coffee and potatoes are good as well! Must try and worth the wait if there is a line outside.
/user_details?userid=q1OaKlzAxd0LC0FRWZwLag,Nick K.,"Central LA, Los Angeles, CA",5 star rating,Amazing place and food. Quick service to boot. They served some fruit before the main course which was pretty cool too. Will be back for sure.
/user_details?userid=4McoAuXDYZSRmHgDnWsOzQ,Dave N.,"Dollard-Des Ormeaux, Canada",5 star rating,"I've always been a big fan of the original avenue on Mount-Royal , therefore heading into the one on Notre Dame , I had very high expectations. To my surprise , I thought the one on Notre Dame may be better than the original one. The food was exceptional, the fruits always seem to be in season ,  and the staff was extremely friendly. We had a waitress named Lilly which was extremely helpful in helping us with our dietary needs. The bathroom was very trendy as was the decoration of the restaurant. I would highly recommend this restaurant however I don't think they need my recommendation because the line up during the weekends speak for themselves. My only recommendation is go during the week, but besides that it's the best restaurant."
/user_details?userid=ecYddXR0m9WOnXalRvztjw,Toby S.,"Celebration, FL",5 star rating,"This place had a great atmosphere, and huge portions. We loved the fact that they gave fruit skewers instead of bread like you typically get. I had the indecisive meal, and the maple pecan French toast, which was delicious. My wife had the passion fruit pancake, and by far the best pancake she and I have ever had (yes, I stole a bite) Great place for a family breakfast or brunch."
/user_details?userid=rgwEs6Nte-d6VLBmruO2xA,Tess L.,"Whitehorse, Canada",5 star rating,"Amazing service, delicious food, generous portions. I loved the Indecisive menu option. Had the coconut guava pancakes with fresh fruit. AMAZING!! Try their housemade beans! I will return to L'Avenue."
/user_details?userid=ciBjf-UBgR59BXdJ19d_QQ,Joel P.,"Lawrence, MA",5 star rating,"We found this place through yelp before our trip back to the states but it was definitely a highlight of our trip. Once I saw a line outside, I knew this place was worth it. We waited about 30 minutes in the cold but it was worth it. As soon as we were seated, the waitress offered us a champagne bottle due to the wait. The menu can be a bit intimidating due to the many great choices. The food was great and the sides were tasty! The portions are large and our server was very attentive. Worth the drive and the wait."
/user_details?userid=Li6jmiVfg9qtNsD78dTjRw,K A.,"Bogota, NJ",4 star rating,Great brunch restaurant! There will be a wait but we'll worth it and the line moves quite quickly. Lots of health options as well as the decedent specialty dishes. A must for brunch in Montreal!
/user_details?userid=Xqysaj9bj9s6ZH5f3hSUIA,Xia W.,"Ville-Marie, Montreal, Canada",4 star rating,Egg Benedict is really nice. I ordered 'Rainbow'. It tasted awesome.
/user_details?userid=hQrb3DaAPA6LsfyUEPfChw,IG-38 G.,"Ville-Marie, Montreal, Canada",5 star rating,"There is only so much one can take in, however I felt that wasn't true for me.  I was just eating my way through the entire place.  You should try dipping eggs in maple syrup. It may sound disgusting but it's actually really delicious. Service is also good here."
/user_details?userid=NXGHE6Cbjpk5S6LNATdYzg,Cindy K.,"Montreal, Canada",4 star rating,I go to the l'avenue on mont royal so I decided to try out the new one that opened in Saint henri. The standard is great and pretty much the same but the wait times is long and there is something just a little bit missing in the flavours. However all around delicious still!
/user_details?userid=Vwbvr8lbQSgwD-iCPmOwxQ,Joanne M.,"Briarcliff, TX",5 star rating,"We came here for a father's day breakfast. It was super yummy! We got here at 8:15 and it was pretty empty. Full by 8:50ish,though! Great food with generous portions. We are from Texas so we know what big portions are!Great place!"
/user_details?userid=W90xlJgPOqkwWPN1KORPOw,Andrew C.,"Montreal, Canada",5 star rating,"Was there about a month ago on a week day morning. So many things to love about this place! Hilarious menu copies (kudos to the creative copywriter).  The large water container filled with luscious watermelon where our waters came from...there is something super satisfying about looking at that water container.  Cool decor and feels very inclusive. The food was great! The best part was... all the waitress there were SUPER professional, friendly, efficient and they carry themselves so well! Elegant, approachable, well-mannered.  Special shout out to Noemie (I think that's her name), she was our waitress, she was just SUPER!   I got the feeling the management really did a great job finding perfect staff. 10 out of 10!! :)"
/user_details?userid=--Nenfm4GBg6w2JsqKcT0g,Layal S.,"Le Plateau-Mont-Royal, Montreal, Canada",5 star rating,"My prayers have been answered. Finally, a brunch place I like! I've tried a lot of the popular places like Cora's, Allo Mon CoCo, and the like, but none of them ever clicked with me. L'Oeufrier is okay too, but it just didn't have what I was looking for. This place checks everything off my list: sick decor, nice staff, clean and visible kitchen, huuuuge selection on the menu, and great drinks. I haven't read the other reviews, but I really recommend checking out the washrooms (as weird as that sounds - lol, just thank me later!) I ordered a nutella coffee to start and wow - it does not compare to the plain blah coffees I got at other places. It was served with a strawberry and a little chocolate, so maybe next time I'll order it after my meal. The omelette I got was so big and filling that I had to take part of it home! This place is pricy but you really get your money's worth. This is a new favourite spot for me! I haven't been to the one in plateau as this one seems a little less busy, but I'm sure that one is just as good! It's a 10/10 place for me!"
/user_details?userid=Oy2dflVMqvNVTZPffJVWhQ,Wanyue S.,"Saint-Laurent, Montreal, Canada",4 star rating,"This is the first time I had brunch in MTL, so I cannot compare with other restaurants, however, it was a really good experience in L' , foods have nothing to say, there are very good! All you need attention is the dishes are big potion! Grils should notice that, by the way, my male friend and I both couldn't finish them."
/user_details?userid=KcZOGv_2fnDZyRTnfqD1FA,Antoine C.,"Montreal, Canada",3 star rating,"Now then onto one of the biggest treason I've ever felt. I love l'Avenue, the food is really good and the portions are more than decent. But why oh god why do you put watermelon in the water! I know it's supposed to be better but I'm one of those people who simply can't bear watermelon, the smell and more importantly, the taste. When I went last time, it was hot and I was thirsty and yet I couldn't drink the water I was served. Please keep in mind that not everybody likes watermelon and I sure don't like people assuming my tastes. I know it's not that big a deal but afterwards I had to justify why I wanted tap water when I should be served that in the first place. Anyway food is awesome but beware of the watermelon water!"
/user_details?userid=-9b4s874f_CnznTu4JorRg,Lison C.,"Montreal, Canada",4 star rating,"Went there yesterday, I already knew the place on Mont-Royal, and it is the same. Same menu, decor and service. Nice menu I really enjoy their eggs Benedictine, especially the chorizo and the spinach/goat cheese, but if you like big brunch the""bon ben j'me la prend toute"" is made for you. Everything is good, go over there for a nice brunch :)"
/user_details?userid=1BmKh3oPuTio8mMTVtAKFQ,Yasamine J.,"Montreal, Canada",5 star rating,"Now listen here, I eat a lot of brunch, but this is probably as good as it gets. I had been eyeing the carrot cake pancakes for the duration of our half-hour wait in line, but when it came time to order, I chickened out and ordered the grilled chicken egg white omelet instead (no pun intended). The omelet was studded with chunks of grilled chicken as well as spinach and swiss cheese and was absolutely delicious and satisfying. On the side, they offered homemade jam that I happily spread onto my gorgeously toasty baguette. Luckily, my friend ended up ordering the carrot cake pancakes so I got few fork-fulls in and boy oh boy were they good. Although my omelet was pretty great, it would be foolish to order anything by those pancakes. Fluffy, sweet, and smeared with cream cheese frosting and walnut pieces, I still dream about them sometimes."
/user_details?userid=4VK5ODtx66tS4iDkpCFEpg,Cal T.,"Montreal, Canada",4 star rating,"L'Avenue in Notre Dame, is everything the original is but without the long waits. Great food and very professional and friendly wait staff. Finally found my permanent breakfast joint."
/user_details?userid=j9hGOy6OsSshQxwyFGIaFg,Marisa P.,"Saint James, NY",4 star rating,"I had found this restaurant on yelp before heading up to Montreal for a week-long trip. It was the first breakfast we had, and definitely the best (even though the other food was great too)! We went on a week day and there was still a wait, but not too long which was appreciated (the best restaurants are worth waiting for)!I liked the serving of fruit first, and my eggs with mushrooms over toast was phenomenal, and enough to take home for seconds! There was a huge variety on the menu. Would definitely recommend going to this establishment! I'd definitely go back if in Montreal again!"
/user_details?userid=q8qqTUJXqyS_4csANxIIpA,Ami J.,"Old Toronto, Toronto, Canada",5 star rating,Had brunch on a Thursday. Small wait at the door for you the restaurant is likely to be good.Instincts were right one of the best brunches i have had in a long time.Both myself and my fiancee enjoyed the food and the restaurant decor.Service was pleasant and efficient.
/user_details?userid=bLDCykDSRZ7J7RYUVODOwg,Erin L.,"Arlington, VA",5 star rating,"Fantastic brunch spot! The food is delicious and the menu is expansive, creative and fresh! We started with fresh fruit. There are a dozen delicious options for eggs Benedict. I had eggs with caramelized onions, mushrooms and cheese. Fantastic. Great coffee and fresh juice. We didn't have mimosas but they appeared on point. I'll definitely be back!"
/user_details?userid=OeFKp6IIUKT-oiNGlNAxkw,Madison M.,"Ottawa, Canada",5 star rating,Such a great little place to have breakfast. We had the classic and chorizo eggs Benedict and it was absolutely amazing! We will definitely be back!!
/user_details?userid=U2rlc2FMJZFS2m5hHe3GaA,Marie K.,"Ville-Marie, Montreal, Canada",5 star rating,Wonderful breakfast spot - the fruit was very fresh and the melon water was a great surprise. Our eggs were cooked perfectly and we would definitely go back ! Great service as well.
/user_details?userid=irwJvVVnlrUqFynDMf6QJg,Tania B.,"Montreal, Canada",5 star rating,"Watermelon water!!! This place is just awesome!! First time here. The service was good, coffee was great, food was even better! In a sea of mediocre, over priced brunch spots- especially in Griffintown, this place is definitely worth checking out!"
/user_details?userid=MYpg3_Yl0BgXQAaaC7Y5-Q,Marili R.,"Miami, FL",5 star rating,"I haven't even left the restaurant yet and already writing s 5 star review! Cappuccino awesome, fruit plate before meal is delicious. My husband ordered the complete meal called something or other in Spain. It was really good. The real treat was my meal. It was a sweet/savory/crunchy eggs Benedict. A.MA.ZING. must have. Service also excellent!!"
/user_details?userid=eL9wiskWF5bnlvZQdjbajg,Virginia Y.,"Western Hill, Saint Catharines, Canada",1 star rating,Very unimpressed with the service. I have food allergies and the staff was rude and not helpfull at all! They were not willing to accommodate at all or make a lunch item early because they had nothing that I could eat. The closest option was a fruit skewer. Which was pitiful. My children order fruit and egg platers and they had more fruit then what was offered to me. If you have any allergies don't go here!
/user_details?userid=suKOlIlHse70oqpPKF3eGQ,Diego B.,"Côte-Des-Neiges—Notre-Dame-De-Grâce, Montreal, Canada",4 star rating,"As of today, one of my favorites in Montreal! Delicious food and awesome environment! Absolutely recommended"
/user_details?userid=wXwOc-uRstawwnR-zt_yFA,Betsy L.,"San Francisco, CA",3 star rating,"Went this morning and got there early, so there was no wait.  We both ordered an omelette, his with a bagel, mine with brown bread.  While we waited, they served us each a fruit brochette.  Sadly it was put on a plate that was so hot out of the dishwasher it was still quite hot when it got to us.  The fruit was not great. I had a couple of pieces.  The cantaloupe was not really ripe, the banana was brown on the ends.  I gave up after that.  Finally the main meals arrived.  They looked good, but they really aren't omelettes.  They are more like frittatas.  There was their homemade sausage in mine, and I really enjoyed that.  The omelette was massive, but mediocre.  Not bad, just mediocre for the money.  The brown bread was a multigrain and it was great.  It had almost no butter on it though, which would have made it even better.  Service was weird.  We were served by a few different people, and everyone seemed to share every table.  This doesn't really make for good service.  It took quite a long time to have anyone notice we were done eating and clear our plate.  Most of the people who finished before us left with a take home container.  We ate half of our omelette each, yet when they cleared the plates no one asked if we wanted it to go.  Like the food, the service was not bad, just mediocre.  For the money and hype, I expected a lot more."
/user_details?userid=u_e0GucjVhu4Fw1Np6AtgQ,Connor S.,"Montpelier, VT",5 star rating,"We got here just in time to beat the crowd lining up out the door. The waitstaff never let our coffee cups stay empty, and the portions were HUGE. The service was on top of it, even as busy as it was."
