user_url,user_name,user_city,user_rating,user_review
/user_details?userid=RWxAmmEmOod3HbI3KNp2Sg,Yann M.,"Atlanta, GA",5 star rating,The food was fantastic! I wish I remembered what I ordered but it was absolutely amazing. I can't say much for the drink though. We made reservations but there was a quite a line when we arrived around noon. The service was great. The waiter spoke English and French. The restaurant was very artsy and casual. The potatoes that I ordered were so well seasoned and coated with syrup. I highly recommend!
/user_details?userid=IMHvG_ysz6akYIM-GO18kg,Andrea D.,"Le Plateau-Mont-Royal, Montreal, Canada",5 star rating,"This has been my favourite brunch place for the last   8 YEARS ! I'm always trying out newer places recommended by friends, but l'avenue still stays at the top of my list. Their menu is very varied  - brunch plates (eggs, meat, potatoes, side of bread) , omelettes, eggs Benedict, sandwiches, sweets (waffles, pancakes etc), steak and eggs, cast iron dishes- but the quality of their food stays so high. I've tried out different things on the menu and am consistently impressed. One of my favourite things to order is the ""undecided "", basically a mix of all of the above when you just can't make up your mind. Or when I'm less greedy, I go for their eggs Benedict dishes.  Toppings are AA quality, hollandaise sauce is so creamy, poached eggs cooked to perfection.  Last tip- you NEED to check out their bathrooms. Bring your phone, you'll want a selfie!"
/user_details?userid=yACLb6lUDPjw0g5JrNwXMg,Kyle S.,"Atlanta, GA",5 star rating,"This place lives up to the hype it has on Yelp and social media. Hip spot for breakfast and brunch. I was unfortunately only partaking in the eating part and none of the drinking as I had to drive back to the states, but the food here is amazing and comes with A LOT. Each meal comes with a fruit skewer that I thought was awesome. I ordered the French toast Benedict, and it was literally so much food I couldn't even finish. And I'm a big eater, I usually always finish my food at restaurants. And it was delicious too. The egg was cooked perfectly (pet peeve of mine when an eggs benny egg is not poached well). Great mix of flavors. The side of potatoes was good too. Again, just SO MUCH FOOD. Pro tip: come here early before the rest of the hipsters and trendy people wake up and do brunch."
/user_details?userid=aZvNQg3zSF7sPHMJvSTOpw,Joyce K.,"Toronto, Canada",4 star rating,"L'Avenue was one of the highly recommended restaurants to try in Montreal, so we dropped by on a Friday morning for brunch. I was a bit surprised at the long line-up out the door since it was raining that day. Fortunately, the servers came out with umbrellas for those of us that just have our hood on, which was very much appreciated. After a half-hour wait, we were seated in the bustling dining area that had a hip and retro décor, and given an extensive menu that offers omelets, crepes, toasts, benedicts, pancakes etc. We decided on the classic eggs benedict, rainbow eggs benedict, and Bobby does Dallas. The classic eggs benedict came w/ 2 poaches eggs, beer braised ham, hollandaise sauce, and roasted potatoes on the side. The rainbow eggs benedict was presented the same way, except it had smoked salmon, cream cheese, and capers in place of the ham. For both dishes, the poached eggs were perfectly runny, and the hollandaise sauce was smooth and creamy. The flavors were rich and went well with the ham/salmon. The potatoes were also nicely seasoned and aromatic, with a slight crisp on the outside. Only caveat is that the ham was sweeter than I prefer. As for the Bobby does Dallas, it was a massive cassolette w/ eggs, steak, cheddar cheese, mushrooms, potatoes, and a baguette on the side. The dish was delicious for the first few bites, but then the sweetness of the bbq sauce became a bit too overwhelming. Pairing it with the baguette helped to offset the sweetness a little. Overall, L'Avenue is a solid place for brunch; just make sure that you come early to avoid the line."
/user_details?userid=8qu5Zyurap002eIj1kLdOg,Joana Z.,"Saint-Lambert, Canada",3 star rating,"L'Avenue is probably one of the brunch restaurants in Montréal that gets the most hype and buzz around. My friend and I went there on a Friday morning and the restaurant was packed. We wanted to sit facing a window or close, but it was all taken so we got a seating in the middle of the restaurant. The restaurant itself is gorgeous, the walls are painted with graffitis and you have to take a photo in the bathrooms! My only issue with the bathroom was the water on the floor (it was everywhere) as well as toilet paper. I believe it is normal to wait before being served, especially if the restaurant is packed, but my friend and I waited 15 minutes before the waiter first came to get our drinking order (2 mimosas). We then waited another 10 minutes to order our food. Again, our waiter was running everywhere because of how packed the restaurant was... maybe they were understaffed? As for the food, the mimosas were very good, filled with alcohol, the fruit brochette they bring in the beginning was delicious as well.I ordered L'indécis and got bacon and sausage with a Nutella/strawberry waffle. The waffle was delicious, perfectly creamy. The potatoes are a classic, they were very good. I didn't love the sausage, it was pretty dry. Also, they only bring one strip of bacon (I would've expected more, especially for 18,88$). The eggs were delicious as well, no complaints there. Another issue my friend and I had were the flies everywhere in the restaurant. They don't have any nets on their windows and they opened the doors wide so they are EVERYWHERE and eating with them is truly annoying."
/user_details?userid=RwQUv7Cn61gTkPXcytSrSQ,Amy Yu T.,"Montreal, Canada",4 star rating,"L'Avenue is a classic in Montreal. However, ever since they changed their menu, they don't serve my favourite item anymore (œufs coin coin), which made me decide to remove a star from them because they do not stand out from all the other brunch places in Montreal anymore. They serve breakfast like a two or three course meal, and the entree is a skewer of fruits, and then they bring the ordered meal. I had the smoked salmon bagel, which was decent and the portion of smoked salmon was very generous. Overall, the quality and taste of the food served here is pretty consistent and never disappoints. They serve a good selection of coffee and other lattes as well.The vibe is a fun one, not too snooty nor too posh. I also want to point out that there is always a line after 10:30 on the weekends."
/user_details?userid=rRKRIBTKW8IrkJsF53DonA,Ryan K.,"Saint-Laurent, Montreal, Canada",5 star rating,"This was always one of my favourite brunch restaurants in Montreal. It's been a while since I've come and I definitely waited way too long to return! But this was my 1st time at this location. Bottom line, it did not disappoint! I couldn't resist ordering the Mac + cheese waffle, even though there were so many great options. It was delicious. I loved the seasoning on chicken. The portions of course are humungous, so don't forget to bring your appetite! I will definitely not go so long before coming back."
/user_details?userid=eF0N0s6CeiZYPt0frlX48A,Annie K.,"North York, Toronto, Canada",5 star rating,"Annie KimYour review will be posted publicly on the web. Learn more""The best eggs benny ever!""What time we arrived/Wait time?Arrived on a Thursday at 1pm and there was a 45 minute wait. It seemed to be worth it for others to wait in the rain so we did too!Atmosphere?The atmosphere is busy and bright. Crowded seats and fast paced but there is a hanging motorcycle on the ceiling and an amazing vibe to the place. Checkout the washrooms for sure ;)Service/Staff?The staff was great. Decent and nothing over the top. Very busy so not very service oriented.Food/Menu/Pricing?The food is amazing. The mushrooms eggs Benedict I would recommend to everyone. The best I've ever had and the potatoes that come served with all the meals are sooooo flavourful with the herbs. You'll be MORE than full here. We got the fruit smoothies and those were just okay- definitely healthy which is a plus! But two can share one of those for sure."
/user_details?userid=DkvaAV7F4Y_rw040k0XGvQ,Wilma R.,"Toronto, Canada",5 star rating,"A super hip place with some great breakfast/brunch dishes. It can get super busy so arrive early to secure a spot. I had the Saint-Ambroise Eggs Benny and they were delicious; rich and flavourful, and the potato crisps that come on the side were cooked perfectly. The meal is huge and I was stuffed by the end of it. The space is very cool with graffiti/cool artwork lining the walls and colourful, lit-up washrooms that are great for a silly picture. Service is super quick and friendly. I'd come back to try all the other Eggs Benedict variations."
/user_details?userid=5Q4PEmN1-D_y-ZFkSJRsAg,Elich O.,"Arlington, VA",4 star rating,"Best place for brunch!!! I heard there is usually a line up but we got there at 10am and we got sited for four in less than 10 minutes.Place is big with nice decor, especially the restroom is really cool. Service was great but maybe the place needed more help on a Saturday. Food is amazing, strong coffee, mimosas were ok and milkshake was delicious. They have free fruit plate till you wait for your food which I thought was an amazing idea for impatient people like me waiting for their food ... lol"
/user_details?userid=ypg0FdxgEcDdYP6nYBcq0g,Diana M.,"Garfield, NJ",5 star rating,"Great place for breakfast. My husband and I both tried a smoothie. They were huge!!! But they tasted soooo good. We both loved our breakfast options. I remember really liking my french toast with nutella and strawberries on it. We both left super satisfied and happy. We did have to wait about 20 minutes before being seated, but it was worth it."
/user_details?userid=c3kFBgv-eyHP5-AFfFaaiA,Leah M.,"Jersey City, NJ",5 star rating,"Absolutely amazing. Excellent service, worth every penny. Very large portions, we couldn't finish it! And we got fruit before our breakfast. Would say it's a must-visit for Montreal!!!!"
/user_details?userid=fQcfRZkcOO-MXFYD5umf2w,Alan S.,"Houston, TX",5 star rating,"This place was delicious. I highly recommend you give this place a try if you're looking for some brunch downtown Montreal. They give you a fruit on a skewer as a free appetizer which was an amazing touch. I had a sweet and crunchy eggs benedict, which was eggs benedict with ham on top of French toast. my mom ordered the chocolate banana shake which I got to try some of which was also delicious. A little under $20 a person the prices are even reasonable!"
/user_details?userid=mBUW9pLyf1fa3NyVJPtNMg,Steven Z.,"Boston, MA",5 star rating,"BEST BRUNCH!!! My friends have been telling me L'Avenue is the best brunch they've ever had and they weren't lying. Their fruit skewers are pretty yummy and add a nice touch. The French toast is the best French toast I've had, it's somehow crispy on the outside but fluffy on the inside. How they accomplish that is besides me! The Californian Benedict was very good as well!"
/user_details?userid=vekEZkHLDO3iqm90es-rmw,Mazal S.,"Boise, ID",4 star rating,Wonderful service. We came here twice with huge group of ppl. Were served really fast and servers were very helpful and attentive. Loved the healthy options for kids and adults. But the bathrooms... were the coolest ones I've ever been in. Especially the red bathroom. They have the Dyson airblade tap with hands drayer fan. So cool! Felt like in a 60's movie with the endless mirrors and disco music. Only wish they installed the diaper station in a different room. My 9 months old was scared to be in the florescent / ultra UV themed bathroom. It was trippy for sure
/user_details?userid=JXS6pNnc0aaS6SqoUhUiSQ,Jermaine G.,"Belmont Heights, Long Beach, CA",4 star rating,"4 stars as the waiter I had used the F word which was not appropriate and my tip reflected it. Although he was friendly and gave me nice advice on the menu I think he got a little excited and forgot that he was working and thought he was at a night out ( I do have that effect on people) I had the Oreos milkshake, the indecisive with ham and home made sausage which was divine. The vibe was fun, good music, food presentation was top notch and the taste was it's equal."
/user_details?userid=rkPrz6uwJIefZdH2Oqv4Tg,Christian C.,"Ville-Marie, Montreal, Canada",1 star rating,"The only vegan option is a chia pudding. Put yourself in our shoes, would you consider this a deserving brunch option? Must we do science homework and make a meal from toast, smoothies, fruits and chia pudding? In 2019 every brunch place worth it's grain of salt has a form of vegan option that's on par with the monstruos big plates of omelettes, pancakes and bacon."
/user_details?userid=vlQsaUQmdJGHvqyepBQlwA,Melissa E.,"Brooklyn, NY",5 star rating,"Such a cool and fun spot for brunch. Decor was creative and trendy. I had amazing carrot cake pancakes, which of course I topped with lots of Canadian maple syrup. AMAZING! The service was great, our waiter was so fun and sweet.**Reviews had me worried since they don't take reservations and we were a group of 5. I anticipated a long wait and line, but I arrived an hour before closing and there was a short line and we even were able to skip the line since they had a 5 person table available before a 2 person table. We probably waited on line no more than 10 minutes.So glad we got to check it out"
/user_details?userid=5QrlMMzUq_RoUlEyH2zcig,Judy K.,"Montreal, Canada",3 star rating,"Now please don't get me wrong the food is absolutely delicious, the decor is most definitely on point and the staff are all unique, friendly and hard working however I'm docking a star because  the owners just don't care. The last three times I've come here the floor has been short staffed and there's no structure enforced. Today I witnessed our waiter serve roughly seven tables alone; mostly small groups of 5-6. Now for the none waitstaff reading this review that means; serving water, then drinks and/or coffee, taking the order and explaining the very detailed-tons-of-options menu, dropping off individual fruit plates per client who ordered ANY dish, clearing said plates, refilling coffee, bringing main courses, refilling waters... etc etc etc.  We waited twenty minutes to be served and I patiently sat and watched our waiter do this all alone. No one ran a single plate or drink, he bussed more then the majority of his plates himself.. while the support staff did zero support. They were understaffed and management wasn't directing the busboy or helping his waiter who was clearly in the weeds.This is the third time that I've witnessed good waitstaff get thrown to the wolfs. Our waiter was apologetic and acknowledge us as much as he could, sure he forgot our hot sauce and he might of dropped a piece of toast but he was pleasant and did the best he could while upper management set him up to fail. Very disappointed in the owners."
/user_details?userid=Tnn_sY9W24ho4Kw9uwuK6A,Sheila C.,"Markham, Canada",5 star rating,"Although I do feel like the mont royal location serves prettier food, this location is prime for the reduced wait times for delicious food.We got the eggs Benedict with Montreal smoked meat and an indecisive with pecan toast. Like my other review on the mont royal page, the eggs Benny's made well. Although the Benny's held a strong Montreal influence with the smoked meat, I think I prefer the original with ham. This is because the added mustard on top is a bit off balance for me. I must say though, the French toast here was beyond the mont royal location! Thick toast and a scrumptious pecan sugary treat topping. It was the best addition to the salty favours from the rest of the dish. The sausage was also cooked to perfection with a sweet after taste. The balance on the indecisive was better than the smoked meat Benny's. Overall, stellar performance by the L'avenue crew. Do expect to drop at least $25 a person at this brunch restaurant."
/user_details?userid=OOWr74yjYooXIxgOQD0vhg,Tatiana S.,"Frederick, MD",5 star rating,"The brunch at L'Avenue is top rated! With a diverse menu of options with plenty of vegetarian choices, I found myself pleasantly lost in their menu as I decided what to get. As a french toast connoisseur, I leaned towards the breakfast options and didn't regret any (caloric) decisions I made on this day. I had the banana nutella french toast with a side of scrambled eggs & blueberry basil mimosa. The french toast was the most delicious french toast I've ever had. Apart from it being drenched in an appropriate amount of nutella & English cream, the second best part was the toasted coconut flakes on top. The scrambled eggs were pretty good too and the blueberry basil mimosa made made feel like I was doing something healthy for my body  The service was good and the only negative thing is that, because of their popularity, you will wait in line for a bit. Totally worth it though!"
/user_details?userid=r6PbQjtij6gcalYWBBrILg,Maria B.,"Laval, Montreal, Canada",5 star rating,"Fran fricken tactic breakfast !!!! I've been searching for a great breakfast place since my favourite spot got shut down and I'm very please with the find. L'Avenue is an amazing breakfast/brunch spot and the st Henri location really has a way of fitting in with that hipster/dive-y vibe. When I first walked in the decor really got my eyes I noticed a big neon sign for the lavazza coffee that they serve and a really cool bike piece that felt like it was right out of tron. The theme is continued in the seating area with a cool graffiti wall and the bathrooms have multiple neon lights and mirrors that are great to play around in and take some pretty cool pictures The menu is a work of art with so many choice is felt almost wrong to not pig out a bit. To start we ordered a strawberry and watermelon mimosa and baileys coffee, while the waitress put the order in for drink we turned the page and saw the rest of the drinks menu so obviously we had to get more and the Caesar was my next go to The main plates were the duck eggs benny amazing taste and pretty self explanatory next dish and wait for it ... sweet savoury and crunchy eggs benny. Picture the most perfectly poached egg covered in a perfect hollandaise sitting on top of Swiss cheese and a plank covered French toast !!! Bruhhh I was in heaven for the duration of the meal. Somehow I managed to also eat the house potato's which were seasoned amazingly and I also chuffed down half a milkshake.Seriously don't know how I got up to walk to the car after all of that but I made it and would 100% recommend popping in for a great breakfast meal !"
/user_details?userid=BjeyTXxk61rAdWyHiLHg9w,Sehrish N.,"Saint-Laurent, Montreal, Canada",4 star rating,"Came here for a last minute brunch with an old friend. I decided to have shakshuka for the first time and I fell in love!!! It was pretty good with potatoes, tomatoes, peppers and poached eggs. I had it with a baguette as you have a choice from breads to choose from. I think they could improve the dish with some more seasoning otherwise I really like it. My friend ordered a pecan french toast. It was very sweet but very scrumptious. You have the choice of having your caffeine drink in a cup or a bowl. I ordered a latte in a bowl which I enjoyed throughout my meal. However, it does cool down fairly quickly. I am lactose intolerant and unfortunately most restos don't carry lactose free milk. However, they had almond and soy milk so I chose that for my drink. Service was great. We didn't have to wait long. Our server was very good and helpful and polite. She was able to serve my friend in English who isn't from Quebec."
/user_details?userid=zZjNwaX7KKCWhs7sovzwCQ,Ki Y.,"Brooklyn, NY",5 star rating,"Like breakfast foods? Like hip hop music while you're eating that breakfast food? Like good drinks at really nice prices? Well than this is the place for you, and certainly me!L'Avenue takes breakfast/brunch to a whole new level of awesome with massive portions and cheap drinks. We strolled in on Friday around 1 and waited only 5 minutes for a table. Not too bad considering I knew this place usually has lines out the door on weekends. Their egg game is strong.I got a massive 4 egg omelette behemoth called the St. Ambroise, which had beer braised ham and St. Ambroise cheese in it. Very very good. The only thing I was disappointed with was the St. Viateur bagel that came with it. Being a devout NYC bagel lover, I must just not like the Montreal style.My friends got two different kinds of benedicts that they said was very good and devoured. All the dishes came with an array of skewered fruit which was a nice refreshing start to the meal. The drinks were made well and very fairly priced. & Service was solid!Oh and the interior design of the place is really fun and vibrant. Walls splashed with crazy murals and bathrooms that have multi-color lighting and motorcycles hanging from ceilings. You know... just your average restaurant decor!"
/user_details?userid=VseHlPAVhHbNZqyl_zRKBQ,Stephanie C.,"Pierrefonds-Roxboro, Montreal, Canada",5 star rating,"I was super excited to find out that there was another location of this awesome breakfast joint - and it does not disappoint! Just like the main brunch spot, the dishes maintain their great quality and generous portion! The same menu and atmosphere is kept as well. And because this location is much bigger than the one in Montreal, the line-up and the wait time for the food is much shorter, and the service is much faster. The only downside just like the other location is that parking is hard to find."
/user_details?userid=-fvoES_EA1-6hAQqWpphmw,Wesley S.,"Philadelphia, PA",5 star rating,"I discovered this restaurant the first time I visited Montreal and have returned every time I have come back for vacation.  3 times now and it has never disappointed.  Fantastic food, great service and awesome atmosphere.  It's definitely spoiled me for what other places should offer for breakfast.Spring for the Millionaire Bacon! It's well worth it!Get there early though because the line will wrap around the block sometimes."
/user_details?userid=6yTV_iirY6r21EeTRGPGqA,Jolie C.V. H.,"Montreal, Canada",5 star rating,"I was so excited to try this because of all the great reviews but upon sitting down I thought it was just like any other trendy brunch spot.  It's a great space and thoughtfully designed. Graffiti wall, cool colorful lights, suspenders and bow tie clad servers, garage door that open up the back terrace area.  However, the menu did not look like anything special other than two, YES, TWO, full pages of cocktails. Good looking out for the boozy bunch!  Thanks and cheers!It took me a while to decide on food because it all sounded the same. I let my server's recommendations narrow my selections and ordered the Duck Benedict and a coconut maple coffee concoction. The coffee was great. I had never heard of it before so of course I had to try it. Now, the duck...omg...that was good. The English muffin was a little tough, not sure why I had such a difficult time cutting through it but after a while I was getting so full; there wasn't any more room left for bread so whatever.  The poached eggs we perfect. The duck was tasty. The potatoes...man, you know a place is legit when something as simple as potatoes are spot on delicious!The service was excellent!  I did not get my servers name but she was so awesome.  I'm so glad a Yelper mentioned that she liked this location better than Mont Royal. She was not lying. It's fantastic. I suppose I cannot compare since I've never been to the other location but I've passed by several times and there was ALWAYS a long line. I'm not standing in any line when there is amazing food all over this city.  Anyway, back to my amazing server...she was delightful. Warm, charming, checked in with me at appropriate times, totally girl crushing on her!  Even the manager stopped by to check on how everything was.As if that wasn't enough...the surprises never end. Ok, so if you happen to be here and you are completely hungover or high I suggest not using their restrooms without assistance. You will not be able to find your way out.  Pictures attached....  Man, I forgot to snap a picture of the damn sink!  The water was a little too hot so I'm trying to look for the ""cold"" lever. Instead air is drying my hands!  Thanks, Dyson. You are a clever old man.  Love all your stuff. Hahahha...enjoyed this place thoroughly."
/user_details?userid=hG0FxhGxIz5mv1ezaKcQiw,Sam P.,"Montreal, Canada",4 star rating,"Great quality brunch! This was the first time I tried this location and am already looking forward to going back. We arrived to a lineup of people but were the only group of two and were seated right away (lucky us!). The menu is large and everything looked amazing. So many unique options! Ironically, me and my partner chose the same thing. We waited longer than expected for our meals. That was disappointing as we saw many tables who ordered after us get their food before us. However, when the food came, they proved that the wait was worth it! A picture is worth a thousand words so I'll let the picture describe the deliciousness. (best potatoes ever!). Huge portion so I had enough for dinner when I finally got hungry again.The restaurant itself is super cool and similar to the other location. Bathrooms are different though but equally fun!Food:5/5Service:4/5Value:4/4Atmosphere: 5/5"
