user_url,user_name,user_city,user_rating,user_review
/user_details?userid=CzgZt_C31sorjhGF4Wvqeg,Susan T.,"Toronto, Canada",4 star rating,"Funky brunch place with interesting decor. The wait time isn't very long for a busy Sunday brunch day. For a party of four, we waited for about 20-30 minutes to get a table. When seated, the service was a bit slow and we waited for about 10 minutes before the waiter gave us water. The waiter was friendly and after taking our order, our fruit plates arrived right after. I ordered the 'Indecisive' with bacon, sausage and the carrot pancake for my sweet option. The portions are big and I was very full even before tasting the pancake. The food overall is delicious."
/user_details?userid=9nj5lry5KkSal22Oo9VGvQ,Cayla L.,"Brossard, Canada",4 star rating,"This was the first time that I came to the Avenue in st-Henri instead of the Plateau one. There was about a 20-30 mins wait time which wasn't too bad.The food was good, I took the egg Benedict with wild mushrooms and my boyfriend took the Bobby goes to Spain. I definitely recommend the egg Benedict section. The portions are huge.I'm giving a 4 star just because the waiter knew that I got a birthday free meal but instead of communicating with his manager , I had to remind him several times. I understand that it was a busy day but instead of responding to me with the bill with both meals priced, "" sorry let me correct that or follow up with my manager"", he said ""the manager needs to approve it"". At that time, the manager has already approved it since we were seated. That's my only feedback that I could give for improvement. Otherwise the restaurant was great!"
/user_details?userid=CxDOIDnH8gp9KXzpBHJYXw,Jennifer K.,"Markham, Canada",5 star rating,"No lines!! No one!! Love this L'Avenue location.We were seated right away for breakfast brunch on a weekday. My friend willingly to share an order of Egg Benedict with me. Thanks so much! I still have nightmares about my last visit when no one wanted to share anything with me and I ended up being so stuffed and could not even think about eating until dinner time!Love the option for a split order with an additional $2.50 charge, you can have your own fruit skewer and potato.Everything was perfect from the food to the service.A truly 5 star experience without the price tag!"
/user_details?userid=HVGfPIZ-w4f0_CfejUGhxg,Joyce N.,"Montreal, Canada",3 star rating,"I was super excited to finally try l'Avenue, but oh well! On a Sunday morning we had to wait an hour as it was insanely busy. Also, when it was our time to grab a table the manager made us wait as we were only two instead of three (my friend was still on her way) and would literally offer the seats to some who had arrived after us; we had to wait about 15 mins additional until my friend finally made it.The food is good, but nothing above what the average Montreal brunch has to offer. I loved the funky decor and the soothing music playing. I would recommend but wouldn't return."
/user_details?userid=Dhse_bnnXPaWcBy3UU-Pjg,Kripa S.,"Montreal, Canada",5 star rating,"One of my favourite brunch spots with the best mIlkshakes I've had. Tried the chicken waffle, Nutella banana milkshake and the chicken benedicts and they were all equally good."
/user_details?userid=RcpiJkkiT5_9UqXz_O1QqA,Konstantina P.,"Le Sud-Ouest, Montreal, Canada",4 star rating,"Lord knows I hate waiting in line for a restaurant but on one of the coldest days of the month during the Christmas holidays, I decided to check this place out with my cousin who was visiting from NYC, in hopes that no one was crazy enough to leave the house for brunch. When we arrived the line was only just out the door, compared to down the block as it often is on a usual weekend. We maybe waited 30 minutes before getting seated near the door but I was happy to be sitting indoors! The service was fantastic, quick and very friendly. Waiter was nice enough to decipher the extensive menu for us even though the place was packed. I opted for their pancakes with cheddar and bacon; portion was huge and I really liked the sweet and savoury mix too! Overall, the food was great, portions were humongous, and the price point is more than reasonable for what you're getting. I'm not a big fan of ""extreme"" brunch spots where I can't finish the plate, but I'd return to L'Avenue as the menu is interesting and fun, with plenty of flavourful choices for all."
/user_details?userid=0Se8OFrPpi6wE2TY2IVTLA,Eric N.,"Montreal, Canada",4 star rating,"Went there for a brunch since lots of people has recommended and never really had a chance to do and when I really want to go, there's a always a huge line up except weekdays lolSo here I am, I gotta say, I ordered the omelet and I didn't enjoy as much as I wanted to. The food is taste really good, don't get me wrong, it was just not what I was expecting. Food quality is good! Don't let my own subjective taste have a bad influence on you.My wife loved their egg Benedict with smoked meat by the way!Service wise, it was great and I got offered with great caring. The waitress saw half of my plate didn't moved and it raised her concern. You might say that's normal but let me tell you, I've been to some restaurants where they don't blink an eye even you didn't touch it at all.The waitress offered to speak with their Chef and I had to explained to her it wasnt their fault lolSeriously, I am going to go back and ordered different food."
/user_details?userid=T6OT8oqqQyFHhs7VOqk3pQ,Pascal S.,"Ville-Marie, Montreal, Canada",2 star rating,"This is a perfect example of how big companies ruin the quality of a perfectly great product when they acquire small companies and have no clue what direction to go in or what they're doing.This place use to be excellent. Now that Cage au Sport purchased the chain it has become an overpriced breakfast place which lacks any quality.A good portion of the menue and some great items are now gone to make matters worst, They did not have their signature carrot cake pancakes because they were out of the topping. The braised pork recipe definitely was changed as it lacked the usual wow factor and gave us an is this even seasoned  feeling. We had no choice to try their Panko French toast instead which itself was only one soft bread and did not offer the crisp that panko is intended for.Service was great but after two attempts  the food quality is just not what it use to be and has reached a point where it no longer makes sense to spend your money there, as the quality and value once was no longer exists."
/user_details?userid=7iZOLfdpS_iRYLR7hi6hPg,Cole S.,"Montreal, Canada",5 star rating,"finally got to try this place! Another popular Montreal restaurant that often has a line up of eager patrons. I went on a weekday around 11 and was lucky enough to be seated right away. The first thing they bring you after ordering is a generous plate of fresh fruits to enjoy while you wait for your meal. Their water is flavoured with huge slices of real watermelon, so refreshing! Really cool Decor with interesting graffiti art on one wall, all kinds of neat fixtures. Lovely polite staff and truly delicious food. Best breakfast potatoes I've had in a while! I really enjoyed this place and having finally tried it I would say it's certainly worth the wait. If you try to go early on a weekday you might have better luck getting in right away."
/user_details?userid=E5lhuIsZZcyCOdzJ589VoQ,Aurélie B.,"Montreal, Canada",5 star rating,"The main reason I went there was to take pictures .The estetic is very artsy. BUT the food was actually really good. I wasn't sure of what to get so I got the ""I'll take it all"" which literally includes everything that is in the picture below. When I went, they were serving water with watermelon, so if you see little things floating in your drink don't be alarmed"
/user_details?userid=jXdnU8ONRIHVzhmDBvlmOQ,Ali A.,"Downtown, Canada",4 star rating,We had to wait for about an hour to be seated. But this was the case for almost everybody! The line was there when we left :) It is a small place and this can partially explain the line. Staff are very nice and helpful. The food is plentiful and colourful (my choice was indeed). They serve some fruit to everyone before serving the meal. I liked the potato and how they make it here. Priced are similar to other brunch places I've been to.
/user_details?userid=GGxg2spTn6jLY0kkEr24ag,Evalina L.,"Miami, FL",5 star rating,"This place is excellent!! The food is incredible, and the portions are huge. First time here and we made the mistake of ordering one plate per person and we left half of the delicious food on the plate. I ordered the California omelette yum yum, and for dessert the caramelized banana pancakes with nuetella, it's a must order. The prices are on the cheap side  $25 per person. Next time I'm in Montreal I will come back for sure."
/user_details?userid=FN2uynNsOBFnblsxrS2LGA,Colin M.,"Pickering, Canada",4 star rating,Very long line ups.  Took 45 minutes to get seated.  Not sure if it was worth the wait but the breakfast was good and so was the service.  I ordered the Huevos Ranchero but it was really a breakfast burrito.  It was okay.  Tasty but they shouldn't be calling this.   A little disappointed in that I was expecting something entirely different.  Fresh fruit to begin was nice.  Coffee was semi strong and hot.  Service was very good.  I'd come again but just order the eggs over easy.
/user_details?userid=qIzhhn2DGXJZKzq5W0WsFw,Helen S.,"Markham, Canada",5 star rating,"Came for 10am, on a winter weekend. Only waited outside for like 5 mins. EVERYTHING IS WORTH THE HYPE!! We all got the indecisive, where you get to pick eggs your way, 2 meats and 1 sweets from the menu. We all got different combinations with the fries. The carrot cake pancake and the guava ones were standout and delicious! The beer braised ham was meh for me but my boyfriend loved it. The sausage was yummy and the creton was a lovely surprise. We also tried the exotic juices, the mango pineapple and the pinapple corriander one.  We ordered 2 of each, and little did we know THEY ARE HUGE. I think they were for sharing, haha. The corriander one is lighter in flav and more herbaceous, if thats what you like. The mango pineapple is just what you think it would taste like- sweet. TLDR; carrot pancake and guava pancake are must tries. Get the indecisive to try alot of diff things. Portions are giant, share or take home if you can. WORTH THE WAIT!"
/user_details?userid=MIJ6XeneTBYa7LiRDlTs8Q,Chuu L.,"West Hartford, CT",3 star rating,"Had a lot of high expectations that ultimately didn't meet the hype. Their breakfast was good, but nothing amazing, and not worth waiting more 45 minutes for. We also couldn't really enjoy the decor as we were seated close to the exit/entrance. They have a ton of options and their portion sizes are large. All the food is aesthetically appealing, but overall the food was just ""good"". Service was decent, but slow as they were incredibly busy.The smoothies were alright, but so incredibly thick (one smoothie can serve two, fyi). I got Bobby Does Dallas, which is basically beef, potatoes, and bbq sauce skillet with scrambled eggs on top. Delicious for the first several bites, but quickly becomes overwhelming to the taste.Still worth a try if you're in Montreal and have time to spare.Fun surprise - visit their restroom but be wary of their scalding hot water that somehow turned on without me understanding how."
/user_details?userid=wffnrXJoLppOlvNOZKU70A,Tamara H.,"Westmount, Canada",3 star rating,"Man, I was so excited to try L'Avenue being a fan of the brunch game in Montreal but somehow having never tried this place. I went to the new-ish location on Notre-Dame on a Wednesday for ""brunch for lunch"". Nice restaurant amid the horrible construction currently ongoing on Notre-Dame. I think maybe because of that fact, there were SO MANY flies and bugs banging and buzzing against the window right next to where we were seated, which made for a less than appetizing environment. If it wasn't for bugs, I would've probably given this place 4*. I loved my vegetarian omelette with baguette bread. Loved the fact that they served the fruits on a separate plate so thumbs up for that! The coffee was your average, refillable filter coffee that's much needed at that time of day.I would only go back if they fix their bug problem!!"
/user_details?userid=p7zk0UiuwCk0qpqPwh7zsQ,Scott L.,"Orange County, CA",4 star rating,"L'Avenue is a trendy breakfast restaurant where owners, chefs, employees, and customers understand that breakfast is the most important meal of the day. You'll see it through their service, execution, and atmosphere. This second location is not as busy as their original location, which means you get the same experience but probably with better service here. I ordered the bacon eggs benedict and latte which was the perfect combination I needed for my first day in Montreal. I felt that I was transported back in the 80s with the Polaroid camera menus, music, and retro decor, and recorders. The eggs benedict was executed with perfection. The hollandaise was not too runny or thick. What was surprisingly great was the bacon. It married well with the spinach and asparagus. Another well-seasoned side was the potatoes. When I thought I couldn't be even more impressed, the complimentary fruit skewer was the perfect refreshment I needed. The only thing I, unfortunately, could not give outstanding review was their latte as the woman barista did not calibrate the machine well in the morning and gave the drink this subtle off-taste. I'm glad I was able to experience at least one great dining experience here in Montreal. It helped make the trip worthwhile. Kudos to the talented french chefs in the back."
/user_details?userid=-BimpRxIUc2791J5Y9uSuQ,Rosy K.,"Townsend, VA",5 star rating,"Love the place! The food is so yummy, portions are huge, staff are so friendly and well trained and the vibe is fantastic.Definitly a place to try out for amazing food and great ambiance"
/user_details?userid=6o1PuE33wstjSgaFezWVSQ,Kamal S.,"Vaughan, Canada",5 star rating,Great breakfast place but make sure you don't mistake tps on the bill as a mandatory tip... they will call you out!
/user_details?userid=M0nCXg9Rt5RwGmXc5MsEzg,Amina A.,"Secaucus, NJ",5 star rating,"Ohmygosh. Mouth watering, absolutely delicious. We went Saturday morning around 10 am, and were expecting a wait of 30 minutes; but surprisingly no line up, were seated right away; was pretty packed though. The decor is very retro, motorcycle on the walls, neon light bathrooms. The menu is just the right amount of sweet and savoury, ""the indecisive"" option caught my eye-the one that you can get sweet and savoury. Anyways, we decided to go with French toast dulche de Leche and Californian eggs Benedict. I absolutely devoured the French toast-so fluffy the cream was so on point! Would definitely return and probably order the same thing"
/user_details?userid=Sh573T1yCq8j6hPSwB_aSw,Richard G.,"Hove, United Kingdom",5 star rating,"My girlfriend & I had been researching Montreal's best brunch spots ahead of a 4 day trip and L'Avenue consistently came up as one of the spots not to miss.Absolutely lives up to the hype. The decor feels really fresh, and it's a really comfortable environment. The staff are really friendly and the food is to die for. We came on a Friday morning at 10.30am and didn't have to wait to get a table.The portions are massive and our eyes were definitely bigger than our bellies! We both got the ""indecisive"" dish.. a mix of sweet and savory.. And they certainly didn't hold back on either.Sounds like we lucked out on not having to wait but I'd happily do so to come back again!No doubt one of the best brunches I've had!"
/user_details?userid=YF3v4Kpyg_YZkb_RTqAKwg,Sarah T.,"Montreal, Canada",4 star rating,"Brunch hot spot!!! A minimum 30min wait on the weekend, and make sure your whole party is there by the time you get to the front or else they won't sit you down.  We were four for sunday brunch, and all of us were happy with our choices. The portions were quite large and none of us were able to eat more then half the plate. Doggy bag! They offer a lot of choice when it comes to food. Finally I had the omelet with goat cheese, which I was happy with. Definitely worth a visit, but if you don't like waiting in line ups, better go during the week."
/user_details?userid=Nq6e5N8bjgD9B46O4va_zA,Sarah S.,"Vaughan, Canada",5 star rating,"The duck confit eggs benny and the strawberry milkshake gave me serious itis. Overall, excellent place to grab brunch! They even give you free fruit kebabs as a starter! The bathroom here is also one of the most lit bathrooms I've been to date - it was quite an experience using their bathrooms lol. My only suggestion is to be more attentive on service. By the time we were finished, we ended up sitting for 15 minutes waiting for our server to give us the machine for our bills. We ended up just paying upfront even though most of the patrons have left by then (we left at almost 3). Overall, great place for brunch!"
/user_details?userid=5_tC7AEZQ_BoFj4tT_6vLg,Ming X.,"Manhattan, NY",5 star rating,"Best brunch I've had in Montreal! Friendly staff and great food. I Would highly recommend the rainbow Benedict and the pecan pie French toast. The bathroom was neat, it felt like I was at a rave."
/user_details?userid=rmI7eCYRIXmvwafl7Y5Ufw,Linh T.,"Rutherford, NJ",5 star rating,"What can I say about this spot? The food is top notch and the service is great. Everyone is so friendly. (That may come without say, since we are in Canada.)I always get so excited to come here and we stop by every few months when we traven to MTL. I'm even excited for the watermelon water! Every single bite is better than the next. I usually get the indecisif because I want everything. With the indecisif, I get the sweet and savory dishea. I WIll steal a bite from my friend's Benedicts (duck confit or steak). It's inevitable.However, I am upset that the grand Marnier brulee french toast did not make the new menu. The new pecan french toast is delicious, don't get me wrong, but that Grand Marnier was truly something special.I travel about 6 hours every few months to have brunch here and dream of my next brunch visit because nothing really compares."
/user_details?userid=ZyC-MBiCLxemL_KtQ90Gtg,Helen P.,"Almonte, Canada",5 star rating,"Deelicious Chia pudding breakfast! So worth the wait!Service excellent and food was delicious, as was the coffee."
/user_details?userid=2Oc2tjHaCa-dW4_dtuY9ew,Ronak P.,"Jersey City, NJ",5 star rating,This place was very amazing in downtown Montreal. The morning/mid afternoon Crowd was lined up just to get inside so definitely get there early if you can. However it is definitely worth it. The eggs Benedict and the number of choices they have are excellent. I got myself the steak and cheese eggs Benedict along with the hazelnut coffee and it was an excellent choice. My whole party was overly delighted afterwards and we all wanted to take a nap. Even the regular coffee from Lavazza was a treat. Definitely recommend for people coming to Montreal
/user_details?userid=4Q55Q73O5kBLVscEO0FXRw,Price H.,"Rocklin, CA",4 star rating,"Very good food, quick service and on point, good music and ambiance overall. It's a little dark in the WC... but everything looked clean.. The prices are right. The coffee was not so bad either. i am a coffee lover, so my expectations were higher. I should of asked for less almond milk and more coffee in my latté. Otherwise everything was very good. They also left real maple syrup on the table, I LOVED that!"
/user_details?userid=eses52EL9PM3Zr98zMpihA,Jad B.,"Montreal, Canada",5 star rating,"One of my favorite places for brunch.      I tried both locations more than once, the one located on Mont-Royal and the one on Notre-Dame.  My favorite is Notre-Dame. The place is new, big and bright. The decor is close enough in both locations.I go there during weekends. Always expect to find a line from 10am to 2:00pm.  For small groups (table of 4 or less), the waiting time could go as long as 20min and for big groups (more than 5) the waiting could go beyond an hour. I had to wait once for 1hour & 10min and I can tell that it was worth it.Right at the entrance, you can take sneak peak at the kitchen and check the chef preparing the platters. You will also notice the big Nutella jars ! Once you're in, facing the bar you will notice that big transparent water container filled with watermelon. They serve water from this container and it tastes good. The watermelon remove the back taste of the chlorine you get from drinking tap water.When it comes to ordering, all their platters are good. You won't be disappointed. Nevertheless, if you do not know what to choose, go for the L'Indecie. I posted a pic of that dish. The bathrooms are designed in a funky way.Despite the waiting time, the service is excellent and feel free to ask questions to the waiters as they are professional and will be very happy to answer all your questions."
/user_details?userid=l_BKhQJCK-fzvvSfX1N6eA,Ou C.,"Candiac, Candiac, Canada",4 star rating,"Sunday noon, our family waited on line nearly half an hour and it's worth, good and service were good and big. Fruit/ drink/ food all served right on time."
/user_details?userid=w5KMLpW7Vhg38wa57Sy2pw,Dawn C.,"San Francisco, CA",5 star rating,I really like the dishes and believe you would also be fond of it if you are a cheese and egg fan. I must admit the wild mushrooms are delicious and juicy even though I don't touch any mushroom generally. The smoothies are good.
/user_details?userid=mN8fyBuA6ruTOg7BXIcQ7A,Fatoma R.,"Long Island, NY",3 star rating,"Came here because of all the reviews but the food was pretty mediocre. I enjoyed their oversized fruit smoothies burnt wasn't out of this world you gotta eat the food. I also didn't have to wait long, when we left there was along line, I don't think I this is a spot that is worth a long wait"
/user_details?userid=v1P1mFlnPjVTJredlhJuwg,Caroline F.,"Portland, OR",5 star rating,"AAAAAAaaaaaahhhhhhh-masing. Seriously, Amazing. I usually don't even like breakfast foods. My husband lives for breakfast and always has to drag me along with him.We had the most perfect breakfast ever. I think it is responsible for my conversion to finally appreciating the first meal of the day.They sat us at a spacious but cozy booth. The music section was impeccable. Our adorable server was professional and efficient. (Three cheers for ambiance and service -woot woot!).The coffee was rich, luscious perfection. Our plate had everything - pancakes (light, airy perfection), French Toast (literally the best I've ever had in my life - vanilla madness), potatoes, eggs, crispy bacon, homemade flavorful sausage, pulled pork deliciousness, cretons (my first experience, holy cow. Breakfast paté ), and heavenly baked beans, all served alongside an aluminum can of the world's best maple syrup, a fresh fruit skewer appetizer, and a perfect -PERFECT- baguette.We live five hours away by car... and are considering a road trip just to relive this meal once again."
/user_details?userid=LYOvyedhKD3eqs4dJrp6yQ,Jackie S.,"Jersey City, NJ",5 star rating,"One of the coolest brunch places! Come early, the line is out the door. The menu is AWESOME! It's huge and offers anything your brunching heart desires. I got the beautiful truffle dish and it was excellent. Shoutout to their coffee game too, because it's on point. When you order a bowl of coffee, you actually get a bowl of coffee and man is it ever good. Also, the dishes all come with a fruit plate which is a great touch. Staff is awesome too! But like I said, get here EARLY and/or be prepared to wait, but it's 100% worth it."
/user_details?userid=LB1dC42iB6WSjPVPwt3Zqg,Meg K.,"Lasalle, Montreal, Canada",4 star rating,Went with my boyfriend. He had the avocado toast and I had the Thur French toast. Both were good but I really recommend their sweet dishes or super savoury. My boyfriend was a little disappointed with his avocado toast. Overall food was good and so was the service and the wait was decent for a Sunday brunch.
/user_details?userid=JDEhGFIPAyIMkfHD0G13UA,Jamal J.,"Mississauga, Canada",3 star rating,"Had brunch here during our visit to Montreal.Great ambience, great menu selections, reasonably priced.We enjoyed the eggs Benedict's, omelettes, the juices, and all.The thing that I would've changed that day was that they didn't have air on and it was 30 degrees, we were all sweating like pigs. Also:The server didn't bring in the correct order for one of us and that person had to wait for the order to be reprocessed. By the time her entree came, the rest of us were done eating. So that wasn't good But apart from this, not a bad place to go for a brunch"
/user_details?userid=n6odUl3qKuYd9VQrRNV33Q,Erika G.,"Washington Heights, Manhattan, NY",5 star rating,"Best brunch I've ever had! I'm not a breakfast fan but I'll definitely return here again and again. There was a line but the wait was quick, maybe 10 minutes. The hostess and waiters were extremely pleasant. The food was amazing! And the coffee was one of the best I've ever had!"
