user_url,user_name,user_city,user_rating,user_review
/user_details?userid=7tkvMG2ZNWcyhQ1-_Zvt_g,Katelynn P.,"San Jose, CA",3 star rating,This place was just ok. The service was amazing but the food wasn't that good. The pictures make this place look rather upscale but it is not fancy at all. It has the vibe of a pizza counter mixed with a dive bar.
/user_details?userid=Vw2j3AV6kJ5uXHsR0sVgmg,Louis A.,"Somerville, MA",5 star rating,"Brought at group of 8 guys for a bachelor party here. We had an incredible time. The 3 brother team that runs the restaurant was amazingly accommodating of our party and even had a personalized sign for our table as we walked in the door. Wine and food selection are perfect: short but well thought out and quality. The food was absolutely incredible, especially considering the price. We had probably half the items on the menu and they were all phenomenal. Drinks and wine were also on point. I had a drink with burnt rosemary that the waiter / bartender actually burnt right in front of us at the table. Quite the presentation. 11/10 would come again!"
/user_details?userid=SrLubbVCO5NmVQTATq2ysA,Heidi D.,"Wayne, PA",5 star rating,"So good! The man helping us translated the menu for us, helped us avoid certain foods I was allergic to, and made wonderful recommendations. The food was delicious, fast, and our water glasses were always full. Highly recommend the Grand Charps drink! Cheers!"
/user_details?userid=FF_JREoXUTHzwZjhMVl5jw,Mike G.,"Los Angeles, CA",5 star rating,"Seriously great food, service and atmosphere. My wife and I had the pork chops, duck confit and beet salad, and licked each plate clean! They could try for a Michelin star! Highly recommended. Also, if you eat and drink too much, a nice park isn't too far to walk it off. Why am I kidding, you could sleep it off!"
/user_details?userid=k2yWFrp0ShTJZigJ44Tqng,Cindy J.,"Statesville, NC",5 star rating,"I'm a long time user of yelp but this is my first review. I have been to many restaurants that I would give 5 stars but the reason I am writing this review is because not only was the food superb but the service was excellent. The atmosphere was cozy and friendly. There is something to appeal to everyone on the menu, from wood brick oven pizza to duck confit. The portion sizes were very generous and the preparation and presentation, spot on. With so many places to go in Montreal, we were pleased that our first night here we hit a gem!"
/user_details?userid=y167fB0WhiGnmG88jG8tqg,Laura F.,"New York, NY",5 star rating,"Loved this amazing restaurant!!! Everyone should go if they have a chance! I rarely write reviews but La Demande Generale was so good that it compelled me to write one. Visiting from NYC, my husband and I were looking for a place to have our first dinner in Montreal; impressed by the great reviews, we decided to make a reservation and they did not disappointment! We tried the tasting menu and every single dish was fantastic! (Some favorites included the salmon tartare, duck confit and short ribs). The service was also excellent and we had a lovely evening; we would have been so sad if we didn't get to experience La Demande Generale during our stay. I highly highly recommend it!"
/user_details?userid=GXWZYDSdOLsnzkSqo9n-gA,Kristina M.,"Edmonton, Canada",5 star rating,We had a fantastic meal at this place with excellent service. Owned and operated by a trio of brothers who take pride and care in their business. It's worth a stop to have a great meal.
/user_details?userid=GogtMtIltLV6i4NNsnPw0g,Jeff S.,"Stanford, CA",5 star rating,"This a gem of a restaurant.  I was visiting Montreal for a few days for work and was looking for a solid dinner, nice ambiance, and a place to unwind late.  Came here around 10:20pm (they stop serving food at 11pm) and the food, service and everything in general just blew me away.  I am also highly picky about my food (having lived in NYC, LA and now the SF Bay Area), I am also Celiac/allergic to gluten and am generally on a Paleo/Whole 30 diet.  They were able to not only accommodate my dietary restrictions but the food just tasted incredible.  Most of the items were locally sourced and everything was fresh.  They adapted some of the dishes so they wouldn't have gluten or dairy, and the staff went out of their way to make sure things were ok.  I actually came back the second night, the next day, since I had such a great experience.  The place is owned and operated by 3 brothers, who are just the nicest guys in the world.  The place just opened last October and I hope they have a long and prosperous run as I hope to be back in Montreal next summer and to come by again!"
/user_details?userid=wTXZ9--l51cHYIOhFtqqQw,V S.,"San Francisco, CA",5 star rating,Creative and incredibly delicious food. The chef is amazing. Stopped here late one night and the staff and chef created a feast for us. Very accommodating and great service. Incredible poutine.  An absolute gem!
/user_details?userid=4oY5_jCSvIbjXZN3o2KN4w,Daniel D.,"Orlando, FL",5 star rating,"Exceptional food, drink and service. The beet salad, grilled romaine salad, wood fired pizzas, short ribs were all exceptional. Owned and operated by 3 brothers who clearly put their heart and soul into this quaint, classy restaurant that treats guests like old friends. Our party of 4 consisting of my wife and 2 daughters were provided premium service at every turn. A culinary highlight of our vacation from Orlando, FL.  Lastly- try the beignets- fantastic."
/user_details?userid=8qaZrE4t6pKYBSWJJKf8dA,Kathryn L.,"Le Plateau-Mont-Royal, Montreal, Canada",5 star rating,Amazing service and even better food. Congrats to the 3 brothers on a fantastic restaurant
/user_details?userid=BTuULSNaKPf3p7HtC2m6XA,Michelle R.,"Smiths Falls, Canada",5 star rating,"We stumbled upon this restaurant on a Friday night, and what a happy accident! The food was delicious and the service was FANTASTIC. Great atmosphere too! Absolutely loved it!!!"
/user_details?userid=GXYs7BReFbnirPttsTBxpA,Luke S.,"Boston, MA",1 star rating,"If I could I would leave this place 0 stars. The food is horrible. It seems that they don't know how to cook. The waiter did not offer the menu. Only after 2 nd attempt he brought the menu. He did not want to make any suggestions on the food. There is an older guy who constantly was on the phone while cooking the food. He touches his phone, cooking, slicing stuff at the same time. Very unsanitary. Ordered 2 items and they were absolutely uneatable. The dishes came in half cold like they were cooked before. It was clear that they just briefly warmed them up. Had duck which was cold. It came with some crazy salad combination, unfresh strawberries, blueberries and greens and some strange chunks of merengues. Underneath the duck leg there was absolutely cold puree which tasted quite awful. I went to many high end restaurants but have never seen duck with sweet merengues as a dish. I am all for contrasts, experiments but trust me that would make anyone to throw up. I could not eat that ""piece of art"" and just was left very hungry. Another dish was the steak.  It was a bad chunk of meat absolutely cold with vinegar flavor plus just unfresh looking vegetables. Contacted the restaurant about the negative experience and the owner was extremely rude by stating that I did not understand their food. He did not apologize and argued in a very hostile manner. It seems that the reviews are bogus because this type of food is not anything close to Montreal restaurants and we all know that Montreal has plenty of delicious restaurants. Avoid this establishment at all costs if you don't want find yourself hungry, angry and dissatisfied. Personally had to go to a local supermarket to find some food to eat after this bizarre experience."
