user_url,user_name,user_city,user_rating,user_review
/user_details?userid=oW9PoxLCSMwZ6EEjKuPNjw,Aimee H.,"Montreal, Canada",5 star rating,"Really cosy place! We loved the relaxed and intimate atmosphere. When we arrived, there was a cute little handwritten sign with my name and our reserved table. It was super sweet for them to give us a 4 person table even though we were only 2 to give us more space. The brothers are warm and chatty. I love that they're so hands-on in their own business. The food was delicious and unique."
/user_details?userid=8qu5Zyurap002eIj1kLdOg,Joana Z.,"Saint-Lambert, Canada",5 star rating,"My friends and I were there on a Friday night (around 8:30) to celebrate a friend's birthday. The restaurant was pretty full, but they managed to give us their best spot and everyone sat all on the same table. We weren't too squished or anything, it was perfect, the seating is very comfortable. The restaurant itself is small, but it makes it cosier and not too loud. They also have a nice terrasse outside.The menu isn't huge, but everything on it is delicious and worth the price. I had the risotto with 3 mushrooms and it was so rich in cream and flavours, I finished it so fast despite it being hot and the hot weather outside. My friends made me try the poutine with chopped pork and the margarita pizza and it was also incredibly good. They have an amazing twist on what I would call comfort food.If you want to drink, I would recommend their Holy Water cocktail. It's flamed in the beginning, very impressive, very good and has a lot of alcohol in it. I've also had a mojito and it was absolutely delicious. The owners of the restaurants are extremely friendly, patient, and the service was great. They offered us shots and cut the cake for my friend's birthday in beautiful pieces with decorated plates. The music in the restaurant is amazing, I'd love to get a hold of that playlist because I was shazamming everything the whole night."
/user_details?userid=yx6zrQvgjj7YhCim4JtxVw,Catriona W.,"Queens, Queens, NY",5 star rating,"Delicious! The bourbon smash was great, very well balanced. When we walked in it was very quiet which made us a little nervous, but we were not disappointed!We had the steak and the mushroom risotto and both wiped our plates absolutely clean. The staff was lovely, including the two brothers who waited on us. Thank you for a wonderful dinner!"
/user_details?userid=hSiBDOQFpMsKz7B0u-qjcA,Nick E.,"Los Angeles, CA",5 star rating,"On a street like St. Denis with so many restaurants to choose from, La Demande Generale was a real find. We ordered the pizza and the beet salad and both exceeded our expectations in taste and presentation. Between us we ordered a signature cocktail, wine and beer and were pleased with all three. The waiter was extremely patient and accommodating. He suggested things to do during our stay in Montreal. It was a pleasant and enjoyable evening!"
/user_details?userid=QQoJ94IlLIG-162eLsT7Yg,Courtney K.,"Stratham, NH",5 star rating,"Went to dinner tonight to meet up with some friends from out of town. Totally just skimmed through Yelp for a decent place that was midway between their hotel and my place and La Demande Générale fit the bill. I was so pleasantly surprised by this place! We ate out on the terrace at sunset, had delicious pizzas, and shared some beignets for dessert. The service was impeccable- very friendly and kind, attentive, and all around enjoyable!Will definitely be back to this restaurant in the future!"
/user_details?userid=TVN3qoXU0-sateboutdCZg,Angela H.,"Haddon Heights, NJ",4 star rating,"When we asked for delicious food, our reggae-playing Uber driver went rouge and dropped us off at this bistro. Seedy as hell looking at night in this neighborhood but we were hungry and in for whatever. The drinks were game set on point and the food was one of our favorites during our trip. Uhhh, thanks Uber...???! Our meal: Burger with a fancy presentation for the guy. I opted for a single sized pizza. Great date night!"
/user_details?userid=zAB6lP0La-bPH-dlr8OHKw,Jawad N.,"Kutzky Park, Rochester, MN",1 star rating,"Worst experience ever; I've been to more than 30 cities and 10 different countries, and went to restaurants/bars in all of them, and this is the first time a place forces me to buy food after drinking half my pint; this was a very shady up selling strategy and the bartender was like this is how we do it in Montreal, you cant order beer without food, its the owners policy. This is BS (I live in MTL and this is the first time I encounter such behavior).  I definitely don't recommend this place at all, especially that this was on a Tuesday night where there was only 3 customers in the place.Update:I am sorry for the previous harsh comment, thanks for sharing the information about the legality of it, however the best approach would be to inform your customers about this before ordering and drinking any beverage, especially walk-ins that go straight to the bar after 10 pm and only ask for the drink menu. Thank you"
/user_details?userid=w7XznzJwxGWP3H3E_L__rw,Jayda J.,"Arlington, VA",5 star rating,"Organized a dinner with close friends, we were 8 and it was amazing. I know I will come back and so will my friends. Excellent service and food! One of us is vegan and had a salad, I tasted it out of curiosity.. it was purple-ish and spiced as I could taste a little garlic and it was just so good. I had the duck which was cooked perfectly, a mix of sweet and not sweet and the veggie mash it came with had a complexed tasty sweet taste. That same mash others had, was so good we had to ask the server what it was. Sorry I forgot the name but it wasn't potato and the server said its made with love and alot of butter. To me it tasted like heaven.For desert I had the beignet which came with a salty caramel sauce..... that sauce.... just thinking about it I salivate and I'm not really a desert person.We took pictures outside and one of the owners ( 1 of the 3 brothers) came outside to take picture of all of us. Did I say service was great? It was!For us 8 it was our first time and not our last. Reasonably priced and for what you're getting it feels like a steal. I've paid way more for mediocre food.  For the record, I personally don't know the owners and was not paid to put this review but I felt compelled to brag about this place and hopefully I get to eat here again.I took pictures of some of the plates so I keep in mind what I'll try next when I come back to Montreal.FYI they have a share meal that some had which included the duck with fish and ribs with that mash... I will be back"
/user_details?userid=AtV1ZzuKy1kkGNL9rbtb5w,Paul A.,"Rochester, NY",5 star rating,"Lovely place with great service. Food was sublime. I had the grilled romaine salad, the poutine with beef cheeks (guilty pleasure because kitchen had so much sophisticated food on offer) and beignet for desert. Cocktails, wine, and coffee. Really attentive service, helpful with translating French items into English. Loved it and hope to return"
/user_details?userid=eIQLLIikPj4tPDPWhcOltg,Joanna M.,"Montreal, Canada",5 star rating,"The ambiance here is so cozy and laid-back. The sound levels are well-managed so you can have a nice conversation. The seating is very comfortable. This place is great for a chill evening out with your flame or an unhurried friend soirée.They have many delicious offerings and lots of comfort food. We tried one of their pizzas and the risotto (excellent texture) and enjoyed both. We don't often order dessert, but the surprise highlight of the evening was their house donut which was tasty and beautifully presented.The servers are friendly and very attentive without being overwhelming. I live in the neighbourhood, and I'll definitely be back. I'm looking forward to when they have brunch. I bet it will be fab :)"
/user_details?userid=MLQAVuIIJ8B2AigoRYyCZQ,Steve B.,"Fort Mitchell, KY",5 star rating,"So glad we stopped here while in Montréal!  The food was top notch; I was blown away by the salmon tartare.  Pizzas were also excellent, and our server had an engaging demeanor that added to the overall experience.  Great food and service for a fair price; what's not to like?"
/user_details?userid=woxoWzgFcDmecEZrsNJh0Q,Alexis B.,"New York, NY",5 star rating,"I have nothing but great things to say about this place.  I got lucky, on the walk home from work one night, I was walking down St. Denis and the menu caught my eye out of sheer simplicity.  A restaurant having a succinct list is always a good sign, it usually means they pick a few things and do them well.Letty, one of the guys who works there started chatting with me and made me feel welcome right away.  Later I found out he was one of the owners.  I really felt like an amazing salad with protein on it and a good glass of wine or two.  I started a new job that sent me up to Montreal for training for 6 weeks, so I was new to the area, it was my first day and I needed a good meal and a drink.  What came out what probably one of the best salads I have ever had.  The chef perfectly grilled a nice big piece of salmon, over a bed of arugula and some grilled veggies underneath, he made an amazing vinaigrette and I had a glass of a light Tuscan Sangiovese from Maremma.  I chatted with them about the list a bit, they do have cool eclectic list going on there.  I enjoyed my salad, had a few glasses of wine and the also asked them to pack my lunch for me for the following day so I could have another killer salad.  Again, that they did, a great piece of grilled chicken, a big salad, some roasted veggies, a little pureed squash and a new vinaigrette.  I was sold!I have been back every week and the food just continues to blow me away.  But, its not just the food.  Montreal is filled with amazing food, this city rocks my world with the food.  With Le Demand General it's a combination of a lot of things with this place, Letty and the crew always make you feel like you're part of the family when you walk in.  It's like a real life Cheers, but with great food, and a great bar.  The bartender/ sommelier really knows his stuff and is pretty fun to chat with.  The place is super cool, you have a mix of having a nice restaurant area to eat in as well as a bar to hang out, drink and chill with friends at.  One of my friends came up and visited on a weekend and we went their which was an absolute blast.  We ordered some appetizers and main courses to share and branded out a lot into their ever growing wine list.  They had a wild mushroom risotto that I need more of in my life, for sure.  We also had a beef cheek what was so rich, sharing it was more than enough.  Every bite was memorable.I know there are so many great places to go, but, Le Demande General is not a place to be missed.  They don't have anything frozen and the don't cut any corners, so everything you have is fresh and great quality.  I do wish they would do some more marketing!  When I tell my co-workers about it, not many people have heard of it, but other than that, I wouldn't change anything."
/user_details?userid=eK_532zUz8ETnx0CQu9MEw,Jess F.,"Ventnor City, NJ",5 star rating,"My family stopped by for a last minute dinner on Friday. We sat on the terrace and enjoyed truly excellent cuisine. This is the type of place where the menu isn't in 5 languages, but if you're lost in the French, I have no doubt that Laki, Petros, and Costas will help you out. They are wonderful hosts!  We tried the *Mediterranean sea bass, pork chops, and mushroom Risotto - all three dishes are outstanding. Highly recommend!"
/user_details?userid=8Cy9FxJ_Hm8ddbAi6ck_3Q,Breck W.,"Ottawa, Canada",5 star rating,"Randomly chose this place because it was close to our Air Bnb for my birthday. When I walked in I was a was wondering if I would be disappointed because it's a pretty standard-looking bar, but I tried all of my family members food, and every plate was amazing- mushroom risotto, salmon tartar, squash soup, poutine, and my FAVOURITE- the arugula and prosciutto pizza with truffle oil was maybe the best I've ever had."
/user_details?userid=ldZ_gdubyMwtWzkq-yEhdQ,Sue Z.,"Los Angeles, CA",5 star rating,"Simply delightful from start to finish, this little bistro in the heart of the Latin Quarter cannot be missed.  The ambiance, friendly staff (the brother-owners are amazing), the food, everything, La Demande Generale pays attention to reach detail with painstaking care to ensure every guest feels like they are welcomed family. Thank you for an amazing experience. Highly recommended to everyone living in or visiting Montreal."
/user_details?userid=zc62C_CsrQUiVhd_9oDVzQ,Elly P.,"Westmount, Canada",5 star rating,"An exceptional Montreal gem! I LOVE this place. Warm vibe, chill music, attentive service and amazing food. The three brothers are passionate about making your experience memorable. Each and every platter is beautifully presented and generous. The beef cheek is so tender and flavourful, salmon tartar is hand-cut, fresh and delicately seasoned, wood oven pizza is piping hot and perfect. For dessert the pudding chomeur is decadent, creamy and totally addictive. LOVED IT!"
/user_details?userid=iogWHWv1XIk64jCg35xZTw,Marc B.,"Chicago, IL",5 star rating,"Wow- amazing in all aspects! My favorite dining experience in our Quebec travels. Owned by 3 brothers and open since fall 2016, located on the busy Rue St-Denis it can be easy to miss but don't pass by. Service was friendly and detailed in English to help decipher the French menu. Cream of carrot soup and beer salad started us off perfectly with tender delicious beets in a beautiful presentation. My soup was creamy and so flavorful, wished I'd ordered 2, so good!Main courses of calamari over perfectly cooked and seasoned grains and my flank steak was served on a piece of slate with a large helping of creamy mashed sweet potatoes and al dente vegetables with the medium rare steak tender and flavorful with a rich au jus if desired. Reasonably priced Italian wine topped it off. Highly highly recommend!"
/user_details?userid=v5trEcduRTyetd9m6mvasA,Serena T.,"Fremont, CA",5 star rating,"This was our first night in Montreal, and the delicious food at La Demande Generale was spot on! Our family of four (including two demanding teenagers) enjoyed everything we ordered.Entrees (Appetizers):(1.) Salade Romaine Grillee -- Whole grilled romaine lettuce with bite-sized bacon and croutons; the grilled romaine definitely added a nice taste to this salad.(2.) Calmars Grilles -- Grilled calamari on a bed of couscous with the slightest hint of limePlats Principaux (Main):(1.) Bavette de Boeuf -- Flank steak; the sauce was heavenly!(2.) Poutine a la Joue de Boeuf -- A staple of Quebec; our waitress recommended this dish, and I have to agree with her that it is decadent. (3.) Prise du Jour (Fish of the Day) -- Red snapper; oh, so tender! Served with hummus and a Greek salad.(4.) Pizza - Sauce Alfredo, Poireaux, Ail, Champignons, ChorizoDessert:(1.) Beignet - I.D.G. -- Wow! The caramel sauce was magnificent! Semi-covered chocolate cherries were pluses!The mark of a great meal is when all the plates are completely cleaned. All of our plates can be described that way. We still want to go back and try the burger.Last but not least, our waitress Asma deserves a shout-out. She was friendly, informative, and hospitable. If you are ever in Montreal, La Demande Generale is one bistro that can't be missed!"
/user_details?userid=1G60jrILPeXz1eKwUZrn3w,Emma A.,"Denton, TX",5 star rating,"I am SO sad that we found this place on our last day in Montreal! It was such amazing food and service that I would have gone back every day if I had more time. My husband had the smoked salmon, mushroom risotto, and beignets. I had the grilled romaine salad, tomato and basil pizza, and maple pudding. All of it was fantastic, but I'd say the mushroom risotto was the winner overall. It's a little pricey, but for the quality and taste I'd say it is actually a steal!"
/user_details?userid=SuRptFgv-qyC_QwYqEjaiw,Jerome K.,"Salisbury, MA",5 star rating,"This was one of the greatest eating experiences I have ever had abroad. So much so, we went back the next night. The owners are incredible. It is a fantastic vibe. Personable and friendly and really making you feel like you matter. The food is incredible. So fresh and well prepared. If you come to Montreal, you HAVE to make this amazing place a stop on your agenda. (Probably more than once :) ) My father thanks you for the extra onions! Thanks Laki!"
/user_details?userid=s9fD33cXfRnNnulndd0vjQ,Nancy F.,"San Diego, CA",4 star rating,Enjoyed a lovely dinner at this comfortable little gem. They offer a variety of options. I had the vegetable curry and my guest had the short rib. Both were delicious. Waiter was knowledgeable and fun to talk with.
/user_details?userid=VEMNv8T7qjQD661oWvKqHQ,Steve M.,"Freeport, ME",5 star rating,"Top notch all around. We had the duck tartar, risotto, and cheeseburger. The wine list was small but well curated. The service was personal and excellent. Comfy chairs, good music, cool but not pretentious. A must if you're in the area"
/user_details?userid=3Ee9oxA9YM987tk7s0xRQg,Joiele C.,"Le Sud-Ouest, Montreal, Canada",5 star rating,"We went here our first night in Montreal, we were extremely satisfied with the service and recommendations from our servers. The food was delicious and filling, the cheeseburger was cooked to perfection and the prosciutto arugula pizza was divine. We'll definitely be coming back and inviting our friends and families."
/user_details?userid=f8vIkOoKmfs9V1O1b77LMQ,John S.,"Baltimore, MD",5 star rating,"It has great atmosphere, nice spacing between the tables, and friendly staff. The quality of the food was as high as places where I spent one and ahalf times as much. I definitely enjoyed a leisurely dinner there!"
/user_details?userid=eG_yyuqhlwAbwe2Gr-18Ew,Patricia S.,"San Francisco, CA",5 star rating,"This is a wonderful neighborhood bistro with an outdoor terrace. You will love this small restaurant owned by three brothers. The food is outstanding including yummy burgers, duck breast, smoked salmon pate, mushroom risotto, pizza, and excellent salads."
/user_details?userid=vxXA62CckEYz6P5dvMv-1g,Andy G.,"Manhattan, NY",5 star rating,"Fantastic food from start to finish.  We shared the plateau a partager which included fish, glazed duck, and the best ribs I have ever had (and I've had a lot of ribs).  Staff was delightful in translating the French menus for us and providing friendly pours on the wine.  Wonderful experience."
/user_details?userid=1FlUwhX_CQOyuuCOA2-rBQ,Antonio F.,"Edmonton, Canada",5 star rating,"I rarely write reviews here, but this place really deserves one. I haven't experienced such a good service in a really long time. The servers really go out if their way to provide the customer a nice experience.The environment and the food are also amazing. I highly recommend their smoked ribs. Definitely worth it."
/user_details?userid=Br7MpzS9xjEOrR6cgv2uwA,John L.,"Chicago, IL",4 star rating,"Tough night but good ending. Our order got lost and we waited an hour for our food. But, to the owner's credit, they tried to make it right once they realized what had happened. I'd like a reboot and redo because they have good food and a fun vibe. But, we were hungry when we got there and the waiting took its toll.   Very nice people..."
/user_details?userid=uqleKCjwQZeNccPYxWkE6A,Angela L.,"Torrance, Los Angeles, CA",5 star rating,"Excellent food, service was attentive and friendly! We ordered the tempura shrimp, chicken salad bowl, and 2 pizzas. One pizza for each of our small boys. They ate both of their respective pizzas- which they never do. They both commented that their pizza was really good- which we both agreed after stealing a bite. Thanks for a great meal on our trip to Montreal!"
/user_details?userid=NR3--89cMS1wIYodxT_s8Q,Josephine S.,"Pittsburgh, PA",5 star rating,Ok. So it was my husbands birthday and I found this place. My husband wasn't sure about it. I think god is in the kitchen because we were in heaven our whole meal. This is a must stop while in Montreal. I never write reviews but this place was fabulous!  Thank you guys for such a great experience!  We chose the menu flight it was awesome. I'm very finicky and this place over performed. What a great surprise for a restaurant I picked because of yelp reviews.
/user_details?userid=iSfBFCHKycdXUbcgwDMBBg,Cameron S.,"Toronto, Canada",5 star rating,Wonderful experience. Amazing service. Got the best poutine in my life. Family own. Good vibes. Totally recommend !
/user_details?userid=DprM_0Ud9lsNh6E5H1smeQ,Khoi P.,"Brooklyn, NY",5 star rating,"Nothing short of amazing. Coming from NYC, where I am spoiled with food, Le General comes with a refreshing perspective to cuisine. The staff is very personable and service was excellent."
/user_details?userid=0xXz5lvQUuqg9fivRQQ2sQ,Kath S.,"Lake Grove, NY",5 star rating,"We stopped at this restaurant for an early dinner in August while on vacation and the food was incredible.  So incredible, in fact, that when we happened to be passing by around lunch time the next day, we popped in again!  And ordered just about the exact same meal...  but don't judge!  Sometimes I tend to get a little obsessed with specific dishes and when you've already enjoyed something once, why not get more of a good thing?  When we were just finishing up, it began to absolutely POUR outside, so we decided to sit at the bar to wait it out with a drink.  We ended up chatting with two of the three brothers for a bit and you can tell they are passionate about what they do.  Try the romaine (caesar?) salad (it's grilled!) and the pizza.  We had the proscuitto and arugula one, but they all looked good.  Don't miss this place for the great food, ambience, and friendly staff."
/user_details?userid=0FMCFC--9JR6OI5VZymD9Q,Lily M.,"Los Angeles, CA",5 star rating,"I love this place! Great food, atmosphere, and service. Although we waited longer for our food because there was a mix up in the kitchen the food was worth the wait. Poutine was so flavorful. I had the duck which was good but not as good as the poutine. Definitely would come here again to try other dishes. Prices were very fair."
/user_details?userid=1huN_Gs0HGUm7DZlQ0USEg,Midori N.,"Waterloo, Canada",4 star rating,"Early in the evening (around 7pm) on a weekday it was easy to get a table of 4. The interior was clean, stylish, and calm. People in my group got the bavette de boeuf, short rib, and confit du canard. They all seemed to enjoy them! The waiter was friendly and very helpful with explaining the menu to us."
/user_details?userid=z_ntdyusfrmZmZmXeGfZjQ,F K.,"Portland, OR",5 star rating,"We came here while visiting Montreal. My heavens, the poutine was AMAZING! So happy to have found such a great restaurant."
/user_details?userid=4qWNKnYUZEHE0YSy_s1AQw,Logan D.,"Concord, Canada",5 star rating,We were looking for a cozy place for a reasonable yet delicious meal. This bistro definitely satisfies in every way. Attentive staff and creative food. For starters we had a very tender mini calamari on savoury couscous. We enjoyed the crispy duck confit special and the beef cheek poutine for dinner and ended with a donut and caramel. Duck and donut - how can you go wrong ?! We will definitely come back.
/user_details?userid=89ovlShENAlCgV1IyB1z0g,Mark H.,"Columbus, OH",5 star rating,"We had a very nice meal at La Demande Generale. The service was super friendly and they did their best to accommodate special requests. We had short ribs, duck confit, poutine, and pizzas with grilled calamari for appetizers and beignets for dessert. Everyone loved their meal and raved when they tasted the others. If everyone in our family of picky eaters loves their meal, it's a day to mark on the calendar.The poutine was a twist on the traditional - a cheese sauce over veal cheeks and mushrooms.  The short ribs were perfectly braised and luxurious.This was our best meal in Montreal. Highly recommended."
/user_details?userid=ZT_0DZNsdmF9tnsI9qXfjw,Skyler M.,"Orange, CA",5 star rating,"Came to La Demande Generale, service was unbelievable, they had a pretzel bun hamburger that was the best thing I have had in Montreal. I highly recommend coming here for dinner and a drink. It is top notch food and top notch service"
/user_details?userid=hxu-2T7U4BwLc2uva6kgvw,Trenton H.,"Houston, TX",5 star rating,"Visiting from the US and found this restaurant on yelp. It was so good, we came back twice during our Montreal stay! Family owned, the service is excellent, food even better. Add it to your list of places to eat!"
/user_details?userid=di2qq3I54ayhNnQVt6RFKA,Tyrone W.,"Washington, DC",5 star rating,"Wonderful restaurant!!! I stumbled onto this hidden gem as we were looking for a restaurant between our place in the Plateau and my friend's hotel on Rue St. Denis. Came in on a Thursday evening for a late dinner. They have a nice outdoor area but we opted to dine in the cozy interior. The vibe is casual chic with a welcoming feel and I was amused they were playing hip hop. We were taken good care of by 'Laki' who we later came to realize is one of the trio of brothers who own the restaurant. I always get nervous when dining in restaurants with small menus that someone either won't find something they want or they won't like it. This place didn't disappoint from the pork and short ribs, to the salads, to the wine and cocktail recommendations everything was exceptional!! We finished it off with a platter of beignets  with berries drizzled with chocolate and caramel! I almost died twice SO good! Overall we couldn't have asked for a better meal on our first evening in Montreal. You should definitely come here!"
