user_url,user_name,user_city,user_rating,user_review
/user_details?userid=41kMyI1BfOTyIIAenUSaTQ,D'Arcy L.,"Terrebonne, Canada",5 star rating,Still my fave chicken- fries- salad cheap eats of MTL. The vibe is different. Covid has made it a much more sterile experience as it is takeout only. It is hard to hear the guys working behind the counter plexiglass. You have to yell pretty loud. Also they can't hear you well so speak up when ordering.*****Only one person allowed in the restaurant per party. So do not come as a two people or more as they will deny you and you will get mad. I saw them enforce the rules and the guy in front of me looked pretty upset. The chicken is still the same flavour as I remember. Light charcoal taste. Amazing sauce and fall off the bone tender. STILL THE BEST!
/user_details?userid=3qMeM2IZP1L_E-aI08-0xw,Vi L.,"Toronto, Canada",5 star rating,"This place is AMAZING. The moment you walk by the outside of the restaurant you can already smell how delicious the food is going to be.We shared a 'small' poutine because we were so full from eating all weekend and we could not finish it--- in our defense, the portion sizes are GIGANTIC. We were watching the guy chop up the chicken for our order and stuff it into the takeout container: it was so packed full of food that the chicken just BARELY fit. The poutine: the chicken was deliciously juicy and tender, the fries were soaking in the delicious gravy and cheese (I'm salivating just thinking about it and this was 5 months ago!).  AMAZING. This is the best poutine I've had in Montreal so far.People around us all got the chicken meals and they looked so delicious. That's definitely something to try for our next visit--- in addition to a poutine of course. Next time we will be sure to save extra room in our bellies!"
/user_details?userid=hF3zr8snmxb5pwa2_9bnlQ,Gabriella F.,"Montreal, Canada",5 star rating,"So this is going to be hella controversial but this place has the BEST POUTINE IN MONTREAL aka the world.It's all I've ever gotten here so that's all I can testify for. Yall. Don't even bother with la Banquise before midnight.Poule mouillée poutine with chicken and chorizo is your best bet in this town, and you can eat it there (pre-Covid) or in the Parc Lafontaine with super tasty Portuguese egg tarts A definite favourite."
/user_details?userid=2wzoB1QP179ju1x5Oy_RFw,Soumia B.,"Montreal, Canada",5 star rating,So good! The chicken is delicious and the staff is friendly !I recommend the Natas as well!
/user_details?userid=KcFMI-hsr2Em7whfI4OM5g,Katya P.,"Montreal, Canada",4 star rating,"Came here just for the chicken, like many others we saw the restaurant featured on a Netflix show. We arrived right around opening time on a Saturday and there was no line up. We got a whole chicken, with mild sauce ($16). The flavors were good, chicken tender and well seasoned but the sauce is just an oily mess. This is very difficult to eat as every piece is just dripping in oil and can be challenging to take it home.For the price and potential line ups, I don't think it's worth it. Now I did not get to sample any other menu items but if you came just for chicken, there are many other portuguese style rotisserie or grilled chicken joints that offer similar options."
/user_details?userid=ZXyGw3Z1DyhK1sfNtpcyYA,Linda P.,"Toronto, Canada",4 star rating,"Whoever associated Canadians and maple syrup was wack because Canadians don't really eat that ever. Poutine? Definitely.La Banquise is just across the street and we can have a war about which is better but you can't go wrong with either :)Torn because I love them both --- Ma Poule Mouillée is definitely known for their chicken. Combine that on the poutine with chorizo, gravy and cheese curds, and you've got a hella good combo here! I liked La Banquise cheese curds and gravy a lot better though. Like I said, can't go wrong :)Portuguese egg tarts were amazing though, couldn't stop myself for getting just one!"
/user_details?userid=a-cPRrpuWSmYIYJQO9560Q,Paul H.,"North York, Canada",3 star rating,"So, I had to try after all the hype and positive reviews.  There is no dine in so everything is take out and I ate in my car.  I was super hungry. I ordered a half chicken that was served with salad and fries and hot sauce. The chicken was really well done. To the point where even the dark meat was flaky. Maybe I was unlucky, but this bird was cooked way too long. The fries were really good and the hot sauce was great. I needed more sauce to make the chicken go down. I also ordered the poutine with sausage and chicken. As far as poutines go it was good, but not spectacular. I base my poutines on the gravy and this one was lacking depth. The meat helped inside, but I really like a richer gravy that should have been hotter to melt the cheese. All in all it was good, but I would not rush back. Still worth a try because you may have better luck."
/user_details?userid=-P0tSMT2EkEjPEjkZ5ZhGA,Marcela D.,"Albany, NY",5 star rating,"My boyfriend and I went to Montreal over New Years, and this was one of the only places on his ""must try"" list that was open and ohhh GOODNESS am I glad it was. In fact, we opted to go to Ma Poule Mouillée in lieu of a more *traditional* poutine. We got the ""small poutine"" (which was anything but small) and Le Louis Cyr (which is a half chicken with French fries and a fresh green salad). Both dishes were out of this world. The signature spicy sauce was featured in both-- it's tangy, spicy, warm, and, in the poutine, the cheese curds perfectly complimented it. The place is small, but we got there at just the right time-- the line wasn't especially long, but the inside was PACKED. However, because of the nature of the place, diner turnover is pretty quick-- we were able to snag a window seat and watch a quieter part of this beautiful city."
/user_details?userid=bJ9JnroYXtpbIbJBp2zFTw,Jeff S.,"Montreal, Canada",3 star rating,"I imagine those who are lining-up will not agree with this, but I'm really not sure why there is such a line?To summarize briefly, with respect to their mainstays; the grilled chicken is alright but not that great, the salad is not much more than fair and the fries are even so-so or dare I say subpar (to the point where I would probably not order them again as a side dish).On other occasions a few redeeming items would be their Bifana sandwich (which they make to order, but did have a bit of dangly fat hanging off one side) and excellent baked goods; like their egg tarts and Portuguese buns which are stand-outs on their own. In retrospect, if people are lining-up for their baked goods then I may understand it a little more. Sometimes a word-of-mouth reputation can get ahead of itself, like it did for another 'take your guess' poutine place across the street (too easy of a hint) -- but in their case has to do with a change in portion and quality -- and with so many other choices for Portuguese take-out and also for poutine -- I still don't get why people are in such a hurry to wait in-line. Sorry, that was a bit of a run on thought and that this review had more focus on lines than much else. I do think it might make some question how to spend their time. Not saying not to support local restaurants, but perhaps think about sharing the wealth as the expression goes. The three stars is an average of meh, I've had better and some darn good baked items."
/user_details?userid=r6PbQjtij6gcalYWBBrILg,Maria B.,"Laval, Montreal, Canada",5 star rating,"Dude.. this is it, this is the spot that changed my life. I seriously don't know how I lived my life before I ate here. I'm the first to admit that I get a little picky with my chicken but my fiancée is Portuguese and this means I've been introduced to a lot of great chicken places recently and I happily go along. While driving down Rachel we decided to stop in and I couldn't even look at the menu because my girl had already order half the menu. We had the poutine, the chorizo sandwich and the spicy chicken sandwich the sandwich came with a salad as well. From the second I took a bite of the poutine and got to taste the chicken the chorizo the cheese the gravy all in a perfect bite I was in love. The poutine is piled high and generously and the chicken and chorizo are so flavourful it still blows my mind. Moving on to the sandwich the bread is stuffed with either protein and taste really can't compare to anything you get the piripiri spice and the taste from the charcoal grill and it's this perfect little dance that happens in your mouth. You won't have room for dessert I promise but if your like me and wanna make sure you have a little something sweet for when you digest a little later on grab an almond tart and thank me later ;) This is Montreal and the Portuguese community is one of the best they are friendly and happy to feed anyone your doing yourself a disservice if you don't eat here at least once ( a week )."
/user_details?userid=X_y7ie2wPylfH9McMcJULg,Joel J.,"Queens, NY",4 star rating,"Came here on my trip to Montreal 1 year ago. Having been my first trip here, I would constantly hear how I haddd to try poutine. Searching on yelp for the areas near me, this was a clear winner. Even as we were parking in the area, we could smell how amazing the food was. We got there around their opening time but even then there was a fairly large line. Once we got to the ordering area, the menu options all looked so good. The cashier recommended one of their larger group poutines since we had 3 guys in our group and we were lucky enough to snag a quick seat inside. The food looked amazing when it came out. It was like the epitome of comfort food all piled into one plate. The chicken, fries and gravy were delicious. The chicken was soft and tender, fries were crispy and gravy was very flavorful. Strongly recommend anyone visiting this area to try this spot out!"
/user_details?userid=xh84BlvTytrjuyOkSyevHg,Jennifer D.,"Manhattan, NY",4 star rating,"If there's a chicken dinner worth waiting 30 min outside in snowy Montreal for... It's this chicken. The lines are long, ordering is a stressful, frantic process, and hunting for a seat can become hunger games-like. But... Man this chicken is damn good. I've never had Portuguese chicken before and it reminded me of latin-style rotisserie chicken - juicy, tender, flavorful - but with a unique spicy red sauce! We ordered a half chicken plate with fries and salad as well as a poutine with chicken and chorizo. We'd been advised by a local to get poutine here and it was a great way to try poutine! The chorizo was also tender and tasty.But to be honest, the chicken and the chicken alone is really the star here. On future visits I'll definitely be ordering chicken and only chicken. But with extra sauce of course!"
/user_details?userid=wW72FaqNPv6pdBC6AUqvcA,Hilary K.,"Vaudreuil-Dorion, Canada",5 star rating,I know this has been said before and I just need to chime in once more .. this place is bursting with flavour .. If you know the area real well.. you know there's a police station right across and to be quite frank the police officers have it GOOD!!!!!! They're really fortunate to have Ma poule Moillée from walking distance ahahaAtmosphere:Welll before I even Entered the resto I could smell the delicious chicken from my car it was so intense! I swear I feel like they made the entire street smell with awesomeness so people get lured in on purpose ahaha .. this place was packed and it was my first time trying out .. I wonder how busy they are at lunch time  on a regular weekday Food: 5+++++++++ Portuguese chicken Was very tender and as per my expectations they were completely met .. it was insanely flavourful cooked on a charcoal grill ! I love Portuguese chicken and they just nailed it and hit the spot!My poutine 5+++++ waaaw it was amazing and so filling.. I didn't know the portions were so large I was amazed. The chorizo sausage could be a bit better It was a tad overcooked and chewy but thats ok... the flavours were so amazing definitely worth getting it for the price. I love how the cheese curds are hidden inside the poutine so they have a chance to melt and get gooey mmmmmThe Chicken Sandwich:My oh my 5++++Starssssss Chicken was so moist but most of all the actualbun was coated with Flavour .. Correct me if I'm wrong but I totally hinted the bread being french Toasted prior and I taste the egg and softnessOf the sandwich woow it was Perfect !Chicken was the actual highlight and I strongly recommend you trying it outService: A1 very fast and super perfect... it was a full house but the staff were well organized and managed to keep the orders rolling definitely experienced. Friendly staff and superb service  Cost: Cheappppp and Insanely large portions don't ever change please :D12$ for a huge poutine Half Chicken for 14$ came with fries and saladChicken sandwich with rice 12$ Parking: super challenging as it's hit and miss downtown lol parking meters are all full and hard to get a hold of one but it didn't stop me from getting hereOverall I definitely recommend this place for Portuguese chicken it's insanely delicious and flavourful and you won't be disappointed .. ohh and Wayyyyy wayyy wayyyy wayyyy better then Romados ;)
/user_details?userid=TJAZ4h-YNSk9vqdEmuwaIg,Roxane V.,"Montreal, Canada",4 star rating,The chorizo!!!! Omg!!! I visited this place for the first time and bought the half chicken which came with salad and fries and the full chorizo with two spicy sauces. Everything came for $25. The chicken was juicy but not great. It didn't have any sauce over it like the pictures on Yelp showed but whatever. The chorizo is the bomb and u should totally buy just that or buy the chicken but u definitely need the spicy sauce with it. The girls taking the orders are pretty quick and don't spend time explaining anything but the girl (Latino looking with the winged) was so sweet and explained to me what I wanted to know (the difference between the whole chicken and half). I'm definitely coming back but just for the full chorizo cuz I grill better chicken in my patio for sure!
/user_details?userid=y1l58D4hgMfpYGIwu5dWhQ,Rachel M.,"Thornhill, Markham, Canada",5 star rating,"I arrived in Montreal for the first time in 5 years and this is the first place I went. Brilliant choice because it started my trip off VERY right.La Banquise is across the street from this establishment and many will say that's the best poutine in Montreal but they would be wrong. VERY wrong. The best poutine is at Ma Poule Mouillee and for $12, you get a whole lot of it so bring your friends and your appetites! Chicken, sausage, curds, fries, gravy, sauces, delicious!Everything else is great. Their chicken is delicious and for me, superior to one of their main competitors, Romados. It's just so flavourful and juicy and everything you'd want from Portuguese chicken.The salad and potatoes are also solid. I really don't think you could go wrong with anything here, especially when you consider that they are quite inexpensive. They have a knack for flavours and they deliver excellence every time."
/user_details?userid=1zxXP-HfI3Ycsv7xuZanaQ,Michael K.,"Montreal, Canada",5 star rating,"First time at this placeLocation is center downtown easy to get to and find. When you are close you will know because you can swell something great is near bye.Parking is hard not going to lie . Had to circle a few times and then gave up and double parked car . I went inside and wife stayed in car. We decided to do take out instead of dine in.When I went inside it was jammed packed.However the line was moving quick and food was coming out fast. Was worried about speed to quality but the food was bang on.I told the man it was my first time and wanted to try all the favorites. I got the followingChicken whole cut up into picies with medium spice.Chicken was tender to touch even the breast was juicy and moist. You can taste the charcoal but not overpowering the spice but enough to know it was there. I enjoyed the flavoursFries were cooked well and I asked them for a bit more well done because I like them burnt. Fries are cut from fresh potatoes and they tasted fresh and not oily and you could tell the oil was not old by taste and colour.Salad came with the meal. Simple salad with tomatoes and onion and mixed greens. Dressing was like a honey mustard base. Decent salad Rice was ok nothing to say about that except it was a bit dry . Not to worry and some of there sauce and bang. Brand new again.Chicken sandwich was on a white type of bun that you can tell was super fresh  and made that day. Fill it with there sauce an Chicken you have a winnerSausage. Was bang on the mark with flavours and juicy. Not overcooked and the flavours worked well.Most places you go the sausage is over cooked and hard like a rock. But not here super tender and moistPoutine is huge and well worth the money.How can you go wrong with poutine.Add there great tasting fries along with the sausage and chicken, cheese and there gravy( nice flavours for gravy alone) you have a winnerIf you are in the area give it a try and you will thank me"
/user_details?userid=jTunzdJcFdPtnk6S8A5oyQ,Corinne K.,"New York, NY",5 star rating,"Omg y'all the hype is REAL. Ma Poule Mouillée legit has some of the best dang Portuguese chicken I have ever eaten and I am so glad that I dragged my boyfriend here for a second lunch our last day in Montreal. It was 100% worth the line and 10/10 would do it again in a heartbeat.We both ordered the P'tit Talbot, which is their signature chicken sandwich in the most delish sauce. Thankfully we only waited about 10 minutes to place our order at the counter (don't be discouraged if you see a line--we almost were because it looked endless, but it truly moved really, really quickly) and another 5 minutes to get our order, so within 15 minutes, we were able to get our hands on these orgasmic sandwiches. Honestly I can say that the P'tit Talbot is one of the best sandwiches I've had the pleasure of devouring. The chicken was so flavorful and juicy and plentiful and the bread perfectly soaked up the sauce, so each bite was chock full of deliciousness. The sauce was so good, in fact, that I actually did end up leaving with a bottle of it to take back home to the states. Merry Christmas to me! The only negative about this place is how dang far it is from me. Any chance you guys could open up a store in NYC, Ma Poule Mouillée?! Thxxxxx."
/user_details?userid=Kr4NAUL6lUcwjYA4rxAOEQ,Anna L.,"Queens, NY",5 star rating,"MY FAVOrite place to get POUTINES!!!so much good food for $10 I'm shook!The place was packed and understandably so! The fries melted with the gravy and juicy chicken meat. Gosh if I wasn't so full I would have devoured. It was a crowded space but we were able to sit and had water too. Their servers were nice and desserts are also available here.I would come back!! Was between this and the poutine store across.Decided to choose this and IS HAPPY WITH IT!It was a fantastic place. Savory, delicious in every bite.South American flavors added. They had bathrooms! @ayoxannna"
/user_details?userid=ybt7rx15lQ5h46WrD0m0Eg,Susan L.,"Los Angeles, CA",4 star rating,"Chicken is delicious! Tender and tasty, doesn't even need the mild sauce rly. Portions are ginormous and highly would recommend sharing and not ordering your own plate.You line up when you get in, tell them what you want and they'll prepare right there for you. Pay after you have received your dish(es). I saw previous pictures here that there was rice - there is no rice. Just salad, fries and broiled potatoes as sides.Was super busy and seating is limited so would recommend someone watch out for a table while the other orders."
/user_details?userid=fEToEmRT-I1QSwwa3MLDrg,Ashley P.,"Arlington, TX",5 star rating,"I read a lot of positive reviews and a youtube video that recommended this restaurant. The reviews and videos did not disappoint!This restaurant is a must to go to in Montreal.This restaurant has portugese chicken that they grill in a spicy pepper sauce.Let me tell you, the chicken is ADDICTIVE. I was in Montreal for 5 days and ate here 3 times of the 5 days. It was so good that I purchased a jar of their sauce.Portions are HUGE too!The restaurant is small and seating is limited, so I would recommend taking out when its busy or going during a time where not a lot of people are eating (2-4pm).Everything is good. Anything you order will not disappoint!When ordering you order from the cook when you walk in. Once you get your food, you move down the line where you can purchase drinks or portugese pastries, and once you get to the cash reegister, you pay.The staff speaks some english, but not in depth, so if you have questions, ask in french.Great great place. I can't wait to take a trip back to Montreal and eat here again!"
/user_details?userid=Wmh9vK9LX-sxeuTb6vzM2A,Christine U.,"Montreal, Canada",5 star rating,"This is the best Portugese chicken I've had in the city and maybe my favorite poutine (it's definitely top three , depends on my mood.) The people who stand in a much  longer line across the street at La Banquise are suckers, Ma Poule Mouillée's Poutine is 10x better.The chicken here is cooked perfectly and consistently. Combined with the chorizo , cheese , piri piri, gravy and fries it is the perfect dish and an insanely good deal at $9 for a small (the large is gigantic and $14.) Service is quick since they're constantly roasting chickens. It's a small restaurant but you can also grab a bottle of wine and take it to Parc La Fontaine to have a picnic if it's nice outside. The pastel de natas are tasty as well. Even though this place isn't especially near my apartment or a metro I will go out of my way to eat here every chance I get."
/user_details?userid=5m-Vrz3Y5bfMktZwpJpM2A,Michelle O.,"Jersey City, NJ",5 star rating,"Affordable, delicious and generous food. Self-service style. Waited in line for about 15 minute. Place your order, pick it up and pay at the cashier at the back of the store, then grab any open seats.Got their #8 large, which is poutine with chorizo and chicken. This can be a meal for 4. This item is 80% fries, so if you are looking for more protein, I suggest going for their other items. Next time, I might get their #1 whole chicken or #11 chicken, chorizo salad."
/user_details?userid=6FNqTxdl_rDHQrW_Sbiu3g,C H.,"Hanover Park, IL",5 star rating,"No to be honest I haven't eaten here.  Cannot afford to go to Canada.But am hoping some kind hearted person will suggest to the owners to maybe come to the Schaumburg, Streamwood, Hanover Park area and open a Ma Poule Mouillée down here.Just from the pictures alone I would bet this is indeed the best poutine anywhere.  The Portuguese Poutine they offer has sausage and chicken and the gravy looks rich and delicious.  They're other dishes on YELP also look mouth watering.It's not fair that we have no good Poutine to speak of here."
/user_details?userid=DgLYl_RrquiEQBe3maBNvA,Angela W.,"Toronto, Canada",5 star rating,"This is probably one of my favourite restaurants during my recent visit to Montreal! The food here is very flavourful and I'm craving for it as I'm writing this review. Starting off with the interior of this restaurant... it's more of a takeout place than a full service restaurant. There are some chairs and tables but for the most part, it's a bit cramped when there are people lining up for food. How it works is that you order at the counter and then proceed to pay. Then you will take your food to a table if you can find an empty spot or take it to go. The food comes fast because I think everything has been pre-prepared. The whole menu is mostly consisting of different combos of chicken meat, chorizo, fries, etc. So I'm guessing they all can be prepared ahead and ready to go in a short amount of time.For the food, we got the much raved Portuguese chicken poutine. It was so amazing and definitely worth the hype! The chicken was very flavourful and everything came together perfectly. Personally I thought this was the best poutine I've had in Montreal. The other food we had was just a plate of chicken and chorizo with salad and fries. Again, everything here tasted amazing. One thing about the place here is that the food portion sizes are pretty big. My boyfriend usually can eat a lot but he was very stuffed by the end. We got the regular sized poutine but I think a small size would have been better. I would definitely come here again when I'm in Montreal!"
/user_details?userid=vCUeFAY774VtmpszX9hyGA,Nataly N.,"San Francisco, CA",4 star rating,"I think I made a mistake trying to be healthy(ish) here by ordering the grilled chicken and chorizo salad (Salade Mathilde). It was HUGE! And I think there was way too much meat for it to truly qualify as a ""salad."" It's probably meant to be shared between 2 people or one very hungry athlete!There was a good amount of lettuce and freshly-cut onions, carrots, and peppers, as well as a generous amount of sliced chorizo and grilled chicken (looked like both light and dark meat). It was definitely good value for less than $15 with tax. There were a few things that didn't make this the ideal dish to get here, however... While the chicken was nicely marinated, I felt there was a bit of a flavor clash between the chicken, chorizo, and salad dressing. Potatoes would probably have paired better with these meats. Also, the chicken tasted a bit cold and dry. I saw them cut it fresh, but I think they had grabbed it from a pile of ready-made chicken that was already off the grill. Overall, great value, quick service, and friendly staff, but I'd maybe recommend prioritizing the warm dishes rather than the entrée salad."
