user_url,user_name,user_city,user_rating,user_review
/user_details?userid=xg_96kkO-lF9oCc1PzrQgA,Leo L.,"Montreal, Canada",5 star rating,"Delicious poutine, great combination with grilled chicken and efficient service. Their spicy sauce is what makes it special. I come here quiet often, and I have never been disappointed. Usually this place is packed, but it is worth it.Moreover, their poutine is generously served, and it is just for $10.Good prices, efficiently served, amazing seasoning, great staff."
/user_details?userid=wvB9Rzn3BHzUUMUzLL4u2w,Racquel E.,"Mountain House, CA",4 star rating,"My GF and I shared a regular Poutine with Sao Jorge cheese and grilled chicken. It was my first experience trying poutine - french fries topped with poutine gravy and cheese curds, but this restaurant offers additional toppings of grilled chicken or chourico sausage. Poutine brings mashed potatoes and gravy to the next level. This poutine was good, and it was interesting to try this level of food combo."
/user_details?userid=BkMqpJikNc3r5itc-ui6ww,Anne C.,"New York, NY",5 star rating,"Personal opinion from a non-Canadian: best poutine I've had. I went to La Banquise the day before and thought that this poutine was better.I had the Portuguese poutine as recommended by a local that was standing next to me. They saw me drowning in the vast menu and decided to give me a life raft. I like this poutine for the following reasons: the sauce was seasoned with spices (not spicy), the little bits of chorizo added a layer of flavor, and they had tender pieces of chicken mixed in. I can't emphasize how every part of this poutine was seasoned whereas the poutine at La Banquise is like the equivalent of nachos. La Banquise had some bits that didn't get the gravy and you were just eating plain fries."
/user_details?userid=sRqJazR7G4RkFSqpFLx9Dw,Brooke M.,"Dallas, TX",5 star rating,"Holy cow! We were on our last day in Montreal and somehow hadn't heard that Portuguese chicken was a thing here. Thank goodness we caught it just in time! We planned to hit La Banquise (for poutine) while in the area, so we went with just chicken and half a sausage. While I watched others in line before us get their plates piled high with everything (meat, salad & fries/potatoes), I already knew we were missing out by not getting the full plate. The chicken was amazing- juicy with crispy skin, and the sauce was something special. We got ours on the side because we didn't know how ""spicy"" it was actually going to be. It was perfect! Can't wait to get back and actually go for a full meal, sides & all!"
/user_details?userid=N-ptYjrbfLmOKhn0Vdh0hQ,Sarah K.,"Queens, NY",5 star rating,Delicious food! My only recommendation is to check out the menu online/yelp before entering the shop. The menu inside is only written on a blackboard and is in French. All the food we ordered was delicious and the portions were huge. The line moves quick because costumers walk in and order at the counter. A most stop for a visit in Montreal.
/user_details?userid=sVV3wstSWCBdqVwK5AzqHw,Nisreen K.,"Montreal, Canada",4 star rating,"Yummy Portuguese chicken but even yummier breads! I've always taken the food to go because it's a small space and the there's always a line up. When I think Portuguese chicken I think sauce. Because it's all about the flavour on the chicken. Comparing this restaurant to some of the other staples in Montreal, I have to admit - it's good but not amazing. I love the spicy rub they put on Portuguese chicken and their sauce is just oh Kay. I do love the freshness of the chicken and their breads so they get a 4 star from me. :)"
/user_details?userid=Y3YVTxRcJjOgEyukIS85mg,Philip C.,"Toronto, Canada",4 star rating,"Great Portuguese chicken! Got a Putin, sandwich and whole spicy chicken. Chicken was surprisingly still moist and the spice level was just right.Ended off the meal with some Natas. Delicious!Skip the lineup and call in to preorder your food to go."
/user_details?userid=eA0VHBJgTvf0aUReQkTi3Q,Teresa C.,"New York, NY",4 star rating,"Per my cousin N's recommendation, we stopped by here with the family and had dinner here. There was a long line for Ma Poule Mouillee. It probably took us around 30 minutes to get in. Food is cheap here and portions are big. It was approximately 70 CAD to feed the 8 people.I definitely recommend you stop by here if you are craving for some poutine. We ordered the following:- Portuguese Chicken - Chicken was delicious and the meat was tender.- Salad Matilde (Chicken Salad) Great to share between 2 people. - Combo Veronique (fries, salad, grilled chicken combo) Huge portion. Note that the fries that come in this combo is not the poutine ones. It's just plain fries. - Poutine with cheese, chicken, and chorizo - This is the highlight of Ma Poule Mouillee. The poutine is slightly spicy but nothing you shouldn't be able to handle. It has a nice kick in the mouth. It's a bit on the salty side so remember to have a beverage on hand.- Portuguese Tarts - Decided to try some Portuguese tarts per Yelp's recommendation and they were just OK. I was a little let down by this because I had such high hopes for this. This was too sweet for me. I mean like half a tart was more than enough for me. The center of the tart is very eggy and pudding like. The crust was layered but it was slightly chewy. I am not sure if the chewiness is attributed to the fact that the tart has been baked earlier in the day and sitting on the counter for a while. I actually like the Chinese Portuguese Tart from Taipan in NYC more. The Chinese version is more layered and flakier. It's has a nice crunch and it's also less sweet."
/user_details?userid=xC-q_yh0XwcjRLimkS3RNg,Jonny M.,"Vancouver, Canada",4 star rating,"Been to MPM a few more times since my original review so I decided an update was in order. It's a great spot to grab food and head over to Parc Lafontaine.We dropped in on a Sunday afternoon (around 2:00pm) and it was busy. We lucked out and snagged two tables at their patio outside.The menu is up on the walls; the menu du jour is a nice change up. They had three options (calamari, mixed combo, beef brochette and salmon).Trip #1- Combo mixte ($14.00) - such a good deal. You get a salad, fries and meat; chicken (two thighs and a drumstick), pork chops and sausage. I have no idea how you can finish this alone but it's perfect for sharing. Pork chops were incredibly tender, sausage had a nice bit of heat and the chicken was moist. Get it piquant (spicy!). - 4x Natas ($1.50) - still as good and creamy as last time. Totally hit the spot. Trip #2- Tony alves (#1) ($15.00) - whole chicken. We got it spicy. A little greasy but overall, pretty good.- Grilled calamari ($15.00) - this took forever to come out and it was a really small portion. Quite oily but not bad. Probably not worth the price point. Stick with the chicken. - A salada matilde (#10) ($9.00 large) - we got a large salad without the chicken. The best part was the homemade honey Dijon salad.- Bon, les Portugais font de la poutine ($14.00 large) - poutine with São Jorge cheese, chicken and grilled sausage. This was the best out of three poutines we ate (the other two were from La Banquise). Good fries, good cheese and tender meats. A small ($9.00) is more than enough.- 2x Le p'tit talbot (#5) ($6.00) - chicken sandwich for my cousin's road trip home. - J'adore mon choriço (#7) ($12.00) - an entire grilled sausage. They put spicy sauce on this as well. Good flavour and well spiced. - Pain grand-mère ($4.00 for 12) - my aunt bought a dozen Portuguese buns for home.- Natas ($1.50), coconut tart ($1.50), peach tart ($2.30) and almond tart ($2.30) - had to get my nata fix in! Still so good and creamy. Other tarts hit the spot. Always come back to MPM to satisfy my Portuguese cravings."
/user_details?userid=XXvkE5WIwBmsPtGQd631HA,Carrie H.,"Wethersfield, CT",5 star rating,"Quick 8 minute walk from the nearest metro station. It was a full restaurant at 8:00pm on a Sunday night. Best poutine my husband had in Montreal! Small restaurant, but amazing food!!! I had the chicken sandwich and salad which was also delicious!"
/user_details?userid=FPv27CkYLodbfz3gj5Fnkg,Tony Y.,"New York, NY",5 star rating,"I could not decide what to eat for lunch on this rainy Sunday and I don't have any local currency. I'm on a credit only trip (just because I'm too lazy to deal with it) so that leaves Schwartz's out of the picture. I randomly came across this chicken palace and am so happy I did. If you enjoy rotisserie chicken, Portuguese chicken is your jam. This dude up front is a grilling machine and it's all charcoal. I got the half chicken with French fries and salad. It's a lot of food for under $12 US. I, of course, opted for spicy with extra hot sauce on the side. That stuff isn't very spicy but so very delicious. The chicken was moist and flavorful and the hot sauce was perfect with it. The heaping pile of fries was a bit overkill.There were a lot of Asians in there so you know it's a good deal. I'm Asian myself so I would know."
/user_details?userid=FWo1hSUugKWFQwr5IpCANw,Rabbiya A.,"Montreal, Canada",5 star rating,"We didn't expect the long lineup but as soon as we took the first bite of the poutine, we knew it was worth the wait!! We ordered half chicken with fries and rice. And a small poutine topped with grilled chicken. The food was excellent. But the poutine was exceptionally good. We were very satisfied with the food and will definitely be coming by again! Just wish the floors and tables were clean and dry. We had to grab extra napkins to clean our table and even then the floor was sticky and wet."
/user_details?userid=U5zHy7ZeBghPq0XeY4b0Fw,Kai Q.,"Columbus, OH",4 star rating,"There's a lot of hype surrounding this place and for the most part, it's worth trying once. The portions are absolutely huge, and most people end up throwing away a good chunk of their meal. I would recommend sharing a plate between two people. My biggest gripe is with the chicken, which is too fatty. The seasoning was good, but I had to throw away more than I am used to due to the chunks of fat. The menu is in French only and ordering would be slightly difficult for anglophones. Seating is tight, especially during busy hours, so i would plan accordingly. You certainly get your money's worth, and I can see why it's such a popular establishment."
/user_details?userid=XRM1J0IDWx87VScj9FkWSg,Foodie M.,"Sharon, MA",5 star rating,First of all you have to absolutely love the name of this place. We were eating across the street we were completely full but came across this place. So we went in and ordered a whole chicken to go. The chicken was perfectly good we got the mild sauce but the spicy sauce is not hot at all so go for that.The only part that sucks is that they won't give you a side of hot sauce unless you pay for it and it's not cheap.
/user_details?userid=87vBjQWvGBd57r4tGpu0lQ,Jason A.,"Guntersville, AL",5 star rating,Can't really add much to what others have said. Great spot in the mile end area. Prepare to stand in line but it's worth it. I ordered the number two - 1/2 chicken with fries and a salad.  I got the spicy sauce but it was not very spicy - which was better than it being so spicy you can't eat it.  Recommend trying the place out a good experience.
/user_details?userid=53DKgcqoIUU1ruPaWlna4Q,Lucas M.,"Atlanta, GA",5 star rating,"You like dope Portuguese bbq? Chicken? Stuffing your face after drinks on Mont Royal Avenue? A warm Poutine with chorizo? Prices that includes taxes!? Crazy lines in front of the store so you better call before you come?That's your spot .PS : I don't need to write about that place, YOU just have to try it and like Drake said ""Thank me later"""
/user_details?userid=GnJ2w63izmrICmt1wNCGOA,Laurence V.,"Brossard, Canada",5 star rating,"If you are craving Portuguese chicken, this place is a must! Large portions, well-priced, flavourful and simply delicious. The fast service gives this restaurant more of a fast food vibe. However, there's plenty of seating although it can get packed. Well worth the lineups! My favourite is the poutine with tender chicken and chorizo, covered in a rich and spicy gravy. Definitely a 5 star without a doubt!"
/user_details?userid=oeAhRa8yFa9jtrhaHnOyxQ,Rod U.,"Pearl City, HI",4 star rating,"MUST TRY MONTREAL FOOD:  PORTUGESE CHICKENYou can't visit the city without trying this oh so simple, hearty, and darn right delicious clucky.Rant:  when you visit another country, don't be an ugly American.  Try to speak their language even if badly.  It shows respect and goes a long way in improving your experience.Note:  Dining out is meant to be enjoyed.  Taking pics of your food is NOT part of the culture in Quebec.  Don't be a tourist.First, the chicken; whole, half, breast or leg (thigh / drum).  With or without fries / salad.  Skin, seasoned well , fire roasted, hints of smoke from the burning fat and oil, crispy blistered skin surrounding tender, juicy, deeply flavored chickeny chicken smothered with piri piri sauce (chili pepper based,  citrusy, somewhat spicy).   The sauce is well balanced and warms you from within.  Tip:  order the whole chicken to share and get...The poutine.  #8, trust.  A pile of tender, soft fried potato strips topped with cheese curds, crumbled, fatty, juicy, fire grilled spicy chorizo and a handful of fire roasted shredded chicken and castoffs smothered with a hearty chicken based ""gravy"".  You know you shouldn't but you're gonna stuff yourself full with this.Inexpensive.  15CAD for the whole chicken.  14CAD for the monster #8.No reservations.  No English menus.  Well worth braving the long line.  A simple pleasure in Montreal."
/user_details?userid=LH3vxSZZ785obBqUAKRQGQ,C R.,"Brooklyn, NY",5 star rating,"Per yelp, I saw the mob of people at the place across the street and immediately said NAH. There was a line at this place as well, so I knew it wasn't a throw away. Got in the line to order then paid the lady at the end. Seeing how big the ""small"" Poutine was I knew I had effed up. It's an easily shared plate. Lesson. Everything was amazing, meat, fries crispy gravy hmm. Nothing too salty and they were not stingy at ALL on anything. I can't compare to a competitor, but this right here YESS!! I opted for the mild sauce, because I'm a wuss and don't really like hot flavors...BOMB! I would go back, except I still have a half remaining. Lol"
/user_details?userid=1TC5reWTNXrMHCynBAfH9w,Tuan L.,"Austin, TX",3 star rating,"A transplant from Portugal, brings simple poultry grilled on a open fire. The chickens are butterflied whole and grilled on a rotisserie. When you order at the counter your order is made right in front you. The spicy option is not really spicy at all, although the color of the sauce may appears so. The sides whether fries or rice, go well with the chicken. I requested for dark only but either the person did not understand my English or completely ignored my request, as we ended getting half of the chicken which included both dark and white. Not a huge issue as both cuts were moist and tender. Seating inside is a bit cramped and can get hot if you're close to the barbecue pit. A lot of customers took their orders to go to a nearby park which was right across the street. There is also a window display of Portuguese deserts. I tried the Portuguese egg tart. It was sweet and eggy but would have tasted better if served warm, instead of from their refrigerated display. If you take the metro it's located about 1/2 mile. Overall, good chicken and cheap prices."
/user_details?userid=Hjypgp41EcoGOtY-U-FmCA,Connie L.,"Chesterfield, MO",5 star rating,The food was very good! They gave super generous portions that could feed at least two people. The price is reasonable for the amount of food they give and I left very full and happy.
/user_details?userid=U95wccXN_J8JwA5Ktlu8tw,Amber H.,"Montreal, Canada",4 star rating,"Wanted to check out banquise across the street but to my surprise every other Montrealer was feeling the same way. Instead of waiting in line my friend noticed this spot across the street where she had it at work.Extremely fast past environment, the menu is written on a chalk board at the front of the store. They have buckets on buckets on fries and chickens being cooked 24/7. I got a small poutine which had Portuguese chicken and chorizo, very good but needs more cheese as that's the only thing that was lacking from this wonderful flavourful meal."
/user_details?userid=vbSWvu2nzGoNl7ITTq3cMQ,Melissa Y.,"Vancouver, Canada",4 star rating,"I just had to try this place. Everyone keeps talking about it! I'm so glad I had the chance to try it, especially after seeing the line up every night! I decided to order take out. The order? One large poutine, a chicken (yup, A whole chicken), and some salad to balance the poutine lol. Verdict? Flavorful, but I'm really picky with my chicken and IMHO I thought it was a little too dry. As for the poutine, I know poutine is generally salty, but I found this too salty for me. In the end, I really enjoyed the whole experience from lining up (take out line is inside the resto) to eating. If you are in MontreaL, try the chicken. I would probably share a poutine next time."
/user_details?userid=_JO5lnXPnvJTjPZUp92A7g,Traci C.,"Vancouver, Canada",5 star rating,"Simply said, the best Portuguese Chicken ever! The ones I had in Portugal are no comparison to this place. Moist chicken, crispy skin and the most amazing peri peri sauce. A must eat in Montreal."
/user_details?userid=vDKJJVVwV-cuFz69jYEB1Q,Diana M.,"Montreal, Canada",5 star rating,"Hands down one of the best place for Portuguese chicken and their poutine is to die for. The reason why MPM has got its 5 star right off the bat with me is because if their consistency. Every single time I go the chicken is tender and the gravy is delicious. When you go order a half chicken with rice and salad and a poutine with Or without meat. Trust me I know, I eat A LOT. You're welcome."
/user_details?userid=IKSmm5MzHF8cMhMolKaIOw,Lorenzo L.,"Mississauga, Canada",5 star rating,"During my first visit to Montreal in late December, a Social Media friend told me that I needed to visit this restaurant for their Portuguese chicken. Unfortunately, it wasn't meant to be since they were closed for Christmas holidays. On this particular visit, things worked out much better. This restaurant is located on Rue Rachel, right in front of La Banquise. Since I knew that we will be visiting La Banquise, a stop to Ma Poule Mouillée was a given. Thankfully this restaurant is open earlier than the ones here in Ontario (9am). Also by coming in early, we avoided the lineup situation. However, there are still people coming in during the morning and that should be a good indicator about the quality of their food. Street parking is available but is limited to time and day. This eatery is a cafeteria type of style as you place your order, get your food and pay. There's small communal/hall style tables along with counter seating. As soon as you pay, you will be provided with cutlery and after you are done, you need to clean up after yourself. The prices for their dishes are crazy. You cannot find a whole chicken for $15 here in the GTA. I told the person at the counter that I came from Toronto to try out their chicken as I was here in late December but unfortunately they were closed for the holidays. I was going to try Le Tremblay (1/4 Chicken Breast with salad and rice/fries) but I wanted to try their chorizo too so he recommended me the Combo Veronique and he'll substitute the leg for the breast at no extra charge which I didn't even ask since I was willing to pay extra for it. The chicken and the chorizo were excellent. Best Portuguese chicken that I ever had. Chicken was soft and moist and the grilled chorizo was flavourful with a little kick. The only blemish will be the side dishes as the rice was bland and the salad was nothing special. The sauce helps give flavour to the rice. Also, as I was leaving, the man at the counter gifted me a pastel de nata, free of charge. This was very much appreciated and unexpected. I like Portuguese chicken as I work in a city with a large Portuguese population and visited a few restaurants in Brampton and Mississauga serving this dish. However, I didn't find any of them to be excellent as the chicken is usually a bit dry or a bit tough. So why is it that I have to come to Montreal for a place that does the chicken right? I know that places in the GTA, have rotisserie ovens but this place grill their chicken inside on charcoal. You will be leaving the restaurant smelling like the chicken so be warned. Besides their chicken and chorizo, they also do sandwiches, poutine and pastries. That pastel de nata was legit! They have earned a customer for life as I will be visiting this place every time I'm in Montreal. Highly recommended! #67 of 2018"
/user_details?userid=CQ67NJigSe5-uBDX3b_CUw,Michael L.,"Toronto, Canada",5 star rating,"Came to this place on a recommendation that it's cheap, tasty, and huge portions. It was raining outside, but there was still a small line leading out the door. The other option was a fondue place across this street and this poutine place with 100 people in line, so we decided to stick with this option. And it was an excellent choice.This restaurant is pretty much self service. Enter, place an order, proceed down the counter to pickup your order. One section for walk-in, another section for phone orders. Just look at the signs hanging from the ceilings for instructions. Don't forget to grab a jug of water and some cups. You should also clean up when you're done.Getting a table might be a bit tricky. We were fortunate that a family was finishing up. You might consider just getting it to go if you know a place to sit down.Their specialty is Portuguese roasted chicken. You can see their kitchen with 50 chickens on the grill at the same time. You can get chicken on its own, or with fries and salad. They also offer chorizo as well as poutine that comes with their chicken.The chicken is really cheap. You can get half a chicken on its own for $11, or a whole chicken on its own for $14. Talk about upsizing, why would you not get the whole chicken? We had three legs, wings, thighs, and a back. Or something like that. Meat was very tender and juicy, and the marinating was amazing. They have a basic poutine for $8, or you can get their deluxe poutine for $13 for this massive plate of poutine filled with potatoes, chicken, cheese curds, chorizo, and their special gravy. Do not underestimate the size of the poutine, you can probably split it between 3 or 4 people easily. Comes with a lot of chunks of chicken as well. Definitely worth trying.I later found out that the poutine place across the street had over 1000 yelp reviews, but whatever, you will not be disappointed coming here. Well, maybe if you were looking for somewhere romantic."
/user_details?userid=U5YQX_vMl_xQy8EQDqlNQQ,Stephanie S.,"Mississauga, Canada",4 star rating,"TIP:  Skip the line, call in your order, and see the looks of envy you get when you walk by the people standing in the line!The worse thing about this place is probably the 1.5hr-wait on a Saturday night!  We arrived around 8pm and line was still significant.  Other than that, servers were friendly, order was received quickly, portions/prices were good!A #8, Portuguese Poutine, SMALL ($9) was good enough for 3 Asian chicks.  Thank God we saw the large being assembled while we waited, so that made it easier to decide.A whole chicken was $15, so in comparison to places in Mississauga/Toronto, this is very reasonable!"
/user_details?userid=4gEpwxt0E2gRV0F59CPWKw,Jo C.,"Markham, Canada",4 star rating,"The best Portuguese Rotisserie Chicken!! Huge  portions and unbelievable deals here. As soon as you walk in the door, you smell the aroma of BBQ grilled chicken. You can see racks of chicken in the Rotisserie. This is a small eatery with counter type service. A small eating area with a few tables and counter seating.A half chicken dinner with 3 sides for only$11. The portions were so big... it's enough for sharing. A whole chicken a la carte is only $14. The chicken is so tasty and even the white meat is juicy & tender. This chicken is amazing..."
/user_details?userid=-x8zi-giZjEMd-Xy3Jp1Kw,John H.,"Cape Coral, FL",5 star rating,"Really liked our lunch, it was quick and the staff was very helpful. We got the petite plate for $10, spicy and it was great deal. We split plate among the two of us, it was plenty."
/user_details?userid=nQsshwRRy1aFYz4_NNIuKA,Firoz K.,"Burnaby, Canada",5 star rating,"Went there for the first time today, tried their 1/2 chicken with fries & salad. Huge lineup at lunch time but worth the wait. All the hype is well deserved."
/user_details?userid=addvm7Hw9y2TJzbGqs6Eog,Alix R.,"Franklin Township, NJ",5 star rating,"After my disappointment with the Trex poutine across the street at La Banquise, I decided to not give up hope on poutine and listened to the multiple Reddit pages I read about finding delicious poutine that wasn't La Banquise. My partner and I ordered the large spicy chicken/chorizo poutine and it was everything I've ever wanted in a poutine! The gravy was delicious and the chicken was perfectly cooked (extra points for the crispy bites every once in a while). The fries were perfectly seasoned and cooked right in front of us. It wasn't too spicy, which I appreciated. We definitely didn't need the large order; I'd say it's a good size for 3-4 hungry people. Weather permitting, pick up some drinks at a deep and eat at La Fontaine park! Perfect way to spend an afternoon."
