user_url,user_name,user_city,user_rating,user_review
/user_details?userid=lyY3aOmISGFcfXQhPusyGA,Maude C.,"Montreal, Canada",5 star rating,I will preface this by saying I'm a die hard fan of Romados. Portuguese chicken is just phenomenal when you're craving something quick and hearty. When I heard I could get it after 8pm (Ma Poule Mouillée closes at 10pm week nights) I couldn't wait to try it.I've now been twice to Ma Poule Mouillée and it lives to its hype. The portions are enormous it has to be one of the best bank for your buck meals! You order at the counter from one of the chalkboard menu items. Everything I've tried and seen there is delicious! The spicy sauce for the chicken is delicious and packed with flavour. Tip: they take phone orders so you can cut the line if you plan ahead.
/user_details?userid=tcDMAC6kvF0iN-kqcjD5Dg,Crystal P.,"Montreal, Canada",5 star rating,"This place makes an EXCELLENT poutine! They put chicken and cherizo in it, I also think the cheese includes some mozarella in addition to cheese curds which makes it more gooey. The portions are enormous so be weary of ordering a large, unless you're going to share, or if you want to bring it home ;) The prices are great, you get a lot of bang for your buck.A typical order would be chicken with salad and fries, fills your plate (and belly) right up, for only 11$ (tax included).There's usually a line, but sometimes you get lucky."
/user_details?userid=t-0_us3OTzs_ZhKy6fcamg,Dawn M.,"Toronto, Canada",3 star rating,"Came here on the enthusiastic recommendation of colleagues. But I should have just realized that roast chicken is not my cup of tea. I've never had a roast chicken that wasn't dry before, and this was no exception. However, it was GREAT value for the money and I really enjoyed being in a local hotspot.The chicken is roasted over charcoal, which is wonderful and very enticing to watch - but I noticed with some dismay that the chicken they serve to you is pulled from a drawer beneath the grill - they collect all their cooked chicken in those bins for serving. I think they could have been roasted a shade less time, and if they plucked them straight from the grill onto your plate it would have been a lot more delicious - and hotter!I ordered the Combo Véronique, which came with a chicken leg and a segment of chouriço, as well as fries and salad. The chouriço was tasty but cold and very, very salty. I think the best part was the fries. They were delicious - and seasoned! My colleagues told me to make sure I got the hot sauce and I'm so glad I did, because it was heavenly over the awesome fries. The hot sauce was not very hot at all, but tasted like a garlicky butter with a very subtle kick. That was the best part of the meal by far.I also got a passionfruit soda, and a nata tart per my colleague's recommendation. I really enjoyed the soda because we don't have anything like it in Toronto, and it is not too sweet. The nata...also another one of those things that should have realized and accepted is just not my thing. But it was well made and would make any nata fan happy.Overall I'm glad I came and braved the long line, but not my cup of tea. Had I not been alone, I would have been interested to try their poutine! I heard good things about it and it's MASSIVE and it looked good!"
/user_details?userid=-4Z0DJd6_luSZN5gOU8Txg,Cori B.,"Milford, NH",5 star rating,"Best poutine I've ever had. Fast service. Crowded and busy atmosphere, but I took it to-go so that didn't effect my opinion much at all. A must try for anyone visiting the area."
/user_details?userid=rPIQiemmu6kX3WX7xUUJnQ,Ashley A.,"Toronto, Canada",3 star rating,This place gets 3.5 stars.The Good- very reasonable prices- grilled chicken is decent- conveniently located just a few small blocks from our hotel (Auberge de la Fontaine) in Mont-Royal The Bad- the chicken is good enough but didn't meet the high expectations set by all the 4 and 5 star reviewsTheir chicken is good and it's very reasonably priced ($15 for a whole chicken) - a rare combo these days.
/user_details?userid=QdRP7wn2GZsFgFfhJJmUWA,Yuzhou G.,"Montreal, Canada",5 star rating,"Great chicken with amazing source! I honestly never tried Portuguese meals before and I will say the chicken really catches my tongue. And my roommate said the egg tarts were amazing as well, I personally am not a big egg tart fan, but you guys can trust my roommate's taste.I ordered the 1/4 chicken leg meal as you can see in this picture, some egg tarts, a cream cup and a diet seven cup, everything add up to about $20, and I've already decided to take one whole chicken to go next time."
/user_details?userid=MYOWs6kjlrV9mBADQyVElg,Andy C.,"Seattle, WA",3 star rating,"So I might have had a difference experience because I ordered the poutine.There was about a 15 minute wait to order...there is basically 1 guy preparing the orders, so you just wait your turn.  Apparently, a lot of people order for the office or takeaway, so even though there were only 6-7 people in front of me, it was long.  I guess you can call ahead and pick up quicker...there's a separate guy doing the call-in orders.I ordered the petite poutine...it looked yummy.  fries, cheese curds, chicken, chorizo, gravy, piri piri!  (By the way, the petite is plenty big for a regular meal. I have no idea how everyone else is ordering the regular and finishing it)The issue is that after it's prepared, you continue to wait in line to pay (another 5 min or so).  By the time I sat down to eat, my poutine was much colder...fries no longer crispy, cheese curds barely softened.The chicken itself was delicious, but I didn't eat most of the fries or curds.So...basically, poutine was cold by the time I got to eat."
/user_details?userid=qTNtPlpssXaheDc22W0ibA,Jolene H.,"New York, NY",4 star rating,"Juicy, tender, yummy fries (crispy outside, potato-ey insides)Winter and at an odd time (330pm) It was practically empty. Huge portions - 1/2 chicken platter and small poutine to share for 2 Easy ordering since there were limited choices (a good thing!) Hot sauce was not as hot as I imagined but the chicken was falling off the bone! Great poutine! Natas was also great! We came starving and left stuffed - didn't manage to finish our fries /:"
/user_details?userid=5vXMMeonwwLUv1sPkXzYHQ,Kaman S.,"Montreal, Canada",5 star rating,Trop Bon!!! I tried almost everything at this restaurent. Everything are really good. Also love their Portuguese tarts... yummO!!  Always a long line up but serve very fast. Seats are not very comfortable... I highly recommend.
/user_details?userid=yphnJ8zYbJF7Y3QbtMj91g,Shahanaz B.,"Southwest, Montreal, Canada",4 star rating,"When I went in, well big line up! What's all the fuss about. So super busy, I can barely a see place to sit. By the time ordered, payed and got my food. Yay, we found a table. My plate looked humongous for the price I paid. The minute, I put the piece of the chicken in my mouth, I became speechless. I don't even know how to explain. Usually, I cannot finish my plate, but the taste of the food took over the fullness of my belly. Plate completely empty.Simply super duper delicious Portuguese chicken. Thank you Kathy Benfeito for recommending such a place of gem."
/user_details?userid=xDg4gp_oBUudXbZz31yf-A,Helena U.,"Montreal, Canada",4 star rating,"Bookmarked this place for a while now. Finally got to try it. I read the comments before and read lots of them saying how big the portions are over there. Man, they were all right about that! We ordered a quarter chicken plate and a small poutine for 2 people and it was more than enough! We step in the restaurant and the line up kept going for the whole time we were there. The place is small with not many seats but we managed to get a table. The menu is written on the wall. The prices are really reasonable for the size portion they give. The portugese chicken was slightly dry inside but it was well marinated on the outside. As long as they keep the same quality and prices, I will definitely come back again!"
/user_details?userid=flV6Cp3M2vHcqFBcCrGS1A,Jennifer C.,"Markham, Canada",5 star rating,"A local favourite and I can see why! The chicken is roasted in house and super flavorful. They obviously specialize in chicken but the portion sizes are big and the prices are good. For $11, you can get a half chicken, fries and salad (Louis Cyr dish) or for $9 you can get a quarter chicken with fries and a salad! The Natas (Portuguese egg tarts) are also a must try ($1.50 each). What's great about the chicken joint is that all the prices include tax already so whatever price you see, is what you're paying for. They do tend to have quite the line up but trust me, it's well worth the wait since the food is not only flavorful but plentiful. They have seats inside as well as a small patio outside -- first come first serve after you order and wait for your food. I would say they are quite efficient given the line up and also very friendly! I would definitely return to try the chicken sandwich!"
/user_details?userid=Ng8f6t-OvZLOMZgVT8X6Nw,John A.,"Philadelphia, PA",5 star rating,Absolutely phenomenal. The spicy sauce is worth the wait alone. The chicken is incredible and the poutine is some of the best I've had.
/user_details?userid=xolh76DMNJv3GaR3aD354A,Raymond S.,"Rowland Heights, CA",5 star rating,"I'm not sure I can express how much I love this place and how disappointed we don't something similar in LA.Chicken was delicious and their sauce is so good. Would've liked it a bit spicier but that's gilding the lily. Fries are perfectly crisp and hold up well even in poutine form. Speaking of which, the poutine is the best we had all trip (didn't even bother going across the street). Mounds of chicken and chorizo on top of their awesome fries with curds, gravy, and house sauce. First time my fiancée wasn't let down by poutine the whole trip. The chuleta sandwich was pretty delicious. Their natas are on point. We came back 3 times during our week stay in Montreal.Portions are huge (even the ""small"" poutine strained the 2 of us). And prices are so reasonable (cheap even) for how much great quality food you get, I was starting get suspicious that they obtain free potatoes and huge discounts on chicken. Don't be put off by the line to order because service is fast and friendly. However finding seating can be a challenge. I'm told warmer months are good because you can picnic at the park a block away."
/user_details?userid=vUhjsASMO1nJXgJw-UcCSA,Jim R.,"Ada, MI",5 star rating,"Wow. On our family vacation in August of 2018, this was our best meal. By far. And we are at some great places that week. Line at lunch was long and slow and hot and worth every minute and bead of sweat. Chicken was amazing, potatoes were amazing, poutine was amazing. The salad was a salad. Cooks were great to chat with as well. Huge portions. Then we had a 3-hour bike tour. Oops. One complaint: my family agreed with me that we could eat every meal there, then when I started off there the next day for lunch they made me turn around. They said it was rhetorical, and I meant it literally. I. Could. Eat. There. Every. Meal."
/user_details?userid=8HafK5cS8pWCWNQTIG8iJw,Uyen D.,"Montreal, Canada",5 star rating,"You know how friends from out of town always ask ""What is the best place to eat Poutine in Mtl?"" And most of the time people will say ""Go to La Banquise!"", which ironically is right across from Ma Poule Mouillee. To that question I'd answer ditch the lineup and come wait here instead (yup, lines are long here too). But it's so worth it, trust me. First of all, they don't skimp on meat. It's probably equal parts roasted Portuguese chicken, chorizo and fries. Then there's the spicy sauce. And the San Jorge cheese. Heaven for poutine-a-holics. I shared the Louis Cyr (half chicken +fries and salad) and small Poutine with my bf and we were so full afterwards. Long lineups, but you can skip the line if you plan a bit ahead and order by phone. Small (10 tables at most) but turnover is pretty quick. If you're only here for the natas then skip the line and head straight to the pastries counter at the back. You won't be disappointed!"
/user_details?userid=lOTna4cz8v1Qa-rf3uPKhg,Richard P.,"Topeka, KS",5 star rating,"I hope the people of this great city appreciate the availability of exceptional ethnic cuisine like this. Coming from the culinary desert known as the American Midwest I long for fresh, quality prepared  foods such as this. The experience of waiting line with people from all over the world (mostly younger) is just icing on the cake.The photos speak for themselves on what to expect and you won't de disappointed on flavor and certainly not on quantity. The mixed salad served with the chicken and fries is a nice balance and certainly aids in the digestion of the feast. My wife had the #3 which is 1/4 chicken with breast and I had the #2 1/2 chicken and it was more than we could eat. Note: there is an option for regular or spicy (both were great)."
/user_details?userid=YJhUmUIvCm_GNYXjz3bL_Q,Elliot P.,"Brooklyn, NY",5 star rating,An hour in line. And we're on vacation in Montreal. Could this restaurant be worth it?Absolutement!!  OK we're from Brooklyn so we're not experts on poutine. But I can't see how any place might be better. Sure La Banquise is across the street and they're line seemed equally long. But Portuguese chick with poutine and chorizo. To die for. On our top ten list forever.
/user_details?userid=MeJJ50cVS-ycShR5wBKtHg,Alex A.,"White Rock, Canada",5 star rating,"Oh. My. God. *cue Janice laugh* This place is amazing! There's an explosion of flavour in every bite of the chicken and potatoes and salad. Romados used to be my go-to but yooo-- Ma Poule Mouillée is next level. J'en ai l'eau à la bouche. The portions are massive too. Potatoes galore! I eat a lot but daaaamn, I'd have to come in on an empty stomach to finish a serving here. The packaging is pretty great too, fancy brown boxes; people think stuff like that doesn't matter but those little details are such a great touch!The service is also fantastic. They're patient if you're one of those who take ten hours to decide if you want spicy or not. It's friendly from when you first get in line, all the way down to when you're paying at the til. Lines are long so be prepared to wait and remember to bring change because their debit machine doesn't take tips!"
/user_details?userid=68PRn5eAVHV1SYHWmdnPkg,Christina W.,"Toronto, Canada",5 star rating,"The smell, taste, portion and satisfaction from the meals here are off the charts. My family ended up here since we found out that La Banquise closes really early during the holiday season (bummer). We ordered 1 large poutine for my sister and me and 1 small poutine for my dad. That was a very poor mistake on our behalf. 1 large poutine is more than enough to feed 3 people. We were all struggling to finish our portions and admitted defeat.The chicken is juicy, well-seasoned, and aromatic. The gravy was also very flavourful, which complimented the cheese curds nicely. My favourite part was the sausage though. Those little nuggets were full of flavour and I kind of wanted a whole sausage afterwards.Be warned, it is a little bit on the salty side due to all the well-seasoned components.All in all, my family and I would come back in a heartbeat!TL;DR Portions are huge for the price! Poutine is heaping with meat, cheese curds, and gravy. Cholesterol beware."
/user_details?userid=B7f5iHcyszjiHthLr5_6zA,TC N.,"Montreal, Canada",5 star rating,"The chickens are super delicious, grilled with a smokey flavour and topped with piri piri sauce which is not crazy spicy. You can fond your way here by following the aroma with your nose. I could finish a whole chicken by myself, and then some!"
/user_details?userid=VAJT8Y8LnQ7FGxyX222vfg,Denis L.,"Mercier, Canada",5 star rating,Yummy chicken legs with tasty fries and there hot sauce to die for. Also loved the salade with lots of carrot strips.
/user_details?userid=is9d2RAi0rlby-9bvLnncg,Armand ..,"Miami, FL",5 star rating,"My girlfriend and I stopped by here during a long lay over in Montreal, and we ended up coming back for a second time before our flight left. The layover was after a week in Paris, and the poutine we had here was the best meal we had during our whole trip. Still think about it..."
/user_details?userid=f70fQEwIfsGVUBquRbUvDw,Sadia C.,"Pickering, Canada",5 star rating,"Our first visit came last year during the Canada Day weekend - albeit probably not the best weekend to come out since there were SO MANY PEOPLE and line ups were inevitable. We initially planned to go to La Banquise but as we approached and saw the line going two blocks down we accepted defeat and were about to turn around and head back when my boyfriend spotted Ma Poule Mouillée across the street. There was a line up, but it was only maybe 1/4 of what Banquise had. So it was my boyfriends idea to try this place instead. Best. Idea. Ever. We were a group of 6 people and we were probably lined up for 30 minutes. The process was quick, cafeteria style. Having been back three times now our usual order stays as the Poutine (without the chorizo). I don't think we've ever eaten such delicious poutine in our lives. We live in Toronto and with so many food spots it's unbelievable that the best poutine (in our opinion) is all the way in MTL. We've now made it a thing to drive out at least once a year to stay in Montreal and have our favorite poutine ever. Plus, for the price you pay, ($14?) the sizes are sooo worth it. Actually, my boyfriend made a work trip out for the day yesterday and brought back three regular sized portions LOL!"
/user_details?userid=l-1cva9rA8_ugLrtSdKAqA,Vibhor S.,"San Francisco, CA",5 star rating,"Next time instead of La Banquise check out this gem across the street. Ma Poule Mouillée, the portugese place right across the street makes some of the best poutine I have had, with chicken and chorizo is #blessed. Does the hashtag make be basic?"
/user_details?userid=8o5YaBnbnTJfjc7wpsiGUw,Kristie N.,"Montreal, Canada",5 star rating,"I love this place. Hands down the best place in town for Portugese chicken (I find that Romados is more oily and the chicken is a bit too dry for my liking). I always get their poutine and it's so good!! The small is only $9 and it's enough to for two/three people or you could eat the whole thing by yourself. They slather on gravy and this other homemade sauce that is so delicious, then cover the fries with giant cheese curds, chorizo and chicken. It's too die for!!!! Do yourself a favour and come here and grab a pastel de nata at the same time (portuguese egg tart)."
/user_details?userid=gUUrJA8PoQqIf8zhbyKYkg,Ayat A.,"Longueuil, Canada",2 star rating,They have good food but the staff can be very rude especially that girl who work serving the chicken on friday afternoon. I wish I took her name.We asked her a question and she replied that she was not working yet but started working 5mns after.I worked in retail and would help anyone who needed me before or after my shift if they came to me.
/user_details?userid=c5A2f4yS4XxO9CUQiPZ5sQ,Rachel Z.,"Manhattan, New York, NY",5 star rating,"tl;dr - eating at this place made me feel guilty, because I felt like I was stealing away this amazing, hearty meal at such a low price. A must go.I literally adjusted my eating schedule to avoid Ma Poule Mouillée's long lines; when I came at around 4 during two workdays, there was no line at all. The half-chicken meal is wonderful on all fronts. We went for half fries and half potato balls. The potato balls have a really unique texture and taste. I believe it had a hint of saffron, but the ladies working at the front didn't tell me the seasonings so it's all speculation. The fries were also great; crispy and thick in all the right places. The chicken is also amazing! The spicy sauce is a must-get; it's not just one-dimensional heat that I believe Romados has. Instead, it's a pretty light sauce with a deep flavor accompanied with heat. The salad was also outstanding; fresh vegetables and a yummy honey-mustard-esque dressing. Every aspect of our meal was perfect, and we were astounded by the value and taste. People working there are friendly towards tourists and seem really happy. This place is great."
/user_details?userid=aPYutgZDyVt8iv88FYlzoA,E L.,"Vancouver, Canada",5 star rating,"HUGE portions here! I'd come back here next time just for one small poutine or a regular size for 2 people. The poutine was delicious they mix in 2 pieces of their chicken and also half of a smoked sausage, along with cheese curds and gravy. Their right across from La banquise the famous poutine place in Montreal. I think their poutine is better IMO. Go try for yourself!"
/user_details?userid=LSmijunlAgPQx1DsEKundw,Mary G.,"Montreal, Canada",5 star rating,Delicious place about 10 mins walk from metro Mont Royal. It is always packed but the service is very fast! The chicken is so juicy and tasty! You get plenty of food for a cheap price! A 12$ plate can easily feed 2 hungry people! Also all their price is tax included! They also have delicious pastries that I ate too fast and forgot to take a picture. Definitely recommend especially if you want to eat on a budget in Mont Royal.
/user_details?userid=NGLufCod1pP760aBucp3tw,Katie Z.,"Montreal, Canada",5 star rating,"Ma Poule Mouillée serves up, without a doubt, some of the best roast chicken I've ever had. With its huge spits over which they rotate the chicken until it becomes a nice, golden brown as well as its huge portions, the place never fails to satisfy my cravings.I ordered the half chicken with salad and fries, and for some reason, I always find myself surprised at the portions they give. Even if you haven't eaten all day, it's nearly impossible to finish everything in one sitting. Maybe it's because they give an enormous amount of fries (aka carbs overload), but I was able to wipe the plate clean with the exception of one piece of chicken. The chicken is oh-so-juicy with the spicy sauce actually being somewhat spicy and melding perfectly with the crispness of the skin, the salad is fresh and has an amazing dressing to go along with it, and the French fries aren't overcooked for once. What's not to love?Honestly, Ma Poule Mouillée is simple and delivers delicious food without the gimmicks and at a great value, which makes it ideal for students. Go there if you haven't already."
/user_details?userid=DiNsPYLvgxKH9Efri52Pmw,Jenny W.,"Toronto, Canada",5 star rating,"Our original plan was to line up for lunch at another place but it was so cold we quickly gave up and looked for another option. I was slightly disappointed at first because really, how good can rotisserie chicken be? The food though quickly put me in my place. Ma Poule Mouillee changed my life long distain for rotisserie chicken.The chicken was falling off the bone tender with a beautiful crispy skin. The spicy sauce added a delicious kick without being over powering. I opted for full salad instead of fries (because I ordered an additional small poutine) and I am in love with the dressing...I wish they sold them in bottles. The small poutine can feed three people. It's full of delicious sausages, chicken, and large cheese curds..defiantly does Montreal proud.Don't leave without trying the portuguese egg tarts. My only regret was not buying a box of them to go."
/user_details?userid=wFC_JRE5r2HxbFGXJNuuzA,Patricia L.,"Queens, NY",4 star rating,"First time having poutine, and it was a great first experience. Word to the wise, the petit poutine is plenty to share between 2-3 people. I would come back after having a few drinks :)"
/user_details?userid=oBaE9y4bEAwby8BVztYvfQ,Antonio E.,"Laval, Canada",5 star rating,The chicken there is amazing ! The chicken is so juicy and tender. Their secret Piri Piri dressing is so luxurious and thank god we can buy some to go. I bought 2 whole entire grilled chicken for 35 $ which is very well priced for the quality you are paying for ! They should open another location.
/user_details?userid=hkZM4ZEkO8nSPro0N4gxgw,Aisu K.,"Ville-Marie, Montreal, Canada",5 star rating,"I dropped there yesterday night and we got our best Poutine ! We were shocked by the huge size of the small one, we were convinced it was the big format. Nevertheless everything was perfect, the chicken is so tender, it was the done at the speed of light and the staff was very friendly and nice !"
/user_details?userid=NtXuUpVUDYPyOZQgzYlpIg,Mendel S.,"Côte-Des-Neiges—Notre-Dame-De-Grâce, Montreal, Canada",4 star rating,Affordable price with generous portionsAlways eating their poutine thereGood place for students
/user_details?userid=xi1ACTYoQNurMY6iR6-NRQ,Utkarsh V.,"Toronto, Canada",5 star rating,This place has the best poutine in town. This is evident from the long lines and the bustling crowd at this place. We came here in Canada day 2018 and found the place full despite the heat and lack of ventilation. Amazing poutine just sealed the deal for me.
