user_url,user_name,user_city,user_rating,user_review
/user_details?userid=JstDKWmAZsL026ADFxf7fw,Tony Kangrui L.,"Montreal, Canada",5 star rating,"Legend has it that the the owner of the place used to work for Romados before the fire two years ago. Actually it's barely a secret. And so to answer the burning question of who's best, I personally think Ma Poule Mouillée comes out winner with the same huge plates of fries, salad, and piri-piri chicken. The difference is one of consistency: I've always had tender juicy seasoned-just-right chicken over here while Romados can be a game of dry & over-salted roulette. Although my sample is a bit skewed with only a couple portuguese chicken meals at Ma Poule Mouillée compared to twice-a-week visits to Romados in my last life. I mean at $10 a plate who isn't tempted to go back again and again? Then there comes a point where you'll have had way too many portuguese chicken meals to want to eat that again. That's why I think grilled seafood at Ma Poule Mouillée is genius. The chicken-chouriço poutine has great flavour combinations and the large ($12) can legitimately feed two hungry wolves. If only the people who line up at La Banquise across the street knew...Small details like serving food on a real plate also add to the value (not that pilling a Styrofoam takeout box can't be an experience on its own - it just gets old and impractical fast). Not to mention Ma Poule Mouillée is trendier, cheaper than the average portuguese chicken restaurant and has outdoor seating during the summer. Tony Alves improved what is already great.Update 1 (2015-11-26):I had the steak plate today - not sure if it's a daily special or something on the regular menu. It was a modest piece (probably 6-8oz), cooked to a very nice medium-well over charcoal. However I wasn't a fan of the gravy which looked a lot of poutine sauce. Neither of the egg. Overall just salty and lacked spices. I would stick with the grilled calamari plate if your'e looking for a break from chicken."
/user_details?userid=k74RHnOFCrliUV0f5DhKRA,Jumbo D.,"Saint-Laurent, Montreal, Canada",5 star rating,"Duuuuuudeeeee! Best portuguese chicken in montreal! Nothing else to add. Try it at least once if your in the plateau, worth it."
/user_details?userid=Lk0Gka6WYBtp3nBRMxRmww,Carly H.,"Athens, GA",5 star rating,"Wonderful food and staff, I would highly recommend this to anyone in Montreal! The spicy chicken sandwich is 10/10!"
/user_details?userid=EJ5ybtY1FqieuS22LHbT1w,Claire L.,"Montreal, Canada",4 star rating,"Great! Only negative here can be the line...it never looks long, but it can take awhile. A great tip would be to call for take out a bit before you arrive and eat in the parc. You'll skip the line :)"
/user_details?userid=AII0Sf_7xsxf4hMRNCPZ-Q,Lizzie B.,"Quincy, MA",5 star rating,"OH MY GOD. Rollover La Banquise. There is a new poutine king in town. MA Poule Mouillée's poutine is salty, meaty, savory perfection. It comes topped with both Portuguese chicken and chorizo. They are incredibly generous with the cheese curds.  The gravy is dense, and you can taste the chicken skin spices in it.The poutine was one of the best things I ever ate in my life. My mouth salivates when I think about it. As I write this review, I am simultaneously trying to book an AirBnB so I can come back for it. Other then poutine- you can  order chicken sandwiches or 1/4, 1/2 or full sized chickens. Their chicken is delicious - super juicy and tender. 1/4 and 1/2 sized chickens come with salad and fries. Everything here tastes better with beer. I can't think of a better late night snack then Ma Poule Mouillée's  poutine or chicken."
/user_details?userid=0jeHaB3xa9030mQ6mJIprg,Arsche F.,"Woodbridge, Canada",5 star rating,"Very good Portuguese food, tasty and VERY generous portions. In my opinion the BEST in Montreal. They had a fire incident recently and were closed for some time but now seems to be back at serving. I wish this business a lot of good fortune and prosperity!"
/user_details?userid=8naIWDbU7_p1ZakScC8GUw,Prachi S.,"Fort Lauderdale, FL",5 star rating,"This place had the best poutine! They make the fries and roast the chicken right in front of you. The fries are lightly seasoned, giving them an amazing taste. Their poutine comes with chicken and pork, but I am a vegetarian so I didn't get the meat. Their gravy was delicious and their portions are huge. They have a spicy sauce that is very flavorful and tastes great with the gravy. I got extra sauce because it wasn't spicy enough for me. Even though it wasn't the healthiest food, it was definitely worth it. Overall, I would greatly recommend this restaurant if you are carving good poutine!"
/user_details?userid=S_9xTmBOARaqVis0WqlhPw,Yen Q.,"Brooklyn, NY",5 star rating,"A friend highly recommended over Romados & I must admit: I'm blown away. We ordered to pickup, so I don't know about service. The chicken is tender & cooked to perfection. Spiced sauce is intoxicating - spicy tangy tastebud seduction at its finest.The Pastéis de Nata were the best I've ever had: crispy shell, creamy custard."
/user_details?userid=MDXqulpNz_WcAJd-mclwoA,Jackie S.,"Mont-Royal, Canada",3 star rating,"So I wasn't sure how I felt about going to another Portuguese chicken place that wasn't ramados but I had heard good things and decided to give it a try. I decided to take it to go instead of eat it there which may have contributed to my overall rating. I had a half chicken and fries and the price overall was about right. The thing I'm not sure of is the food and food quality itself. The peri peri sauce was tasty but the chicken was a bit dry. Fries didn't do well on my journey and ended up soggy and tasteless. But, like I said, this may be due to having done take out. So, I would try it again just to give it another shot but so far, not super impressed"
/user_details?userid=cbKDSLUhfwjF9myv7jvIug,Gavin P.,"Chicago, IL",5 star rating,"A heart attack worth having! This place delivers a wonderful and huge serving of Portuguese chicken over fresh cheese curds and fries. There was so much flavor in their sauce, whatever it is, that I couldn't stop eating even after I was full. Went into food coma and had to take a nap dreaming about eating more of this. Definitely the best poutine in Montreal."
/user_details?userid=ZEjBNmwcVyeZ3meVdTXbPw,Sam C.,"MPM is the new gold standard for Portuguese chicken in Montreal. It has set the bar so high that many chicken aficionados, myself included, have simply stopped frequenting all other Portuguese chicken establishments.",5 star rating,"MPM is the new gold standard for Portuguese chicken in Montreal. It has set the bar so high that many chicken aficionados, myself included, have simply stopped frequenting all other Portuguese chicken establishments."
/user_details?userid=p-AXVrROISD1gweeXiyxVA,Taline O.,"Laval, Canada",5 star rating,"Food:10/10 really good, I'm definitely going there again. Portions are huge. Price is amazing. 2 meals a big bottle of water cost 21$Con: Hard to find a spot to sit. Be prepared to wait or consider take out."
/user_details?userid=e0z6O22yhiKnxfjQP3aBSA,Daniel M.,"Warsaw, Poland",5 star rating,"One word yum! And so cheap. Full chicken, one ""small"" poutine and a side salad for 23 bucks.. get out of here. First of all, the place has the amazing bbq chicken with a sauce you will get addicted too. Second of all I ordered the small poutine... turned out to be more than I can eat.. and it comes with chicken and chorizo. There is an option for large but you can feed a family of 5 with that... and I eat a lot. Even the 3 dollar side salad was big. Portions are huge and yummy and to be honest you can get a crazy banquise style poutine for 7 bucks... sold. Id recommend calling and picking up your order... it can get quite busy."
/user_details?userid=4apz4hU-MM-8h5uLz01mbQ,Jennifer Z.,"Scarborough, Toronto, Canada",5 star rating,"Let me just say I don't even like chicken usually but this place is the bomb.com. The portion sizes are HUGE, it's easily 2 meals or more if you get chicken and fries (and it comes with salad too!) the sauce is amazing, I make a point to always eat here when I visit mtl. The only issue is that this place is super popular so you can have a hard time getting a place to sit, but the lineup is definitely worth the wait"
/user_details?userid=GrYh9b3nwgFZfoEyKTAgjA,Irene P.,"Whitchurch-Stouffville, Canada",4 star rating,"Ma Poule Mouillee poutine hands down!  It is delicious, sausage flavourful and chicken super juicy.  The gravy was just enough to cover but not soak too much into the fries and was not overly salty like other poutine restaurants.  They recommended a little spicy sauce for the kick and that's exactly what I got.  No regrets ... maybe only that it was too much food for 1 to eat."
/user_details?userid=IpO2GbD5J1dvJREp5KzRdQ,B W.,"Calgary, Canada",4 star rating,"I'll give it 3.5 - 4 starsCrazy local poulet place.  We arrived to a lengthy line up even at 9:00pm but it was a Saturday night so makes some sense although I suspect it is busy regarless.Charcoal roasted chicken was good and was very tender and moist.  If they could ever time the demand with the supply and serve chicken right off the grill, that would be spectacular.  But everyone settled for the pre-cooked chicken kept in their warming ""cupboards"".  Which was still good and reasonably fresh.Servings of fries and salad were humongous with the chicken.  We had the petite poutine also which when combined with the chicken and sausage, was a bit overwhelming after getting through about a quarter of the plate.Value for money - greatFood overall - good for the moneyAtmosphere - local vibrant Montreal"
/user_details?userid=YTLEy5v_juzquOEaqLghcQ,Fiona C.,"Kirkland, WA",5 star rating,Best poutine in Montreal!! Delicious chicken!Delicious custard tarts! Delicious!!!!!
/user_details?userid=RISb9OC1whuXSS6Q9FHgKg,Ara K.,"Laval, Canada",4 star rating,Hard to be beat the QPR of Poule Mouillé. 11$ tax in for half a chicken with salad and fries smothered in that spicy sauce. Plate is impossible to finish for any appetite. Service however needs some improvement. A definite destination as this Portuguese rotisserie cooks on charcoal. Bring your appetite and be patient as 30 minute line ups are the norme at this joint. Well done.
/user_details?userid=6elNm2xn9f3KS08bcK-cBw,Carrie-Ann K.,"Montreal, Canada",2 star rating,"We picked up sandwiches with fries and salad to take to the park. Well, we were nearly at our chosen spot when we realized we hadn't been given forks. Yes, they are sitting right on the counter, but when I order food to go and am given a take out bag, I think everything ought to be included in that bag. So we rushed back to the restaurant for forks, knives, and napkins, got alllll the way back to our spot.... 15 minutes have elapsed since we've picked up our food... And we realize we have no ketchup or mayo for our fries. Never mind though, because the fries they gave us were old. I know from fries, alright? And these guys were made, never picked up, and thrown back in the dryer to heat up, making them both greasy and dry, and hard in spots. The chicken sandwich was similarly dry and very plain. The only redeeming item was the pork sandwich, succulent and oozing flavour. The salad was simple but good, but then dessert was a total flop. I ordered a regular natas and got a coconut one... My husband ordered a custard filled lobster tail and complained about dry pastry and a tail that was not fully filled. Super lame experience overall. I'm not saying I wouldn't go back, but I think they need to get it together. If you're going to offer take out, that ought to be as complete an experience as eating in the restaurant, and the onus can't be on the client to make sure you do your job right."
/user_details?userid=8Qmr9QYJOD5P77tT5yAbjw,Ethan Y.,"Montreal, Canada",2 star rating,"I brought my friends here to have dinner today, and when I went to ask for some ketchup, the girl at the cash (the one with facial hair on her upper lip) shouted in my face loudly with a ""What?!!!!"" The strong impatience on her face and the embarrassment totally spoiled my appetite. I'm 100% sure I said ""please"" when asking. Didn't see that coming at all because it was not my first time here and all the other employees are friendly. Maybe I wasn't loud enough when asking, but I certainly do not deserve that especially after 1hr of lineup. The food is just great, but if you ever want to ask for some ketchup, be cautious of the cashier girl with facial hair."
/user_details?userid=vttdFxswoCR2K6NTuGSdMQ,Tiffany L.,"Lachine, Montreal, Canada",5 star rating,Highly recommend trying this place out! You get an enormous plate of food for a very good price. The chicken sauce is super flavorful and not greasy. And service is super quick! Visited January 2017
/user_details?userid=eGsWdfdkDJSnq9okBrMGNw,t x.,"East Brunswick, NJ",5 star rating,"PSA: Both Yelp and their website says the opening time is 9AM, but they don't serve chicken until 10:30 -- they start making them at 9, and you can have coffee and pastry while watching them cook, but THERE WILL BE NO CHICKEN UNTIL 10:30AM. Anyone in a rush and cannot wait please be aware."
/user_details?userid=KUzSS0uiCIlQIcJT63pjGw,Carlito B.,"La Salle, Canada",4 star rating,"This place is amazing. The chicken is meatier and juicier than Romados. The skin is crispy and tasty. No awkward long lines and prices are very similar. Unlike Romados, this place has more places to sit down and eat. I like the cafeteria style line, except it can get long during rush hours. I need to try this pouting everyone is talking about. I'm hooked, this place will see me again that's for sure."
/user_details?userid=fZEUba7F-oUUN3Ym38MNow,Ted M.,"ROCKCLIFFE, Canada",4 star rating,"there's a new (Portuguese) sheriff in town. Full respect to a certain other Portuguese rotisserie, down on the west end of Rachel-- but Ma Poule has their game on tight. Smoky charred chicken, glorious potatoes, tasty fries, sweet-sweet nata... By no means have the (super friendly) team here re-invented the wheel, they've just fine-tuned it, pumped it full of air and put some nice new rims on it. Didn't try their poutine or anything more elaborate-- just stuck with the basics-- which, as it turns out, were anything but. My new Portuguese chicken jam."
/user_details?userid=xO3EIJR0QNzM3CdajinWtw,Michael P.,"Montreal, Canada",5 star rating,"I never really understood how good rotisserie chicken was until I tried Romados. I grew up on St-Hubert chicken and the occasional Scores - Suburban life for the win - and there is a reason I stuck mostly to the chicken fingers through my teenage years. The classic chicken was generally too dry and not as flavourful as I wanted. Finally I moved downtown and then I discovered the beauty of Portuguese rotisserie. Moist and packed full of spicy flavour - finally proper chicken! Living close to Romados over the years gave me great opportunities to indulge when the craving hit. However, over the past couple of years, I've been hearing that another place in the plateau was given them a run for their money. That sounded impossible to me but given the co-owner of this new place worked at Romados for 20 years, it definitively peaked my interest. Last week, after a long Friday class nearby, I stopped over at Ma Poule Mouillee to give them shot.If you've been to Romados, you will recognize the set-up. Take-out counter - you wait in line, watch the chicken cook on the massive grill behind the counter and you pay at another counter where a bunch of Portuguese pastries are on display as well. It's simple but as a take-out/quick service option, it's works well. Decor-wise, that have certainly put more effort into creating a nicer sit-down space compared to Romados but frankly it's doesn't really matter in this context. The food is the key.For my first visit, I went with their ""Louis Cyr"" - 1/2 chicken with salad and fries. The classic combo. First off, huge portion for the price. I was surprised at just how much food I got for 11$ - a mountain of fries and a very sizeable half-chicken. The salad was classic side dish for Portuguese chicken and the fries were great as well - dense, tender and crispy - but let's be honest.... it's all about the chicken. I never thought I'd say this.... but I think they have Romados beat. The chicken was juicy and tender, super moist and so enjoyable. Add to that their spicy sauce slathered over the chicken and you have a heck of a chicken to enjoy.They do have a few other option including a ridiculous poutine that I couldn't justify ordering on top of the chicken. However, I did take the opportunity to order one of their chorizo sandwich to eat the next day. Beautifully smoky and spicy chorizo sliced in between a soft roll and covered with the same spicy sauce as the chicken, the sandwich was a great lunch the next day.And because they had some pastries, of course I needed a natas. Pretty good version to enjoy - the crust was thin and crackly with a nice torched top, the custard had that crème brûlée texture with a strong vanilla note. Always a good way to finish a meal.Ma Poule Mouillée has got this chicken thing down. If anyone you know says they don't like roasted chicken, simply bring them here and watch them realized the error of their ways. Portuguese chicken is a staple of the Plateau and is once again a reminder of the greatness of the diversity of Montreal. Now to find more reasons to visit the Plateau for lunch time....Cheers!"
/user_details?userid=ndKoOKD7-SsT-6Ul-q2yWA,G C.,"Palo Alto, CA",5 star rating,"Both the chicken and pork sandwich are amazing deals! Only around 6 canadian dollars each stuffed with plenty of delicious meat that they cook in front of you. The bread is great (crisp outside, fluffy inside) and the sauce they use adds a nice flavor to the sandwich. Highly recommend this place for a well-priced, quick eat."
/user_details?userid=9yzHD0x5srYlHBbuJROWFg,Katie R.,"Montreal, Canada",4 star rating,"Like many others, we ended up here because of the long, long line outside La Banquise across the street. We were 4 adults and 2 3-year-olds, had just spent the morning skating and sledding and working up an appetite, and were not going to wait for the kids to start crying in the cold. But, we'd already (foolishly) promised them poutine, so when we saw it on the menu of Ma Poule Mouillée, we knew we had a winner. We were afraid the place was a bit more upscale than we'd bargained for, because it looks somewhat swanky from the outside (and advertised being a ""rotisserie portugaise urbaine"") but in fact it was very comfortable and cozy inside.We settled into a table, and ordered a whole chicken, a Portuguese poutine, and a salad. In about 30 seconds, we had food in front of us. Piles and piles of amazing, delicious, steamy hot food. That alone is worth a lot.Like others have mentioned, the food didn't have as much kick or smoky rotisserie flavor as we'd expected, but for our purposes, with the kids in tow, it was perfect. My son devoured every piece of chorizo he could find in the poutine. A surprising, but delicious combination of chicken, chorizo, and the standard poutine fare of cheese curds, fries, and gravy. Our bill was $30. All the menu prices, which were reasonable to begin with, had the taxes included! We fed 6 people (ok, 2 were kids, but still!) for $30, and were all very, very satisfied. Thanks, La Banquise, for being over-hyped and over crowded. Glad we didn't end up there, and found Ma Poule Mouillée instead!"
/user_details?userid=v3bXJIDRQsCazSPCC8KGWQ,Catherine L.,"Ithaca, NY",4 star rating,"The restaurant was packed and the smell of freshly grilled meats was appetite-inducing. We got a take-out box of chicken and chorizo poutine. The chicken was tender and well-seasoned, and the waxy potatoes they used for the fries had a sweet flavour that paired well. However, the gravy was too salty for me- perhaps a good control measure on overall consumption? I would be willing to try their other chicken dishes next time I'm in town."
/user_details?userid=0NPLieYv9tkXJjpqnLVolg,Judy T.,"Waterloo, Canada",3 star rating,"good portion size and bang for your buck but the chicken was dry, flavour wasnt anything special, and my fries were sooooo salty. i recommend the sausage as that was tasty."
/user_details?userid=R2Yicg9lzRcR_lsA5esiSA,KJ T.,"Sydney, Australia",4 star rating,Massive servings. Share the poutine with chorizo and chicken between two. Spicy sauce included. Recommended by a local who said this place has the best poutine in the city.
/user_details?userid=4tkhURpuhw8foPV4Zby_BQ,Dasom K.,"Toronto, Canada",5 star rating,The poutine and chicken here are out of the world. One of the best restaurants in Montreal for fire roasted chicken and poutine. The portions are enormous. My boyfriend and I ordered one regular chicken and sausage poutine and we couldn't even finish it. Would always return when I am in Montreal!
/user_details?userid=o5Lf9GJht3fe7Y6N9tECYg,Susie B.,"Oakland, CA",5 star rating,"Enormous servings of succulent, delicious chicken!  I could even finish my salad, but wow, I really wanted to."
/user_details?userid=b7-hwo6STJn_FH78e5XqcA,Andrea O.,"Philadelphia, PA",5 star rating,"I was told by no less than four friends that they'd disown me if I didn't eat here while in Montreal, and I can now see why. I ordered the 1/4 chicken with frites and salad, and managed to finish about half. The portions are completely insane - listen to your fellow Yelpers when they tell you you'll need to split the poutine with someone (my three friends split a small!). The chicken is AMAZING, so moist and delicious, and the spicy sauce is perfect, especially when it mixes with the garlicky salad dressing and peppery frites. I heard how crazy busy it got during the lunch hour, so we went around 3 pm on a Wednesday and had no wait time. Run, don't walk, and thank me later."
/user_details?userid=LN4ajhAiIshKkXJQhuh6uA,Kali E.,"Montreal, Canada",5 star rating,"Came to this place last thursday and I will definately be back! As we arrived, we saw a line up but we got ourselves a table. We had the chorizo/chicken poutine (which is to die for!) and the other had the typical chicken plates. The portions were huge so arrive hungry or maybe share your plate.  All I can say about the food is YUM YUM YUM! Everything was fresh and delicious.  I think this is one of the best portuguese joints I've been to so far. A bit busy, but worth the wait! RECOMMEND."
/user_details?userid=f1Tuuakga-rv1gbsExBJng,Liz S.,"Cambridge, MA",2 star rating,"Pretty disappointed after getting a few recommendations to eat here. The gravy was super inedible and the chicken and chorizo had a ton of fat and gristle in it, so it was not easy to eat. I wanted to love this place but it did not live up."
/user_details?userid=3NvmvvKNUcigSkT5OlLM7A,Vincent T.,"Montreal, Canada",4 star rating,"Tender juicy chicken with a bit of spice at a very decent price, what more can you ask?"
/user_details?userid=dBOD0jCnRXWGzxRAAle99Q,Amy G.,"Cleveland, OH",4 star rating,"I'm not sure where to start with this... The portions are HUGE. While we were waiting in line, we saw other people's food get plated and said to each other, ""maybe we should order THAT; THAT is HUGE! We could split one of those instead of these meals written on the wall."" Turns out, what we saw WAS one of the meals written on the wall. So, my companion and I split the (#9?) the chicken breast plate. For $9 or $10CAD, we got a healthy portion of delicious chicken, a mound of rice, and a lunch-sized salad with some tasty dressing. We also got an order of the potato balls on top (they were my least favorite part of this meal, but I - in general - don't really care for potatoes, so you should try them). When plating our food, we were asked if we wanted ""spice"" and we agreed; this was a spicy sauce they dabbed on the chicken. I was expecting it to have a hot sauce sort of effect and I was nervous because there was so much of it, but it really isn't spicy. I think it enhanced the flavor for sure.We also got two natas and yummmmmmm they were good! The custard was super smooth and thick and the pastry cup was perfect (not dry at all).FYI - Everything is in French and I am not sure if they have an English menu. it's cafeteria style, so you order at the beginning of the counter and work your way down to the cashier."
/user_details?userid=Z4qxqNBKv-9-rJIIPr5ldg,Mei W.,"San Diego, CA",5 star rating,"I got a six dollar (spicy) chicken sandwich by itself to eat in a park. It only had two components, bread and chicken, and it was the best sandwich I've ever had no joke. The orange oil/spicy sauce soaked like one cm into the bread which was soft and flour dusted and just crisp enough on the crust to have good texture but not smoosh the chicken out. The chicken was chopped into manageable pieces and was simply good, probably not the best chicken ever but as a component in the sandwich was perfect. It's perfect to save for later, and the spice level is perfect, enough to feel spicy but it doesn't linger and burn and necessitate a drink."
/user_details?userid=z1694G64ksVx062XgF5o-Q,Vivian W.,"Jericho, NY",5 star rating,"Awesome.  We are lucky that the line was short.  I cannot believe the chicken poutine with their special sauce was so good.  We got a large order and it was so big that I thought we cannot finish.  But have no fear,  you cannot stop eating."
