user_url,user_name,user_city,user_rating,user_review
/user_details?userid=iFbgPR9AMci9Sg2dDsNPGw,Stanley D.,"Montreal, Canada",4 star rating,"A very good place for lunch! I have been going there now for more than 10 times because it is really worth it.Located near Concordia University in downtown Montreal, this place serves very affordable dumplings. As a consequence, it can get very crowded both at lunchtime and dinnertime. I mostly go there during lunch time because the prices are slightly lower (7$ for 10 dumplings vs 9$ for 10 dumplings).The service at this place can get pretty bad sometimes, being understaffed at most times (eg. one waiter while the restaurant is packed). It might not be the greatest idea if you are in a rush. But the food does compensate for the not-so-great service. One other thing to keep in mind too, once you make your order already, it might take up to 15 minutes before your food arrives. Food-wise, I feel like this is as good xiaolongbao you can get in Montreal, especially for the price. Their variety is decent also, which includes different choices of meat (lamb, pork, shrimp). Overall, poor service, but very good value meal!"
/user_details?userid=cF1oFZ2cl1xpQIsq-yA4mQ,Aretha C.,"Montreal, Canada",4 star rating,"Perfect place to get your 小籠包 fix! We got the lamb and coriander, and sweet pork soup dumplings, and the beef curry pan fried dumplings.Soup dumplings are what you'd expect: juicy, thin skinned, and flavourful. The lamb did not have a gamey flavour and tasted delicious. Sweet pork was my favourite though! The fried dumplings were just a bit smaller than I expected.We went at 6pm on a Sunday night, but the fried buns and the majority of the pan fried dumplings were all sold out! Just settled with what's left on the menu. Service a bit slow, but you know, busy night so I'm not complaining.Prices are amazing too! Would defo come here again.(Pro tip: bite small hole on top, suck up the soup, drop vinegar into dumpling, and then consume the whole thing)"
/user_details?userid=VseHlPAVhHbNZqyl_zRKBQ,Stephanie C.,"Pierrefonds-Roxboro, Montreal, Canada",4 star rating,"Cheap and delicious soup dumplings!This place makes soups dumplings on the spot, offering fresh batches every time. My favourite has to be the pork and coriander steamed soup dumplings, and the beef and onion. Depending on which dumpling you get, the beef and pork are always more juicy and flavourful, and have a good amount of soup inside, while others like the leek, egg and shrimp dumplings are less juicy. This place tends to get packed during the weekend, especially in the evening, fair warning. The wait time isn't the fastest but not the slowest either, taking about 20-25mins for the food to arrive, considering they make your dumplings by hand and then steam or fry them."
/user_details?userid=V5QfQMOJ_13iqG2kc4uEQA,Lauren C.,"Le Plateau-Mont-Royal, Montreal, Canada",3 star rating,"A good place to come for dumplings in Montreal. I put 3 stars mostly because I've found that the quality varies depending on the day that I go. Sometimes the dumplings are perfect and sometimes the dough seems off and the xiao long bao are already broken when they get to me (which is sad because I love the soup inside!)You can see the dumplings being made fresh in the kitchen though. Now I've always been for dinner but according to the menu it seems it would be more worth it to come for lunch to get more dumplings for your buck. The restaurant is a little cramped, however, and is usually packed in the evenings so be prepared to wait for a table."
/user_details?userid=3yGnsbg2upmxoZzLqYtW6g,Laura-Li B.,"Downtown, Canada",5 star rating,"So yummy, I can't get enough! Usually me delivery experiences make me regret if all the time. However, this place gave me faith back. The food delivered was still hot and so good. I had an order of fried dumplings and another one of steam dumplings. The delivery was fast, the food was good. What's not to like? Will definitely go bacj"
/user_details?userid=owtyCzBVO-4xaEnHvPKLLw,Joanne L.,"Montreal, Canada",2 star rating,"Have been to Sammi's many times but the most recent experience was disappointing. We went for lunch and one of the dishes ordered was the pork and crab soup dumpling. After the first bite, we immediately noticed there was no crab taste or strands of crab meat. We asked the server who insisted they gave us the right dish. We've ordered this dish before and it was definitely just a pork dumpling. Nonetheless we were charged $12.99 for it."
/user_details?userid=KEBvAP-lG8oOUaX4coq0cg,Issan Z.,"Montreal, Canada",3 star rating,"We decided to go for dumplings this week, and stopped by Sammi & Soupe Dumpling on the way back home. As usual, we ordered pork/coriander and lamb/coriander dumplings. The pork ones came first and were delicious. The lamb dumplings came 5-10 minutes later. We each ate one, and stared at each other.- Is this lamb?- I think its pork.We flagged the waiter, and told him there might have been a mistake. He brought the dumplings back to the kitchen, where a few staff members sampled them. He came back and said it was definitely lamb, but would prepare us another portion (no extra fee). I apologized, but was puzzled - lamb has such a unique taste, how did I miss it? Anyhow, the second serving came, and we happily started eating. The first dumpling was distinctively lamb, and so was the second. But the third and fourth tasted just like pork. The fifth was lamb again. Was I losing my sense of taste? Did they make a mistake again? Who knows, but I wasn't very happy about it.I still think their food is good, but I don't really feel like going back anymore.Note: They brought in new tables. A nice improvement!"
/user_details?userid=QYKYfSNHAkaE4Vf0lNqBFQ,Amanda U.,"Laval, Canada",5 star rating,"After hearing my sister rave about sammi & soupe dumplings, we had to try it out!!!With a toddler and baby along, we decided it was best to go for lunch. We arrived at opening (11h), first customers of the day! We sat at the back, on a table with a bench where my toddler can move freely and added a high chair for the other one. I can say the place is baby friendly!! One of the few restaurant where there is a spot to store your stroller next to your table! After looking at the menu, we were pleasantly surprise on the pricing... super affordable! Range between 6-8$ per dumplings orders (you get 10 steamed or 15 fried). We got carried away and ordered 35 dumplings (some we took away) plus a cold peanut noodle entree. The steamed dumplings were really good, moist with lots of soup inside. We had the beef curry fried dumplings, which is an interesting mix of flavor. We definitely recommend this place, come early as it tends to fill up quick."
/user_details?userid=Fl0Ma3hCnjxHWQiGYCfLOg,Sindy H.,"Montreal, Canada",1 star rating,"I will try to make it short and straight to the point with this one. The place : infested with fruit flies, we couldn't keep em off us and for some twilight zone reason, we seemed to be the only ones bothered by them. It's outdated and was sliding off my seat (banquettes) broken stuffed with a rag perhaps in the hopes of keeping it together? The staff : the ones I interacted with at least, not very alive, walking around like zombies, mind you I do love Halloween but not in that context. The food : although prepared by order was not in the least bit fresh. The curry beef filling was extremely dry and tasted off. The porc gave me nausea and im pretty sure it wasn't fully cooked !!! ( you can kill ppl like that ) I ate one soup dumpling and one porc fried one and one beef curry one and I was done. I felt so sick afterwards. I don't know how this place attracts that many people and if they're too drunk or oblivious to what is really going on but I am never stepping foot there again."
/user_details?userid=TvenTNXyYtMNtED0i2tXfA,Heather C.,"Toronto, Canada",4 star rating,"Soup Dumplings!REAL SOUP DUMPLINGS!So, it's pretty hard to find real soup dumplings anywhere, and they do not exist at this price point on this continent. We made the mistake of ordering the pickled cucumbers (slimy and underwhelming), and the hot and sour soup (chicken egg drop soup, with some fungus); normally, this would kill their chances, but the soup dumplings were hot, fresh and fast. They have thin skins and are full of soup, and full of meat too! The fried ones are a little underwhelming, but if they are your jam, then they aren't bad (just not as good as the steamed ones). The flavours they are actually come through, so shrimp and pork, you can actually taste the shrimp and pork. Alcohol is cheap and cold, so that's just an added bonus! Service is fast and turnaround is quick, so don't worry too much about the ever present line."
/user_details?userid=xC-q_yh0XwcjRLimkS3RNg,Jonny M.,"Vancouver, Canada",4 star rating,"I'm not sure how it happened but I ate at quite a few dumpling houses this trip. I guess you can never have too many dumplings right? Well, Mon and I met up for an early Monday night dinner. The weather was spitting rain outside so it was nice to take comfort inside. The place is pretty compact but it's cool how you can see the workers making the dumplings fresh in the kitchen. You can bring a bag of dumplings home (30 pieces for $10.35 - 15.00). The menu is split into three: appetizers and soups, XLB's and pan fried dumplings. I love me some XLB's but I've never seen so many varieties for it. I'm a traditionalist though so when it comes down to it, always go with the classic.- Cold noodles with peanut sauce ($2.99) - the noodles were passable but the flavour was pretty lacklustre. I wasn't a huge fan of the peanut sauce, which tasted watered down.- Juicy pork (classic) (J1) ($6.99) - 10 XLB's for only $7! Are you kidding me??? What a steal. These were a satisfying take on the classic soup dumpling. Juicy, a pleasantly thin wrapper and balance of flavours. - Pork, leek and shrimp (F4) ($8.99) - they were already out of most of their pan fried options but we were still able to try one type. These were on the small side and I wished they'd been crisped longer. That being said, they were still tasty and you do get 15 pieces. Another solid spot in the ever expanding options of Chinatown 2. Love this area. 3.5 stars."
/user_details?userid=Rlwhnwqrg2QkKcDougcJqQ,Shaun Z.,"Le Plateau-Mont-Royal, Montreal, Canada",1 star rating,This is the worst restaurant I had in Montreal. They took my order and did not give my food for one hour. And then the waitress told me: wait 15 min otherwise just leave.Can I call the police for this?
/user_details?userid=km3lnJeuDtQrtKxyU1Dwfg,Trevor T.,"Montreal, Canada",3 star rating,"I've heard great things about this restaurant, so it was only natural that I tried it! It's pretty hard to find GREAT soup dumplings in Montréal, so I was pretty excited. Overall, my experience was okay, but not amazing.There was a sign that said ""Please wait to be seated"", but when my girlfriend and I entered the restaurant, we were told to sit wherever we wanted.We ordered their lamb, and classic pork soup dumplings. They arrived pretty quickly, which was nice. The classic pork was a little underwhelming, but the lamb dumplings were very flavorful. Although the flavor was there, I was disappointed that both types of dumplings kept breaking. I've had many soup dumplings before, and this is something that does not happen with well-made soup dumplings.I am slightly sensitive to msg, so when the food is prepared with lots of it, my tongue becomes numb. After about 20 minutes, my tongue started to feel numb; if you're sensitive to msg, perhaps this is not the best restaurant for you! This being said, the lamb dumplings were very flavorful, with lots of meat and soup. Their beer prices are pretty decent, so I may come back for some Sapporo and lamb dumplings!"
/user_details?userid=MHxV6zAJ5A9AeFXUk5eQtA,Joy O.,"Halifax, Canada",5 star rating,"Sweet Pork soup dumplings! Yes, you heard me right. When I first saw it on the menu I was like ""Eww. Sweet and Pork don't usually appear in the same sentence."" But my friend who frequents this restaurant highly recommended it. And I'm so glad she did. It was not the dessert sweet that I imagined, but more of a meaty sweet that complimented the flavor really well. Besides the sweet pork soup dumplings we also ordered the pork & cilantro, and pork & shrimp. And lamb & cilantro potstickers, whose wrappers were a little dry and tough. Since we don't have soup dumplings in Halifax I savoured every bite of this. Are they the highest quality soup dumplings I've had? Nope, but for $6.99/steamer(lunch price), I can't complain. They were surprisingly filling too. They're made to order so there's about a 10-15 minute wait., and the restaurant fills up quickly. Highly recommend, especially when you have a hankering for some authentic steamed soup dumplings."
/user_details?userid=38u0EcTbJRDQHDOILB8qRw,Lingzi X.,"New York, NY",4 star rating,"Awesome soups dumplings. Had the sweet pork, never had it before, it was very interesting. They made it with brown sugar, which adds a lot of complexity to the flavor. I'm glad I tried it, but I think I prefer the classical savory pork.About the service-- soup dumplings is street food! They're not supposed to have service! As long as you don't come with expectations of proper restaurant service, it's all very fine! They're actually very nice when they have time to chat."
/user_details?userid=GnJ2w63izmrICmt1wNCGOA,Laurence V.,"Brossard, Canada",3 star rating,"If you're looking for somewhere casual, affordable and tasty, this is the place! I went on a Sunday night at around 5:30-6 pm and it was already pretty crowded (mind you it is a small establishment). Service was slow as the waiters did not notice my friend and I were ready to order but we got our food pretty quickly. I notice there weren't as many options as other soup dumpling restaurants I've been (i.e., 10-15 steamed dumplings options and fewer fried options), but I still enjoyed the ones I got: fried lamb with green onion, steamed pork with leek, and steamed chicken and mushroom. The dumplings didn't have as much juice as I've experienced in the past, but I don't mind that as it was less messy. For 35 dumplings, I paid about $16 which is a good price. It's loud in there, the decor itself is nothing special, and the tables are quite close to one another, but it's the kind of place that people come and go. My general impression is that if someone I knew wanted to go there, I'd go, but for the lack of variety, I would go somewhere else for soup dumplings. I give it a 3.5/5!"
/user_details?userid=ADx3PGAOX_ZaYywIf6i-ZA,Wincy S.,"Richmond Hill, Canada",3 star rating,"A casual dumpling shop place, do not come here expecting excellent service or anything fancily presented. The menu is simple - a few starters and a moderate variety of xiaolongbao and potsticker dumplings. There is good variety for all diets-various meat and veggie options are available. Having been looking for more Chinese food in Montreal, I was not disappointed. The wait for food to arrive after order was a by longer than expected, but may be due to a busy night in the shop in general. Have patience as there's limited staff in the small shop. The xiaolongbao comes in sets of 10 and are more northerner sized-about 2in in diameter. Coming from Toronto where super-southern-style (read: Guangdong) ones are popular, these felt much larger and the skin was thicker. We ordered the classic pork and the chicken and mushroom - the classic was an expected good flavour and the chicken and mushroom was a good unconventional option. The potsticker dumplings come in sets of 15 and are, oppositely, smaller than I expected. They're folded with the ends open to allow the oil to leak out making the skin crispier. We ordered the pork and bok choy and the beef curry. The pork and bok choy was again, a classic combination with a flavour that met expectation. The beef curry was a surprising twist that I thoroughly enjoyed - not too spicy but had a curry kick."
/user_details?userid=bds7VxgVm0e6Pu5RuVV-wg,Thea V.,"Montreal, Canada",4 star rating,"Fave dumpling place in the city! I love how juicy and tasty their dumplings are. My faves are their pork and coriander dumplings and the cucumber salad ! You have to get the cucumber salad! So refreshing and delicious. I also recently tried their lamb fried dumplings and they exceeded my expectations. Very flavourful and juicy ! The service is a little slow but they are often very busy, I get it. The place is also quite tiny and there is often a line up. You have to have some patience haha. Prices are also very reasonable in my opinion."
/user_details?userid=BtcNKKvSExeLUWgPFnRJ8Q,Ellie V.,"Old Toronto, Toronto, Canada",5 star rating,This os definitely my fav dimpling restaurant in town. The food is excellent for the affordable price. Highly recommend
/user_details?userid=hBADi4exXG7eTd90WKwQjw,Eric L.,"Montreal, Canada",4 star rating,soup dumplings were good but I ordered the Sweet Pork Dumpling and was not a fan. there non sweet ones were really good though. overall the price is pretty good
/user_details?userid=23wjj6EJFD-jlKPW5931Lg,Simon P.,"Albion, CA",5 star rating,"Used to come years ago and wanted to try it again during my last visit to MTL. Place hasn't changed and serves some of the best dumplings. Great thin dough, fillings are generous. Shared steamed/fried dumplings, loved the curry-beef pan fried this time round. Worth spending a little extra on cucumbers and hot and sour soup. The latter can be a bit intense, but stars some good introductory umami flavors."
/user_details?userid=Henrt3UXBgJAMaM_9szKiA,Kathy N.,"Chicago, IL",4 star rating,"This may be one of the better dumpling places in Montréal. As a vegetarian, it's quite rare to find veg dumplings and this place hits the mark with their mushroom and vegetable soup dumplings. Also, their lunch menu makes for an incredibly satisfying and affordable meal!"
/user_details?userid=iNtIt-Paqm1Z54vtlY6ySg,J W.,"Côte-Des-Neiges—Notre-Dame-De-Grâce, Montreal, Canada",4 star rating,"My favourite dumpling place, so affordable, so delicious. We love the juicy pork dumplings, but also the lamb and coriander and shrimp / scallop ones."
/user_details?userid=F8I0FAZxzWJjcLoajsYK3Q,Phuong N.,"Toronto, Canada",5 star rating,"Yet another Montreal gem that made our trip all the worthwhile. Busy and always lively, the specialty soup dumplings are always at the top of my to-do list when I'm visiting. Yet once again, with the saturation of so many dumpling shops all through the city, their simple offerings and no non-sense service style push them to the top. This place is up on top with the best of the best, and I have not experience any place that can complete with this place, whether be Montreal or the GTA.The Dumplings are little chubby nuggets that is bursting with juice and meat. What sets these dumplings apart from the rest is definitely the wrappers and had a nice chewiness to them; not too thick and just delicate and sturdy enough to contain all that mouthwatering goodness. Served with a dash of vinegar and chili oil just for that added kick. I love the classic pork, the lamb and coriander, the pork and crab, and the juicy pork with shrimps and scallops. I love this place. Prices impressively affordable, and quality exceeds expectations. I love that diners get a direct view into their dumpling making kitchen. We get to see the staff so expertly wrap each and every dumplings fresh. It was a nice satisfaction to watch the beginning to the time our dumplings were served to us. Definitely a place to experience. This is my favourite soup dumpling place ever, I'm only sad that I'm about 600 km away from enjoying some right now. I will be back next time and every time I'm in town!"
/user_details?userid=nHjRBSbzPeqdq5_D3AirEg,Patricia C.,"Hampstead, Canada",4 star rating,"This is a great little dumpling restaurant located in the heart of downtown and so cheap ! Its not huge inside but the decor is casual and comfortable and clean inside. The service was quick and friendly and the dumplings were really tasty and well prepared. We were lucky to be seated when we arrived because minutes later the place was full and had a lineup. We tried the pork+cilantro and the beef +onion (One fried and one steamed). Both dumplings were delicious, the steamed order was filled with soup and the other order was fried.  They did run out of shrimp (which I thought was a little odd in the middle of the day on a Saturday) but even so, the experience was a good one. I will definitely be back here again to try more of their items and I would recommend this place to any dumpling fan to curb that craving!"
/user_details?userid=4B6Cfz8wsnPJ4Da34kHx6A,Caroline T.,"Longueuil, Canada",2 star rating,"We went there for lunch because i was craving soup dumplings in like forever, i saw that this place had super good ratings so i had high expectations.We ordered the classic pork soup dumplings and when they arrived i took a bite and realized they weren't fully cooked which is my biggest fear is to have food poisoning...The waitress kindly sent them back. We also ordered a half serving of fried dumplings and they gave us a full serving... the waitress took care of it also The food is bland tasteless even uncooked!After this messy experience i don't think it's worth going there."
/user_details?userid=dgFwd3OckcA8x6RvD__8hA,SoupFilledDumpling ..,"Toronto, Canada",4 star rating,"I gave 4 stars based on my realistic expectations of this place after many repeat visits and delicious dumplings!You don't come to this place for the atmosphere. It's a hole in the wall with annoyingly tiny tables and the leatherette banquet seats are always slightly sticky. There's often a lineup out the door and in the winter the cold constantly blasts in when those waiting prop the door open. However, their soup dumplings are freshly made right in front of you, plump and full of flavourful broth and fillings that cure my dumpling craving every time. We usually order the pork and leek, lamb and coriander and the fried beef and onion but they have lots of good options on their menu. They also serve a limited selection of beers either by the bottle or pitcher.If you come hungry for soup dumplings, you won't be disappointed by this spot."
/user_details?userid=rNtfGhTe3h7qFIL46OzbFA,Samantha L.,"Côte-Des-Neiges—Notre-Dame-De-Grâce, Montreal, Canada",5 star rating,First time having soup dumplings and they were amazing. The soup was hot but so flavorful. The meat was delicious. The dough was just perfect. Will go again.
/user_details?userid=wlGSVJRnj6XXZoQXkydVlQ,Jinny Z.,"Saint-Laurent, Montreal, Canada",5 star rating,"The potstickers were delicious, especially if dipped in their spicy oil (one of the best sauces I've had). Reasonable price and service was pretty good too."
/user_details?userid=9cPxrHI6Klm7XbvfBhnBEw,Julie S.,"Boston, MA",5 star rating,Some of the best dumplings I've ever had. Came back 2 days in a row! My favorite was the pork-shrimp-scallop steamed soup dumpling. Tastes like happiness.
/user_details?userid=VtiHkMISkk69btfo_s0cYw,Luis G.,"Verdun, Montreal, Canada",5 star rating,"This place has everything you are looking for: Delicious food, good service and a cosy atmosphere. I ordered the pork xiao long bao and although they took a while to arrive, I could feel they were freshly made. In fact, you can see them prepare them while you wait. Worth going if you are not in a rush"
/user_details?userid=HpzMECWPO4H1fJihiMG1Pg,Lanyi L.,"Markham, Canada",4 star rating,"The best xiaolongbao I've had in Montreal so far! Service was fair too, and prices were fair for the amount of food you get. I'll be back to satisfy my cravings!"
/user_details?userid=oW9PoxLCSMwZ6EEjKuPNjw,Aimee H.,"Montreal, Canada",3 star rating,"The first two times I went, the food was delicious.  I ordered the juicy lamb coriander and it was sooo yummy with lots of coriander.  I also ordered the juicy pork & leek which was good but not as flavorful.  The third time I went on a Sunday, being so in love with the juicy lamb and coriander, I ordered it again.  It was so disappointing. The service was horribly slow even though the resto wasn't that busy. Then the dumplings came looking pretty pathetic cause they really  flattened out like a big puddle.  The dough consistency was too thin.  There was little coriander in the mix so I was quite sad about that. I don't know if on weekends they have different cooks but it was not as good as the first times I went during the week!"
/user_details?userid=eUOtKYsTgJqLxiiq95U5sg,Chris Nadon F.,"Montreal, Canada",4 star rating,"For a place that I've never had dumplings before, this place was perfect. A lot of choices but I'm a simple gal so I stayed to something that could be good. The ambiance is nice except the music is a bit too loud. Waiters are attentive and refilled my glass of water several times. Would definitely go back a second time to try something else. Good job!"
