user_url,user_name,user_city,user_rating,user_review
/user_details?userid=HXWmun5Hj8KaU_Rm3wvtpQ,Flavio K.,"Montreal, Canada",5 star rating,"I'm in love with their Dumplings!!! For me they are the BEST Dumplings in MONTREAL!!!I went many times and they never disappointed me, always amazing.You can see when they make and cook them, how fast and professional they are.Highly recommended!!!"
/user_details?userid=vJVWP-6RuLtmwatFzpbuBw,G S.,"San Francisco, CA",5 star rating,"Stop being a fool eating dumplings elsewhere. Sammy Soup is THE place to be. I think my boyfriend would actually sale me for some of their pork and coriander steam dumpling. Well, he might. Fried dumplings are good too. Not too fried, bravo. You guys would make Lesley Chesterman proud. Nothing beats the real experience but if you want to try some of their frozen dumplings and try them at home, you'll still have a great diner."
/user_details?userid=gRTJX1byUA31E0OBqfYPIw,Veronica C.,"Montreal, Canada",4 star rating,"This is a great spot for everyone who's craving for some authentic 小籠包 - xiao long bao (soup dumplings) in downtown Montreal! My favourite would be the classic pork dumplings! You can never go wrong with the classics! Every single XLB was very juicy and delicious! Xiao Long Bao Checklist :Hot Soup Chewy Wrapper Juicy Fillings We wanted to try the Shanghai fried bao (生煎包) but unfortunately, they were all sold out... In terms of their fried dumplings, they were okay. I do prefer their soup dumplings more. The hot and sour soup was rich and thick. However, I find the soup was a bit too sour.Classic Pork Soup Dumplings ($9)Beef & Onion Soup Dumplings ($12)Pork & Cabbage Fried Dumplings ($10)Hot & Sour Soup ($3)"
/user_details?userid=yACLb6lUDPjw0g5JrNwXMg,Kyle S.,"Atlanta, GA",5 star rating,"I'm a big fan of this place. Took a weekender trip here and was craving some dumplings, and stumbled upon this place. The location is prime, and inside is nothing special: cash register, tables and a kitchen. But even at 3pm on a Sunday this place remained pretty packed. I ordered the XLBs and the cold peanut noodles. XLBs were really good and juicy. I think that the skin of the dumpling varied a bit in thickness, some being too thin and coming apart when picking them up. But aside from that minor critique, the taste, the size, and the juiciness of the baos were perfect. Pricing is cheap too, 10 of them for about 8 bucks. I think I would've been satisfied with just to dumplings but I also needed some noodles. They were good, nothing amazing. Great spot for a quick bite."
/user_details?userid=mY3NA8f6H0-i38SOjxyhFg,Dan P.,"Montreal, Canada",5 star rating,"Yes this is not just any dumpling ... You have a spoon for a reason. Most of the time I cheat and just skip the technical steps.. and times I'm hungry and pop it in to my mouth only to find myself fighting the burning hot liquid .. feels like lava flowing down... Knowing I'm not going to feel anything or taste anything for the rest of the meal.If I have to choose between eating a hot dumpling or getting brain freeze with ice cream I choose ice cream.All this to say if you haven't tried soup dumplings you're in for a treat. This is one of my favourite places it's super affordable and a great variety. It can get a bit crowded but that's what you get when the food is that good. I personally like the lamb...This is the type of meal you want to come with a group sharing a variety of dumplings makes the experience so much more enjoyable.They do have pan fried dumplings but I'm a huge fan of the steamed dumplings.. If you do want to make this a proper experience and try to make use of the spoon I found this online and some places have the instructions on the wall. If this is your first time feel free to ask them as well ..Put soy sauce and vinegar into the bowl. They say 1 part soy sauce to 3 parts vinegar would be best.i like to had hot sauce.Take the soup dumpling and dip it into the sauce.Then put the dumpling into your spoon, and poke a hole in the wrapper of the dumpling to release the juices.And finally eat."
/user_details?userid=moMgADvpLpjcLkkM1jJDBw,Scott L.,"Conroe, TX",5 star rating,"Stop to watch the dumpling makers, elves of extraordinary efficiency multitasking to create delectable morsels bursting with flavor. Hugely busy, but still able to quickly seat me for lunch rush. Terrifically attentive service Be sure to try peanut butter dumplings! Go great with tea on a cold winter day!!"
/user_details?userid=9MD2Ry2jQ08z1_4VKpEmfQ,Kate G.,"Mercier-Hochelaga-Maisonneuve, Montreal, Canada",5 star rating,"It's been almost two years since my last review of this place, so I thought maybe it's time for an update!This is easily my most visited restaurant in Montreal.Three reasons:1. Juicy pork (sweet) soup dumplings2. Cheap, filling, freshly-made dumplings that are better than Qing Hua by a long way3. You can pretty much always get a table, even during the busy lunch and dinner rush hours (it's a student favourite)Keep on dumplinging, Sammi!!"
/user_details?userid=I8EWu_X7MYWk9Y29V5rHxw,Daniel H.,"Orlando, FL",5 star rating,"A cold snowy day in Montreal, called for soup dumplings. Highly recommend the hand made dumplings as they're  filled with pork. I also got the hot and sour soup which was prepared well. The restaurant is very clean but cramped. It was starting to get full from the nearby college."
/user_details?userid=RwQUv7Cn61gTkPXcytSrSQ,Amy Yu T.,"Montreal, Canada",4 star rating,"Decent enough soup dumplings. Although there are fewer choices of dumplings compared to other places, the pricing was fair and the quality was good. The dumplings were indeed soupy. The service was fast and efficient, always coming to fill our water. I tried the crab xiao long bao, and it did not disappoint. The skin was chewy enough, the soup was at just the right temperature and the whole thing was delicious, dipped in a little bit of vinegar, soy sauce and spicy oil. The pork mushroom one was also tasty. Would come back for convenience and quality of food."
/user_details?userid=SIem6QPvjU9Olzif-aOYzQ,Jodie B.,"Edmonton, Canada",5 star rating,"Wow. Wow. Wow. I'll say wow three times, as that's how many times I returned to this place during my visit to Montreal. It was super-dumpling-rific! It was a slam-dumpling. It literally was my fave restaurant in all of Montreal, and I had some good food there!The place is crammed, informal and has brisk service. But the quality - oh my. The shrimp and coriander soup dumplings are phenomenal! I am still craving them! The shrimp, scallop and pork soup dumplings were also great, but if you can only order one, get shrimp and coriander!You can see the staff create and cook the dumplings right in front of you! So fresh! And prices are very reasonable. The portion per order is large for one person! Highly recommend!"
/user_details?userid=1J8LYd5Cs4UFRMwgdx2HVg,Alexandra S.,"Montreal, Canada",3 star rating,"A M B I A N C EWe finally got in! My partner and I HATE waiting in lines! But we finally arrived early enough in the night that there was only one table waiting in front of us! This place is super small, so not many tables, I finally understood why there's always a line!O V E R A L L   Q U A L I T YHonestly, these were not my favourite dumplings... The dough was quite thin compared to other MTL dumpling places and the service was not the best. The menu is quite small, making the choices easier for us, so if you're new to the dumpling game this might be a good place to start. C O S T$ W A I T   T I M E SNormally there's a HUGE line out the door. Go earlier in the night if you want to avoid this! But once your in the door and order, your food arrives pretty quickly!P A R K I N G & L O C A T I O NLocated on a busy street, so lots of for traffic and limited paid parking spots! Leave early to look around DT MTL."
/user_details?userid=LkP5uU4ncr5MgNp8ercSCA,Annie P.,"Fairfax, VA",2 star rating,"I wouldn't recommend dining here if you're in a rush. Although we were in a large group (10 girls here for a bachelorette), we felt like the wait time for our food was unreasonable (especially since we just ordered the same things, just in multiples to share amongst the group) and were surrounded by dirty tables that weren't being cleaned after patrons would leave.They also ran out of ice during the hot summer day and we were left to drink lukewarm water. We also ordered the a pitcher of the sangria that was advertised on a poster and they seemed to not understand how to make it, and we ended up with a weird mix of fruit juice and minimal alcohol. We had to ask for things multiple times.The soup dumplings themselves were above average. There was a good ratio of meat and dumpling dough and they came out hot. There was also vinegar, chilis, and soy sauce available on the table. We also ordered fried dumplings and those had a bit too much dough to it."
/user_details?userid=eR09YkZsZyyxOUANw-FuFQ,Katelyn K.,"Montreal, Canada",5 star rating,Sammi Dumpling has by far the best dumplings and wonton soup in Montreal! Although it's a bit cramped and the tables/seats could be upgraded it's my go to when I'm craving dumplings. Be warned there's always a line near typical dinner hours.
/user_details?userid=U1vl4SQzO3wTAWlYVnSjnw,Justine S.,"Outremont, Canada",4 star rating,"I've been meaning to visit this place ever since my friends started posting delicious dumpling pics on instagram from here. It did not disappoint. Went for lunch with my friend and we got the fried lamb and green onion and the steamed juicy pork,shrimp,scallop. This place makes the best steamed dumplings I've ever had. The fried I think I would go somewhere else because their lamb isn't very flavourful. But the steamed ones were perfect!! Next time I really want to try the juicy sweet pork ones. Seating is medium sized and my friend and I had no trouble getting a table right away and the service was very fast. She did mention they were friendlier than during the night time hours though."
/user_details?userid=4ayVX0YKY3GSP2IICpLJXQ,Priscilla Y.,"Vancouver, Canada",5 star rating,"I was surprised by how much I adored the chinese food in Montreal as it was all no frills and usually consisted of dumplings. This place was quite close to our hotel so we dropped by for our lunch before heading to toronto. Since we already had brunch, we ordered their specialty being their soup dumplings! We got a juicy pork and leek (classic) as well as the chicken and mushroom lunch deals making the prices extremely reasonable!  The chicken and mushroom was quite different as the texture of the mushroom gave it a little bit of a kick while the soup was less concentrated. The juicy pork was exactly that. Flavourful, juicy pork with plenty of soup that looked very flat but were actually just sogging with soup! Overall, delicious XLB for a great price!"
/user_details?userid=OinaEPoqW_68OP6eDHsPKw,Quoc-Bao N.,"Downtown Houston, Houston, TX",5 star rating,"I am so happy that my family and I came across this restaurant. The line was short when we arrived but became quite long after dinner peak time arrived. Their Xiao Long Bao is very delicious, and is comparable to the Din Tai Fung chain. Service is great here, and they exhibit how their dumplings are made. This place is definitely worth a visit for some authentic delicious Xiao Long Bao in Montreal!"
/user_details?userid=RmnLFQF7c-kbp4qQ8mIUgg,Gloria V.,"Montreal, Canada",4 star rating,"For the price these dumplings are amazing! Ordered the Xiao Long Bao Juicy Pork (10 pieces) and the Pan Fried Cabbage and Pork dumplings (15 pieces).The Xiao Long Baos skin was a bit thicker than I was used to but was surprisingly very tasty! I do not really like when the dumpling skin is too doughy and chewy but it was a good balance. There was a lot of flavour and I enjoyed it. The pan fried dumplings very great, not greasy but nice and crisp. They were a bit on the drier side so I added some vinegar dipping and chilli sauce on the side but it was still awesome.This place is small and I felt a little squished in between two tables. I did not particularly enjoy having to shimmy between tables and I do not like when people are sticking their butts near our food when they sit down.But I did come on a weekend almost before peak dinner time so I think for next time I will come during a weekday and beat the lunch crowd. The service was good, there was a particular lady who was so sweet and she provided great service from our interactions.I really like this place especially for it's price and quantity - I will be back!!"
/user_details?userid=h5eVBQ5DyrpnQOaJ9ycl3g,Shiyue X.,"Montreal, Canada",2 star rating,"After I came back from my trip to China, I've been craving xiaolongbao. When I found this place (on yelp!) and saw that they had a bunch of great reviews, I was so excited! I suggested it to my boyfriend and he seemed pretty interested, so we came. We came on a thursday, but it was still pretty crowded. Luckily for us, we came fairly early, so we got a table immediately. The back of my chair was touching the chair of the person sitting behind me and it was almost impossible for people to pass between tables. We ordered the lamb and corriander as well as the traditional pork. We ate the lamb first and it was quite yummy! I was pretty happy with the flavour. However, the pork was rather bland and didn't really taste like anything. That was quite a let down.Another thing that dissapointed me was the fact that the skin kept breaking. The entire point of xiaolongbao is to have that nice broth. If the skin breaks, the broth is obviously going to run out. The staff was okay. They worked quickly, but they seemed a little hectic, which made me feel rushed. When it came time to pay, we had to go to the register, which I don't mind at all. However, because there's no real line, the customers seemed confused and there was inadvertent line cutting. The meal was fairly cheap though. 10 xiaolongbao came to 9 or 10$. Overall, I was pretty dissapointed. The skin breaking, the bland pork, the cramped space and feeling rushed made my entire dining experience less than great. However, I will proably go back at some point to try it out again to see if I get a better experience."
/user_details?userid=IrZ37G3pEnPtH5wAk3DKdQ,Ilana Z.,"Brooklyn, NY",5 star rating,"I'm a big soup dumping fan, and let me tell you, this place is GREAT! We went for lunch on a rainy Monday afternoon and the place was still pretty busy. They have a lunch special menu with mainly all of the dinner menu items. We ordered the pork wonton soup (it was small but yummy!) and then lamb/coriander soup dumplings along with pork/coriander soup dumplings. Both were amazing and had such interesting flavor to it. The dough was good, but not too chewy and the soup inside was delicious.I would definitely come back here again and try the fried dumplings! It's so cool to see the ladies in the kitchen actually freshly making your order..."
/user_details?userid=8EclJ24l7H0J-GC5tvegcg,Léonie L.,"Ville-Marie, Montreal, Canada",3 star rating,"+ taste is very good! love the pork/crab xiao long bao the most personally. The juice inside is delicious. My boyfriend really liked the lamb xiao long bao. We also enjoyed the shrimp xiao long bao too. Very good food. Juicy and hot. I like the decoration inside also:)- it's long to receive food,server doesn't refill your water unless you ask, dirty sticky table, dirty sticky sauce containers, service is not the best Recommendations: I would suggest more appetizers/side dishes option that are different than dumpling/wontons since it's already the main dish."
/user_details?userid=c56oZZbK3bt8vFA8lz4wfQ,Lani G.,"St. Petersburg, FL",5 star rating,Fan-friggin-tastic XLB! Second best I've had outside of NYC. The pork was great but I think I'm love with the lamb and coriander. So flavorful! Both sets of soup dumplings were light and and filled with soup. So delicious! The fried beef curry ones were quite tasty as well. I'd love to come back if the opportunity arises!
/user_details?userid=JqRq8qDPbKtiuK4OX1o5-A,Milton Y.,"South Glens Falls, NY",4 star rating,"I was surprised by how much I liked this place, it seemed so simple, no frills, just great food. With a hole in the wall type atmosphere, but the food and dumplings were next level delicious!!This place was very close to our hotel so we dropped by for an early dinner - Please do not come here if you're pressed for time. Everything seemed to take a long time to come out, I was bothered by the wait for our food until I realized everything was being made fresh in the back. They even have a viewing glass to watch the dumplings being handmade in the kitchen, its fun to witness the creation of these things from start to finish. he wait is well worth itSurprisingly, the peanut butter dumpling appetizer, was amazing! And the noodle peanut salad appetizer, was amazing!! _ highly recommend the both of them, and they seem to be popular with the locals -- rightfully so.Their Juicy Dumplings were so delicious, Second best beef and onion juicy dumplings were the best I have ever had, the first were in NYC. The meat was delicious and the mouthful of soup was seasoned perfectly and very flavorful - WARNING: the first bites are dangerously hot, so be careful you don't want to make the mistake of burning your tongue and ruining the whole meal with an eager first bite, especially after such a long wait. The place is great -- wish the service was a little faster and they had everything the offer on the menu - however what we did taste was delicious. It's small inside but it works because its clean and the food was so good, the wait was well worth it."
/user_details?userid=2CrTE4dQA8biZ7SLzoFvlA,Jaime L.,"San Diego, CA",4 star rating,Quite enjoyed Sammi. Will be back to sample more.
/user_details?userid=41kMyI1BfOTyIIAenUSaTQ,D'Arcy L.,"Terrebonne, Canada",4 star rating,"So I've eaten here at Sammi Soupe dumpling a couple of times the last few months and here's my lowdown. Order the cucumber dish as an appetizer. It's freaking amazing. Like eating sweet Chinese style pickles which are crunchy and are in a sweet chilli style sauce. They are crunchy tasty delicious. Also tell mom you had your veggies for the meal! Then you can fill your tummy with XLB. Xiao long bao (Shanghai style soupe dumplings) rules supreme here. They are a pretty good value and loads of selection. The first time I ordered the shrimp pork and scallop.  It was a mistake as these ones were smaller. Then I ordered the #1 pork classic ones on the menu just this evening. The pork or beef ones are more generous in size and are juicy and freshly made in the glass cube window. I'd recommend avoiding the XLB's with seafood in them as they are just smaller portions. Also we had tried a plate of chicken fried dumplings. They were piping hot, crunchy and generous in size. Let them cool down or risk burning that roof of your mouth. Overall not the best dumplings I've sampled, however for the price they are more than adequate. Free wifi code available.  NO credit card sign clearly marked at cash register. Cash or Interac only. Pints of beer are available as well as Chinese beer if this is to your game plan for the evening. Overall the XLB is a 3.75/5- you would have to go to Toronto or Din Tai Fung for better ones but these are some of the better ones in MTL. The place is by no means glamorous. It's cavernous and loud when the restaurant is full of hungry young student crowd. The tables could be described as somewhat closer together also.If you can stomach the basic decor and loud place the XLB is worth the visit!"
/user_details?userid=_h_igAq8NhmjLNT4njHxYQ,Kitty W.,"Forest Hills, NY",3 star rating,"Please do not come here if you're pressed for time. I stayed at a hotel a few blocks away from Sammi and decided to drop by to pick up some food. An order of pork soup dumplings and small wonton soup took them 20+ minutes to churn out. This is after I told the cashier I was pressed for time too. If I haven't done so, the order would've taken closer to half an hour.Food - OK I guess. Soup dumplings were soupy, but there wasn't much depth to the flavor. The skin was not too thin, not too thick so kudos to that. Wonton soup is nothing to rave about - plain and bland, but edible. The killer is the SAUCE that comes with it. It's a premixed blend of hot chili oil + vinegar, but tasted like canola oil. No spiciness, no acidic vinegar. Weird much."
/user_details?userid=SMesVaPTVNRJz-Ztj6jYHA,Devika S.,"Auckland, New Zealand",5 star rating,"Literally the best xiao long bao's, you have to try the plain pork. Crab and pork is also such a winner! Home style cooking and service. Ate here like three days in a row!"
/user_details?userid=xn4tDUBqmYNMVws4aDE_Ug,Ariel E.,"South Gate, CA",5 star rating,Delicious dumplings! The broth inside the dumpling brought out the flavor of the meat filling. Great service and very reasonable prices. Family friendly atmosphere and variety of dumplings to chose from.
/user_details?userid=i8q-S7WFNkfgOVBx7K6tPw,Yao W.,"Montreal, Canada",5 star rating,"Definitely one of my favourite places to go, especially on a colder day! There is just something so comforting with having steaming xiaolongbaos. The ones from Sammi's are delicious and soupy, reminding me of my hometown. Order the classic pork, you won't regret it! The beef and onion is also another favourite of mine. And yes, it's on the sweeter side and that's just a trademark of Southern Chinese cuisine (so don't go there if you're craving spicy food). Note. Order a cold Tsingtao beer with your steaming hot xiaolongbaos... mmm"
/user_details?userid=apg4zq2NocVW49x6YQA3iA,Neel L.,"Ville-Marie, Montreal, Canada",5 star rating,"This was the restaurant where I first tried soup dumplings and I gotta say I'm hooked. The dumplings are SO juicy and yummy and for the price you pay, you can get so many boxes! I'm quite impressed with the speed of the cooks of making such good dumplings. I've tried so many options like their juicy pork, pork and leek, pork shrimp and scallop and lamb and coriander and they all taste fantastic. Super fresh, flavorful and juicy. Plus the little dipping sauces give it that extra boost!I definitely recommend you to try this place but be warned that it gets crowded really quickly so you might have to wait a bit!"
/user_details?userid=-a0XgJCXoJln2Ue_JMnfIQ,Jules D.,"Montreal, Canada",4 star rating,"I would give this place a 3.5/4The star of the show is obviously the delicious soup dumplings. The broth arrives not too hot, very fatty and super tasty. The dough is not too thick but not too thin, which is perfect for noobs like me who break them easily. The service is what is lacking. The place itself also isn't great: tables are crammed and expect to wait 5-10 mins on busy evenings. Aside from that, I highly recommend it over their other spot Qing Hua in chinatown. I went here twice in one week when I first discovered it!"
/user_details?userid=5CbfKqyOSe63xH6CJL9sSA,Maxine R.,"Manhattan, New York, NY",5 star rating,"GREAT GREAT DUMPLINGS!!! the dim sum here was some of the best i've ever had, especially considering the cheap prices. We (4 people) ordered the steamed pork dumplings (10 pieces), the pan fried lamb with green onion (15 pieces)- would recommend eating with the spicy oil, and the pan fried with beef curry (15 pieces). All were so amazing and we ate them within minutes! All were extremely flavorful, I would very strongly recommend ordering the pan fried dumplings with beef curry as they were especially delicious. The atmosphere was scattered as there were so many people. it took about five minutes to be seated at the peak of dinner rush and the server was incredibly attentive and polite. Definitely would come again! What an amazing restaurant!"
/user_details?userid=xDg4gp_oBUudXbZz31yf-A,Helena U.,"Montreal, Canada",4 star rating,"When people say soup dumplings, I immediately think of this place. It is situated in downtown between atwater and guy concordia.  We ordered the classic pork soup dumpling and the pork, leek and shrimp fried dumplings. Both were really tasty. The way I'm eating the soup dumpling: 1. make a hole in the dumpling.2. Pour the soup into the spoon.3. Drink it.4. Eat the whole dumpling. Voilà! I could say this is a good place when it's cold outside and you want to eat comfort food!"
/user_details?userid=iLIGDMatmuGPGELLFlPXdw,Jess M.,"Toronto, Canada",5 star rating,"Best soupe dumpling I have ever had! This is true because this occasion was the first time I tried a soupe dumpling. The flavours were very complex, the dumpling dough was so tender. You can't go wrong with this place. The steamed dumplings are definitely better than the pan fried dumpling they serve."
/user_details?userid=SyzbL8kotVWE4-RWqqAIkQ,Vivian N.,"Ventura, CA",4 star rating,"There's a lot of dumpling houses but not many that serves soup dumpling. So if you're looking for some soup dumpling, you've come to the right place! We ordered the pork classic soup dumpling here and also the cabbage and mushroom regular dumpling which were both really good. The cabbage and mushroom had a fantastic texture to it and surprisingly very flavorful for vegetarian dumpling. Also ordered a cold peanut noodle side which was average. Reminded me of dan dan but was a little under seasoned. Overall, would recommend this place!"
