user_url,user_name,user_city,user_rating,user_review
/user_details?userid=EaBKe-8LB-NHuH7Us-QhGw,Vincent V.,"Montreal, Canada",3 star rating,"The famous Shanghai style dumpling place by the crew behind Qing Hua. After craving Xiao Long Bao forever, I've decided to give this place a try. we ordered the spicy tofu, the cold sesame noodles, the cucumber salad, the lamb dumplings, the pork, and the crab xiao long bao. The entrees were very average. The cold tofu, while being smokey, lacks any type of flavour. It was a clear case of missing salt. The dish lack a glue that gets it together.The cold sesame noodles were acceptable, while a bit too sweet.The cucumber salad was very cucumbery, and sour, just like how it should be.The lamb dumplings were a total failure, by using the dough of the soup dumplings to make the normal dumplings, it falls apart, taste flat, and has absolutely no texture.The soup dumplings were acceptable, and had a solid balance between the flavours.Unlike most people on this page, our service was efficient and quick enough."
/user_details?userid=UgAl1BXZjJWUAdvVixwhew,Eden L.,"Montreal, Canada",5 star rating,"I love the soup dumpling here. Came on a Saturday dinner time, this place was packed. Waited around 10 mins. We two girls ordered two soup dumpling and the portion is perfect. we had pork with seafood and lamb with corridor. The lamb one is so lamb if you know what I mean.There are some tech in the process of eating. First the sauce: one portion of soy sauce plus three portions of chinese vinegar. add chili oil as you like. Second, the waiting time before you have the first one, the first ones will be very hot so lift them up with chopsticks or finger tips, put it on the spoon and blow it to cool, take a tiny bite on the skin but not to drink the soup, blow it a little to let the steam inside out and then suck the soup inside, and then eat the whole thing. The first ones can be very hot, The first ones can be very hot, repeated.The dumpling should always sit on the spoon. After the first one, the temperature is probably good to go."
/user_details?userid=pMefTWo6gMdx8WhYSA2u3w,Bernie C.,"Mississauga, Canada",4 star rating,"We were walking down Rue St. Catherine and trying to figure out what to eat.  We ended up walking quite far from St. Catherine and Peel because we were just wandering around and ended up seeing a big block of Asian restaurants including Chinese, Japanese and Korean food. We saw a quite few soup dumping places but decided on this one because of the overall reviews plus the price ($7.99 to $8.99 for 10 dumplings).  This is a great price because usually the soup dumplings are $5.99 for 6.  We had two orders of soup dumplings, I believe one was beef and the other was chicken.  Since I don't eat meat that often anymore, I may not be the best connoisseur for this, but my DC loved both of them as they were full of juice and flavour but not too salty.  There was a lot of natural meat flavour and the wrapping wasn't too starchy. We also ordered the wonton soup which was great.  The great thing about this place is that it's roomy, they have an open kitchen and the service is okay.  Overall, pretty decent place for Chinese dumplings, however not too many vegetarian options."
/user_details?userid=XR1Orq2bfw3fYYiUogI4pQ,Jocelynne F.,"Old Toronto, Toronto, Canada",3 star rating,"I came here on a weekday evening around 5pm and was seated immediately. I ordered the pork & coriander soup dumplings, and they came very fast.What I liked:- flavour was good- portion size was good (10 pieces)- lots of filling options, unlike most places I've been to which mostly offer only one or two options- decent price- food came fastWhat I didn't like:- the food arrived quicker than I thought, and for a good reason. The dumplings appeared very steamy when they arrived but once I bit into one it wasn't very warm on the inside. I read another reviewer mention this so I wasn't surprised."
/user_details?userid=YKm-0aMn46Yi0Re2lN1XRQ,Ivy L.,"Seattle, WA",4 star rating,"Excellent choice for a delicious, cheap and authentic Chinese meal. It is actually my favourite dumpling place in the city at the moment. No other restaurants has their Xiaolongbao quite as authentic and soupy as these. The taste was just right: not too salty and not bland. The only reason why I'm giving a 4 is because I ordered the spicy shrimp wonton, but what they have me was some rather small sized wontons topped with a sweet hoisin sauce. I confirmed with the waitress that it was indeed my dish before I tried it. It was everything but spicy. It was just sweet. So I was kind of disappointed by that. But apart from that, I would recommend it. Personally, I would definitely go back, I just won't ever order the spicy wontons."
/user_details?userid=fxkB--Irn-zsFSNQ_FDLhw,Remi C.,"Huntington Station, NY",5 star rating,"YES YES YES! All of the yes'. They make the dumplings literally in front of your face. Which means that they aren't necessarily quick, but they ARE delicious. Got the soup dumplings, peanut butter dumplings, and some other pan fried dumplings. Honestly, everything was really tasty and perfect for the freezing montreal weather. My only gripe - I would have liked a more peanut buttery and perhaps a bit more spicy sauce for the dumplings....something more along the lines of an Indonesian peanut butter sauce would've been perfect. But it was a great meal!"
/user_details?userid=QFSek24a9vAOy1VQpvZhYw,Kevin Z.,"Calgary, Canada",5 star rating,"120% Excellent soup dumplings here. Undisputed soup dumpling champ. How many ways can I put it? this is 5 stars all the way. I have been to Sammi & Soupe many many many times over the last 7 years, and it's only gotten busier. Now there are perpetually line-ups out the door, no matter what hour of the day it is. Lunch time prices are a little cheaper, starting at $7 for a basket averaging $9 a basket. All of the choices are phenomenal, but the seafood one and the sweet pork one are both stand outs. I will also note that their sour / spicy cucumber appetizer is pretty amazing. Their chili oil is also notable - strong flavour but not too spicy, perfect for those soup dumplings. This is the place to go for soup dumplings. Don't miss this for the world!!"
/user_details?userid=ZGiwU16rhGvWAYUzkWL0xw,Boz X.,"Montreal, Canada",4 star rating,"10 xiao long bao (soup dumplings) for only 6.99$?!Brief summary of what I took: I've been here twice now in under 24h, and I must say, the classic pork soup dumplings are reaaal tasty. So far, I've tried:Soup dumplings: classic pork (4.5/5), pork and leek (3/5), chicken and mushroom (3.5/5)Fried dumplings: lamb and green onions (4/5).Shanghai Fried Buns (3/5)Tea: charging 2$ wtfThe classic pork turns out to be the best. I thought the pork and leek might be even better, which is why I returned a second time, ordering classic pork and 'pork and leek' for a side to side comparison. The pork and leek dumplings is a loony more expensive, but tastes a tad worse -_-The classic pork dumplings contained such nice tasting broth, I'm starting to think it's MSG overload because the broth seems so clear and simple I can't comprehend its source of flavour  and, pardon my modesty, because I've never made any broth close to this gud :') Anyway, it's a good place for 2nd-3rd time dates, because it can get... inelegant. There is quite a protocol to follow in order to get the dumpling from the basket to your mouth in a secure manner. This aforementioned flowchart is printed and located somewhere on the table. I strongly suggest first timers to follow it by the letter."
/user_details?userid=Wc5L6iuvSNF5WGBlqIO8nw,Risa D.,"Lac-Supérieur, Canada",4 star rating,"Sammi is owned by the folks at Qing Hua, but (according to the staff) specializing in southern Chinese, Shanghai-style soup-filled dumplings, xiao long bao, versus the northern-style dumplings served at Qing Hua. The beef and onion and the pork and leek were delicious. The service was friendly, helpful, super quick and kind. They have a couple basic beers and some inexpensive salads on the menu, but we didn't try any. We had the dumpling craving, and we ate all the dumplings, and it was glorious. If you haven't eaten xiao long bao before let me save you the emphatic mess that I was the first time: let the soup pour out of the dumpling into the big spoon they give you. Rather than let it explode all over you. Pro tip."
/user_details?userid=g5iI1I2m1xq5yx0450hQkg,Clarence F.,"Quebec City, Canada",1 star rating,"Wish I could give a negative star rating. (TLDR: RAW FOOD, FOOD POISONING, DISGUSTINGLY RUDE WAITER/HUMAN BEING, FORCED TIP! WILL NEVER BE BACK - WILL NEVER RECOMMEND. TOO BAD AS IT WAS OUR FAVOURITE) That's how horrendous our experience was here. Firstly, they served us completely raw fried pork dumplings - how does that happen when they're fried!? They did bring us a new plate, but they still were less than desirable. The soupe dumplings themselves were quite enjoyable. I guess when it's the only place in the city then it has to do - not bad. We were constantly waiting with empty water glasses which never got filled until we asked. Listen, I realize this isn't a Michelin starred restaurant, but filling patrons' water glasses, no matter what level establishment you're running, should very basic and something that just happens. Things took a turn for the worst when we went to pay. First off, no concession was made, at all, for the raw dumplings we were served. No discount, no apology - nothing! When we asked about it our gentleman server replied, ""but we brought you a new dish!"" He continued saying ""no one here can make decisions on discounts and voids so if you want to leave your number someone can call you to discuss a discount."" We didn't bother as if nothing was going to be done now then they just didn't care to rectify the situation. Once we walked out of the restaurant the server, to our surprise, followed us and said ""so would you like to leave your number so someone can call?"" We replied ""no it's fine - if you won't do anything now then that's all we need to know."" He continued by telling us ""that we MUST pay a better tip!"" This was extremely appalling behaviour. They served us raw pork which someone in our party got sick from. We sat and waited with empty beverage glasses all night. When trying to defend ourselves he looked at my girlfriend and her friend and disgustingly and rudely told us to leave. This guy should be fired and if he has any responsibility on the managerial side of things this place should be embarrassed and ashamed. Really disappointed as we were are excited to come here!"
/user_details?userid=JstDKWmAZsL026ADFxf7fw,Tony Kangrui L.,"Montreal, Canada",4 star rating,"Go simple, get the traditional porc xiaolongbao. You'll be more than satisfied with the flavour-packed soup-filled dumplings served in steaming baskets. Use the spoon, sip the soup, careful it's hot. The broth is so tasty by itself that I enjoyed it plain without the soy and vinegar. Real food at this price? That's rare. The lamb and green onion fried dumplings, though not as novel, were quite good as well. Don't ask for tea. It's not free and not good (lol).Very quiet, with tables and banquettes for groups. Service was quick on an early Saturday evening. Cash only or debit over $10. On a sidenote, the receipt says ""Qing Hua Dumpling"" with three addresses, Sammi and the other two Qing Hua must be related?"
/user_details?userid=q_oc5Gp5Cmmh9X5EGN6Irg,Dustin L.,"Old Toronto, Toronto, Canada",5 star rating,I love the food here and the price is very affordable for students as well. Highly recommend this restaurant to those who have not tried yet :)
/user_details?userid=FmIBB9mxmFpMOKpy3XTy4g,Danika L.,"Mercier-Hochelaga-Maisonneuve, Montreal, Canada",1 star rating,"Food was ok but we won't return because of the service.  There are too many dumpling choices in the neighbourhood to make this the only option.  It doesn't even come close to being as good as Mademoiselle Dumpling on St Hubert for instance.  No smiles, little to no eye contact and we were ignored so long standing at the cash register that we considered pretending to leave without paying to see if they'd acknowledge us.  In the end, I added up the tab and taxes myself and left the money on a a tip tray that I purposefully placed next to one of the unaffected employees.  My dinner companion was peeved that I left a tip."
/user_details?userid=jzGQxkaA0eToOlgVkIWqdg,Christine S.,"Côte-Des-Neiges—Notre-Dame-De-Grâce, Montreal, Canada",3 star rating,"this is my favourite dumpling place for xiao long baos but although the flavouring is still the same (which is great), lately their soup dumplings have been really flat and contain less soup than usual."
/user_details?userid=nOJM12os1X4S0VrF0t37YQ,Thie C.,"North York, Toronto, Canada",3 star rating,"Food: 7/10. Tastes decent xlb broth was quite good, xlb skin was too thick for my taste though.Fried pork dumplings were nice and crispy on the outside, chewy on the inside. Waiting time at door: 5mins (I was there at 6pm on Saturday)Service: a solid 2/10 (management decided to have 1 waiter for the whole restaurant). Serving time slow, orders forgotten, appetizers came in last. Waiter asked my grandmother to shift seat because the restaurant was getting too cramped (wth)Overall- 6/10 ign"
/user_details?userid=EOajY1L3ole3gLTCZ2xw1g,Jack M.,"West Chester, PA",5 star rating,"Somebody on Chowhound had recommended this place as being a top soup dumpling spot. I had to check it out. The service was pretty darn unfriendly, but the food was excellent. Chinese dumpling chefs handcraft your dumplings behind an open glass-windowed kitchen. I got the classic pork dumplings and the flavors were spot on. The pork had a nice texture, unctuous broth teeming with porky goodness. There was just enough balance in the meat blend of aromatics to nicely compliment the fattiness of the pork. All around a very good deal for 6 (or 8?) dumplings. I'd definitely advise you check this place out for the dumplings."
/user_details?userid=mXVcbFOjFIzMw0Jdi9kFSw,Tia R.,"Fairfax, VT",5 star rating,"The juicy dumplings, amazing!! The peanut butter dumpling appetizer, amazing! The noodle peanut salad appetizer, amazing! It's small inside but it works because its clean and the food is so good. Love that they have a viewing glass to watch the magic of dumplings being made in the kitchen. Service was great! I'd definitely dine there again!!"
/user_details?userid=ZEaXcUg3TgKrfW-dgKG-uA,Fariha A.,"Montreal, Canada",5 star rating,"The food was so good I had to write a review. The steamed dumpling is completely veggie with tofu and it's honestly amazing, great option for vegetarians. The fried shrimp as well omg I think I shed a single tear taking a bite. Please give this place a try."
/user_details?userid=voFxNdzhG-cDrW_9NzFGbw,Denzil D.,"Montreal, Canada",4 star rating,"Another great dumpling place in the city. Steamed dumplings, I love that and it really how it should be done. They serve soup dumplings which can be harder to eat and are not my favourite type in dumplings but it doesn't change the fact they do a great job and a good price. I would go back again and again because there is a lot of choice."
/user_details?userid=fr2uzL4G7NeqdEWaUEkyfw,S L.,"Montreal, Canada",5 star rating,"This is the best dumpling and xiao long bao! A must try. Whenever I crave it, I am willing to make a 20-30 min drive downtown to fulfill my cravings. It is my top pick in Montreal. Everyone that I introduce to this place, loves it too.I have been going to this place for over a year and each time, it is always serves 5 star food. My word of advice is that it is best to get them steamed, not fried.Enjoy!"
/user_details?userid=XqWiDEMPFDZcbF4exyre8A,Banana M.,"Seattle, WA",1 star rating,"I have been to this place 5-6 times now. I am from Shanghai and I have to say this is the first place I have found in Montreal that serves decent xiao long bao (little dragon soup dumplings), which comes close to the authentic ones you get in Shanghai. HOWEVER, the service is amongst the worst I have experienced, even for Chinese restaurant standards. Last time I was here, I ordered the jellyfish, seasoned cucumber, xiao long bao and the Shanghai fried bun (Sheng Jian Bao).When we sat down at our table, it took about 20 mins before we got our water and here is the ""best"" part, the water we go was actually the water that our neighbouring table had. I watched one of the waitress bring the water to the next table, leave, then get called back because the table next to us wanted room temperature water. I then watched the waitress pick those cups of water, turn around and place those same cups of water on our table. She then walks away as if nothing happened. I was completely shocked. Even if a place is popular and cheap and has good xiao long bao, this should never be done. It is unsanitary.If you think this is bad, then just wait and keep reading.The cucumber we ordered were fully mushy, and it tasted fermented. I know that these cucumbers are soaked chili oil for flavour, but I don't think they should taste carbonated and mushy as if they were made last week and left out all week.The jellyfish was decent, but a bit on the salty side.The xiao long bao were pretty good, but tasted less soup filled than usual and less hot.  I feared after that they were not steamed long enough, but thankfully, the pork looked cooked and I did not get sick after.The best (or worst) part was the Shanghai fried bun. I watched the cook place it in the frier and I also watched him take it out.  I then heard him comment to the waitress in Chinese that these Shanghai fried buns were not like the usual batches he makes.  I watched him leave it on the counter for about 10min, before the waitress decide to serve it to us anyways. The cook was right, it did look a bit odd. I opened one up and of course, I could see raw pork and uncooked dough.  At this point in time, I called the waitress over and pointed out that the Shanghai fried bun was still raw inside.  Instead of apologizing, she instead gave me a dirty look when I asked if I can have a new pair of chopsticks.  The waitress took the buns and walked to the front, where she pokes around into the bun and confirm with the cook in Chinese that the pork was indeed raw.At this point in time, any other restaurant would have at least ask me if I would like a new batch made and apologized for any in conveniences. I understand, stuff like this happen even in the best restaurants and its ok if it only happens once or twice and they handle the situation properly.  But at this place, instead of of making a new batch, they took the half open Shanghai fried buns that was on our table, stick them back into the frier and then return them to our table.  I was completely shocked and very upset.  First of all, they have ruined the Shanghai fried bun, which is also a specialty dish from Shanghai. Secondly, it is just unacceptable for them to behave in such a manner to customers and also handle food like this.I had a hard time deciding which star rating to give this place...For the xiao long bao alone, I would give this place a 4 star rating, but for eveything else, they deserve  a 1 star rating at the most and I hope for the customer's sake, they improve their food safety. I hope that no ones has to go home with gastro...I am still undecided if I want to go back to this place. If you do go, watch what you are getting carefully."
/user_details?userid=7cfgBUvOxqTmEELiGGjFSA,Linda P.,"Downtown Core, Toronto, Canada",4 star rating,Great value for their menu prices! I got the pork and leek xiao long bao and noodles with peanut sauce--I enjoyed both dishes. If you're looking to have a cheap light lunch this is a good place to go! (:
/user_details?userid=00Nl9q5fFGa73-cQjSCdiw,D D.,"Fredericton, Canada",4 star rating,"Stumbled upon this place while wandering around Montreal and I consider it a lucky find. Had the marine kelp salad (great), hot and sour cucumber (okay), the juicy pork and coriander dumplings (wonderful) , and the fried pork and cabbage dumplings (quite good). I wasn't sure how much to order, but this fed three of us. Probably could have had another dumpling order to finish us off. Excellent price and exquisite quality. It's great to see the chefs make the dumplings behind the counter. I will definitely return as it was quick, friendly, great value and a a nice staff."
/user_details?userid=21CCKg5wJMj_ENeyaoq4pA,Laura L.,"Denver, CO",5 star rating,"OMG!! Be prepared for a wait, but it's totally worth the wait.  This place is crazy busy, and seems to be a little low on staff, but the dumplings were everything I was hoping they would be.    There is not much on the menu other than dumplings, and not all menu items are available every night.  Regardless, it was really great."
/user_details?userid=d_TBs6J3twMy9GChqUEXkg,Jennifer O.,"Phoenix, AZ",4 star rating,"I was so excited to try some Xiao Long Bao while in Montreal! I found this place and decided it was a must visit. The place is a bit odd.... you wait in a long line out the door for a table. Service is nothing exciting. They had a lot of dumplings, but they were out of many that we wanted (unfortunately). We ended up getting a pan fried curry spiced dumpling (not terrible, but not great), the juicy pork (delish), the cold noodles (ehhhh would pass on this), and a juicy beef (tasty, but no pork). I would definitely come back here, but maybe come earlier as to not miss out on the full variety of dumplings."
/user_details?userid=WtmmtVkui7AjVIZvnqQHwg,Rosie B.,"Westmount, Canada",4 star rating,"TLDR: Juicy tasty soup dumplings in the Concordia area.Small, lovely, place to get some yummy soup dumplings. The beef and onion are my favourite steamed dumplings, while the leek and chicken are my favourite fried ones. They are great on a winter night, but unfortunately, the dumplings get cold quick in the winter from everyone who wants to get in the restaurant. Clearly, it's a very good place as the door opened non-stop.The cold peanut noodles were average, but the hot and sour cucumbers are a great starter and a treat in between dumplingsI've enjoyed every one of my visits to Sammi and Soupe Dumplings. The service is quick and efficient. They also have a window into their kitchen so you can watch them make your dumplings!"
/user_details?userid=GluXH9-1YpkbBII6nN3Vmw,Leah T.,"Montreal, Canada",4 star rating,"I live in the area and come here for soup dumplings when I don't feel like cooking and want something filling, but isn't too expensive. I always order the cucumber salad to start - as one user said ""very cucumbers and sour, just how it should be"".I always opt for the lamb and coriander soup dumplings. Always. Juicy and delicious, their portions are perfect and the price is even better. Service isn't great and they often sell out of things, but I'm glad I have this joint in my neighborhood."
/user_details?userid=6knga-vNLcCxdQmhevWjTA,Jack J.,"Philadelphia, PA",4 star rating,"I can't go a weekend without an Asian fix, so I stopped by this dumpling joint on my trip in Montreal. I was surprised to see them offer so many options for SOUP dumpling (usually it's just pork or pork with crab). I was skeptical, but ordered pork with leek soup dumplings to try. Mistake - pork and leek should stay being regular dumplings. The classic pork soup dumplings were very good - on par with some of the better places I've tried. We split three orders total between two people and left pretty full. I think this place was cash and Canadian debit only."
/user_details?userid=1TpPrIGwpUVzjaGjCX4sXw,Mimi K.,"Montreal, Canada",4 star rating,"I always enjoy coming to eat at Sammi & Soupe Dumplings! Their dumplings are very unique and are offered in many flavors - steamed or fried, also at affordable prices. The only downside is the wait line and the place is too small. Sometimes, the service can be slow. But, it's all definitely worth the try."
/user_details?userid=VCp5TCsErW0T_nxpw-aOfg,Brandon N.,"Chestermere, Canada",3 star rating,"Very affordable and delicious soup dumplings. Only complaint is the lack of efficiency with the staff. Waited close to 15 minutes for the server to clean a table and seat us, they could not walked any slower. When seated, one of the cutlery sets were dirty. No server came for us to place an order so we had to go up to the cashier and tell them our order."
/user_details?userid=NuY5yYWiVAVZzbdYI8h7gQ,Lisa W.,"West Bronx, NY",4 star rating,"I ordered the mushroom and cabbage dumplings thinking they would be soup dumplings, but they're just regular dumplings. I'll still give this place 4 stars, because the dumplings were still good and the waitresses are really nice. I was just disappointed because I was really looking forward to having soup dumplings."
/user_details?userid=FGxUPbjHD7g3LCirJTP2tQ,Audrey B.,"Ville-Marie, Montreal, Canada",1 star rating,"ordered online from just-eat and honestly.....wrong order!  They gave me this tofu and assorted vegetable dumplings when i ordered the shrimp egg and leek one.  The tofu one is really gross.  They didn't even give me a call back in case I wanted to change my order to something else or to cancel it.  I know you want to make money,  but don't do that to customers cause it leaves a bad experience for everyone and doesn't make you a trust worthy business.."
/user_details?userid=CqE49Gu0rv4v2W41WbjOYQ,Maberry Y.,"Grafton, Canada",5 star rating,"Came here twice during our trip to Montreal. Unreal soup dumplings - juicy, flavourful, piping hot. Ordered pork and leek (9/10), pork shrimp and scallop (8/10), lamb and coriander (9.5/10). All three were fantastic. Service can be slow at times but you know your dumplings are freshly made."
