user_url,user_name,user_city,user_rating,user_review
/user_details?userid=8HafK5cS8pWCWNQTIG8iJw,Uyen D.,"Montreal, Canada",4 star rating,Very yummy and cheap xiao long baos! I took the advice of fellow Yelpers and ordered the steamed dumplings filled with pork only. They were absolutely delicious! I've been to other restaurants where the skin was so delicate that it tore and leaked precious soup as soon as I would attempt to pick up the bun. I didn't have this problem here! The wrapper was thin yet had a nice bite to it while the filling was generous. I don't recommend the pan-fried beef curry dumplings as they were way too salty. The waitress was absent-minded but the food was so worth it that it won't prevent me from returning.
/user_details?userid=bbcRcIOk_TNQAqfssy1SjA,Karen K.,"Boston, MA",3 star rating,"This place has really good soup dumplings! They make the dumplings Fresh and you can see them making it. I like these dumplings cause they actually have soupIn them, I've tried some places where there really isn't any soup. But this place is really affordable and tastes great. Downfall is the service is quite crappy. You gotta holler at the waitresses if you need help, so don't be s"
/user_details?userid=BytRWk8X1OelSgwwfXd8Aw,Arun D.,"London, United Kingdom",3 star rating,The best part about the meal was how cheap it was. I was pretty disappointed that they were out of both their vegetarian dumpling fillings (it was about 7pm on a Tuesday night). I ended up ordering a large hot&sour soup and enviously glaring at my friend's dumplings.The soup was great but nothing to call home about. I also tried out the spicy bean curd which was difficult to eat and lacking in excitement. The service was best described as hostile. What struck me was how slow they were to clear up our dishes. It was also cash-only that night so I wouldn't go in expecting to pay with card.
/user_details?userid=Gkxe9U9E2WR2937cjIZboA,Jason K.,"Montreal, Canada",5 star rating,"This place seems to be doing a good job of pumping up social media lately so I thought I would give them a try. The only thing I can recommend is... EVERYTHING ON THEIR MENU!!!soup dumplings are pretty trendy right now and I have tried a few and these ones are better than the others I have tried, the broth is out of this world. What takes a back seat to the taste is the amount of fun they are to eat.The neatest part is watching through the glass window the ladies making the dumplings, they look like those people that can solve a Rubik's cube super fast, I couldn't help but laugh at how crazy fast their fingers are moving.And for 2 people the bill was only $20!! No visa though"
/user_details?userid=6mgPpxdEGM4u4CvU37t_oA,Julie L.,"Montreal, Canada",3 star rating,The fried Pork & Cabbage Dumpling were really good (9/10) but the Pork Classique Steamed Dumpling were not my taste (4/10). Over all it was really affordable so you should try !
/user_details?userid=I3kSuuggYmsDhWnkyJ667g,Erika C.,"Montreal, Canada",3 star rating,"I'm an avid dumpling fan. Soup dumpling at Sammi was okay. I have eaten in Hong Kong and NYC Chinatown soup dumplings so I can compare too Sammi. It's probably the best around town but there fried dumpling is pretty good. We had the pork and leek fried dumplings, I would recommend this and for the soup dumpling we had the classic pork soup dumpling and the beef and onion soup dumpling. Fried Dumpling is the way to go! The service was pretty slow, we waited for 20 mins for our 3rd entree to come out. Overall, it's good in town and price is fair. I would go back and eat there fried dumplings!"
/user_details?userid=LQG9wFTmscbAATp8QWj1hg,Kathy H.,Hong Kong,2 star rating,"Very quick service and extremely cheap!!! Only $7 for 10 dumplings!!!! And they are huge dumplings!They are tasty if you haven't ate xiao long bao before. And especially delicious if you don't compare with, say, real ones. They are very bland, both the soup and the meat are almost tasteless. The dumping dough is very thick like bao's. The soup has the authentic flavour, perhaps 10% and 90% water. The lamb is quite alright!The restaurant is small and very busy. The floors are quite dirty. Tables are close together. Very good service! For the price, definitely valuable.However for this quality, I would rather make them at home."
/user_details?userid=sG1SGddhKQ21QNW6tTRNtA,DiStefano S.,"パリ, France",4 star rating,"Very good food. Unfortunately, they serve and cook with unfiltered water, and odd omission considering how cheaply it can be solved nowadays."
/user_details?userid=9rP85DGTE8_uGTWryi3Xqw,Duong V.,"Saint-Léonard, Montreal, Canada",4 star rating,The soup dumplings were a little dry (not alot of broth inside)  but flavor was good especially the shrimp and coriander. Would absolutely come back!
/user_details?userid=qe_Yiq-Gm60TA9cK0VfbiA,Nina N.,"Ottawa, Canada",3 star rating,"One of the newest dumpling joints in the city, following the trend of the numerous Mandarin Chinese cuisine restaurants hat opened in the past years. Sammi, just like Qinghua and its successors, boasts about its soup dumpling, or xiaolongbao (小笼包), hailing from the city of Shanghai, in southern China. Whereas Qinghua's own soup dumplings are also very rich in broth, they are folded in a Northern Chinese fashion, while Sammi's are pleated like it is in Shanghai. I ordered the pork xiaolongbao and the pork panfried dumplings, and even though my expectations weren't that high, I wasn't entirely satisfied by the execution of the food.A bit bigger than expected and their skin being much thicker and starchier than I'm used to, the xiaolongbao were served fresh and piping hot in a bamboo basket. For newbies, the store owners were kind enough to leave a how-to pamplet at each table to help them mix the dipping sauce and eat the dumplings. The broth was satisfyingly dripping after the first bite, rich and savoury. The meat filling was salted to meet expectations and it complemented the taste of the dough. However, I find the saltiness a bit too overwhelming for this type of dumpling, especially since they're dipped in a mixture of black vinegar, soy sauce and chili oil.The panfried dumplings are a total letdown: the meat was unexpectedly really salty and the dough was too chewy for comfortable eating. The extra oil added to the dumplings during the frying step was dampening the dough, stealing away its usual crispiness. Usually, dumplings are let to drip before being served, but since it was during lunch rush hour I guess this step could've been skipped.Sammi might not deliver the best xiaolongbao I ever had, but it's one of the only two places I know in the city that offer proper xiaolongbao, made according to the Shanghai fashion. I will come back whenever I feel nostalgic about the Pearl of the Orient, but otherwise the other regular dumplings aren't worth the detour."
/user_details?userid=mrlKJNsy8CkPYAfHW3m5Cw,Lisa C.,"Boston, MA",1 star rating,"Sammi's place was really cute and casual from the outside and it caught my friends and my attention. We were from out of town and this seemed like a good place to check out, plus it seems to have high reviews on yelp.Unfortunately I am someone who holds customer service really high and this place was quite disappointing and sad in this aspect. - go in and told to sit anywhere we like, but the make waiter ignores us right after that. Sitting there for over 10 mins, no menu, nothing. A friend goes up to the counter to ask for a menu to be shot down. He got shouted at that they will be there....simply rude.- noticed a couple come in later after us, they are immediately given a menu and service...something wrong here?Granted the Si Long Bao is really good, I would never recommend this place because its unsatisfying to eat a good meal in a setting with this kind of bad service."
/user_details?userid=laFwsknjneH2QoGeLbemTw,Didier H.,"Montreal, Canada",4 star rating,The best soup dumpling in Montreal. The waiters change all the time but the taste of the soup dumplings is always consistent. Great place for weekend lunch.
/user_details?userid=dSgBBmDWPuC7AjiJGgvPRw,Kay H.,"Runnymede, Canada",4 star rating,Delicious steamed dumplings and very fast service. When we arrived there was a bit of a wait but it was well worth it.  The only reason why I rated thus 4 out of 5 was due to the fact that they only had some of the options on the menu.  If you're in Montreal and craving dumplings definitely give them a try.
/user_details?userid=9DRiWsAzhbi5-Iu4By3ovA,Katy P.,"Lancaster, PA",5 star rating,"We started off on the wrong foot with Sammi. We waited close to an hour for a take out order the first time we visited. But the dumplings were SO GOOD, so bursting with brothy flavorful magic, that we had to give them a second chance. We never had another bad experience!My absolute favorite is the classic steamed pork. I admire restaurants that stick to a few items and do them perfectly. These dumplings are perfect! It took me a while to get the hang of eating them, with my sorry chopstick skills, but now I'm a dumpling-eating champion! After sampling a few other surrounding dumpling restaurants, I'm confident that these dumplings are the only ones for me!"
/user_details?userid=cPnojCbtFDviWKtZN6Cueg,John J.,"Saint-Lambert, Canada",1 star rating,"We entered and sat at an empty table and the man who wipes the tables seemed angry our order was taken but when the soupe arrived we did not get any spoon or napkins, when the main dish arrived we were offered no chopsticks or cutlery or any dish or plate we could use to pour some sauce on to dip our dumplings. Each time i went to the cash and told them we have nothing and they sais sorry and that was it. The table that was  rt next to us had all they needed and seemed fussed over i am not sure if the staff were happy to have us try their food for the first time. This was more like McDonald where they give you the food but you ate on your own if you dont wish to eat with your hands. I would be suprised if this is the way the manager wanted his clients treated but for now will avoid that restaurant"
/user_details?userid=7_NhbtABpkBiHU-s99FWKg,Lara A.,"Ville-Marie, Montreal, Canada",1 star rating,one of the worst places to eat in montreal. Never had worst service in my life. food is undercooked.
/user_details?userid=cU9nPptHbTjXZCne28Riog,Angie C.,"Centreville, VA",1 star rating,"Luke warm soup dumplings and the fried dumplings tastes as if they fried it, let it sit awhile then served it to us.. it was not good...... very disappointed..."
/user_details?userid=FuW1EwnbQoHyDMeOGrljsg,Khanh L.,"Montreal, Canada",5 star rating,"I go once a week...I used to think this place was only so so, but now I love it. I've had all the different kinds of dumplings. My favorite is the shrimp pork and scallops.The cucumber salad is amazing, so good, try it, it looks like nothing but it's actually  so well made. This place is so cheap too, the service could be slow when they are busy but the quality of the food makes up for it. I love this place and it's a pretty decent soup dumpling, not the best but definitely hits the spot everytime.:)"
/user_details?userid=fMtgTF7xIA4NouZEPKprpg,Antony C.,"The Castro, San Francisco, CA",5 star rating,Fantastic soup dumplings! Simple service but pleasant. It's busy and you can watch the staff in the kitchen making the dumplings. The seafood soup dumplings are the best!
/user_details?userid=urixW_OiHM5Wjvyb-gAQdA,Muen Y.,"Manhattan, NY",5 star rating,My favorite soup dumpling place! Insanely delicious and well priced! Friendly staffs too!
/user_details?userid=iwSdey8jOgLMLeJPOtwgPQ,J L.,"Fremont, CA",4 star rating,Very tasty and juicy chicken and mushroom xiao long bao. Sesame soy noodles were also good.
/user_details?userid=fkiZ7pUJtaEsMtmTP87eUQ,Ellen C.,"Durham, NC",3 star rating,"The food was decent, but not worth the ridiculously long wait. One Saturday night, I walked in and ordered two take-out dishes. Nothing too fancy, just classic xiao long bao and won ton noodle soup. I waited forty five long minutes at the cash for my food. Yes, I understand they make everything to order, and yes, it was busy but the restaurant was not full when I arrived. We enjoyed the food okay. The dumplings were nice and juicy, but to me they did not taste very traditional - they were a tad too gingery or something. Also, the won ton soup and dumplings were bland and the broth had seaweed pieces floating around in them, something which I have never seen. In my opinion, only the XLB were good (avoid the soup) but overall not worth the wait especially if you're in a hurry or expecting quick service. Just a tip, they also don't take credit cards here, and cash only for purchases under $10."
/user_details?userid=rwzrpBr-SlZoOdt3TBvtzw,Elizabeth A.,"Arlington, VA",3 star rating,"We went on a Thursday evening because of the great reviews.  Service was friendly and food arrived quickly.  You can also watch the ladies make the dumplings behind a glass window.  You were also told that they only take cash as you sat down. Now to the food...  We had soup dumplings (classic pork, pork with leeks and shrimp with cilantro), hot and sour soup, wonton noodle soup and the cucumber appetizer.  The different soup dumplings were all unremarkable.  I was also disappointed that the sauce that accompanies these dumplings was missing.  How can you have xiao long bao without the soy sauce with vinegar and julienned ginger?The hot and sour soup was neither hot nor sour and the wonton soup was tasteless.  The cucumber dish was decent but it was a little wilted."
/user_details?userid=hmOQm33GQeCgkvnYguQk9A,Alissa L.,"Ville-Marie, Montreal, Canada",5 star rating,"On top of having delicious soup dumplings, their service is great. I was pretty much the worst pick up customer and the woman on the phone responded to me like a champ. I ordered, came almost an hour late to pick it up, and the cashier was so kind and understanding. On top of that, I gave her an extra $5 bill without knowing it and she chased me down the cold, winter street to return the $5 to me! This is now my go-to dumpling place. Before this experience, I already really liked their dumplings, but the customer service makes it a top choice for me."
/user_details?userid=aIqDek9d1fDEgLIAWXMGSA,Robert L.,"Fort Lauderdale, FL",5 star rating,"Finally a place to get my Xiao long boa fix. I go to toronto but no more. Their spice also is 5 star along with the smile and service which you do not get at most other chinese dumpling places. Although I have never seen lamb XLB in china they make them here and I love them. The pork are just as good but as a Greek we love lamb. I can have it on anything,"
/user_details?userid=oqOd-BdSCHGirleO3UwLjA,Li Z.,"Mississauga, Canada",4 star rating,I know I go to Montreal for Chinese food. Doesn't entirely make sense but you know what? Glad I checked his place out. Very central if you are staying at the Meridian on Sherbrooke st.I really would have given this place a 5 star but I had a few iffy dishes...So there's the recap:1. This place is so cheap. You will be full having spent $13 with tip....2. Skip the soup and the side dishes. I would have paid more for better soup!! The hot and sour soup was so starchy with a few pieces of tofu and seaweed. I also ordered the seaweed. That was just tons of sugar and vinegar....3. Xiao long bao!!! That's what you want to get. I ordered the pork leek because that is my go to and the most traditional dumpling filling really. So what is a xiao long bao? It's a soup filled dumpling and they are really soupy! So watch out for your first bite.4. Sauce... Ask for Ginger and mix it with black vinegar (this is how elitists and elites do it!!!) with a dash of soy sauce... You're welcome.Until my next food adventure! Hiyay!
/user_details?userid=-PHnbrru-P8IdlP5ZUd2cQ,Eric G.,"Mercier-Hochelaga-Maisonneuve, Montreal, Canada",4 star rating,Good Dumpling restaurant . We order mostly xiao long boa (steamed juicy pork dumpling). Not impressed with the fried varieties that were too salty and a little bit dry for our taste.A small place that can be overcrowded in the evening.
/user_details?userid=YyuIhgNpWNssxETs8Kem6A,Hyun H.,"Montreal, Canada",4 star rating,"Excellent food!Had the pork&veg wonton soup, juicy classic pork dumpling, and juicy sweet pork dumpling.The wonton soup was phenomenal. The temperature and the flavor were perfect. And there were lots of wontons.I liked the sweet pork dumpling better than the classic one. Very fragrant, sweet, and again the temperature was good.One star off due tp the slow service. I've been here numerous times and the service has been consistently slow. So I was expecting the same and they didn't disappoint! Hopefully they will get better in the future. Or, at least serve the dishes without the long gap between them."
/user_details?userid=ur_T4YKoe_HbxsMy82bdxQ,Jonathan L.,"Richmond Hill, Canada",4 star rating,"Went at 11 in the morning. Maybe their steamer wasn't fully heated yet.. their soup dumplings came out raw. Told them. . They fixed it and fine. It was probably comparable to some of the best in Shanghai and Taiwan.  Only difference is that their wrapping has a airy texture. So texture of the wrapping is very thin indeed, but lacks the chewey texture traditional ones had.  Not that it's a bad thing.. it kept the meats inside extremely juicey, soup gushing out and hot as anyone needs it to be. Apps.. I had spicy tofu and wontons. . Meh. . Stick with the soupy dumplings.. you can't go wrong"
/user_details?userid=JSk62MnAYrowzmTfki5iQA,Julia S.,"Saint-Lambert, Canada",4 star rating,Super yummy xiao long bao! It gets packed pretty fast during lunch time and dinner time so get there early or be ready to wait. The prices are good and I never had any problems with the employees.
/user_details?userid=lDSTPdZu7fdrHdZEnVKsQQ,Emely P.,"Montreal, Canada",5 star rating,"This 5 star review is based on the soup dumplings only.  If like me, you've been desperately searching for the elusive xiao long bao and been fooled by places like qing hua that falsely advertise soup dumplings, go to Sammi & Soupe!  They are the best I've found in Montreal - fresh, made to order, and you have the option of choosing different meats and stuffings.  I ordered the pork/coriander and chicken/mushroom.  Both were so soupy and delicious.  I also ordered the wonton soup and spicy pickled cucumber which were just so-so.  There were a couple cucumber pieces that were old and mushy and inedible - this seemed to be a problem for other reviewers as well.  2 stars for the place itself as it was a bit dingy which is nothing new when it comes to restaurants like this, but the menus and tables were sticky and smelled weird.  The service was also a bit slow as well, but it's worth it for the dumplings in my opinion.  I'm looking forward to going back and trying other soup dumpling flavors and the fried dumplings."
/user_details?userid=60v7H_m0Atd_98oCwqclew,C C.,"Montreal, Canada",5 star rating,"I think this place has the BEST soup dumplings. I never had their other dumplings. I mean, why would I when they are most well known for their soup dumplings. I've tried many of the flavours but my favourite are the pork shrimp and scallop ( I think) ones."
/user_details?userid=B9hG8-Qo5Nen9GwwiywFKA,Sarah V.,"Montreal, Canada",4 star rating,"This place is probably the best place for soup dumplings in Montreal! Anytime I introduce someone to Sammi & Soup Dumpling, I create a new addict. The menu is simple and not over the top, the prices are absolutely affordable, and the dumplings are alway fresh. The reason I gave it 4 stars instead of 5, is because one time, the dumplings tasted a little bit like hand lotion, and since they are hand rolled, it's possible one of the employees put on some lotion before making the dumplings. It was a little off putting, but this has only ever happened once. Despite this, I have constantly returned for soup dumplings. P.S. prepare for a wait if heading here on a Friday or Saturday night. Usually the line is out of the door, but it is well worth the wait!"
/user_details?userid=BLKm7ydfkm2n8BOClbuKUw,Zhijun X.,"Montreal, Canada",4 star rating,"l shared two kind of the pork xiao long bao with my friend. I prefer the sweet one than the salt one. It's awesome that juicy steamed xiao long bao is stuffed with pork！When you have a bite, you will be surprised there are a lot of soup inside. It's worth to try it！"
/user_details?userid=NYw8Vvqd3eCUmjxvHLh_vA,R P.,"Manhattan, New York, NY",3 star rating,"great deal, good bang for your buck- but unfortunately it lacked flavor and the skin was too thick. would i go back? 50/50. but it's definitely worth trying out"
/user_details?userid=kwWfvdUg-YzYa2rc2ECnhg,Angela P.,"Houston, TX",4 star rating,"We ordered the hot and sour cucumber, spicy tofu, classic xiao long bao, pork and crab xiao long bao, and the beef curry fried dumplings. All the food was very tasty. The skin on the dumplings was not too thick, which is hard to find, and the soupy goodness inside the dumpling was delicious. The only drawback was the non existent service. We had to ask for dumpling sauce that was on all the other tables, and never got a refill of water or our other beverages. So go for the food, but don't expect good service."
/user_details?userid=x64CBrDNGDAMBsurKyQKjQ,Eric L.,"Montreal, Canada",4 star rating,"I am a fan of the place. I think it's a great place to have decent soup dumpling at a reasonable price. I personally like the pork dumplings (All of them) steam and the beef curry (Fried one). The service is quick but something they mess up specially when it's busy. So try to go before busy hours, you will get a much better service.The place only takes cash and debit. Also I do not recommend the wonton soup as entree it's below average."
/user_details?userid=9kLPuapKfGjF6ipVSqIuSQ,Ashley P.,"Montreal, Canada",4 star rating,"This place is great for a quick and easy lunch with friends. Beware if you're bringing people who don't know how to use chopsticks, it can be tricky since there are no other utensils besides a spoon. We brought my boyfriend's parents, and it was hilarious to see my father in-law use chopsticks! The dumplings are freshly made and well priced. I've been three different times and I'll definitely be back."
/user_details?userid=Ex-QoUxevVpBPsovXWb8cw,Naoufel T.,"Montreal, Canada",5 star rating,"I am a very big fan of dumplings, I discovered this place through a friend. It is one of those restaurant that you won't probably go to unless you lived in the neighborhood. Looks like any random Chinese restaurant but I was very impressed by the quality of their dumplings. There were made fresh and had enough soup/filling in them. We ordered the cucumber salad and tofu and they were both delicious. If you are looking for a low key, cheap dinner, this is a great place"
/user_details?userid=UAUI3l-duD9Gb66-NENgDw,Larry D.,"Westbury, NY",4 star rating,I recently relocated to upstate New York. I always get soup dumplings when I'm in NYC. Outside of Shanghai NYC is the best place for soup dumplings. However I'm closer to Montreal than the city now. I Googled soup dumplings and Montreal and up popped Sammis. Sammi's has authentic soup dumplings. Not the best I've had but right up there. Excellent dumplings no doubt. Service was great. Waitresses were very friendly. Prices were very reasonable! Will definitely repeat!
/user_details?userid=VoKCmDRJ_qtNFfL7VkH1SQ,Hannah V.,"Toronto, Canada",4 star rating,"As xiao long bao as it gets. Good soup dumplings and even the hot and sour soup was good. The wait for the dumplings take quite a while (15-20 mins) because they make it as you order. Worth it! No credit, cash or debit only."
/user_details?userid=V7fCYqL1zL3RLGag5tavqg,James B.,"Columbus, GA",5 star rating,Great soup dumplings! As good as the ones I've had in New York City in Chinatown!  It is Canadian debit card or cash only prepared if you're not Canadian.
/user_details?userid=72uLAeYGZhWxmCIdLtsHqA,Grace K.,"Suwanee, GA",5 star rating,"Soup dumplings were so good! This would've been my go-to-spot on cold days if Iived here. It was cozy and nice, and I could finish those dumplings in seconds!"
/user_details?userid=C6gK-VkoOm3EySx9hjB2-w,John L.,"Gaithersburg, MD",5 star rating,"Many different types of xiao long bao!  Made right in front of you and each dumpling filled with a lot of soup.  We got the classic pork, shrimp pork and scallop and the lamb.  They were all delicious, had no problems with the service.  The cucumber appetizer was good as well.  Spicy and pickled cucumbers are an awesome compliment to the tasty soup dumplings.  I was surprised that this place wasn't packed.  Well, it was good for us since we don't like waiting in lines."
/user_details?userid=mjPzPxEc_z5TqjKvBAP6oA,Lady D.,"Jamaica Plain, MA",3 star rating,The xiao long bao was a bit too large and doughy for my taste. I enjoyed the spicy cucumbers but would like a bit more spice. We also had the fried dumplings which were good. Overall I thought it was okay but I have had a lot better.
/user_details?userid=zo3WzOh8L_NvDcWcc1NmXA,Yael J.,"Plano, TX",4 star rating,"I enjoyed the food, tasty and the waiting time was not too long (~20 mins).I ordered to go, so I can't really tell about the service quality, what I can tell as a heads up for visitors of Canada:They do not accept any not Canadian credit or debit card, and they take the CAD & USD 1 to 1 And the hostess do not understand pretty well English* I will definitely return  (with Canadian cash tho)"
