user_url,user_name,user_city,user_rating,user_review
/user_details?userid=syTxDxDMxjtXZUmWI3bJUg,Alexis M.,"Chicago, IL",5 star rating,"I haven't been able to come here in a year with COVID keeping us from Canada right now. This place is one of the best vegan restaurants you will find. The food is spectacular. The sushi is so creative and unique. You just want to sit and savor every bite. We have never had anything here that wasn't just extraordinarily special. The prices aren't cheap, but they are worth it. Oh-- and the sushi pizza? SO GOOD. Really, not a bad thing on their menu. I'm sitting here wishing I could go there right now. So, if you are lucky enough to be nearby, go get some takeout."
/user_details?userid=9P8-9EUP-aEnuisqUYt5jQ,Kathy S.,"Montreal, Canada",5 star rating,"They have a streamlined Covid takeout process. The only confusing thing is you have to pick up the takeout next door at a place called Komomo. 1- Go to their website and click ""order"" and then ""order online"". You pay here including tip. They will tell you how long the wait is (usually 20 mins)2- Pickup at their pickup counter which is next door and called ""Komomo"". Komomo actually has a separate review page so I will complete my review there."
/user_details?userid=wffnrXJoLppOlvNOZKU70A,Tamara H.,"Westmount, Canada",4 star rating,"For vegan sushi, this place is excellent. Delicious flavour and textures, you don't miss the seafood. We found it slightly overpriced and the wait time for pick up was ridiculous for a weeknight.I would urge anyone who hasn't tried vegan sushi to give it a shot! You won't be disappointed."
/user_details?userid=AuEHPR3Fj7qsuRWiXRy0yA,Laura L.,"Montreal, Canada",4 star rating,"Great vegan sushi restaurant in the plateau!Comprehensive menu with too many delicious options! Everything we tried- the mango/sweet potato, the momo, the tempura veg , dumplings and one of the fancier sushis (cant remember the name), was delicious!Would recommend."
/user_details?userid=5HiO4RFBVtAc7EY6w2mmRg,Vanessa V.,"Côte Saint-Luc, Canada",5 star rating,WOW! this is definetely one of my favorite places now!! food is EXCEPTIONAL. service is AMAZING!!!! everything on their menu is good. worth every $. drinks are also pretty tasty!
/user_details?userid=QaM_SfwIY6fZbSYycBBQFg,Deborah K.,"Johnson City, NY",5 star rating,"This place was up and down fantastic.  As someone who tries to eat plant-based as much as possible, and vegetarian always, it's been awhile since I went into a restaurant and I could eat everything they served.  It was wonderful.  The food is delicious and beautifully presented.  Even my meat-eating husband loved it.  What I liked best is that they don't try to make mock-fish for the sushi, they just take really delicious, fresh vegetables, and prepare them beautifully.  We had the omakase for 2, and everything was wonderful.  Service was great.  We had a really friendly waiter who was very helpful with sake selections.  When we're next in Montreal we will be back!"
/user_details?userid=JmEji3_Tfo2__69aLLcLPA,Jing S.,"Brossard, Canada",5 star rating,"Situated on the plateau Mont Royal, this is easily on my top 10 list restaurants.Now, you're probably thinking; how can you call it sushi when it's all vegan. Well, by making some delicious sushi; that's how.Honestly, everything on their menu is delicious. I'm not gonna tell you what to get or what I had; I'm leaving it all up to your tastebud to decide. Every flavour is elevated in a way to surprise your senses. If you're not adventurous then they have their special ""best seller combos"" for you to try. The presentation of the plates are splendid. The waiters and waitress are friendly; very knowledgeable of their menu. The decor is antic and refreshing.Overall; a gem in the big city of Montreal. A must for sushi lovers, vegan friends, and pregnant woman ;)"
/user_details?userid=LP-8DbFrARGiEavU4BcI6Q,Sha Y.,"Brossard, Canada",4 star rating,"We went on a Sunday night, and it was packed.Cute little restaurant.We are ordered the Omakase for 2: miso soup or salad, beet tatare and taro chips or Papaya salad, 25 sushis and dessert.Looking around at the other tables, there were some groups but mostly two people together, and by the looks of it, most opted for the omakase set menus rather than à la carte. I would too, especially if it was my first time there. Their menu being vegan, is quite unique from what we are used to see and your regular plain avocado or tempura sushis. I've heard from friends and reading other reviews,  prior to going, that they loved their experience and even if you are not vegetarian, wouldn't miss the fish. I had very high hopes and my expectations were met (well mostly!)The miso soup was great for a miso soup. I liked the mushroom as an added touch. It was not overly salty or just salty like you might get sometimes. We chose the Beet Tartare with Taro Chips and it was amazing! It might be one of my favourite thing that night. A good mixture of different textures, with some crunch and it was very palatable. The portion was generous too.We then had the 25 pieces of sushi and honestly cannot remember the names of the 5 rolls, but they were all quite tasty, different, and very original! It was also great fun to try to figure out all the ingredients in each. You can definitely tell that each item of the menu was very well thought of and they must've tested quite a bit what would work, all were complexed, intricate and an explosion of flavour. My least favorite might be the roll that had tomato in it. We were full but of course had space for dessert! The table next to us also ordered the Omakase for 2, and got to the dessert before us. I was excited to see the nicely presented what looked like a royal - chocolate mousse and actually looked forward to ours. When the waiter gave us ours...honestly I was quite disappointed...we were presented with a matcha cake/cupcake placed on a sauce that really looked and tasted like a grocery store bought cupcake cut in half and placed on a fruity diluted compote for the sake of presentation..and the matcha taste did not come through..Oh and it was only when we finished our sushis that it dawned on me that we didn't get edamame like all the tables around got to start with. We were full at this point and would be weird to have them after the main meal, but we asked the waiter if we were supposed to get some and he did not looked surprise and said that yes we should but they didn't have any available to serve for a sec tonite so that was why. Although I did notice all the tables around us had some..even the couple next to us who ordered the exact same thing. It is not a big deal but I did read in other reviews that their flavoured edamame were great! So overall, very tasty and great experience but the dessert was really disappointing so I would actually kinda deduct half a star."
/user_details?userid=8tjx6xsOigLJC07y7yA2BA,JiaYin C.,"Le Sud-Ouest, Montreal, Canada",4 star rating,"We tried their tasting menu which included: miso soup, edame and a choice between papaya salad or beet tartare and a variety of vegetarian sushis.As someone who isn't really into vegetarian food, I didn't know what to expect from sushis that consist only of vegetables.  To my surprise, there were 5 type of sushis and had a variety of veggies: sweet potatoes, mushrooms(enoki, oyster, portobello), avocado, tofu, etc.. Although each bite were flavourful, they were very salty and I had to drink a lot of water. Nonetheless, each one tasted different  and had a nice texture!The presentation was also adorable and the sushis were brought on wooden plates.I wouldn't classify this as a casual hangout place as the space is pretty small. For people who aren't fond of vegetarian food, you should go at least once! It's worth a try and might even change your opinion on vegetarian food. Their service was fast and the staff are all so friendly!The pricing is on the expensive side, so if you want to try a bit of everything: go for their tasting menu. Definitely need to reserve in advance to eat there, even on a week day! Many people who just show up got turned away."
/user_details?userid=wJF-NdtxYCk_SrwG4UUL9Q,Stephanie L.,"Montreal, Canada",4 star rating,"This is an excellent vegan sushi restaurant. I am a sushi fanatic, so I thought I'd be missing the fish, but I didn't! The way in which they crafted the vegetables really replicated the classic sushi feel, and it was extremely filling too! I came here with 3 of my friends, so we opted for the 4 person menu. If you're coming with a group, this is the best way to maximize both cost and variety. The set menu included a choice of 2 appetizers from mango salad, beet tartar and gyozas. We got the tartar and the gyozas, the tartar was excellent very tasty. Next came the rolls, I honestly don't remember what each one was, but what I can say is they were really delicious and each had a unique flavour. Two of the rolls were freshly fried so the waiter told us to eat them first, YUM! If you're looking for a place to bring some vegan or vegetarian friends, look no further!"
/user_details?userid=WMK1j18ACm-EtopEznV4Rg,Jana T.,"Westmount, Canada",4 star rating,"Heard great things about this place and was looking forward to trying it.  Came with the family on a stormy Saturday night.  The place was full, and reservations are definitely needed especially for the weekend.  We were seated quickly and decided to take the tasting menu for 4 people.  We were 2 adults, 2 teenagers, and a 2 year old and it was more than enough food.  We started with very good miso soup, then 2 appetizers, the dumplings and beet tartare.  Then we had an assortment of rolls, about 7-8 different ones to try.  The food is all vegan, and the flavours and textures were really fantastic, very creative and flavourful.  I found a few of the rolls a little too salty but otherwise loved the meal.  The presentation was also visually very attractive.  This would have been a 5 star review except for a few things, the wooden bench we were seated on was really uncomfortable.  Also, service was friendly and attentive at the beginning, but vanished after the main course was served.  Dessert was included in our meal but we waited 45 minutes with dirty plates in front of us before we got it.  Dessert was four small slices of cake, which were very good but not sure they were worth the wait. Amazing vegan food, with some service issues...  would certainly come back and give it another try."
/user_details?userid=4EDFNz5FcbHywqCtcMAmaw,Rose T.,"London, United Kingdom",5 star rating,"Everything about Sushi Momo is spectacular! After reading reviews, my friend and I made sure we got there right before it opened so we could secure a table. We decided to have ourselves a feast and ordered a ton of food- way more than we could handle, but the sushi was still amazing as leftovers. Everything was amazing, but one item that was incredibly unique and I still dream about it til this day is their poutine. They totally nailed the Japanese fusion take on a Canadian delicacy. Love love love and can't wait to visit again just to get sushi here!"
/user_details?userid=qFqo9lQK8btWER-SF5YDrA,Pooja G.,"Schaumburg, IL",5 star rating,"If you're in Montreal, this place should not be missed! A vegan sushi place, can you imagine!! :)This place is always packed so make sure you have a reservation. Its a beautiful place, cozy atmosphere with lovely servers and their vegan sushi is to die for! Everything that we ordered there was freakn amazing! Usually, vegetarians have to stick to avocado and cucumber rolls at most sushi restaurants but this restaurant proves that vegans/vegetarians can also enjoy a wide variety of sushi. I would totally recommend trying this place out."
/user_details?userid=8HafK5cS8pWCWNQTIG8iJw,Uyen D.,"Montreal, Canada",5 star rating,"Disclaimer: this review is written through the lens of an omnivore. I've known about Sushi Momo for a few years now but have never tried it because honestly- how good can vegetarian sushi be?! In my skeptical mind I was picturing plain cucumber or tempura sweet potato rolls, in no way as tasty as a fresh, spicy salmon roll. I'm happy to say I was proven wrong. First off, thanks to Yelp I knew reservations were a must. In the span of 10 minutes I saw 2 walk-ins get turned away on a regular Wednesday evening. The restaurant has a serene, earthy feel to it- wood panels adorn the walls and potted plants hang from the ceiling. Most of the chairs are funky refurbished boat seats, which matched the portholes in the room. The layout is a bit odd- the place doesn't feel spacious because of the large enclosed sushi bar in the middle of the room. Our table was next to the sushi bar, in a narrow path near the back of the room. I admit I felt a bit claustrophobic, but the good food made up for it. The menu is ballsy, with tons of veggie/fruit combos I'd never heard of. The textures and sauces are the true stars here. Surprisingly, I never once missed the taste of fish, as I was so engulfed in Sushi Momo's innovative and complex flavours. I highly recommend this restaurant to adventurous eaters, vegan or not."
/user_details?userid=Wc5L6iuvSNF5WGBlqIO8nw,Risa D.,"Lac-Supérieur, Canada",4 star rating,"I had friends coming into town for an indulgent Montreal weekend and wanted to book one night that would be fun and delish but still veggie and healthy. I hadn't been to the new location yet but I'd really enjoyed the original and loved the friendly joyful service and felt like I could trust them to pull off a fun group dinner. I was not wrong! For $30 each plus drinks we had a crazy epic feast. Started with salads and crispy rolls and fried wonton style dumplings, super flavourful and fun bites. The showstopper though was the massive sushi boat. Why is it on a boat? Why isn't all my food served in a boat? The group top favourite was the spicy jackfruit roll, and our least favourite were the ones with a pesto inside - the flavour combo freaked us out. There were so many to try from though, and so many left over, you couldn't be mad at having a few you didn't enjoy as much. Dessert was delicious as well and our bottles of wine were affordable and tasty. The big group table we were seated at in the back was great for getting a view of the whole spot, and still feeling kind of intimate with the group. It's a bit weirdly shaped though, I imagine the person sitting in the furtherest corner could feel a little left out. Not a big problem in our case as that guy in our group has a megaphone voice. Everyone I'd invited seemed happy, even though they'd started dubious, and the service was as warm and welcoming as I'd hoped. For vegetarians or pregnant people this place is a gift. We'll be back soon no doubt."
/user_details?userid=V3yjfheDa-5zY95ZaqOj5Q,Stella L.,"Ottawa, Canada",5 star rating,"Had only heard good things about this place and I can not disagree. You should definitely make reservations!If you want fish, don't come to this place, but if you have an open mind, you should go!I didn't think vegetarian food could be so flavourful and have so much texture, but it did! I especially loved the beet tartare with the taro chips.Staff was lovely and friendly. The restaurant was warm and cozy, a very comfortable atmosphere."
/user_details?userid=GGI39_EL1ERSqyWX1tEjMA,Shubhi A.,"Mississauga, Canada",5 star rating,"I was not expecting that Montreal can beat Toronto's sushi experiences. Aaah well, ""vegan/vegetarians"" sushi experience. But it did! All credit goes to Sushi Momo vegetalien. I went there on a weekday lunch time. To my surprise it was pretty busy. It is a fancy fine dine. But every penny is worth it. The sushi's are so innovative, delicious and gorgeously plated! The server said "" They are made with love""  They have a platter , if you are in a group its worth trying. There are around 25 pieces in the platter with 5-6 varieties of shushi's. They offer Eddamme as welcome snacks. Equally yummy! They sushi's are sooo fresh, flavourful and full of beauty ( lol, can't remember any synonym with F).Simply 'F'antastic!"
/user_details?userid=EO49noCE6deJZXcf1Zrd0A,Chanhong L.,"Alexandria, VA",5 star rating,"The best vegan sushi in North America indeed-my boyfriend and I split the Ichiban for 1, and it was so worth it! We opted for the wakame (seaweed) salad as the appetizer, and it came with complimentary edamame, which quite frankly kind of confused me because I was pretty sure wakame meant seaweed, but then I was pleasantly surprised when a dish of five different kinds of seaweeds was subsequently presented. I was totally expecting the typical green seaweed served at sushi restaurants, but the four other seaweeds were all new to me and delicious with the presented garnishes and dipping sauce. Our main entree was five pieces of three different rolls chosen by the chef. At first I thought 15 pieces of sushi wouldn't be enough between the two of us, but it was the perfect amount of deliciousness and fullness. Because it's been so long and because the sushi menu is so extensive, I don't remember the exact rolls we got, but they were all delectable. I wish I could've tried them all and almost asked our neighboring table for leftovers of their huge order. Dessert was chocolate ice cream, which was actually my least favorite portion of the meal, but it was nice that it was included with the cost. We each ended up spending only around 17 USD for a high quality three-course meal. I'm so glad disappointment at another restaurant led me to making a reservation here, a must-stop for any visiting vegan."
/user_details?userid=KBHTIaz-OdXukREefkP4qg,Gabrielle L.,"Montreal, Canada",4 star rating,"I was really impressed with this restaurant! I had reservations for 8:30pm on Thursday night and it was packed! Also I was surprised to see how many things there were on the menu! I would not expect a vegetarian sushi restaurant to have so many options. I read really good reviews for this place and two friends recommended it so I was excited to try it out even though I am not vegetarian. This restaurant totally met my expectations and I will definitely be back!My friend and I each had the omakase for 1($32). It came with free edamame . I enjoyed the spices that they put on the edamame. We each had a miso soup. We also added gyozas as an extra. The omakase came with 25 sushi pieces (chef's choice) and 1 dessert to share. The waiter brought us fried gyoza without asking us if we wanted fried or pan friend and was nice enough to change it for us. We had 5 sushi rolls. Each were so flavorful and I totally did not miss the seafood! My favorites were the following:3 champions: Three mushrooms (enoki, oyster, portobello), marinated Japanese radish, avocado, bubu arare, truffle oil & miso emuslsionJacque épicé - Pan-fried jackfruit, avocado, green onion, tempura, kimchi emulsion.Mangue patate (5)  - Soy paper, sweet potato, mango, cucumber, avocado, maple syrup, tempura flakes, green onion, yuzu emulsion.The dessert was a passion fruit tarte with walnuts. The crust was very hard to cut but the dessert was delicious!This restaurants closes at 10pm on Thursdays and we left at 11:30pm! They were putting the chairs up on the tables and didn't rush us out. Very nice! I can't wait to try other stuff on the menu!"
/user_details?userid=vADS6TNFpCWxnpLY7hOZlg,Stefanie K.,"Montreal, Canada",5 star rating,"Valentine's day date decided to give Sushi Momo a try. I have to say at first i was a bit skeptical especially since there was no way of seeing the menu anywhere. I am currently on a vegan based diet and wow am i grateful for that journey. Because of it i have discovered the best sushi i have ever had...would i have tried it if i wasn't eating vegan?!  not likely. To top it off i am celiac which further complicates things so my boyfriend took one for the team when we took the gf sharing menu but he didn't feel deprived at all. Everything was awesome, amazingly different and flavorful. Cannot wait to go back, actually i would have gone back today...A month later i had to get my fix and went back... again it was an amazing experience, will definitely be back again and drag my non vegan friends cause it's just that good!!!"
/user_details?userid=eIFR6CeI7amzlqtzzUR8JQ,Sara A.,"Southwest, Montreal, Canada",4 star rating,"I've been craving some Good vegan sushi We ordered the tasting menu for 2 which includes two Miso soup, one salad, a platter of 25 pieces of sushi and a dessert We would have liked to have more sushi choice in our platter. ( Since the choices of the tasting menu are not written on the menu) The price is 32$ / person"
/user_details?userid=F7vcrApf-w_L4XquDBkDOQ,Jessica E.,"Albany, NY",5 star rating,"Second time dining at Sushi Momo and at this point I can't imagine visiting Montreal without stopping in. Apparently, everyone else agrees as the place was packed at 10 PM on a Thursday. Wait staff are all in good spirits notwithstanding and are happy to help you navigate the menu if you're not into gluten. They have a couple beers on tap an a nice selection of Sakis.On to the food: There are already so many pictures on yelp that you know their vegan sushi is edible art. For an appetizer this time my partner and I got the vegetable tempura, which was served like a bird's nest, with individually fried thin strips of vegetables amassed into a loosely packed ball the size of a softball. Totally wild and delicious. Red bell pepper was a nice addition to the mix of veggies that many japanese restaurants I've been too in NY don't usually include.For our entrees we ordered 4 rolls which arrived atop and below delicate swirls of sauces and carefully placed mircogreen leaves and edible flower petals. One with tempura shishitos and a spicy mayo, one with mango and sweet potato, another with a soy beef substitute seasoned like bulgogi, tomato, pear and a basil sauce, and the last with vegan shrimp, avocado, potato and a curry mayo. Everything was delicious and so creative and inspired. Still so many things to try, such as rolls featuring different kinds of mushrooms and marinated tofu, that I am already looking forward to returning!"
/user_details?userid=bqhyEHIjgc7e6jKUqJsTUg,Brian X.,"Mountain View, CA",5 star rating,"My friends and I visited here for dinner 9pm on a Friday evening. I was admittedly a bit skeptical of a vegan sushi place, but Sushi Momo really exceeded my expectations both in terms of food and in terms of service. We had made a reservation the day before though our table was a bit delayed so we weren't seated until some time after. The staff were super nice about it, though, and even provided us a complimentary sake drink while we waited! After we got seated, we ordered about six different rolls. All of the rolls were unique and very tasty. My favorites were the Geisha, Jacque Epice, and the 3 Champions. We also tried some dessert after; the dessert dish itself rotates day to day. We tried the strawberry and passionfruit variants of the dessert and both flavors were very flavorful but not overly sweet.Overall, we had a fantastic experience! I would definitely come back if visit Montreal again."
/user_details?userid=M1De2lTi1x9uzW1ah7FLEQ,Saida S.,"Montreal, Canada",5 star rating,"Everything about this place is great. The decor, you feel so zen when you're here, the waitresses are not too pushy, the menu is well described and the food delicious. Ive never had vegan sushi in my life so i was kind of sceptical. But my boyfriend swore on his life this was the best sushis in the world (mind you he's not vegan ) so we called to make a reservation (really important as the place is super popular).We ordered a bunch of rolls they were all so delicious and pretty (yesssss the presentation was A1).The price was a little more expensive than regular sushi but it wasnt a huge difference. Cant wait to go back ."
/user_details?userid=djxnI8Ux8ZYQJhiOQkrRhA,Abby S.,"Denver, CO",4 star rating,"The fact that I'm giving vegan sushi 4-stars says enough right there. #1 I am a seafood lover#2 Despite fact #1, I don't crave sushi or go out of my way to eat it#3 Just try to keep me away from dairy...Given all of these facts, dinner at Sushi Momo was quite good. Not too heavy, not too light, plenty of food to go around with a large group. Those boats are ginormous and can accommodate 8-10 people easy. White wine by the bottle on a warm evening compliments the meal in the best way possible, too! Even if you can't have all the vices, one is still OK. Would I go back? Actually, yes I would. Am I now a vegan sushi lover? Not quite, but Momo has changed my tune quite a bit."
/user_details?userid=yL7dyt4e2OkVLwokx5M8wQ,Ceci J.,"Ville-Marie, Montreal, Canada",5 star rating,"First I was skeptical when I heard that there's vegetarian sushi and I didn't have muuch expectation.  But once I saw how packed and how you can only be seated with reservation made me want to try this place even more. My bf and I got: Mumbai, Geisha, Jacque Epice, 3 Champions, Sakura which came to about $56. 25 rolls for two people are enough. Although with $8 more you can order Omakase which comes with popular 25 rolls, miso soup, and papaya salad/Beet tartar and a dessert. Highly recommend this place!"
