user_url,user_name,user_city,user_rating,user_review
/user_details?userid=zND6dC2q-5-GxqK-Yl-wsw,Molly L.,"Montreal, Canada",2 star rating,"The portions and prices were horrible - $7 for two rolls was a particularly unfortunate point. The veggie tempura sushi (which I would never order at a non-vegan joint) was abysmal - spongy tempura, dry rice, completely lacking in  flavour. The other rolls tried to draw their inspiration from a variety of sources - Indian, Western, Mexican - but it was a classic case of being spread too thin; maple syrup and hibiscus in sushi is interesting, but the core components like the rice were neglected in the process. Overall, this definitely lived up (or down) to what I imagine happening when white hipsters try to make sushi. 1 extra star, though, for giving me the best poop I had in months."
/user_details?userid=nBf6-0Or3H63PDk-rbRoCQ,Michael T.,"Laval, Canada",5 star rating,"What a great restaurant.I'll start by saying that I am very happy that they moved locations because their older one, apparently, was very small and could only accommodate 1/3 of their new location.I personally am not vegan, but I like supporting businesses so here I am.We came here on Thursday evening at 5pm for my birthday. We had the Omakase for 2.We told the waitress that I was allergic so several fruits, so if I'm writing this, it's because I'm still alive!They gave us edamame and miso soup to start off the night. Shortly after enjoying a nice hot soup with some nice edamame, we had a beet tartare - yes, BEET tartare. It was so good, I wish I had more! The main course consists of 25 pieces of maki's. I have to tell you guys: if you want to use soy sauce, use a tiny bit because the rolls are good as is!We finished the night with a nice jasmine ice cream.I can't believe this was all vegan, it was so good!The pictures will tell you everything."
/user_details?userid=XEqApY2jtSPdGptPsJHumg,Lucy F.,"Montreal, Canada",5 star rating,"Full disclosure. I am not vegan, nor will I ever be (I love cheese, even more so if it's in a burger). Now that that's out of the way, you will need to believe me when I say this restaurant is exceptional. For one, the presentation of the dishes is beautiful. Luckily, it's also crazy delicious. The beet tartare made it to my top ten favourite dishes of all times... yes, it's that good. A must try. The papaya salad was also good, maybe not as zesty as others I have tried but that might be because I am used to the fish sauce kick. The sushi was amazing. Really nothing to envy to traditional sushi. The homemade ice creams were also surprisingly perfect.The chef that created these recipes is a talented artist. I have found that many vegan and vegetarian restaurants rely on sauces and ""mayo"" for flavour, which often ends up being good but very heavy. Not this chef. His sauces are wonderful but really he relies on the combination of ingredients to create those perfect bites. Make sure to reserve. The establishment is very busy and rightfully so."
/user_details?userid=g2A5KNz1bxmD3qyUuqeCjg,Sofia S.,"Toronto, Canada",5 star rating,"One of my best sushi experiences. Whole new way to eat sushi. For people who are not a fan of fish, this will blow your mind. Local treasure! Fresh and favourable ingredients. Great ambiance, excellent service. You need to book in advance not too much seating."
/user_details?userid=rkPrz6uwJIefZdH2Oqv4Tg,Christian C.,"Ville-Marie, Montreal, Canada",5 star rating,"One would think that sushi is only rice and fish but oh how wrong they are! Their sushi is so delicious and rich in flavor and texture! It's not just 'a bunch of vegetables and rice', it's a work of art! Kudos to the staff, keep it up!"
/user_details?userid=noLV2HHn8FwWtR50vSHtNA,Laura A.,"Longueuil, Canada",5 star rating,"I can't stress enough how much I LOVED this place!!!! The food was so delectable - the jackfruit sushi is one of the best to try! We had a mixed platter and every single piece was to die for. The emulsions and flavours are so inspiring, you've never seen anything like it. Vegan or not, this place is at the TOP of my list for all sushi places I've been in the world. No competition comes close. Awesome decor, friendly staff, food was sooooooo good. I honestly can't wait to go back!"
/user_details?userid=sv98So_okvtXpEfbGbciQA,Fadi A.,"Ville-Marie, Montreal, Canada",5 star rating,"Came here with my SO and we had the best sushi of our lives. Before coming, I was very skeptic of what of vegetarian sushi but this changed my mind. We got the combo for two ($40) and were pretty full by the end. This is a must see."
/user_details?userid=7wrPUBr_xc7NHvuPMKiRjQ,Nurjahan B.,"Mercier-Hochelaga-Maisonneuve, Montreal, Canada",5 star rating,"Ugh how do I even start this review everything was amazing the decor of the place was sooo cute and definitely insta worthy but the best was the food !!! I'm not a huge fan of sushi but my friends forced me to come with them and I seriously don't regret it AT ALL TRUST ME WHEN I SAY THIS PLACE HAS AMAZING FOOD  (even the edamames were good ???) we started off with the sweet potato pizza and Ohmygod I still remember the taste of it it was a perfect combo of sweet and spicy it was really good I wish I ordered it again. Next we ordered the L'Enfer 2.0 which is a spicy maki it tasted a bit like the pizza hence why I enjoyed it and then we got the GYU and Roru-rouge which are fried Maki and in my opinion they tasted the same but it was still good trust me. Then we went on to the sushi's and we shared the Surf and Turf, Patate-Jalapeño, Mumbai and spider which were all super tasty and my personal favourite was the jalapeño one (as you can tell I like the spicy ones ahah) my least favourite was the La Vie en Rose which my friends loved and it had a beautiful display but unfortunately it wasn't up to my taste. But overall my experience here was great the service was good the waitress was super friendly and she helped us with the ordering since it was our first time there I recommend anyone to visit this place if they're looking for a good sushi place :)"
/user_details?userid=7UYXZk2tjJun3VZP6ZsYzw,Victoria D.,"Sainte-Anne-De-Bellevue, Canada",5 star rating,"I was never a fan of sushi because even as a non-vegan the idea of raw fish was very unappealing to me... but now that I'm vegan I'm always on the hunt for delicious vegan cuisine so Sushi Momo was my introduction to sushi and did not disappoint!  I went with some (non-vegan) girlfriends on a Saturday night to celebrate my birthday and from the moment we walked in the door we felt welcome and were blown away by the ambience and the service.  The staff are friendly and the decor is eclectic, Asian, chic and cozy. We were seated a little towards the back at the perfect table tucked into a corner for a group of boisterous girls ;-)We were well taken care of by the charming Jonathan, who started us off with warm saki and then suggested the perfect wine and the Saiko Ko for Four from ""Les Deals"".  This four-course menu included a sumptuous miso soup to start, which the girls loved.  I subbed for a small salad instead and feel like I went to heaven when I tasted the ambrosia that was the dressing.  Then we had a yummy papaya salad & beetroot tartare and we also ordered some dumplings (Gyoza) all of which disappeared in a flash.  The portions were perfect for sharing and everything tasted even better than it looked.  When the sushi platter arrived with a selection of favorites from the chefs, Jonathan took the time to explain what each item was and then left us to dive in.  At this point I have to say that I'm a VERY picky eater and am not usually adventurous when it comes to food. I threw caution to the wind and tried almost everything - including the jackfruit. I can't even remember the names of anything, but suffice to say that I was more than satisfied as were the girls. The portion was just right, even leaving us with a little box of leftovers to take home.As a vegan, it can be difficult to find a restaurant that appeals to my non-vegan friends... so discovering Sushi Momo was the best birthday present ever!  Now that I've popped my sushi cherry, I will definitely be back and would highly recommend this oasis of deliciousness to vegans & non-vegans alike."
/user_details?userid=eHUSEq5AnV7SPvgpcWklrQ,Sharon X.,"New York, NY",5 star rating,"OH MY GOSH THIS PLACE IS ABSOLUTELY AMAZING!!!!!SERVICEService was absolutely amazing. We went in around 4:30 without a reservation, and they seated us without a question (this place usually needs a reservation because it's so busy). Our waitress was a sweetheart and she made sure that everything was to our tastes and checked in with us periodically. One of the people in my group has a mushroom allergy, and our waitress made sure she was accommodated and gave her alternative dishesFOODThe food was absolutely delicious. We ordered the saiko ko for four, which included miso soup, two appetizers, 50 pieces of sushi, and dessert for about $30/person. It doesn't sound like that much, but when it all came on the table, it was So Much food (There was even more sushi than the pictures I've attached). We had a beet tartare for one of the appetizers, and it was absolutely delicious. The sushi was also amazing and every different roll had a unique taste that I've never had before.10/10 would recommend and a restaurant you should definitely try if you are in Montreal!!"
/user_details?userid=NiZK2S0SOfSRR4P50KN98A,Meaghan P.,"Beaconsfield, Canada",4 star rating,"First thing, getting a reservation as more than 2 people isn't always the easiest, so plan ahead if you can. If you're more than 2 and just want to walk-in, you are likely going to be waiting a while. Not recommended.The atmosphere at this restaurant is wonderfully cozy/casual. The cooks are in the middle so you can watch your sushi rolls being made while you wait. It does, however, get extremely busy and somewhat loud. I went with 2 girlfriends on a reservation we made way in advance and had gotten there more or less on time. We ordered the tasting menu (miso soup each + edamame to share, 2 choices of apps, 36 pieces of sushi and dessert to share for $32/ea) and LOVED our food experience - Definitely worth the cost. The appetizers we had were the miso soup (so wonderfully earthy), the edamame, the papaya salad (fresh and tangy) and the gyozas (seriously satisfying). I truly wish I remembered the names of the rolls we had but sadly, I'm not that good... I do remember some favourite flavours were the mushroom, the incredible one with faux shrimp, a super earthy and mouth savory beet one and I believe was the faux beef fried roll (Koby Roll). Lastly the dessert, OMG the dessert! Creamy delicious pieces of cake to share: Matcha, Lemon and Chocolate on a crunchy gram cracker like crust. Make sure there is a little room for dessert for sure! What killed all this goodness to me was our waiter. We walked in, sat down and he more or less told us order the tasting menu or else we don't have time to wait for you to decide on your order. We felt rushed and pressured by him within seconds of sitting down to a nice girls night out. It just set the night on a negative start.  We then proceeded to have a wonderful dinner and which ended by us being more or less rushed to pay our bills and leave our table ASAP as according to him we were holding up the table. I understand they are busy but rudeness isn't acceptable. I'm hoping if I go back, I never run into him again. I'm usually a generous tipper but he made is VERY difficult for me to feel he deserved anything."
/user_details?userid=IKMSDZS1tjTn66I2xXOTSw,Ria A.,"Highland Park, Los Angeles, CA",5 star rating,"This place is the best. We came here while visiting Montreal four years ago and still talk about it. The assortment of sushi is really incredible, every piece is like a flavor explosion. Not only great food, but a fun place to go with friends. It's an experience for sure. We make sure to stop by each time we're in town."
/user_details?userid=VZtaiqj40IF36qs2JnQaeg,Marisa K.,"Kansas City, MO",5 star rating,"This place is OUTSTANDING. Montreal is such a vegan-friendly city. I was so happy to hear about Sushi Momo, and I knew I'd have to try it on vacation. I brought my omnivore boyfriend and he loved it all too! Seriously, this place is a must-try. We got six different types of sushi total. I can't remember which ones, but honestly they were all delicious. I wish they had a restaurant like this where I live!"
/user_details?userid=Yj6gAP6HTKaFks9EyDLm2Q,Mark B.,"Oakland, CA",5 star rating,"***MAKE A RESERVATION WELL IN ADVANCE***This place is extremely popular, we got turned away on our first attempt because we didn't have a reservation, but made one there on the spot for the following evening. Asked out of curiosity how the rest of the week looked, they were booked solid, so we got lucky that we were able to get in during out Montreal visit.Okay, enough with the cautionary tale...Two words, GOD DAMN. I kept saying those words, again and again after each bite. Their rolls are SO delicious.Go with the ""Omakasé For Two"" (or any of the other ""deals"" where they pick the sushi for you). Suggesting this because they pick drastically different rolls, so you get a chance to really taste their creative spectrum in its entirety.Kind of wild, but I was really impressed with the miso soup. Normally this is a boring preliminary dish that I enjoy, but there's nothing special. Not the case at Sushi Momo, their miso was so damn good.For anyone wondering how this place stacks up against other well known vegan sushi restaurants, I'd be willing to go as far as saying Sushi Momo is better and more creative than our local gem, and vegan sushi tourist destination, Shizen."
/user_details?userid=fu9kPR6VmQDwTh0f3i_OFQ,Sylvie L.,"Montreal, Canada",5 star rating,"Extremely tasty non-Japanese makis !!! Don't think you are going to eat Japanese, because you are at the wrong place. Japanese sushis/makis aims for simplicity and the tasting of a almost-single fresh ingredient. Sushi Momo is using makis as a blank canvas to compose surprising associations of many flavors, textures and colors, all fresh and vegan ! Every bite was an experience ! Bravo to the chef ! Nice thing is that they have a set menu to share for 2-4-5 people for 30$/person; you will get to taste a variety of things, they change the menu quite often. Very good food at a very good price. I recommend to everyone : vegan, vegetarian, carnivores, omnivores, etc !"
/user_details?userid=gcJ5T8Nr17T6wNCzcMvI8w,Elly L.,"El Cerrito, CA",5 star rating,Wow I would literally go here every day! They have so many choices and every one of them is fantastic with distinct and interesting flavors. I'm not even vegan and I find this the best sushi I've ever had!
/user_details?userid=aVxpgZk6ZwUBKzvCs2Ae4w,Jacqueline N.,"Vancouver, Canada",5 star rating,the BEST sushi in all of montreal! and it's vegan! meat lovers and herbivores will both take delight in the incredibly beautiful flavors and textures of sushi momo! every time i put a roll in my mouth it is mindblowingly amazing! the new location is very cool and trendy. my only wish is that their menu was the same because it is a bit smaller than it used to be. but the food was excellent as always and the customer service is wonderful!
/user_details?userid=gr28gZBtSon2Irey9JtcFw,Jeremy D.,"Le Plateau-Mont-Royal, Montreal, Canada",5 star rating,"Best sushi and amazing dumplings.  Hard to get into, but the service is perfect and the food is off the charts haute cuisine sushi, and the pan fried dumplings are cravable!"
/user_details?userid=bLfb8t2AaiHTMjAyzubmaQ,Tara D.,"Fairfield, IA",5 star rating,Momo sushi is PURE BLISS. I think I just transcended....You'll never able to hit another sushi joint after this
/user_details?userid=Wigv2LJgKjrGS5M_Nvy8iQ,Theresa B.,"Princeton, NJ",5 star rating,"The beet tartare is AMAZING!!!!  The ambiance is great, the wait staff was super nice and the food was awesome!!  We went with the chef's platter and were totally happy!!!"
/user_details?userid=pQg1NX8ge1iY7FjlXK-NUA,Morgan W.,"Baton Rouge, LA",4 star rating,This was my first time at a Sushi Restaurant where everything is vegan or vegan friendly! The staff is nice and they also speak English for those who don't speak French. My hostess carefully explained everything on the menu and recommend some great rolls. I had the Mumbai Roll and the Surf & Turf. The later was my favorite out of the two as it had vegan bacon and was very delicious! I can't wait to come back and try more rolls. I've got my eye on a Jackfruit roll next!
/user_details?userid=VrM20MquPZbVlz_EBxC_xA,Stephanie M.,"Sunnyvale, CA",5 star rating,"Best vegan sushi ever. The flavours are so delicious , whether you are vegan or not, you should definitely come here. The decor is also super charming !"
/user_details?userid=PAW431AL_eDbvTHYACw6pQ,Alexandra S.,"Manhattan, NY",5 star rating,This place is beyond delicious. I love it so much. I think it has become my favourite place in Montreal. The restaurant is so cozy and relaxing and the service is amazing. The best sushi I've had in a while. Try the papaya salad and the three champions sushi! I want to come here everyday haha!
/user_details?userid=kLQ8DMxJGIV28NtPGuDcNA,Cassiano R.,"San Francisco, CA",1 star rating,"I was surprise when we came and the manager suggested us to stay in the delivery area, no support to sellect the food in English. The manager was very arrogant and didn't give us any attention. Unfortunatelly we left the place without the food."
/user_details?userid=PK3EmRHbtPxxuJuEyHnI5A,Nica D.,"Toronto, Canada",5 star rating,"My first time visiting a vegan sushi place and we ordered the Omakase. Started off with edamame which seemed complimentary, a delicious and creamy miso soup, and then papaya salad which was so tasty (and not spicy like traditional Thai ones) and had the chef's selection of 25 rolls. I also ordered the kobe roll as people recommended it, so far I would say that was my least favourite as it was more of a salad roll and quite expensive at $14. I think we had 5 rolls each of the Mangue Patate, Three Champions, Mumbai, another one with mushrooms and another with asparagus. For some reason we shared a creme bruele for dessert instead of icecream but that was fine. We left totally stuffed. I liked that the menu had enough that you could visit a few times before trying everything. I would like to try the blow torched sushi next time."
/user_details?userid=jn6THmhWapW7OiCJWOlNGw,Caitlin A.,"Los Angeles, CA",3 star rating,"The food is spicy. it's not the traditional sushi you get in Japan of course. It's a fun fatter junkier version which is great for a craving. The male server kept pushing us to order more even though we told him we were full- so that's a bit inappropriate and awkward. He also said we cannot order later as reservations are for a limited time. Secondly, be careful if you are allergic to something in the menu. The kitchen may still forget to remove it even if you request. This has happened many times before."
/user_details?userid=1-InP8lBeLIryDeDhFcyVQ,S O.,"Orlando, FL",5 star rating,The food is so amazing.  One of my favorites in Montreal. The best vegan sushi.  A great selection of items on menu.  The staff is very friendly and attentive.
/user_details?userid=7GGxwH_t9DNTveS2gi1Nbw,Sarah F.,"Saranac, NY",5 star rating,"What a great restaurant! We absolutely loved the food and the service was great! Not only did the waiter help us with the menu, he recommended the special for 2 with great enthusiasm. This came with edamame, miso soup, beet tartare, 25 assorted rolls and ice cream. What a great presentation for ever meal that was brought out! (Even if you aren't vegan, you certainly won't be disappointed! I found that it was a very convenient location, easy parking and short walk. I recommend a making reservation! Very easy, you can do so by going right on their website. We traveled 75 miles to eat here and will most certainly be back as soon as possible. Thank you Sushi Momo for a great meal!!!!"
/user_details?userid=FtGTO3MShfZdG-TAOTloGA,Johnny R.,"Le Sud-Ouest, Montreal, Canada",5 star rating,"I used to order take out here all the time and it was always excellent. On the night we went there in person it was just as we remembered it when ordering. The waitress unfortunately forgot to enter one of the pieces of the order and by the time we asked about it the kitchen had closed, but she offered us dessert on the house to make up for it."
/user_details?userid=8335cvG3_f_fxDwKl5MdjQ,Bryan P.,"Washington, DC",5 star rating,"best meal we've had all year. we'll be remembering this place for years to come. and without a doubt, this is the best vegan sushi in North America (even better than Shojin in Los Angeles). make this place your priority."
