user_url,user_name,user_city,user_rating,user_review
/user_details?userid=e4Btqqc-VNdu6eyo9HNbjw,Rainie J.,"Montreal, Canada",5 star rating,"I'm not a big fan of salads in general, mainly because I am a big fan of meat. Naturally, I had the filet mignon salad, it was a gigantic bowl of arugula, baby spinach, and so much meat.... It was delicious~ The portion size was exceptionally large. I also liked how clean the place was, and service was nice too."
/user_details?userid=XdP5IhjDjso2-clf1uiANg,Anne D.,"Talence, France",4 star rating,Very good salad but when you make your own it can be very quickly expensive for just a salad. Nicely staff
/user_details?userid=b0wKODMWvFtZRsUmdABWGg,Alina B.,"Windsor, Canada",5 star rating,Absolutely amazing place! Perfect for when you're trying to stay healthy but not spend crazy money on downtown foods. The portions of the salads are huge I could hardly finish mine so it's definitely worth the price! Only con is that if you get there at a busy time and want to eat in it can be hard to find a spot
/user_details?userid=3-nyItcBFRq0ZhyJjzqVpg,Wassim O.,"Prague, Czech Republic",4 star rating,Great variety salads to start with and I really liked the place with its simple original decoration. Friendly atmosphere
/user_details?userid=pV5yh55j12SWmipNv53qsQ,Thea M.,"Montreal, Canada",2 star rating,"Large portions, but as many other reviewers have said, it's so expensive! Further, service is slow and it's always crowded. The table set-up in the restaurant makes it difficult to find a seat if you're in a group of more than 2. The ingredients (though fresh) are also not special or creative - certainly not worth $15+. For the price, you might as well make it yourself!"
/user_details?userid=MCdgzhntTVK0OEH0ivqpEw,Stuart ..,"Calgary, Canada",5 star rating,"Fresh, crisp and tasty.  The choices are abundant. Most are protien free initially and then you can add as you wish.  You can create your own salad if the 20 or so choices don't suit your fancyI had the Wolfe salad and after a bruiser of a smoked meat sandwich for lunch did not feel the need toj add meat.  Large portions but not overwhelming. Bright atmosphere and very friendly and helpful staff. Chilled flat and sparkling filtered tap water is a great feature. ."
/user_details?userid=bUpSdxKtSWBM5zbarjConw,Chris D.,"Brooklyn, NY",5 star rating,"Delicious salads and soup. (Pastries looked good also.) This place is doing the gourmet salad thing WELL. I ordered take out, but it looked like a great place to come sit with friends. I recommend the wild sage salad."
/user_details?userid=FcMJU6YabsYW3ktF9R4Khw,Carolyn K.,"Washington, DC",2 star rating,"I typically love the salads at Mandy's and don't mind the high prices.  I ordered two salads the other day, and while mine was great, my husband's was missing most of the toppings described in the menu and there was a long brown hair sticking out from the greens.  So disappointing!   You don't expect that from a $20 salad!"
/user_details?userid=muFEehJQ-NYC1WrIuow5GQ,David E.,"Montreal, Canada",4 star rating,Definitely the best of the few salad bars in Montreal. Mandy's menu is very diversified with a almost 15 original and filling salads. You can also create your own salad. I like going there for post workout meals or to grab a quick dinner. Salads are big however a little expensive for a salad.
/user_details?userid=4mHbLyxdNQj0psbSwOpH7A,Monica P.,"Westmount, Canada",1 star rating,I'm so reluctant to eat here. I only have it when my family doesn't want to cook because it's so close to our house. I'm not the one that pays. Last last time I got a Tokyo salad and I didn't get tofu. I was wondering if this was one of those bullshit things where you pay an extra $2-$3 for chicken *rolls eyes* but no I checked the menu it's supposed to come with tofu.  They forgot the vest ingredient! The next two salads I got Tokyo salad then Asian Salad both were underdressed. Next time my parents want this I'm asking for the Dagwoods next door instead. THIS PLACE IS NOT WORTH IT!
/user_details?userid=bBbGqiRo4QE6tzkXjv_ZzA,Eric D.,"New Albany, OH",5 star rating,I had the protein bowl and thought it was really great. And they are environmentally conscious which is really cool!
/user_details?userid=SUd0Gwv8dg6x2oUSy4lgVQ,Will R.,"Montreal, Canada",4 star rating,"Good salad. Long waits. Fair price (still wish it was 15% less). Nothing unexpected, which can nice, but Panthère Verte's salads one block over have some mind blowing flavor."
/user_details?userid=XNiWeH_-FTKY9ceJKwiBqw,Hawkes B.,"Montreal, Canada",4 star rating,Great big salads in a twee style in the otherwise very corporate downtown area.  Great for lunch on the fly or settle down with your laptop. Wi-Fi was down though...
/user_details?userid=1hT5oewKWdp-RsZL4J0UfQ,Sarah D.,"Montreal, Canada",3 star rating,"Mandy's proves you can make friends with salad. Meal-sized and then some. Fresh ingredients (and lots of 'em to choose from). No matter what regimen you're following, there's something for you here. But let's also be real for a hot minute: salads do not equal healthy if you're loading the blue cheese + candied pecans + cranberries + waterfall of dressing. (Then again, LIVE YOUR LIFE!)"
/user_details?userid=e4mbew0Fy3KQ5vw5nLpHLw,Joanna B.,"Toronto, Canada",5 star rating,"The best salads in the world, far and away better than comparable spots in NY/TO/LA!! So fresh and bright tasting. Plus the snacks, drinks, chocolates and decor are so thoughtfully curated. It's always jammed with stylish people and for good reason!"
/user_details?userid=3kQsPgVgGkJ_FjCSXkWxzw,Jonathan B.,"Montreal, Canada",5 star rating,"Fresh, delicious, and addictive. Those three words accurately describe my experience with this salad joint - only complaint would be the insanely long lines during the lunch rush hour, but it's normal."
/user_details?userid=P-qkBhjs4mkSE5JC-wTwOA,PB F.,"Riverside, CA",5 star rating,"Expensive, but good. You can have your salad tailor made so it meets your ridiculous diet requirements. It is hard for me to find a place that is able to fulfill the needs of my diet - and Mandy's certainly did just that. Eating there is nice too and the shabby-chic ambiance makes me want to be healthy and eat more salad."
/user_details?userid=XEqApY2jtSPdGptPsJHumg,Lucy F.,"Montreal, Canada",2 star rating,"Let me start by saying I love Mandy's salads (all locations). So why only 2 stars?The ingredients. When you get a good salad here, it's amazing! However, half the time, you will find a problem with your salad. Last week, the avocado in my Cobb salad was brown and I had it 5 minutes after it was prepared. This week, my man salad had undercooked flabby bacon. If bacon is not crispy in a salad, it is so unpleasant to bite and chew on pieces of fat!! A few weeks ago I had a great asian salad with extra chicken. The salad was good, but the added chicken was so dry I just discarded it. Taj soup is only broth with chickpeas, cauliflower  and shredded carrots. Also VERY oily for a soup. Taste is disappointing. Same broth they use in the matzo ball soup. Sometimes, they go very heavy on dressing/oil, so I ask for a bit less. The price... An abibi salad (lettuce, chick peas, tomatoes, etc, no meat) will cost you 15$. It never bothers me to pay high prices for my food, if it's justified by the ingredients, the type of cuisine or the location. In this case, it really isn't. Definitely place for improvement, but concept is great. Service is friendly and effective."
/user_details?userid=Ex-QoUxevVpBPsovXWb8cw,Naoufel T.,"Montreal, Canada",5 star rating,"I cannot remember when was the last time I had such a great salad. I ordered the endless summer salad with white tuna, the quality is more than enough if you are very hungry. The product felt fresh and the mix was well balanced."
/user_details?userid=iHWkaQKPuZ4ETp95ThYRyw,A.B M.,"Toronto, Canada",4 star rating,"The salad cost me $17 and was okay. The trouble is that they charge you alot for a custom salad, not realizing the toppings were more than toppings, they were what made the salad, so if you ordered onion, pita chips etc etc, you got as much onion as pita chips. The sesame dressing was good, but they don't put enough its quite dry. Would go back to try more things, ask to sample the dressings if you're not sure what you want :)the chicken is cold and dry  - add chick peas for protein if that's what you're going for. Also you can ask to split the salad so you can share with a friend."
/user_details?userid=oWfKtdfa6GtYJhetLm0zOA,Lee L.,"Montreal, Canada",5 star rating,"This place is Amazing! great salads, nice friendly atmosphere I am obsessed. Only little thing is that the lineup tends to be long (depending on the time you go) but definitely worth the wait!"
/user_details?userid=WTBjrYlY8thkKOCwmFCIhQ,Cassandra C.,"Courtice, Canada",3 star rating,"Had an early dinner, was intrigued by the window signage that it was just salad, well it was very good salad you have two choices you can either design your own salad with any number of options, or you can choose from the menu options. The portion of the salad was very large it is for sure a ""big salad"" ( Seinfeld anyone?) The price for a salad as a main was very reasonable. An enjoyable meal for sure :)"
/user_details?userid=StEPkEdWZuI0RNcugjZYFg,Dana S.,"Ville-Marie, Montreal, Canada",5 star rating,"Literally the only place I go for lunch. The location is convenient for students, and the prices are even better. The salads are fresh, delicious, and extremely filling. My favorite would be the superfood salad, minus the kale (hard to chew). Also, I would like to see red quinoa added to the menu, not just white!"
/user_details?userid=Bo90ToiOB-qqTAXMqeEgjA,Vince T.,"Pickering, Canada",5 star rating,"This was one of our go to places for a healthy, tasty meal. We have only eaten at this  location but I am sure the other sites are similar. There was certainly a lineup to order during lunch but well worth it. There is an option to order the themed Salads or you can build your own. I ordered the Tokyo Salad which I highly recommend. Prices range from $9-$12 for the salads and the portion as very big. It is has a great vibe to the place both inside and on the patio. We really enjoyed coming here for lunch and did come back more then once. Only recommendation would be for the Take out containers to be switched from Plastic to Paper. Let's be healthy to planet as well as our bodies."
/user_details?userid=VrRFgQQUNTwvdd-N1urGlA,Jameel C.,"Montreal, Canada",4 star rating,The Wolfe Bowl with extra grilled chicken is to die for.A little pricey but the complimentary carbonated water is good compensation
/user_details?userid=bzCgHWtklCymHQDEFiCppA,Nazanin G.,"Ville-Marie, Canada",4 star rating,"The salads are good , also the place and the staff are nice but the only thing I don't like is sometimes they mixed the ingredients too much"
/user_details?userid=zR2RIA8HL2YoRwuwy-4E6g,Chris B.,"Montreal, Canada",1 star rating,"Very plain salad that lacks flavor. The lettuce was bitter. I gagged and couldn't even go through half of my salad.All they did was chop the greens/fruits, throw them in a plastic cup, serve it in a hip tiny place and expect a tip on a takeout crazy expensive salad. I'm guessing in some people's book this is deserving of the price they are charging.I've tried salad places elsewhere where they are bursting with flavor and cheaper. This chain is not one of them."
/user_details?userid=J_dFVDRC_s9Hvkm-ZeH6uw,Solaleh K.,"Calgary, Canada",5 star rating,"The salads were fresh snd very tasty, served in colourful bowls.The portions are very generous, i could only finish half of it. The airy and light interior matches the salads perfectly. Great choice for a hot summer day."
/user_details?userid=kOTgA-on3LylRq2gbfgkoQ,Stephanie Z.,"Hampstead, Canada",1 star rating,"This is not my first time having issues with this location. They never seem to get my order right and I have never complained on missing ingredients I payed for but never got in my salad. But today, as I called to order my salad for pick up, I still had to wait about 30 mins to get my order, walk back to my office and realize there is NO dressing. NONE. I have had salads with very little dressing on it and still never felt the need to complain or go back. But enough is enough. I called and had to go back to the store to get my salad tossed in dressing. The lady appologized which was nice of her but that's it... She tosssed in a free cookie I guess to appologize again but I never asked for it and don't want it either... It is upsetting because I like their salads but I never get good service..."
/user_details?userid=Th5gC7G3CKU4wU5TSfj2jQ,Lolita A.,"Montreal, Canada",5 star rating,"Best salads ever! Great portion size at a reasonable price. My husband had the ""man salad"" and it was even more amazing then my terrific ""wolf salad"". We will be back!!"
/user_details?userid=TUY1Atjg4qd2fwudacUy-w,Julia R.,"West New York, NJ",5 star rating,Best salad place in town!! Freshest veggies and allows for a variety of substitutions of veggies!
