user_url,user_name,user_city,user_rating,user_review
/user_details?userid=NNsdd9gqYo-lS8ogP5pA7Q,Catherine A.,"Côte-Des-Neiges—Notre-Dame-De-Grâce, Montreal, Canada",4 star rating,"Although the place is always super crowded, people leave pretty quickly since it is a salad restaurant, and seats are cleared pretty fast. The salads are pricey but I find it justifiable for such filling portions. My personal favorite is the Mexi salad. They also have vegan options, and a make your own salad. The decor and atmosphere are really nice, the place is cozy, and the terrace during the summer is really enjoyable. Perfect place to go with friends."
/user_details?userid=5lT1GxGTIArrYbZGazAm-A,Ida K.,"Montreal, Canada",3 star rating,"This is where i like to get lunch on a weekday if i haven't brought my own to work. They have a nice variety of suggested salad mixes (endless summer and Cobb's are my favs) and you can choose to make your own. Portions are large and they mix in a little too much dressing for my taste - i always ask for half dressing. The atmosphere is pretty casual and cozy and the restaurant is bright with large green plants that are easy on the eye particularly in winter. I find the salads relatively overpriced (most are just below $20 after tax), specially b/c they don't use organic greens (they use free range eggs though)... Overall it's pleasant and relaxing to get lunch there and enjoy a midday break. Perhaps not economical for eveyday lunch, but good for a tiny treat every once in a while"
/user_details?userid=EaBKe-8LB-NHuH7Us-QhGw,Vincent V.,"Montreal, Canada",4 star rating,"So, Mandy's has always been my go-to ""salad"" place when I'm craving greens, and this time was no exception. I usually order a Cobb salad, which is delicious, but this time I grabbed the Wolfe Bowl, an amazing mix of greens, nuts, rice and the amazing tamari sauce. It was a delicious blow of freshness during this cold winter evening.It's kinda pricey, but the free carbonated water kinda makes up for the fact that you are paying 15$ for a salad."
/user_details?userid=yBzusnZmw_QcETaUyVfWdg,Grant L.,"Burlington, VT",4 star rating,I've ordered salads through Uber multiple times with great results. The quality of the salads and the service has always been super. Rating would be five stars if it was not so expensive.
/user_details?userid=gcBpdIB2zl65ht3imVA9pA,Devon C.,"Antigonish, Canada",5 star rating,Wow what a great cookie they make here at Mandys! Just a fabulous work of art! The bowls are to die for so friggin delicious.
/user_details?userid=U1vl4SQzO3wTAWlYVnSjnw,Justine S.,"Outremont, Canada",4 star rating,The salad's are great here! The staff is nice and the place is beautiful. My only complaint is that they are a bit expensive
/user_details?userid=gqhgABh1iLg8EX3B0O15RA,Tom A.,"Montreal, Canada",5 star rating,What an experience my wife and I had. Great smells as you walk in. I had 'the man salad' and she had the kale something or other. They were both wonderful and we plan on going backGreat business plan and we will recommend to others Well done
/user_details?userid=IeysEP_UCsQThvkI2lJguw,Vanessa A.,"New York, NY",5 star rating,"Buying a salad for lunch would probably be the last thing I'd consider doing but Mandy's would convert me! The salads are so good!  Unfortunately, I don't live in Canada otherwise I might make it a point to try all the salads they offer. They are also HUGE! Three of us shared 2 salads and we still couldn't finish them. We had the fave and the habibi. I understand where the fave got it's name from; it was our fave."
/user_details?userid=e_jRFyF1nRRzP5h_5Nzziw,Ruth B.,"Montreal, Canada",4 star rating,"Mandy's is my go to place for innovative generous gourmet salads. I automatically feel skinnier when I step into those doors. However If I'm being 100% honest, I often order the Cobb salad which I'm sure is their most caloric salad but what can I say , the heart want what it wants...which is Bacon in a salad. I also love the pieces of baked pita In it because it makes it so scrunchy. Their salad are on the pricy side but they are very generous so you at least stay full for a few hours after. There's not much room to sit at this location but I saw that there's a bigger location in old port that I haven't tried. Even if there's a lineup don't be scared to go in because they are very effective. I tried the October salad and the superfood salad, they were both really good. Everything about Mandy's is well marketed. I love seeing local success stories. Being health conscious is in style, their decor reminds me of summer and California. Everything about this place is so ""Instagram pic ready""  from their boxed water to their funky bowl. I feel like you can't leave this place without a big smile on your face. Bravo Mandy's !"
/user_details?userid=izdAXYjPdwaztxuT6C7GvQ,Jane S.,"Toronto, Canada",3 star rating,I have to say upfront that I have never been a salad lover but I feel like Mandy's is one of those places that makes you feel like you're having a real meal and not just a salad. The place is very neat and trendy. It even has boxed water :O The selection is nice and the portions are very large. If you're not a big eater I would recommend sharing with a friend as they are willing to do 2 half bowls of the same salad. I would just say the price of what they charge for these salads is a little extravagant. I like their food but I'm not sure I can justify paying up to $15 for some veggies and toppings. Side note: they do have amazing fresh baked choco chip cookies.
/user_details?userid=eMrAfFbqFb0BOKaZyeU1zw,Genevieve V.,"Brooklyn, NY",5 star rating,I lived and worked by their Westmount shop for a year and found myself there every week. Delicious options for everyone and every diet. Staff is always friendly.Go to: Asian salad with sunflower seeds in place of crunchy noodles.
/user_details?userid=ToxAsUPbU2Yzx3imGwAFbw,Connie L.,"Redondo Beach, CA",5 star rating,"Coming from California, I enjoy entree salads and look forward to staying healthy-ish while traveling. Mandy's did not disappoint! There are plenty of salad options to choose from and the service is friendly and fast. There are also plenty of juice/beverage options from kombucha, tea, water, root beer to choose from.Thank goodness I stopped by to grab a salad before getting to the airport. Why is airport food so, so bad?! Mandy's would definitely be a place I would frequent if I lived in Montreal.Enjoy!"
/user_details?userid=wb_BRhsZh0b3s3yQA14jkw,Tiffany H.,"Flushing, NY",5 star rating,"Really delicious salads with very generous portions! The staff is super friendly as well - the cashier noticed I was struggling with which salad (the choices all looked so good), and told me both a popular choice (Asian salad), and her own personal favorite (Wolfe bowl). They're super accommodating as well - I ended up opting for the Asian salad (greens, tomatoes, avocado, sesame seeds, crispy noodles, shredded carrots, ...) , and they allowed me to sub rice noodles for the crispy noodles, and dried cranberries for carrots! You can also add protein or other things for an additional charge. I think it is one of the best salads I've ever had - I really liked the creaminess from the avocados, and the dressing was very tasty as well. The portions are huge - it comes in a huge bowl (if you eat it there) - so it's super filling. Prices aren't bad either :) You're also given the option of creating your own salads.Long story short- lovely decor, friendly staff, super yummy salads, and generous portions. Can't wait to come back to try their other salads!"
/user_details?userid=OSPuQh94fH2jT1S6bZ6Q8A,Emily B.,"Toronto, Canada",5 star rating,"I have been to Mandys 3 times in the past month because I cannot get enough of this place. I have not dared to veer away from my favourite item yet--the Man Salad--in fear nothing will live up to it. The salads are huge, staff is friendly, and the interior beautiful. Prices may seem expensive, but when you see the size of the salads and the amount of ingredients in each, it becomes more reasonable. Fear not, the long lines move quickly even in the lunchtime rush!"
/user_details?userid=JsIq_t54KswcF5jKVjmEbA,Huvie J.,"Montreal, Canada",4 star rating,"Im  currently in a no process carbs  journey and I was kinda annoyed with life because well  I love to eat out...A friend of mine  told me about that place and I was yessssss  I wanna try it. I got awesome friends!I love Mandy's; my salad was fresh,the portions are huge and u definitly dont leave the place starving...the decor was pretty nice. Service its a bit grounded though we were at the Crescent location"
/user_details?userid=21BIvbY_rMDlQAH1mGfd0g,Ciara M.,"Moore Park, Australia",2 star rating,I used to love the Wolfe Bowl veganized (without Parmesan)The past couple times I've been to the one on Crescent there were gross kale stems all throughout my salad! it was not even enjoyable Sadly the quality seems to have changed a lot since a couple years ago or the salad makers have gotten lazy.
/user_details?userid=WFrGKXl9MSUarUwUag9V6Q,Shahin V.,"Honolulu, HI",1 star rating,Ordered an Asian salad but it turn to be almost all pieces of raw Roman with little of salad. Not good at all!
/user_details?userid=gcHp_IK6nRpvCf3QMfIhxQ,Max P.,"Hartsdale, NY",4 star rating,"The Miso Salmon Salad tasted so good, I almost forgot it cost me $50 for two salads and drinks. Mandy's loses one star for their obnoxiously high prices, and also my future business. If you have money to burn, enjoy."
/user_details?userid=tDZZ2WAPzJui4o8g1DWQjA,Yingcan L.,"Montreal, Canada",4 star rating,"Nice salade bar! My favorite is Asian salade. It tastes so goooooood! I tried Tokyo salade too, but I felt it's too sour and tofu inside is too salty."
/user_details?userid=nHjRBSbzPeqdq5_D3AirEg,Patricia C.,"Hampstead, Canada",4 star rating,"I heard a lot of good things about Mandy's so it was long overdue for me to try this place for myself!  A friend of mine highly recommended it saying that its so good that even people who don't usually enjoy salad can be converted into fans by Mandy's. After trying it myself, I have to say I agree with her.  First off, this location is adorable inside with a modern airy décor and lively atmosphere. Service was impeccable, they were very friendly. they did not make any mistakes on my order and I got my food quickly.  The price is about 15-25$ (with tax) for their salads (depending on the selection and any extras), so while this is a little on the pricey side, what I can say is that the portion is VERY generous and it is very well prepared with fresh quality ingredients which they don't skimp on!  I had the Wolfe Bowl (Arugula+other mixed greens, shredded carrot, Parmesan, quinoa, cherry tomatoes, kale , lots of avocado, walnuts and sesame seeds + I added Grilled chicken). It was delicious and filling, everything was so fresh and well balanced with a nice light vinaigrette style dressing. The added grilled chicken was key, it really added to it. So while I think it would be too pricey to come here on the daily for lunch, I can safely say I will be coming back to try more of their salads."
/user_details?userid=f4f0qnbLkjGnpUvdrtfZzg,Chloé P.,"Toronto, Canada",5 star rating,"I can't believe I haven't reviewed Mandy's yet!! This place lives up the hype.  Mandy's is the reigning salad queen. Before this place, I always hardcore judged people who ordered salads in restaurants. I mean, why would I pay to order something that I could easily make on my own? But then I finally gave in and decided to give Mandy's a shot. Best decision ever. I've gotten takeout from here and also dined in. Both experiences have been good! If you're eating in, there are some tasty hot sauces on the table! I always go for the Fave or the Wolfe bowl. I try to branch out every once in a while, but always end up going back to my #holygrail salads. The lineup for ordering can be long, but don't worry: it moves fast. I have literally eaten there like 15 times (no exaggeration) and every time has been a lovely experience. 10/10 recommend. One of my favorite spots in Montreal."
/user_details?userid=dmN6SfMI-pQyT-ouOmEkjQ,Noor M.,"Montreal, Canada",4 star rating,"MTL staple food basically. Despite the long lines you'll always be served in max ten minutes. They're really efficient in that sense. In terms of the food; Mandy's is always a great place if you want to grab a filling, healthy meal. They also have juices, cookies, and soups which is nice, but if you come here you have to have the salads. My personal favourite is the Habibi salad, and I've tried three of their other salads (the asian, and two whose names I don't remember), all of which left me full, satisfied, and pleased with what I just ate. Grab their salads to go and eat them at the McGill quad when the weather's nice, also a fun idea!"
/user_details?userid=eTDqUKfcPOIa2lV-9qEKiA,S B.,"Montreal, Canada",1 star rating,"Seriously canola oil in a 18$ salad...I wish they use olive oil instead. Until then, I'll go to Abe and Mary's... Please change the dressing oil, its unacceptable c'mon!!"
/user_details?userid=I8MtQVGlr2W1hn5epBXxLQ,Joel N.,"Toronto, Canada",5 star rating,Best salad spot I've ever been to. Ordered the salad of the month with the tamari dressing - which was amazing. Love this spot - they need it in Toronto.
/user_details?userid=tAtblebDRTiB9TkAxupncQ,Ivan M.,"Westmount, Canada",1 star rating,"I placed an order from Mandy's this evening through Foodora, with a listed delivery time of 25 minutes.Over an hour later, I find that the delivery tracking page hasn't even updated - not even once, it's still sitting there on ""Your order has been received.""I finally get through to someone on the Foodora customer service and they phone into the restaurant to find that the ""kitchen closed early"", so I've literally been sitting here 70 minutes while they didn't even bother to make my order.No contact from the restaurant, no contact from Foodora, and given that I was paying $60 for 2 salads, there's *zero* chance I'm giving this place a try at their physical location. If you're not going to fulfill orders, don't sign up with a delivery service. Complete waste of time and thanks for ruining our dinner."
/user_details?userid=706h7pnp5PswjGbly6XdgQ,Carolyn M.,"Northwest Calgary, Canada",5 star rating,"Very busy, but well worth the 15 minute wait. One of the best and healthiest lunch places I've been too in quite some time. I had the October salad with chicken added."
/user_details?userid=Zxm9YdQPtkLl4RZrIL9eTA,Chelsea T.,"Montreal, Canada",2 star rating,"We regularly order Mandy's at work, and every single time, the order takes much longer than what we were told. Today, for instance, we ordered at 11:45 and didn't get our order until well past 2 o'clock because the kitchen is slow and they messed up the ordIf you can't keep up with demand, then you shouldn't offer delivery services. The only good thing about Mandy's is that the salads are consistent. They need to find a way to make their kitchen more efficient though."
/user_details?userid=Q7JWDxkeVsZPBsLHr-jN-A,Who C.,"Ville-Marie, Montreal, Canada",4 star rating,"Incredible, imaginative salads.Very convenient and cute location. Fast service. Good choice of beverages. Crazy expensive for what you get. I've started using their menu to try and recreate the recipes yet I still come back for more.      Wild Sage is where it's at."
/user_details?userid=Bm6MmTcw1BZ6IZjVna1OKQ,Jade A.,"Montreal, Canada",4 star rating,"Good salads, service was very friendly. The also have free carbonated water on tap which is nice :)"
/user_details?userid=iYBHqogBsq6XhZgfBXJtIQ,Mark V.,"Webster, NY",5 star rating,"Great salads! We got the Wolfe Bol and a Caesar Salad. They were hearty salads that both myself and my girlfriend really enjoyed. We wanted a light, but filling meal and Mandy's hit the nail on the head. Really deep bowls and the salads are coated fully with dressing. Mandy's is a trendy and healthy eating spot. Everyone sat at big, family style table vibes, with trendy wall art and a big cooler to choose drinks at. It was the perfect meal for us. I highly recommend coming here for a healthy, good meal."
/user_details?userid=5i8f_qKmYjBuRODEa_XQMw,Carolyn T.,"Toronto, Canada",4 star rating,"So this story actually starts over a year ago when someone brought a bunch of amazing salads to a potluck lunch that we had at work. I didn't think to ask where the salads were from, but I'd been on the look out ever since.Fast forward to this week. I was looking for a healthy lunch downtown and I came across Mandy's on Yelp. As usual, I scrolled through the pictures on Yelp and perused their #JaimeMandys hashtag on Instagram. Lo and behold, I found the salad that I had been searching for!I went at around 2 PM on a weekday and the place was still quite busy. The line up to order was about 5 deep, but it moved quickly. I ordered the Asian Salad to eat in and it was promptly delivered to my table. It was almost, but not quite, as good as I had remembered - possibly because I ordered mine only lightly dressed or because I'd been building it up in my mind for over a year... The portion size is perfect for me, but probably large by most people's standards =PThe place is vintage and bright and there is a variety of seating - communal tables in the centre, bar seating on one side, one or two tables with armchair (!) seats, and a few tables with bench and chair seating. There's also a decent sized terrace.Overall, I'm a fan =)"
/user_details?userid=Wigv2LJgKjrGS5M_Nvy8iQ,Theresa B.,"Princeton, NJ",4 star rating,"This place is awesome!  My only complaint is that it was busy and very difficult to get a seat!!  But, the salads are wonderful--many, many healthy options.  The decor was fabulous.  The people that worked there were super nice!  We loved it and went back THREE times in two days while visiting Montreal!!"
/user_details?userid=hbcwTZqxS_spDAHVG0fmWw,Joe L.,"Norwood, MA",1 star rating,"The salad is highly overpriced for the quality, the romaine lettuce was not fresh. I should have gotten spinach or kale, did not realize romaine was the default for almost all of the 13 dollar salads. Maybe ok for a quick bite, nothing else. The juice was ok, but all in all not worth the price. Great decor though"
/user_details?userid=MeJJ50cVS-ycShR5wBKtHg,Alex A.,"White Rock, Canada",4 star rating,"My go-to salad is definitely the Reagan Danielle Extraordinaire. And let me tell you, it is extraordinaire! I've tried a countless number of salads at Mandy's and not once did I dislike a salad. The portions are fairly big-- you'll definitely feel refuelled after finishing one of their salads. The only downside is that it's waaaay overpriced. The cheapest you'll pay for a salad including tax and tip would probably be around $15. And you could also end up paying around $25 for another salad (ain't no shame in being delicious, Man salad).This place is also always busy: crowded and packed, and lines all the way out to the terrace."
/user_details?userid=C63nSmO0gBQt3I8953wAlQ,Michael Z.,"Montreal, Canada",5 star rating,Finally a lunch resto downtown that does more than burgers and beer (love burgers and beer but not everyday) Mandy's has been a Montreal original staple for years. First in Westmount and Outremont and now here!!The new location is beautiful and the salads are amazing. The Asian Salad and the Wolfe bowl are my two top picks. Mind you they are featuring a Lobster salad this month...
/user_details?userid=Pg167WgHwXcAIWAILD8p2Q,Meghan S.,"Montreal, Canada",5 star rating,"Can't get enough of this place! Their menu of salads is amazing, but you can also order a custom salad with any assortment of toppings, types of lettuce, and dressings. It's definitely on the expensive side for a salad (between $13 and $15 depending on the number of toppings), but definitely worth it given the freshness of the ingredients. Try to eat there if you can rather than taking a salad to go - the salad tastes way better in the big ceramic bowls!"
/user_details?userid=1Nkuhh-HOUB7XUfgImWxmw,Valentina D.,"Montreal, Canada",4 star rating,A little pricy but sooo good!Salads are generous portions made with fresh ingredients and very tasty vinaigrette and between their interesting pre-made salads and their fully customizable options the choice is endless!
/user_details?userid=h1ad1YCNLFxe_sRejKABoQ,Efraim R.,"Toronto, Canada",5 star rating,"Fabulous, fresh ingredients (I had the Habibi Salad). Super tasty and they do not skimp on the ingredients. The salads are large portions. Can't wait to go back. Would love to see Mandy's in Toronto."
/user_details?userid=6YPfM_xcWZM4GjBvGvL8Mg,Alfonse D.,"Montreal, Canada",1 star rating,"Total chaos !! Don't waste your time or energy .It doesn't worth it !! No manger in the branch !!This place was great when it was in Sherbrooke but I guess they will only go down from here as if they don't respect their customers and  don't care about their satisfaction and take it for granted.That's the first step downhill .Was a fan, not anymore ."
/user_details?userid=K95X5oE2-fuDZHhzFOfPUw,Meghan L.,"Montreal, Canada",4 star rating,"I've only been here once but I was very happy with my salad. You start off with a long list of items and you basically build your own salad by ticking the square boxes coinciding with what you want. I ordered a salad with romaine lettuce, black bean, blue cheese, walnut and avocado  with a cilantro-cumin vinaigrette. It came in a gigantic bowl and was absolutely delicious. I also ordered a small thai soup which I immediately regretted. First of all because the salad was enough food on it's own and second of all because the soup was just terrible. It was watery, salty and the vegetables were bland. Also, I don't love the atmosphere. The decor is generally tasteful but the tables and seats are arranged cafeteria style which for me isn't ideal. You might be forced to sit next to a stranger, which I don't really like. My friend and I grabbed one of the only couch/table scenario but we had to lean way over to talk because it was a little loud and the couches are far apart. I'm giving it 4 stars because I think if you ordered your own personalized salad to go and avoided the thai soup, you'd probably be very satisfied. It's always nice to have healthy meal options downtown Montreal."
/user_details?userid=FKRtOAneg5kDTL34KaaV0g,Mark M.,"Rapid City, SD",5 star rating,So  I'd suggest sticking with the menu. Protein is not worth the extra $$$ but the quality of greens and such is amaze
/user_details?userid=VdX18Gw0CduhVBFSS4zwGA,Mahin J.,"Boston, MA",4 star rating,"I've spent quite a bit of time in Montreal recently, so I've been to Mandy's for lunch. Though it's pricey, it's the best place in the city to get a healthy meal. I've never ordered a menu item, but it all looks great! I enjoy customising my salads. Sometimes the staff messes up my order (lettuce instead of kale :() but they're always welcoming. The complimentary sparkling water is a treat too. I would highly recommend Mandy's to anyone looking for a healthy and tasty lunch around Concordia."
/user_details?userid=gcJ5T8Nr17T6wNCzcMvI8w,Elly L.,"El Cerrito, CA",5 star rating,"Delicious salads!!! Really fast also, and they have a great variety of choices. When it's warm they have a really cute outdoor patio as well. One of my favorite restaurants in Montreal. 10/10 recommend!"
/user_details?userid=qebGY1oc1AdhVLz9mMF1yg,Mark V.,"Ottawa, Canada",2 star rating,"It was OK, but not amazing. I won't be rushing back next time I'm in Montreal. It seems overpriced for what it is. The Curry Quinoa salad was pretty bland. Maybe they were just having an off day but I was disappointed."
/user_details?userid=bvuxor346zDAen3poNl9qA,Kate F.,"Fort Mitchell, KY",5 star rating,"What a delightful place. Order your own salad (you chose the toppings) with a ton of choices In lettuces, meats, cheeses and veggies.  The ingredients were very fresh. My only complaint is that there isn't enough seating. If you go during lunch hour-Prepare to get it to go."
/user_details?userid=BytRWk8X1OelSgwwfXd8Aw,Arun D.,"London, United Kingdom",5 star rating,Amazing place for lunch.The salads are delicious and the portion sizing is huge! Good thing it's a salad so there is no harm in actually finishing what you get! I've had the Tokyo and the Mexican - both were really incredible. They have a  really great selection of drinks - my recommendation would be Fentiman's Rose Lemonade. If you're feeling sinful end the meal with their scrumptious chocolate chip cookies. You deserve a cookie after the healthy salad you just ate. Warning: it was pretty crowded during lunch time so I would budget your time accordingly! Maybe go a little earlier or later so you can nab a good spot on their terrace!
/user_details?userid=Nyhnfs2oxwsgjuVdg7W_Og,jamie c.,"Weston, FL",5 star rating,"Great find for delicious, fresh, huge salad. There are a variety of salads on the menu or design your own with tons of ingredients to choose from.  Bright, cheerful atmosphere and friendly, helpful staff. Only one suggestion, add fresh baked bread choices."
/user_details?userid=i9tlSIwwap5NqrSbNbGW7g,Mn S.,"Montreal, Canada",5 star rating,"Before I tried this one, I was like, people are acting too much, salads taste same but the second I put Wolfe Bol I'm impressed!! It tastes so good!!"
/user_details?userid=FTsYsxk0-vsSk4uil1VD5g,Feifei L.,"Chicago, IL",5 star rating,"You can either make your own salads or choose from one of a dozen salads on the menu. Mandy's lets you choose how much dressing you want as well, from well dressed to slightly dressed, or even naked if you don't want any I suppose. Very fresh ingredients, very generous portions, taste is awesome too. Will definitely be back for more as this place is close to work."
