user_url,user_name,user_city,user_rating,user_review
/user_details?userid=MWCPUFk-fnNXehPosCtwHA,Geneviève F.,"Montreal, Canada",5 star rating,"Mandy's is one of my favourite places to get delivery from. Healthy, fresh, tasty! My favourite salads are the Wolfe (+ goat cheese, + egg, + red oignons) and the Cobb (+ goat cheese, - bacon, + quinoa). I usually swap the vinaigrettes for the balsamic one, as it if my favourite. They never got my custom additions/ removals/ vinaigrette swaps wrong, so I'm a big fan. Hope you enjoy it as much as I do!"
/user_details?userid=1aRXamL4PHcLKDfz21MBQw,Nas M.,"Ahuntsic-Cartierville, Montreal, Canada",5 star rating,"I had to drive to few different locations because of COVID the hours were not updated. When I got to this location I advised the cashier. She apologized I told her it's okay I know the situation we are in I'm just advising you so you guys can update the hours. She was so nice and friendly in 2 minutes my salad was ready she came around to give me my salad with a free cookie, I wasn't expecting but that showed me how much they care about their customers.THANK YOU"
/user_details?userid=KBoIRjxSW7OWczv8OS9Bew,Xue L.,"Verdun, Montreal, Canada",4 star rating,"Love their online ordering service during the pandemic. You can order everything ahead on their website and then they will tell you when to pick it up. My salad was fresh and tasted great, although it was a bit pricey. The service was fast and the staff was friendly even during these times. Would definitely order again."
/user_details?userid=DsRVytxsQl0bj1il7WsgAg,Michelle C.,"Old Toronto, Toronto, Canada",5 star rating,"A small cafe like restaurant with shared tables. Super cozy and has a warm decor. It's definitely a place to go to when you're in Montreal (especially if you're craving a salad). There were many classic and signature salads to choose from and all of them are amazing. I got the Cobb Salad and it was super fresh and flavourful. The portion was large as well and filling. The salad is on the pricey side but worth it to try. Next time I go, I want to try the Asian Salad!"
/user_details?userid=o_IEnOVNuir0QNVkANzyXQ,Esteban Y.,"Montreal, Canada",4 star rating,"Excellent place, good vegan options. I usually take the hippie bowl, I love the texture of their tofu. The lentil peanut soup is amazing as well."
/user_details?userid=yphnJ8zYbJF7Y3QbtMj91g,Shahanaz B.,"Southwest, Montreal, Canada",4 star rating,"Beautiful, summer looking restaurant! White walls! Plants and flowers all around. Mandy's is known for their salad. My sister and I went there for lunch. There are two line ups. 1) order your dish, pay and take your number to your table, food will arrive when ready; 2) you can order by telephone, and pick and pay at this line. We got the The Santorini Salad and the ""Fave"" Salad. Both were absolutely delicious! The service is good. The place is beautiful.The food is super succulent.Price is super high; and it's painful.Still highly recommended!"
/user_details?userid=rsnoCyL7IrF_mVC4xAqfWw,Nicky D.,"Maple, Vaughan, Canada",4 star rating,"If you love salads then definitely have to check this place out. This place has a bunch of cool gourmet salad options. I tried one of the signature salads. You have the option to create your own. I ordered the mexi salad. It had romaine lecture, avocado, cilantro , black beans , cheddar cheese and tortilla chips in it. The chips gave the salad a nice crunchy taste. The salad was really flavourful. The portion was big. I'm not a big salad person but I really enjoyed this one. The inside of the restaurant is pretty small but very cute. Loved the dishes the salads were served in. Each table had a few sauces that you could add to your salads if you wanna wanted to make it spicy. Would definitely try this place again next time I go to Montreal."
/user_details?userid=HpzMECWPO4H1fJihiMG1Pg,Lanyi L.,"Markham, Canada",4 star rating,"Some people think it's ridiculous to pay $17 for a salad but they say that because they've never tried Mandy's! It's surprisingly an extremely filling (and, of course, healthy) meal. Usually I can't finish the entire salad and will have to take it home for eating later (it gets a little soggy, but still delicious). There are so many great options here and you can even customize your own salad. I myself always order a pre-made salad. My favourite dressing is the tamari dressing. I usually get the Tokyo bowl or whatever the monthly bowl is when I want to try something new. You can also order salads/bowls with different dressings, so I also like having the hippie bowl with tamari dressing. Service at this location is very friendly. I will be back again!"
/user_details?userid=0LJqfXPuK13iKd1YxEUqXA,Marie-France A.,"Montreal, Canada",5 star rating,"My favourite salad & soup place. Overload of freshness, don't even care to do my own salads anymore, they just make it better. Healthy fast food, so blessed to finally have them close to home.  They always manage to have those little ingredients that totally makes it pop. Love the reusable containers, even get a 1$ rebate each time you use them. My favourites: The Farro and the Habibi salads as well as the Bubble Soup miam"
/user_details?userid=aHkn3tnOEyA1grHpcDZEew,Sharon L.,"Toronto, Canada",4 star rating,"I was pretty surprised with the salad I ordered today. It was actually delicious. The salad was simple, fresh and it was a healthy alternative. It's great if you are vegan, on a diet or eat healthy. The price is very good considering the huge portion that we get. I wouldn't eat this for dinner, but it's a perfect size for a lunch.My sister ordered Asian salad and I took the Tokyo salad. Both were vegetarian and it were tasty, fresh and delicious. I would go back again."
/user_details?userid=4ayVX0YKY3GSP2IICpLJXQ,Priscilla Y.,"Vancouver, Canada",5 star rating,"Make your own salads, nothing better! I got the ""belle salad"" and it came with greens, pear, avocado and carrots with added chicken. It was deliciously tasty with the asian sesame sauce served on the side and perfect after a vacation already filled with decadent meals.Overall, from a range of well crafted and theme inspired salads to customizing from the very start, a perfect place to get a light but hearty meal that satisfies any type of salad craving."
/user_details?userid=KBHTIaz-OdXukREefkP4qg,Gabrielle L.,"Montreal, Canada",1 star rating,"I'm gonna start off by saying that I love Mandy's. I usually order from the one on Sherbrooke street west since it's close to my home and I sometimes go to the one in Phillip's square. This location however is just TERRIBLE! I've never had such bad service! I went for a TED talk at Concordia and we were not allowed to eat in the auditorium. We were given 45 min to eat lunch. So I walked on over to Mandy's which was close by and ordered my favorite salad which is the Wolfe with tofu and replaced the quinoa with lentils. I waited over 20 min for my salad and I could see that everyone who came after me got their orders. So I enquired and they said it was coming so I kept waiting. They didn't tell me anything else but clearly there was a mixup. It seems they gave my salad to someone else who didn't want it so the person sent it back. Meanwhile they had to remake my order. Finally they give me a salad and the waitress said she slipped in a chocolate chip cookie to apologize for the mixup. I walked over to Concordia now having only 15 min to eat when I realize that they made the Wolfe salad the way they normally make it which means with quinoa! Because I'm allergic to quinoa I couldn't eat the salad! I called the restaurant and they said they would give me a credit and took down my phone number. I ended up giving my salad away to a volunteer working at the Ted talk since I couldn't eat it and didn't want a salad to go to waste. I couldn't go back to Mandy's right away because I was pressed for time so I wasn't able to eat lunch. I was hangry! Luckily, I brought snacks with me and bought mid-day squares from Mandy's. Mid-day squares are really good by the way. It's healthy and actually tastes good! I also ate the cookie which was good but a bit too sweet for my liking. Anyways after the Ted talk I ordered my salad and told them about the credit and the girl at the cash had the nerve to tell me that I should have told them that I was allergic for next time! Does that mean they would be more careful if I had told them I was allergic?? First of all it doesn't matter if I'm allergic or not. I wanted lentils and they messed up my order! And instead of just apologizing for it they made me feel like it was my fault! I'm never going back there."
/user_details?userid=qZn4-4_ApTfiJHRTSwJAlQ,Sylvain P.,"Victoria, Canada",3 star rating,Nice decorations in this salad restaurants chain with 5 locations in Montreal. Good thing is it was founded in Montreal in 2004.I think these kind of restaurant is more a girly thing cause i always think of salads as a side not a main menu. But my girlfriend and her 2 daughters like it. As a man i prefer vegetarian restaurant over salad restaurant were you always think there's something missing when you're done. I have to say it's very fresh but like tartar it has to be fresh or you didn't eat it.I also think it's a bit expensive 20$ for a salad and drink. So next time I'll passed my turn.
/user_details?userid=Gmm7aWeQrwpQbxpLf-3GyQ,Judy S.,"Houston, TX",5 star rating,"Hands down, Mandy's serves the best gourmet salads that I have ever had.  We ordered the Seared Tuna Salad and the Lumberjack. Each was so different and full of flavor. Salads are not cheap but you definitely will get a nice large portion. The seared tuna had wasabi ginger dressingmixed greens, arugula, kale, avocado, cucumber, edamame, super slaw, apples, tempura onions, toasted sesame seeds & spicy togarashi seared tuna. The lumberjack came with caesar dressingromaine lettuce, cherry tomatoes, avocado, mushrooms, green onions, baked pita chips, mozzarella, bacon, deli turkey & chicken. This restaurant is worth a visit or two."
/user_details?userid=8HafK5cS8pWCWNQTIG8iJw,Uyen D.,"Montreal, Canada",2 star rating,"This is the closest Mandy's location to my place but I am not going to come here anymore. The Westmount location is a million times better. My order isn't complicated- I always get the Wolfe salad. But they somehow always manage to butcher my order. They either forget to add the Parmesan or the dressing is way too light. For $15 a salad I really expect more. Also, the lattes are a joke. Once I ordered the turmeric latte and the milk was not even lukewarm. Either go to another location or give Foodchain a try."
/user_details?userid=jXdnU8ONRIHVzhmDBvlmOQ,Ali A.,"Downtown, Canada",5 star rating,"It's been a while I wanted to try Mandy's, it occurred to be the day today!Loved the wild sage it was plenty and delicious. What you pay for here though, is a good feeling to eat healthy!A bit over priced but I would come once a month or so. Staff are helpful and polite and the ambiance is great!"
/user_details?userid=aVM0g6AoZv0qfrIlJaO-8A,Brianna B.,"Fishers, IN",5 star rating,"This place takes salads to another level, that's for sure! Huge portions and great for lunch, very filling. Super cute and inviting inside with great attention to detail. Very warm and cozy...Great spot for a lunch date....Perfect for gluten free/ vegetarian crowd as well as many options for meat lovers!"
/user_details?userid=AnOkDeIQdWEgN-SPDa7bng,Robyn O.,"Montreal, Canada",2 star rating,"So today I ordered Mandy's to my office, through Foodora. I specified that I wanted 1/2 kale and 1/2 greens. I also specified that I wanted it premixed. Both were not done when the salad arrived. I then tried to call Mandy's on crescent but got the voicemail every time. The voicemail then said that it was full. Pretty brutal service."
/user_details?userid=iQBe5Ngbl84EMpWdOcZa0Q,Alex W.,"Madrid, Spain",4 star rating,I love Mandys. I come often for a quick convenient meal or to buy dressings for at home. I love to make my own but be careful!!! I have had my protein forgotten recently and ingredients forgotten when they dont repeat them to you.
/user_details?userid=ex5IwcRb2fLWGXFFGzIYGA,Edmary S.,"Totowa, NJ",5 star rating,"This was my favorite spot in Montreal when I was there on vacation! Fresh salads, tons of options for everyone, and delicious. They have yummy treats and superfood drinks. The place is super cute inside and plates are adorable."
/user_details?userid=WMK1j18ACm-EtopEznV4Rg,Jana T.,"Westmount, Canada",3 star rating,"This downtown Mandy's is always super busy and sometimes it's hard to find a seat at peak times. For some reason, their salads aren't as good as the ones at their Westmount location even though it's the same menu.  Still a decent bet to grab a healthy lunch if you're downtown but not my favourite Mandy's location.  Decor is nice and service is usually quick and friendly."
/user_details?userid=hG0FxhGxIz5mv1ezaKcQiw,Sam P.,"Montreal, Canada",4 star rating,"Though I am physically pained by the fact that I just spent $20.09 on a salad, I have to admit that it was pretty damn amazing! Picking up fast food/take out from the usual places is cheap, but deeply unsatisfying. Sometimes you're just craving a healthy and delicious salad. Mandy's definitely satisfies in that department.I've eaten in at this location once but mostly take out. The staff are friendly and although it is always busy, they are really efficient. So far, I've made a few ""design your own"" salads and  tried the Wolfe Bowl and the Reagan-Danielle Extraordinaire. I added mock chicken to both those salads for some extra substance. Though the ""chicken"" is tasty and filling, I'm not sure that it is worth an extra $5. Both salads were delicious and made with fresh ingredients. The portions are huge and filled with ingredients (they don't just try to fill it with lettuce to reduce cost). I think Montreal needs more restaurants like this. Possibly when there is competition, they will lower the somewhat ridiculous prices. Overall, the salads are delicious, the price is insane but even so, I'll continue to buy them on special occasions/once a week!Food: 5/5Value:3/5Ambiance: 3/5 (It gets pretty busy)Service 5/5"
/user_details?userid=iFbgPR9AMci9Sg2dDsNPGw,Stanley D.,"Montreal, Canada",3 star rating,"Famous Mandy's salad that I had to try. Being not a big fan of salad to begin with, I was not impressed after going to this restaurant. However, I would understand why someone would be pleased with this place.I went there for dinner. The environment of the restaurant was nice, with great hipster decors. The way you order you food is you go to the counter and choose your salad, then sit down and someone will come serve you your meal. As for the food itself, I usually find salads more a chore to eat than anything else. I just feel I spend more energy chewing the salad than the nutritional gain that I get from it. This salad was no different. The flavors of the salad itself were more or less enjoyable. I found by half the bowl, I got very bored of eating it.Overall, although I find the appeal of salads as a healthy alternative for meals, Mandy's has not changed my opinion on salads."
/user_details?userid=YDrRThaGP3Otqxf16zbyag,Maria D.,"Montreal, Canada",1 star rating,"While the salads are a good overall a good size, taste is great, and decor is lovely.... the value for money is TERRIBLE. TINY/barely detectable portions of added custom ingredients, and in some cases paid ingredients are completely missing!   Only about 2 oz. of chicken per portion as well. For a $20 after tax, it is just not justifiable.  What i received was only worth $10. Salad Guru @ Alexis Nihon is a better value."
/user_details?userid=EepVyGQFBKjuJw1dorttyw,Madeline C.,"Montreal, Canada",5 star rating,"I find that Montreal is lacking in the salad/health restaurant department, so if you want a healthy yet satisfying meal, Mandy's is the place to fill that void. The lack of competition probably explains the somewhat outrageous prices, which is my only drawback. That being said, service is friendly and the atmosphere is incredibly welcoming. The outdoor seating area is also a huge bonus.I'd recommend it if you are willing to splurge a little for a healthful meal experience."
/user_details?userid=x2rtzRsNrJtnKLwUa9dp1g,Mary H.,"Lachine, Canada",4 star rating,The salads are very good. The ingredients used are fresh and the vinegrette is delicious.The portions are quite big and your definitely don't feel hunger after even if you didn't take any proteins with it.The wait can be a bit long during lunch hour.
/user_details?userid=3vGiPNH4yCAj88-kfdvbjw,Noha G.,"Montreal, Canada",4 star rating,"Best salad ever at an insane price. That's basically the summary of Mandys.We came here for a quick lunch, and took forever to order because there were SO many options to pick from. We ordered the Fave salad, the Miso rice bowl, and the banana-nutella smoothie to share, and were ASTOUNDED by the $45 bill (tax/tip in). That being said, everything was super delicious, and portion sizes were very generous.Would I come back? Maybe...but the prices are a little bit of a turn off to be honest. Overall, great food and great service but crazy prices for what you get!"
/user_details?userid=Gnkq84PL6E5dYdhJvruAAw,Roxane A.,"Côte-Des-Neiges—Notre-Dame-De-Grâce, Montreal, Canada",4 star rating,"Where your salad dreams come true! Whether you want to be healthy for a week or you want to enjoy a filling salad in a cute plate, Mandy's has a salad for every taste! I especially like their asian salad with crunchy ramen noodles, or the mexican salad as a healthy alternative to tortillas and dips. The restaurant itself is very pretty and hip, and the terrasse is lovely. However, the service can be a little slow for a place that specializes in salads. All in all, great healthy salads!"
/user_details?userid=nLvssaSephFYKHVjMd0XFg,Benjamin C.,"Brooklyn, NY",5 star rating,"Looking to recharge with some greens, my wife located Mandy's courtesy of Yelp. We tried two to share, the Wild Sage and the Asian. The Wild Sage is outstanding. Gave us some good ideas for future salads. The Asian is also very good, but more inline with other Asian salads we have had. Both salads had little items about them that made the salad more interesting - fried onion in Wild Sage and crumbled, dry ramen in the Asian. Good selection of tasty beverages to accompany the salads. We were there during rain, so unused outdoor seating made it a little crazy inside. And as others have mentioned, it can be a little pricey. But when you are on a weekend of eating heavy food, the cleansing aspect may be worth the money."
/user_details?userid=yIFyaNq4oCLoYkY1Gi0XAw,Corey D.,"Brossard, Canada",5 star rating,"Nothing much was open on Good Friday and ended up here. I thought to myself just another salad place. Holy shit was I wrong. This was the best and freshest salad I've ever had.  Roasted walnuts dipped in maple syrup, apples, ham, dried cranberries. What a combo. Tried the salmon salad as well. Fresh dill, asparagus, pine nuts, quinoa.... Wow!  Now I know why there was a line up out the door. Very busy for take out. 2 big community tables. Friendly staff. I'll be back! Bravo Mandy's, you brought salad to the next level."
/user_details?userid=oKaHY42t2hWxKLZg5PQv2Q,Madeline K.,"New Windsor, NY",4 star rating,"Let me start off by saying, I love Mandy's. But for anyone that is new to this lunch spot, there are few things I would recommend. 1- Do not go during the hours of 11:30 am and 3:00 pm. 2- If you do go during those hours, be prepared to wait on line, EVEN if you ordered ahead. 3- Good Luck finding any tables 4- Be very clear with your order or you will get things you didn't ask for. I am very fond of their mock chicken, I think it's a great option for anyone looking for something delicious. If you can, try to eat the salad at the restaurant because you will definitely get less when you take out. Finally, the cost value. If you are looking to customize your salad, you may end up paying about $25 CAD or more. It is crazy expensive for add ons."
/user_details?userid=4LUG6dffnqgGxE6HxJ0wOw,Tammy M.,"Montreal, Canada",5 star rating,"Congrats Mandys!Very smart, groovy, busy business.  Salad done like never seen before. The 95%, mostly 20 something, estrogen-power packed house gathered in front of large bowls of greens plus. With boxes of water! A couple fellas joining. One adult fella sat at a communal table with red meat tossed on his greens and a steamy bowl of soup. Salad that knows its worth. Not cheap: portions, nor price. Lots of choice. Create your own. Filtered H2O. Product. Clean. Lovingly designed. Just smart. Healthy. Awesome."
/user_details?userid=cY6BAJqLWRpUosCOsMvJLw,Iain M.,"Vancouver, Canada",5 star rating,"Loved this place! Stopped in after walking all over Montreal for a light dinner. My daughter ordered a custom salad with a pencil and notepad of checkboxes and I had he couscous pesto bowl salad with grilled chicken - both of which were amazingly tasty and fresh. I wish we had something like this in Vancouver. Flavoured waters, juices, coffee. Nothing fancy but fun, young, eclectic and authentic. Rue Crescent is super hipster with great shops bars and restaurants in beautiful old houses - and Leonard Cohen looks out over all of it!"
/user_details?userid=oiedlfqLMq5cFY_ov9eTZA,Jose T.,"College Point, NY",5 star rating,"Delicious healthy salads. Different choices and they are all good. Went there on a Sunday lunch time and sat outside enjoyed the view, the weather and of course the food."
/user_details?userid=usmsSJrebd2iP4FpTsrr5w,Hanna H.,"San Francisco, CA",5 star rating,"This place is so good! Super yummy salads and a really wide selection, plus they offer a make-your-own salad option so there really is something for everyone. (I highly recommend the Wolfe salad- definitely my personal favorite). The atmosphere is also really cute and eclectic. The only downsides are that it is a bit pricey, and the seating is first-come first-serve so there's no guarantee you can find a spot (esp. when it's busy). Otherwise, it's an awesome spot and I'd recommend it to anyone looking for a yummy salad place!"
/user_details?userid=LY-KaOJyXzbwZyqjQfl7xA,Álex G.,"Chicago, IL",5 star rating,i do not care what anyone has to say- the hippie bowl with quinoa is the ultimate salad/grain bowl and i'll pay $12 for a salad if i want to!!! its my life. the cookies are crazy soft and delicious. the lemonade is TIGHT on a summer's day. for the hippie bowl:the tofu is sometimes overcooked/hard but only one out if every five times - still good!! the tamari dressing is iconic. could use more kale? i do not like it when i have to mix my own salad :( the atmosphere is cute.
/user_details?userid=c9xBCAAiE5v_2CVEA5YXQw,John S.,"NEPEAN, Canada",5 star rating,"Seeing a restaurant full of 20 something's eating $20 salads is quite strange. I'm not going to say where my $20 would have gone when I was that age but it wouldn't have been on salad.  Lol. That said, Mandy's really does make a great salad.   You can pick from a set list of salads or custom make your own.   I've had great results both ways."
/user_details?userid=C4-lJLlGABgAD5tdv7p7yw,Emma M.,"New York, NY",4 star rating,These salads are really huge! They are super tasty and the ingredients tasted really fresh. A little on the expensive side but you can ask them to pack your leftovers in a to go container which is nice. Definitely recommend stopping by if you're in the mood for something healthy!
/user_details?userid=hTZb1INhnCG8URaFywVoYQ,Alina M.,"Markham, Canada",4 star rating,"I'd really give it a 4.5 if that was a thing.I visited on a weekday peak lunchtime hours (between noon-1pm) and the place was packed - all the seats inside were taken, almost all the outside terrace/patio seats were filled and the line was super long. Surprisingly enough though, the line moved very quickly and I was able to place my order in a minute or 2. Since I can be a picky eater with raw ingredients, I decided to customize my salad with - romaine lettuce, organic greens, blue cheese, feta cheese, avocado, rice noodles, sunflower seeds, and edamame along with a green dressing, which came to $12.49 +tax. The girl taking my order was very helpful and gave me 3 samples of dressings to try, since I had no idea what any of them tasted like, so if you're picky about your dressing and would like to try them out, they give you a small piece of lettuce with the dressing to taste and test out.Even though the restaurant was incredibly busy, there were constantly salads in large ceramic bowls being brought out and I go my take-out salad too within 10 minutes. This place is pretty dog-friendly too, as I saw a customer bring her dog in as she placed her order. On the side, in a fridge beside the cashier/counter there are bowls of some of the premixed salads, fresh juices, and small mini salads. They also sell smoothies and some sweets (cookies, brownies, etc.) on the side. I feel like the salads in the bowls are a little bigger than the take-out container ones, but even so, the take-out container ones are very large and filling, even mine without any protein. I did find that the majority of my avocado was at the top and all the edamame was the bottom, so it would have been nice if the salad was a little better mixed. There was also a bit too much dressing for my taste, so you can request for lights/less dressing when you order as well."
